sent_id,left_context,pivot,right_context
12142,Sur la couche originelle (Préhistoire: Lascaux et Altamira ) vinrent se poser bien des peuples en migration dont les Celtes nous sont les mieux ,connus,.
12148,L'Union européenne sera représentée mais je ne m'y ,rendrai," pas personnellement,"""" a déclaré le commissaire au sujet de cette réunion qui se tient du 20 au 22 septembre à Canberra."
12163,"Son parti, le VVD, semble pourtant à la traîne, les sondage ne lui ",prédisant," que 22 sièges, contre 28 aux dernières législatives."
12165,Veuillez remplir les cases suivantes pour nous ,permettre, de prendre contact avec vous :
12180,L'immunité dont il ,bénéficie, en tant qu'ancien président doit être levée pour chaque dossier dans lequel son nom apparaît.
12211,Reste à savoir quelles pourraient être les applications disponibles pour rendre cette plateforme intéressante pour le grand public à une époque où le réalité augmentée ,commence, déjà à faire des émules dans le monde de la navigation GPS.
12227,Si on en ,restait," là, l'histoire serait simplement embarrassante pour l'un des plus puissants patrons du sport mondial."
12234,Le codage assez complet des formes verbales (cf. b) permet d'en ,obtenir, rapidement le premier noyau.
12266,"La liberté reste maîtresse, si elle ne consent pas à ces [487] désirs déréglés; elle n'est jamais blessée, parce que le péché est seulement dans la volonté; et cette grâce, Dieu nous l'a ",donnée, par bonté et non par obligation.
12270,Mais que ,font," les dirigeants du mouvement ouvrier, à commencer par ceux de la CGT, de FO et de la FSU?"
12278,"Ce résultat élevé est en baisse de 52% par rapport au 1er semestre 2007, où les cours du nickel avaient ",atteint, des niveaux exceptionnels.
12288,C'est à ce moment précis que Malick Ngom m',envoie, un violent coup de poing » soutient Mafodji.
12316,"Il avait connu la gloire dès son premier rôle en 1947 dans le film """"Le carrefour de la mort"""" où il ",incarnait, un tueur psychopathe.
12323,La Sarthe en ,possède, également des spécimens intéressants.
12336,"Quant à supprimer les """"inutiles"""", on n'en ",prend," pas vraiment le chemin, l'euthanasie reste un sujet tabou chez nous..."
12340,"Moi, je te vous lui aurais ",coupé, la margoulette en quatre pour commencer !
12347,"J'avais alors dit que c'était un mauvais choix, compte tenu de sa non-compétence en matière de football, et du fait que d'ailleurs les dirigeants de Lille lui avaient ",demandé, de partir au bout d'un an de présidence.
12356,"Sans aucun doute», lui ",répond, en écho José Mourinho.
12369,Elles nous ,rendent," nos chers contemporains drôles, touchants, et dérisoires à la fois."
12378,"On risque de me taxer de mauvaise foi, genre """"ha vous avez ",vu," un motard sur la photo et donc vous avez contesté"""" alors que si je parle du motard avant d'avoir vu la photo, c'est plus convainquant!"
12392,"Lost a bénéficié d'un public fidèle, autour de 18 millions d'amateurs chaque semaine, et a généré un imposant trafic sur Internet, ainsi qu'une forte attente dans les pays où sa diffusion était ",annoncée,.
12406,"Si cette dernière est axée sur un objectif très précis, par exemple une situation d'urgence dans un pays bien déterminé, les fonds doivent lui être ",affectés,.
12433,La ministre de l'Éducation Michèle Courchesne compte quant à elle envoyer des lettres aux écoles pour leur ,demander, de rester vigilants face aux groupes qui se proposent pour dispenser des conférences et ateliers dans leur institution.
12433,La ministre de l'Éducation Michèle Courchesne compte quant à elle ,envoyer, des lettres aux écoles pour leur demander de rester vigilants face aux groupes qui se proposent pour dispenser des conférences et ateliers dans leur institution.
12438,"Avec le Mali, le Niger, la République Centrafricaine et les Comores : missions d'enseignement et de recherche auxquelles s'",ajoutent, un soutien en matériel d'enseignement et de travaux pratiques et la fourniture de documentation.
12449,"Au terme de ses travaux -trois années au total-, Mathieu Pernot a saisi """"une dernière photographie des survivants, pour qu'enfin resurgisse l'image du camp et des gens qui y ",vécurent,", rapportent-ils."
12461,"Le monastère était en effet situé à l'extrémité de l'aqueduc approvisionnant la ville, qu'il contrôlait, et des citernes y sont encore ",préservées,.
12479,"En étant titulaire les trois années passées là-bas, il y ",inscrit," 2182 points pour une moyenne de 24,5 points marqués par match."
12498,"Aucun accident n'a été signalé, selon la préfecture où une cellule de veille a été ",installée,.
12531,"Le poste de commandement nous a permis de rencontrer quelques dizaines de personnes du secteur, qui nous ont fourni des informations permettant d'ouvrir de nouvelles pistes, et d'en ",fermer, d'autres.
12531,"Le poste de commandement nous a permis de rencontrer quelques dizaines de personnes du secteur, qui nous ont ",fourni," des informations permettant d'ouvrir de nouvelles pistes, et d'en fermer d'autres."
12531,Le poste de commandement nous a ,permis," de rencontrer quelques dizaines de personnes du secteur, qui nous ont fourni des informations permettant d'ouvrir de nouvelles pistes, et d'en fermer d'autres."
12534,On y ,retrouve, des jeunes qui ont des profils scolaires et académiques extrêmement différents.
12545,"Il est conseiller communal de 1972 à 1983, député suppléant, puis titulaire au Grand Conseil du canton du Valais de 1969 à 1984, où il ",préside, le groupe parlementaire PDC du Haut-Valais.
12594,L'ADISQ vient de lui ,rendre, hommage à son plus récent gala.
12603,"Complètement affolé, vous vous précipitez dans la rue et constatez que tout le monde vous ",reconnaît,.
12603,"Complètement affolé, vous vous ",précipitez, dans la rue et constatez que tout le monde vous reconnaît.
12620,"Auteur d'une double contestation, Febvay ",recevait, un carton rouge (79e).
12662,"Ceci dit, je me ",pose," une question, si le vote sur la prise de décision dit blanc et que nous, nous disons noir, que va-t-il se passer?"
12673,"D'autres, avaient prévus des satelites allaient tomber et détruire Paris On est pas à l'abri de tout, c'est évident, mais de là à toujours s'attendre au pire, surtout lorsqu'on y ",connait, rien...
12679,Dingane donna alors l'ordre d'attaquer les campements boers de la région et de massacrer tous ceux qui s'y ,trouverait,.
12708,Elle m'a ,donnée, des rôles très forts.
12736,"Au cours des derniers mois, les locataires de l'immeuble ont formé une coalition afin de dénicher les appuis nécessaires lui ",permettant, de retirer l'immeuble du marché.
12740,Le Banco de Chile avait payé l'amende sans reconnaître ni démentir ce qui lui était ,reproché,.
12767,Et le 17 mars l'artiste revient y ,lancer," sa tournée en province et étrenner par la même occasion cette salle, 14e du nom."
12807,George Michael y ,chantera," trois chansons Village Ghettoland de Stevie Wonder, If You Were My Woman, et Sexual Healing de Marvin Gaye."
12856,"Il est probable qu'aucun nouveau terme n'ait été forgé outre ceux-là, pour la raison que les scientifiques en ont abandonné l'usage avant d'avoir le temps d'en ",créer, d'autres.
12856,"Il est probable qu'aucun nouveau terme n'ait été forgé outre ceux-là, pour la raison que les scientifiques en ont ",abandonné, l'usage avant d'avoir le temps d'en créer d'autres.
12877,"Elle ressasse sa vie bafouée et, c'est avec des hauts le c&#156;ur que l'on subit les innombrables détails sordides de ce récit où sans cesse ",revient, l'appel à la mère décédée alors que la fillette n'avait que 7 ans.
12878,"Quand il referme la gueule sur sa proie, elle ne peut plus se ",dégager,.
12890,Elle a ainsi abaissé ses tarifs en début de mois et a entièrement rénové son système électronique pour y ,faciliter," des transactions ultrarapides, souvent aidées par des calculs algorithmiques."
12891,Vélodrome où seul Bordeaux est ,parvenu," à s'imposer, toutes compétitions confondues, pour le premier match de la saison."
12954,Chacune est faite en argent ce qui leur ,donne, une certaine beauté et valeur.
12970,"Et j'éprouve aussi souvent des moments de grand respect vis-à-vis un, de l'adversaire que nous devons éliminer aujourd'hui, et deux, des tâches qui m'",attendent, et qui attendent le club en cas d'éventuelle ascension.
12989,"Il ne s'agit pas de le reprendre ici, d'autant que les rapports pré-cités en ",font, l'analyse et en montrent l'inadaptation dans le contexte actuel d'indemnisation lié à l'essor de lassurance.
12991,"Ayez de bonnes mentions, je viens pour vous ",rappeler, que vous devez avoir de bons résultats.
13035,"Google a nié et même jugé bon de publier un communiqué après l'épisode: """"Nous sommes heureux d'annoncer que Kaiser a été repéré hier soir"""", y ",indique," simplement la responsable de la communication, apparemment le plus sérieusement du monde."
13113,La faiblesse de nos ventes d'infrastructures au cours du premier semestre fiscal nous avait ,conduits, à anticiper une performance en retrait.
13122,Sur cette page : Après nous avoir ,proposé," en fin de semaine dernière une vidéo ( Lost Planet Col Mots Clefs : actualité, informatique, news, info, exclusivité."
13137,Évidement cela est de nature à lui ,donner, encore plus confiance.
13141,"En mars 1976, l'obtention du statut consultatif auprès du Fonds des Nations unies pour l'Enfance (UNICEF) lui ",donnait," les moyens d'une interaction plus grande avec l'ONU dans les domaines de la santé, de l'éducation et du bien-être des enfants."
13142,"J'en ai gardé plusieurs anciens, et parfois je me ",replonge," dedans."""""
13142,J'en ai ,gardé," plusieurs anciens, et parfois je me replonge dedans."""""
13158,"La Chine sera invitée au sommet du G8 à Hokkaido au Japon début juillet, où le réchauffement de la planète ",figurera, en tête de l'ordre du jour.
13160,"Grâce à notre présence sur """"le terrain"""" nous suivons de près l'avancement des travaux de construction afin de respecter nos engagements et de vous ",garantir, la qualité de nos réalisations.
13161,"L'exécution d'un détenu d'une prison de Californie a été reportée, hier, après le refus de deux docteurs d'y ",participer,", pour des considérations éthiques."
13163,"Mais sa prestation au sol, peut-être plus artistique et moins acrobatique que celle de Cheng, ne lui a ",valu," que la deuxième place (15,550)."
13183,"Depuis le départ d'Israël, en août, et plus encore depuis le raz-de-marée électoral du Hamas, la semaine dernière, l'insécurité s'est accrue à Gaza, où plusieurs étrangers ont été ",enlevés, brièvement ces derniers mois.
13189,La reine Victoria y met un terme : le duc est éloigné de la capitale et Annie Crook est internée dans un asile d'aliénés après avoir subi une opération chirurgicale qui lui a fait ,perdre, une partie de ses facultés mentales.
13189,La reine Victoria y ,met, un terme : le duc est éloigné de la capitale et Annie Crook est internée dans un asile d'aliénés après avoir subi une opération chirurgicale qui lui a fait perdre une partie de ses facultés mentales.
13226,"La mauvaise fin est accessible après avoir traversé les 4 niveaux de départ, ce qui a fait ",dire, que le jeu était trop court.
13230,Il s'agit donc du PID du processus qui a créé le processus dont on ,parle,.
13254,"En effet, la complexité des organisations et de leur évolution nous amène à nous ",interroger," sur la validité des représentations tant au niveau de la formalisation, des modèles proposés et des statistiques utilisées."
13254,"En effet, la complexité des organisations et de leur évolution nous ",amène," à nous interroger sur la validité des représentations tant au niveau de la formalisation, des modèles proposés et des statistiques utilisées."
13277,Information-documentation : un documentaliste est à votre disposition pour vous ,aider," dans vos recherches, ( 05.49.60.68.68,"
13281,Ils prennent cependant le temps de nous faire ,parvenir, une série de six captures plus originales que de coutume.
13409,J'ai su d'abord que je figurais dans une présélection de vingt-sept joueurs puis on m'a ,confirmé, la semaine dernière que je figurais dans le groupe des vingt.
13431,"Sonic n'a à son actif que son spin dash, car Robotnik a remplacé secrètement par d'autres ses chaussures rouges qui lui ",permettent, de courir vite et de sauter.
13443,Il nous ,propose," une pérégrination romantique sur les traces de Byron et de Tolstoï- qui avaient décidé d'effectuer la même randonnée du lac Léman en 1857, en tenant chacun leur journal intime-, qui se place d'emblée dans une filiation exigeante."
13455,"Une victoire parisienne ne lui ferait certes gagner qu'un seul rang au classement, mais il lui ",permettrait," de compter cinq points d'avance sur le premier relégable, Troyes."
13455,Une victoire parisienne ne lui ,ferait," certes gagner qu'un seul rang au classement, mais il lui permettrait de compter cinq points d'avance sur le premier relégable, Troyes."
13456,"Simultanément, deux quotidiens de la République française nous ont ",appris, que les miracles n'étaient plus la propriété exclusive du petit Jésus.
13469,J'ignore d'où cela ,vient,", a dit Fahey à Reuters."
13470,Pour en ,savoir, plus sur notre environnement:
13491,Aussi devons-nous respecter la vérité et nous en ,préoccuper,.
13494,"L'autre pièce, où se ",trouve," un plan de travail avec une """"pile"""" et un foyer, était consacrée à la cuisine."
13519,Je n'ai trouvé de réponse à mes questions nulle part dans la FAQ alors je me ,tourne, vers vous.
13549,"Dmitri Medvedev, vainqueur de l'élection présidentielle russe, selon les premiers résultats, est apparu brièvement dimanche avec Vladimir Poutine sur la place Rouge, où il a ",promis," de """"maintenir le cap fixé par Vladimir Poutine""""."
13557,"Vers le milieu du XIIe siècle, l'ordre de Grandmont y établit un prieuré conventuel, dont hélas il ne ",reste, que des vestiges aujourd'hui.
13577,Un des agresseurs a ensuite été vu à Aleg au moment où les Français ,changeaient, de l'argent à un guichet.
13587,Envoyez un cavalier au nord et un autre au sud pour récupérer vos alliés puis commencez à vous ,développer,.
13604,"Au nord de Bordeaux, le long du fleuve, à hauteur de ce Bec d'Ambès où ",naît," la Gironde des épousailles de la Garonne et de la Dordogne, le terroir de Margaux est sans doute l'un des plus prestigieux de tout le Médoc."
13608,Le vétéran quart Danny McManus a rétréci l'avance des visiteurs à 23-14 à l'aide d'une passe de touché de 13 verges à Craig Yeast au moment où il ,restait, 3:04 à disputer.
13624,Cliquez sur la version qui correspond à votre lecteur de flux pour vous ,abonner, aux nouvelles publiées sur notre site.
13633,"Des manifestations ont aussi été organisées dans d'autres pays, notamment à Paris, où 1 300 personnes ont ",défilé," dans le quartier de Barbès-Rochechouart, à Madrid et à Ankara."
13653,Si la famille y ,vit," depuis au moins 6 mois, elle peut aussi sans attendre acheter le terrain à un prix relativement faible de 1,25 dollar par acre."
13657,"En effet, lorsque Askani emmène Nathan Christopher Summers dans le futur pour le sauver du technovirus qui le tue peu à peu, elle et son clan décident de cloner ce dernier au cas où il ",mourrait,.
13659,Il est bien loin le temps où la communauté financière s',attendait, d'un moment à l'autre à l'annonce du dépôt du groupe.
13694,Le dalaï lama lui a répondu lundi que «les gens n'y ,croyaient, pas même pas la population chinoise».
13694,Le dalaï lama lui a ,répondu, lundi que «les gens n'y croyaient pas même pas la population chinoise».
13708,"Blue Lagoon, kusadasi vous ",propose," l'achat et la réservation de séjours, circuits, vols, croisières, billets d'avion (vol sec, charter), weekend et plongée sous marine."
13729,"Etant donné que vous ne pouvez imprimer cette lettre type qu'à partir d'une fiche de visite, nous vous ",conseillons, de créer la visite dès que vous avez programmé un rendez vous et de saisir le champ commentaires une fois la visite effectuée.
13747,"Edith Head (28 octobre 1897 - 24 octobre 1981) était une costumière américaine, dont la longue carrière à Hollywood lui ",permit, de remporter plus d'Oscars que n'importe quelle autre femme dans l'histoire du cinéma.
13749,"Après deux heures, les quatre nageurs qui me devançaient se sont un peu échappés et, sur le coup, je ne me ",sentais, pas la force de les rattraper.
13763,"Selon le groupe Lagardère, l'avocat """"précise cependant que les sociétés du groupe Crédit Mutuel seraient prêtes à suspendre cette action au cas où Lagardère SCA ",estimerait," approprié d'ouvrir une négociation""""."
13783,Il nous ,faut, gagner le challenge de la responsabilité et de la maturité syndicales pour soutenir les actions de l'inspecteur général Modibo Sidibé.
13800,Les modalités en sont ,présentées, mardi matin à l'issue d'une ultime table ronde.
13801,Quand il voyait une chose qui lui ,plaisait,", il disait : """" Louange à Dieu dont seule la Grâce conduit toute chose à leur réalisation """"."
13808,"En fonction du déroulement de celle-ci, le Président peut en ",limiter, le nombre ou les rejeter si elles ne concernent pas les affaires du District.
13864,"Une typographie nette et l'utilisation de l'espace horizontal facilitent la compréhension de cette publicité, y compris pour ceux qui n'ont que quelques millièmes de seconde à lui ",consacrer,.
13874,"Je crois qu'un test à Spa a été annoncé, il s'agira certainement de l'évaluation finale avant qu'ils me ",disent," ce qu'ils comptent faire """" répond Bourdais."
13879,"Je suis donc venu à Paris, j'ai fait mon droit, j'ai été reçu avocat, et comme beaucoup de jeunes gens, j'ai mis mon diplôme dans ma poche et me suis ",laissé, aller un peu à la vie nonchalante de Paris.
13908,"Dégager les grandes masses d'un bilan, les gestionnaires vous le ",feront,.
13911,Elle était seule à bord et a été transportée au CHRTR où son décès n'a ,pu, qu'être constaté.
13916,"La justice, elle, peut les y ",autoriser, et vient de le faire pour la troisième fois.
13920,"Les débats sont en général placé dans leur contexte par Patrice Carmouze (le 'centreur de débat', qui lui aussi ",casse," sa fausse image d'amuseur), puis arbitré judicieusement par T.Ardisson."
13922,"Il s'agit non seulement de disposer de l'information sur le terrain, mais également d'en ",générer, et de la remonter vers un système d'information central.
13960,"A partir de cette date, les échanges de mails n'ont plus cessé jusqu'à ce que Marcelo lui ",propose," le mariage, via internet."
13982,"Il s'agit de Daniel Angleraud (1937-1993), qui vient juste de quitter son poste d'administrateur du CCAS de l'EDF, où il ",représente, la CGT.
14044,"Pour protester, tous ont ",décidé, d'entamer une gréve de la faim.
14045,Il en ,résulte, que les tonalités de Do majeur et de Sol sont particulièrement belles.
14073,Vous y ,découvrirez, notre sport ainsi que l'équipement nécessaire.
14083,Le docteur qui pourtant en a ,vu, d'autres est tout de même un peu choqué.
14086,"S'il y en a ici à qui je dois des excuses, ce sont tous les lecteurs, du BBB et du présent site, que mon incapacité à vous gérer contraint à vous ",subir,.
14086,"S'il y en a ici à qui je dois des excuses, ce sont tous les lecteurs, du BBB et du présent site, que mon incapacité à vous ",gérer, contraint à vous subir.
14093,"Envoyé par aicha1982 Bonjour, et avant tout je souhaite à tous les musulmns du monde entier untrés bon ramadan et que le bon dieu nous ",donne," chaque jours un peu plus la foie , la force et aussi la santé pour jeûne chaque année."
14116,"Ce sursaut a été accueilli avec peu de bienveillance par la FFSA, qui """"a pris acte de la démarche"""" dont elle n'avait pas été ",avertie,", mais n'a pas souhaité la commenter immédiatement."
14117,Cette réorganisation ferait également partie de la décision du Pentagone de regrouper ses forces en Europe et de réduire le nombre des installations dont il y ,dispose,.
14117,Cette réorganisation ferait également partie de la décision du Pentagone de regrouper ses forces en Europe et de réduire le nombre des installations dont il y ,dispose,.
14124,De nombreux joueurs qui ont participé à l'Euro ne sont pas au niveau physique où ils ,devraient, être.
14126,M. Jobs lui a ,dit, que le conseil avait donné son accord (...).
14138,"En 2006, il a voulu passer au-dessus de la Chambre en proposant cette série de référendums, et il en a été ",puni,.
14199,Ils en ,font, une question de principe.
14222,Le cours de bourse est le reflet de la confiance du marché en la capacité d'une entreprise à se ,donner, un avenir (pour reprendre en partie vos termes).
14226,"Le canton d'Argovie n'a pas besoin d'aide, mais nous refusons d'être les seuls à nous ",préoccuper, de l'approvisionnement en électricité du pays.
14277,"L'Equipe BOL, la culture qui vous ",ressemble,.
14282,Autant qu'on se retourne sur moi parce qu'on me ,reconnaissait, plutôt que parce que j'avais quelques centimètres en moins.
14332,Les débats ont également évoqué la disposition du rond-point où a ,eu," lieu l'accident, et notamment le manque de visibilité la nuit de trois des quatre panneaux de signalisation annonçant le carrefour giratoire."
14343,"Le musée Walt Disney Family Museum and Library sera consacré à Walt Disney et contiendra des dessins, photographies, lettres, documents et objets divers qui raconteront l'histoire de Walt et son influence sur l'époque où il a ",vécu,.
14354,"Sous la direction du Responsable Internet/Multimédia et du Directeur Artistique, et dans le cadre d'un remplacement de congès de maternité vous ",allez," participer à la création de projets Multimédia, vos responsabilités sont :"
14357,"Enfin ils sont 26,2% à se ",déclarer," """"fumeurs réguliers"""" (22% chez les anxieux-dépressifs et 15% chez les """"bien-portants"""")."
14359,"Celui qu'elle sème, cultive, récolte aux ciseaux, vanne à la main pour une trentaine de kilos de grains l'an et dont elle ",fait, son pain.
14362,"Rien n'interdit à une femme enceinte de boire tous les jours, mais cela ne nous ",empêche," pas de l'en dissuader », dit-il."
14394,Celui-ci indique le lieu où cinq colons furent ,tués," par les Britanniques le 5 mars 1770, durant ce qu'on appela ensuite le massacre de Boston."
14445,"La police londonienne a annoncé mercredi avoir entendu Amy Winehouse la veille pour possession de drogues illégales, suite à la publication d'une vidéo où l'ont ",voit, la jeune femme en train de fumer du crack.
14467,"La géante, estimant qu'elle pourrait s'y ",recueillir,", se montra favorable à cette proposition."
14579,J'en ai ,parlé, aux joueurs en janvier.
14588,En exergue de la monographie qui lui est ,consacrée," en 2007, il est précisé """"Avril aime le dessin et les dessinateurs""""."
14590,"Cependant, cela vous ",permet, d'acquérir une indépendance vis-à-vis de vos parents qui n'est pas négligeable.
14598,J'ai besoin de 5 m2 pour mes journaux et comme la mairie refuse de m',accorder," un supplément de surface, je préfère payer une amende chaque année."
14644,"Denzel, Washington, Clive Owen et Jodie Foster ça me ",tentais, beaucoup.
14649,"A travers l'oraison, Dieu m'a ",appris, la gratuité de l'amour.. à savoir l'aimer pour lui-même.
14688,Et c'est bien dommage de se dire qu'on va perdre un contributeur d'aussi grande qualité potentielle (voir sa page utilisateur où il ,disait, se tâter pour contribuer) parce qu'il a voulu défendre un article fait sur un de ses concepts SF...
14781,Le soleil perçait les carreaux pour nous ,caresser,.
14797,"Or, les chercheurs et biologistes, notamment, estiment que le fonctionnement de la recherche publique nécessite de plus en plus de réactivité, souplesse et rapidité, seules capables de lui ",assurer, un positionnement compétitif au niveau international.
14824,"Là, le mot protecteur a pris un tout autre sens Évidemment, elles ne m'",adressaient," pas la parole, j'avais 16 ans, j'étais une petite fille."
14828,Il y déjà ,eu, des tentatives de regroupement/suppression (sur EN aussi) et elles ont échoué (sauf pour les lignes désaffectées).
14857,"Pour comprendre au plus près la logique dans laquelle ils travaillent, je me suis fait ",embaucher," comme guichetier vacataire, pendant un mois."
14869,"Mahmoud Abbas, en provenance du Soudan où il a participé au Sommet arabe, doit arriver au Cap (sud-ouest) où il s'",entretiendra," vendredi avec Thabo Mbeki des relations bilatérales politiques et économiques, ainsi que de la situation au Moyen-Orient."
14869,"Mahmoud Abbas, en provenance du Soudan où il a ",participé," au Sommet arabe, doit arriver au Cap (sud-ouest) où il s'entretiendra vendredi avec Thabo Mbeki des relations bilatérales politiques et économiques, ainsi que de la situation au Moyen-Orient."
14887,Les livres qui lui sont ,consacrés," se multiplient, aussi bien à destination des adultes que des jeunes."
14912,"Même si on a du mal à en vivre, certains peuvent se livrer à ces activités et divertir les soirées des plus fortunés en en ",tirant, quelques bénéfices.
14919,Je vous ,offre," ma bourse, usez-en sans façon."
14928,Les Palestiniens n'y ,trouvent," plus de ciment pour construire des tombes et """"les hôpitaux distribuent des draps parce qu'on ne trouve pas assez de linceuls"""", a-t-il ajouté. - (Avec AFP)"
14940,Il y ,abrite, un faune variée.
