sent_id,left_context,pivot,right_context
58811,"Son nouveau combat politique veut mettre en évidence cette carence, mais aussi, dans la mesure du possible, y ",remédier,.
58868,Il lui ,faut, deux lunes pour retrouver une relique magique qui repousse les esprits du mal.
58892,Nous avons envoyé l'armée et des forces paramilitaires en ,renfort," pour contrôler la situation qui reste tendue mais est en train de se stabiliser"""", a ajouté le ministre deux heures après l'attentat."
58910,"Courage, vous pouvez vous en ",sortir,.
58910,"Courage, vous pouvez vous en ",sortir,.
58917,"Il avait ajouté qu'il espérait """"récupérer rapidement"""" pour pouvoir participer au tournoi de Madrid dont il a ",fait," """"sa priorité numéro un du moment""""."
58946,On y ,retrouve, des problèmes récurrents.
58994,"Interrogé sur les rumeurs de rapprochement entre Thales et Safran, Louis Gallois ne se prononce pas, mais se dit """"sûr que si un tel projet se concrétisait, on nous ",demanderait," notre avis car l'impact sur EADS serait considérable""""."
59008,Ce qui lui ,fait," le plus aimer son travail, c'est de voir qu'un enfant a appris ou a évolué."
59014,Il lui avait ,dit," qu'il était armé d'un AK-47 et muni d'explosifs et de poison et qu'il voulait chercher la confrontation avec la police """"pour se faire abattre par un flic""""."
59065,Le CRI se ,réserve, le droit de prendre toutes dispositions nécessaires pour assumer ces responsabilités et permettre le bon fonctionnement des ressources informatiques communes.
59131,La victoire leur a enfin ,permis," d'accéder au premier rang du classement dans la première division de la USL, deux points devant les Rhinos de Rochester et les Kickers Richmond."
59186,Pour y ,arriver,", en plus d'avoir notre réseau traditionnel de centres hospitaliers universitaires, nous collaborons avec sept nouveaux établissements de la rive sud et de la rive nord de Montréal."
59194,"Bernard Girard, conférencier à la journée Infopresse sur les nouveaux modèles d'affaires a tenté d'y ",répondre,.
59210,"Groupe A :Comme la semaine dernière, ne nous ",attardons, pas sur la nouvelle défaite du Mans au Cibona Zagreb (93-61).
59242,Son entrée dans l'Académie d'électricité lui ,permit," alors de pour-suivre ses recherches et durant son séjour il sympathisa avec Erlan de Parye, l'un des immortels, fils du méta-morphe."
59249,"La dame a été transportée à l'hôpital d'Arthabaska, à Victoriaville, où elle est ",traitée, pour des blessures sérieuses.
59286,"Mais """"ne me faites pas dire qu'il y ",aura, des modifications législatives.
59293,Je ne me suis pas ,posé, cette question de chercher à être différente.
59294,"Souvent, c'est ma 4x4 Toyota que vous voyez là (il désigne du doigt le véhicule garé dans son parking intérieur) que l'on utilisait dans certains milieux où la voiture de Me Wade ne ",pouvait, pas accéder.
59331,Certains joueurs n’hésitent pas à quitter le centre sans y ,achever, leur formation.
59337,Tout esprit négatif en lui ,semblait, éteint.
59342,"Pour ne pas envenimer nos relations, je m'en suis tenu à une stricte relation professionnelle avec lui, en faisant ce qu'on me ",demandait, de faire.
59342,"Pour ne pas envenimer nos relations, je m'en suis ",tenu," à une stricte relation professionnelle avec lui, en faisant ce qu'on me demandait de faire."
59347,"À une autre question, McKellen se fait encore plus précis : """"De façon encourageante, Peter et Fran Walsh m'ont ",dit," qu'ils ne pouvaient pas imaginer """"The Hobbit"""" sans leur Gandalf original."
59363,"Les autres sont pour la plupart rentrés au Liban, où certains ont été ",jugés, et emprisonnés pour leur collaboration avec l'Etat juif.
59387,Si on y ,ajoute," les transferts institutionnels, on atteint la somme de 5,3 milliards de francs."
59400,Alors n'hésitez pas à vous ,inscrire," à la mailling liste """"Les Chroniques MERCATORIENNES"""" :"
59405,Alors que jusque là tout était ,gratuit," sur le web, les entreprises arrivent et commencent à lancer le commerce électronique."
59421,Ils remontent en voiture et cherchent un endroit où ils ,pourront, capter le réseau.
59422,"Par exemple I2 leur demande souvent """"Bon ça y ",est,?
59429,Si l'on y ,ajoute," la gestion des temps et des activités aux fonctions précédemment citées, la licence coûte environ 72 000 euros."
59468,"Tu retiens mon nom, et tu n'as pas ",renié," ma foi, même aux jours d'Antipas, mon témoin fidèle, qui a été mis à mort chez vous, là où Satan a sa demeure."
59468,"Tu retiens mon nom, et tu n'as pas ",renié," ma foi, même aux jours d'Antipas, mon témoin fidèle, qui a été mis à mort chez vous, là où Satan a sa demeure."
59487,"A commencer par le Président de la République et celui de l'Assemblée nationale Au sortir des entretiens, il évoqua, comme il fallait s'y ",attendre,", la situation qui sévit ay Nord du Mali."
59501,La même télé qui bombarde le client de ses vidéoclips où un plan ne ,doit, jamais durer plus d'une seconde et quart ne se gêne jamais pour avoir des annonces à placer.
59504,"La plus sportive des Audi, la R8, s'",offre," un V10 cubant 5,2 litres sorti des entrailles de sa cousine la Lamborghini Gallardo LP560-4. Dégonflé pour l'occasion à 528 chevaux."
59540,"Passionné par l'écriture de Minyana, il lui a ",passé, commande de cette &#156;uvre en forme de livret.
59596,"Après une enfance champêtre à Epaignes en Normandie, Hervé Morin veut reprendre la ferme familiale, mais son père s'y ",oppose,.
59613,"Peu à peu, elle et lui ",vont, tisser des liens de tendresse et vivre un amour empreint de pudeur et de retenue.
59626,"Il a plus que jamais raison : quinzième avec vingt points, le Racing Club de Lens n'y ",arrive, toujours pas.
59633,"De plus, un refus de sélection pourrait lui faire ",courir, un risque de suspension.
59636,"Concernant la Roumanie, où un virus de la grippe aviaire a été ",identifié,", la Commission attend pour vendredi la confirmation qu'il s'agit ou non du H5N1."
59661,Un fou de musique dont on se ,demande," comment il peut bien vivre à Metz, avec ces clubs de danse «de merde: Bob Sinclair, David Guetta, etc.»."
59695,"Debut du Grand Prix à 14h, où Kimi Räikkönnen ",partira, en pole.
59698,Le froc baissé les me f',ront, la raie d'honneur.
59705,"«C'est évident que leur expérience leur a permis de gérer au mieux leur attente sous terre, de se rationner en nourriture et de se positionner exactement là où on les ",attendait,.
59705,«C'est évident que leur expérience leur a ,permis," de gérer au mieux leur attente sous terre, de se rationner en nourriture et de se positionner exactement là où on les attendait."
59712,Dans les départements où la mission s' est ,rendue,", les commissions de circonscription se trouvent le plus souvent placées sous la présidence effective de l'inspecteur de l'Education nationale de la circonscription."
59730,"Seulement voilà, Félicie n'aimait pas Polo et le peu qu'elle l'avait vu, il lui avait ",déplu,.
59731,Mais la qualité s'en est ,accrue, avec l'implantation de deux fermes biologiques : le Gaec de l'eau vive à Monbran et la ferme Bird à Artigues.
59760,Ils représentent la moitié des effectifs qui y ,travaillent," actuellement, pour le compte de différents groupes."
59773,"Et les signes, je les connais mieux que le cher Sully : m'",étonneraient, qu'ils chassassent l'onde sur le miroir des lacs profonds et calmes.
59799,"C’est durant ses études à Bergamo qu’il se liera d’amitié avec les frères Serassi, célèbres facteurs d’orgue italiens, d’où lui ",viendra, son activité de concepteur et de réparateur d’orgues.
59800,Cette page concerne les événements qui se sont ,déroulés, un 10 septembre dans les Croisades.
59836,Ce sont les Palms qui m'ont ,mené, aux Macs.
59842,"Autrement dit, chacun peut y ",introduire," sa représentation de Dieu, le chrétien comme le musulman, le confucianiste comme l'animiste ou le fidèle de n'importe quelle religion."
59852,Il me ,semble," que les Etats-Unis vont devoir garder une présence en Irak pendant longtemps», a-t-il ajouté."
59885,"Notre pays se développe, certes, pas de façon tout à fait démocratique, mais il se développe"""", argumente-t-il, expliquant avoir voté """"comme cela lui ",semblait," nécessaire"""", autrement dit pour M. Loukachenko."
59894,"Chacun est libre de croire en ce qu'il en a envie, et arrêter de dire que """"tu ne connais pas ta religion"""" parce que vous en ",avez, aucune preuve!
59894,Chacun est libre de croire en ce qu'il en a ,envie,", et arrêter de dire que """"tu ne connais pas ta religion"""" parce que vous en avez aucune preuve!"
59907,La balle s'est arrêtée à trois pieds de la coupe et il a lui aussi ,terminé," à 268, 16 coups sous la normale."
59925,"Des rumeurs font état d'une douzaine de têtes nucléaires manquantes, dont certaines ",pourraient, être en la possession de groupes terroristes.
59935,Ils m'ont ,fourni, une moustiquaire car ici les moustiques sont nombreux.
59939,"Né à Pointe-Noire, au Congo, où son père est ",réceptionniste," dans un hôtel, Alain Mabanckou enseigne depuis 2002 la littérature francophone aux Etats-Unis."
59979,"Mauresmo a montré de bonnes choses dans le jeu, mais a été insuffisante au service, notamment au dernier set où elle a ",perdu, sa mise en jeu cinq fois sur cinq.
22,"Après avoir réussi à tomber du paquebot à bord duquel elle voguait en compagnie de ses parents, Sunny reprend ses esprits sur la plage d’une île oubliée de tous, où le temps est comme ",figé, depuis près de deux siècles.
40,Je ne vous ,dirai, pas grand-chose de la période de ma vie entre mon retour au giron familial et le commencement de mes études.
46,"Richissime, tout lui ",réussit, sauf sa vie de famille.
47,"Ce travail indispensable justifie la mise en place d'un ensemble de procédures, au sein des services de la collectivité, lui ",permettant, d'assurer la surveillance :
67,"Après la visioconférence et en attendant la téléportation (nan je deconne), Cisco France m'a ",permis," de tester leur tout nouveau système de """"téléprésence""""."
68,Il peut en ,négocier, les modalités de diffusion avec les organismes concernés à la suite de son travail pour leur compte.
71,"Avec 3,61 m de long, la Yaris est la plus courte de son segment (seule la Mercedes Classe A lui ",tient, tête avec 3 cm de moins).
73,"Alors qu'il est encore adolescent, sa famille met tout en œuvre pour qu'il puisse suivre ses exercices de physiothérapie, notamment en lui procurant un espace qui lui est totalement ",consacré,.
73,"Alors qu'il est encore adolescent, sa famille met tout en œuvre pour qu'il puisse suivre ses exercices de physiothérapie, notamment en lui ",procurant, un espace qui lui est totalement consacré.
84,"Cela veut dire que vous croyez l'idéal et l'initiative prônés par 3 parti de la poignée de mains, cela veut dire aussi que vous vous ",projetez," vers l'avenir"""", a-t-déclaré."
113,"Au XVIIIe siècle, cette hérésie fit la révolution dans les communautés juives d'Europe où ",prédominaient," les Marranes, comme Amsterdam ou Venise."
119,Elle ne ratifiera donc probablement jamais la charte de l'énergie et le protocole de transit qui lui est ,lié,.
130,L'équipe médicale estimait qu'il y avait nécessité de le réhabiliter dans le sens où il ,faut," le réhabituer à vivre dans la cité"""", a encore expliqué le directeur."
130,L'équipe médicale estimait qu'il y avait ,nécessité," de le réhabiliter dans le sens où il faut le réhabituer à vivre dans la cité"""", a encore expliqué le directeur."
169,"Le controversé """"tournant vert"""" du Parti libéral pourrait lui ",attirer," des appuis, selon un récent sondage."
230,"CM : Non, ca ne nous ",fait, pas peur.
261,Que dois-je faire pour y ,remédier,?
263,"Fut, puisqu'il n'a jamais existé. / Sans avoir existé, il nous ",combla,". / Puisqu'il n'arriva jamais, toujours il fut l'arrivant. / Et il nous créa."""""
281,"Je lui demandais, avant de nous ",quitter,", ce qu'il pensait de mon projet de médiatisation outrancière, afin de faire connaître mon manuscrit à Sollers, comme Loana ou je ne sais qui."
296,Il est aussi très malicieux : le soir il gratte la cage pour qu'on lui ,donne, une galette.
302,"ROLEPLAY: Si un de vos joueurs fait du roleplay, ne vous inquiétez pas, ça lui ",passera,.
302,"ROLEPLAY: Si un de vos joueurs fait du roleplay, ne vous ",inquiétez," pas, ça lui passera."
333,"L'ordinateur mis à votre disposition pour votre présentation est un Mac G3, il symbolisera un client web lambda, Pour sa configuration je vous ",conseille, de regarder les insctructions suivantes.
335,Une unité spéciale israélienne venait d'y ,découvrir, un tunnel de 150mètres de long menant sous les installations de Karni.
374,L'ensemble de ces croisements mitochondriaux nous a ,permis, d'élaborer un modèle stochastique de la recombinaison mitochondriale qui a permis d'établir la première carte fonctionnelle de l'ADN mt de la levure.
397,Il va maintenant nous ,montrer, le chemin de la rédemption (L.A. Confidential) et celui de la vulnérabilité (en homosexuel chez Eastwood).
399,Car une imposante armoire électrique orne le mur du local d'où est ,parti, le sinistre.
405,Mais Jean-Marie Villégier lui ,propose, des rôles au TNS ce qui l'amène à renoncer aux deux écoles.
416,"Selon Libération, le président français a multiplié les plaisanteries sur la cuisine britannique dimanche à Kaliningrad (Russie), où se ",tenait, un sommet informel avec Vladimir Poutine et Gerhard Schroder.
426,"Selon Airbus, """"neuf personnes se trouvaient à bord de l'appareil afin d'y ",effectuer," les mesures habituellement prévues""""."
467,Sa récente séparation de sa femme lui ,donne, un nouvel état de célibataire auquel il a du mal à s'habituer.
484,"Ensuite le cheval apprend à donner les pieds, c’est-à-dire laisser le soigneur prendre son pied sans y ",mettre," de poids, sans le retirer brusquement et si on approche la main du pied sans donner l’ordre, ne pas donner le pied."
513,Un interprète renchérit: «Il se ,moque, de tout le monde depuis des mois.
523,"Les enfants du crooner italo-américain - Nancy, Frank Jr et Tina - ont participé à la cérémonie où a été ",dévoilée, la maquette du timbre montrant le chanteur arborant son habituel chapeau de feutre.
567,"Des combats ont opposé les rebelles congolais de Laurent Nkunda à des miliciens pro-gouvernementaux après une accalmie de cinq jours dans l'est de la République démocratique du Congo (RDC), où l'ONU a ",annoncé, le renforcement de ses troupes.
572,WebTest peut être aussi utilisé au bout d'un temps d'exploitation d'un site afin d'en ,améliorer, la qualité dans l'objectif de réaliser une nouvelle version.
576,"Devant le ridicule de cette pensée bien involontaire, je me suis ",calmé,", et j'ai finalement réussi à récupérer mon document."
581,"Cette prouesse, à elle seule, aurait suffi à lui ",assurer, la postérité.
582,"Doris m'avait déjà dit: """"Un coach recrue aurait démissionné en novembre"""" et moi je lui avait ",répondu,": """"Oui!"
582,Doris m'avait déjà ,dit,": """"Un coach recrue aurait démissionné en novembre"""" et moi je lui avait répondu: """"Oui!"
605,Son attrait pour l'ensemble de la gent féminine lui ,joue," parfois de mauvais tours : l'habit ne fait pas le moine, et celles qui finissent dans son lit jouent parfois les mantes-religieuses."
611,"Tournant sur base Havok et Unreal Engine 3 modifié, excusez du peu, ce jeu à la troisième personne nous ",mettra," dans les baskets de Chow Yun-Fat alias, pour l'occasion et pour la seconde fois, Burrito Oups !"
627,Son enfance au Texas ne l'avait pas ,préparé," à un tel rôle», relate Will Di Novi pour The Nation."
640,"La page 5 de la notice concernant l'organisation des épreuves vous donne la liste des académies chargées de traiter votre candidature, selon le pays ou le territoire d'Outre-mer où vous ",résidez,.
640,La page 5 de la notice concernant l'organisation des épreuves vous ,donne," la liste des académies chargées de traiter votre candidature, selon le pays ou le territoire d'Outre-mer où vous résidez."
675,"La caravane conservatrice se rend à Québec, où le parti ",espère, tenir son gros rassemblement de la campagne.
697,"Des fideles viennent en grand nombre de part le monde ,Un grand nombre de bêtes y sont ",sacrifiées, à chaque Hillula à Lag Baomer.
707,Nous sommes sur Wikipédia FRANCOPHONE au cas où ça t'aurait ,échappé,", et les diacritiques cités (vietnamiens en l'occurence) ne font pas partie de la syntaxe française."
717,"Aujourdhui, quand on interroge les Allemands sur le peuple dont ils se ",sentent," les plus proches, ils répondent invariablement les Français et vice-versa."
717,"Aujourdhui, quand on interroge les Allemands sur le peuple dont ils se ",sentent," les plus proches, ils répondent invariablement les Français et vice-versa."
789,"Au moment où se négocie l'élargissement à l'Est et au Sud, il n'est pas inutile de faire le point sur les éléments de convergence et de divergence et d'en ",expliquer, les fondements.
789,Au moment où se ,négocie," l'élargissement à l'Est et au Sud, il n'est pas inutile de faire le point sur les éléments de convergence et de divergence et d'en expliquer les fondements."
793,On le sait depuis des décennies: François Nourissier est un styliste de la langue française qui sait admirablement sonder les coeurs les âmes mais aussi les reins de cette bourgeoisie française dont il est ,issu, mais qu'il abhorre.
849,Celle-ci nous ,réserve, généralement bien des surprises.
862,"Si ceux qui travaillent dans le secteur n'ont pas de perspectives, ils vont peut-être essayer de conquérir un marché où ils ",peuvent, encore utiliser leur expertise.
896,Un commerce illicite qui lui avait ,coûté, à plusieurs reprises un châtiment de quelques mois de prison ferme.
923,"On sait depuis un an que 1770 appareils de loterie vidéo seront retirés des bars pour être concentrés dans les salons de jeux des hippodromes, où on ",croit, qu'il sera plus facile d'éviter le jeu compulsif.
925,"Plus large, plus ergonomique, plus riche, plus belle, elle a été conçue pour vous ",offrir, une expérience de navigation améliorée.
955,"Aujourd'hui, les technologies collaboratives, comme les blogs ou les «wikis», façonnent de nouvelles interactions sociales, où le pouvoir ne ",réside," plus entre les mains des institutions, mais entre celles des communautés, observe Catherine Graeber."
956,"Par contre, je ne crois pas que la Classification française ait à prendre en considération le classement d'entités traditionnelles dont l'autonomie nous ",apparaît, aujourd'hui discutable.
956,"Par contre, je ne crois pas que la Classification française ait à prendre en considération le classement d'entités traditionnelles dont l'autonomie nous ",apparaît, aujourd'hui discutable.
960,"Par le sérieux des sujets, de la préparation et des questions, cet espace de rigueur détonne quelque peu dans un marigot matinal où ",clapotent, les lieux communs.
969,"«Nous voulons travailler pour subvenir au besoin de nos familles», ont-elles ",expliqué,.
988,"Faute de quoi il envisagera des mesures, """"n'impliquant pas l'usage de forces armées"""", pour l'y ",contraindre,.
995,Il leur ,appartient, de prendre du recul par rapport à cette bataille qui pollue l'atmosphère de l'arène sénégalaise.
1014,"Pas d'hypocrisie là dedans, juste dire on te ",laisse," la chance de revenir différemment, pas juste en changeant de nom et en restant le même, ça c'est clair."
1032,Evidemment il leur ,prépare," beaucoup de légumes, mais nos chiens apprécient aussi les biscuits à l'avoine ou au caroube, et surtout le parmesan"""", ajoute-t-elle."
1065,Ca me ,déprime," un peu quand je vois le temps, ou que je n'arrive pas à partir par rapport aux autres, que je me prends un mètre dans le virage dans la coulée», confiait-elle au Parisien."
1073,"Or, précisément, n'est-ce pas ce qu'a fait Spielberg tout occupé à nourrir les rêves de son cinéma, du Cinéma qui, par définition, nous « sort » de la réalité pour nous faire ",vivre, une ou deux heures de pure illusion ?
1080,"Je suis un enfant de l'époque Nixon, la douleur ne m'a pas ",atteint,.
1091,"Des personnes qui peuvent vous aider à parachever certains de vos objectifs du moment, sont prêtes à vous ",écouter,.
1100,"Dans la proposition « être libre, c'est pouvoir faire ce que l'on veut », on discerne sans peine la présence de deux éléments, qui indiquent les deux conditions devant être remplies pour qu'il y ait ",liberté,.
1106,"Scott et Lyman en distinguent deux : La première concerne """"l'excuse"""" où l'acteur ",admet," la transgression de la norme, tout en apportant des propos argumentaires visant à réduire sa responsabilité pour """"la faute commise""""."
1114,Elle vous ,propose, de découvrir ses activités et de retrouver de nombreuses informations pratiques sur la ville.
1153,"Pour la sortie ce mercredi du film 48 heures par jour, nous vous ",proposons, l'interview de la réalisatrice (Catherine Castel ) et de l'acteur principal (Antoine de Caunes) ainsi que notre avis sur ce long métrage.
1164,Nous avons eu l'occasion de rencontrer le président du conseil d'administration et l'administrateur délégué pour nous ,entretenir, des conséquences éventuelles de cette inculpation.
1186,Pour organiser une rencontre et vous faire ,massacrer," (cela va de soi), laisser un message sur le forum ou s'adresser par ICQ à Calimeropierro ou Maxracaille."
1193,"Repoussé par l'invasion étrangère, Truguet fut un des derniers à quitter le poste qui lui avait été ",confié,.
1199,"Nous n'essayons pas d'imposer un gouvernement à la Somalie, pas plus que nous n'avons l'intention de nous ",immiscer, dans les affaires internes de la Somalie.
1204,"Il faudra en avoir accumulé 20 pour passer de 0 à 10. Pour passer de 10 à 20, il faudra pour chaque pourcent y ",passer," 2×2 heures, soit 40 heures au total."
1209,"Le film démontre que échouer à un rêve n'est pas la fin du monde, puisqu'il est toujours facile d'en ",trouver, un autre substitue.
1246,Arrêté dans le Var où il s'était ,réfugié," à la fin de la Seconde Guerre mondiale, il fut interné de janvier à juin 1944 et mourut peu de temps après la fin des hostilités en 1946."
1276,C'est en effet à Dives que fut ,rassemblée, l'armada du duc de Normandie.
1278,"Selon plusieurs sondages, l'AKP, au pouvoir depuis 2002, obtiendrait environ 40 % des voix, ce qui lui ",permettrait," de rafler au minimum quelque 300 sièges sur les 550 du Parlement, soit plus que la majorité absolue."
1330,"Situé qu nord de l'île, à 20 Kms de la ville de SAN ANTONIO où la fête ",bat," son plein de jour comme de nuit, le club VISTA BAHIA offre toute la sérénité d'une petite crique rocheuse (cala) entourée d'une pinède odorante."
1346,Vous accédez plus rapidement aux informations qui vous ,intéressent,.
1349,Des aides de la Fondation Mohamed V pour la solidarité y ont été ,acheminées,", rapporte la MAP."
1358,"Mais, comme en 2002, c'est peut-être un acteur d'un film des frères Dardenne qui lui ",soufflera, le Prix.
1360,Nous espérons que chaque amateur y ,trouvera, les monnaies nécessaires au développement de son médaillier.
1412,"Interview, dimanche dernier à Paléo, d'Eugene Hütz, leader de Gogol Bordello, le band de New York, avec ses danseuses épileptiques, ses ruades à vous ",réveiller," les moribonds Pour lui le live est une thérapie, un chamanisme."
1425,"A Ribeauvillé, où elle a ",accueilli," en quatre saisons 250.000 visiteurs, elle avait réalisé l'an dernier un parcours sur le thème des Voyages extraordinaires de Jules Verne."
1452,Notre belle-mère à une élégance assurée dans le choix des cadeaux qu'elle nous ,offre, à haute fréquence.
1462,Il lui ,reste, encore cinq départs cette saison alors qu'il essaie de remporter 15 victoires ou plus pour une 18e saison de suite.
1465,Je leur ai ,donné, ce link.
1474,"Du côté français, Michel Barnier a déclaré que Paris continuait """"à espérer que l'Iran ne fera pas ce geste dont il ",connaît," les conséquences""""."
1477,Le chauffeur n'aura plus qu'à présenter aux gendarmes le quitus qui lui a été ,délivré," », explique-t-il."
1487,"Parler de """"déclin"""" de FERRERI, ça me ",paraît, excessif.
1491,"Le seul film d'époque que j'ai vu qui était un peu intéressant, c'est le film Amadeus, car il racontait une histoire vraie de quelqu'un de connu, sinonÉgalement, je ne connais pas les acteurs dans ce film, ce qui ne me ",donne, pas le goût de le voir.
1499,Un endroit où je ,sais,", chaque nuit, qu'ils sont ivres."
1501,"Sophie Verrijke, qui est en instance de divorce, refuse depuis le printemps dernier de confier la garde de sa fille à son père belge avec lequel la petite Eline serait, selon elle, en ",danger,.
1508,Il devait en ,résulter,", à l'origine, une prédilection marquée pour l'improvisation."
1511,"Tant qu'il y aura de bonnes personnes pour s'occuper des enfants rejetés de la société, ils auront de l'espoir de s'en ",sortir,.
1513,La musique à en ,perdre,.
1521,"Dans Le Devoir du 9 novembre dernier, Marie-Jo Ouellette demande des coordonnées de couvents, d'abbayes et de communautés religieuses où elle ",pourrait, être hébergée pendant un voyage en Italie.
1554,"Déjà acteur ou non dans le mouvement social, l'efficacité commande de nous ",organiser, mieux ensemble pour porter tous nos besoins et revendications.
