sent_id,left_context,pivot,right_context
30015,«Beaucoup d'acheteurs potentiels s'étaient ,mis," sur la touche, attendant que les vendeurs soient prêts à des compromis sur les prix et les termes de la vente», souligne David Lereah, chef économiste de la NAR."
30021,Un avantage qui doit logiquement lui ,permettre," de faire oublier une prestation médiocre lors de la dernière édition, en France en 2003."
30046,J'y ,pense, en fait plus pour tous les autres participants!
30085,Elle n'existe que par rapport aux opinions que nous nous ,faisons, des faits.
30107,"Quand ce n'est pas déjà fait : « Franchement, vous pensez qu'un candidat vous ",dira, qu'Internet ne l'intéresse pas ?
30117,"La nouvelle junte militaire aux commandes en Thailande a annoncé samedi qu'elle allait prendre des mesures contre la presse étrangère, mécontente de la manière dont le coup d'Etat a été ",couvert, par elle.
30120,Que puis-je faire pour me ,faciliter, la vie?
30122,Le professionnel du club Le Mirage est redevenu un joueur dominant comme en ,font, foi sa victoire à la classique Telus et ses deuxièmes places à l'Invitation Via Rail Canada et au challenge Jean Coutu.
30125,"De la fin 1982 jusqu’à 1986, sa carrière est essentiellement colombienne, avec quelques incursions au Mexique où il ",participe, à neuf corridas.
30126,"L'Allemagne, l'Espagne, la Grande-Bretagne y ",consacrent, aussi des programmes.
30135,"Je ne trouve pas de petite statue de Manjushri, du coup je m'",achète, un CD :-) Retour à l'hôtel.
30181,Fabrice Wuyts lui ,prédit, la rentabilité dès l'exercice inaugural.
30182,"Cessons de nous aveugler à ce point, et que l'exemple des peuples plus raisonnables que nous serve à nous ",persuader, de nos erreurs.
30182,Cessons de nous ,aveugler," à ce point, et que l'exemple des peuples plus raisonnables que nous serve à nous persuader de nos erreurs."
30195,La faculté est donnée aux électeurs de voter par correspondance lorsque les circonstances ne leur permettent pas de se rendre au bureau de vote pour y ,exercer, directement leur droit de vote le jour du scrutin.
30215,Un conseil : n'écoutez plus ceux qui vous ,disent," qu'il n'y a plus de vie après le travail, ils ont tort, c'est peut-être à partir de ce moment, à la retraite, qu'elle est la plus forte."
30226,"La démonstration est ainsi faite qu'il est possible, dans une commune modeste et comptant une importante population d'origine étrangère, de faire reculer l'intolérance, la xénophobie et le repli sur soi dont est ",porteuse, l'extrême droite.
30234,Je me retrouve à la FNAC devant les bacs de CD à me ,dire, que c'est quand même largement plus pratique de trouver ce qu'on cherche avec un moteur de recherche !
30243,"Gadget lit à voix haute son ordre finissant toujours par la phrase « ce message s'auto-détruira... » et redonne le papier à Gontier, qui, enfoncé dans sa cachette, n'a pas le temps de s'en ",débarrasser, et reçoit l'explosion en plein visage.
30245,Vous pouvez par exemple lorsque vous êtes en déplacement vous ,connecter, par FTP sur le serveur de l'ENSTIMA par l'URL ftp://soleil.ema.fr.
30345,"En effet, la plupart des boxes gardent une trace des adresses MAC qui lui ",demandent, accès à Internet à un moment donné.
30361,"Une volonté élyséenne de «verrouillage» Dans le camp chiraquien, certains s'inquiètent des rumeurs faisant état d'une probable désignation de Renaud Denoix de Saint-Marc dont ils ne ",savent, pas mesurer «la fidélité à Jacques Chirac».
30369,Le Traité de Maastricht lui a également ,conféré, un pouvoir de décision dans le domaine de la politique étrangère et de sécurité commune (PESC).
30388,"Et il ajoute: """"les dernières 36 années à  Londres m'ont ",montré," que tout change, généralement pour le meilleur""""."
30395,Cela ne lui était pas ,arrivé, depuis le 18 février 2008.
30420,A l'en ,croire,", seule la volonté des électeurs de «reconstruire la démocratie» explique le quasi-triplement de son score au premier tour de la présidentielle entre 2002 (6,81 %) et 2007 (18,57 %)."
30441,"Mathieu Lindon, """"Comment ça s'",écrit,", l'Hommage dans le tapis, Libération, 14 septembre 2000."
30455,Le lien canonique sera établi dès l'instant où nous ,approuverons, la Constitution proposée par Sa Béatitude le Patriarche Justinien et par le Saint-Synode.
30460,"La première manche, celle de la reconnaissance de la plénitude d'exercice pour les médecins à diplôme étranger et les PAC en particulier a été arrachée de haute lutte par le SNPAC, le syndicat qui vous ",représente,.
30485,Il y ,aura, plus de joie dans le ciel pour un seul pécheur qui s'amende que pour quatre vingt dix neuf justes qui n'ont pas besoin de repentance.
30499,"A l'évidence, elle est heureuse d'être là, dans cette ville où elle a ",signé, tant d'exploits.
30502,Il lui ,faut," qu'un frère, un autre, la nomme comme chrétienne et qu'à son tour elle puisse reconnaître et nommer son frère dans la foi."
30522,Pour choisir il faut passer par cinq étapes : 1- Apprendre à se ,connaître," : A partir d'exercices et de réflexion, il s'agit de se découvrir ou d'approfondir ses goûts, ses aspirations, sa personnalité ou le mode de vie que l'on souhaite."
30544,La révision coopérative a été organisée par le décret n° 84-1027 du 23 novembre 1984 auquel ,renvoie, l'article 13 du décret n° 2002-241 du 21 février 2002.
30549,A l'heure où la gynécologie médicale ,semble," en péril, les femmes souligne leur attachement à cette spécialité."
30559,"Selon Jacques Chirac, """"la solution, chacun en ",connaît," les termes: ce sont deux Etats qui soient en sécurité l'un vis-à-vis de l'autre et qui soient viables""""."
30569,Il nous fallait nous ,éloigner, le plus vite possible de la prison.
30569,Il nous fallait nous ,éloigner, le plus vite possible de la prison.
30584,"Le milieu espagnol de Villarreal José Joaquin Moreno, dit Josico, va rejoindre Fenerbahçe, entraîné par Luis Aragones et où ",joue," l'attaquant Dani Güiza, deux compatriotes, a annoncé vendredi le club espagnol."
30585,"Par ailleurs, la carte apparaissant dans l'article Portugal me ",semble," incorrecte aussi, d'après ce que tu dis."
30622,"C'est au travers de quelques captures, mais aussi d'une première vidéo, que THQ nous ",propose, de découvrir le nouvel épisode de la série des WWE SmackDown vs. Raw.
30635,"Après la fameuse scène du hamburger de """"Pulp Fiction"""", il mime un ami qui, de retour d'Espagne, lui avait ",assuré," que """"les burritos de Taco Bell y étaient bien plus gros qu'en Amérique""""."
30661,Vous savez comme j'aime raconter ces fantasmes qui me ,hantent, dès que la température monte.
30695,"Les attentats y sont moins fréquents que dans les zones où la rébellion, ",animée," principalement par les sunnites, est active, comme à Bagdad, dans le nord et l'ouest de l'Irak."
30746,"D'autre part, il maîtrise et contrôle l'ensemble des processus de production, de l'analyse des procédés à la gestion des organisations, les moyens et les coûts, et en ",assure, la maintenance.
30748,"J'aurais préféré que les choses se passent autrement, qu'il y ",ait, moins de bruit.
30756,"Pas de soucis, si nous sommes sûrs de nos horaires, c'est que l'on joue l'option joker, nous serons accompagnés par un """"p'tit gars du Pays"""" qui nous fera ",découvrir," ses montagnes, leurs paysages enchanteurs à la blancheurs colombines sans reproche."
30783,Il fut comblé des faveurs de Denys l'Ancien dont il se ,faisait, l'adulateur.
30784,Mon fantasme c'est de me ,travestir, et de me sentir femme.
30802,"La rémunération globale des travailleurs n'a pas cessé, par exemple, d'y ",augmenter," depuis 1994, même lorsque l'on tient compte de l'inflation."
30807,"Entre ses séjours à Munich, sur la Côte d'Azur ou au Maroc, il revient toujours dans sa Normandie, où il ",trouve, l'inspiration de ses oeuvres.
30872,"Grand-père de cinq petits-enfants, Rosewall vit désormais au nord de Sydney où il ",joue, encore au tennis.
30873,"Ils quittèrent Rio le 3 septembre et, profitant des alizés, firent voile vers le cap de Bonne-Espérance, où ils ",mouillèrent, à la mi-octobre.
30907,Plusieurs personnes (la caste des gourmets voyageurs) m'on ,tancées," compte tenu de la vacuité manifeste des sections """"Voyages"""" et """"Cuisine""""."
30909,L'important est qui vous ,regarde,", comment : est-il respectueux, bienveillant ?"
30931,"Son règne est un règne éternel, et tous les dominateurs le serviront et lui ",obéiront,. 7.28 Ici finirent les paroles.
30934,"La principale activité de GM, l'automobile, affiche un chiffre d'affaires de 42,9 milliards, en léger ",recul," sur les 43,6 milliards du premier trimestre 2006."
30948,"J'ai lu la dernière entrée de Kemushi ce midi, ralala ces hommes qui ne veulent jamais nous ",écouter,...
30951,"À la guitare, et surtout dans ce spectacle d'exception où il n'",est," qu'à la guitare, c'est le folksinger et ses «protest songs» qu'on a dans la face, mêlé au westerneux d'hôtel perdu."
30982,Il en ,existe," aussi dans d'autres pays, mais la loi suisse est l'une des plus strictes en termes de risques (hypothèques de premier rang et ratio de fonds propres élevé), selon Thomas Jordan."
30994,"Dès lors, il ne vous ",reste," qu'à faire votre choix, tout en sachant que de toute manière, le plaisir du pilotage est bien présent chez l'une comme chez l'autre."
31040,Elle offre une capacité de stockage de 4 Go ainsi qu'une vitesse de lecture / écriture de 20 mbps qui en ,fait, le plus rapide des modèles de ce type au catalogue de Sandisk.
31053,Notre site est bien consulté à l'extérieur et nous recevons des encouragements notamment des États-Unis et de France d'où les gens nous écrivent pour nous ,féliciter,", se réjouit Cheick Hamalla Sylla."
31118,Dans lui ,utilise, les colonnes de fer de fonte et les tiges innovatrices de tension de fer.
31142,"Vous disposez d'un droit d'accès, de modification, de rectification et de suppression des données qui vous ",concernent, (Article 34 de la loi Informatique et Libertés).
31162,Les procureurs devront déterminer si Spears réside vraiment en Californie et désire s'y ,établir," de façon permanente, selon Flanagan."
31170,"En revanche, François Pinault, qui depuis a été ",dégagé," de toute responsabilité, et Artemis, avaient décidé de lutter sur le terrain juridique."
31242,"Si, par l'inspiration divine, il a conçu d'embrasser un état plus parfait, le ver rongeur du soupçon qui est entré en lui ",détruit," le parfum de la vertu, et il retourne à ses premières faiblesses."
31244,Il se rendra ensuite au village olympique pour y ,rencontrer, les athlètes et les responsables du sport tricolores.
31252,Apres cela il passera chez Delarue pour témoigner à propos de j'ai pas arreter de passer dans des émissions TV et maintenant chui ridicule quand je me ,ballade, dans la rue.
31255,"A leur sortie, les enfants nous ont ",raconté, :
31259,Je me suis ,trouve, des copains et copines geeks mais surtout ce qui m'a marque c'est l'acceptance par les non geeks qui comprenaient ce que j'etais.
31266,Juste un mot pour vous ,souhaiter, à toutes et à tous un bon et joyeux Noël 2001!
31278,"Tellement fier de sa Jennifer, qu'il lui a ",demandé, de grossir son nom au générique de Surveillance.
31284,"Titulaire indiscutable, il y passera 4 saisons où il y ",vivra, l'unique épopée européenne du club.
31284,"Titulaire indiscutable, il y passera 4 saisons où il y ",vivra, l'unique épopée européenne du club.
31291,"Comme cette comédie n'était en soi pas suffisante, Canal+ nous a fait le plaisir d'en ",organiser," un épisode surréaliste samedi soir lors de Jour de Foot, dont les invités furent successivement Pierre Blayau et Pape Diouf."
31295,Plus de 2000 policiers y ont ,participé,.
31296,"Le réseau EEF veut aujourd'hui connaître le parcours de chaque créateur, à partir du moment où il est ",accueilli," par un espace local, puis réorienté vers d'autres réseaux ou contacts."
31338,Concentrez vous sur le sujet de l'article ou sur le point qui vous ,oppose, à l'autre contributeur.
31373,"Sans être en retard, ni même en difficulté, tous les trois aimeraient que l'école soit aussi facile que le tir, qu'ils y ",prennent, autant de plaisir.
31388,"Après un bref exil en Espagne, il se rend aux Etats-Unis, d'abord à New York, puis à Las Vegas et enfin à Miami, dans les années 80, où il ",rejoint, d'autres grands de la musique latino comme Tito Puente et Gloria Estefan.
31409,L'information des maîtres nous ,semble, indispensable.
31456,On ne voit pas au nom de quoi on lui ,imposerait, cette torture.
31491,En arrivant dans la maison où on lui ,loue," une chambre (Madame de la Chanterie est la propriétaire), il reconnaît l’homme bon."
31491,En arrivant dans la maison où on lui ,loue," une chambre (Madame de la Chanterie est la propriétaire), il reconnaît l’homme bon."
31516,L' e-Working n'en est qu'à ses balbutiements; c'est le rôle des entreprises et des organisations mondiales de lui faire ,atteindre, sa pleine maturité.
31572,Advenant le cas où la banque ,envoie," un courriel à ses clients, jamais elle ne suggérera un lien hypertexte menant à son site officiel."
31585,"Pour qu'ils s'approprient les critères, les élèves sont associés ; cela donne du sens au travail attendu et permet d'en ",montrer," l'intérêt ainsi que le rôle joué par les TPE pour leur formation personnelle, à court et long terme."
31588,A en ,croire," leurs déclarations, les populations doivent éviter de corrompre et de se faire corrompre car, selon eux, c'est une gangrène qui freine le développement d'un pays."
31597,"La principale innovation de la Super Nintendo était ce fameux mode 7 inventé par Nintendo, dont je vous ai ",parler, tout à l'heure.
31598,Les nombres entiers ,peuvent, être codés comme des caractères ordinaires.
31611,Quant au prix moyen dont se sont ,acquittées," les personnes sondées par le """"Times"""", il est de quatre livres sterling (soit un peu moins de six euros)."
31617,S'en ,suit," un défilé de voitures très rares et très chères comme la Ferrari Enzo, la Bugatti Veyron et même une Bentley tractant une playmate en roller."
31640,Je vous ,déconseille, donc ce film ennuyant et décevant.
31649,Pour y ,parvenir,", il se concentre uniquement sur les opportunités qui se présentent, dans les monnaies et les obligations, quitte à n'avoir aucune position dans un segment qu'il trouve trop cher, même s'il s'agit d'une grande région."
31663,Bien qu'on lui ait souvent ,proposé," de superbes espaces, jamais il n'a envisagé de déménager""""."
31668,Une école s'y ,oppose,.
31680,"À huit journées de la fin, Caen reçoit Strasbourg dans une enceinte affichant complet 72 heures avant la rencontre, enceinte où les Normands n'ont jamais ",cédé, cette saison.
31682,J'ai déposé ces demandes lorsque cela me ,paraissait," justifié"""", a-t-il commenté."
31687,"J'ai failli en acheter un en Angleterre la derniere fois, et puis je me suis ",retenur,", a tort."
31690,Il y ,perd, finalement beaucoup.
31725,Ceci pousse la police de New York à afficher une bannière où il est ,écrit, We Own the Night (nous maîtrisons la situation) sur les commissariats de la ville.
31732,La seconde chose à faire va être de se ,diriger," le plus vite possible vers les canons, les capturer, puis les retourner vers les adversaires: les pièces d'artillerie serviront à aider la bataille à repousser les charges de cavalerie."
31736,"Car, j'y ",reviendrai,", il faut de temps à autre cesser d'être naïfs et aveugles."
31749,Les incidents se sont déroulés à  un barrage où ,auparavant, une colonne de 60 véhicules de manifestants souhaitant participer aux assemblées de Santa Cruz et Beni avait été bloquée par des paysans pro-Morales.
31774,Le transport aura lieu dans la rue d'Ajaccio où le préfet Claude Erignac a été ,assassiné," le 6 février 1998, et à la gendarmerie de Pietrosella (Haute-Corse), cible d'un attentat en septembre 1997, dont Yvan Colonna est également accusé."
31815,Adorez Allah et ne Lui ,donnez, aucun associé.
31825,Nous vivons dans une société où la publicité nous ,dit, ce qu'il faut penser ou ce qu'il faut faire tout le temps.
31825,Nous vivons dans une société où la publicité nous ,dit, ce qu'il faut penser ou ce qu'il faut faire tout le temps.
31830,"Notre joueur n'a pas été blessé, il s'en est ",tiré,.
31891,"Elle peut également être posée en barre ou en bande, voire en fasce ; la position normale pour le panneton est alors d’être tourné vers la pointe (dans la position où on ",introduit, la clef).
31892,"Ça me fait mal pour mon père, ça me ",fait, mal de l'avoir déçu.
31892,Ça me ,fait," mal pour mon père, ça me fait mal de l'avoir déçu."
31895,Pour parvenir à se ,faire," une place sur ce segment, elle met en avant la griffe BBC: son expérience unique de l'information internationale et surtout son indépendance éditoriale."
31935,"Quelle grandeur il faut au Général de Gaulle pour prendre aussitôt l`avion pour Londres, survolant la ville où sa mère se ",meurt,", sans nouvelles de sa femme et de ses enfants !"
31943,"L'équipe espagnole de Daniel Bellanger, dite """"la dream team"""", y ",côtoie," la banlieue sud d'Antonio Ferrara, mais aussi des Marseillais, des Perpignanais et des Corses."
31953,"Suite à l'accueil que notre offre a suscité, nous regrettons devoir vous ",informer," que les stocks promotionnels étant épuisés, nous ne pouvons plus maintenir notre offre de février."
31981,J'allais lui demander ce qu'elle en ,pensait, quand son portable a sonné.
31987,Dans les deux capitales où les pétrodollars ,servent," à cette guerre de proximité par procuration, on dresse des défenses, et on prépare le coup suivant."
31991,"Dynamique, rigoureux, polyvalent, vous êtes capable de travailler en équipe et de vous ",adapter, à des environnements variés.
32002,"La minorité, c'est l'impuissance à se ",servir, de sa raison sans être guidé par autrui.
32010,Je me suis ,installé," à New York, ville d'où est originaire ma compagne."
32035,Ce qui s'est passé à Indianapolis nous a tous ,secoué,.
32035,Ce qui s'est passé à Indianapolis nous a tous ,secoué,.
32038,Les détails en ont été ,publiés, mardi dans The Annals of Neurology.
32059,"L'organisme a aussi fait paraître un article """"Living Proof of a ",Vibrant," Culture"""" (""""La preuve vivante d'une culture dynamique"""")"""", dans l'édition européenne de Time du 14 janvier."
32060,Revenez à lendroit où vous avez ,trouvé, le Revolver et la deuxième clé du jardin.
32074,"Il s’y occupa de ses poèmes, reprit une tragédie déjà esquissée en 1574 sous le titre de Galeatto, roi de Norvège, et il l’",acheva, en l’intitulant Le Roi Torrismonde.
32096,"Et quand il ne postillonne pas sur l'accusé, Jack l'éventreur s'exhibe dans des shows télés où il ",expose," son cynisme et ne palabre que les seuls mots qu'il connaît """"not guilty"""" (non coupable)."
32114,Au motif que « la philosophie n'a plus sa place à l'UTBM Une université qui se targue d'ouvrir l'esprit de ses étudiants afin d'en ,faire, des cadres complets qui ne soient pas réduits à des machines intellectuellement productives.
32117,"Mais, à tous, du temps pour vous ",arrêter,.
32159,"Qui qu'il soit, il m'aime et m'",attend,.
32159,"Qui qu'il soit, il m'",aime, et m'attend.
32179,Relais de croissance significatif sur un segment de marché où Harvest est fortement ,implanté,", l'offre O2S est de plus très complémentaire de l'offre BIG et permet à Harvest de répondre encore mieux aux besoins de ses clients."
32201,Michel Chartrand a lui aussi ,pris," part à l'événement, au grand dam des syndicats représentant les travailleurs de Kruger sur la Côte-Nord."
32207,"Pour offrir un mouton à sa mère, pour la tabaski de cette année, il lui a ",fallu," emprunter de l'argent auprès d'un usurier, moyennant un profit de 25 pour cent."
32241,Jusqu'où ,pouvait, aller une mondialisation pensée comme un effacement des tempéraments historiques ?
32255,"Elle a eu l'air ravi :o) J'avais un gros coup de barre, malgré le coca et le café qu'elle m'a ",offert,", ce qui fait que ma conversation n'a pas du être aussi """"dynamique"""" que d'habitude."
32256,"Envoyé en résidence sur les côtes de Normandie au commencement de l'an IV, il y ",servit," jusqu'en l'an VII, fit les campagnes des ans VIII et IX à l'armée du Rhin et fut nommé capitaine en deuxième, le 13 frimaire an IX."
32288,"Alors, c'est le bon vieux ",sudden," death, comme disent les Anglais."
32299,DELIOT Cindy Monsieur ROSA nous a ,apporté, un autre témoignage.
32350,"Ne pouvant satisfaire leurs passions, ils jouissent de ceux qui s'y abandonnent et les y ",excitent,.
32350,"Ne pouvant satisfaire leurs passions, ils jouissent de ceux qui s'y ",abandonnent, et les y excitent.
32358,"Revenu au domicile de sa mère après 3 ans d'absence, il est enlevé dans la rue, jeté dans le coffre d'une voiture, entravé et conduit dans les Bouches-du-Rhône où il sera ",libéré, par le SRPJ.
32406,Il l'aurait contrainte à lui ,faire," une fellation, et l'aurait également agressée sexuellement, en recourant à la force, sous la forme de multiples gifles et coups de pieds."
32434,"Tout se passe comme si l'enfant """"s'",oubliait, délibérément.
32441,Un Général ne participe à une attaque que si plus de 6 régiments ont été lancés à l'attaque d'un territoire depuis le territoire où il se ,situe,.
32444,Sur la page Marlène Jobert le lien sur le film Les cigognes n'en ,font, qu'à leur tête apparaît rouge (=article à créer).
32448,L'inscription du cénotaphe nous ,dit," :""""De race noble, rayonnante de mérites, forte dans sa conduite, elle a brillé par sa foi sainte."
32465,"Ces modèles sont en général bien moins cher que les appareils des autres classes, mais leurs capacités en sont d'autant ",limitées,.
32466,"Absalom resta trois ans à Gueschur, où il était ",allé,", après avoir pris la fuite."
32486,Chase Palmer a ,écrit, la plus récente version du scénario.
32521,Mais j'ai bien peur qu'à trop y ,réfléchir,", je ne me mette à croire qu'il ne changera jamais..."
32546,"Cité dans ce livre, il y ",reconnaît," que """"l'histoire de la bombe à la communauté juive était conçue comme une action pro-palestinienne""""."
32569,"Non, ils seront sur ta session avec comme non si je me rappelle bien <tonID (1)>, <tonID(2)> etc. Note (pour le (1)et (2) je ne suis plus sur, peut-être qu'on peut mettre un vrai nom.Citation y'en a qui ont ",chargé, le jeu US sur PS3 Euro ?
32583,Il y ,attaque," très violemment le christianisme et se tourne vers le fascisme, dans une volonté de retrouver la grandeur romaine antique."
32589,"Mais quand le nombre d'ordinateurs personnels de type Mac et de type PC est assez semblable et qu'ils ne différent pas trop en terme de génération, dans les lieux où je suis ",passé,", les PC sont moins souvent utilisés."
32610,S'y ,ajoutent," un large panorama de la littérature francophone, africaine notamment, pour la jeunesse et un fonds spécialisé sur le conte[6]."
32643,"Quand ils tentent de l'enchaîner après une fuite ratée, elle """"se ",débat,"; quand un guérillero l'insulte, elle """"le secoue par le col""""."
32648,"Jamel, c'est un iceberg, et laissez-moi vous ",dire, qu'il est copieux.
32658,"Au dire d'Andrée Charpentier, des citoyens qui s'étaient farouchement ",opposés," à cette transformation, avaient à l'oeil cette première réception, sans plus."
32667,"Je ne veux pas me battre pour cela, du moins ce n'est pas ce qui me ",fait, avancer.
32669,Il faut aussi lui ,offrir, un son de bonne qualité car la chaîne HI-FI est devenue courante dans les foyers et rend exigeant.
32683,Mais Bordeaux semble le club le mieux ,placé," alors que le Président des Girondins, Jean-Louis Triaud, expliquait que la semaine pourrait être décisive et qu'il espérait que ses recrues seraient présentes le jour de la reprise fin juillet."
32696,Jean-Georges Henrotte nous ,livre, ici le témoignage d'un scientifique à la découverte de sa composante mystique.
32703,"S'il n'y a pas de peine de mort ni de condamnation à perpétuité en Espagne, le ministère public y ",requiert, souvent symboliquement de longues peines de prison dans les affaires de terrorisme.
32715,On n'en ,finirait, pas d'énumérer les entorses au droit et a la morale qui marquent cette détestable aventure militaire.
32732,"Pendant les années 1950 et 1960, il y ",eut," une vogue d'assister à des séances de cinéma en plein air, depuis une automobile, c'est ce qu'on appelle les drive-in."
32791,"Par ailleurs, notre modèle économique repose sur la variabilité de nos coûts, ce qui nous ",permet, d'être moins exposés à la saisonnalité et au cycle économique.
32795,"Les récentes nominations du directeur de la SNCF, du coordinateur des services de renseignement et du contrôleur général des prisons sont autant de cas où la compétence a ",primé, sur la loyauté politique.
32811,Son Parrain officialisa son identité et lui ,révéla, sa flamme.
32812,A en ,croire," le confrère de l'Indépendant citant les chiffres de Transparency International, en 2004, le Mali s'est classé 77ème sur 163 pays classés ; en 2005, 88ème sur 163 et en 2006, 99ème sur 163 pays classés."
32827,Sans parler des médias du pays où le Président «a ,reçu," la plus large couverture», mis à part certains journaux d'opposition, lesquels ont été les seuls à connaître des déboires pendant la campagne."
