sent_id,left_context,pivot,right_context
45086,"Aucune information n'a filtré sur les discussions que le diplomate nigérian a eues à Naypyidaw, la nouvelle capitale édifiée par la junte militaire birmane à quelque 400 km au nord de Rangoun où il s'est ",rendu, dès son arrivée.
45089,"Pour présenter sa principale caractéristique, il convient d'ailleurs de vous ",montrer," l'appareil non pas de face, mais de dos."
45095,Louis ne lui ont pas ,permis, de conclure dans un sens ou dans l'autre.
45100,Je m',attend," au pire, donc."
45134,"Je suis en pourparlers avec un producteur, toutefois je ne peux vous en ",dire, plus.
45141,"Mais, nous avons préféré ",opter," pour le week-end afin de permettre aux travailleurs d'être concernés par cette manifestation"""" ajoutera Mamoutou Kéita."
45157,C'est une des très rares professions où il n'y ,a, pas d'enjeu.
45171,"J'avais vu un reportage sur TF1 l'année dernière, c'est ce qui m'a ",décidé," à  venir"""", explique cette éducatrice de 56 ans."
45178,"Une hypothèse plus réaliste est le cas où un premier ministre, rapidement ",défait," aux Communes sur une question de confiance après la tenue d'élections, demanderait une seconde dissolution et la convocation d'élections anticipées."
45222,Cerdic est mentionné dans la Chronique anglo-saxonne où est ,précisé," le fait qu'il aborda à Cerdicesora, dans le Hampshire en 495 avec cinq navires."
45269,Le granite me ,marque,", je vis à son rythme minéral."
45285,Ce qui nous ,semble," le plus important est la capacité d'utiliser davantage de puissance de traitement"""", répond Niklas Zennström, directeur et créateur de Skype."
45297,C’est mal ,connaître, notre bon vieux championnat.
45306,Des modes de pensée et des dispositifs institutionnels neufs ,doivent," apparaître dès lors qu'il s'agira de concilier, sans confusion, des cadres explicatifs et des solutions qui étaient jusque maintenant tenus pour opposés ou contradictoires."
45349,Il y ,effectue," un rappel du long conflit entre Lagash et Umma, rappelant l'arbitrage de Mesalim, qui confirme qu'il est dans son bon droit, ainsi que la victoire d'Eannatum."
45385,"Comme c'est une fille qui s'assume, le fait de perdre sa virginité dans les bras d'un quasi inconnu ne lui a pas vraiment ",fait, avoir de remords.
45386,Un responsable de l'une de ces madrasas lui ,déclare," : «ce que les Américains font en Afghanistan ou en Irak, c'est un djihad..."
45391,Orange vous ,propose, des forfaits de 2 à 15 heures.
45425,Celles et ceux qui s'y ,intéresseront," après nous, n'occulteront peut-être plus l'un des faits saillants d'une bien triste histoire : l'exil intérieur de la pensée critique."
45426,Cela lui a ,pris, tellement de temps pour arriver jusqu'en haut que c'est déjà le mois de mai.
45454,"Et aussi les ateliers d'écriture auprès de jeunes en difficultés, et le jour où il leur a inventé le stage «Je crie et je frappe», juste avant d'en choper un manu poetica pour lui ",gueuler, au fond du cerveau : «mais je voudrais que vous viviez» .
45454,"Et aussi les ateliers d'écriture auprès de jeunes en difficultés, et le jour où il leur a ",inventé," le stage «Je crie et je frappe», juste avant d'en choper un manu poetica pour lui gueuler au fond du cerveau : «mais je voudrais que vous viviez» ."
45454,"Et aussi les ateliers d'écriture auprès de jeunes en difficultés, et le jour où il leur a ",inventé," le stage «Je crie et je frappe», juste avant d'en choper un manu poetica pour lui gueuler au fond du cerveau : «mais je voudrais que vous viviez» ."
45479,"Pas plus qu'elle ne manqua jamais de m'emmener avec elle, cherchant à me divertir et à me faire ",oublier," les torts du Prince... """" Malgré la bienveillance de la Reine à mon égard, on comprend que la vie au palais ne fut pas toujours gaie pour moi..."
45479,"Pas plus qu'elle ne manqua jamais de m'emmener avec elle, cherchant à me ",divertir," et à me faire oublier les torts du Prince... """" Malgré la bienveillance de la Reine à mon égard, on comprend que la vie au palais ne fut pas toujours gaie pour moi..."
45501,Simplement pour vous ,rendre, la vie encore plus confortable...
45518,L'objet du Syndicat et les objectifs que se ,donnent, les élus pour le Projet de territoire vont guider l'action intercommunale et le mode de fonctionnement du Syndicat et des communes.
45531,Celui-ci lui a d'ailleurs promis de se marier avec elle si elle réussissait à lui ,porter, un coup au moins une fois au visage (ce qui met Yuya en rogne lorsqu'elle l'apprend).
45531,Celui-ci lui ,a, d'ailleurs promis de se marier avec elle si elle réussissait à lui porter un coup au moins une fois au visage (ce qui met Yuya en rogne lorsqu'elle l'apprend).
45553,Lesly Malouda en aurait lui aussi ,terminé, avec sa saison puisqu'il est victime d'une contracture à la cuisse nécessitant plusieurs semaines d'arrêt.
45553,Lesly Malouda en aurait lui aussi ,terminé, avec sa saison puisqu'il est victime d'une contracture à la cuisse nécessitant plusieurs semaines d'arrêt.
45620,"Son concert, prévu au Forum de Fribourg le 27 février, ne lui ",rapportera," rien, et tous les bénéfices engrangés par la billetterie seront versés à des œuvres de bienfaisance."
45654,Pour faciliter le travail des robots l'administrateur peut leur ,proposer, des champs spécifiques qui regroupent les caractéristiques du document.
45680,"Hume fera de son mieux pour protéger le musicien de son sort funeste, lui ",épargnant," ainsi la noyade, un piège de Rousseau ainsi que d'être frappé par la foudre."
45694,"Il n'exige pas de toilettage et s'adapte parfaitement à une vie en intérieur, à condition de lui ",fournir, des distractions suffisantes et de l'attention.
45711,Incapable de dire précisément où il avait ,rencontré," le patient, il sortit de la chambre sans rien ajouter, laissant Candy avec Terry endormi."
45732,Les positions variaient peu jusqu'à l'entrée du dernier tournant où Guérillero ,passait," à l'offensive, mais les chevaux de tête redémarrèrent."
45740,L’amnistie de brumaire an VI lui ,permit, de revenir en France.
45743,"Une corde devra par ailleurs être réformée pour toute mise en contact avec des produits corrosifs (acide, base, solvants), et à plus fortes raisons s'il s'agit d'une substance dont on ne ",connaît, pas les propriétés.
45754,On lui ,impute, un grand nombre de blessés et de morts.
45755,"Réfugié en Belgique, où il a ",acquis," la nationalité belge, cet ex-officier de la garde présidentielle djiboutienne a mis directement en cause le président Ismaël Omar Guelleh dans l'enquête sur la mort du juge."
45784,Je vous ,conseille, de le garder en vie pour aider Adalon la Dragonne.
45791,"Le Canadien Craig Forrest et plusieurs membres actuels de l'équipe canadienne masculine de Coupe du monde tels que Julian de Guzman, Paul Stalteri, Atiba Hutchinson et Iain Hume y ont aussi ",participé, dans le passé.
45821,Il y ,voit, un signe que les Québécois réagissent favorablement au fédéralisme d'ouverture qu'il affirme offrir.
45851,Repas du soir : ils vous seront ,remboursés, selon le forfait suivant : 82F/repas - le même forfait sera appliqué si le restaurant universitaire est fermé.
45871,"Il emménage très jeune à Madrid, où il ",suit, les cours du Conservatoire.
45880,"Un centre composé de salles de sport, d'entraînement et de cabinets où toute personne, sportive de haut niveau ou non, ",pourraient, venir analyser son état physique.
45957,Acceptez de me ,recevoir,", votre jour et votre heure seront les miens...""""."
45968,"Tabu Ley a récemment représenté la République Démocratique du Congo (RDC) au Festival mondial de musique, organisé dans la ville cubaine de Varadero, où un trophée lui a été ",décerné, par les organisateurs pour l'ensemble de sa carrière.
45968,"Tabu Ley a récemment représenté la République Démocratique du Congo (RDC) au Festival mondial de musique, organisé dans la ville cubaine de Varadero, où un trophée lui a été ",décerné, par les organisateurs pour l'ensemble de sa carrière.
45988,"Le premier cul que mes lèvres et ma langue ont vraiment su savourer cet intrigant trou du cul et ses alentours finement peuplés de velours, c'était le cul d'un ",squatter, d'une autre ville.
45993,"D'autres groupes, tels que Test Department et Einstürzende Neubauten, ont pris ces nouveaux sons pour en ",créer, des compositions électroniques bruitistes.
46007,"La décision a donc été de se concentrer sur les autres jeux, tout en espérant pouvoir y ",revenir, un jour.
46075,"En hommage à son rival Clark, Hill déclare : « Je me ",sentais," de taille à battre n'importe qui aujourd'hui, peut-être même Clark »."
46088,"Le public a hué les notes attribuées par les juges à l'Américain Alexander Artemev, médaille de bronze à Aahrus, auteur d'une belle prestation à Stuttgart où il a ",terminé," à la 6e place avec 15,175 pts."
46096,Il ne nous ,restait, plus qu'à exercer nos talents à l'aide de la boîte de Pastels à l'huile...
46105,On y ,cultivait," le blé, les légumes et des plantes médicinales."
46113,Pour m',entraîner," au Marathon de New York j'ai décidé de tondre ma pelouse en courant :-o 10/04/2001  Pour les amoureux de Mame, allez voir dans les liens les nouveaux sites pour trouver les dernières ROMS (merci à The QuarTz)."
46164,Cela me ,paraît," raisonnable et de nature à éviter certains à-coups si les gouvernements, constatant que cette politique de maîtrise n'est pas toujours au rendez-vous, devaient être amenés à prendre des mesures tarifaires"""", a-t-il ajouté sobrement."
46176,"Derrière, les quatre équipes françaises ont ",fait, bloc pour résister.
46202,"Donc, dans mon esprit, c'était comme d'habitude ; quand ils ont des problèmes ils me ",consultent,.
46266,D'où cet inconfort - Christian Morel parle de blues - face à ces objets pourtant censés nous ,faciliter, la vie.
46272,"Doté d'un excellent relationnel et d'une grande combativité, votre aptitude à analyser les problèmes et votre sens de l'organisation vous permettent de vous ",adapter, rapidement à un milieu multiculturel.
46272,"Doté d'un excellent relationnel et d'une grande combativité, votre aptitude à analyser les problèmes et votre sens de l'organisation vous ",permettent, de vous adapter rapidement à un milieu multiculturel.
46291,Dans les peu de semaines qui lui ,restent,", il compose deux phrases d'une sérénade."
46333,"· Le tabac Vous êtes dans un lieu public et, conformément à la loi, nous vous ",rappelons," l'interdiction absolue de fumer, en particulier dans votre chambre."
46342,"Identification est le thème unificateur de cette exposition où chacun des sept artistes, dans le temps de sa résidence, a ",réfléchi," à l'image qu'il porte sur son pays, son identité."
46380,"Si la construction et surtout les services ont créé des emplois, l'industrie en a encore ",détruit,.
46416,"Ces romans ont le plus souvent pour cadre ce que Paul Bourget nomme « le monde », c'est-à-dire la noblesse ou la grande bourgeoisie, dont il ",décrit, les mœurs et les travers.
46421,"A l'époque, si je me souviens bien, je décrivais le monde comme un théâtre où auraient ",dansé,", au bal macabre des pulsions, des théories de cadavres."
46468,"Il est donc prévisible que des formes d'interprétation """"canoniques"""" (d'autant plus structurantes qu'elles demeurent inconscientes) y ",prévalent,.
46472,"La mise en oeuvre du Plan mondial dans 84 pays coûterait US $3,1 milliards en 2007, soit 1,1 milliard de plus que ce dont on ",dispose,.
46502,"Lorsque le dossier n'est pas retenu en première lecture, il est systématiquement remonté à la DRH, qui va soit le transmettre à d'autre entités de CSO Informatique soit vous ",répondre, par courrier.
46502,"Lorsque le dossier n'est pas retenu en première lecture, il est systématiquement remonté à la DRH, qui va soit le transmettre à d'autre entités de CSO Informatique soit vous ",répondre, par courrier.
46517,"Ce printemps, elle a présenté une nouvelle échelle d'alerte épidémique, où la situation créée par la progression de l'épizootie était ",rangée, en phase 3 (sur 6): transmission d'homme à homme très limitée ou inexistante.
46543,"Souvent, au cours des années où elle avait ",travaillé," comme infirmière, elle avait déploré le peu de cas que l'on portait aux enfants malades, que l'on mélangeait aux adultes, sans se préoccuper de leur détresse physique mais surtout morale."
46562,Le site Internet du championnat allemand explique qu'il lui aurait ,fallu," trois points de plus pour qu'il remporte le titre, mais que l'athlète des Laurentides obtient la meilleure note pour la saison qu'il a connue."
46582,Où s',arrête, la frontière entre le désespoir et la maladie mentale?
46591,Elle y ,rend, l'âme le 25 juillet 2007.
46610,"«Je préfère jouer Lyon champion de France, plutôt que d'affronter un mal classé comme cela nous est ",arrivé, dernièrement.
46615,Ce processus dure habituellement plusieurs heures à partir du moment où la tique se fixe sur sa proie et commence à s’,alimenter, avant que les rickettsies soient transmises à l’hôte.
46615,Ce processus dure habituellement plusieurs heures à partir du moment où la tique se ,fixe, sur sa proie et commence à s’alimenter avant que les rickettsies soient transmises à l’hôte.
46619,Je voudrais essayer de développer ce qui me ,semble," positif et ce qui, effectivement, a été négatif."
46621,"Pour son dernier long-métrage, Patrice Leconte a entièrement fait confiance à son scénariste en lui ",promettant, de tourner le film avant même d'en avoir rien lu.
46642,Qu'Eliphas Levi ait fait des rêves ne m',étonne," pas, et je ne pense pas qu'il soit besoin de sources pour le démontrer."
46657,Il me ,semble," que nous devrions parvenir dans les 48 heures à avancer sur cette question"""", a-t-il ajouté."
46666,"Sur le trajet, on menace la reine, lui montrant une corde et lui ",promettant, un réverbère de la capitale pour la pendre.
46670,"L'exploration des sites LOCARESO et LOGEMENT.ORG permet au candidat locataire de rassembler une moisson d'informations qui orienteront ses recherches, éclaireront ses choix et lui ",feront, gagner beaucoup de temps.
46672,De simple lecteur qui n'y ,connais," rien en zoologie, ça fait bizarre."
46720,Trois restaient planter là à me regarder tandis que les 5 autres essayaient de faire le maximum pour m',asseoir,.
46720,Trois restaient planter là à me ,regarder, tandis que les 5 autres essayaient de faire le maximum pour m'asseoir.
46734,Ce n'est cependant pas le lieu d'en ,donner, une discussion ou une compréhension plus élaborée.
46746,"Ici, en l'occurrence, l'article apporte peu de nouveauté puisque l'on y ",reprend," les processus de culture, plantation, récolte, et les différents stades de fabrication du cigare."
46763,Pour savoir où vous vous ,trouvez, :
46793,"Les bureaux de poste, souvent mal équipés, ne servent pas bien les citoyens des quartiers populaires où ils sont ",implantés,.
46807,"Je ne parle pas des générations de produits, à vrai ",dire,", mais des modifications successives concernant l'utilisation de ces baladeurs (en excluant donc les changements de forme, par exemple)."
46825,"Perçue depuis l'effondrement de l'URSS comme le """"ventre mou"""" de l'espace post-soviétique, l'Asie centrale est une région disputée entre la Russie et les Etats-Unis, qui y ont ",déployé," leurs troupes, notamment depuis la guerre en Afghanistan en 2001."
46830,"«Pour y arriver, nous devons nous ",comprendre, des deux côtés.
46830,«Pour y ,arriver,", nous devons nous comprendre des deux côtés."
46854,Les visiteurs y ,découvriront," des performances, des oeuvres interactives, des installations d'art contemporain comme une maquette géante que les enfants, en particulier, pourront manipuler."
46857,"Pour la Cosatu, principale centrale syndicale, les autorités portent une part de responsabilité dans la mesure où elles ne sont pas ",parvenues, à contribuer à la résolution de la crise qui fait rage au Zimbabwe.
46871,"La géographie ou l'histoire n'offrent pas de définition satisfaisante de l'Europe des Européens, seule la sociologie serait susceptible d'y ",parvenir,.
46907,Qu'est-ce que ,fait, un portugais avec ta femme dans ton lit?
46909,On ne peut pas leur en ,vouloir," de leurs propos, c'est normal qu'ils soient déçus."
46927,"Dans les deux cas, il vous sera ",demandé," : le numéro de la carte assurée et sa date d'échéance, le nom du titulaire de la carte, le nom des personnes bénéficiaires de cette attestation, le pays et les dates de séjour."
46959,Il compte y ,remédier, avec l'accord noué en novembre avec la société espagnole RBA.
46980,"Parceque nous trouvons indigne certaines lois de certains pays, nous ne nous ",contenterions," pas d' aide, mais nous les obligerions par le fait à se placer sous le coup d' une autre loi ?"
46986,Céline Dion y ,figure, au septième rang.
47019,Mais il lui ,prit, la main et la suivit.
47048,Leur gérante en avait toutefois ,fait, la demande.
47064,Les amateurs de corridas ne peuvent évidemment que se ,poser, des questions quant au scandale que font les « antis » à ce sujet.
47087,"Arens travaillera également dans l’agence de publicité d’Earnest Elmo Calkins, où il ",commence, une carrière de designer industriel en créant un département de stylisme.
47123,Bénéficiaires : Toutes les associations du département ,oeuvrant, auprès des bénéficiaires du RMI.
47168,"Ainsi une statue d'Éros d'après Lysippe est-elle exposée face au dessin qu'en fit l'artiste et au vase de Sèvres célébrant l'entrée à Paris des oeuvres d'art réquisitionnées par Bonaparte en Italie, où ",figure, ce même Éros.
47169,Les questions fréquemment posées au sujet des CD-ROMs y ,trouvent," une réponse, et des références sont données concernant d'autres sources d'informations relatives à la technologie et aux applications liées au CD-ROM."
47184,On lui ,attribut,", sans preuve historique, la construction de plusieurs palais dans la vallée du Jourdain et dans le désert jordanien, sans doute des résidences de divertissement et de chasse."
47199,"Il rejoindrait ainsi son ancien coéquipier Fabrice Fiorèse, lui aussi ",prêté, par le club phocéen.
47240,Le roi lui accorde en la matière les pleins pouvoirs et lui ,laisse, son anneau (le sceau apposé sur les décrets).
47240,Le roi lui ,accorde, en la matière les pleins pouvoirs et lui laisse son anneau (le sceau apposé sur les décrets).
47266,"Troquer son contrat de travail actuel contre le futur contrat unique, dont ",rêve," Nicolas Sarkozy ?""""..."
47273,"Yann (Guichard, son routeur) a téléphoné à plusieurs reprises, il n'est pas parvenu à me ",réveiller,", a raconté Lemonchois."
47282,Les 7 premières manifestations que nous vous ,présentons," ici, sous forme de reportages, constituent un premier essai de devoir de mémoire, que nous souhaitons pouvoir poursuivre pour d'autres de ces fêtes populaires et traditionnelles."
47305,Et pour peu que votre faciès ne lui ,convient," pas, adieu veaux, vaches, cochons et couvées."
47404,La proposition vise à persuader l'Iran de suspendre son enrichissement d'uranium et à imposer d'eventuelles sanctions si l'Iran choisissait de ne s'y ,conformer, pas.
47421,"Cela ne ferait que jeter de l'huile sur le feu s'il continuait à prêcher dans l'intervalle"""", a indiqué Abdul El Ayoubi, un des responsables de l'Association des musulmans libanais chargée d'administrer la mosquée de Sydney, où ",exerce, le mufti.
47454,Or l'information qui nous ,intéresse, est le code erreur précédant l'erreur 163 (celui-ci nous indique seulement que la réorganisation a échoué) et le nom du fichier précisé en bas de l'écran.
47466,"En effet, très rapidement, il nous est ",apparu, primordial d'accompagner nos clients dans leur apprentissage de l'internet en leur faisant profiter de la veille technologique que nous effectuons continuellement.
47469,"Si vous n'avez pas effectué les modifications obligatoires concernant votre logiciel de messagerie, veuillez rapidement vous ",rapprocher, de votre responsable informatique.
47471,"Dix minutes après leur arrivée sur place, grâce à mon ARVA, il m'avaient ",localisée, et dégagée.
47476,"Bref, si vous êtes un mélomane dans l'âme, n'hésitez à vous ",faire," du bien, c'est gratuit, et ça ne fait de mal à personne."
47482,"En cas de consultation par écrit, ce rapport est adressé aux associés avec le projet de résolution qui leur est ",soumis,.
47491,"Repas anniversaire du 16 juin Cette année est l'occasion de la célébration de trois événements : les 10 ans de l'ENIC, le 1000ème diplômé et la traditionnelle ",remise, des diplômes 2000.
47524,Je vous ,laisse, débattre pour savoir si c'en est vraiment un ou pas.
47537,C'est le seul domaine où Gaël n'est pas encore ,réglé, depuis le début de la partie.
47548,"A propos du travail scolaire, Lucien me ",dira,": """"Moi, ça rentre, ça sort."""""
47593,Mais il aurait l'avantage de départager ceux qui acceptent de communiquer sur leur exposition au risque subprime et ceux qui s'y ,refusent,.
47595,"Mais tout le bout sur la dépendance aux pilules, quand on voit où ça ",peut, nous mener est vraiment terrible ...
47614,Je ne savais plus quoi lui ,donner,.
47660,"Jean-Michel Aphatie : Seriez-vous prête, s'il était candidat, à vous ",effacer, devant Lionel Jospin ?
47665,Ce slide provient directement de SUN et lui a été ,fourni, par Intel.
47694,"Vers la fin de la manifestation, Yitzhak Rabin avait été tué par les tirs d'un extrémiste nationaliste juif lui ",reprochant, sa volonté d'échanger les territoires contre la paix avec les Palestiniens.
47695,"Tom Horn, un tueur professionnel et travaillant avec l’agence Pinkerton (une agence privée de protection et de détectives) en fut informé par l’expert en explosifs Bill Speck lorsqu’il lui ",révéla, que les deux hommes avaient tué Hazen.
47697,"Cycle 3 : les choix peuvent amener l'enfant à réfléchir, se poser des questions et tenter d'y ",répondre, mais peuvent totalement être détournés de leurs fonctions.
47697,"Cycle 3 : les choix peuvent amener l'enfant à réfléchir, se ",poser, des questions et tenter d'y répondre mais peuvent totalement être détournés de leurs fonctions.
47702,Il en ,composera," la bande originale avec les titres Le Vin, Au bois de mon cœur et L'Amandier."
47713,Je vais faire une analyse de sang en Belgique cette semaine parce que l'équipe travaille dur et je n'arrive pas à leur ,donner," les résultats""""."
47732,Cela fait plusieurs années qu'ils nous ,soutiennent, et ce soir ils sont récompensés.
47751,"Las Vegas 19 août 1974 Opening show Mauvais son et incomplet, manquent """"I'm leavin' """", """"Softly, as I leave you"""", """"Love me ",tender,", """"Polk salad Annie"""", et les présentations des musiciens."
47757,Quand l'administration pénitentiaire y ,déroge," en plaçant «2 ou 3 détenus par cellule», elle doit «s'assurer que la promiscuité des détenus ne génère pas de risques pour leur intégrité physique, sexuelle ou morale», écrivent-ils."
47811,"Il fut un temps, se souvient-elle, où les communes ",devaient," s'acquitter, de-ci de-là, d'une prime de base impayée."
47815,A peine Willow ferme les yeux que Anya lui ,demande, si elle a commencé.
47834,"Ce film, les évêques reconnaissaient, certes, qu'ils ne l'avaient pas ",vu,.
47841,Les autres seront donc obligés de me ,dépasser,.
47846,Intéressant lorsque vous êtes déjà équipé en télé et que les appels gratuits et illimités entre Membres vous ,suffisent,.
47848,Il faut savoir que cette baisse a le potentiel de doper les profits des entreprises et rend les actions plus attrayantes que les obligations comme en ont ,témoigné, les hausses sur les grandes places boursières suite à cette annonce.
47856,Pour en ,savoir," plus sur les services spécifiques de Brenntag Normandie, contactez :"
47885,"Le premier pulp avéré est la version modifiée du magazine Argosy de Frank Munsey, afin d'en réduire le coût de fabrication et d'en ",permettre, une plus grande distribution.
47885,"Le premier pulp avéré est la version modifiée du magazine Argosy de Frank Munsey, afin d'en ",réduire, le coût de fabrication et d'en permettre une plus grande distribution.
47891,Il lui ,donne, désormais une assise réglementaire qui permet de généraliser et de lever les incertitudes ou ambiguïtés qui ont pu l'entraver jusqu'à présent.
47897,"L'utilisation des samples et du piano est très importante dans ce morceau, ce qui peut lui ",donner, des allures plus électroniques.
47903,"Conséquente, la CRA renonce par contre à se prononcer sur les risques encourus en raison d'actes d'espionnage auxquels elle ne ",croit, pas.
47929,Il est inutile de vous ,dire," que pour moi, fan inconditionnel la fierté était colossale."
47936,"Le prix du baril de """"light sweet crude"""" pour livraison en novembre chutait de 3,74 dollars à 82,85 dollars le baril après avoir déjà perdu 2,36 dollars jeudi à New York où il a ",clôturé," à 86,59 dollars."
48001,"Les Français, s'ils ont voulu donner une majorité au Président élu le 6 mai, n'ont pas voulu lui ",accorder, les pleins pouvoirs.
48007,Or ce système n'était pas installé sur le tronçon où la rame a ,pris, une vitesse incontrôlable avant de dérailler.
48016,Seriez-vous plus motivés par le projet d'une réussite personnelle ou par le succès de l'entreprise qui vous ,emploierait,?
