,sent_id,left_context,pivot,right_context,ID,FORM,LEMMA,UPOS,XPOS,FEATS,HEAD,DEPREL,DEPS,MISC
2366,fr-ud-train_11806,"C'est une excellente idée mais, ",ayant," peur des motos, je pense que je choisirai toujours la voiture. ",8,ayant,avoir,VERB,_,Tense=Pres|VerbForm=Part,15,advcl,_,Subject=Instantiated
2368,fr-ud-train_11817,Les contacts entre AK et la ŻOB (organisation juive de combat) ,existaient, déjà. ,14,existaient,exister,VERB,_,Mood=Ind|Number=Plur|Person=3|Tense=Imp|VerbForm=Fin,0,root,_,_
2375,fr-ud-train_11842,"Noel Murray, du site A.V. Club, affirme avoir « apprécié beaucoup d'éléments » de l'épisode, notamment « l'idée qu'on puisse se débarrasser aisément de beaucoup de choses qui régissent une société », regrettant seulement que le comportement des adultes implique que les adolescents « ne ",pensent, jamais clairement ». ,56,pensent,penser,VERB,_,Mood=Ind|Number=Plur|Person=3|Tense=Pres|VerbForm=Fin,50,ccomp,_,_
2376,fr-ud-train_11856,"Norcesto révèle alors que son père est le véritable meurtrier du père d'Edemondo, et produit comme preuve les aveux écrits que son père lui a remis juste avant de ",mourir,. ,33,mourir,mourir,VERB,_,VerbForm=Inf,31,xcomp,_,SpaceAfter=No|Subject=SubjRaising
2378,fr-ud-train_11865,"Parmi les cent Pokémon les plus populaires d'IGN, Ectoplasma arrive le 17e, il est dit comme un « pilier, pure et simple » car c'est un des premier Pokémon qu'on échange pour le faire ",évoluer,", Spectrum se place 56 et est décrit comme « assez cool » et Fantominus ferme le classement en prenant la centième et dernière position, il a ainsi l'« honneur d'être le premier Pokémon de type spectre ». ",42,évoluer,évoluer,VERB,_,VerbForm=Inf,38,advcl,_,SpaceAfter=No|Subject=ObjRaising
2383,fr-ud-train_11882,Elle est fortement diffusée à ,partir," du XIIe siècle, car la présence d'un saint patron bien particulier à l'Écosse est utilisé politiquement pour justifier l'indépendance de l'église écossaise, menacée de dépendre de l'archevêché d'York. ",6,partir,partir,VERB,_,VerbForm=Inf,5,fixed,_,InIdiom=Yes
2386,fr-ud-train_11903,Il en a toujours ,été, ainsi ! ,5,été,être,VERB,_,Gender=Masc|Number=Sing|Tense=Past|VerbForm=Part|Voice=Act,0,root,_,_
2390,fr-ud-train_11911,"Il a vécu 28 ans en Belgique, et il a même fait ici le service militaire """", a ",déclaré, sa soeur Farida citée par l'agence Belga. ,21,déclaré,déclarer,VERB,_,Gender=Masc|Number=Sing|Tense=Past|VerbForm=Part|Voice=Act,3,parataxis:insert,_,_
2392,fr-ud-train_11922,Les collections étaient présentées dans l'usine construite à Saint-Denis à ,partir, de 1875 entre le canal Saint-Denis et la voie ferrée. ,12,partir,partir,VERB,_,VerbForm=Inf,11,fixed,_,InIdiom=Yes
2393,fr-ud-train_11931,"Nous nous attendons à ce que la République du Soudan du Sud nous rejoigne en tant que membre des Nations unies et travaille étroitement avec ses représentants, a-t-il ",ajouté,. ,34,ajouté,ajouter,VERB,_,Gender=Masc|Number=Sing|Tense=Past|VerbForm=Part|Voice=Act,3,parataxis:insert,_,SpaceAfter=No
2397,fr-ud-train_11945,"La chute du dollar a entraîné une légère baisse du coût de la vie dans la plupart des villes d'Amérique du Nord"""", ",explique, ECA. ,31,explique,expliquer,VERB,_,Mood=Ind|Number=Sing|Person=3|Tense=Pres|VerbForm=Fin,8,parataxis:insert,_,_
2399,fr-ud-train_11951,L'asphodèle ramifié est une plante assez facile à ,identifier,", mais que les auteurs ont souvent confondue soit avec Asphodelus albus, soit surtout avec Asphodelus cerasiferus. ",10,identifier,identifier,VERB,_,VerbForm=Inf,8,ccomp,_,SpaceAfter=No|Subject=Generic
2401,fr-ud-train_11953,Chacun a un rôle à ,jouer,. ,6,jouer,jouer,VERB,_,VerbForm=Inf,4,acl,_,SpaceAfter=No|Subject=Instantiated
2404,fr-ud-train_11964,"J'instruis par exemple un dossier, pour un monsieur qui a 62 ans et qui n'a pas assez de sa retraite pour ",vivre,. ,25,vivre,vivre,VERB,_,VerbForm=Inf,18,advcl,_,SpaceAfter=No|Subject=SubjRaising
2405,fr-ud-train_11966,"En 1970, Matiyasevic montra qu'il était impossible qu'un tel algorithme ",existe,. ,14,existe,exister,VERB,_,Mood=Sub|Number=Sing|Person=3|Tense=Pres|VerbForm=Fin,9,csubj,_,SpaceAfter=No
2407,fr-ud-train_11979,Nous effectuons des démonstrations pour que le public ,sache, comment on travaillait le bois autrefois avec le débardage. ,9,sache,savoir,VERB,_,Mood=Sub|Number=Sing|Person=3|Tense=Pres|VerbForm=Fin,4,acl,_,_
2410,fr-ud-train_11983,"La polémique n'est pas close : ainsi, dans Nineteeth-Century Religion and Literature, An Introduction, publié en 2006, Mark Knight et Emma Mason s'attachent à montrer que la description de Mr Brocklehurst est « partiale et incomplète », et que ses propos sont « volontairement » amputés de toute référence à la rédemption des péchés qui, ",écrivent,"-ils, est « inhérente à la foi évangélique ». ",65,écrivent,écrire,VERB,_,Mood=Ind|Number=Plur|Person=3|Tense=Pres|VerbForm=Fin,70,parataxis:insert,_,SpaceAfter=No
2413,fr-ud-train_12007,Il ,reprend, et retravaille son texte qui est finalement accepté au printemps 1937 ; ,2,reprend,reprendre,VERB,_,Mood=Ind|Number=Sing|Person=3|Tense=Pres|VerbForm=Fin,0,root,_,_
2414,fr-ud-train_12012,"La eBox sera dans un deuxième temps commercialisée dans d'autres pays de la région Asie-Pacifique puis ailleurs dans le monde, ",précise, le fabricant qui n'a pas rendu public le montant de son investissement dans le nouveau produit. ,23,précise,préciser,VERB,_,Mood=Ind|Number=Sing|Person=3|Tense=Pres|VerbForm=Fin,8,parataxis:insert,_,_
2416,fr-ud-train_12017,"Or, Lacroix, fortement influencé par Marcel Aubut, ",dit,"-on, laisse tomber son ami Bergeron et porte finalement son choix sur l'entraîneur-chef du club-école des Nordiques, Marc Crawford. ",11,dit,dire,VERB,_,Mood=Ind|Number=Sing|Person=3|Tense=Pres|VerbForm=Fin,6,parataxis:insert,_,SpaceAfter=No
2418,fr-ud-train_12019,Les oncles ,ont," donc le droit d'épouser leur nièce, dans le silence du texte ou à l'alliance de la femme, ou au fait qu'elle allaite.. Rien n'est jusqu'ici donc dit de l'époux, en revanche (art. 24, v. cep. art 30 infra). ",3,ont,avoir,VERB,_,Mood=Ind|Number=Plur|Person=3|Tense=Pres|VerbForm=Fin,0,root,_,_
2419,fr-ud-train_12027," Je défends le mouvement associatif parce qu'il est très riche, à Gonfreville l'Orcher, ",explique, Serge Le Bret. ,19,explique,expliquer,VERB,_,Mood=Ind|Number=Sing|Person=3|Tense=Pres|VerbForm=Fin,3,parataxis:insert,_,_
2420,fr-ud-train_12031,Cinquième visite pastorale en 1886 : c'est lors de ce voyage qu'il ,meurt,", assassiné par un déséquilibré (son domestique ?) ",15,meurt,mourir,VERB,_,Mood=Ind|Number=Sing|Person=3|Tense=Pres|VerbForm=Fin,9,advcl:cleft,_,SpaceAfter=No
2428,fr-ud-train_12096,"Il était d'ailleurs offert avec les toutes premières platines CD à avoir été commercialisées, vendues au Japon à ",partir, du 1 octobre 1982. ,22,partir,partir,VERB,_,VerbForm=Inf,21,fixed,_,InIdiom=Yes
2432,fr-ud-train_12112,Ceux qui n'avaient pas réservé la tablette ne devaient y avoir accès à ,partir, de 15H00 samedi après-midi. ,15,partir,partir,VERB,_,VerbForm=Inf,14,fixed,_,InIdiom=Yes
2433,fr-ud-train_12112,Ceux qui n'avaient pas réservé la tablette ne devaient y ,avoir, accès à partir de 15H00 samedi après-midi. ,12,avoir,avoir,VERB,_,VerbForm=Inf,10,xcomp,_,Subject=SubjRaising
2438,fr-ud-train_12129,À ,partir," de 2001 ce poste est occupé par Vasile Panciuc qui a été réélu à trois reprises : en 2003--lors des élections anticipées (à cause de la réforme territoriale et administrative), en 2007 et en 2011. ",2,partir,partir,VERB,_,VerbForm=Inf,1,fixed,_,InIdiom=Yes
2444,fr-ud-train_12149,À vrai ,dire,", peu se soucient des colonies à l'intérieur du territoire français, et l'on ne manqua pas de se demander sérieusement « À quoi bon les colonies ? ",3,dire,dire,VERB,_,VerbForm=Inf,1,fixed,_,InIdiom=Yes|SpaceAfter=No
2445,fr-ud-train_12158,Il y éprouve plus de mal à s'imposer et à ,marquer,. ,12,marquer,marquer,VERB,_,VerbForm=Inf,9,conj,_,SpaceAfter=No|Subject=SubjRaising
2447,fr-ud-train_12180,Ceci a pour conséquence immédiate d'organiser une grande réunion de tous les seigneurs des Marches pour discuter de ce qu'il convient de ,faire,. ,26,faire,faire,VERB,_,VerbForm=Inf,24,csubj,_,SpaceAfter=No|Subject=Generic
2456,fr-ud-train_12210,N',attendez, pas ! ,2,attendez,attendre,VERB,_,Mood=Imp|Number=Plur|Person=2|Tense=Pres|VerbForm=Fin,0,root,_,_
2459,fr-ud-train_12225,Il est pénitencier majeur en 1961-1962 et préfet de la Congrégation des rites et président de la Commission pontificale pour la liturgie sacrée à ,partir, de 1962. ,26,partir,partir,VERB,_,VerbForm=Inf,25,fixed,_,InIdiom=Yes
2472,fr-ud-train_12302,Le magma ,restant, est forcé de cristalliser très vite dans les espaces créés par l'extension. ,3,restant,rester,VERB,_,Tense=Pres|VerbForm=Part,2,acl,_,_
2475,fr-ud-train_12343,"Neuf touristes et six membres d'équipage ont pu être sauvés, a-t-il ",ajouté, en précisant que les deux victimes vietnamiennes étaient un touriste et un interprète qui accompagnait les étrangers. ,15,ajouté,ajouter,VERB,_,Gender=Masc|Number=Sing|Tense=Past|VerbForm=Part|Voice=Act,9,parataxis:insert,_,_
2479,fr-ud-train_12355,"Elle fut transformée à partir de 1809 avec la construction d'un moulin à blé, acheté ensuite par la ville et aménagé en station de pompage à ",partir, de 1838. ,5,partir,partir,VERB,_,VerbForm=Inf,4,fixed,_,InIdiom=Yes
2480,fr-ud-train_12355,Elle fut transformée à ,partir," de 1809 avec la construction d'un moulin à blé, acheté ensuite par la ville et aménagé en station de pompage à partir de 1838. ",5,partir,partir,VERB,_,VerbForm=Inf,4,fixed,_,InIdiom=Yes
2482,fr-ud-train_12401,A ,éviter,", même à Paris on trouve mieux pour bien moins cher. ",2,éviter,éviter,VERB,_,VerbForm=Inf,0,root,_,SpaceAfter=No|Subject=Generic
2483,fr-ud-train_12403,"Cette solution nécessite une entente parfaite entre les copropriétaires mais l'expérience montre que des conflits, qu'ils soient d'ordre financier ou liés à l'exploitation et à la disponibilité de l'avion, ",arrivent, inévitablement tôt ou tard. ,37,arrivent,arriver,VERB,_,Mood=Ind|Number=Plur|Person=3|Tense=Pres|VerbForm=Fin,13,ccomp,_,_
2487,fr-ud-train_12419,"L'étude des couches de terrain superposées donne leurs âges relatifs, à ",savoir," leur ordre chronologique, mais pas leurs durées ou leur ancienneté par rapport au temps présent--en dehors d'estimations grossières qui supposent d'ailleurs, entre autres, une vitesse de formation constante. ",15,savoir,savoir,VERB,_,VerbForm=Inf,14,fixed,_,InIdiom=Yes
2489,fr-ud-train_12421,En fait c'est bien le Maroc qui est et qui ,reste, le grand perdant. ,12,reste,rester,VERB,_,Mood=Ind|Number=Sing|Person=3|Tense=Pres|VerbForm=Fin,9,conj,_,_
2493,fr-ud-train_12437,"« Le peuple va encore se soulever, a-t-il ",dit,. ,11,dit,dire,VERB,_,Gender=Masc|Number=Sing|Tense=Past|VerbForm=Part|Voice=Act,4,parataxis:insert,_,SpaceAfter=No
2495,fr-ud-train_12442,Les plats commandés sont ,arrivés," rapidement et les portions étaient très généreuses, ",5,arrivés,arriver,VERB,_,Gender=Masc|Number=Plur|Tense=Past|VerbForm=Part|Voice=Act,0,root,_,_
2498,fr-ud-train_12449,"Elle peut par exemple menacer un groupe bancaire de lui retirer sa licence s'il refuse d'échanger des données à sa demande, ",explique, l'économiste Gabriel Zucman. ,25,explique,expliquer,VERB,_,Mood=Ind|Number=Sing|Person=3|Tense=Pres|VerbForm=Fin,2,parataxis:insert,_,_
2499,fr-ud-train_12450,L'âge d'or du groupe ,prend," vite fin puisque c'est fin 1959 que Ben E. King décide de lancer sa carrière solo, laissant les Drifters une nouvelle fois sans meneur. ",8,prend,prendre,VERB,_,Mood=Ind|Number=Sing|Person=3|Tense=Pres|VerbForm=Fin,0,root,_,_
2500,fr-ud-train_12458,"« C'est un début, a ",déclaré, M. Bertrand. ,8,déclaré,déclarer,VERB,_,Gender=Masc|Number=Sing|Tense=Past|VerbForm=Part|Voice=Act,5,parataxis:insert,_,_
2521,fr-ud-train_12540,Le dernier développement--Le Domaine des Étoiles--a lieu à l'ouest et comprend environ 47 résidences à ,partir, de 1995. ,22,partir,partir,VERB,_,VerbForm=Inf,21,fixed,_,InIdiom=Yes
2522,fr-ud-train_12541,"Comme leur nom l'indique, ces composants n'",ont, pas besoin d'être remplacés après déclenchement : ils reviennent spontanément à l'état initial (conducteur) après la suppression ou la disparition du défaut. ,10,ont,avoir,VERB,_,Mood=Ind|Number=Plur|Person=3|Tense=Pres|VerbForm=Fin,0,root,_,_
2525,fr-ud-train_12570,"L'avènement dans le Nord de la Chine, particulièrement à ",partir," du IVe siècle, de royaumes dits dynasties du Nord fondés par des non-Hans ou d'anciens Hans « barbarisés », moins attachés au confucianisme ou au taoïsme que les royaumes du Sud, donna à des moines l'occasion de devenir conseillers -voire magiciens- au service des souverains, parfois considérés comme des bodhisattvas. ",12,partir,partir,VERB,_,VerbForm=Inf,11,fixed,_,InIdiom=Yes
2526,fr-ud-train_12574,"On le disait peu, car c'était des amis de l'Occident qui étaient au pouvoir, mais au Caire on se faisait arrêter pour n'",importe," quoi, même sans raison, et on était torturé dans un commissariat. ",30,importe,importer,VERB,_,Mood=Ind|Number=Sing|Person=3|Tense=Pres|VerbForm=Fin,29,fixed,_,InIdiom=Yes
2537,fr-ud-train_12629,"Il est donc interdit de le détruire, le mutiler, le capturer ou l'enlever, de le perturber intentionnellement ou de le naturaliser, ainsi que de détruire ou enlever les œufs et les nids, et de ",détruire,", altérer ou dégrader son milieu. ",7,détruire,détruire,VERB,_,VerbForm=Inf,4,csubj:pass,_,SpaceAfter=No|Subject=Generic
2541,fr-ud-train_12631,Le Desktop Management Interface (DMI) fournit un framework logiciel standard afin de gérer et de ,suivre," les modifications de composants sur un ordinateur, qu'il soit un ordinateur portable, un ordinateur de bureau, ou un serveur. ",18,suivre,suivre,VERB,_,VerbForm=Inf,15,conj,_,Subject=Generic
2543,fr-ud-train_12648,"Et plutôt que de tourner autour du côté droit, ils ",tournent, autour du côté gauche. ,13,tournent,tourner,VERB,_,Mood=Ind|Number=Plur|Person=3|Tense=Pres|VerbForm=Fin,0,root,_,_
2544,fr-ud-train_12648,Et plutôt que de ,tourner," autour du côté droit, ils tournent autour du côté gauche. ",5,tourner,tourner,VERB,_,VerbForm=Inf,2,xcomp,_,Subject=SubjRaising
2545,fr-ud-train_12650,La Bulgarie a décidé d'abolir le service militaire obligatoire (dont la durée était de six à neuf mois) à ,partir, du 1er janvier 2008. ,23,partir,partir,VERB,_,VerbForm=Inf,22,fixed,_,InIdiom=Yes
2550,fr-ud-train_12672,Ce type d'architecture (2-tier en anglais) caractérise les environnements client-serveur où le poste client demande une ressource au serveur qui la fournit à ,partir, de ses propres ressources. ,28,partir,partir,VERB,_,VerbForm=Inf,27,fixed,_,InIdiom=Yes
2554,fr-ud-train_12685,Mais le parti éclate faute d'entente sur le choix du candidat à ,présenter,. ,15,présenter,présenter,VERB,_,VerbForm=Inf,13,acl,_,SpaceAfter=No|Subject=Generic
2555,fr-ud-train_12687,"Parlant au nom du peuple libyen, Mahmoud Jibril met en garde l'émirat : «... Qu'il s'agisse du Qatar ou d'un autre pays, tous les politologues s'accordent pour dire qu'à ",partir," du moment où un pays cherche à élargir encore plus sa sphère d'influence, il risque de se briser du milieu... ». ",42,partir,partir,VERB,_,VerbForm=Inf,41,fixed,_,InIdiom=Yes
2563,fr-ud-train_12713,Les travaux ,commencent, peu après et se poursuivent jusqu'en 2006. ,3,commencent,commencer,VERB,_,Mood=Ind|Number=Plur|Person=3|Tense=Pres|VerbForm=Fin,0,root,_,_
2574,fr-ud-train_12777,"La Conquête de Jérusalem, ",faisant," suite à la Chanson d'Antioche, par Graindor de Douai (1868) ; ",6,faisant,faire,VERB,_,Tense=Pres|VerbForm=Part,2,acl,_,InTitle=Yes
2576,fr-ud-train_12796,"Les réservations pour Noël et février sont à un bon niveau """", ",explique," Laurent Dourrieu, directeur de l'établissement public des stations d'altitude (Epsa) qui gère les stations de Gourette et La Pierre-Saint-Martin. ",14,explique,expliquer,VERB,_,Mood=Ind|Number=Sing|Person=3|Tense=Pres|VerbForm=Fin,11,parataxis:insert,_,_
2581,fr-ud-train_12813,Elle est le fruit d'un enseignement qui a commencé à l'âge de 6 ans avec son professeur de père qui lui apprend à ,jouer," le plus long possible pour briser le jeu de ses adversaires : un tennis solide, académique, sans faille, mécanisé, automatisé, et repoli chaque jour durant des heures. ",26,jouer,jouer,VERB,_,VerbForm=Inf,24,xcomp,_,Subject=OblRaising
2593,fr-ud-train_12895,A voir absolument si vous ,passez," par là, cette extraordinaire église baroque est dans un état magnifique. ",6,passez,passer,VERB,_,Mood=Ind|Number=Plur|Person=2|Tense=Pres|VerbForm=Fin,2,advcl,_,_
2594,fr-ud-train_12895,A ,voir," absolument si vous passez par là, cette extraordinaire église baroque est dans un état magnifique. ",2,voir,voir,VERB,_,VerbForm=Inf,0,root,_,Subject=Generic
2597,fr-ud-train_12908,Il y ,a," deux ou trois siècles, le Jaunay était un petit fleuve qui se jetait directement en mer, au droit de son parcours terrestre, vers l'endroit de la côte connu sous le nom de Roche-Biron, au nord de Brétignolles-sur-Mer. ",3,a,avoir,VERB,_,Mood=Ind|Number=Sing|Person=3|Tense=Pres|VerbForm=Fin,1,fixed,_,InIdiom=Yes
2598,fr-ud-train_12911,Si c',est," pour faire un film qui ne soit pas aussi bon que le premier, ça n'aura aucun intérêt. """" ",3,est,être,VERB,_,Mood=Ind|Number=Sing|Person=3|Tense=Pres|VerbForm=Fin,20,advcl,_,_
2601,fr-ud-train_12927,"Fils d'un avoué de la Liste civile sous Louis-Philippe, il succéda à son père au tribunal de la Seine en 1851, et fut plusieurs fois président de la chambre des avoués à ",partir, de 1867. ,38,partir,partir,VERB,_,VerbForm=Inf,37,fixed,_,InIdiom=Yes
2608,fr-ud-train_12966,"« Il y a, puisque vous me commandez de ",parler,", Monsieur, lui dis-je avec feu en tenant mes regards fichés sur les siens qui ne les purent soutenir, que vous êtes en train de perdre auprès de tous le peu d'estime et de considération--ce furent là les termes dont je me servis--qu'a gardé pour vous le gros du monde. ",11,parler,parler,VERB,_,VerbForm=Inf,9,xcomp,_,SpaceAfter=No|Subject=OblRaising
2621,fr-ud-train_13016,"Il a réuni cinq noms, ceux des cinq responsables du massacre de sa famille : Attel Malagate le prince des étoiles mégalomane et reclus, Kokor Hekkus l'immortel hanté par la peur, les moyens de l'infliger, et sa terrible machine à ",tuer,", Viole Falushe qui sur une planète s'est bâti un monde d'apparence paradisiaque, en réalité un cauchemar qu'il alimente sans cesse avec tous les moyens possibles, Lens Larque, le Darsh exilé aux mœurs barbares, aux méthodes expéditives et sanglantes et qui a pour projet d'imposer au monde son visage repoussant, et Howard Alan Treesong, jadis un enfant frustré, aujourd'hui l'homme qui s'est proclamé le premier des sur-hommes et qui a tenté de prendre le contrôle de l'Institut et même des forces policières de la CCPI. ",50,tuer,tuer,VERB,_,VerbForm=Inf,48,acl,_,SpaceAfter=No|Subject=Generic
2624,fr-ud-train_13033,À ,partir," du guichet, il faut traverser la route et grimper un des deux cheminements piétonniers assez raides, de chaque côté du viaduc, côté Loges (sud de la voie) pour la direction Versailles-Chantiers, côté Petit Jouy (nord de la voie) pour la direction Jouy-en-Josas. ",2,partir,partir,VERB,_,VerbForm=Inf,1,fixed,_,InIdiom=Yes
2625,fr-ud-train_13036,"Et s'il reste à Paris, c'",est, pour s'entraîner à l'écart du groupe professionnel. ,9,est,être,VERB,_,Mood=Ind|Number=Sing|Person=3|Tense=Pres|VerbForm=Fin,0,root,_,_
2629,fr-ud-train_13071,"« Nous ne l'approuvons pas car elle n'est pas conforme à la mission de la France de défense des droits de l'Homme dans le monde », a-t-il ",affirmé,. ,34,affirmé,affirmer,VERB,_,Gender=Masc|Number=Sing|Tense=Past|VerbForm=Part|Voice=Act,5,parataxis:insert,_,SpaceAfter=No
2632,fr-ud-train_13084,Les résultats obtenus à ,partir, de restes couvrant plusieurs milliers d'années ont permis de mettre en évidence une évolution des comportements alimentaires en passant d'un mode de chasseur-cueilleur à celui de la domestication des plantes et de l'agriculture. ,5,partir,partir,VERB,_,VerbForm=Inf,4,fixed,_,InIdiom=Yes
2637,fr-ud-train_13102,"« La motivation est un moteur essentiel pour l'apprentissage des langues, ",souligne," Fabienne Fevrier-Tabarnoust, l'un des professeurs d'anglais. ",15,souligne,souligner,VERB,_,Mood=Ind|Number=Sing|Person=3|Tense=Pres|VerbForm=Fin,6,parataxis:insert,_,_
2639,fr-ud-train_13108,Pourquoi ne lui ,fait,-on pas confiance ? ,4,fait,faire,VERB,_,Mood=Ind|Number=Sing|Person=3|Tense=Pres|VerbForm=Fin,0,root,_,SpaceAfter=No
2641,fr-ud-train_13122,"Dimanche soir à 20h, Nicolas Sarkozy prononcera une allocution sur la situation internationale, ",annonce, aujourd'hui un communiqué de l'Elysée. ,16,annonce,annoncer,VERB,_,Mood=Ind|Number=Sing|Person=3|Tense=Pres|VerbForm=Fin,8,parataxis:insert,_,_
2646,fr-ud-train_13151,,Faire, attention aux dates limites de consommation. ,1,Faire,faire,VERB,_,VerbForm=Inf,0,root,_,Subject=Generic|wordform=faire
2647,fr-ud-train_13164,"Il trouve l'opposition de théologiens comme Lanfranc de Pavie (vers 1010-1089) et Hildebert de Lavardin (1056-1133), qui défendent l'idée d'un changement de substance : la « transsubstantiation » telle qu'on l'appelle à ",partir," du XIIe siècle, puis au IVe concile de Latran (1215). ",43,partir,partir,VERB,_,VerbForm=Inf,42,fixed,_,InIdiom=Yes
2650,fr-ud-train_13172,"Par ailleurs le site internet est magnifique (www.zensushi.fr), dommage que la cuisine n'ai pas ",suivi,. ,19,suivi,suivre,VERB,_,Gender=Masc|Number=Sing|Tense=Past|VerbForm=Part|Voice=Act,12,csubj,_,SpaceAfter=No
2651,fr-ud-train_13179,Pas n',importe, lequel. ,3,importe,importer,VERB,_,Mood=Ind|Number=Sing|Person=3|Tense=Pres|VerbForm=Fin,2,fixed,_,InIdiom=Yes
2652,fr-ud-train_13183,"Les voies latérales, dites lentes, sont mises en sens unique à ",partir, de 1964. ,14,partir,partir,VERB,_,VerbForm=Inf,13,fixed,_,InIdiom=Yes
2655,fr-ud-train_13191,Il ,existe," quelques outils tels que la Charte européenne des langues régionales ou minoritaires, qui protège les langues minoritaires et soutenu par la politique linguistique de l'Union européenne, qui doit faire face à l'impérialisme linguistique des langues internationales. ",2,existe,exister,VERB,_,Mood=Ind|Number=Sing|Person=3|Tense=Pres|VerbForm=Fin,0,root,_,_
2661,fr-ud-train_13210,Il a grandi à ,partir," du Scout louveteau, et a servi le mouvement de 1938 à 2005, quand il a pris sa retraite en tant que président du Gambia National Scout Council. ",5,partir,partir,VERB,_,VerbForm=Inf,4,fixed,_,InIdiom=Yes
2663,fr-ud-train_13219,A ,éviter, si vous n'avez pas gagné au Loto ! ,2,éviter,éviter,VERB,_,VerbForm=Inf,0,root,_,Subject=Generic
2665,fr-ud-train_13225,"« Mégatron must be stopped, no matter the cost/Mégatron doit être arrêté, quel que soit le prix » ",dira,-t-il avant de se lancer sur le champ de bataille. ,23,dira,dire,VERB,_,Mood=Ind|Number=Sing|Person=3|Tense=Fut|VerbForm=Fin,2,parataxis:insert,_,SpaceAfter=No
2668,fr-ud-train_13228,Herriot ,a," recours à de nombreuses avances auprès de la Banque de France, qui est encore entre les mains d'intérêts privés (les « 200 familles »). ",2,a,avoir,VERB,_,Mood=Ind|Number=Sing|Person=3|Tense=Pres|VerbForm=Fin,0,root,_,_
2672,fr-ud-train_13250,"Un second appareil prit l'air le 20 mars 1999, qui ",donna, satisfaction. ,13,donna,donner,VERB,_,Mood=Ind|Number=Sing|Person=3|Tense=Past|VerbForm=Fin,3,acl:relcl,_,_
2679,fr-ud-train_13300,"Les filles, vous ",savez,", ont fait tant de choses dans l'ombre !"""" ",6,savez,savoir,VERB,_,Mood=Ind|Number=Plur|Person=2|Tense=Pres|VerbForm=Fin,9,parataxis,_,SpaceAfter=No
2680,fr-ud-train_13325,Les régimes criminels ,ont, recours à des actes criminels devant la condamnation internationale. ,4,ont,avoir,VERB,_,Mood=Ind|Number=Plur|Person=3|Tense=Pres|VerbForm=Fin,0,root,_,_
2684,fr-ud-train_13354,À ,partir," de 1942, pour compenser son manque de bombardiers lourds, la Luftwaffe a commencé à expérimenter l'utilisation d'anciens bombardiers Junkers Ju 88 usées par les années de guerres comme d'énormes ogives à charge creuse en les guidant vers leur cible avec un avion de chasse monté sur l'arrière du bombardier sans pilote. ",2,partir,partir,VERB,_,VerbForm=Inf,1,fixed,_,InIdiom=Yes
2688,fr-ud-train_13384,"En cette occasion, les résultats de l'analyse graphologique réalisée par Silvana Bernardini sur des textes de l'artiste ont été présentés (",voir, ci-haut). ,25,voir,voir,VERB,_,VerbForm=Inf,23,parataxis,_,Subject=Generic
2689,fr-ud-train_13386,"Le 8 avril 1865, la cavalerie de l'Union commandée par le brigadier-général George Armstrong Custer prend et ",brûle, les trois trains de provisions qui attendent l'armée de Lee lors de la bataille d'Appomattox Station. ,20,brûle,brûler,VERB,_,Mood=Ind|Number=Sing|Person=3|Tense=Pres|VerbForm=Fin,18,conj,_,_
2696,fr-ud-train_13423,"D'autres grandes voies de communications sont améliorés durant cette période comme les routes de terre vers Saint-Siméon (170), Saint-Urbain (381) et Québec à ",partir, d'Héberville (169). ,30,partir,partir,VERB,_,VerbForm=Inf,29,fixed,_,InIdiom=Yes|Subject=Generic
2697,fr-ud-train_13426,Le musée de la Forêt de Renwez montre ce qu'était cette activité il y ,a, encore un siècle. ,16,a,avoir,VERB,_,Mood=Ind|Number=Sing|Person=3|Tense=Pres|VerbForm=Fin,14,fixed,_,InIdiom=Yes
