,# sent,# sent successif,% sent,% sent successif,filtered
all,2739.0,2739.0,100.0,100.0,
no_obj,352,352,12.85,12.85,"Je suis amoureux des forêts anciennes, et je suis un patriote américain parce que nous en ;;avons;;. "
in_both,1207,208,44.07,7.59,Les campagnes publicitaires d'ANA ;;conduisent;; généralement à un taux de clics de 8 à 12%. 
out_idiom,2739.0,208.0,100.0,7.59,
something,2426,142,88.57,5.18,"Madame la présidente, nous ne pouvons pas - nous n'avons pas le droit - de nous résigner à entendre ;;parler;; de plus en plus souvent d'accidents qui provoquent, sur les routes, les voies ferrées et navigables, des dégâts importants également imputables au fait que les personnes concernées ne prennent pas assez au sérieux le transport de marchandises dangereuses ou que par ignorance ou par manque de formation du chauffeur ou de la personne responsable des divers moyens de transport, il arrive trop souvent qu'un accident bénin tourne à la catastrophe. "
not_fixed,2679,142,97.81,5.18,J'ai ;;trouvé;; cela tout à fait exceptionnel. 
no_pass,2739.0,142.0,100.0,5.18,
no_pron,2645,121,96.57,4.42,Et c'est exactement ce qui se ;;passe;; avec les PDB dans cette pyramide de la chaîne alimentaire. 
