sent_id	left_context	pivot	right_context	ID	FORM	LEMMA	UPOS	XPOS	FEATS	HEAD	DEPREL	DEPS	MISC
576	Devant le ridicule de cette pensée bien involontaire, je me suis 	calmé	, et j'ai finalement réussi à récupérer mon document.	13	calmé	calmer	VERB	VERB	Gender=Fem|Number=Sing|Tense=Past|VerbForm=Part|Voice=Pass	0	root	_	SpaceAfter=No
581	Cette prouesse, à elle seule, aurait suffi à lui 	assurer	 la postérité.	12	assurer	assurer	VERB	VERB	VerbForm=Inf	9	xcomp	_	_
582	"Doris m'avait déjà dit: """"Un coach recrue aurait démissionné en novembre"""" et moi je lui avait "	répondu	": """"Oui!"	21	répondu	répondre	VERB	VERB	Gender=Masc|Number=Sing|Tense=Past|VerbForm=Part	12	ccomp	_	SpaceAfter=No
582	Doris m'avait déjà 	dit	": """"Un coach recrue aurait démissionné en novembre"""" et moi je lui avait répondu: """"Oui!"	5	dit	dire	VERB	VERB	Gender=Masc|Number=Sing|Tense=Past|VerbForm=Part	0	root	_	SpaceAfter=No
605	Son attrait pour l'ensemble de la gent féminine lui 	joue	 parfois de mauvais tours : l'habit ne fait pas le moine, et celles qui finissent dans son lit jouent parfois les mantes-religieuses.	11	joue	joue	VERB	VERB	Mood=Ind|Number=Sing|Person=3|Tense=Pres|VerbForm=Fin	0	root	_	_
611	Tournant sur base Havok et Unreal Engine 3 modifié, excusez du peu, ce jeu à la troisième personne nous 	mettra	 dans les baskets de Chow Yun-Fat alias, pour l'occasion et pour la seconde fois, Burrito Oups !	22	mettra	mettre	VERB	VERB	Mood=Ind|Number=Sing|Person=3|Tense=Fut|VerbForm=Fin	11	advcl	_	_
627	Son enfance au Texas ne l'avait pas 	préparé	 à un tel rôle», relate Will Di Novi pour The Nation.	9	préparé	préparer	VERB	VERB	Gender=Masc|Number=Sing|Tense=Past|VerbForm=Part	0	root	_	_
640	La page 5 de la notice concernant l'organisation des épreuves vous donne la liste des académies chargées de traiter votre candidature, selon le pays ou le territoire d'Outre-mer où vous 	résidez	.	34	résidez	résider	VERB	VERB	Mood=Ind|Number=Plur|Person=2|Tense=Pres|VerbForm=Fin	26	acl:relcl	_	SpaceAfter=No
640	La page 5 de la notice concernant l'organisation des épreuves vous 	donne	 la liste des académies chargées de traiter votre candidature, selon le pays ou le territoire d'Outre-mer où vous résidez.	13	donne	donne	VERB	VERB	Mood=Ind|Number=Sing|Person=3|Tense=Pres|VerbForm=Fin	0	root	_	_
675	La caravane conservatrice se rend à Québec, où le parti 	espère	 tenir son gros rassemblement de la campagne.	12	espère	espérer	VERB	VERB	Mood=Ind|Number=Sing|Person=3|Tense=Pres|VerbForm=Fin	5	advcl	_	_
697	Des fideles viennent en grand nombre de part le monde ,Un grand nombre de bêtes y sont 	sacrifiées	 à chaque Hillula à Lag Baomer.	19	sacrifiées	sacrifier	VERB	VERB	Gender=Fem|Number=Plur|Tense=Past|VerbForm=Part|Voice=Pass	14	acl	_	_
707	Nous sommes sur Wikipédia FRANCOPHONE au cas où ça t'aurait 	échappé	, et les diacritiques cités (vietnamiens en l'occurence) ne font pas partie de la syntaxe française.	12	échappé	échapper	VERB	VERB	Gender=Masc|Number=Sing|Tense=Past|VerbForm=Part	7	acl:relcl	_	SpaceAfter=No
717	Aujourdhui, quand on interroge les Allemands sur le peuple dont ils se 	sentent	 les plus proches, ils répondent invariablement les Français et vice-versa.	14	sentent	sentir	VERB	VERB	Mood=Ind|Number=Sing|Person=3|Tense=Pres|VerbForm=Fin	10	acl:relcl	_	_
717	Aujourdhui, quand on interroge les Allemands sur le peuple dont ils se 	sentent	 les plus proches, ils répondent invariablement les Français et vice-versa.	14	sentent	sentir	VERB	VERB	Mood=Ind|Number=Sing|Person=3|Tense=Pres|VerbForm=Fin	10	acl:relcl	_	_
789	Au moment où se négocie l'élargissement à l'Est et au Sud, il n'est pas inutile de faire le point sur les éléments de convergence et de divergence et d'en 	expliquer	 les fondements.	35	expliquer	expliquer	VERB	VERB	VerbForm=Inf	31	conj	_	_
789	Au moment où se 	négocie	 l'élargissement à l'Est et au Sud, il n'est pas inutile de faire le point sur les éléments de convergence et de divergence et d'en expliquer les fondements.	5	négocie	négocier	VERB	VERB	Mood=Ind|Number=Sing|Person=3|Tense=Pres|VerbForm=Fin	2	acl:relcl	_	_
793	On le sait depuis des décennies: François Nourissier est un styliste de la langue française qui sait admirablement sonder les coeurs les âmes mais aussi les reins de cette bourgeoisie française dont il est 	issu	 mais qu'il abhorre.	36	issu	issu	VERB	VERB	Gender=Masc|Number=Sing|Tense=Past|VerbForm=Part|Voice=Pass	31	acl:relcl	_	_
849	Celle-ci nous 	réserve	 généralement bien des surprises.	5	réserve	réserve	VERB	VERB	Mood=Ind|Number=Sing|Person=1|Tense=Pres|VerbForm=Fin	0	root	_	_
862	Si ceux qui travaillent dans le secteur n'ont pas de perspectives, ils vont peut-être essayer de conquérir un marché où ils 	peuvent	 encore utiliser leur expertise.	24	peuvent	pouvoir	VERB	VERB	Mood=Ind|Number=Plur|Person=3|Tense=Pres|VerbForm=Fin	21	acl:relcl	_	_
896	Un commerce illicite qui lui avait 	coûté	 à plusieurs reprises un châtiment de quelques mois de prison ferme.	7	coûté	coûter	VERB	VERB	Gender=Masc|Number=Sing|Tense=Past|VerbForm=Part	2	acl:relcl	_	_
923	On sait depuis un an que 1770 appareils de loterie vidéo seront retirés des bars pour être concentrés dans les salons de jeux des hippodromes, où on 	croit	 qu'il sera plus facile d'éviter le jeu compulsif.	29	croit	croire	VERB	VERB	Mood=Ind|Number=Sing|Person=3|Tense=Pres|VerbForm=Fin	21	acl:relcl	_	_
925	Plus large, plus ergonomique, plus riche, plus belle, elle a été conçue pour vous 	offrir	 une expérience de navigation améliorée.	19	offrir	offrir	VERB	VERB	VerbForm=Inf	16	xcomp	_	_
955	Aujourd'hui, les technologies collaboratives, comme les blogs ou les «wikis», façonnent de nouvelles interactions sociales, où le pouvoir ne 	réside	 plus entre les mains des institutions, mais entre celles des communautés, observe Catherine Graeber.	26	réside	résider	VERB	VERB	Mood=Ind|Number=Sing|Person=3|Tense=Pres|VerbForm=Fin	16	ccomp	_	_
956	Par contre, je ne crois pas que la Classification française ait à prendre en considération le classement d'entités traditionnelles dont l'autonomie nous 	apparaît	 aujourd'hui discutable.	26	apparaît	apparaître	VERB	VERB	Mood=Ind|Number=Sing|Person=3|Tense=Pres|VerbForm=Fin	20	acl:relcl	_	_
956	Par contre, je ne crois pas que la Classification française ait à prendre en considération le classement d'entités traditionnelles dont l'autonomie nous 	apparaît	 aujourd'hui discutable.	26	apparaît	apparaître	VERB	VERB	Mood=Ind|Number=Sing|Person=3|Tense=Pres|VerbForm=Fin	20	acl:relcl	_	_
960	Par le sérieux des sujets, de la préparation et des questions, cet espace de rigueur détonne quelque peu dans un marigot matinal où 	clapotent	 les lieux communs.	26	clapotent	clapoter	VERB	VERB	Mood=Ind|Number=Plur|Person=3|Tense=Pres|VerbForm=Fin	23	acl:relcl	_	_
969	«Nous voulons travailler pour subvenir au besoin de nos familles», ont-elles 	expliqué	.	17	expliqué	expliquer	VERB	VERB	Gender=Masc|Number=Sing|Tense=Past|VerbForm=Part|Voice=Pass	0	root	_	SpaceAfter=No
988	"Faute de quoi il envisagera des mesures, """"n'impliquant pas l'usage de forces armées"""", pour l'y "	contraindre	.	23	contraindre	contraindre	VERB	VERB	VerbForm=Inf	0	root	_	SpaceAfter=No
995	Il leur 	appartient	 de prendre du recul par rapport à cette bataille qui pollue l'atmosphère de l'arène sénégalaise.	3	appartient	appartenir	VERB	VERB	Mood=Ind|Number=Sing|Person=3|Tense=Pres|VerbForm=Fin	0	root	_	_
1014	Pas d'hypocrisie là dedans, juste dire on te 	laisse	 la chance de revenir différemment, pas juste en changeant de nom et en restant le même, ça c'est clair.	11	laisse	laisse	VERB	VERB	Mood=Ind|Number=Sing|Person=3|Tense=Pres|VerbForm=Fin	3	acl	_	_
1032	Evidemment il leur 	prépare	" beaucoup de légumes, mais nos chiens apprécient aussi les biscuits à l'avoine ou au caroube, et surtout le parmesan"""", ajoute-t-elle."	5	prépare	préparer	VERB	VERB	Mood=Ind|Number=Sing|Person=3|Tense=Pres|VerbForm=Fin	0	root	_	_
1065	Ca me 	déprime	 un peu quand je vois le temps, ou que je n'arrive pas à partir par rapport aux autres, que je me prends un mètre dans le virage dans la coulée», confiait-elle au Parisien.	3	déprime	déprime	VERB	VERB	Mood=Ind|Number=Sing|Person=3|Tense=Pres|VerbForm=Fin	0	root	_	_
1073	Or, précisément, n'est-ce pas ce qu'a fait Spielberg tout occupé à nourrir les rêves de son cinéma, du Cinéma qui, par définition, nous « sort » de la réalité pour nous faire 	vivre	 une ou deux heures de pure illusion ?	41	vivre	vivre	VERB	VERB	VerbForm=Inf	33	advcl	_	_
1080	Je suis un enfant de l'époque Nixon, la douleur ne m'a pas 	atteint	.	16	atteint	atteindre	VERB	VERB	Gender=Masc|Number=Sing|Tense=Past|VerbForm=Part|Voice=Pass	0	root	_	SpaceAfter=No
1091	Des personnes qui peuvent vous aider à parachever certains de vos objectifs du moment, sont prêtes à vous 	écouter	.	20	écouter	écouter	VERB	VERB	VerbForm=Inf	17	xcomp	_	SpaceAfter=No
1100	Dans la proposition « être libre, c'est pouvoir faire ce que l'on veut », on discerne sans peine la présence de deux éléments, qui indiquent les deux conditions devant être remplies pour qu'il y ait 	liberté	.	42	liberté	liberter	VERB	VERB	Gender=Fem|Number=Sing|Tense=Past|VerbForm=Part|Voice=Pass	36	advcl	_	SpaceAfter=No
1106	"Scott et Lyman en distinguent deux : La première concerne """"l'excuse"""" où l'acteur "	admet	" la transgression de la norme, tout en apportant des propos argumentaires visant à réduire sa responsabilité pour """"la faute commise""""."	18	admet	admettre	VERB	VERB	Mood=Ind|Number=Sing|Person=3|Tense=Pres|VerbForm=Fin	13	acl:relcl	_	_
1114	Elle vous 	propose	 de découvrir ses activités et de retrouver de nombreuses informations pratiques sur la ville.	3	propose	proposer	VERB	VERB	Mood=Ind|Number=Plur|Person=2|Tense=Pres|VerbForm=Fin	0	root	_	_
1153	Pour la sortie ce mercredi du film 48 heures par jour, nous vous 	proposons	 l'interview de la réalisatrice (Catherine Castel ) et de l'acteur principal (Antoine de Caunes) ainsi que notre avis sur ce long métrage.	15	proposons	proposer	VERB	VERB	Mood=Ind|Number=Plur|Person=1|Tense=Pres|VerbForm=Fin	0	root	_	_
1164	Nous avons eu l'occasion de rencontrer le président du conseil d'administration et l'administrateur délégué pour nous 	entretenir	 des conséquences éventuelles de cette inculpation.	21	entretenir	entretenir	VERB	VERB	VerbForm=Inf	8	advcl	_	_
1186	Pour organiser une rencontre et vous faire 	massacrer	 (cela va de soi), laisser un message sur le forum ou s'adresser par ICQ à Calimeropierro ou Maxracaille.	8	massacrer	massacrer	VERB	VERB	VerbForm=Inf	2	conj	_	_
1193	Repoussé par l'invasion étrangère, Truguet fut un des derniers à quitter le poste qui lui avait été 	confié	.	20	confié	confier	VERB	VERB	Gender=Masc|Number=Sing|Tense=Past|VerbForm=Part|Voice=Pass	13	ccomp	_	SpaceAfter=No
1199	Nous n'essayons pas d'imposer un gouvernement à la Somalie, pas plus que nous n'avons l'intention de nous 	immiscer	 dans les affaires internes de la Somalie.	23	immiscer	immiscer	VERB	VERB	VerbForm=Inf	20	acl	_	_
1204	Il faudra en avoir accumulé 20 pour passer de 0 à 10. Pour passer de 10 à 20, il faudra pour chaque pourcent y 	passer	 2×2 heures, soit 40 heures au total.	8	passer	passer	VERB	VERB	VerbForm=Inf	5	advcl	_	_
1209	Le film démontre que échouer à un rêve n'est pas la fin du monde, puisqu'il est toujours facile d'en 	trouver	 un autre substitue.	24	trouver	trouver	VERB	VERB	VerbForm=Inf	21	xcomp	_	_
1246	Arrêté dans le Var où il s'était 	réfugié	 à la fin de la Seconde Guerre mondiale, il fut interné de janvier à juin 1944 et mourut peu de temps après la fin des hostilités en 1946.	9	réfugié	réfugier	VERB	VERB	Gender=Masc|Number=Sing|Tense=Past|VerbForm=Part	4	acl:relcl	_	_
1276	C'est en effet à Dives que fut 	rassemblée	 l'armada du duc de Normandie.	9	rassemblée	rassembler	VERB	VERB	Gender=Fem|Number=Sing|Tense=Past|VerbForm=Part|Voice=Pass	4	dep	_	_
1278	Selon plusieurs sondages, l'AKP, au pouvoir depuis 2002, obtiendrait environ 40 % des voix, ce qui lui 	permettrait	 de rafler au minimum quelque 300 sièges sur les 550 du Parlement, soit plus que la majorité absolue.	23	permettrait	permettre	VERB	VERB	Mood=Ind|Number=Sing|Person=3|Tense=Imp|VerbForm=Fin	20	acl:relcl	_	_
1330	Situé qu nord de l'île, à 20 Kms de la ville de SAN ANTONIO où la fête 	bat	 son plein de jour comme de nuit, le club VISTA BAHIA offre toute la sérénité d'une petite crique rocheuse (cala) entourée d'une pinède odorante.	20	bat	battre	VERB	VERB	Mood=Ind|Number=Sing|Person=3|Tense=Pres|VerbForm=Fin	13	acl:relcl	_	_
1346	Vous accédez plus rapidement aux informations qui vous 	intéressent	.	9	intéressent	intéresser	VERB	VERB	Mood=Ind|Number=Plur|Person=3|Tense=Pres|VerbForm=Fin	6	acl:relcl	_	SpaceAfter=No
1349	Des aides de la Fondation Mohamed V pour la solidarité y ont été 	acheminées	, rapporte la MAP.	14	acheminées	acheminer	VERB	VERB	Gender=Fem|Number=Plur|Tense=Past|VerbForm=Part|Voice=Pass	2	acl	_	SpaceAfter=No
1358	Mais, comme en 2002, c'est peut-être un acteur d'un film des frères Dardenne qui lui 	soufflera	 le Prix.	20	soufflera	souffler	VERB	VERB	Mood=Ind|Number=Sing|Person=3|Tense=Fut|VerbForm=Fin	14	acl:relcl	_	_
1360	Nous espérons que chaque amateur y 	trouvera	 les monnaies nécessaires au développement de son médaillier.	7	trouvera	trouver	VERB	VERB	Mood=Ind|Number=Sing|Person=3|Tense=Fut|VerbForm=Fin	2	ccomp	_	_
1412	Interview, dimanche dernier à Paléo, d'Eugene Hütz, leader de Gogol Bordello, le band de New York, avec ses danseuses épileptiques, ses ruades à vous 	réveiller	 les moribonds Pour lui le live est une thérapie, un chamanisme.	32	réveiller	réveiller	VERB	VERB	VerbForm=Inf	3	acl	_	_
1425	A Ribeauvillé, où elle a 	accueilli	 en quatre saisons 250.000 visiteurs, elle avait réalisé l'an dernier un parcours sur le thème des Voyages extraordinaires de Jules Verne.	7	accueilli	accueillir	VERB	VERB	Gender=Masc|Number=Sing|Tense=Past|VerbForm=Part	16	advcl	_	_
1452	Notre belle-mère à une élégance assurée dans le choix des cadeaux qu'elle nous 	offre	 à haute fréquence.	15	offre	offrir	VERB	VERB	Mood=Ind|Number=Sing|Person=3|Tense=Pres|VerbForm=Fin	11	acl:relcl	_	_
1462	Il lui 	reste	 encore cinq départs cette saison alors qu'il essaie de remporter 15 victoires ou plus pour une 18e saison de suite.	3	reste	reste	VERB	VERB	Mood=Ind|Number=Sing|Person=3|Tense=Pres|VerbForm=Fin	0	root	_	_
1465	Je leur ai 	donné	 ce link.	4	donné	donner	VERB	VERB	Gender=Masc|Number=Sing|Tense=Past|VerbForm=Part	0	root	_	_
1474	"Du côté français, Michel Barnier a déclaré que Paris continuait """"à espérer que l'Iran ne fera pas ce geste dont il "	connaît	" les conséquences""""."	25	connaît	connaître	VERB	VERB	Mood=Ind|Number=Sing|Person=3|Tense=Pres|VerbForm=Fin	22	acl:relcl	_	_
1477	Le chauffeur n'aura plus qu'à présenter aux gendarmes le quitus qui lui a été 	délivré	 », explique-t-il.	17	délivré	délivrer	VERB	VERB	Gender=Masc|Number=Sing|Tense=Past|VerbForm=Part|Voice=Pass	12	acl:relcl	_	_
1487	"Parler de """"déclin"""" de FERRERI, ça me "	paraît	 excessif.	11	paraît	paraître	VERB	VERB	Mood=Ind|Number=Sing|Person=1|Tense=Pres|VerbForm=Fin	0	root	_	_
1491	Le seul film d'époque que j'ai vu qui était un peu intéressant, c'est le film Amadeus, car il racontait une histoire vraie de quelqu'un de connu, sinonÉgalement, je ne connais pas les acteurs dans ce film, ce qui ne me 	donne	 pas le goût de le voir.	50	donne	donne	VERB	VERB	Mood=Ind|Number=Sing|Person=3|Tense=Pres|VerbForm=Fin	46	acl:relcl	_	_
1499	Un endroit où je 	sais	, chaque nuit, qu'ils sont ivres.	5	sais	savoir	VERB	VERB	Mood=Ind|Number=Sing|Person=1|Tense=Pres|VerbForm=Fin	2	acl:relcl	_	SpaceAfter=No
1501	Sophie Verrijke, qui est en instance de divorce, refuse depuis le printemps dernier de confier la garde de sa fille à son père belge avec lequel la petite Eline serait, selon elle, en 	danger	.	44	danger	danger	VERB	VERB	VerbForm=Inf	12	advcl	_	SpaceAfter=No
1508	Il devait en 	résulter	, à l'origine, une prédilection marquée pour l'improvisation.	4	résulter	résulter	VERB	VERB	VerbForm=Inf	2	xcomp	_	SpaceAfter=No
1511	Tant qu'il y aura de bonnes personnes pour s'occuper des enfants rejetés de la société, ils auront de l'espoir de s'en 	sortir	.	27	sortir	sortir	VERB	VERB	VerbForm=Inf	23	acl	_	SpaceAfter=No
1513	La musique à en 	perdre	.	5	perdre	perdre	VERB	VERB	VerbForm=Inf	2	acl	_	SpaceAfter=No
1521	Dans Le Devoir du 9 novembre dernier, Marie-Jo Ouellette demande des coordonnées de couvents, d'abbayes et de communautés religieuses où elle 	pourrait	 être hébergée pendant un voyage en Italie.	25	pourrait	pouvoir	VERB	VERB	Mood=Cnd|Number=Sing|Person=3|Tense=Pres|VerbForm=Fin	21	acl:relcl	_	_
1554	Déjà acteur ou non dans le mouvement social, l'efficacité commande de nous 	organiser	 mieux ensemble pour porter tous nos besoins et revendications.	15	organiser	organiser	VERB	VERB	VerbForm=Inf	11	acl	_	_
1564	Raison officielle: Google ne veut pas dévoiler le nombre de centres de traitement des données dont il 	dispose	 dans le monde.	19	dispose	disposer	VERB	VERB	Mood=Ind|Number=Sing|Person=3|Tense=Pres|VerbForm=Fin	10	acl:relcl	_	_
1565	Nassima, tu es belle, je t'	aime	, je t'adore, et, si tu n'es pas mariée, et si tu es d'accord, je suis prêt à t'épouser.	9	aime	aimer	VERB	VERB	Mood=Ind|Number=Sing|Person=1|Tense=Pres|VerbForm=Fin	0	root	_	SpaceAfter=No
1572	La police le suspecte désormais d'être impliqué dans une série de viols dont ont été 	victimes	 plus de 50 femmes dans la région de Nagoya.	17	victimes	victimer	VERB	VERB	Gender=Fem|Number=Plur|Tense=Past|VerbForm=Part|Voice=Pass	11	acl:relcl	_	_
1578	Cet équilibre, messieurs les députés, assure deux choses à l'Espagne : il lui 	assure	 un présent et un avenir.	8	assure	assurer	VERB	VERB	Mood=Ind|Number=Sing|Person=3|Tense=Pres|VerbForm=Fin	0	root	_	_
1603	Un lion adulte a besoin de 7 kg de viande par jour et peut en 	ingurgiter	 jusqu'à 40 kg en un seul repas.	16	ingurgiter	ingurgiter	VERB	VERB	VerbForm=Inf	14	xcomp	_	_
1647	Comme par exemple sur le rallye d'Argentine où tout semblait lui 	sourire	 jusqu'à ce que sa transmission le lâche.	13	sourire	sourire	VERB	VERB	VerbForm=Inf	11	xcomp	_	_
1647	Comme par exemple sur le rallye d'Argentine où tout 	semblait	 lui sourire jusqu'à ce que sa transmission le lâche.	11	semblait	sembler	VERB	VERB	Mood=Ind|Number=Sing|Person=3|Tense=Imp|VerbForm=Fin	6	acl:relcl	_	_
1714	Elle passera les dernières années de sa vie dans une petite maison d'une région dont elle 	dira	 qu'on y retrouve des paysages parmi les plus beaux du monde.	18	dira	dire	VERB	VERB	Mood=Ind|Number=Sing|Person=3|Tense=Fut|VerbForm=Fin	15	acl:relcl	_	_
1723	"Le journal rappelle que Sharon """"a participé à toutes les guerres où Israël a été "	impliqué	" et fait l'éloge du Premier ministre, """"reconnu pour être l'un des meilleurs stratèges militaires du monde""""."	17	impliqué	impliquer	VERB	VERB	Gender=Masc|Number=Sing|Tense=Past|VerbForm=Part|Voice=Pass	12	acl:relcl	_	SpaceAfter=No
1733	Ouvrez la porte et allez prendre se dont vous 	avez	 besoin.Sortez, allez en face et ouvrez la porte avec la clé du garde.Descendez dans les catacombes.	10	avez	avoir	VERB	VERB	Mood=Ind|Number=Plur|Person=2|Tense=Pres|VerbForm=Fin	6	ccomp	_	_
1735	On peut aussi y 	trouver	 deux galeries privées et plusieurs ateliers d’art qui proposent souvent des expositions.	5	trouver	trouver	VERB	VERB	VerbForm=Inf	2	xcomp	_	_
1780	Je vous 	verrai	" demain à dix heures, dix heures et quart, pour que vous puissiez faire votre travail"""", a dit le chef de l'Etat, interrompant brièvement son jogging."	3	verrai	voir	VERB	VERB	VerbForm=Inf	0	root	_	_
1805	Elle se réfugie avec ses parents à la campagne où le luxe 	laisse	 place à la misère la plus totale, ce qui forge très vite son caractère.	13	laisse	laisse	VERB	VERB	Mood=Ind|Number=Sing|Person=3|Tense=Pres|VerbForm=Fin	9	acl:relcl	_	_
1818	Vous pouvez vous procurer les documents décrits ci-dessous, soit en vous 	rendant	 directement au CRDP d'Alsace, soit en utilisant ce bon de commande.	13	rendant	rendre	VERB	VERB	Tense=Pres|VerbForm=Part	4	conj	_	_
1818	Vous pouvez vous 	procurer	 les documents décrits ci-dessous, soit en vous rendant directement au CRDP d'Alsace, soit en utilisant ce bon de commande.	4	procurer	procurer	VERB	VERB	VerbForm=Inf	2	xcomp	_	_
1835	C'est encore le moyen le plus sûr d'éviter de se 	brûler	 les ailes avec un modèle trop vite passé de mode.	13	brûler	brûler	VERB	VERB	VerbForm=Inf	10	xcomp	_	_
1839	Des techniques d'élevages rationalisées (traitement préventif, vide sanitaire, conduite en bande unique) ont permis d'en 	limiter	 le développement à partir du troisième trimestre 98.	22	limiter	limiter	VERB	VERB	VerbForm=Inf	19	xcomp	_	_
1846	"Devant la menace d'une grève, la direction de la SNCF avait déclenché une procédure de """"concertation immédiate"""", organisant trois réunions qui se sont "	soldées	 par des échecs.	29	soldées	solder	VERB	VERB	Gender=Fem|Number=Plur|Tense=Past|VerbForm=Part|Voice=Pass	25	acl:relcl	_	_
1847	À des classes où la fantaisie serait 	encouragée	 comme rempart à la médiocrité.	8	encouragée	encourager	VERB	VERB	Gender=Fem|Number=Sing|Tense=Past|VerbForm=Part|Voice=Pass	3	acl:relcl	_	_
1849	Pour y 	parvenir	, Veolia Propreté mettra en place une filière intégrée qui prévoit la construction et la gestion de nouvelles unités de traitement et de valorisation.	3	parvenir	parvenir	VERB	VERB	VerbForm=Inf	7	advcl	_	SpaceAfter=No
1899	Refusant les avances de Quintien, proconsul de Sicile, celui-ci la fit torturer : on lui 	arracha	 les seins à l'aide de tenailles mais elle fut guérie de ses blessures par l'apôtre Pierre qui la visita en prison.	19	arracha	arracher	VERB	VERB	Mood=Ind|Number=Sing|Person=3|Tense=Pres|VerbForm=Fin	1	advcl	_	_
1900	Les relations privilégiées avec deux cités, Ornans et Morez, où un travail a déjà 	prouvé	 sa nécessité l'an dernier, et une collaboration avec Nans sous Sainte Anne et Châtillon-le-Duc (voir ci-contre).	17	prouvé	prouver	VERB	VERB	Gender=Masc|Number=Sing|Tense=Past|VerbForm=Part	3	ccomp	_	_
1916	La Muse l'aimait plus que tous, et elle lui avait donné de connaître le bien et le mal, et, l'ayant privé des yeux, elle lui avait 	accordé	 le chant admirable.	33	accordé	accorder	VERB	VERB	Gender=Masc|Number=Sing|Tense=Past|VerbForm=Part	4	conj	_	_
1916	La Muse l'aimait plus que tous, et elle lui avait 	donné	 de connaître le bien et le mal, et, l'ayant privé des yeux, elle lui avait accordé le chant admirable.	13	donné	donner	VERB	VERB	Gender=Masc|Number=Sing|Tense=Past|VerbForm=Part	33	advcl	_	_
1927	Si Ferdinand m'en 	offrait	 une de mon choix, c'est celle-là sans hésitation que je prendrais.	5	offrait	offrir	VERB	VERB	Mood=Ind|Number=Sing|Person=3|Tense=Imp|VerbForm=Fin	13	advcl	_	_
1930	Son rôle est de vous 	donner	 l'information la plus claire et la plus objective possible.	6	donner	donner	VERB	VERB	VerbForm=Inf	0	root	_	_
1955	Pour la première fois dans l'histoire des Etats-Unis, l'élection présidentielle opposera deux tickets où se 	trouvent	 d'un côté un Noir, Barack Obama et de l'autre une femme, Sarah Palin.	19	trouvent	trouver	VERB	VERB	Mood=Ind|Number=Plur|Person=3|Tense=Pres|VerbForm=Fin	16	acl:relcl	_	_
1975	Le budget affiché, c'est celui qui nous est 	présenté	 aujourd'hui.	11	présenté	présenter	VERB	VERB	Gender=Masc|Number=Sing|Tense=Past|VerbForm=Part|Voice=Pass	7	advcl	_	_
1996	Malgré mon refus, il m'	engage	 à parler de mon passé.	7	engage	engager	VERB	VERB	Mood=Ind|Number=Sing|Person=3|Tense=Pres|VerbForm=Fin	0	root	_	_
2037	Je vous 	précise	 que j'enverrai ce même message aux 4 sites, juste pour partager les infos.	3	précise	préciser	VERB	VERB	Mood=Ind|Number=Plur|Person=2|Tense=Pres|VerbForm=Fin	0	root	_	_
2050	Il n'est pas seulement question de vérifier au mieux possible si nos comportements interpersonnels correspondent à ce que peut nous 	indiquer	 l'Évangile ou reflètent une certaine cohérence.	22	indiquer	indiquer	VERB	VERB	VerbForm=Inf	20	xcomp	_	_
2064	Il y 	eut	 tout de même cent cinquante journalistes au total.	3	eut	avoir	VERB	VERB	Mood=Ind|Number=Sing|Person=3|Tense=Past|VerbForm=Fin	0	root	_	_
2087	N'oubliez donc pas d'y 	ajouter	 8,25% de taxes.	7	ajouter	ajouter	VERB	VERB	VerbForm=Inf	2	xcomp	_	_
2120	Selon la télévision locale, des incendies se sont également déclarés dans une douzaine de maisons de l'île, mais les inondations ont empêché les pompiers d'y 	accéder	.	30	accéder	accéder	VERB	VERB	VerbForm=Inf	25	xcomp	_	SpaceAfter=No
2121	Si vous désirez déclarer vos cotisations en euros, il vous 	suffit	" de rayer les mentions """"francs"""" sur le BRC ou la DNT, et de remplacer les mots """"francs"""" par """"euros""""."	12	suffit	suffire	VERB	VERB	Mood=Ind|Number=Sing|Person=3|Tense=Past|VerbForm=Fin	0	root	_	_
2128	Les circonstances ne me 	permettront	" pas d'entrer dans la course"""", ajoute le maire de Bordeaux, en faisant notamment allusion aux affaires politico-judiciaires de la mairie de Paris qui l'ont écarté d'un destin politique au sommet."	5	permettront	permettre	VERB	VERB	Mood=Ind|Number=Plur|Person=3|Tense=Fut|VerbForm=Fin	0	root	_	_
2153	Ce qu'Apple voyait d'un mauvais oeil, puisque dans ce cas, aucune recette sur les communications ne lui serait 	reversée	.	23	reversée	reverser	VERB	VERB	Gender=Fem|Number=Sing|Tense=Past|VerbForm=Part|Voice=Pass	19	acl	_	SpaceAfter=No
