sent_id	left_context	pivot	right_context	ID	FORM	LEMMA	UPOS	XPOS	FEATS	HEAD	DEPREL	DEPS	MISC
13864	Une typographie nette et l'utilisation de l'espace horizontal facilitent la compréhension de cette publicité, y compris pour ceux qui n'ont que quelques millièmes de seconde à lui 	consacrer	.	32	consacrer	consacrer	VERB	VERB	VerbForm=Inf	27	acl	_	SpaceAfter=No
13874	Je crois qu'un test à Spa a été annoncé, il s'agira certainement de l'évaluation finale avant qu'ils me 	disent	" ce qu'ils comptent faire """" répond Bourdais."	25	disent	dire	VERB	VERB	Mood=Ind|Number=Plur|Person=3|Tense=Past|VerbForm=Fin	15	advcl	_	_
13879	Je suis donc venu à Paris, j'ai fait mon droit, j'ai été reçu avocat, et comme beaucoup de jeunes gens, j'ai mis mon diplôme dans ma poche et me suis 	laissé	 aller un peu à la vie nonchalante de Paris.	38	laissé	laisser	VERB	VERB	Gender=Masc|Number=Sing|Tense=Past|VerbForm=Part	29	conj	_	_
13908	Dégager les grandes masses d'un bilan, les gestionnaires vous le 	feront	.	13	feront	faire	VERB	VERB	Mood=Ind|Number=Plur|Person=3|Tense=Fut|VerbForm=Fin	0	root	_	SpaceAfter=No
13911	Elle était seule à bord et a été transportée au CHRTR où son décès n'a 	pu	 qu'être constaté.	17	pu	pouvoir	VERB	VERB	Tense=Past|VerbForm=Part	3	dep	_	_
13916	La justice, elle, peut les y 	autoriser	 et vient de le faire pour la troisième fois.	9	autoriser	autoriser	VERB	VERB	VerbForm=Inf	6	xcomp	_	_
13920	Les débats sont en général placé dans leur contexte par Patrice Carmouze (le 'centreur de débat', qui lui aussi 	casse	 sa fausse image d'amuseur), puis arbitré judicieusement par T.Ardisson.	24	casse	casser	VERB	VERB	Mood=Ind|Number=Sing|Person=3|Tense=Pres|VerbForm=Fin	5	acl:relcl	_	_
13922	Il s'agit non seulement de disposer de l'information sur le terrain, mais également d'en 	générer	 et de la remonter vers un système d'information central.	19	générer	générer	VERB	VERB	VerbForm=Inf	7	conj	_	_
13960	A partir de cette date, les échanges de mails n'ont plus cessé jusqu'à ce que Marcelo lui 	propose	 le mariage, via internet.	21	propose	proposer	VERB	VERB	Mood=Ind|Number=Sing|Person=3|Tense=Pres|VerbForm=Fin	17	acl:relcl	_	_
13982	Il s'agit de Daniel Angleraud (1937-1993), qui vient juste de quitter son poste d'administrateur du CCAS de l'EDF, où il 	représente	 la CGT.	30	représente	représenter	VERB	VERB	Mood=Ind|Number=Sing|Person=3|Tense=Pres|VerbForm=Fin	17	acl:relcl	_	_
14044	Pour protester, tous ont 	décidé	 d'entamer une gréve de la faim.	6	décidé	décider	VERB	VERB	Gender=Masc|Number=Sing|Tense=Past|VerbForm=Part	0	root	_	_
14045	Il en 	résulte	 que les tonalités de Do majeur et de Sol sont particulièrement belles.	3	résulte	résulter	VERB	VERB	Mood=Ind|Number=Sing|Person=3|Tense=Pres|VerbForm=Fin	0	root	_	_
14073	Vous y 	découvrirez	 notre sport ainsi que l'équipement nécessaire.	3	découvrirez	découvrir	VERB	VERB	Mood=Ind|Number=Plur|Person=1|Tense=Pres|VerbForm=Fin	0	root	_	_
14083	Le docteur qui pourtant en a 	vu	 d'autres est tout de même un peu choqué.	7	vu	voir	VERB	VERB	Gender=Masc|Number=Sing|Tense=Past|VerbForm=Part	2	acl:relcl	_	_
14086	S'il y en a ici à qui je dois des excuses, ce sont tous les lecteurs, du BBB et du présent site, que mon incapacité à vous gérer contraint à vous 	subir	.	36	subir	subir	VERB	VERB	VerbForm=Inf	33	xcomp	_	SpaceAfter=No
14086	S'il y en a ici à qui je dois des excuses, ce sont tous les lecteurs, du BBB et du présent site, que mon incapacité à vous 	gérer	 contraint à vous subir.	32	gérer	gérer	VERB	VERB	VerbForm=Inf	29	acl	_	_
14093	Envoyé par aicha1982 Bonjour, et avant tout je souhaite à tous les musulmns du monde entier untrés bon ramadan et que le bon dieu nous 	donne	 chaque jours un peu plus la foie , la force et aussi la santé pour jeûne chaque année.	27	donne	donne	VERB	VERB	Mood=Ind|Number=Sing|Person=3|Tense=Pres|VerbForm=Fin	20	conj	_	_
14116	"Ce sursaut a été accueilli avec peu de bienveillance par la FFSA, qui """"a pris acte de la démarche"""" dont elle n'avait pas été "	avertie	, mais n'a pas souhaité la commenter immédiatement.	29	avertie	avertir	VERB	VERB	Gender=Fem|Number=Sing|Tense=Past|VerbForm=Part|Voice=Pass	9	acl:relcl	_	SpaceAfter=No
14117	Cette réorganisation ferait également partie de la décision du Pentagone de regrouper ses forces en Europe et de réduire le nombre des installations dont il y 	dispose	.	27	dispose	disposer	VERB	VERB	Mood=Ind|Number=Sing|Person=3|Tense=Pres|VerbForm=Fin	23	acl:relcl	_	SpaceAfter=No
14117	Cette réorganisation ferait également partie de la décision du Pentagone de regrouper ses forces en Europe et de réduire le nombre des installations dont il y 	dispose	.	27	dispose	disposer	VERB	VERB	Mood=Ind|Number=Sing|Person=3|Tense=Pres|VerbForm=Fin	23	acl:relcl	_	SpaceAfter=No
14124	De nombreux joueurs qui ont participé à l'Euro ne sont pas au niveau physique où ils 	devraient	 être.	18	devraient	devoir	VERB	VERB	Mood=Cnd|Number=Plur|Person=3|Tense=Pres|VerbForm=Fin	14	acl:relcl	_	_
14126	M. Jobs lui a 	dit	 que le conseil avait donné son accord (...).	6	dit	dire	VERB	VERB	Gender=Masc|Number=Sing|Tense=Past|VerbForm=Part	0	root	_	_
14138	En 2006, il a voulu passer au-dessus de la Chambre en proposant cette série de référendums, et il en a été 	puni	.	24	puni	punir	VERB	VERB	Gender=Masc|Number=Sing|Tense=Past|VerbForm=Part|Voice=Pass	7	conj	_	SpaceAfter=No
14199	Ils en 	font	 une question de principe.	3	font	faire	VERB	VERB	Mood=Ind|Number=Plur|Person=3|Tense=Pres|VerbForm=Fin	0	root	_	_
14222	Le cours de bourse est le reflet de la confiance du marché en la capacité d'une entreprise à se 	donner	 un avenir (pour reprendre en partie vos termes).	21	donner	donner	VERB	VERB	VerbForm=Inf	18	acl	_	_
14226	Le canton d'Argovie n'a pas besoin d'aide, mais nous refusons d'être les seuls à nous 	préoccuper	 de l'approvisionnement en électricité du pays.	21	préoccuper	préoccuper	VERB	VERB	VerbForm=Inf	14	xcomp	_	_
14277	L'Equipe BOL, la culture qui vous 	ressemble	.	9	ressemble	ressembler	VERB	VERB	Mood=Ind|Number=Sing|Person=3|Tense=Pres|VerbForm=Fin	6	acl:relcl	_	SpaceAfter=No
14282	Autant qu'on se retourne sur moi parce qu'on me 	reconnaissait	 plutôt que parce que j'avais quelques centimètres en moins.	12	reconnaissait	reconnaître	VERB	VERB	Mood=Ind|Number=Sing|Person=3|Tense=Imp|VerbForm=Fin	5	advcl	_	_
14332	Les débats ont également évoqué la disposition du rond-point où a 	eu	 lieu l'accident, et notamment le manque de visibilité la nuit de trois des quatre panneaux de signalisation annonçant le carrefour giratoire.	14	eu	avoir	VERB	VERB	Gender=Masc|Number=Sing|Tense=Past|VerbForm=Part	11	acl:relcl	_	_
14343	Le musée Walt Disney Family Museum and Library sera consacré à Walt Disney et contiendra des dessins, photographies, lettres, documents et objets divers qui raconteront l'histoire de Walt et son influence sur l'époque où il a 	vécu	.	42	vécu	vivre	VERB	VERB	Gender=Masc|Number=Sing|Tense=Past|VerbForm=Part	30	acl:relcl	_	SpaceAfter=No
14354	Sous la direction du Responsable Internet/Multimédia et du Directeur Artistique, et dans le cadre d'un remplacement de congès de maternité vous 	allez	 participer à la création de projets Multimédia, vos responsabilités sont :	26	allez	aller	VERB	VERB	Mood=Ind|Number=Plur|Person=2|Tense=Pres|VerbForm=Fin	3	acl	_	_
14357	Enfin ils sont 26,2% à se 	déclarer	" """"fumeurs réguliers"""" (22% chez les anxieux-dépressifs et 15% chez les """"bien-portants"""")."	8	déclarer	déclarer	VERB	VERB	VerbForm=Inf	5	xcomp	_	_
14359	Celui qu'elle sème, cultive, récolte aux ciseaux, vanne à la main pour une trentaine de kilos de grains l'an et dont elle 	fait	 son pain.	28	fait	faire	VERB	VERB	Mood=Ind|Number=Sing|Person=3|Tense=Pres|VerbForm=Fin	4	conj	_	_
14362	Rien n'interdit à une femme enceinte de boire tous les jours, mais cela ne nous 	empêche	 pas de l'en dissuader », dit-il.	18	empêche	empêcher	VERB	VERB	Mood=Ind|Number=Sing|Person=3|Tense=Pres|VerbForm=Fin	3	conj	_	_
14394	Celui-ci indique le lieu où cinq colons furent 	tués	 par les Britanniques le 5 mars 1770, durant ce qu'on appela ensuite le massacre de Boston.	11	tués	tuer	VERB	VERB	Gender=Masc|Number=Plur|Tense=Past|VerbForm=Part|Voice=Pass	6	acl:relcl	_	_
14445	La police londonienne a annoncé mercredi avoir entendu Amy Winehouse la veille pour possession de drogues illégales, suite à la publication d'une vidéo où l'ont 	voit	 la jeune femme en train de fumer du crack.	29	voit	voir	VERB	VERB	Gender=Masc|Number=Sing|Tense=Past|VerbForm=Part	25	acl:relcl	_	_
14467	La géante, estimant qu'elle pourrait s'y 	recueillir	, se montra favorable à cette proposition.	10	recueillir	recueillir	VERB	VERB	VerbForm=Inf	7	xcomp	_	SpaceAfter=No
14579	J'en ai 	parlé	 aux joueurs en janvier.	4	parlé	parler	VERB	VERB	Gender=Masc|Number=Sing|Tense=Past|VerbForm=Part	0	root	_	_
14588	En exergue de la monographie qui lui est 	consacrée	" en 2007, il est précisé """"Avril aime le dessin et les dessinateurs""""."	9	consacrée	consacrer	VERB	VERB	Gender=Fem|Number=Sing|Tense=Past|VerbForm=Part|Voice=Pass	2	acl:relcl	_	_
14590	Cependant, cela vous 	permet	 d'acquérir une indépendance vis-à-vis de vos parents qui n'est pas négligeable.	5	permet	permettre	VERB	VERB	Mood=Ind|Number=Sing|Person=3|Tense=Pres|VerbForm=Fin	0	root	_	_
14598	J'ai besoin de 5 m2 pour mes journaux et comme la mairie refuse de m'	accorder	 un supplément de surface, je préfère payer une amende chaque année.	17	accorder	accorder	VERB	VERB	VerbForm=Inf	14	xcomp	_	_
14644	Denzel, Washington, Clive Owen et Jodie Foster ça me 	tentais	 beaucoup.	12	tentais	tenter	VERB	VERB	Mood=Cnd|Number=Sing|Person=1|Tense=Pres|VerbForm=Fin	9	obj	_	_
14649	A travers l'oraison, Dieu m'a 	appris	 la gratuité de l'amour.. à savoir l'aimer pour lui-même.	9	appris	apprendre	VERB	VERB	Gender=Masc|Tense=Past|VerbForm=Part	0	root	_	_
14688	Et c'est bien dommage de se dire qu'on va perdre un contributeur d'aussi grande qualité potentielle (voir sa page utilisateur où il 	disait	 se tâter pour contribuer) parce qu'il a voulu défendre un article fait sur un de ses concepts SF...	27	disait	dire	VERB	VERB	Mood=Ind|Number=Sing|Person=3|Tense=Imp|VerbForm=Fin	24	acl:relcl	_	_
14781	Le soleil perçait les carreaux pour nous 	caresser	.	8	caresser	caresser	VERB	VERB	VerbForm=Inf	3	advcl	_	SpaceAfter=No
14797	Or, les chercheurs et biologistes, notamment, estiment que le fonctionnement de la recherche publique nécessite de plus en plus de réactivité, souplesse et rapidité, seules capables de lui 	assurer	 un positionnement compétitif au niveau international.	34	assurer	assurer	VERB	VERB	VerbForm=Inf	26	xcomp	_	_
14824	Là, le mot protecteur a pris un tout autre sens Évidemment, elles ne m'	adressaient	 pas la parole, j'avais 16 ans, j'étais une petite fille.	17	adressaient	adresser	VERB	VERB	Mood=Ind|Number=Plur|Person=3|Tense=Pres|VerbForm=Fin	0	root	_	_
14828	Il y déjà 	eu	 des tentatives de regroupement/suppression (sur EN aussi) et elles ont échoué (sauf pour les lignes désaffectées).	4	eu	avoir	VERB	VERB	Gender=Masc|Number=Sing|Tense=Past|VerbForm=Part	0	root	_	_
14857	Pour comprendre au plus près la logique dans laquelle ils travaillent, je me suis fait 	embaucher	 comme guichetier vacataire, pendant un mois.	17	embaucher	embaucher	VERB	VERB	VerbForm=Inf	11	xcomp	_	_
14869	Mahmoud Abbas, en provenance du Soudan où il a participé au Sommet arabe, doit arriver au Cap (sud-ouest) où il s'	entretiendra	 vendredi avec Thabo Mbeki des relations bilatérales politiques et économiques, ainsi que de la situation au Moyen-Orient.	26	entretiendra	entretenir	VERB	VERB	Mood=Ind|Number=Sing|Person=3|Tense=Fut|VerbForm=Fin	19	acl:relcl	_	_
14869	Mahmoud Abbas, en provenance du Soudan où il a 	participé	 au Sommet arabe, doit arriver au Cap (sud-ouest) où il s'entretiendra vendredi avec Thabo Mbeki des relations bilatérales politiques et économiques, ainsi que de la situation au Moyen-Orient.	11	participé	participer	VERB	VERB	Gender=Masc|Number=Sing|Tense=Past|VerbForm=Part	7	acl:relcl	_	_
14887	Les livres qui lui sont 	consacrés	 se multiplient, aussi bien à destination des adultes que des jeunes.	6	consacrés	consacrer	VERB	VERB	Gender=Masc|Number=Plur|Tense=Past|VerbForm=Part|Voice=Pass	2	acl:relcl	_	_
14912	Même si on a du mal à en vivre, certains peuvent se livrer à ces activités et divertir les soirées des plus fortunés en en 	tirant	 quelques bénéfices.	27	tirant	tirer	VERB	VERB	Tense=Pres|VerbForm=Part	24	advcl	_	_
14919	Je vous 	offre	 ma bourse, usez-en sans façon.	3	offre	offrir	VERB	VERB	Mood=Ind|Number=Sing|Person=3|Tense=Pres|VerbForm=Fin	0	root	_	_
14928	Les Palestiniens n'y 	trouvent	" plus de ciment pour construire des tombes et """"les hôpitaux distribuent des draps parce qu'on ne trouve pas assez de linceuls"""", a-t-il ajouté. - (Avec AFP)"	5	trouvent	trouver	VERB	VERB	Mood=Ind|Number=Plur|Person=3|Tense=Pres|VerbForm=Fin	0	root	_	_
14940	Il y 	abrite	 un faune variée.	3	abrite	abriter	VERB	VERB	Mood=Ind|Number=Sing|Person=3|Tense=Pres|VerbForm=Fin	0	root	_	_
14941	Quelqu'un saurait où je 	peux	 trouver le logo de notre wiki en bonne qualité (vectoriel serait magnifique) ?	6	peux	pouvoir	VERB	VERB	Mood=Ind|Number=Sing|Person=1|Tense=Pres|VerbForm=Fin	3	acl:relcl	_	_
14957	Les candidats de la formation continue pourraient faire valider leurs acquis professionnels et universitaires ; des formations complémentaires pourraient leur être 	proposées	.	22	proposées	proposer	VERB	VERB	Gender=Fem|Number=Plur|Tense=Past|VerbForm=Part|Voice=Pass	19	xcomp	_	SpaceAfter=No
15000	Sport24.com : Pouvez-vous nous 	donner	 votre sentiment sur le tirage de la Ligue des Champions ?	6	donner	donner	VERB	VERB	VerbForm=Inf	3	xcomp	_	_
15019	Pas de doute, les finances du Québec sont toujours dans un état précaire, mais jusqu'à quel point un gouvernement peut-il compter sur un autre, celui de Stephen Harper, pour lui 	fournir	 les munitions nécessaires pour gagner des élections?	37	fournir	fournir	VERB	VERB	VerbForm=Inf	23	advcl	_	_
15032	Qui me 	dira	 d'où jaillit, au creux de la désespérance d'un monde sans espoir,	3	dira	dire	VERB	VERB	Mood=Ind|Number=Sing|Person=3|Tense=Fut|VerbForm=Fin	0	root	_	_
15038	Pat rougit de fureur rien que d'y 	repenser	.	9	repenser	repenser	VERB	VERB	VerbForm=Inf	5	acl	_	SpaceAfter=No
15066	La planète la plus proche de 55 Cancri ressemble à NeptuneNeptune, huitième planète du Système solaire, gravite sur une orbite quasi circulaire à environ 4,5 milliards de kilomètres du Soleil qu'elle 	met	 165 ans à parcourir.	35	met	mettre	VERB	VERB	Mood=Ind|Number=Sing|Person=3|Tense=Pres|VerbForm=Fin	28	acl:relcl	_	_
15079	Ce qui me 	fait	 rire avec la Wii, c'est que tous les jeux sont soi-disant révolutionnaires.	4	fait	faire	VERB	VERB	Mood=Ind|Number=Sing|Person=3|Tense=Pres|VerbForm=Fin	1	acl:relcl	_	_
15086	Selon lui, des personnes ont été relâchées et leurs papiers leur ont été 	restitués	 vers midi après vérification.	15	restitués	restituer	VERB	VERB	Gender=Masc|Number=Plur|Tense=Past|VerbForm=Part|Voice=Pass	8	conj	_	_
15095	La championne olympique du 400 mètre nage libre Laure Manaudou en 	sait	 quelque chose.	12	sait	savoir	VERB	VERB	Mood=Ind|Number=Sing|Person=3|Tense=Pres|VerbForm=Fin	0	root	_	_
15112	Les autorités de l'ancien Empire du Milieu répètent régulièrement qu'elles combattent ces pratiques dont elles sont également 	victimes	.	20	victimes	victimer	VERB	VERB	Gender=Fem|Number=Plur|Tense=Past|VerbForm=Part|Voice=Pass	15	acl:relcl	_	SpaceAfter=No
15142	Mi-convaincu, mi-mordu, je vous 	encourage	 à poursuivre le combat pour l'utilisation des nouvelles technologies de l'information dans une perspective démocratique.	7	encourage	encourager	VERB	VERB	Mood=Ind|Number=Sing|Person=1|Tense=Pres|VerbForm=Fin	0	root	_	_
15148	Une déduction fiscale de 440 000 FB (10 907,32 &euro;) est octroyée pour l'embauche de tout 	employé	 supplémentaire dans un centre de recherche scientifique.	21	employé	employer	VERB	VERB	Gender=Masc|Number=Sing|Tense=Past|VerbForm=Part	18	nmod	_	_
15154	Page 281 Quelques maquisards sont venus au restaurant Moguet-Debure, à côté de l'épicerie-boulangerie Brisson et les commerçants leur ont 	préparé	 un casse-croûte.	26	préparé	préparer	VERB	VERB	Gender=Masc|Number=Sing|Tense=Past|VerbForm=Part	8	acl:relcl	_	_
15200	Certains de ceux qui ont pu y 	jeter	" un œil disent qu'il contient beaucoup de """"yaka"""" et de """"yfô""""."	8	jeter	jeter	VERB	VERB	VerbForm=Inf	6	xcomp	_	_
15235	À l'écran, grâce à un passionnant DVD qui lui est 	consacré	.	13	consacré	consacrer	VERB	VERB	Gender=Masc|Number=Sing|Tense=Past|VerbForm=Part|Voice=Pass	8	acl:relcl	_	SpaceAfter=No
15244	Environ 2700 navires franchissent les écluses chaque année et transportent plus de 40 millions de tonnes de marchandise, mais la Voie maritime peut en 	accueillir	 le double.	26	accueillir	accueillir	VERB	VERB	VerbForm=Inf	24	xcomp	_	_
15258	Cauch leur montre une tente où sont 	organisés	 des jeux de hasard.	8	organisés	organiser	VERB	VERB	Gender=Masc|Number=Plur|Tense=Past|VerbForm=Part|Voice=Pass	5	acl:relcl	_	_
15289	Rapportée au Ray, sur le fil de l'émotion... « Quand j'ai marqué contre Grenoble, j'ai pensé à ceux qui m'ont 	apporté	 du réconfort lors du décès de mon père ».	28	apporté	apporter	VERB	VERB	Gender=Masc|Number=Sing|Tense=Past|VerbForm=Part	24	acl:relcl	_	_
15291	Mais son essai en 1998 avec Perdus dans l'espace, adaptation d'une série des années 60, ne lui 	permet	 pas de multiplier les projets.	22	permet	permettre	VERB	VERB	Mood=Ind|Number=Sing|Person=3|Tense=Pres|VerbForm=Fin	0	root	_	_
15293	La première fois où je suis 	intervenu	 sur sa page s'était pour l'avertir du bandeau sur l'article pour qu'il envoie un mail et que l'ambigüité soit levée.	7	intervenu	intervenir	VERB	VERB	Gender=Masc|Number=Sing|Tense=Past|VerbForm=Part|Voice=Pass	3	acl:relcl	_	_
15329	Pour y participer, les représentants des médias n'auront qu'à s'identifier au moment où ils s'y 	joindront	.	21	joindront	joindre	VERB	VERB	Mood=Ind|Number=Plur|Person=3|Tense=Fut|VerbForm=Fin	16	acl:relcl	_	SpaceAfter=No
15329	Pour y 	participer	, les représentants des médias n'auront qu'à s'identifier au moment où ils s'y joindront.	3	participer	participer	VERB	VERB	VerbForm=Inf	10	advcl	_	SpaceAfter=No
15334	La Fédération européenne des sociétés de neurosciences (FENS) y 	tient	 son congrès, le plus important du genre sur le continent.	12	tient	tenir	VERB	VERB	Mood=Ind|Number=Plur|Person=3|Tense=Imp|VerbForm=Fin	0	root	_	_
15338	Nos interlocuteurs nous 	demandent	 de fournir de plus en plus d'explications et de justificatifs et nous passons un temps important à remplir de volumineux dossiers.	4	demandent	demander	VERB	VERB	Mood=Ind|Number=Plur|Person=3|Tense=Pres|VerbForm=Fin	0	root	_	_
15341	C'est difficile à dire, dans la mesure où nous ne nous 	attendions	 pas nous-mêmes à ce que BenQ-Siemens soit un échec.	14	attendions	attendre	VERB	VERB	Mood=Ind|Number=Plur|Person=1|Tense=Pres|VerbForm=Fin	3	advcl	_	_
15341	C'est difficile à dire, dans la mesure où nous ne nous 	attendions	 pas nous-mêmes à ce que BenQ-Siemens soit un échec.	14	attendions	attendre	VERB	VERB	Mood=Ind|Number=Plur|Person=1|Tense=Pres|VerbForm=Fin	3	advcl	_	_
15346	Vous pourrez également y 	profiter	 de magnifiques points de vue sur le Mont Ventoux et les Monts d'Albion.	5	profiter	profiter	VERB	VERB	VerbForm=Inf	2	xcomp	_	_
15354	On m'a 	confié	" la présidence à la fois de l'association et du GIE, et c'est une dualité qui s'exerce dans une unité de décision """", dit Gérard Bekerman."	4	confié	confier	VERB	VERB	Gender=Masc|Number=Sing|Tense=Past|VerbForm=Part	0	root	_	_
15379	Commence alors une longue carrière d'enseignant en Angleterre où il 	demeure	 - exception faite d'un séjour au Ghana (1962-1964) - jusqu'à sa retraite.	12	demeure	demeure	VERB	VERB	Mood=Ind|Number=Sing|Person=3|Tense=Pres|VerbForm=Fin	5	acl:relcl	_	_
15408	Cela n'est pas innocent, mais résiste mal à la réalité et un jour ou l'autre va poser de grands problèmes de lisibilité et de compréhension tant à ceux qui y 	travaillent	 qu'à ceux qui sont des publics potentiels...	34	travaillent	travailler	VERB	VERB	Mood=Ind|Number=Plur|Person=3|Tense=Pres|VerbForm=Fin	31	acl:relcl	_	_
15443	Désirant y 	apporter	 quelques modifications, j'ai fait une recherche par nom et impossible de le retrouver.	3	apporter	apporter	VERB	VERB	VerbForm=Inf	1	xcomp	_	_
15446	La tension est palpable également à l'intérieur du centre, où l'attention se 	focalise	 sur une série d'enjeux précis pouvant basculer dans un camp ou dans l'autre.	16	focalise	focaliser	VERB	VERB	Mood=Ind|Number=Sing|Person=3|Tense=Pres|VerbForm=Fin	8	acl:relcl	_	_
15487	La police française menait mercredi une perquisition dans l'appartement de Bordeaux où ont été 	arrêtés	" les quatre membres présumés de l'ETA, qui devrait """"durer au moins toute la journée"""", a indiqué à Paris une source proche du dossier."	16	arrêtés	arrêter	VERB	VERB	Gender=Masc|Number=Plur|Tense=Past|VerbForm=Part|Voice=Pass	10	acl:relcl	_	_
15503	J'y 	représente	 cette société civile qui n'a pas toujours été entendue par le politique Ému, Morael l'était autant.	3	représente	représenter	VERB	VERB	Mood=Ind|Number=Sing|Person=3|Tense=Pres|VerbForm=Fin	0	root	_	_
15507	Ce fonctionnement par partenariats ne vous 	rapproche	-t-il pas de certains grands portails ?	7	rapproche	rapprocher	VERB	VERB	Mood=Ind|Number=Sing|Person=1|Tense=Pres|VerbForm=Fin	0	root	_	SpaceAfter=No
15517	Au lieu de poursuivre le taureau, ou de se faire poursuivre par celui-ci, il l’	attend	 de pied ferme pour l’arrêter avec sa lance, comme le font les picadors actuels.	18	attend	attendre	VERB	VERB	Mood=Ind|Number=Sing|Person=3|Tense=Pres|VerbForm=Fin	2	conj	_	_
15533	Le gouvernement brésilien finance cette expérience, et les enseignants qui y sont 	engagés	 militent pour qu'elle soit généralisée dans les plus brefs délais.	14	engagés	engager	VERB	VERB	Gender=Masc|Number=Plur|Tense=Past|VerbForm=Part	10	acl:relcl	_	_
15557	La FAQ est un endroi où l'on 	trouve	 les questions les plus posées.	9	trouve	trouver	VERB	VERB	Mood=Ind|Number=Sing|Person=3|Tense=Pres|VerbForm=Fin	5	acl:relcl	_	_
15578	Après avoir reçu leurs réponses, je viens poser le problème ici : il me 	semble	 qu'il faut là passer à un niveau de sanction rapide, et de sanction sévère.	17	semble	sembler	VERB	VERB	Mood=Ind|Number=Sing|Person=3|Tense=Pres|VerbForm=Fin	0	root	_	_
15634	Sofy Bourret lui 	succède	 comme directrice des Petites annonces et Carrières professions.	4	succède	succéder	VERB	VERB	Mood=Ind|Number=Sing|Person=3|Tense=Pres|VerbForm=Fin	0	root	_	_
15643	Le jour où le Louvre nous 	tombe	 sur le rable, on est très mal.	7	tombe	tombe	VERB	VERB	Mood=Ind|Number=Plur|Person=3|Tense=Pres|VerbForm=Fin	2	acl:relcl	_	_
15649	J'espère que tu n'es pas la réincarnation de la veuve Mao ;-) La source la plus facile à se 	procurer	" (peut-être 1/2 romancée, je ne sais pas), c'est le livre de Lucien Bodard, """"Le chien de Mao"""" (ISBN 2253148717)."	23	procurer	procurer	VERB	VERB	VerbForm=Inf	20	acl	_	_
15666	Au-dessus d'une niche vitrée, une pierre sculptée vient peut-être du prieuré : certains y ont 	vu	 une Svastika, d'autres, plutôt le trigramme JHS (Jesus Hominum Salvator : « Jésus, sauveur des hommes »).	21	vu	voir	VERB	VERB	Gender=Masc|Number=Sing|Tense=Past|VerbForm=Part	18	acl:relcl	_	_
15686	L'Association y 	contribue	 largement, en particulier au travers de la collecte des offres.L'Association contribue à la collecte des offres d'emploi.	4	contribue	contribuer	VERB	VERB	Mood=Ind|Number=Sing|Person=3|Tense=Pres|VerbForm=Fin	0	root	_	_
15715	Luc Perret dénonce ainsi carrément «les distorsions de concurrence» qui en ont 	découlé	.	15	découlé	découler	VERB	VERB	Gender=Masc|Number=Sing|Tense=Past|VerbForm=Part	8	acl:relcl	_	SpaceAfter=No
15720	Il lui appartient d'y 	contribuer	 en tant que médiateur et facilitateur des relations interpartenariales.	6	contribuer	contribuer	VERB	VERB	VerbForm=Inf	3	xcomp	_	_
15720	Il lui 	appartient	 d'y contribuer en tant que médiateur et facilitateur des relations interpartenariales.	3	appartient	appartenir	VERB	VERB	Mood=Ind|Number=Sing|Person=3|Tense=Pres|VerbForm=Fin	0	root	_	_
15768	J'estime que pour faire face à de telles perspectives, il faut qu'il y 	ait	 une autre compagnie pour épauler Air Madagascar.	17	ait	avoir	VERB	VERB	Mood=Ind|Number=Sing|Person=3|Tense=Pres|VerbForm=Fin	13	ccomp	_	_
15770	On ne peut vivre dans un monde où le logiciel libre n'	existerait	 pas.	13	existerait	exister	VERB	VERB	Mood=Ind|Number=Sing|Person=3|Tense=Imp|VerbForm=Fin	3	ccomp	_	_
15795	Fasciné par son enfance et ses souvenirs de Falkenberg, où il a grandi auprès d'une mère professeur de langues et d'un père illustrateur, Jesper, qui vit à  Stockholm depuis des années, a décidé d'en 	faire	 un film.	43	faire	faire	VERB	VERB	VerbForm=Inf	40	xcomp	_	_
15805	Laisser en définitive 	coexister	 deux dynamiques relationnelles, l'une ayant un objet productif, l'autre devenant celle que lui donneront les collaborateurs.	4	coexister	coexister	VERB	VERB	VerbForm=Inf	1	xcomp	_	_
15828	L'époque où le ministre-Président de Bavière 	louait	 le manager belge pour avoir sauvé, en tant que second du milliardaire Haim Saban, de la faillite ProSieben Sat.1 implanté à Munich, est bien révolue.	10	louait	louer	VERB	VERB	Mood=Ind|Number=Sing|Person=3|Tense=Imp|VerbForm=Fin	2	acl:relcl	_	_
