Unnamed: 0,sent_id,left_context,pivot,right_context,ID,FORM,LEMMA,UPOS,XPOS,FEATS,HEAD,DEPREL,DEPS,MISC,dist
654,fr-ud-train_01478,Les comptes à ,déclarer," sont ceux ouverts hors de France auprès d'un établissement bancaire ou de tout autre organisme, administration publique ou personne (notaire, agent de change, etc.) ",4,déclarer,déclarer,VERB,_,VerbForm=Inf,2,acl,_,Subject=Generic,1
1838,fr-ud-train_07317,"Certaines de ces images sont insoutenables """", a ",déclaré," la présidente du tribunal, Marie-Françoise Guidolin. ",10,déclaré,déclarer,VERB,_,Gender=Masc|Number=Sing|Tense=Past|VerbForm=Part|Voice=Act,6,parataxis:insert,_,_,3
1934,fr-ud-train_07819,"Tout le monde peut voir l'état de détérioration dans lequel se trouve cette sculpture"""", a ",déclaré," la sénatrice Maria Eugenia Estenssoro (Coalition Civique, opposition). ",20,déclaré,déclarer,VERB,_,Gender=Masc|Number=Sing|Tense=Past|VerbForm=Part|Voice=Act,5,parataxis:insert,_,_,2
1995,fr-ud-train_08093,"Au total, sur la période 2011-2014, la Grèce pourrait voir sa dette publique allégée d'au moins 26 milliards d'euros, soit 12% du PIB, a ",déclaré, le premier ministre grec Georges Papandréou. ,35,déclaré,déclarer,VERB,_,Gender=Masc|Number=Sing|Tense=Past|VerbForm=Part|Voice=Act,12,parataxis:insert,_,_,1
2756,fr-ud-train_11911,"Il a vécu 28 ans en Belgique, et il a même fait ici le service militaire """", a ",déclaré, sa soeur Farida citée par l'agence Belga. ,21,déclaré,déclarer,VERB,_,Gender=Masc|Number=Sing|Tense=Past|VerbForm=Part|Voice=Act,3,parataxis:insert,_,_,2
2866,fr-ud-train_12458,"« C'est un début, a ",déclaré, M. Bertrand. ,8,déclaré,déclarer,VERB,_,Gender=Masc|Number=Sing|Tense=Past|VerbForm=Part|Voice=Act,5,parataxis:insert,_,_,2
