sent_id	left_context	pivot	right_context
ParisStories_2020_anecdoteMetro_3	ben, je me suis 	fait	 mal à la cheville, tu vois. 
ParisStories_2020_anecdoteMetro_9	il y 	a	 toujours des soucis, euh, avec les transports de toute façon. 
ParisStories_2020_anecdoteMetro_10	ouais, mais j'ai hésité, donc je me suis dit, oh, vas-y, j'	ai	 la flemme aujourd'hui, je vais aller, euh, au bus, euh, avec le bus jusqu'au métro. 
ParisStories_2020_anecdoteMetro_10	ouais, mais j'ai hésité, donc je me suis dit, oh, 	vas	-y, j'ai la flemme aujourd'hui, je vais aller, euh, au bus, euh, avec le bus jusqu'au métro. 
ParisStories_2020_anecdoteMetro_11	donc le bus j'arrive j'arrive pile poil pour le 	prendre	, et tout, super contente et tout. 
ParisStories_2020_anecdoteMetro_12	et je 	vois	 quoi, je vois qu'en fait le bus, il est blindé, blindé, blindé, blindé, blindé. 
ParisStories_2020_anecdoteMetro_17	on a fait deux stations, il y 	avait	 des gens qui montaient etc, enfin, c'était beaucoup blindé pour un samedi matin quand même ! 
ParisStories_2020_anecdoteMetro_17	on a 	fait	 deux stations, il y avait des gens qui montaient etc, enfin, c'était beaucoup blindé pour un samedi matin quand même ! 
ParisStories_2020_anecdoteMetro_20	et en fait, euh, ce qui s'est passé, c'est que genre, euh, il y 	a	 des gens, en fait, ils étaient pressés de descendre. 
ParisStories_2020_anecdoteMetro_21	donc il y a 	eu	 un mouvement de foule. 
ParisStories_2020_anecdoteMetro_25	et j'	avais	 mon sac à côté de moi genre, euh, enfin, à la main gauche. 
ParisStories_2020_anecdoteMetro_26	hein, tu dois l'	enlever	. 
ParisStories_2020_anecdoteMetro_28	et, euh, genre en fait, ben, il s'est 	passé	 quoi. 
ParisStories_2020_anecdoteMetro_36	et un monsieur qui me 	tient	 un petit papier, et tout ça, qui était, qui disait non mais vous êtes sûre mademoiselle vous allez bien? 
ParisStories_2020_descenteCanoe_3	on l'avait 	emmenée	. 
ParisStories_2020_descenteCanoe_4	et, on avait décidé de 	faire	 cette journée là, la descente de l'Ardèche. 
ParisStories_2020_descenteCanoe_5	et, du coup, euh, la veille, on avait 	réservé	 des canoës. 
ParisStories_2020_descenteCanoe_6	il y 	avait	 soit les horaires, du coup, euh, deux heures, quatre heures ou huit heures. 
ParisStories_2020_descenteCanoe_7	et mon père, il voulait absolument 	faire	 huit heures. 
ParisStories_2020_descenteCanoe_9	on voulait pas du tout le 	faire	. 
ParisStories_2020_descenteCanoe_10	on était là, non mais c'est pas possible, ça va pas le 	faire	. 
ParisStories_2020_descenteCanoe_11	et au final, bon bah on s'est 	lancé	. 
ParisStories_2020_descenteCanoe_15	on 	avait	 nos canoës, on est rentré dedans. 
ParisStories_2020_descenteCanoe_18	et, euh, il y 	a	 un moment où avec mon amie, on s'est échoué sur, euh, sur, euh, le rivage. 
ParisStories_2020_descenteCanoe_20	et, bah, je savais qu'il y en avait une de nous deux qui devait s'y coller, en fait, pour le 	pousser	. 
ParisStories_2020_descenteCanoe_20	et, bah, je savais qu'il y en 	avait	 une de nous deux qui devait s'y coller, en fait, pour le pousser. 
ParisStories_2020_descenteCanoe_21	du coup, euh, moi c'était mort, je voulais pas le 	faire	, parce que je savais qu'il allait partir sans moi. 
ParisStories_2020_descenteCanoe_22	et, du coup, euh, bah Juliette l'a 	fait	. 
ParisStories_2020_descenteCanoe_23	elle est sortie, elle a 	poussé	 le canoë. 
ParisStories_2020_descenteCanoe_28	et au final, il y 	avait	 une cascade, juste à côté en plus. 
ParisStories_2020_descenteCanoe_29	et, elle a 	pris	 la rapide. 
ParisStories_2020_descenteCanoe_31	elle a 	fait	 la cascade toute seule, donc bon, voilà. 
ParisStories_2020_descenteCanoe_32	ensuite, euh après, il s'est 	passé	 quoi ? 
ParisStories_2020_descenteCanoe_34	et, euh, en fait, tu vois, il y 	avait	 plein de rapides. 
ParisStories_2020_descenteCanoe_35	et il y en 	avait	 une, particulièrement, qui était mais vraiment, euh, terrible terrible. 
ParisStories_2020_descenteCanoe_39	et à chaque fois, pour essayer de 	rejoindre	 ma mère, il devait, euh, entre guillemets, euh, marcher sur les cailloux, 
ParisStories_2020_descenteCanoe_40	sauf que ça glissait énormément parce qu'il y 	avait	 de la mousse dessus. 
ParisStories_2020_descenteCanoe_42	ensuite, euh, qu'est-ce qu'il y 	avait	, euh ? 
ParisStories_2020_descenteCanoe_43	on a échangé de de binôme, je me suis 	retrouvée	 avec ma mère. 
ParisStories_2020_dragQueen_2	non surtout Eleanor, en fait, qui m'a dit de 	regarder	 une émission de RuPaul. 
ParisStories_2020_dragQueen_11	et, elle pouvait pas du tout 	changer	 son séjour, sa date de séjour. 
ParisStories_2020_dragQueen_12	donc, en fait, ils m'ont proposé, euh, bah, que je 	récupère	 la place de Maude. 
ParisStories_2020_dragQueen_13	ce que j'ai 	fait	. 
ParisStories_2020_dragQueen_18	et, donc, on y est allé, bah, je l'ai 	retrouvée	. 
ParisStories_2020_dragQueen_19	euh, on s'est 	retrouvé	 directement là-bas, à, à, Etoile. 
ParisStories_2020_dragQueen_21	et, donc, ensuite on est arrivé là-bas, mais il y 	avait	 une queue énorme. 
ParisStories_2020_dragQueen_27	en fait, euh, il devait y 	avoir	 certaines drag queens à la base, qui étaient annoncés. 
ParisStories_2020_dragQueen_29	il y en avait, il devait y en avoir genre, euh, cinq et finalement il y en a eu six, dont deux qu'on 	savait	 pas du tout. 
ParisStories_2020_dragQueen_29	il y en avait, il devait y en avoir genre, euh, cinq et finalement il y en a 	eu	 six, dont deux qu'on savait pas du tout. 
ParisStories_2020_dragQueen_29	il y en avait, il devait y en 	avoir	 genre, euh, cinq et finalement il y en a eu six, dont deux qu'on savait pas du tout. 
ParisStories_2020_dragQueen_29	il y en 	avait	, il devait y en avoir genre, euh, cinq et finalement il y en a eu six, dont deux qu'on savait pas du tout. 
ParisStories_2020_dragQueen_31	un peu en hauteur pour bien voir la scène, même si il y 	avait	 un bon gros, une bonne grosse sono au milieu. 
ParisStories_2020_dragQueen_31	un peu en hauteur pour bien 	voir	 la scène, même si il y avait un bon gros, une bonne grosse sono au milieu. 
ParisStories_2020_dragQueen_35	et il y avait tout le monde, beaucoup trop de monde donc on aurait rien 	vu	. 
ParisStories_2020_dragQueen_35	et il y 	avait	 tout le monde, beaucoup trop de monde donc on aurait rien vu. 
ParisStories_2020_galereNice_2	on y allait pour 	passer	 le concours d'orthophonie. 
ParisStories_2020_galereNice_5	et euh on décide de partir quelques jours avant le concours pour voir des amis qu'on 	a	 là-bas. 
ParisStories_2020_galereNice_5	et euh on décide de partir quelques jours avant le concours pour 	voir	 des amis qu'on a là-bas. 
ParisStories_2020_galereNice_12	on, on 	fait	 notre petite vie à Nice tout tranquillement. 
ParisStories_2020_galereNice_14	c'est bizarre, parce que c'est vrai que qu'il nous 	arrive	 toujours des galères quand on est en voyage. 
ParisStories_2020_galereNice_16	mais il ne faut jamais 	dire	 ça avant d'être rentré chez soi. 
ParisStories_2020_galereNice_17	et, je vais vous 	dire	 pourquoi. 
ParisStories_2020_galereNice_19	on passe le concours qui 	dure	 toute l'après-midi. 
ParisStories_2020_galereNice_19	on 	passe	 le concours qui dure toute l'après-midi. 
ParisStories_2020_galereNice_22	euh, du coup on se dit : bon bah tranquille tranquille on 	a	 le temps euh. 
ParisStories_2020_galereNice_24	on va aller prendre un petit euh prendre à manger, et 	faire	 les boutiques. 
ParisStories_2020_galereNice_24	on va aller 	prendre	 un petit euh prendre à manger, et faire les boutiques. 
ParisStories_2020_galereNice_28	on 	fait	 les boutiques. 
ParisStories_2020_galereNice_29	on on 	achète	 notre petit goûter, tout ça. 
ParisStories_2020_galereNice_30	et vers je 	sais	 plus trop quelle heure, on se dit : faudrait quand même, euh, aller vers l'aéroport. 
ParisStories_2020_galereNice_31	donc on va prendre le bus qui est censé nous 	emmener	 à l'aéroport. 
ParisStories_2020_galereNice_31	donc on va 	prendre	 le bus qui est censé nous emmener à l'aéroport. 
ParisStories_2020_galereNice_32	euh, on le 	prend	. 
ParisStories_2020_galereNice_33	on le 	trouve	. 
ParisStories_2020_galereNice_38	là il n'y 	a	 qu'une seule route pour y aller. 
ParisStories_2020_galereNice_43	on 	voit	 pas le bout. 
ParisStories_2020_galereNice_46	enfin, donc, là, on 	prend	 notre mal en patience. 
ParisStories_2020_histoireOurs_2	je, je, je fais, je 	disais	 rien. 
ParisStories_2020_histoireOurs_3	parce que s~, si je commençais à crier ou à, à pleurer, ça pouvait, ça pouvait le rendre, ça pouvait 	rendre	 l'animal encore plus agressif ! 
ParisStories_2020_histoireOurs_3	parce que s~, si je commençais à crier ou à, à pleurer, ça pouvait, ça pouvait le 	rendre	, ça pouvait rendre l'animal encore plus agressif ! 
ParisStories_2020_histoireOurs_7	et, euh, j'en 	avais	 tellement marre. 
ParisStories_2020_histoireOurs_10	j'ai 	ouvert	 le zip de la tente. 
ParisStories_2020_histoireOurs_12	j'ai 	envoyé	 mon coussin, mon, mon sac de couchage sur, sur l'animal en croyant que c'était vraiment un, un ours. 
ParisStories_2020_histoireOurs_13	et, en fait, après, je me suis rendu compte que c'était un déguisement puisque l'animateur, il avait 	enlevé	 la tête de son déguisement. 
ParisStories_2020_histoireOurs_15	donc, sur le coup, c'est vrai que je me suis 	sentie	 tellement bête. 
ParisStories_2020_histoireOurs_15	donc, sur le coup, c'est vrai que je me suis 	sentie	 tellement bête. 
ParisStories_2020_histoireOurs_17	et, euh, donc, après, on est, ils étaient tous, euh, genre, vraiment, euh, ils étaient, ils étaient tous en train de rigoler parce qu'ils nous avaient 	fait	 une mauvaise blague. 
ParisStories_2020_histoireOurs_18	donc, c'est vrai que, sur le coup, on l'avait tellement mal 	pris	, quoi. 
ParisStories_2020_histoireOurs_20	donc, après, on, on est partie, s~, se, euh, 	recoucher	, en espérant que il se passe rien. 
ParisStories_2020_histoireOurs_23	donc, euh, voilà, ils en 	pouvaient	 plus, hein. 
ParisStories_2020_histoireOurs_25	et, en fait, on s'est rendu compte, quand même, que il y 	avait	 des, des casseroles et des, des popotes, donc, nos gammelles, dans lesquelles on mangeait, qui avaient, quand même, disparu. 
ParisStories_2020_histoireOurs_26	et on voyait, quand même, qu'il y avait des traces sur, euh, sur le van comme si, que, l'animal, il y avait un animal qui avait voulu manger quelque chose, qui avait 	senti	 quelque chose. 
ParisStories_2020_histoireOurs_26	et on voyait, quand même, qu'il y avait des traces sur, euh, sur le van comme si, que, l'animal, il y avait un animal qui avait voulu 	manger	 quelque chose, qui avait senti quelque chose. 
ParisStories_2020_histoireOurs_26	et on voyait, quand même, qu'il y avait des traces sur, euh, sur le van comme si, que, l'animal, il y 	avait	 un animal qui avait voulu manger quelque chose, qui avait senti quelque chose. 
ParisStories_2020_histoireOurs_26	et on voyait, quand même, qu'il y 	avait	 des traces sur, euh, sur le van comme si, que, l'animal, il y avait un animal qui avait voulu manger quelque chose, qui avait senti quelque chose. 
ParisStories_2020_histoireOurs_28	il y avait, vraiment, peut-être, 	eu	 un animal qui est venu. 
ParisStories_2020_maisonAbondonnee_5	on allait 	chercher	 des bonbons au village. 
ParisStories_2020_maisonAbondonnee_6	et un jour, il y a, euh, une copine, euh, de ma meilleure amie qui elle habitait là-bas qui, euh, qui nous a 	amenées	 dans un endroit. 
ParisStories_2020_maisonAbondonnee_6	et un jour, il y 	a	, euh, une copine, euh, de ma meilleure amie qui elle habitait là-bas qui, euh, qui nous a amenées dans un endroit. 
ParisStories_2020_maisonAbondonnee_10	et donc, il y 	avait	 vraiment, euh, des vieux meubles. 
ParisStories_2020_maisonAbondonnee_13	et il y 	avait	 un escalier. 
ParisStories_2020_maisonAbondonnee_16	et arrivé là-haut, il y 	avait	 un vieux lit en fer. 
ParisStories_2020_maisonAbondonnee_17	et par terre sur le sol, il y 	avait	 une vieille valise. 
ParisStories_2020_maisonAbondonnee_18	et dans cette valise, il y 	avait	 des lettres, euh, des enveloppes. 
ParisStories_2020_maisonAbondonnee_19	on pouvait pas lire ce qu'il y avait 	écrit	 parce que c'était effacé, enfin, c'était très vieux, quoi. 
ParisStories_2020_maisonAbondonnee_19	on pouvait pas 	lire	 ce qu'il y avait écrit parce que c'était effacé, enfin, c'était très vieux, quoi. 
ParisStories_2020_maisonAbondonnee_20	on avait 	trouvé	 des vieilles pièces. 
ParisStories_2020_maisonAbondonnee_21	euh, on en avait pris même pour, euh, les 	montrer	 à nos parents, quoi. 
ParisStories_2020_maisonAbondonnee_21	euh, on en avait 	pris	 même pour, euh, les montrer à nos parents, quoi. 
ParisStories_2020_requinReunion_1	il y a un truc qui m'a 	marquée	. 
ParisStories_2020_requinReunion_1	il y 	a	 un truc qui m'a marquée. 
ParisStories_2020_requinReunion_3	et à la radio on a 	entendu	 un, un événement avec un requin euh, un événement grave. 
ParisStories_2020_requinReunion_6	et euh, il y a 	eu	 le drapeau rouge euh, comme quoi c'était un moment dangereux euh, euh, pour surfer. 
ParisStories_2020_requinReunion_9	et euh, tous les surfers sont partis à part, enfin ce que 	disaient	 euh, les personnes, les les personnes à la radio, sauf lui. 
ParisStories_2020_requinReunion_13	du coup ça nous a un peu choqués d'	entendre	 ça. 
ParisStories_2020_requinReunion_13	du coup ça nous a un peu 	choqués	 d'entendre ça. 
ParisStories_2020_requinReunion_14	et euh le volcan euh, tu as pu euh, 	approcher	 le volcan ? 
ParisStories_2020_requinReunion_21	on a 	vu	 le cratère. 
ParisStories_2020_requinReunion_25	je me suis 	tordu	 la cheville. 
ParisStories_2020_requinReunion_27	mon père il me port~ enfin il me tenait s~ enfin je me 	tenais	 à l~ à son épaule. 
ParisStories_2020_requinReunion_27	mon père il me 	port~	 enfin il me tenait s~ enfin je me tenais à l~ à son épaule. 
ParisStories_2020_requinReunion_30	parce qu'il y 	a	 des belles choses à voir. 
ParisStories_2020_requinReunion_31	bah justement euh, l'année où on est parti euh, à la Réunion, c'e~ je venais de 	passer	 mon niveau un de plongée. 
ParisStories_2020_sangDEncre_1	alors, euh, je vais vous parler aujourd'hui de, euh, du jour où quand j'	avais	 quatorze ans. 
ParisStories_2020_sangDEncre_2	mon avion a 	fait	 demi-tour pour cause de problème technique, euh. 
ParisStories_2020_sangDEncre_4	alors, en fait, donc, c'était, du coup, quand j'	avais	 quatorze ans, j'étais chez mes grands-parents près d'Agen. 
ParisStories_2020_sangDEncre_5	et, du coup, euh, je prenais l'avion pour rentrer à Paris puisque, euh, ils pensaient, euh, ma famille pensait que c'était plus sûr pour moi, de, comme je voyageais toute seule, de 	prendre	 l'avion plutôt que le train. 
ParisStories_2020_sangDEncre_5	et, du coup, euh, je 	prenais	 l'avion pour rentrer à Paris puisque, euh, ils pensaient, euh, ma famille pensait que c'était plus sûr pour moi, de, comme je voyageais toute seule, de prendre l'avion plutôt que le train. 
ParisStories_2020_sangDEncre_9	et, euh, moi ça ne m'a jamais posé de soucis puisque je suis, euh, fan d'aviation, et que j'adore l'avion et que dès que je 	prends	 l'avion je suis heureuse et que j'ai jamais eu peur en avion. 
ParisStories_2020_sangDEncre_9	et, euh, moi ça ne m'a jamais posé de soucis puisque je suis, euh, fan d'aviation, et que j'	adore	 l'avion et que dès que je prends l'avion je suis heureuse et que j'ai jamais eu peur en avion. 
ParisStories_2020_sangDEncre_16	je 	lis	 un livre et je me souviens même du livre en question. 
ParisStories_2020_sangDEncre_19	je 	lis	 tranquillement mon livre. 
ParisStories_2020_sangDEncre_22	les, des, des avions à hélices, euh, c'est des avions qui, euh, qui 	font	 juste le transport en France. 
ParisStories_2020_sangDEncre_23	en fait, des petits avions où il y a que, bah, du coup, dans celui-là il y 	avait	 que quarante-deux places. 
ParisStories_2020_sangDEncre_26	et, du coup, euh, voilà en plein vol au bout d'une demi-heure de vol, l'hôtesse, euh, nous communique que, euh, on allait devoir faire demi-tour, euh jusqu'à l'aéroport d'Agen, puisque il y 	avait	 une alarme qui sonnait dans le cockpit depuis le décollage. 
ParisStories_2020_sangDEncre_26	et, du coup, euh, voilà en plein vol au bout d'une demi-heure de vol, l'hôtesse, euh, nous communique que, euh, on allait devoir 	faire	 demi-tour, euh jusqu'à l'aéroport d'Agen, puisque il y avait une alarme qui sonnait dans le cockpit depuis le décollage. 
ParisStories_2020_sangDEncre_27	et que du coup, bah, comme ils arrivaient pas à trouver d'où venait ce problème, euh, il fallait rentrer à Agen plutôt que de 	finir	 la route jusqu'à Paris. 
ParisStories_2020_sangDEncre_27	et que du coup, bah, comme ils arrivaient pas à trouver d'où 	venait	 ce problème, euh, il fallait rentrer à Agen plutôt que de finir la route jusqu'à Paris. 
ParisStories_2020_sangDEncre_33	ça va être horrible parce que en plus là-bas, euh, euh, une fois que tu es parti de l'aéroport, euh, il fallait 	faire	 une heure de deux heures de route pour aller jusqu'à chez mes grands-parents en voiture. 
ParisStories_2020_sangDEncre_34	et je me suis dit mon dieu, pour les joindre après pour qu'ils 	fassent	 demi-tour, ça va être un cauchemar. 
ParisStories_2020_sangDEncre_34	et je me suis dit mon dieu, pour les 	joindre	 après pour qu'ils fassent demi-tour, ça va être un cauchemar. 
ParisStories_2020_sangDEncre_35	vous voyez très bien, euh, 	visualisez	 l'esprit de, euh, d'une ado de quatorze ans qui se fait tout un sang d'encre. 
ParisStories_2020_sangDEncre_36	XXX c'est-à-dire que moi je n'avais rien à faire que l'avion 	fasse	 demi-tour. 
ParisStories_2020_sangDEncre_36	XXX c'est-à-dire que moi je n'	avais	 rien à faire que l'avion fasse demi-tour. 
ParisStories_2020_sangDEncre_37	et enfin très clairement ça ne me faisait pas peur qu'une alarme sonne dans le cockpit, parce que j'	ai	 totalement confiance, euh, en l'aviation. 
ParisStories_2020_sangDEncre_38	mais j'avais plus peur du coup de, de, euh, d'atterrir, euh, à Agen et de me dire mes grands-parents sont pas là, ils sont partis je ne les 	reverrai	 jamais, et je vais jamais rentrer chez moi. 
ParisStories_2020_sangDEncre_39	et, donc du coup on arrive à l'aéroport, et je n'arrive pas à joindre mes grands-parents puisqu'il n'y 	a	 aucun réseau réseau dans le Sud-Ouest, mais rien du tout rien, rien, rien c'est infernal ! 
ParisStories_2020_sangDEncre_39	et, donc du coup on arrive à l'aéroport, et je n'arrive pas à 	joindre	 mes grands-parents puisqu'il n'y a aucun réseau réseau dans le Sud-Ouest, mais rien du tout rien, rien, rien c'est infernal ! 
ParisStories_2020_sangDEncre_40	j'arrive pas à les joindre, je les appelle six fois sept fois, impossible de les 	joindre	. 
ParisStories_2020_sangDEncre_40	j'arrive pas à les joindre, je les 	appelle	 six fois sept fois, impossible de les joindre. 
ParisStories_2020_sangDEncre_40	j'arrive pas à les 	joindre	, je les appelle six fois sept fois, impossible de les joindre. 
ParisStories_2020_sangDEncre_41	donc je 	fais	 littéralement une crise de panique dans l'aéroport à moitié. 
ParisStories_2020_sangDEncre_42	l'aéroport d'Agen 	fait	, euh, je ne sais pas, la taille d'une petite maison. 
ParisStories_2020_sangDEncre_44	un agent vient me 	voir	 et me dit, et tout, il ne faut pas paniquer t'inquiète pas, euh. 
ParisStories_2020_sangDEncre_45	ils vont venir te 	chercher	. 
ParisStories_2020_sangDEncre_47	j'arrive enfin à 	avoir	 mes grands-parents, euh. 
ParisStories_2020_sangDEncre_48	ils viennent me chercher, euh, du coup une heure et demie plus tard, parce que le temps de 	faire	 le retour etc. 
ParisStories_2020_sangDEncre_48	ils viennent me 	chercher	, euh, du coup une heure et demie plus tard, parce que le temps de faire le retour etc. 
ParisStories_2020_sangDEncre_50	et, euh, du coup tout s'est un peu enragé, euh, puisqu'ils nous ont mis dans le vol du lendemain, le temps de 	réparer	 l'avion et tout. 
ParisStories_2020_sangDEncre_50	et, euh, du coup tout s'est un peu enragé, euh, puisqu'ils nous ont 	mis	 dans le vol du lendemain, le temps de réparer l'avion et tout. 
ParisStories_2020_sangDEncre_52	et puis aussi, autre chose la réaction de ma mère en 	sachant	 ça, en sachant que à l'heure que j'arrivais à Paris, je n'arrivais pas à Paris. 
ParisStories_2020_sangDEncre_54	et que l'avion a 	fait	 demi-tour. 
ParisStories_2020_sangDEncre_58	l'avion a 	fait	 demi-tour quoi, euh. 
ParisStories_2020_sangDEncre_59	il a 	fait	 trois quarts du chemin, euh. 
ParisStories_2020_sangDEncre_60	en fait, il a 	fait	 demi-tour. 
ParisStories_2020_sangDEncre_66	j'avais un peu peur de ne jamais 	revoir	 mes grands-parents, euh. 
ParisStories_2020_sangDEncre_67	mais connaissant la situation de l'avion lui-même qui faisait demi-tour ça ne me faisait pas peur mais c'était plutôt de, de 	rester	 seule à l'aéroport. 
ParisStories_2020_sangDEncre_67	mais connaissant la situation de l'avion lui-même qui 	faisait	 demi-tour ça ne me faisait pas peur mais c'était plutôt de, de rester seule à l'aéroport. 
ParisStories_2020_sangDEncre_67	mais 	connaissant	 la situation de l'avion lui-même qui faisait demi-tour ça ne me faisait pas peur mais c'était plutôt de, de rester seule à l'aéroport. 
ParisStories_2020_sangDEncre_68	j'avais l'impression que j'allais me faire bouffer par des hyènes ou des sangliers plutôt parce que c'	était	 le coin. 
ParisStories_2020_sangDEncre_69	il n'y a tellement rien autour que je, je me voyais déjà rentrer en taxi toute seule juste dans le village pommé de mes grands-parents et que mes grands-parents doivent 	payer	 cent soixante euros de taxi. 
ParisStories_2020_sangDEncre_72	et au final, aujourd'hui, j'en 	garde	 un bon souvenir. 
ParisStories_2021_discussionSansAbris_1	alors, en fait, en deux mille seize, quand j'ai eu mon bac, je savais pas trop ce que je voulais 	faire	 comme études. 
ParisStories_2021_discussionSansAbris_1	alors, en fait, en deux mille seize, quand j'ai eu mon bac, je 	savais	 pas trop ce que je voulais faire comme études. 
ParisStories_2021_discussionSansAbris_1	alors, en fait, en deux mille seize, quand j'ai 	eu	 mon bac, je savais pas trop ce que je voulais faire comme études. 
ParisStories_2021_discussionSansAbris_2	donc, je savais que je voulais faire professeur des écoles, mais, euh, je savais pas trop ce que je voulais 	faire	 avant. 
ParisStories_2021_discussionSansAbris_2	donc, je savais que je voulais faire professeur des écoles, mais, euh, je 	savais	 pas trop ce que je voulais faire avant. 
ParisStories_2021_discussionSansAbris_2	donc, je savais que je voulais 	faire	 professeur des écoles, mais, euh, je savais pas trop ce que je voulais faire avant. 
ParisStories_2021_discussionSansAbris_3	et du coup, histoire de faire quelque chose, euh, je me suis 	inscrit	 en licence d'espagnol, donc, à Paris 3. 
ParisStories_2021_discussionSansAbris_3	et du coup, histoire de 	faire	 quelque chose, euh, je me suis inscrit en licence d'espagnol, donc, à Paris 3. 
ParisStories_2021_discussionSansAbris_4	donc, c'était pas forcément, enfin, j'	avais	 pas forcément une attirance spéciale pour l'espagnol. 
ParisStories_2021_discussionSansAbris_5	mais fallait bien que, que je 	fasse	 une licence. 
ParisStories_2021_discussionSansAbris_6	du coup, euh, je me suis 	inscrit	 en espagnol. 
ParisStories_2021_discussionSansAbris_9	j'avais 	passé	 quasiment toute ma vie à la campagne. 
ParisStories_2021_discussionSansAbris_10	donc ça a 	fait	 pas mal de changements d'un coup, donc, passer du lycée à la fac. 
ParisStories_2021_discussionSansAbris_12	et du coup, en première année de licence, il y 	avait	 pas mal de, de travail, pas mal de cours, surtout que je venais d'un bac S. 
ParisStories_2021_discussionSansAbris_13	donc j'	avais	 énormément de, de lacunes, dans pas mal de matières littéraires. 
ParisStories_2021_discussionSansAbris_14	donc, j'	avais	 pas mal de difficultés. 
ParisStories_2021_discussionSansAbris_15	mais j'avais réussi, en fait, à 	organiser	 mon emploi du temps, pour pouvoir aller à la salle de sport tous les aprems. 
ParisStories_2021_discussionSansAbris_16	et donc, les deux premières semaines, je commence à aller à la salle de sport, donc, à 	prendre	 mes marques etc. 
ParisStories_2021_discussionSansAbris_17	je fais mes séances de sport, et en sortant de la salle, je me rends compte que, devant la salle, je me rends compte qu'il y 	a	 un sans-abri qui est là, tous les jours, à la même heure. 
ParisStories_2021_discussionSansAbris_17	je 	fais	 mes séances de sport, et en sortant de la salle, je me rends compte que, devant la salle, je me rends compte qu'il y a un sans-abri qui est là, tous les jours, à la même heure. 
ParisStories_2021_discussionSansAbris_19	et je me rends compte qu'en fait tout le monde l'	ignore	. 
ParisStories_2021_discussionSansAbris_20	personne le 	regarde	. 
ParisStories_2021_discussionSansAbris_21	personne lui dit quoi que ce 	soit	. 
ParisStories_2021_discussionSansAbris_21	personne lui 	dit	 quoi que ce soit. 
ParisStories_2021_discussionSansAbris_22	de temps en temps, il y a quelqu'un qui s'arrête pour lui donner une pièce, mais sans le 	regarder	. 
ParisStories_2021_discussionSansAbris_22	de temps en temps, il y a quelqu'un qui s'arrête pour lui 	donner	 une pièce, mais sans le regarder. 
ParisStories_2021_discussionSansAbris_22	de temps en temps, il y a quelqu'un qui s'	arrête	 pour lui donner une pièce, mais sans le regarder. 
ParisStories_2021_discussionSansAbris_22	de temps en temps, il y 	a	 quelqu'un qui s'arrête pour lui donner une pièce, mais sans le regarder. 
