sent_id,left_context,pivot,right_context
ParisStories_2019_cuisineApproximative_5,"et en gros euh, ensuite, ensuite, tu ",mets," le beurre, genre des morceaux de beurre, "
ParisStories_2019_cuisineApproximative_6,et là j'ai ,regardé, la recette pour une fois du coup quand je t'en ai fait aujourd'hui. 
ParisStories_2019_cuisineApproximative_13,"euh, l'eau s'évapore et donc ça permet que, euh, en fait, la pâte se ",détache," des bords de la casserole parce que l'eau est évaporée, "
ParisStories_2019_cuisineApproximative_14,et du coup tu ,finis, avec une vraie boule de pâte. 
ParisStories_2019_cuisineApproximative_23,"là je rajoute le fr~, fromage et tout, et euh, non non non bah je je l'",enlève," du feu en fait, dès que, dès que le beurre est fondu. "
ParisStories_2019_cuisineApproximative_24,"en fait, quand tu ",mets, la farine à le final ça se décolle. 
ParisStories_2019_cuisineApproximative_28,"mais du coup après tu le retires du feu une fois que, une fois que c'est, XXX enfin une fois qu~ une fois que le beurre a fondu et que la la farine a été mise et que ça s'est bien ",décollé, de la casserole. 
ParisStories_2019_cuisineApproximative_28,mais du coup après tu le ,retires," du feu une fois que, une fois que c'est, XXX enfin une fois qu~ une fois que le beurre a fondu et que la la farine a été mise et que ça s'est bien décollé de la casserole. "
ParisStories_2019_devoirPhilosophie_2,le sujet c'était peut-on se ,mettre, à la place d'autrui ? 
ParisStories_2019_devoirPhilosophie_5,"mais bon, le prof nous avait quand même euh, ",initiés," à la dissertation, en nous expliquant euh, ce qu'était la thèse, l'antithèse et la synthèse. "
ParisStories_2019_devoirPhilosophie_6,"nous avait dit aussi d'utiliser des euh, arguments hum, plutôt atypiques pas toujours euh, ceux du cours, et d'utiliser aussi euh, des exemples et des citations d'auteurs, et de savoir les expliquer et de pas les ",balancer, que dans le vent comme ça. 
ParisStories_2019_devoirPhilosophie_7,du coup je m'étais ,penchée, un peu sur mon devoir 
ParisStories_2019_devoirPhilosophie_9,donc je l'ai ,laissé," un peu de côté tu vois, quelques jours. "
ParisStories_2019_devoirPhilosophie_9,donc je l'ai ,laissé," un peu de côté tu vois, quelques jours. "
ParisStories_2019_devoirPhilosophie_10,et ensuite je suis ,revenue," dessus~fin, pas tout de suite. "
ParisStories_2019_devoirPhilosophie_11,"en fait, un jour, j'",ai," euh, j'entends, j'écoutais pardon la radio. "
ParisStories_2019_devoirPhilosophie_13,"et euh, j'écoutais le témoignage d'une euh bonne sœur, sœur Marie-Paul Ross qui ",était," en train de présenter euh, son livre. "
ParisStories_2019_devoirPhilosophie_14,je voudrais vous ,parler," d'amour, et de sexe. "
ParisStories_2019_devoirPhilosophie_16,"c'est ça en fait le, le truc qui m'a interpellé, c'est que en gros euh, elle est ",devenue, sexologue. 
ParisStories_2019_devoirPhilosophie_19,"tu vois, d'un côté, elle a ",fait, vœu de chasteté. 
ParisStories_2019_devoirPhilosophie_20,"et d'un autre côté, elle veut euh, ",donner," des conseils euh, à ses patients euh, sur le sexe. "
ParisStories_2019_devoirPhilosophie_20,"et d'un autre côté, elle ",veut," euh, donner des conseils euh, à ses patients euh, sur le sexe. "
ParisStories_2019_devoirPhilosophie_21,"donc pour moi, je me suis ",dit,", ça va pas ensemble, "
ParisStories_2019_devoirPhilosophie_23,"et euh en gros, elle ",expliquait," euh, comment est venue euh, sa vocation euh, pour devenir sexologue. "
ParisStories_2019_devoirPhilosophie_25,"elle expliquait qu'elle est, qu'elle a eu vraiment un choc culturel, et euh qu'elle a était ",confrontée, à beaucoup de violences sexuelles. 
ParisStories_2019_devoirPhilosophie_26,"notamment euh, chez les jeunes générations, donc en gros chez les jeunes, et euh qu'ils ne ",savaient," pas euh, se respecter, et ils n'avaient aucune éducation sexuelle. "
ParisStories_2019_devoirPhilosophie_27,"du coup euh, comme elle était, quand même, ",confrontée," à beaucoup de violences sexuelles, elle s'est dit ben, pour les aider, je vais leur donner des cours d'éducation sexuelle, pour euh, justement euh, essayer de changer leurs comportements et leur vision quoi. "
ParisStories_2019_devoirPhilosophie_30,"si tu veux il y avait des filles qui se faisaient euh, ",avorter," euh, comme ça, tu vois, sans leur consentement. "
ParisStories_2019_devoirPhilosophie_30,"si tu veux il y avait des filles qui se faisaient euh, ",avorter," euh, comme ça, tu vois, sans leur consentement. "
ParisStories_2019_devoirPhilosophie_34,"parce que, du coup, cette femme, euh finalement, elle doit faire preuve d'empathie, pour pouvoir ",donner," des conseils en matière de sexe, à ses patients, puisque, en gros, elle elle a fait vœu de chasteté, elle est religieuse. "
ParisStories_2019_devoirPhilosophie_35,"elle a un engagement religieux, mais en même temps, elle doit faire preuve d'empathie, pour pouvoir, justement, ",donner," des conseils à ses patients, en matière de sexe. "
ParisStories_2019_devoirPhilosophie_35,"elle a un engagement religieux, mais en même temps, elle ",doit," faire preuve d'empathie, pour pouvoir, justement, donner des conseils à ses patients, en matière de sexe. "
ParisStories_2019_peripitiesVoiture_2,donc euh j'ai ,fait, la conduite accompagnée à le lycée. 
ParisStories_2019_peripitiesVoiture_3,donc avant ça il ,fallait," que je passe le code et tout, "
ParisStories_2019_peripitiesVoiture_5,"après ces leçons de conduite euh, j'ai pu me ",lancer," dans la conduite accompagnée avec ma mère, "
ParisStories_2019_peripitiesVoiture_5,"après ces leçons de conduite euh, j'ai pu me ",lancer," dans la conduite accompagnée avec ma mère, "
ParisStories_2019_peripitiesVoiture_5,"après ces leçons de conduite euh, j'ai ",pu," me lancer dans la conduite accompagnée avec ma mère, "
ParisStories_2019_peripitiesVoiture_7,donc c',était, sur un an je devais faire la conduite accompagnée. 
ParisStories_2019_peripitiesVoiture_10,"euh on a fait beaucoup de trajets, on est partie en vacances, on est allée chez mes tantes qui ",habitent, euh sur Paris. 
ParisStories_2019_peripitiesVoiture_10,"euh on a fait beaucoup de trajets, on est partie en vacances, on est ",allée, chez mes tantes qui habitent euh sur Paris. 
ParisStories_2019_peripitiesVoiture_10,"euh on a fait beaucoup de trajets, on est ",partie," en vacances, on est allée chez mes tantes qui habitent euh sur Paris. "
ParisStories_2019_peripitiesVoiture_11,donc euh il fallait ,passer," par le périph euh, "
ParisStories_2019_peripitiesVoiture_12,"XXX j'ai vraiment eu des bonnes expériences pour euh m'aider à apprendre à conduire, parce que on ",apprend, avec l'expérience. 
ParisStories_2019_peripitiesVoiture_15,mais avant ça euh ils m'ont ,redonné," quelques heures de conduite, pour vérifier que j'avais pas perdu. "
ParisStories_2019_peripitiesVoiture_16,je me souviens même euh l'heure de conduite que j'ai ,eu," la veille de passer mon permis, "
ParisStories_2019_peripitiesVoiture_16,je me ,souviens," même euh l'heure de conduite que j'ai eu la veille de passer mon permis, "
ParisStories_2019_peripitiesVoiture_17,"je me suis mise euh sur la voie de gauche, alors que je devais pas de le tout me ",mettre, sur cette voie. 
ParisStories_2019_peripitiesVoiture_17,je me suis ,mise," euh sur la voie de gauche, alors que je devais pas de le tout me mettre sur cette voie. "
ParisStories_2019_peripitiesVoiture_18,c'est parce que je pensais que le stop il s',étalait," sur tout le long de la route, mais, en fait, pas de le tout. "
ParisStories_2019_peripitiesVoiture_21,le lendemain donc je ,passais, mon permis. 
ParisStories_2019_peripitiesVoiture_22,j'ai eu très peur parce que euh le même jour de que mon permis j',avais," un examen, un contrôle de l'espagnol, "
ParisStories_2019_peripitiesVoiture_24,le matin j'avais ,eu, mon partiel d'espagnol. 
ParisStories_2019_peripitiesVoiture_25,"et, en fait, euh vu que j'habite sur euh la... enfin, dans le sud de Seine et Marne, j'ai dû me déplacer sur Paris le matin, prendre le train et tout, et ",remonter, après mon partiel. 
ParisStories_2019_peripitiesVoiture_25,"et, en fait, euh vu que j'habite sur euh la... enfin, dans le sud de Seine et Marne, j'ai dû me ",déplacer," sur Paris le matin, prendre le train et tout, et remonter après mon partiel. "
ParisStories_2019_peripitiesVoiture_25,"et, en fait, euh vu que j'habite sur euh la... enfin, dans le sud de Seine et Marne, j'ai dû me ",déplacer," sur Paris le matin, prendre le train et tout, et remonter après mon partiel. "
ParisStories_2019_peripitiesVoiture_25,"et, en fait, euh vu que j'",habite," sur euh la... enfin, dans le sud de Seine et Marne, j'ai dû me déplacer sur Paris le matin, prendre le train et tout, et remonter après mon partiel. "
ParisStories_2019_peripitiesVoiture_27,j'ai eu de la chance que c'était... ça ,tombait, pas à le même moment. 
ParisStories_2019_peripitiesVoiture_30,après euh l'après-midi de le coup je me suis ,rendue," euh à mon lieu de rendez-vous pour mon permis, "
ParisStories_2019_peripitiesVoiture_30,après euh l'après-midi de le coup je me suis ,rendue," euh à mon lieu de rendez-vous pour mon permis, "
ParisStories_2019_peripitiesVoiture_30,après euh l'après-midi de le coup je me suis ,rendue," euh à mon lieu de rendez-vous pour mon permis, "
ParisStories_2019_peripitiesVoiture_31,j'étais ,accompagnée, de ma mère. 
ParisStories_2019_peripitiesVoiture_32,"j'ai pu… du coup, dans la voiture elle m'a beaucoup ",aidée," à réviser, à travailler… euh parce que quand on passe le permis il y a des questions en plus euh, théoriques, en plus de la pratique. "
ParisStories_2019_peripitiesVoiture_33,"du coup, je les ai XXX, enfin, j'ai essayé de les voir pour les ",retenir," par cœur parce que c'est c'est des points de gagnés, quoi. "
ParisStories_2020_blessureRecreation_1,"bah en gros, j'",ai, ma pause déjeuner de onze heures quarante-cinq à midi quinze. 
ParisStories_2020_blessureRecreation_2,"et euh, donc je ",revenais, de mon déjeuner. 
ParisStories_2020_blessureRecreation_3,j'ai ,posé, euh mon mon lunch bag dans mon casier. 
ParisStories_2020_blessureRecreation_4,"et euh, et je repars vers la cour euh, pour aller, pour ",prendre, mon poste dans la cour. 
ParisStories_2020_blessureRecreation_4,"et euh, et je ",repars," vers la cour euh, pour aller, pour prendre mon poste dans la cour. "
ParisStories_2020_blessureRecreation_11,"et euh donc j'y vais aussi vite que je peux, mais, avec mon genou ça ",va, un peu doucement. 
ParisStories_2020_blessureRecreation_14,donc je me ,rapproche, de Sanga. 
ParisStories_2020_blessureRecreation_17,"et tu avais tout le cercle des collégiens autour, hyper choqués, et qui ",étaient," genre là, ah mon dieu ! "
ParisStories_2020_blessureRecreation_24,donc euh je ,dis," à Sanga euh, t'inquiète ça va aller, ça va aller, alors que moi-même j'étais vraiment pas bien du tout. "
ParisStories_2020_blessureRecreation_25,"euh j'essaye de casser, de cacher sa blessure comme je peux, parce que je vois que c'est ça qui ",crée, euh de l'émotion chez les gamins. 
ParisStories_2020_blessureRecreation_25,"euh j'essaye de casser, de cacher sa blessure comme je peux, parce que je vois que c'est ça qui ",crée, euh de l'émotion chez les gamins. 
ParisStories_2020_blessureRecreation_26,"euh alors comme une couillone, j'",essaye, de mettre mon genou devant. 
ParisStories_2020_blessureRecreation_30,"enfin il était vraiment à terre euh, ",terrorisé,. 
ParisStories_2020_blessureRecreation_31,"euh là il y a l'autre surveillante qui arrive, qui était dans la cour aussi avec son mégaphone, qui commence à ",demander," à tout le monde de se reculer, que c'est pas un spectacle, qu'on va gérer la situation. "
ParisStories_2020_blessureRecreation_31,"euh là il y a l'autre surveillante qui arrive, qui ",était," dans la cour aussi avec son mégaphone, qui commence à demander à tout le monde de se reculer, que c'est pas un spectacle, qu'on va gérer la situation. "
ParisStories_2020_campBedouin_2,"euh à Roissy Charles de Gaulle, et euh on avait ",attendu, une ou deux heures. 
ParisStories_2020_campBedouin_6,euh on est ,arrivé, de nuit et tout. 
ParisStories_2020_campBedouin_7,il y avait un mec il nous attendait euh il nous ,attendait," avec une pancarte, euh où il y avait écrit mon prénom Julie YYY, c'était assez marrant je trouvais. "
ParisStories_2020_campBedouin_8,et puis après il nous a ,emmenés," dans notre hôtel, à Dubaï franchement c'était super beau tout ça euh. "
ParisStories_2020_campBedouin_9,alors euh je vais te ,raconter, un peu vite fait en détails quand même parce que euh. 
ParisStories_2020_campBedouin_11,alors le premier jour je me souviens on a ,été," au Dubaï Creek, euh c'était un petit marché tout ça euh. "
ParisStories_2020_campBedouin_12,après on est ,passé," devant la grande mosquée Jumeirah, c'est euh super connu super beau. "
ParisStories_2020_campBedouin_13,"après on était dans un zouk, bah il y avait plein euh, plein d'affaires si on voulait les ",acheter," tout ça euh, des souvenirs même je vous ai ramené du café ! "
ParisStories_2020_campBedouin_13,après on ,était," dans un zouk, bah il y avait plein euh, plein d'affaires si on voulait les acheter tout ça euh, des souvenirs même je vous ai ramené du café ! "
ParisStories_2020_campBedouin_15,après euh l'aprèm on a été ,déjeuner, dans un hôtel tout ça c'était super beau. 
ParisStories_2020_campBedouin_15,après euh l'aprèm on a été ,déjeuner, dans un hôtel tout ça c'était super beau. 
ParisStories_2020_campBedouin_16,"après euh, on a ",fait, un safari dans le désert en quatre-quatre. 
ParisStories_2020_campBedouin_16,"après euh, on a ",fait, un safari dans le désert en quatre-quatre. 
ParisStories_2020_campBedouin_17,"j'en n'avais jamais fait c'était super euh super euh marrant, enfin on s'est bien tapé des barres parce que ça ",secouait, de partout là dedans. 
ParisStories_2020_campBedouin_18,"après euh, le soir si je me souviens bien la première journée on a ",été," en camp Bédouin on avait fait un barbecue, il y avait un spectacle un monsieur il crachait du feu euh de la danse orientale tout ça. "
ParisStories_2020_campBedouin_18,"après euh, le soir si je me ",souviens," bien la première journée on a été en camp Bédouin on avait fait un barbecue, il y avait un spectacle un monsieur il crachait du feu euh de la danse orientale tout ça. "
ParisStories_2020_campBedouin_19,après on est ,rentré, le soir. 
ParisStories_2020_campBedouin_20,"mais par contre dans le désert en décembre, il ",fait, super super froid. 
ParisStories_2020_concoursInstagram_10,"et, donc, du coup, il ",disait," aux , à ses fans de, euh, bah, de, du coup, d'enregistrer une vidéo en train de danser un peu active et, du coup, je t'ai dit allez faut le faire, faut le faire, faut le faire. "
ParisStories_2020_concoursInstagram_11,sauf que tu voulais pas le ,mettre, sur ton Insta. 
ParisStories_2020_concoursInstagram_12,"bah, oui, évidemment parce que, moi, je ",mets, toujours rien sur mon Insta. 
ParisStories_2020_concoursInstagram_14,"du coup, j'ai accepté de le ",mettre, sur mon Insta. 
ParisStories_2020_concoursInstagram_15,"et soi-disant, parce que j'",ai, de la chance aux concours. 
ParisStories_2020_concoursInstagram_18,on a ,filmé, la vidéo au moins quinze fois. 
ParisStories_2020_concoursInstagram_24,"oui, mais il passait aussi dans, il ",passait, aussi dans le clip. 
ParisStories_2020_concoursInstagram_24,"oui, mais il ",passait," aussi dans, il passait aussi dans le clip. "
ParisStories_2020_concoursInstagram_26,"donc, il ",passait, dans… 
ParisStories_2020_concoursInstagram_27,"mais le clip c'était pas la surprise, parce que tout le monde, euh, tous les participants ",passaient, dans le clip. 
ParisStories_2020_concoursInstagram_28,"non, mais ça, on ",savait, pas au début. 
ParisStories_2020_concoursInstagram_30,"donc, euh, il avait juste dit, euh, vous ",passerez, dans le clip et plus une surprise. 
ParisStories_2020_concoursInstagram_33,donc moi je pensais que c'était trois personnes qui ,passaient, dans le clip. 
ParisStories_2020_concoursInstagram_54,"bah, heureusement que j'ai ",filmé," avec l'Iphone mais parce que, euh~… "
ParisStories_2021_adoptionMouts_15,"alors, euh, on l'a ",prise," dans nos bras, maman d'abord, après moi. "
ParisStories_2021_adoptionMouts_19,"et sous ses yeux, elle ",é~,", elle avait, elle avait tout un cercle noir, comme si elle avait du mascara, de l'eyeliner. "
ParisStories_2021_adoptionMouts_22,et pour le prénom on avait déjà ,décidé,. 
ParisStories_2021_adoptionMouts_26,et on s'est ,regardée, avec ma mère. 
ParisStories_2021_adoptionMouts_32,et on est ,revenu," la semaine d'après, avec mon frère, ma mère. "
ParisStories_2021_adoptionMouts_32,et on est ,revenu," la semaine d'après, avec mon frère, ma mère. "
ParisStories_2021_adoptionMouts_35,et elle est ,rentrée, à la maison. 
ParisStories_2021_adoptionMouts_37,"euh, au début elle ",avait, peur. 
ParisStories_2021_adoptionMouts_39,"et au bout de quelques heures, elle a enfin ",aboyé,. 
ParisStories_2021_couruLaVoir_3,"enfin, à vrai dire on se connaissait depuis la grande section de maternelle parce qu'on, on a ",grandi," dans le même quartier, et dans le même immeuble. "
ParisStories_2021_couruLaVoir_3,"enfin, à vrai dire on se ",connaissait," depuis la grande section de maternelle parce qu'on, on a grandi dans le même quartier, et dans le même immeuble. "
ParisStories_2021_couruLaVoir_10,"et euh, donc euh, on s'est vraiment euh, euh mise à parler ensemble, quand on ",était," en CM1 parce que il y avait, euh, je sais plus, il y avait eu un truc bizarre, euh. "
ParisStories_2021_couruLaVoir_13,"et je me rappelle, on ",était," au milieu de la cour, et je l'ai vue de loin. "
ParisStories_2021_couruLaVoir_15,"donc, euh, je me suis dit tiens, bon, bah, je vais aller lui parler, parce qu'elle ",a," l'air aussi seule que moi, euh, en ce moment. "
ParisStories_2021_couruLaVoir_16bis,"je m'en rappelle très bien parce que, c'est vraiment pas le genre de chose que j'aurais fait à l'époque, euh, d'aller ",parler," comme ça à quelqu'un que je ne connaissais pas, ou, genre, juste de vue. "
ParisStories_2021_couruLaVoir_16bis,"je m'en rappelle très bien parce que, c'est vraiment pas le genre de chose que j'aurais fait à l'époque, euh, d'",aller," parler comme ça à quelqu'un que je ne connaissais pas, ou, genre, juste de vue. "
ParisStories_2021_couruLaVoir_16bis,"je m'en rappelle très bien parce que, c'est vraiment pas le genre de chose que j'aurais ",fait," à l'époque, euh, d'aller parler comme ça à quelqu'un que je ne connaissais pas, ou, genre, juste de vue. "
ParisStories_2021_couruLaVoir_17,"donc, euh, donc, tu lui as parlé, euh, tu lui as ",parlé," comme ça euh, pour, pour que vous soyez amies, c'est ça? "
ParisStories_2021_couruLaVoir_19,c'était marrant je l'ai ,vue," de d~, toute de, de l'autre côté de la cour carrément. "
ParisStories_2021_couruLaVoir_24,je sais même plus de quoi on avait ,parlé, exactement. 
ParisStories_2021_couruLaVoir_28,"donc, après on a dû, euh, se dire au revoir, pour ",retourner," euh, en cours quand la récréation était finie. "
ParisStories_2021_couruLaVoir_28,"donc, après on a dû, euh, se ",dire," au revoir, pour retourner euh, en cours quand la récréation était finie. "
ParisStories_2021_couruLaVoir_31,on s'est ,vues, à la cour d'après. 
ParisStories_2021_couruLaVoir_32,on s'est ,vu,", euh, après les sorties. "
ParisStories_2022_7_chienGourmand__2,"mais en fait, depuis qu'il est né, déjà au moment où, où on est allé le chercher, en fait, donc, c'était avec ma mère, on ",voulait, absolument adopter un chien. 
ParisStories_2022_7_chienGourmand__2,"mais en fait, depuis qu'il est né, déjà au moment où, où on est ",allé," le chercher, en fait, donc, c'était avec ma mère, on voulait absolument adopter un chien. "
ParisStories_2022_7_chienGourmand__3,"du coup, on est ",allé," au, euh, au chenil pour l'adopter, enfin, pour le chercher. "
ParisStories_2022_7_chienGourmand__6,"et euh, donc du coup, on en a ",pris, chacun un dans nos bras. 
ParisStories_2022_7_chienGourmand__6,"et euh, donc du coup, on en a ",pris, chacun un dans nos bras. 
ParisStories_2022_7_chienGourmand__8,"et donc on s'est dit si il nous, il fait pipi dessus, c'est qu'il ",tient," à moi, tu vois. "
ParisStories_2022_7_chienGourmand__11,on l'a ,ramené, à la maison et tout. 
ParisStories_2022_7_chienGourmand__12,"et puis, de ce temps-là, il ",est, à la maison. 
ParisStories_2022_7_chienGourmand__12,"et puis, de ce temps-là, il ",est, à la maison. 
ParisStories_2022_7_chienGourmand__13,"euh, il a même ",vécu, le déménagement avec nous. 
ParisStories_2022_7_chienGourmand__14,parce qu'on a ,déménagé," entre temps, tu sais, tu te rappelles ? "
ParisStories_2022_7_chienGourmand__21,"et, et, on ",fait, des jeux ensemble. 
ParisStories_2022_7_chienGourmand__25,"donc moi, je m'",occupe," beaucoup beaucoup de lui, parce que je l'aime beaucoup. "
ParisStories_2022_7_chienGourmand__26,"et donc, je le fais même ",rentrer, dans la maison. 
ParisStories_2022_7_chienGourmand__27,"mais ça, bon, faut le ",dire, à personne. 
ParisStories_2022_7_chienGourmand__28,je le fais ,rentrer, dans la maison. 
ParisStories_2022_7_chienGourmand__34,"la dernière fois, je lui ai ",donné, une pomme à manger. 
ParisStories_2022_7_chienGourmand__42,"donc, du coup, avec ma mère on s'est ",amusée,. 
ParisStories_2022_7_chienGourmand__44,et on lui a ,donné, des petits quartiers de pêche comme à un petit humain et tout. 
ParisStories_2022_7_chienGourmand__56,"au début, ça fait beaucoup de conneries, parce qu'au tout début, quand il était tout petit, et bah, il ",mangeait, nos chaussures. 
ParisStories_2022_7_chienGourmand__56,"au début, ça ",fait," beaucoup de conneries, parce qu'au tout début, quand il était tout petit, et bah, il mangeait nos chaussures. "
ParisStories_2022_7_chienGourmand__63,"avec les chiens, il ",faut, jamais laisser trainer ses chaussures. 
ParisStories_2022_7_chienGourmand__65,"et puis, euh bon, il avait le droit que d'",être, dans son panier et tout. 
ParisStories_2022_7_chienGourmand__66,"bon, maintenant, vu qu'il est un peu plus vieux, on a le droit de le faire ",rentrer," un peu dans la maison tout ça, mais toujours sur son tapis. "
ParisStories_2022_7_chienGourmand__66,"bon, maintenant, vu qu'il est un peu plus vieux, on a le droit de le faire ",rentrer," un peu dans la maison tout ça, mais toujours sur son tapis. "
ParisStories_2022_7_chienGourmand__68,"il a pas le droit d'aller en haut, pas le droit d'",aller, dans la cuisine. 
ParisStories_2022_7_chienGourmand__68,il a pas le droit d',aller," en haut, pas le droit d'aller dans la cuisine. "
ParisStories_2022_7_chienGourmand__69,"mais dès qu'il sent de la bouffe, et bah, tout de suite, il ",accourt,", il accourt, il accourt. "
ParisStories_2022_13_CocktailsEtCrêpes__3,"après, euh, bah, c'est vrai que, euh, il y ",avait," pas mal de monde, ce soir-là. "
ParisStories_2022_13_CocktailsEtCrêpes__5,"et, et je crois, qu'avec le recul maintenant, euh, si j'aurais dû le faire, moi aussi, euh, je ",pense, que j'aurais été incapable de monter. 
ParisStories_2022_13_CocktailsEtCrêpes__13,"et puis, du coup, euh, c'est ce jour-là où j'ai ",rencontré, Lise. 
ParisStories_2022_13_CocktailsEtCrêpes__17,"et du coup pour rigoler, je lui avais demandé de ",venir, avec moi en réserve. 
ParisStories_2022_13_CocktailsEtCrêpes__17,"et du coup pour rigoler, je lui avais demandé de ",venir, avec moi en réserve. 
ParisStories_2022_13_CocktailsEtCrêpes__19,"et du coup, on est ",restées," bloquées en bas, pendant dix minutes, à peu près. "
ParisStories_2022_13_CocktailsEtCrêpes__20,"et du coup, on a ",parlé, un petit peu de tout et de rien. 
ParisStories_2022_13_CocktailsEtCrêpes__20,"et du coup, on a ",parlé, un petit peu de tout et de rien. 
ParisStories_2022_13_CocktailsEtCrêpes__23,"et petit à petit, bah, on est ",devenue, amie. 
ParisStories_2022_13_CocktailsEtCrêpes__25,"à chaque fois, en fin de service, on ",allait, chez lui. 
ParisStories_2022_13_CocktailsEtCrêpes__25,"à chaque fois, en fin de service, on ",allait, chez lui. 
ParisStories_2022_13_CocktailsEtCrêpes__25,"à chaque fois, en fin de service, on ",allait, chez lui. 
ParisStories_2022_13_CocktailsEtCrêpes__28,"et puis même tu vois, quand j'y repense, à ce fameux cocktail qu'elle m'a demandé, bah, elle ",faisait, un peu la même avec les crêpes. 
ParisStories_2022_13_CocktailsEtCrêpes__28,"et puis même tu vois, quand j'y repense, à ce fameux cocktail qu'elle m'a demandé, bah, elle ",faisait, un peu la même avec les crêpes. 
ParisStories_2022_13_CocktailsEtCrêpes__28,"et puis même tu vois, quand j'y repense, à ce fameux cocktail qu'elle m'a demandé, bah, elle ",faisait, un peu la même avec les crêpes. 
ParisStories_2022_13_CocktailsEtCrêpes__30,"enfin, en tout cas, elle ",faisait," des mélanges, euh, qui étaient vraiment trop drôles. "
ParisStories_2022_13_CocktailsEtCrêpes__30,"enfin, en tout cas, elle ",faisait," des mélanges, euh, qui étaient vraiment trop drôles. "
ParisStories_2022_11_copineEnCarton__3,"donc finalement ben, euh, ça a été très compliqué entre nous, parce qu'on est quand même resté trois ans ensemble, pour euh, faire pl~, un peu ",résumé,. 
ParisStories_2022_11_copineEnCarton__3,"donc finalement ben, euh, ça a été très compliqué entre nous, parce qu'on est quand même ",resté," trois ans ensemble, pour euh, faire pl~, un peu résumé. "
