sent_id,left_context,pivot,right_context
ParisStories_2021_adoptionMouts_20,et ça lui faisait une petite tête de chien ,battu, beaucoup trop mignonne. 
ParisStories_2021_adoptionMouts_21,"du coup, on a dit, bah, ",voilà,", quoi, c'est notre chien! "
ParisStories_2021_adoptionMouts_29,"alors, bah, ",voilà,", c'était Mouts! "
ParisStories_2021_adoptionMouts_38,elle osait pas ,marcher, tout ça. 
ParisStories_2021_couruLaVoir_4,"mais, pour, euh, je ne sais quelle raison, on n'a jamais vraiment ",traîné, ensemble quand on était petites. 
ParisStories_2021_couruLaVoir_7,"enfin voilà c'était, il y ",avait,", on peut dire qu'il y avait deux groupes. "
ParisStories_2021_couruLaVoir_7,enfin ,voilà," c'était, il y avait, on peut dire qu'il y avait deux groupes. "
ParisStories_2021_couruLaVoir_9,"donc euh, on n'a vraim~, on n'a jamais vraiment ",intéragi,. 
ParisStories_2021_couruLaVoir_9,"donc euh, on n'",a," vraim~, on n'a jamais vraiment intéragi. "
ParisStories_2021_couruLaVoir_10,"et euh, donc euh, on s'est vraiment euh, euh mise à parler ensemble, quand on était en CM1 parce que il y avait, euh, je ",sais," plus, il y avait eu un truc bizarre, euh. "
ParisStories_2021_couruLaVoir_10,"et euh, donc euh, on s'est vraiment euh, euh mise à parler ensemble, quand on était en CM1 parce que il y ",avait,", euh, je sais plus, il y avait eu un truc bizarre, euh. "
ParisStories_2021_couruLaVoir_10,"et euh, donc euh, on s'est vraiment euh, euh mise à ",parler," ensemble, quand on était en CM1 parce que il y avait, euh, je sais plus, il y avait eu un truc bizarre, euh. "
ParisStories_2021_couruLaVoir_12,"il y avait eu une sorte d'épidémie de, de rhume ou de grippe, je ",sais, plus. 
ParisStories_2021_couruLaVoir_16,"et euh, et je ",sais, pas pourtant c'est bizarre. 
ParisStories_2021_couruLaVoir_18,"euh, ouais, enfin je, on, c'était XXX, ça faisait un peu comme dans les films, à vrai ",dire,. 
ParisStories_2021_couruLaVoir_18,"euh, ouais, enfin je, on, c'était XXX, ça ",faisait," un peu comme dans les films, à vrai dire. "
ParisStories_2021_couruLaVoir_21,"et, euh, j'ai, je me rappelle, on, j'ai, presque couru pour aller la voir, genre euh, genre, pour lui demander est -ce que ce, ça, te dirait qu'on traine ensemble, qu'on ",parle, et tout vu qu'on est toutes les deux toutes seules en ce moment? 
ParisStories_2021_couruLaVoir_21,"et, euh, j'ai, je me rappelle, on, j'ai, presque couru pour aller la voir, genre euh, genre, pour lui demander est -ce que ce, ça, te dirait qu'on ",traine," ensemble, qu'on parle et tout vu qu'on est toutes les deux toutes seules en ce moment? "
ParisStories_2021_couruLaVoir_21,"et, euh, j'ai, je me rappelle, on, j'ai, presque ",couru," pour aller la voir, genre euh, genre, pour lui demander est -ce que ce, ça, te dirait qu'on traine ensemble, qu'on parle et tout vu qu'on est toutes les deux toutes seules en ce moment? "
ParisStories_2021_couruLaVoir_21,"et, euh, j'",ai,", je me rappelle, on, j'ai, presque couru pour aller la voir, genre euh, genre, pour lui demander est -ce que ce, ça, te dirait qu'on traine ensemble, qu'on parle et tout vu qu'on est toutes les deux toutes seules en ce moment? "
ParisStories_2021_couruLaVoir_22,"et euh, elle a ",fait, ok. 
ParisStories_2021_couruLaVoir_23,"et puis après euh, j~, on a commencé à ",parler,. 
ParisStories_2021_couruLaVoir_25,mais on n'a jamais ,arrêté,. 
ParisStories_2021_couruLaVoir_28,"donc, après on a dû, euh, se dire au ",revoir,", pour retourner euh, en cours quand la récréation était finie. "
ParisStories_2021_couruLaVoir_29,mais après on a continué à ,parler, de plus en plus. 
ParisStories_2021_couruLaVoir_30,et ça a ,continué,. 
ParisStories_2022_7_chienGourmand__2,"mais en fait, depuis qu'il est ",né,", déjà au moment où, où on est allé le chercher, en fait, donc, c'était avec ma mère, on voulait absolument adopter un chien. "
ParisStories_2022_7_chienGourmand__5,"et on savait pas euh, bah, lequel, euh, on choisit, on, euh, ",choisir,", du coup. "
ParisStories_2022_7_chienGourmand__5,"et on savait pas euh, bah, lequel, euh, on ",choisit,", on, euh, choisir, du coup. "
ParisStories_2022_7_chienGourmand__8,"et donc on s'est dit si il nous, il fait pipi dessus, c'est qu'il tient à moi, tu ",vois,. 
ParisStories_2022_7_chienGourmand__14,"parce qu'on a déménagé entre temps, tu ",sais,", tu te rappelles ? "
ParisStories_2022_7_chienGourmand__17,"hum, parce qu'il a un peu de mal à ",avancer,. 
ParisStories_2022_7_chienGourmand__19,il ,boite, et tout. 
ParisStories_2022_7_chienGourmand__23,"enfin, à chaque fois que je ",reviens," parce que, bon … "
ParisStories_2022_7_chienGourmand__29,"mon père, il ",veut, pas trop. 
ParisStories_2022_7_chienGourmand__31,"et donc, sinon, il adore ",jouer,. 
ParisStories_2022_7_chienGourmand__33,"alors, c'est assez drôle, parce que dès que tu lui mets à ",manger,", il gobe tout ! "
ParisStories_2022_7_chienGourmand__34,"la dernière fois, je lui ai donné une pomme à ",manger,. 
ParisStories_2022_7_chienGourmand__38,"sauf qu'il faut faire très attention, je ",savais, pas. 
ParisStories_2022_7_chienGourmand__38,sauf qu'il faut ,faire," très attention, je savais pas. "
ParisStories_2022_7_chienGourmand__48,et ,voilà,. 
ParisStories_2022_7_chienGourmand__49,et bah ,dis, donc ! 
ParisStories_2022_7_chienGourmand__50,donc si j'ai bien ,compris,", tu as choisi un chien parce qu'il t'a pissé dessus. "
ParisStories_2022_7_chienGourmand__57,"enfin, genre, il ",mangeait, … 
ParisStories_2022_7_chienGourmand__67,"il a ses espaces à lui, bien ",délimités,. 
ParisStories_2022_7_chienGourmand__69,"mais dès qu'il sent de la bouffe, et bah, tout de suite, il accourt, il accourt, il ",accourt,. 
ParisStories_2022_7_chienGourmand__69,"mais dès qu'il sent de la bouffe, et bah, tout de suite, il accourt, il ",accourt,", il accourt. "
ParisStories_2022_13_CocktailsEtCrêpes__2,"contrairement à moi, qui, bah, en fait, j'ai adoré ce moment, tu ",vois,. 
ParisStories_2022_13_CocktailsEtCrêpes__4,"on s'attendait vraiment pas qu'il y ait autant de monde, tu ",vois,. 
ParisStories_2022_13_CocktailsEtCrêpes__5,"et, et je crois, qu'avec le recul maintenant, euh, si j'aurais dû le faire, moi aussi, euh, je pense que j'aurais été incapable de ",monter,. 
ParisStories_2022_13_CocktailsEtCrêpes__6,"mais du coup, en fait, euh, c'est ça, je ",pense,. 
ParisStories_2022_13_CocktailsEtCrêpes__7,"elle a vu le monde arriver, elle a été incapable de ",produire,. 
ParisStories_2022_13_CocktailsEtCrêpes__7,elle a vu le monde ,arriver,", elle a été incapable de produire. "
ParisStories_2022_13_CocktailsEtCrêpes__8,"et, et ",voilà,. 
ParisStories_2022_13_CocktailsEtCrêpes__9,"et du coup, c'est, c'est vraiment, je ",pense,", sa mauvaise expérience. "
ParisStories_2022_13_CocktailsEtCrêpes__17,et du coup pour ,rigoler,", je lui avais demandé de venir avec moi en réserve. "
ParisStories_2022_13_CocktailsEtCrêpes__21,"et, euh, le feeling, il est bien passé, tu ",vois,. 
ParisStories_2022_13_CocktailsEtCrêpes__21,"et, euh, le feeling, il est bien ",passé,", tu vois. "
ParisStories_2022_13_CocktailsEtCrêpes__24,"et puis, bah, tu te souviens, en fait, c'est quand j'y repense, c'est grâce à elle, qu'on a ",connu,", euh, mh, qu'on, euh, a connu Paul et ses fameuses crêpes. "
ParisStories_2022_13_CocktailsEtCrêpes__28,et puis même tu ,vois,", quand j'y repense, à ce fameux cocktail qu'elle m'a demandé, bah, elle faisait un peu la même avec les crêpes. "
ParisStories_2022_13_CocktailsEtCrêpes__29,"tu te rappelles quand elle avait demandé un mélange de banane, euh, cacahuète, euh, sirop de fraise, je ",crois,", un truc comme ça. "
ParisStories_2022_13_CocktailsEtCrêpes__32,je crois qu'il a ,déménagé,", non ? "
ParisStories_2022_13_CocktailsEtCrêpes__33,"ouais, bah, je ",pense,", tu as raison, sûrement. "
ParisStories_2022_11_copineEnCarton__5,"après, ça a été ",compliqué,. 
ParisStories_2022_11_copineEnCarton__12,j'ai ,adoré,. 
ParisStories_2022_11_copineEnCarton__27,"et moi, je ",pouvais," pas, parce que j'ai besoin d'indépendance. "
ParisStories_2022_11_copineEnCarton__31,on ,peut, pas … 
ParisStories_2022_11_copineEnCarton__33,"cauchemar, meuf, tu peux même pas ",savoir,. 
ParisStories_2022_11_copineEnCarton__40,"j'ai fait écoute, faut qu'on parle, parce que là ça ",va, plus. 
ParisStories_2022_11_copineEnCarton__40,"j'ai fait écoute, faut qu'on ",parle,", parce que là ça va plus. "
ParisStories_2022_11_copineEnCarton__40,j'ai fait ,écoute,", faut qu'on parle, parce que là ça va plus. "
ParisStories_2022_11_copineEnCarton__46,j',ai," besoin d'un peu d'indé~, d'indépendance. "
ParisStories_2022_11_copineEnCarton__51,"lui, il l'a mal pris, parce qu'il m'a dit mais je ",comprends, pas. 
ParisStories_2022_11_copineEnCarton__54,"est-ce que je t'ai déjà dit euh, ",écoute,", tu vas pas voir César sans moi. "
ParisStories_2022_11_copineEnCarton__56,si tu ,as," envie de voir tes potes sans moi, mais vraiment, vas-y ! "
ParisStories_2022_11_copineEnCarton__61,"j'ai besoin d'un peu, de ",voilà,", de, de mon, mon espace, quoi. "
ParisStories_2022_11_copineEnCarton__61,j',ai," besoin d'un peu, de voilà, de, de mon, mon espace, quoi. "
ParisStories_2022_11_copineEnCarton__63,c'est ,fini,. 
ParisStories_2022_10_frèreHyperDifférent__13,et j'ai voulu aller voir ce qui se ,passait,. 
ParisStories_2022_10_frèreHyperDifférent__18,mais ça s'est ,amélioré, depuis ? 
ParisStories_2022_10_frèreHyperDifférent__19,ça s'est clairement ,amélioré, depuis. 
ParisStories_2022_10_frèreHyperDifférent__20,mais après on ,a,", je sais pas si on a toujours été proches vraiment. "
ParisStories_2022_10_frèreHyperDifférent__22,pourtant c'était il y ,a," longtemps, hein ? "
ParisStories_2022_10_frèreHyperDifférent__28,"ça fait, ça, ça ",change,", hein ? "
ParisStories_2022_10_frèreHyperDifférent__28,ça ,fait,", ça, ça change, hein ? "
ParisStories_2022_10_frèreHyperDifférent__35,"ouais, bah, en fait, on a eu une enfance qui est assez similaire, parce que, parce que bon, bah, on a quand même ",vécu," ensemble, même si on n'avait pas les mêmes papas. "
ParisStories_2022_10_frèreHyperDifférent__38,"mais lui, il a commencé à ",marcher, bien plus tôt que moi. 
ParisStories_2022_10_frèreHyperDifférent__39,"et moi, j'ai commencé à ",parler, bien plus tôt que lui. 
ParisStories_2022_10_frèreHyperDifférent__43,"et ça correspond assez à nos personnalités que, lui, bah maintenant il est plus euh, bah, il va plus ",bouger, partout et tout. 
ParisStories_2022_10_frèreHyperDifférent__50,"ah carrément, tu avais envie de ",courir,", toi. "
ParisStories_2022_10_frèreHyperDifférent__50,"ah carrément, tu ",avais," envie de courir, toi. "
ParisStories_2022_10_frèreHyperDifférent__53,faut ,essayer,", hein ? "
ParisStories_2022_10_frèreHyperDifférent__54,c'est comme ça qu'on ,apprend,. 
ParisStories_2022_10_frèreHyperDifférent__56,et tu as ,parlé, tard ? 
ParisStories_2022_10_frèreHyperDifférent__58,"ça, je ",sais, pas. 
ParisStories_2022_10_frèreHyperDifférent__64,"bah, elle était fière, tu ",vois,", tu m'étonnes. "
ParisStories_2022_3_petitDuCentre__11,"je l'ai pris dans mes bras, parce qu'il était en, en train de ",pleurer,. 
ParisStories_2022_3_petitDuCentre__14,et il m'a dit tu peux dormir sur mon épaule si tu ,veux,. 
ParisStories_2022_3_petitDuCentre__19,"euh, je ",pense," que, je pense que c'est parce que, euh c'était la première fois ou la deuxième fois qu'il venait comme ça au centre un, un mercredi. "
ParisStories_2022_3_petitDuCentre__24,"et elle m'a demandé, euh, si, si cette journée s'était bien ",passée,. 
ParisStories_2022_8_rencontreALiège__4,"et euh, je venais d'",arriver,. 
ParisStories_2022_8_rencontreALiège__15,"et en fait, derrière moi, j'ai entendu une fille qui ",parlait," assez fort, et qui parlait de la ville de Monaco. "
ParisStories_2022_8_rencontreALiège__21,"et je me disais mais en fait, euh, elle ",a, l'air super gentille cette fille. 
ParisStories_2022_8_rencontreALiège__23,"et, euh, j'ai ",eu, envie de lui parler. 
ParisStories_2022_8_rencontreALiège__27,enfin je t'entends ,parler," depuis tout à l'heure, est-ce que je peux me joindre à toi ? "
ParisStories_2022_8_rencontreALiège__29,"mais euh mais ça a fonctionné, puisque finalement on a commencé à ",parler,. 
ParisStories_2022_8_rencontreALiège__29,mais euh mais ça a ,fonctionné,", puisque finalement on a commencé à parler. "
ParisStories_2022_1_rencontreSolfège__1,"et à la fin du cours, je lui ai demandé mais au fait, euh, bah, euh, comment je te enfin, euh, j'",ai, l'impression de te connaître ! 
ParisStories_2022_1_rencontreSolfège__5,"je fais oui, oui, j'",ai, l'impression de t'avoir déjà vue ! 
ParisStories_2022_1_rencontreSolfège__37,"oui, ",voilà,", au conservatoire d'Athis, exactement ! "
ParisStories_2022_1_rencontreSolfège__42,,voilà,. 
ParisStories_2022_1_rencontreSolfège__43,"et donc, euh, là, finalement, la première fois que je l'ai rencontrée, parce que après, elle a regardé dans son, hum, elle a regardé, euh, chez elle dans son, comment ça s'",appelle, … 
ParisStories_2022_1_rencontreSolfège__54,"pas, je me souviens pas des années, mais plutôt des années scolaires, tu ",vois,", de la date, mais plus des années scolaires. "
ParisStories_2022_1_rencontreSolfège__57,"et là, elle ",voit,", et elle fait ah, mais je te, je t'ai reconnue de suite ! "
ParisStories_2022_6_tetedeNeuneu__6,il y ,a, combien de temps ? 
ParisStories_2022_6_tetedeNeuneu__10,je ,sais, pas. 
ParisStories_2022_6_tetedeNeuneu__12,mais ça ,fait, trop longtemps. 
ParisStories_2022_6_tetedeNeuneu__17,je savais juste à quoi il ressemblait vite ,fait,. 
ParisStories_2022_6_tetedeNeuneu__19,et comment il s',appelait,. 
ParisStories_2022_6_tetedeNeuneu__27,"d~, je veux pas, je veux pas ",sav~,. 
ParisStories_2022_6_tetedeNeuneu__28,"moins je sais d'infos sur lui, moins je, enfin, mieux je me sens, tu ",vois, ? 
ParisStories_2022_6_tetedeNeuneu__33,"et, euh, et, du coup, on devait, enfin, moi, je devais en gros, dé~ comment on ",dit,", euh, genre, détourner l'attention d'Eva. "
ParisStories_2022_6_tetedeNeuneu__33,"et, euh, et, du coup, on devait, enfin, moi, je devais en gros, ",dé~," comment on dit, euh, genre, détourner l'attention d'Eva. "
ParisStories_2022_6_tetedeNeuneu__33,"et, euh, et, du coup, on ",devait,", enfin, moi, je devais en gros, dé~ comment on dit, euh, genre, détourner l'attention d'Eva. "
ParisStories_2022_6_tetedeNeuneu__40,"et elle m'avait fait en mode ah, bah tiens, on a qu'à inviter XXX à ",manger, ! 
ParisStories_2022_6_tetedeNeuneu__41,tu ,vois, ? 
ParisStories_2022_6_tetedeNeuneu__44,"alors que bah, je savais très bien qu'il y avait tout ses potes qui ",attendaient,. 
ParisStories_2022_6_tetedeNeuneu__46,et tout était ,éteint,. 
ParisStories_2022_6_tetedeNeuneu__51,il y ,a, pas machin. 
ParisStories_2022_6_tetedeNeuneu__51_bis,"et je dis bah, ",attends,. 
ParisStories_2022_6_tetedeNeuneu__53,si ça se ,trouve,", elle est en haut. "
ParisStories_2022_6_tetedeNeuneu__60,il ,avait, l'air trop débile. 
ParisStories_2022_6_tetedeNeuneu__68,"donc euh, j'",avais, pas envie de le connaître. 
ParisStories_2019_prepaScientifique_8,enfin ,voilà," c'était chouette quoi, de continuer les maths, et puis de pouvoir se la péter tout ça. "
ParisStories_2019_prepaScientifique_11,on s'était pas de le tout ,rendu, compte de ça. 
ParisStories_2019_prepaScientifique_13,"on s'était pas renseigné non plus, enfin ",voilà,. 
ParisStories_2019_prepaScientifique_13,on s'était pas ,renseigné," non plus, enfin voilà. "
ParisStories_2019_prepaScientifique_14,"de le coup, je suis ",arrivée, là-dedans sans savoir de le tout ce que ça allait donner. 
ParisStories_2019_prepaScientifique_15,"et, euh, ensuite pendant deux ans, ben, j'ai fait que travailler, parce que, enfin, en prépa, euh, tu as pas le temps de ",réfléchir,", euh. "
ParisStories_2019_prepaScientifique_16,"c'est, voilà, tu fais que ",bosser,. 
ParisStories_2019_prepaScientifique_16,"c'est, ",voilà,", tu fais que bosser. "
ParisStories_2019_prepaScientifique_16,c',est,", voilà, tu fais que bosser. "
ParisStories_2019_prepaScientifique_18,"donc j'ai travaillé, travaillé, travaillé, beaucoup ",pleuré,", c'était horrible. "
ParisStories_2019_prepaScientifique_18,"donc j'ai travaillé, travaillé, ",travaillé,", beaucoup pleuré, c'était horrible. "
ParisStories_2019_prepaScientifique_18,"donc j'ai travaillé, ",travaillé,", travaillé, beaucoup pleuré, c'était horrible. "
ParisStories_2019_prepaScientifique_18,donc j'ai ,travaillé,", travaillé, travaillé, beaucoup pleuré, c'était horrible. "
ParisStories_2019_prepaScientifique_23,"euh, premier moment un peu de, je ",sais," pas, de panique quoi enfin. "
ParisStories_2019_prepaScientifique_24,"mais, euh, j'avais pas envie d'arrêter tout de suite, parce que on fait deux ans de prépa, on travaille à mort, on a pas envie de, euh, d'abandonner quoi, surtout que ça donne aucune équivalence, enfin ",voilà,. 
ParisStories_2019_prepaScientifique_24,"mais, euh, j'avais pas envie d'arrêter tout de suite, parce que on fait deux ans de prépa, on travaille à mort, on a pas envie de, euh, d'",abandonner," quoi, surtout que ça donne aucune équivalence, enfin voilà. "
ParisStories_2019_prepaScientifique_24,"mais, euh, j'avais pas envie d'arrêter tout de suite, parce que on fait deux ans de prépa, on travaille à mort, on ",a," pas envie de, euh, d'abandonner quoi, surtout que ça donne aucune équivalence, enfin voilà. "
ParisStories_2019_prepaScientifique_24,"mais, euh, j'",avais," pas envie d'arrêter tout de suite, parce que on fait deux ans de prépa, on travaille à mort, on a pas envie de, euh, d'abandonner quoi, surtout que ça donne aucune équivalence, enfin voilà. "
ParisStories_2019_prepaScientifique_26,ça ,sonnait," bien, c'est original, "
ParisStories_2019_prepaScientifique_29,"et, euh, donc je ",pars, là-bas. 
ParisStories_2019_prepaScientifique_30,"euh, première année d'école d'ingé, je m'ennuie, mais, euh, tout le monde s'",ennuie," un petit peu, parce que c'est encore très général comme enseignement. "
ParisStories_2019_prepaScientifique_31,"voilà, on refait les mêmes choses qu'en prépa, mais plus lentement, donc bref, tout, tout le monde ",déteste,. 
ParisStories_2019_prepaScientifique_31,,voilà,", on refait les mêmes choses qu'en prépa, mais plus lentement, donc bref, tout, tout le monde déteste. "
ParisStories_2019_prepaScientifique_32,mais on s',amuse," beaucoup, c'est l'école d'ingénieur, euh, le retour des , de la vie sociale, de les amis, et tout ça, donc ça c'était chouette. "
ParisStories_2019_prepaScientifique_35,"c'est sympa, euh, c'est pas ma vocation, enfin je, je me découvre pas une passion pour l'océanographie spatiale, mais ",voilà,. 
ParisStories_2019_prepaScientifique_38,"enfin, c'",est,", c'est un peu le oh, je m'étais dit que, oh en deuxième année c'est cool, on va se spécialiser, ça va commencer à être super intéressant, et, et en fait, euh, ça m'a pas plu. "
ParisStories_2019_vacancesEte_5,"j'ai fait enfin j'ai vu mes amies, j'ai fait des pique-niques, je suis allée à la Japan Expo, euh j'ai je suis allée dans un spa qu'on m'avait offert enfin bref ",voilà,", très sympa. "
ParisStories_2019_vacancesEte_5,j'ai ,fait," enfin j'ai vu mes amies, j'ai fait des pique-niques, je suis allée à la Japan Expo, euh j'ai je suis allée dans un spa qu'on m'avait offert enfin bref voilà, très sympa. "
ParisStories_2019_vacancesEte_7,euh donc voilà c',était,", c'était sympa, "
ParisStories_2019_vacancesEte_7,euh donc ,voilà," c'était, c'était sympa, "
ParisStories_2019_vacancesEte_8,"euh j'ai visité l'Île de Ré, ",voilà,", je suis allée à la plage. "
ParisStories_2019_vacancesEte_10,"et euh en fait mon père est photographe, enfin bon tu le sais mais bon ",voilà,. 
ParisStories_2019_vacancesEte_12,euh donc ,voilà, c'était dans les Charentes Maritimes. 
ParisStories_2019_vacancesEte_14,"donc il avait une exposition de photo et donc on a ramené ses photos, on a fait l'exposition, on a vu de la famille enfin bref, ",voilà, donc très sympa. 
ParisStories_2019_vacancesEte_16,"et ensuite moi je suis repartie toute seule en train, à Paris, mes parents sont ",restés, là-bas. 
ParisStories_2019_vacancesEte_17,"euh voilà et donc à le retour de à Paris je suis allée à le concert de Coldplay à le Stade de France, euh ",voilà,. 
ParisStories_2019_vacancesEte_17,euh ,voilà," et donc à le retour de à Paris je suis allée à le concert de Coldplay à le Stade de France, euh voilà. "
ParisStories_2019_vacancesEte_18,,voilà," quoi c'était un concert euh avec une amie, euh donc c'était, c'était génial, c'était un de mes plus beaux concerts ! "
ParisStories_2019_vacancesEte_19,,voilà," et euh ensuite je suis restée euh, euh quelques jours à Paris et je suis repartie le vingt-deux juillet à Biscarrosse, avec mon copain. "
ParisStories_2019_vacancesEte_20,"donc Biscarrosse c'est euh pas très loin d'Arcachon, de Bordeaux, enfin ",voilà,. 
ParisStories_2019_vacancesEte_23,euh qu'est-ce qu'on a ,fait," bah, "
ParisStories_2019_vacancesEte_25,c'est ,voilà,", c'est ni bien ni nul. "
ParisStories_2019_vacancesEte_25,c',est," voilà, c'est ni bien ni nul. "
ParisStories_2019_vacancesEte_28,euh et ensuite je suis ,rentrée,", euh c'est le, c'était le début, début août. "
ParisStories_2019_vacancesEte_30,donc j',suis," j'étais animatrice, euh dans une colo euh d'adolescents, "
ParisStories_2019_voyageItalie_1,"euh, ouais, tu ",sais,", cet été, euh, j'étais, euh, en Italie là, avec Pauline. "
ParisStories_2019_voyageItalie_9,"parce que, euh, mais rien que à Florence, bon, après, c'est une ville hyper touristique. donc, euh, je ",sais," pas, c'est peut-être normal, mais, je, mais, j'ai pas le souvenir qu'à Paris c'était pareil. "
ParisStories_2019_voyageItalie_10,"mais à Florence on s'était, euh, on était dans le centre-ville, on ",marchait,. 
ParisStories_2019_voyageItalie_17,"et euh, et là je commence clairement à ",beuguer,", et je lui demande euh, si, si il y a pas un petit souci. "
ParisStories_2019_voyageItalie_32,"mais quand même, enfin genre deux jours, ça ",suffit, euh largement. 
ParisStories_2019_voyageItalie_37,"le truc il y avait d'un côté il y avait une euh, une voie rapide, de l'autre côté il y avait une autre voie rapide, à côté d'un rond-point, et il y ",avait, la station service. 
ParisStories_2019_voyageItalie_37,"le truc il y avait d'un côté il y avait une euh, une voie rapide, de l'autre côté il y ",avait," une autre voie rapide, à côté d'un rond-point, et il y avait la station service. "
ParisStories_2019_voyageItalie_37,le truc il y avait d'un côté il y ,avait," une euh, une voie rapide, de l'autre côté il y avait une autre voie rapide, à côté d'un rond-point, et il y avait la station service. "
ParisStories_2019_voyageItalie_37,le truc il y ,avait," d'un côté il y avait une euh, une voie rapide, de l'autre côté il y avait une autre voie rapide, à côté d'un rond-point, et il y avait la station service. "
ParisStories_2019_voyageItalie_39,"donc euh, laisse ",tomber," c'était, c'était horrible genre de le bruit, mais toute la journée, toute la nuit, "
ParisStories_2019_voyageItalie_40,genre on n'a pas pu ,dormir,. 
ParisStories_2019_voyageItalie_47,"mais bon après c'était quand, on a quand même bien profité donc euh, donc ça ",va,. 
ParisStories_2019_voyageItalie_47,"mais bon après c'était quand, on a quand même bien ",profité," donc euh, donc ça va. "
ParisStories_2019_voyageItalie_52,"et puis pareil, les, les spritz, là-bas ils sont quoi à, six euros, et ils t'amènent euh, l'apéro avec, genre des petits trucs à ",manger, et tout euh. 
ParisStories_2020_histoireHorreur_3,du coup on est ,parti," pour faire euh, un film d'horreur. "
ParisStories_2020_histoireHorreur_5,on ,filmait, et chacun avait un rôle. 
ParisStories_2020_histoireHorreur_10,et à chaque fois que la bête apparaissait il y avait d'autres euh choses un peu mystiques qui ,apparaissaient, aussi. 
ParisStories_2020_histoireHorreur_10,et à chaque fois que la bête ,apparaissait, il y avait d'autres euh choses un peu mystiques qui apparaissaient aussi. 
ParisStories_2020_histoireHorreur_12,,voilà,", il y avait ça. "
ParisStories_2020_histoireHorreur_13,il y avait enfin il y avait plein de personnages euh de des de films qui ,apparaissaient,. 
ParisStories_2020_histoireHorreur_13,il y ,avait, enfin il y avait plein de personnages euh de des de films qui apparaissaient. 
ParisStories_2020_histoireHorreur_18,euh ben en fait juste euh tu ,verras, après. 
ParisStories_2020_histoireHorreur_19,et du coup euh on on était en train de ,tourner,. 
ParisStories_2020_histoireHorreur_22,et tu ,sais, on était en train d'essayer d'éclairer la scène avec les les phares de la voiture. 
ParisStories_2020_histoireHorreur_23,du coup on ,éclaire,. 
ParisStories_2020_histoireHorreur_25,et il y en avait un juste qui ,filmait,", celui qui était dehors genre. "
ParisStories_2020_histoireHorreur_26,et du coup ceux qui étaient à l'arrière de la voiture ils se sentaient un peu ,observés,. 
ParisStories_2020_histoireHorreur_26,et du coup ceux qui étaient à l'arrière de la voiture ils se ,sentaient, un peu observés. 
ParisStories_2020_histoireHorreur_30,et il est ,apparu, et il était là. 
ParisStories_2020_poissonsNoel_9,"et les poissons sont vraiment magnifiques, il y en a de plein de tailles et de plein de couleurs, il y en a qui ",font, peur. 
