sent_id,left_context,pivot,right_context
ParisStories_2022_11_copineEnCarton__3,"donc finalement ben, euh, ça a été très ",compliqué," entre nous, parce qu'on est quand même resté trois ans ensemble, pour euh, faire pl~, un peu résumé. "
ParisStories_2022_11_copineEnCarton__4,on est ,resté," trois ans ensemble, parce qu'on s'est mis ensemble. "
ParisStories_2022_11_copineEnCarton__7,"mais, euh, on s'est ",mis, ensemble pendant trois ans. 
ParisStories_2022_11_copineEnCarton__8,"et, c'était pas la folie, parce que il ",avait," des problèmes, euh. "
ParisStories_2022_11_copineEnCarton__13,"mais euh, je me s~, j'aurais dû le ",laisser," à XXX, finalement. "
ParisStories_2022_11_copineEnCarton__14,"non, parce qu'après, il l'a ",quitté, pour moi. 
ParisStories_2022_11_copineEnCarton__18,"et du coup, ben, euh, on est ",resté, trois ans ensemble. 
ParisStories_2022_11_copineEnCarton__19,"alors, les premiers un an et demi, ça a ",été,", parce qu'on était pas en couple, officiellement. "
ParisStories_2022_11_copineEnCarton__20,"mais après, une fois qu'il m'a dit ouais, tu veux ",sortir," avec moi là, ça a été la catastrophe. "
ParisStories_2022_11_copineEnCarton__22,et je pouvais rien ,faire,. 
ParisStories_2022_11_copineEnCarton__23,"c'était, il me surveillait, il me ",fliquait, tout le temps. 
ParisStories_2022_11_copineEnCarton__24,pourquoi tu ,vas, à une soirée sans moi ? 
ParisStories_2022_11_copineEnCarton__25,je pouvais pas ,vivre, sans lui. 
ParisStories_2022_11_copineEnCarton__28,"donc ok, j'étais ",attirée," par lui au début, physiquement. "
ParisStories_2022_11_copineEnCarton__28,"donc ok, j'étais ",attirée," par lui au début, physiquement. "
ParisStories_2022_11_copineEnCarton__39,"du coup, ce qui c'est passé, c'est que, ben, à un moment, je lui ai ",dit, carte sur table. 
ParisStories_2022_11_copineEnCarton__41,"euh, tu me ",fliques, tout le temps. 
ParisStories_2022_11_copineEnCarton__43,je peux pas ,voir, mes amis sans toi. 
ParisStories_2022_11_copineEnCarton__53,"enfin, je ",vois, jamais mes potes sans toi. 
ParisStories_2022_11_copineEnCarton__54,"est-ce que je t'ai déjà dit euh, écoute, tu vas pas ",voir, César sans moi. 
ParisStories_2022_11_copineEnCarton__56,si tu as envie de ,voir," tes potes sans moi, mais vraiment, vas-y ! "
ParisStories_2022_10_frèreHyperDifférent__5,"du coup, il est ",né," quand, moi, j'avais, euh, trois ans et demi, un truc comme ça. "
ParisStories_2022_10_frèreHyperDifférent__12,"mais euh, je me souviens que je suis arrivée avec mon papa, et que j'ai vu ma mère, et avec mon petit frère dans les bras, et qu'à ce moment-là, euh, on ",devait," le changer, on devait changer sa couche. "
ParisStories_2022_10_frèreHyperDifférent__12,"mais euh, je me souviens que je suis ",arrivée," avec mon papa, et que j'ai vu ma mère, et avec mon petit frère dans les bras, et qu'à ce moment-là, euh, on devait le changer, on devait changer sa couche. "
ParisStories_2022_10_frèreHyperDifférent__14,"et euh, bien euh, j'ai ",vomi, à ce moment-là. 
ParisStories_2022_10_frèreHyperDifférent__16,"du coup, je me dis, la première fois que j'ai vu mon frère, littéralement, j'ai ",vomi,. 
ParisStories_2022_10_frèreHyperDifférent__21,"mais, en tout cas, je me ",souviens," de cette scène-là, à l'hôpital. "
ParisStories_2022_10_frèreHyperDifférent__21,"mais, en tout cas, je me ",souviens," de cette scène-là, à l'hôpital. "
ParisStories_2022_10_frèreHyperDifférent__23,"je sais qu'on a une photo, où on ",est," tous les deux avec, euh, moi avec lui dans les bras, comme ça, comme un petit bébé. "
ParisStories_2022_10_frèreHyperDifférent__23,"je sais qu'on a une photo, où on ",est," tous les deux avec, euh, moi avec lui dans les bras, comme ça, comme un petit bébé. "
ParisStories_2022_10_frèreHyperDifférent__23,"je sais qu'on a une photo, où on ",est," tous les deux avec, euh, moi avec lui dans les bras, comme ça, comme un petit bébé. "
ParisStories_2022_10_frèreHyperDifférent__31,"mais ouais, après euh, à cette époque-là, on habitait euh, on ",habitait," dans les Bouches du Rhône, du coup. "
ParisStories_2022_10_frèreHyperDifférent__31,"mais ouais, après euh, à cette époque-là, on ",habitait," euh, on habitait dans les Bouches du Rhône, du coup. "
ParisStories_2022_10_frèreHyperDifférent__32,"et, euh, bah, on, après, on a chacun ",eu, nos chambres et tout. 
ParisStories_2022_10_frèreHyperDifférent__32,"et, euh, bah, on, après, on a chacun ",eu, nos chambres et tout. 
ParisStories_2022_10_frèreHyperDifférent__33,"et, bon, on a ",fait," un peu nos, nos vies chacun de notre côté, quoi. "
ParisStories_2022_10_frèreHyperDifférent__33,"et, bon, on a ",fait," un peu nos, nos vies chacun de notre côté, quoi. "
ParisStories_2022_10_frèreHyperDifférent__33,"et, bon, on a ",fait," un peu nos, nos vies chacun de notre côté, quoi. "
ParisStories_2022_10_frèreHyperDifférent__34,"et puis, vous ",avez, des vies graves différentes. 
ParisStories_2022_10_frèreHyperDifférent__36,"mais euh, on est ",devenu," des personnes, on est rapidement devenu des personnes hyper différentes. "
ParisStories_2022_10_frèreHyperDifférent__43,et ça ,correspond," assez à nos personnalités que, lui, bah maintenant il est plus euh, bah, il va plus bouger partout et tout. "
ParisStories_2022_10_frèreHyperDifférent__46,"tu sais que, moi, j'ai ",marché, à neuf mois et demi ? 
ParisStories_2022_10_frèreHyperDifférent__60,"ta mère, elle a juste dit ça, c'est une info très importante à ",retenir, pour mon fils euh. 
ParisStories_2022_3_petitDuCentre__1,"oui, bah, en fait, je voulais te raconter ma rencontre avec, euh, un enfant du centre, parce que maintenant ça va faire, euh, deux semaines que je ",travaille," au centre, bah, le mercredi. "
ParisStories_2022_3_petitDuCentre__1,"oui, bah, en fait, je voulais te raconter ma rencontre avec, euh, un enfant du centre, parce que maintenant ça va faire, euh, deux semaines que je ",travaille," au centre, bah, le mercredi. "
ParisStories_2022_3_petitDuCentre__2,"et, et la semaine dernière, j'ai ",rencontré, un petit garçon. 
ParisStories_2022_3_petitDuCentre__5,"au début, il voulait pas ",venir, dans la salle pour faire des activités. 
ParisStories_2022_3_petitDuCentre__5,"au début, il ",voulait, pas venir dans la salle pour faire des activités. 
ParisStories_2022_3_petitDuCentre__7,"et je lui ai demandé, euh, pourquoi il, il, il ne voulait pas ",participer," aux activités, et euh, et comme, bah, tous les enfants. "
ParisStories_2022_3_petitDuCentre__11,je l'ai ,pris," dans mes bras, parce qu'il était en, en train de pleurer. "
ParisStories_2022_3_petitDuCentre__14,et il m'a dit tu peux ,dormir, sur mon épaule si tu veux. 
ParisStories_2022_3_petitDuCentre__18,"et on a passé tout le temps ensemble, parce qu'il était un peu ",perdu, par rapport aux autres. 
ParisStories_2022_3_petitDuCentre__18,"et on a passé tout le temps ensemble, parce qu'il était un peu ",perdu, par rapport aux autres. 
ParisStories_2022_3_petitDuCentre__19,"euh, je pense que, je pense que c'est parce que, euh c'était la première fois ou la deuxième fois qu'il ",venait," comme ça au centre un, un mercredi. "
ParisStories_2022_3_petitDuCentre__25,on a ,discuté," avec, euh, bah, sa mère et avec Warren. "
ParisStories_2022_3_petitDuCentre__26,"et il a même dit qu'il ne voulait pas rentrer à la maison et que, et qu'il voulait ",rentrer, avec moi. 
ParisStories_2022_3_petitDuCentre__26,et il a même dit qu'il ne voulait pas ,rentrer," à la maison et que, et qu'il voulait rentrer avec moi. "
ParisStories_2022_8_rencontreALiège__2,je venais d',arriver, en Belgique. 
ParisStories_2022_8_rencontreALiège__3,c',était, au tout début de mes études d'orthophonie. 
ParisStories_2022_8_rencontreALiège__5,"je m'étais euh, ",installée, le dimanche dans mon appartement. 
ParisStories_2022_8_rencontreALiège__5,"je m'étais euh, ",installée, le dimanche dans mon appartement. 
ParisStories_2022_8_rencontreALiège__6,"et le jeudi, ils avaient ",organisé," une pré-rentrée à la Haute École, pour qu'on puisse euh, se rencontrer, nous, les françaises. "
ParisStories_2022_8_rencontreALiège__6,"et le jeudi, ils avaient ",organisé," une pré-rentrée à la Haute École, pour qu'on puisse euh, se rencontrer, nous, les françaises. "
ParisStories_2022_8_rencontreALiège__8,"et il y avait un professeur de la Haute École qui répondait à toutes nos questions, sur comment s'installer, trouver un appartement, euh, à ",faire," ses courses à Liège, plein de, plein de petites choses pratiques comme ça, pour nous aider à, à mieux intégrer la ville en fait, et mieux s'intégrer surtout. "
ParisStories_2022_8_rencontreALiège__8,et il y avait un professeur de la Haute École qui ,répondait," à toutes nos questions, sur comment s'installer, trouver un appartement, euh, à faire ses courses à Liège, plein de, plein de petites choses pratiques comme ça, pour nous aider à, à mieux intégrer la ville en fait, et mieux s'intégrer surtout. "
ParisStories_2022_8_rencontreALiège__10,on a ,fait, une promenade dans la ville de Liège. 
ParisStories_2022_8_rencontreALiège__11,ça a été ,organisé, par le prof. 
ParisStories_2022_8_rencontreALiège__12,et donc on est toutes ,parties," en groupe, euh, un peu comme euh, comme euh, comme quand on était petit, euh. "
ParisStories_2022_8_rencontreALiège__12,et donc on est toutes ,parties," en groupe, euh, un peu comme euh, comme euh, comme quand on était petit, euh. "
ParisStories_2022_8_rencontreALiège__14,et on se ,promenait, dans les rues. 
ParisStories_2022_8_rencontreALiège__15,"et en fait, derrière moi, j'ai entendu une fille qui parlait assez fort, et qui ",parlait, de la ville de Monaco. 
ParisStories_2022_8_rencontreALiège__15,"et en fait, derrière moi, j'ai ",entendu," une fille qui parlait assez fort, et qui parlait de la ville de Monaco. "
ParisStories_2022_8_rencontreALiège__17,"et, euh, elle ",parlait, de tout son voyage. 
ParisStories_2022_8_rencontreALiège__18,"elle avait pris euh, euh, la voiture euh, le train, pour ",venir," euh, de Monaco à Liège. "
ParisStories_2022_8_rencontreALiège__20,"et en fait, je l'entendais ",parler, derrière moi. 
ParisStories_2022_8_rencontreALiège__25,mais je me suis ,retournée, vers elle. 
ParisStories_2022_8_rencontreALiège__27,"enfin je t'entends parler depuis tout à l'heure, est-ce que je peux me ",joindre, à toi ? 
ParisStories_2022_8_rencontreALiège__31,"parce qu'en fait, on a fait que ",parler," de plein de choses euh, bah, de, de nos écoles, dans lesquelles on était avant, euh, Liège euh, l'orthophonie. "
ParisStories_2022_8_rencontreALiège__32,on a ,parlé," vraiment de, de plein plein de choses. "
ParisStories_2022_1_rencontreSolfège__1,"et à la fin du cours, je lui ai ",demandé," mais au fait, euh, bah, euh, comment je te enfin, euh, j'ai l'impression de te connaître ! "
ParisStories_2022_1_rencontreSolfège__20,"mais, du coup, elle ",habite, à Athis ? 
ParisStories_2022_1_rencontreSolfège__21,"euh, oui, elle ",habite, à Athis. 
ParisStories_2022_1_rencontreSolfège__26,"donc elle m'a dit, euh, tennis, elle le ",faisait, pas à Athis. 
ParisStories_2022_1_rencontreSolfège__27,elle le ,faisait," sur Orly, donc. "
ParisStories_2022_1_rencontreSolfège__29,"et après, on est ",venu, à l'instrument. 
ParisStories_2022_1_rencontreSolfège__30,et elle me disait qu'elle ,faisait, de l'alto. 
ParisStories_2022_1_rencontreSolfège__34,"elle m'a dit, euh je l'ai ",fait," au, euh... "
ParisStories_2022_1_rencontreSolfège__43,"et donc, euh, là, finalement, la première fois que je l'ai rencontrée, parce que après, elle a regardé dans son, hum, elle a ",regardé,", euh, chez elle dans son, comment ça s'appelle … "
ParisStories_2022_1_rencontreSolfège__43,"et donc, euh, là, finalement, la première fois que je l'ai rencontrée, parce que après, elle a regardé dans son, hum, elle a ",regardé,", euh, chez elle dans son, comment ça s'appelle … "
ParisStories_2022_1_rencontreSolfège__43,"et donc, euh, là, finalement, la première fois que je l'ai rencontrée, parce que après, elle a ",regardé," dans son, hum, elle a regardé, euh, chez elle dans son, comment ça s'appelle … "
ParisStories_2022_1_rencontreSolfège__46,"parce que ce qui était bien, c'est que, bon, ça ",dépendait," des activités, hein, mais quand, en fait, euh, on faisait, euh, c'était quoi, le conservatoire, on avait la chance, comme à l'école, d'avoir des photos d'années. "
ParisStories_2022_1_rencontreSolfège__52,"et là, elle a retrouvé une photo, je ne ",sais, plus de quelle année. 
ParisStories_2022_1_rencontreSolfège__54,"pas, je me ",souviens," pas des années, mais plutôt des années scolaires, tu vois, de la date, mais plus des années scolaires. "
ParisStories_2022_1_rencontreSolfège__57,"et là, elle voit, et elle fait ah, mais je te, je t'ai ",reconnue, de suite ! 
ParisStories_2022_1_rencontreSolfège__59,"et donc, finalement, c'",est," pas en seconde, la première fois que je l'ai rencontrée. "
ParisStories_2022_6_tetedeNeuneu__11,"en vrai, je ",sais, pas ça fait combien de temps qu'ils sont ensemble. 
ParisStories_2022_6_tetedeNeuneu__17,je savais juste à quoi il ,ressemblait, vite fait. 
ParisStories_2022_6_tetedeNeuneu__28,moins je ,sais," d'infos sur lui, moins je, enfin, mieux je me sens, tu vois ? "
ParisStories_2022_6_tetedeNeuneu__30,"et, euh, et, du coup, pour son anniversaire là, pour ses 20 ans, sa mère, elle m'a ",envoyé, un message en mode on va faire l'anniversaire surprise. 
ParisStories_2022_6_tetedeNeuneu__33,"et, euh, et, du coup, on devait, enfin, moi, je ",devais," en gros, dé~ comment on dit, euh, genre, détourner l'attention d'Eva. "
ParisStories_2022_6_tetedeNeuneu__35,et elle était ,venue, à la maison. 
ParisStories_2022_6_tetedeNeuneu__36,"toute la journée, elle était ",venue, ? 
ParisStories_2022_6_tetedeNeuneu__40,et elle m'avait ,fait," en mode ah, bah tiens, on a qu'à inviter XXX à manger ! "
ParisStories_2022_6_tetedeNeuneu__45,"et, euh, et du coup, ben, on ",arrive, à l'anniversaire. 
ParisStories_2022_6_tetedeNeuneu__48,"déjà, elle a mis huit ans à ",ouvrir," les, la porte avec les clés. "
ParisStories_2022_6_tetedeNeuneu__53,"si ça se trouve, elle ",est, en haut. 
ParisStories_2022_6_tetedeNeuneu__58,"et là, tu vois la tête de Kévin qui ",dépasse, du mur bon anniversaire ! 
ParisStories_2022_6_tetedeNeuneu__63,mais vu que je l',aime, pas déjà de base … 
ParisStories_2019_prepaScientifique_2,"en fait, euh, quand j'étais, euh, à le lycée, enfin même à le collège, enfin, et surtout en terminale, euh, ce que j'",aimais," le plus c'était les sciences, et surtout les maths. "
ParisStories_2019_prepaScientifique_4,"de le coup, avec ma maman, on a ",demandé," un peu conseil à mes profs, qui euh… "
ParisStories_2019_prepaScientifique_4,"de le coup, avec ma maman, on a ",demandé," un peu conseil à mes profs, qui euh… "
ParisStories_2019_prepaScientifique_5,ils ont un peu tous ,conseillé," de faire une prépa, une prépa scientifique. "
ParisStories_2019_prepaScientifique_6,"donc, euh, moi, XXX, enfin ça me semblait parfait, parce que déjà, euh, ça permettait de pas se ",spécialiser," de le tout tout de suite, de continuer à faire un peu de tout. "
ParisStories_2019_prepaScientifique_7,"et puis euh, j'étais hyper fière d'",aller, en prépa aussi. 
ParisStories_2019_prepaScientifique_9,donc je suis ,allée," en prépa, à Saint-Louis à Paris. "
ParisStories_2019_prepaScientifique_9,donc je suis ,allée," en prépa, à Saint-Louis à Paris. "
ParisStories_2019_prepaScientifique_10,"et, euh, c'était euh, en fait, en fait, ni moi ni ma famille, on avait réfléchi à le fait que ça ",menait, à des études d'ingénieur. 
ParisStories_2019_prepaScientifique_15,"et, euh, ensuite pendant deux ans, ben, j'ai fait que travailler, parce que, enfin, en prépa, euh, tu ",as," pas le temps de réfléchir, euh. "
ParisStories_2019_prepaScientifique_15,"et, euh, ensuite pendant deux ans, ben, j'ai fait que ",travailler,", parce que, enfin, en prépa, euh, tu as pas le temps de réfléchir, euh. "
ParisStories_2019_prepaScientifique_21,"et c'est là que, on a commencé à ",regarder," les brochures, euh, avec mes parents, et XXX on a commencé à regarder les brochures de les écoles d'ingénieur. "
ParisStories_2019_prepaScientifique_24,"mais, euh, j'avais pas envie d'arrêter tout de suite, parce que on fait deux ans de prépa, on ",travaille," à mort, on a pas envie de, euh, d'abandonner quoi, surtout que ça donne aucune équivalence, enfin voilà. "
ParisStories_2019_prepaScientifique_24,"mais, euh, j'avais pas envie d'",arrêter," tout de suite, parce que on fait deux ans de prépa, on travaille à mort, on a pas envie de, euh, d'abandonner quoi, surtout que ça donne aucune équivalence, enfin voilà. "
ParisStories_2019_prepaScientifique_28,"hop, euh, je décide d'",aller, là-bas. 
ParisStories_2019_prepaScientifique_30,"euh, première année d'école d'ingé, je m'",ennuie,", mais, euh, tout le monde s'ennuie un petit peu, parce que c'est encore très général comme enseignement. "
ParisStories_2019_prepaScientifique_34,je ,fais," un stage en, en océanographie, enfin en océanographie spatiale à Toulouse, euh, pendant un mois. "
ParisStories_2019_prepaScientifique_34,je ,fais," un stage en, en océanographie, enfin en océanographie spatiale à Toulouse, euh, pendant un mois. "
ParisStories_2019_prepaScientifique_36,"et, euh, et donc ensuite, on commence la deuxième année, très bien, euh, où là on commence à se ",spécialiser," en hydrographie océanographie, "
ParisStories_2019_prepaScientifique_36,"et, euh, et donc ensuite, on commence la deuxième année, très bien, euh, où là on ",commence," à se spécialiser en hydrographie océanographie, "
ParisStories_2019_prepaScientifique_38,"enfin, c'est, c'est un peu le oh, je m'étais dit que, oh en deuxième année c'",est," cool, on va se spécialiser, ça va commencer à être super intéressant, et, et en fait, euh, ça m'a pas plu. "
ParisStories_2019_vacancesEte_3,euh j'étais en vacances dès le mois de mai en quelque sorte même si j'ai ,travaillé, euh en mai et en juin en tant que baby sitter. 
ParisStories_2019_vacancesEte_3,euh j'étais en vacances dès le mois de mai en quelque sorte même si j'ai ,travaillé, euh en mai et en juin en tant que baby sitter. 
ParisStories_2019_vacancesEte_4,"euh sinon euh en juillet, euh je suis ",restée," chez moi à le début juillet, "
ParisStories_2019_vacancesEte_4,"euh sinon euh en juillet, euh je suis ",restée," chez moi à le début juillet, "
ParisStories_2019_vacancesEte_4,"euh sinon euh en juillet, euh je suis ",restée," chez moi à le début juillet, "
ParisStories_2019_vacancesEte_5,"j'ai fait enfin j'ai vu mes amies, j'ai fait des pique-niques, je suis allée à la Japan Expo, euh j'ai je suis ",allée," dans un spa qu'on m'avait offert enfin bref voilà, très sympa. "
ParisStories_2019_vacancesEte_5,"j'ai fait enfin j'ai vu mes amies, j'ai fait des pique-niques, je suis ",allée," à la Japan Expo, euh j'ai je suis allée dans un spa qu'on m'avait offert enfin bref voilà, très sympa. "
ParisStories_2019_vacancesEte_6,"euh et ensuite le huit juillet je suis, je suis ",partie, euh euh dans les Charentes Maritimes juste pendant une petite semaine avec mes parents. 
ParisStories_2019_vacancesEte_6,"euh et ensuite le huit juillet je suis, je suis ",partie, euh euh dans les Charentes Maritimes juste pendant une petite semaine avec mes parents. 
ParisStories_2019_vacancesEte_6,"euh et ensuite le huit juillet je suis, je suis ",partie, euh euh dans les Charentes Maritimes juste pendant une petite semaine avec mes parents. 
ParisStories_2019_vacancesEte_8,"euh j'ai visité l'Île de Ré, voilà, je suis ",allée, à la plage. 
ParisStories_2019_vacancesEte_9,"il faisait beau, je suis ",allée," à La Rochelle, hum, à l'Île d'Oleron aussi. "
ParisStories_2019_vacancesEte_11,et euh et pendant le mois de juillet il ,avait, une exposition euh à le château de Javarzay. 
ParisStories_2019_vacancesEte_11,et euh et pendant le mois de juillet il ,avait, une exposition euh à le château de Javarzay. 
ParisStories_2019_vacancesEte_15,on est ,allé, à Rochefort aussi. 
ParisStories_2019_vacancesEte_16,et ensuite moi je suis ,repartie," toute seule en train, à Paris, mes parents sont restés là-bas. "
ParisStories_2019_vacancesEte_16,et ensuite moi je suis ,repartie," toute seule en train, à Paris, mes parents sont restés là-bas. "
ParisStories_2019_vacancesEte_17,euh voilà et donc à le retour de à Paris je suis ,allée," à le concert de Coldplay à le Stade de France, euh voilà. "
ParisStories_2019_vacancesEte_17,euh voilà et donc à le retour de à Paris je suis ,allée," à le concert de Coldplay à le Stade de France, euh voilà. "
ParisStories_2019_vacancesEte_17,euh voilà et donc à le retour de à Paris je suis ,allée," à le concert de Coldplay à le Stade de France, euh voilà. "
ParisStories_2019_vacancesEte_19,"voilà et euh ensuite je suis restée euh, euh quelques jours à Paris et je suis ",repartie," le vingt-deux juillet à Biscarrosse, avec mon copain. "
ParisStories_2019_vacancesEte_19,"voilà et euh ensuite je suis restée euh, euh quelques jours à Paris et je suis ",repartie," le vingt-deux juillet à Biscarrosse, avec mon copain. "
ParisStories_2019_vacancesEte_19,"voilà et euh ensuite je suis restée euh, euh quelques jours à Paris et je suis ",repartie," le vingt-deux juillet à Biscarrosse, avec mon copain. "
ParisStories_2019_vacancesEte_19,voilà et euh ensuite je suis ,restée," euh, euh quelques jours à Paris et je suis repartie le vingt-deux juillet à Biscarrosse, avec mon copain. "
ParisStories_2019_vacancesEte_21,"euh, donc je suis ",partie," avec mon copain en train, "
ParisStories_2019_vacancesEte_21,"euh, donc je suis ",partie," avec mon copain en train, "
ParisStories_2019_vacancesEte_24,euh j'ai ,gagné, à le total quinze euros. 
ParisStories_2019_vacancesEte_26,"euh on est allé à le cinéma, on a fait euh de le vélo, on est allé à le lac, on ",retournait," à le casino, "
ParisStories_2019_vacancesEte_26,"euh on est allé à le cinéma, on a fait euh de le vélo, on est ",allé," à le lac, on retournait à le casino, "
ParisStories_2019_vacancesEte_26,"euh on est allé à le cinéma, on a ",fait," euh de le vélo, on est allé à le lac, on retournait à le casino, "
ParisStories_2019_vacancesEte_26,euh on est ,allé," à le cinéma, on a fait euh de le vélo, on est allé à le lac, on retournait à le casino, "
ParisStories_2019_vacancesEte_29,je suis rentrée à Paris et je suis ,repartie, directement euh en colo en fait. 
ParisStories_2019_vacancesEte_29,je suis ,rentrée, à Paris et je suis repartie directement euh en colo en fait. 
ParisStories_2019_vacancesEte_30,donc j'suis j',étais," animatrice, euh dans une colo euh d'adolescents, "
ParisStories_2019_vacancesEte_34,on est ,allé," à la plage, "
ParisStories_2019_vacancesEte_35,on est ,allé," à le casino, beaucoup, parce que on aime bien ça. "
ParisStories_2019_voyageItalie_1,"euh, ouais, tu sais, cet été, euh, j'",étais,", euh, en Italie là, avec Pauline. "
ParisStories_2019_voyageItalie_1,"euh, ouais, tu sais, cet été, euh, j'",étais,", euh, en Italie là, avec Pauline. "
ParisStories_2019_voyageItalie_3,on est ,allé, à Florence pendant deux jours. 
ParisStories_2019_voyageItalie_3,on est ,allé, à Florence pendant deux jours. 
ParisStories_2019_voyageItalie_4,"Et après, on a ",fait,", euh, l'île d'Elbe, Portoferraio, sur, euh, quatre jours, ouais, et après, on a fait les Cinq Terres. "
ParisStories_2019_voyageItalie_6,on est ,resté," cinq jours, par contre, un peu plus. "
ParisStories_2019_voyageItalie_7,"et, euh, après, on est rentré par Gênes, on a ",pris, notre avion à Gênes. 
ParisStories_2019_voyageItalie_7,"et, euh, après, on est ",rentré," par Gênes, on a pris notre avion à Gênes. "
ParisStories_2019_voyageItalie_10,mais à Florence on s',était,", euh, on était dans le centre-ville, on marchait. "
ParisStories_2019_voyageItalie_12,"et, euh, on voulait s'acheter, euh, une glace, genre on ",passe," devant un glacier, et tout. "
ParisStories_2019_voyageItalie_13,"on demande si, euh, on peut s'",installer," en terrasse, euh, pour prendre, euh, notre petite boule de glace. "
ParisStories_2019_voyageItalie_24,"et hum, à le final on est ",parti," en tapant un scandale, "
ParisStories_2019_voyageItalie_33,"et euh. oh la la mais après euh, quand on est ",arrivé," sur hum, sur l'île d'Elbe, c'était horrible parce que euh, mais on n'avait pas vraiment regardé les, les photos de, de l'appart qu'on avait loué. "
ParisStories_2019_voyageItalie_34,et là on ,arrive," devant le truc, "
ParisStories_2019_voyageItalie_35,"déjà on doit longer une espèce d'autoroute, et on ",arrive," devant euh, devant l'appart. "
ParisStories_2019_voyageItalie_41,"et en plus euh, tous les matins, on se ",réveillait," avec des espèces de piqûres de punaises de lit, donc euh non mais. "
ParisStories_2019_voyageItalie_41,"et en plus euh, tous les matins, on se ",réveillait," avec des espèces de piqûres de punaises de lit, donc euh non mais. "
ParisStories_2019_voyageItalie_44,on ,faisait," des siestes de trois heures euh, pendant la journée, enfin c'était pff. "
ParisStories_2019_voyageItalie_45,"et euh, mais à le final euh on a fait notre petite réclamation sur Airbnb, et euh et on a été ",remboursé," de euh, genre euh, quatre-ving euros mais bon. "
