sent_id	left_context	pivot	right_context
ParisStories_2021_rencontreMourinho_12	vraiment tous, mais vraiment, ils se sont tous 	arrêtés	, bon, à part un, où il a fait une petite blague. 
ParisStories_2021_rencontreMourinho_13	il s'est 	arrêté	. 
ParisStories_2021_rencontreMourinho_14	et au final, à la fin, il s'est pas 	arrêté	. 
ParisStories_2021_rencontreMourinho_15	enfin, il s'est 	arrêté	 pour les pour les fans du début, donc pour nous. 
ParisStories_2021_rencontreMourinho_16	et pour les autres, à la fin, il a 	tracé	 une pointe. 
ParisStories_2021_rencontreMourinho_17	et, il a pas voulu s'	arrêter	 plus, quoi. 
ParisStories_2021_rencontreMourinho_18	ouais, c'était pas très cool, mais je pense, il devait 	avoir	 faim. 
ParisStories_2021_rencontreMourinho_20	et euh et donc ma mère, comme, bah, on est portugais et tout, elle commence à lui 	parler	 portugais. 
ParisStories_2021_rencontreMourinho_21	et elle lui demande en portugais est -ce que tu veux m'	épouser	? 
ParisStories_2021_rencontreMourinho_24	et là, lui, il l'a 	regardée	 en mode euh, mais, ça va, madame? 
ParisStories_2021_rencontreMourinho_26	surtout qu'il y 	avait	 mon père à côté. 
ParisStories_2021_rencontreMourinho_28	il a 	répondu	 quoi? 
ParisStories_2021_rencontreMourinho_30	il l'a 	regardée	. 
ParisStories_2021_rencontreMourinho_32	après, il a 	dit	 non de la tête. 
ParisStories_2021_rencontreMourinho_34	mais, vous pouvez au moins 	signer	 mon téléphone, s'il vous plaît? 
ParisStories_2021_rencontreMourinho_35	et donc, du coup, euh, du coup, elle a 	donné	 son téléphone. 
ParisStories_2021_rencontreMourinho_36	et lui il était là en mode, euh, mais, euh, vous voulez que je 	fasse	 quoi avec ça et tout. 
ParisStories_2021_rencontreMourinho_43	bah, ensuite, euh, les autres, ils étaient un peu dégoutés, parce que, du coup, nous, on est cinq, et le temps de 	faire	 les cinq photos, de parler un peu avec eux et tout, euh, bah, les autres, ils étaient un peu en mode bah c'est quand notre tour c'est quand notre tour etc. 
ParisStories_2022_5_gîteEnMontagne__1	honnêtement, je pense que, le mieux ce serait euh, de 	louer	 un gîte, un grand gîte euh, en montagne euh, essentiellement euh. 
ParisStories_2022_5_gîteEnMontagne__4	euh, où il y 	ait	 beaucoup beaucoup euh, de nature autour. 
ParisStories_2022_5_gîteEnMontagne__5	on puisse aller marcher, aller prendre l'air quand on veut, sans 	avoir	 une limite d'un kilomètre. 
ParisStories_2022_5_gîteEnMontagne__5	on puisse aller marcher, aller 	prendre	 l'air quand on veut, sans avoir une limite d'un kilomètre. 
ParisStories_2022_5_gîteEnMontagne__6	euh, pouvoir euh, se 	faire	 des batailles de boules de neige, euh. 
ParisStories_2022_5_gîteEnMontagne__8	et, ouais, pour moi ça serait vraiment le rêve, parce que je pense qu'à rester enfermés comme ça pendant, pendant des jours euh, on finit par euh, 	perdre	 toute notion euh, de temps et d'espace. 
ParisStories_2022_5_gîteEnMontagne__13	non, euh la montagne euh : les Alpes euh, mh, les Pyrénées, ou euh, mh, moi, j'en 	sais	 rien, Tignes. 
ParisStories_2022_5_gîteEnMontagne__17	et euh, franchement euh, je crois que je me rappellerai toujours euh, d'être montée à trois mille, c'est ça trois mille mètres, et euh, et de 	voir	 le, les glaciers avec les moraines euh, effectivement euh, juste en face. 
ParisStories_2022_5_gîteEnMontagne__20	bon, à trois mille mètres, c'était pas top pour tout le monde, hein, je te 	rappelle	. 
ParisStories_2022_5_gîteEnMontagne__23	l'idée, c'était de faire du ski et de s'	amuser	. 
ParisStories_2022_5_gîteEnMontagne__23	l'idée, c'était de 	faire	 du ski et de s'amuser. 
ParisStories_2022_5_gîteEnMontagne__24	mais au-delà de ça euh, en famille euh, tu 	as	 pas des idées, de repas de famille, euh ? 
ParisStories_2022_5_gîteEnMontagne__25	et si tu 	as	 des idées de repas de famille euh, qu'est-ce que tu aimerais qu'on fasse à manger euh ? 
ParisStories_2022_5_gîteEnMontagne__26	ou est-ce que tu voudrais qu'on 	fasse	 quelque chose, justement, d'un petit peu exceptionnel cette année ? 
ParisStories_2022_5_gîteEnMontagne__27	bah, je me suis toujours dit que euh, faire un vrai repas de Noël euh, comme euh, comme nos grands-parents avec euh, la dinde aux marrons, euh, les dix repas, les les dix plats euh, pendant le repas où, où euh, tu as l'impression que tu vas exploser tellement il y a à manger, ça serait génial, parce que je pense que, que depuis que les enfants sont nés, on a pas euh, on a pas 	eu	 trop cette tradition. 
ParisStories_2022_5_gîteEnMontagne__27	bah, je me suis toujours dit que euh, 	faire	 un vrai repas de Noël euh, comme euh, comme nos grands-parents avec euh, la dinde aux marrons, euh, les dix repas, les les dix plats euh, pendant le repas où, où euh, tu as l'impression que tu vas exploser tellement il y a à manger, ça serait génial, parce que je pense que, que depuis que les enfants sont nés, on a pas euh, on a pas eu trop cette tradition. 
ParisStories_2022_16_hamacTahiti__1	ok, c'est quoi le plus, le souvenir, le premier souvenir, le plus clair que tu 	as	 en tête, de nous deux ? 
ParisStories_2022_16_hamacTahiti__4	le premier souvenir de nous le plus clair que j'	ai	, euh, je pense que c'est en Algérie. 
ParisStories_2022_16_hamacTahiti__6	et je sais pas, si tu te 	souviens	. 
ParisStories_2022_16_hamacTahiti__15	Sabrina était là, il me 	semble	. 
ParisStories_2022_16_hamacTahiti__19	en même temps, Morgane, on se 	connaît	 depuis au moins vingt-deux ans maintenant. 
ParisStories_2022_16_hamacTahiti__20	donc, euh, ouais, ça, c'est un souvenir très, très clair que j'	ai	. 
ParisStories_2022_16_hamacTahiti__23	euh, il, il, dans mes souvenirs, il n'y 	avait	 personne. 
ParisStories_2022_16_hamacTahiti__24	enfin, c'était comme si, euh, il n'y 	avait	 personne à part nous et, euh … 
ParisStories_2022_16_hamacTahiti__27	euh, je sais pas, parce que j'ai peur que mes souvenirs les plus jeunes soient des, des, euh, des créations de, de photos que j'ai 	vues	, de nous. 
ParisStories_2022_16_hamacTahiti__28	et du coup, j'aurais 	dit	 Tahiti. 
ParisStories_2022_16_hamacTahiti__33	mais vu que j'	ai	, on énormément de photos et de vidéos de ce voyage, j'ai peur que ce ne soit pas v~, enfin, réel, quoi. 
ParisStories_2022_16_hamacTahiti__33	mais 	vu	 que j'ai, on énormément de photos et de vidéos de ce voyage, j'ai peur que ce ne soit pas v~, enfin, réel, quoi. 
ParisStories_2022_16_hamacTahiti__37	et ce serait, euh, moi qui suis dans le, le hamac et toi qui m'	aides	 à essayer de sortir. 
ParisStories_2022_16_hamacTahiti__39	et je vous 	voyais	 tous. 
ParisStories_2022_16_hamacTahiti__40	et vous me 	regardiez	. 
ParisStories_2022_16_hamacTahiti__41	et je galérais à 	sortir	 de ce putain de hamac. 
ParisStories_2022_18_mocheMaisMignonne__1	le jour où j'ai rencontré ma petite soeur, euh, bah, déjà, ça faisait longtemps que je l'attendais, plus que neuf mois quand même, parce que je l'avais 	demandée	 avant. 
ParisStories_2022_18_mocheMaisMignonne__1	le jour où j'ai rencontré ma petite soeur, euh, bah, déjà, ça faisait longtemps que je l'	attendais	, plus que neuf mois quand même, parce que je l'avais demandée avant. 
ParisStories_2022_18_mocheMaisMignonne__1	le jour où j'ai 	rencontré	 ma petite soeur, euh, bah, déjà, ça faisait longtemps que je l'attendais, plus que neuf mois quand même, parce que je l'avais demandée avant. 
ParisStories_2022_18_mocheMaisMignonne__2	donc, je suis pas allée voir, la 	voir	 le jour même, parce qu'elle est née euh, je crois qu'elle est née le soir. 
ParisStories_2022_18_mocheMaisMignonne__5	il y 	avait	 mes cousins avec moi. 
ParisStories_2022_18_mocheMaisMignonne__8	et euh, il y 	a	 le téléphone qui a sonné. 
ParisStories_2022_18_mocheMaisMignonne__11	j'	avais	 sept ans, je crois. 
ParisStories_2022_18_mocheMaisMignonne__12	mon cousin, il devait 	avoir	 huit ans, mon autre petit cousin, quatre. 
ParisStories_2022_18_mocheMaisMignonne__13	du coup, bah, on est tous allé se 	coucher	. 
ParisStories_2022_18_mocheMaisMignonne__14	et après, donc le lendemain, on est allé la 	voir	 à l'hôpital. 
ParisStories_2022_18_mocheMaisMignonne__21	puis, elle 	avait	 plein de cheveux. 
ParisStories_2022_18_mocheMaisMignonne__23	elle 	était	 dans son, tu sais, c'est pas des landaus, c'est les trucs dans les hôpitaux là, je crois que c'est en verre. 
ParisStories_2022_18_mocheMaisMignonne__26	mais ils les 	mettent	 dedans. 
ParisStories_2022_18_mocheMaisMignonne__28	et je l'ai 	prise	 dans mes bras. 
ParisStories_2022_18_mocheMaisMignonne__33	je la 	rencontrais	 pour la première fois. 
ParisStories_2022_18_mocheMaisMignonne__34	je me souviens que dans l'hôpital, c'était, on était du coup, il y 	avait	 mon père, ma mère et moi. 
ParisStories_2022_18_mocheMaisMignonne__35	mais du coup, il y avait aussi mon oncle et ma tante, vu qu'ils m'avaient 	emmenée	, vu que j'avais dormi chez eux la veille. 
ParisStories_2022_18_mocheMaisMignonne__35	mais du coup, il y 	avait	 aussi mon oncle et ma tante, vu qu'ils m'avaient emmenée, vu que j'avais dormi chez eux la veille. 
ParisStories_2022_18_mocheMaisMignonne__36	et je me souviens que les garçons, ils avaient 	fait	 une course de chariot. 
ParisStories_2022_18_mocheMaisMignonne__37	enfin, je crois ils avaient pris un, un chariot vide ou, je sais pas, tu sais, le truc là où on 	met	 les bébés. 
ParisStories_2022_18_mocheMaisMignonne__37	enfin, je crois ils avaient 	pris	 un, un chariot vide ou, je sais pas, tu sais, le truc là où on met les bébés. 
ParisStories_2022_18_mocheMaisMignonne__39	je sais pas s'ils s'étaient fait 	engueuler	 ou … 
ParisStories_2022_18_mocheMaisMignonne__40	mais ouais, ils avaient 	foutu	 un peu le bazar. 
ParisStories_2022_18_mocheMaisMignonne__41	je me souviens, j'étais jalouse aussi, parce que mon cousin, donc qui a mon âge, il a 	pris	 ma sœur dans ses bras. 
ParisStories_2022_18_mocheMaisMignonne__41	je me souviens, j'étais jalouse aussi, parce que mon cousin, donc qui 	a	 mon âge, il a pris ma sœur dans ses bras. 
ParisStories_2022_18_mocheMaisMignonne__42	toute façon, j'étais trop jalouse après, quand quelqu'un, euh, même quand il y a quelqu'un qui voulait lui 	donner	 le biberon ou … 
ParisStories_2022_18_mocheMaisMignonne__42	toute façon, j'étais trop jalouse après, quand quelqu'un, euh, même quand il y 	a	 quelqu'un qui voulait lui donner le biberon ou … 
ParisStories_2022_18_mocheMaisMignonne__43	mais je crois que je m'en 	souviens	 à moitié, avec les photos, parce que, ça fait longtemps. 
ParisStories_2022_18_mocheMaisMignonne__44	donc, les, la moitié des souvenirs que j'ai, c'est parce que je vois les photos et, du coup, je 	sais	 ce qui s'est passé. 
ParisStories_2022_18_mocheMaisMignonne__44	donc, les, la moitié des souvenirs que j'ai, c'est parce que je 	vois	 les photos et, du coup, je sais ce qui s'est passé. 
ParisStories_2022_18_mocheMaisMignonne__44	donc, les, la moitié des souvenirs que j'	ai	, c'est parce que je vois les photos et, du coup, je sais ce qui s'est passé. 
ParisStories_2022_18_mocheMaisMignonne__46	je sais qu'on l'a 	ramenée	 à la maison. 
ParisStories_2022_15_onEnParleAPersonne__1	parce que, je me 	souviens	, que tu étais sorti, un peu avant moi, genre, peut-être dix minutes, ou, une demi-heure, je sais plus. 
ParisStories_2022_15_onEnParleAPersonne__3	et je sais que je t'ai 	vu	 à la porte, euh, sur le côté à droite. 
ParisStories_2022_15_onEnParleAPersonne__4	je sais, que tu m'	attendais	 là. 
ParisStories_2022_15_onEnParleAPersonne__5	et j'ai fais exprès de sortir par devant, pour faire genre que je t'avais pas vu, en mode je te 	cherche	 et tout. 
ParisStories_2022_15_onEnParleAPersonne__5	et j'ai fais exprès de sortir par devant, pour faire genre que je t'avais pas 	vu	, en mode je te cherche et tout. 
ParisStories_2022_15_onEnParleAPersonne__5	et j'ai 	fais	 exprès de sortir par devant, pour faire genre que je t'avais pas vu, en mode je te cherche et tout. 
ParisStories_2022_15_onEnParleAPersonne__6	je me souviens d'avoir fait un truc con comme ça, je 	sais	 pas pourquoi. 
ParisStories_2022_15_onEnParleAPersonne__6	je me souviens d'avoir 	fait	 un truc con comme ça, je sais pas pourquoi. 
ParisStories_2022_15_onEnParleAPersonne__7	juste parce que j'avais peur d'	aller	 juste droit vers toi, en fait. 
ParisStories_2022_15_onEnParleAPersonne__8	et on a 	parlé	 bouquin. 
ParisStories_2022_15_onEnParleAPersonne__10	on a 	parlé	 Eragon, les Chevaliers d'Émeraude. 
ParisStories_2022_15_onEnParleAPersonne__19	je me souviens que euh, je m'étais 	préparée	, genre, peut-être cinq heures à l'avance au moins. 
ParisStories_2022_15_onEnParleAPersonne__20	et j'avais 	fais	 exprès de rentrer le plus vite possible. 
ParisStories_2022_15_onEnParleAPersonne__21	et, j'avais déjà tout 	préparé	, le matin. 
ParisStories_2022_15_onEnParleAPersonne__22	j'étais déjà, j'avais déjà, mh, je m'étais déjà 	maquillée	. 
ParisStories_2022_15_onEnParleAPersonne__24	j'ai 	repris	 une douche dès que je suis rentrée, en mode vite vite vite. 
ParisStories_2022_15_onEnParleAPersonne__27	et j'ai 	défait	 tous les sacs, mais genre, tous mes sacs de déménagement. 
ParisStories_2022_15_onEnParleAPersonne__28	et j'ai 	essayé	 quatorze millions de tenues. 
ParisStories_2022_15_onEnParleAPersonne__33	en fait, let-shirt vert que j'ai 	mis	, c'est juste parce que, si je partais pas maintenant, j'étais en retard, hein. 
ParisStories_2022_15_onEnParleAPersonne__37	c'est pas trop moche, j'y 	vais	. 
ParisStories_2022_15_onEnParleAPersonne__39	s~, sauf que, du coup, ça va pas du tout avec le on en parle à personne, hein qu'on 	disait	 au début. 
ParisStories_2022_15_onEnParleAPersonne__39	s~, sauf que, du coup, ça va pas du tout avec le on en 	parle	 à personne, hein qu'on disait au début. 
ParisStories_2022_15_onEnParleAPersonne__41	tu m'as 	dit	 ? 
ParisStories_2022_15_onEnParleAPersonne__42	mh, on, je 	sais	 plus comment, on avait décidé qu'on disait pas encore tout de suite. 
ParisStories_2022_15_onEnParleAPersonne__43	franchement, je savais déjà que je l'avais déjà 	dit	 à quelqu'un. 
ParisStories_2022_15_onEnParleAPersonne__47	et dès que je me suis dit on est pas loin de la mairie, il va me 	voir	, j'ai ralenti. 
ParisStories_2022_15_onEnParleAPersonne__48	je me suis 	mise	 à marcher direct. 
ParisStories_2022_15_onEnParleAPersonne__49	on a 	choisi	 le premier bar, mais genre, vraiment. 
ParisStories_2022_15_onEnParleAPersonne__52	tu me fais bon, tu veux 	aller	 où ? 
ParisStories_2022_15_onEnParleAPersonne__54	il y 	a	 genre une place. 
ParisStories_2022_15_onEnParleAPersonne__55	on a 	fait	 le premier, à droite, là. 
ParisStories_2019_cuisineApproximative_1	donc comment je 	fais	 les gougères ? 
ParisStories_2019_cuisineApproximative_2	bah d'abord, enfin je suis pas quelqu'un qui 	fait	 euh, des recettes très très carrées etc. 
ParisStories_2019_cuisineApproximative_3	genre souvent j'ai plus l'habitude de, de pas trop suivre les proportions, de regarder en gros et tout, donc souvent je 	fous	 de l'eau dans la casserole, et souvent trop. 
ParisStories_2019_cuisineApproximative_3	genre souvent j'ai plus l'habitude de, de pas trop 	suivre	 les proportions, de regarder en gros et tout, donc souvent je fous de l'eau dans la casserole, et souvent trop. 
ParisStories_2019_cuisineApproximative_3	genre souvent j'	ai	 plus l'habitude de, de pas trop suivre les proportions, de regarder en gros et tout, donc souvent je fous de l'eau dans la casserole, et souvent trop. 
ParisStories_2019_cuisineApproximative_4	je me suis aperçue que c'était ça qui les 	empêchait	 de gonfler. 
ParisStories_2019_cuisineApproximative_5	et en gros euh, ensuite, ensuite, tu 	mets	 le beurre, genre des morceaux de beurre, 
ParisStories_2019_cuisineApproximative_6	et là j'ai regardé la recette pour une fois du coup quand je t'en ai 	fait	 aujourd'hui. 
ParisStories_2019_cuisineApproximative_6	et là j'ai 	regardé	 la recette pour une fois du coup quand je t'en ai fait aujourd'hui. 
ParisStories_2019_cuisineApproximative_8	et une fois que le tout est bien fondu, bien, ouais, que l'eau et le beurre est bien, est bien, sont bien mélangés, tu rajoutes un peu de sel, et tu rajoutes la farine, et la farine, maintenant je l'ai retenu, c'est ce qu'il y 	a	 le plus gros format. 
ParisStories_2019_cuisineApproximative_8	et une fois que le tout est bien fondu, bien, ouais, que l'eau et le beurre est bien, est bien, sont bien mélangés, tu rajoutes un peu de sel, et tu rajoutes la farine, et la farine, maintenant je l'ai 	retenu	, c'est ce qu'il y a le plus gros format. 
ParisStories_2019_cuisineApproximative_8	et une fois que le tout est bien fondu, bien, ouais, que l'eau et le beurre est bien, est bien, sont bien mélangés, tu rajoutes un peu de sel, et tu 	rajoutes	 la farine, et la farine, maintenant je l'ai retenu, c'est ce qu'il y a le plus gros format. 
ParisStories_2019_cuisineApproximative_8	et une fois que le tout est bien fondu, bien, ouais, que l'eau et le beurre est bien, est bien, sont bien mélangés, tu 	rajoutes	 un peu de sel, et tu rajoutes la farine, et la farine, maintenant je l'ai retenu, c'est ce qu'il y a le plus gros format. 
ParisStories_2019_cuisineApproximative_10	et euh, et du coup tu rajoutes la farine, et ensuite, euh, tu, tu mélanges, et, il faut, il faut bien 	garder	 le feu, parce que comme ça, euh, en fait, l'eau s'évapore. 
ParisStories_2019_cuisineApproximative_10	et euh, et du coup tu 	rajoutes	 la farine, et ensuite, euh, tu, tu mélanges, et, il faut, il faut bien garder le feu, parce que comme ça, euh, en fait, l'eau s'évapore. 
ParisStories_2019_cuisineApproximative_15	et là moi la question que je me suis toujours posée, c'est est-ce que tu 	mets	 les épices, euh, pendant que le beurre est en train de fondre, 
ParisStories_2019_cuisineApproximative_15	et là moi la question que je me suis toujours 	posée	, c'est est-ce que tu mets les épices, euh, pendant que le beurre est en train de fondre, 
ParisStories_2019_cuisineApproximative_16	parce que les matières grasses, ça 	capte	 vachement bien les saveurs et tout. 
ParisStories_2019_cuisineApproximative_17	ou est-ce que tu le 	fais	 une fois que la boule de pâte est formée ? 
ParisStories_2019_cuisineApproximative_18	et en fait, je me 	pose	 cette quest~ bah le fromage, justement c'est aussi la question qu~ parce qu'en fait, une fois que la boule de pâte est ferm~ formée, elle est hyper difficile à casser. 
ParisStories_2019_cuisineApproximative_19	ensuite tu vas 	rajouter	 les œufs, 
ParisStories_2019_cuisineApproximative_21	et du coup euh, le, bah du coup souvent moi je 	rajoute	 tout après. 
ParisStories_2019_cuisineApproximative_22	genre je mets les œufs etc, et une fois que tout est fait là je 	rajoute	 les épices. 
ParisStories_2019_cuisineApproximative_22	genre je 	mets	 les œufs etc, et une fois que tout est fait là je rajoute les épices. 
ParisStories_2019_cuisineApproximative_23	là je rajoute le fr~, fromage et tout, et euh, non non non bah je je l'	enlève	 du feu en fait, dès que, dès que le beurre est fondu. 
ParisStories_2019_cuisineApproximative_23	là je 	rajoute	 le fr~, fromage et tout, et euh, non non non bah je je l'enlève du feu en fait, dès que, dès que le beurre est fondu. 
ParisStories_2019_cuisineApproximative_24	en fait, quand tu 	mets	 la farine à le final ça se décolle. 
ParisStories_2019_cuisineApproximative_25	enfin si tu le 	fais	 bien, et dans les bonnes proportions et tout, ça se décolle hyper vite. 
ParisStories_2019_cuisineApproximative_26	et du coup, euh, du coup après, bah après tu le 	retires	 du feu. 
ParisStories_2019_cuisineApproximative_27	oui j'ai 	oublié	 ce que tu… 
ParisStories_2019_cuisineApproximative_28	mais du coup après tu le 	retires	 du feu une fois que, une fois que c'est, XXX enfin une fois qu~ une fois que le beurre a fondu et que la la farine a été mise et que ça s'est bien décollé de la casserole. 
ParisStories_2019_cuisineApproximative_30	et ensuite tu rajoutes euh, tu rajoutes ton fromage, fromage râpé ou Neufchâtel quand tu 	as	 une super coloc picarde comme toi. 
ParisStories_2019_cuisineApproximative_30	et ensuite tu rajoutes euh, tu 	rajoutes	 ton fromage, fromage râpé ou Neufchâtel quand tu as une super coloc picarde comme toi. 
ParisStories_2019_cuisineApproximative_32	mais souvent je 	trouve	 que le Neufchâtel… 
ParisStories_2019_cuisineApproximative_33	si tu mets du Neufchâtel faut pas 	mettre	 de la muscade. 
ParisStories_2019_cuisineApproximative_33	si tu 	mets	 du Neufchâtel faut pas mettre de la muscade. 
ParisStories_2019_devoirPhilosophie_1	alors c'était au lycée, j'	avais	 un devoir maison à rendre, en philosophie. 
ParisStories_2019_devoirPhilosophie_2	le sujet c'était peut-on se 	mettre	 à la place d'autrui ? 
ParisStories_2019_devoirPhilosophie_3	donc je me suis dit, comment je vais faire pour 	rendre	 ce devoir ? 
ParisStories_2019_devoirPhilosophie_5	mais bon, le prof nous avait quand même euh, initiés à la dissertation, en nous 	expliquant	 euh, ce qu'était la thèse, l'antithèse et la synthèse. 
ParisStories_2019_devoirPhilosophie_5	mais bon, le prof nous avait quand même euh, 	initiés	 à la dissertation, en nous expliquant euh, ce qu'était la thèse, l'antithèse et la synthèse. 
ParisStories_2019_devoirPhilosophie_6	nous avait dit aussi d'utiliser des euh, arguments hum, plutôt atypiques pas toujours euh, ceux du cours, et d'utiliser aussi euh, des exemples et des citations d'auteurs, et de savoir les expliquer et de pas les 	balancer	 que dans le vent comme ça. 
ParisStories_2019_devoirPhilosophie_6	nous avait dit aussi d'utiliser des euh, arguments hum, plutôt atypiques pas toujours euh, ceux du cours, et d'utiliser aussi euh, des exemples et des citations d'auteurs, et de savoir les 	expliquer	 et de pas les balancer que dans le vent comme ça. 
ParisStories_2019_devoirPhilosophie_6	nous avait dit aussi d'utiliser des euh, arguments hum, plutôt atypiques pas toujours euh, ceux du cours, et d'	utiliser	 aussi euh, des exemples et des citations d'auteurs, et de savoir les expliquer et de pas les balancer que dans le vent comme ça. 
ParisStories_2019_devoirPhilosophie_6	nous avait dit aussi d'	utiliser	 des euh, arguments hum, plutôt atypiques pas toujours euh, ceux du cours, et d'utiliser aussi euh, des exemples et des citations d'auteurs, et de savoir les expliquer et de pas les balancer que dans le vent comme ça. 
ParisStories_2019_devoirPhilosophie_7	du coup je m'étais 	penchée	 un peu sur mon devoir 
ParisStories_2019_devoirPhilosophie_8	et euh, il y 	avait	 quelques idées, mais pas euh, les idées atypiques que le prof recherchait. 
ParisStories_2019_devoirPhilosophie_9	donc je l'ai 	laissé	 un peu de côté tu vois, quelques jours. 
ParisStories_2019_devoirPhilosophie_11	en fait, un jour, j'ai euh, j'entends, j'	écoutais	 pardon la radio. 
ParisStories_2019_devoirPhilosophie_13	et euh, j'écoutais le témoignage d'une euh bonne sœur, sœur Marie-Paul Ross qui était en train de 	présenter	 euh, son livre. 
ParisStories_2019_devoirPhilosophie_13	et euh, j'	écoutais	 le témoignage d'une euh bonne sœur, sœur Marie-Paul Ross qui était en train de présenter euh, son livre. 
ParisStories_2019_devoirPhilosophie_16	c'est ça en fait le, le truc qui m'a interpellé, c'est que en gros euh, elle est 	devenue	 sexologue. 
ParisStories_2019_devoirPhilosophie_16	c'est ça en fait le, le truc qui m'a 	interpellé	, c'est que en gros euh, elle est devenue sexologue. 
ParisStories_2019_devoirPhilosophie_20	et d'un autre côté, elle veut euh, 	donner	 des conseils euh, à ses patients euh, sur le sexe. 
ParisStories_2019_devoirPhilosophie_24	et en gros euh, comme elle était missionnaire avant, ~enfin, elle l'est toujours d'ailleurs, euh lors de ses voyages, en Amérique Latine, et elle est 	restée	, du coup euh, dix-huit ans là-bas. 
ParisStories_2019_devoirPhilosophie_25	elle expliquait qu'elle est, qu'elle a 	eu	 vraiment un choc culturel, et euh qu'elle a était confrontée à beaucoup de violences sexuelles. 
ParisStories_2019_devoirPhilosophie_26	notamment euh, chez les jeunes générations, donc en gros chez les jeunes, et euh qu'ils ne savaient pas euh, se respecter, et ils n'	avaient	 aucune éducation sexuelle. 
ParisStories_2019_devoirPhilosophie_26	notamment euh, chez les jeunes générations, donc en gros chez les jeunes, et euh qu'ils ne savaient pas euh, se 	respecter	, et ils n'avaient aucune éducation sexuelle. 
ParisStories_2019_devoirPhilosophie_27	du coup euh, comme elle était, quand même, confrontée à beaucoup de violences sexuelles, elle s'est dit ben, pour les aider, je vais leur donner des cours d'éducation sexuelle, pour euh, justement euh, essayer de 	changer	 leurs comportements et leur vision quoi. 
ParisStories_2019_devoirPhilosophie_27	du coup euh, comme elle était, quand même, confrontée à beaucoup de violences sexuelles, elle s'est dit ben, pour les aider, je vais leur 	donner	 des cours d'éducation sexuelle, pour euh, justement euh, essayer de changer leurs comportements et leur vision quoi. 
ParisStories_2019_devoirPhilosophie_27	du coup euh, comme elle était, quand même, confrontée à beaucoup de violences sexuelles, elle s'est dit ben, pour les 	aider	, je vais leur donner des cours d'éducation sexuelle, pour euh, justement euh, essayer de changer leurs comportements et leur vision quoi. 
ParisStories_2019_devoirPhilosophie_28	bah en fait euh, parfois, i~, ils 	respectaient	 pas euh, par exemple, la femme. 
ParisStories_2019_devoirPhilosophie_29	il y 	avait	 beaucoup de violences sexuelles là-bas, en fait. 
