sent_id,left_context,pivot,right_context,ID,FORM,LEMMA,UPOS,XPOS,FEATS,HEAD,DEPREL,DEPS,MISC,dist
w01129053,"En 2003, il a dominé au classement des points, menant les 33 dernières courses sur les 36 et il est ",devenu," le champion de l’année 2003 de la Winston Cup de NASCAR, le dernier pilote à détenir un tel titre. ",25,devenu,devenir,VERB,VBN,Gender=Masc|Number=Sing|Tense=Past|VerbForm=Part,6,conj,_,_,1
w01129053,"En 2003, il a ",dominé," au classement des points, menant les 33 dernières courses sur les 36 et il est devenu le champion de l’année 2003 de la Winston Cup de NASCAR, le dernier pilote à détenir un tel titre. ",6,dominé,dominer,VERB,VBN,Gender=Masc|Number=Sing|Tense=Past|VerbForm=Part,0,root,_,_,-1
w01130099,"Gerry Rafferty sort deux autres albums dans les années 1990, ",décrit, par le musicien Tom Robinson plus tard comme « un grand retour à la forme ». ,12,décrit,décrire,VERB,VBN,Gender=Masc|Number=Sing|Tense=Past|VerbForm=Part,3,ccomp,_,_,2
w01130101,"Il comprenait trois morceaux co-écrits avec le frère de Gerry Rafferty, Jim, également un chanteur-compositeur, qui avait ",signé, chez Decca Records dans les années 1970. ,21,signé,signer,VERB,VBN,Gender=Masc|Number=Sing|Tense=Past|VerbForm=Part,8,acl:relcl,_,_,2
w01130101,Il comprenait trois morceaux ,co-écrits," avec le frère de Gerry Rafferty, Jim, également un chanteur-compositeur, qui avait signé chez Decca Records dans les années 1970. ",5,co-écrits,co-écrire,VERB,VBN,Gender=Masc|Number=Plur|Tense=Past|VerbForm=Part,4,acl,_,_,2
w01130102,Gerry Rafferty a enregistré une nouvelle version d’une chanson auparavant ,enregistrée, avec The Humblebums « Her Father Didn't Like Me Anyway » sur son album « Over My Head » (1994). ,12,enregistrée,enregistrer,VERB,VBN,Gender=Fem|Number=Sing|Tense=Past|VerbForm=Part,10,acl,_,_,6
w01130103,Il s'agit des deux derniers enregistrements réalisés par Gerry Rafferty avec Hugh Murphy ; ce dernier est ,décédé, en 1998. ,20,décédé,décéder,VERB,VBN,Gender=Masc|Number=Sing|Tense=Past|VerbForm=Part,3,parataxis,_,_,-1
w01130103,Il s'agit des deux derniers enregistrements ,réalisés, par Gerry Rafferty avec Hugh Murphy ; ce dernier est décédé en 1998. ,9,réalisés,réaliser,VERB,VBN,Gender=Masc|Number=Plur|Tense=Past|VerbForm=Part,8,acl,_,_,-1
w01131060,"Au moins 330 000 personnes, dont 10 000 techniciens, ont été ",impliquées,. ,13,impliquées,impliquer,VERB,VBN,Gender=Fem|Number=Plur|Tense=Past|VerbForm=Part,0,root,_,SpaceAfter=No,-1
w01131076,Joseph Staline avait ,commencé, à encourager Viktor Abakumov à former son propre réseau à l'intérieur du KGB pour contrer la domination de Lavrenti Beria sur les ministères de pouvoir. ,4,commencé,commencer,VERB,VBN,Gender=Masc|Number=Sing|Tense=Past|VerbForm=Part,0,root,_,_,-1
w01132042,Les tendances présentées par les données de la région de Petén et d'Uaxactun ont ,permis, à ces sites de s'intégrer au développement culturel des basses terres mayas. ,16,permis,permettre,VERB,VBN,Gender=Masc|Number=Sing|Tense=Past|VerbForm=Part,0,root,_,_,1
w01132042,Les tendances ,présentées, par les données de la région de Petén et d'Uaxactun ont permis à ces sites de s'intégrer au développement culturel des basses terres mayas. ,3,présentées,présenter,VERB,VBN,Gender=Fem|Number=Plur|Tense=Past|VerbForm=Part,2,acl,_,_,1
w01132056,L'article de Thompson suppose que les Mayas étaient finalement des personnes « paisibles » car ils ,manquaient, de défenses apparentes. ,18,manquaient,manquer,VERB,VBC,Mood=Ind|Number=Plur|Person=3|Tense=Imp|VerbForm=Fin,9,conj,_,_,1
w01132056,L'article de Thompson ,suppose, que les Mayas étaient finalement des personnes « paisibles » car ils manquaient de défenses apparentes. ,5,suppose,supposer,VERB,VBC,Mood=Ind|Number=Sing|Person=3|Tense=Pres|VerbForm=Fin,0,root,_,_,1
w01132081,"Les voiles ne sont pas représentées dans l'iconographie ou les textes préhistoriques de la Mésoamérique, au lieu de cela, il est ",théorisé, que les anciens Mayas utilisaient les pirogues comme le principal mode de transport pour se déplacer sur l'eau. ,26,théorisé,théoriser,VERB,VBN,Gender=Masc|Number=Sing|Tense=Past|VerbForm=Part,6,conj,_,_,1
w01132081,Les voiles ne sont pas ,représentées," dans l'iconographie ou les textes préhistoriques de la Mésoamérique, au lieu de cela, il est théorisé que les anciens Mayas utilisaient les pirogues comme le principal mode de transport pour se déplacer sur l'eau. ",6,représentées,représenter,VERB,VBN,Gender=Fem|Number=Plur|Tense=Past|VerbForm=Part,0,root,_,_,1
w01133014,"Jim Starlin a repris comme fil rouge la question suivante, et a commencé à développer un arc narratif élaboré sur le super vilain Thanos, ",réparti, dans un certain nombre de titres Marvel. ,27,réparti,répartir,VERB,VBN,Gender=Masc|Number=Sing|Tense=Past|VerbForm=Part,18,acl,_,_,2
w01133014,"Jim Starlin a repris comme fil rouge la question suivante, et a ",commencé," à développer un arc narratif élaboré sur le super vilain Thanos, réparti dans un certain nombre de titres Marvel. ",14,commencé,commencer,VERB,VBN,Gender=Masc|Number=Sing|Tense=Past|VerbForm=Part,4,conj,_,_,2
w01133016,"Simultanément au milieu des années 1970, Jim Starlin a ",contribué," à une collection d’histoires de Start Reach, des périodiques indépendants de bande dessinée. ",13,contribué,contribuer,VERB,VBN,Gender=Masc|Number=Sing|Tense=Past|VerbForm=Part,0,root,_,_,1
w01134062,"En 1955, Yukio Mishima a ",commencé," à faire de la musculation et pendant les 15 dernières années de sa vie, il a suivi sans interruption son programme d'entraînement de trois séances par semaine. ",7,commencé,commencer,VERB,VBN,Gender=Masc|Number=Sing|Tense=Past|VerbForm=Part,0,root,_,_,-1
w01135034,"En 2011, Emily Blunt a été ",nommée, égérie du nouveau parfum Opium d’Yves Saint Laurent. ,8,nommée,nommer,VERB,VBN,Gender=Fem|Number=Sing|Tense=Past|VerbForm=Part,0,root,_,_,-1
w01135035,Emily Blunt a joué dans la comédie britannique ,dirigée," par Lasse Hallström, « Des saumons dans le désert » (2011), avec Ewan McGregor et Kristin Scott Thomas. ",9,dirigée,diriger,VERB,VBN,Gender=Fem|Number=Sing|Tense=Past|VerbForm=Part,7,acl,_,_,0
w01135035,Emily Blunt a ,joué," dans la comédie britannique dirigée par Lasse Hallström, « Des saumons dans le désert » (2011), avec Ewan McGregor et Kristin Scott Thomas. ",4,joué,jouer,VERB,VBN,Gender=Masc|Number=Sing|Tense=Past|VerbForm=Part,0,root,_,_,0
w01135036,"Cette même année, elle est brièvement ",apparue," en tant que réceptionniste de Mlle Piggy dans « Les Muppets, le retour » (2011), de Walt Disney Pictures. ",8,apparue,apparaître,VERB,VBN,Gender=Fem|Number=Sing|Tense=Past|VerbForm=Part,0,root,_,_,2
w01135037,"Elle a joué dans le film 5 ans de Réflexion, avec sa co-vedette Jason Segel, ",réalisé, par Nicholas Stoller en 2012. ,18,réalisé,réaliser,VERB,VBN,Gender=Masc|Number=Sing|Tense=Past|VerbForm=Part,6,acl,_,_,-1
w01135037,Elle a ,joué," dans le film 5 ans de Réflexion, avec sa co-vedette Jason Segel, réalisé par Nicholas Stoller en 2012. ",3,joué,jouer,VERB,VBN,Gender=Masc|Number=Sing|Tense=Past|VerbForm=Part,0,root,_,_,-1
w01135038,"En janvier 2011, Emily Blunt a tenu le premier rôle du film Looper, face à Joseph Gordon-Levitt et Bruce Willis ; c’est un film de science-fiction américain, réalisé par Rian Johnson, ",sorti, en septembre 2012. ,38,sorti,sortir,VERB,VBN,Gender=Masc|Number=Sing|Tense=Past|VerbForm=Part,28,acl,_,_,1
w01135038,"En janvier 2011, Emily Blunt a tenu le premier rôle du film Looper, face à Joseph Gordon-Levitt et Bruce Willis ; c’est un film de science-fiction américain, ",réalisé," par Rian Johnson, sorti en septembre 2012. ",33,réalisé,réaliser,VERB,VBN,Gender=Masc|Number=Sing|Tense=Past|VerbForm=Part,28,acl,_,_,1
w01136029,Rudolph Valentino a ,essayé, de distancier le personnage d’un portrait stéréotypé d’un homme arabe. ,4,essayé,essayer,VERB,VBN,Gender=Masc|Number=Sing|Tense=Past|VerbForm=Part,0,root,_,_,-1
w01136074,Joseph Schenck ,souhaitait," que sa femme, Norma Talmadge, donne la réplique à Valentino dans une version de Romeo et Juliette. ",3,souhaitait,souhaiter,VERB,VBC,Mood=Ind|Number=Sing|Person=3|Tense=Imp|VerbForm=Fin,0,root,_,_,-1
w01137087,"En mai, les gardes-frontières tchèques ont fusillé deux fermiers allemands des Sudètes qui ",tentaient, de traverser la frontière en Tchécoslovaquie sans s'arrêter aux contrôles aux frontières. ,16,tentaient,tenter,VERB,VBC,Mood=Ind|Number=Plur|Person=3|Tense=Imp|VerbForm=Fin,10,acl:relcl,_,_,1
w01138045,"Au cours de cette période, Édith Piaf et Mômone laissaient souvent Marcelle seul dans la chambre pendant qu’ils étaient dehors ou en train de ",chanter, dans un club. ,28,chanter,chanter,VERB,VB,VerbForm=Inf,22,conj,_,_,1
w01138045,"Au cours de cette période, Édith Piaf et Mômone laissaient souvent Marcelle seul dans la chambre pendant qu’ils ",étaient, dehors ou en train de chanter dans un club. ,22,étaient,être,VERB,VBC,Mood=Ind|Number=Plur|Person=3|Tense=Imp|VerbForm=Fin,12,advcl,_,_,1
w01139043,Ils ont été presque complètement ,oubliés, jusqu'après la mort de E.E. Smith. ,6,oubliés,oublier,VERB,VBN,Gender=Masc|Number=Plur|Tense=Past|VerbForm=Part,0,root,_,_,-1
w01140030,"Dès 1926, Stephen Meyer s’était adressé à Irène Joliot-Curie suggérant qu’Elizabeth Rona devrait collaborer avec elle pour apprendre comment son laboratoire ",pouvait, créer ses propres échantillons de polonium. ,25,pouvait,pouvoir,VERB,VBC,Mood=Ind|Number=Sing|Person=3|Tense=Imp|VerbForm=Fin,21,ccomp,_,_,1
w01140030,"Dès 1926, Stephen Meyer s’était adressé à Irène Joliot-Curie suggérant qu’Elizabeth Rona devrait collaborer avec elle pour ",apprendre, comment son laboratoire pouvait créer ses propres échantillons de polonium. ,21,apprendre,apprendre,VERB,VB,VerbForm=Inf,17,advcl,_,_,1
w01140030,"Dès 1926, Stephen Meyer s’était adressé à Irène Joliot-Curie suggérant qu’Elizabeth Rona devrait ",collaborer, avec elle pour apprendre comment son laboratoire pouvait créer ses propres échantillons de polonium. ,17,collaborer,collaborer,VERB,VB,VerbForm=Inf,16,xcomp,_,_,1
w01140030,"Dès 1926, Stephen Meyer s’était adressé à Irène Joliot-Curie suggérant qu’Elizabeth Rona ",devrait, collaborer avec elle pour apprendre comment son laboratoire pouvait créer ses propres échantillons de polonium. ,16,devrait,devoir,VERB,VBC,Mood=Cnd|Number=Sing|Person=3|Tense=Pres|VerbForm=Fin,12,ccomp,_,_,1
w01140030,"Dès 1926, Stephen Meyer s’était adressé à Irène Joliot-Curie ",suggérant, qu’Elizabeth Rona devrait collaborer avec elle pour apprendre comment son laboratoire pouvait créer ses propres échantillons de polonium. ,12,suggérant,suggérer,VERB,VBG,Tense=Pres|VerbForm=Part,8,ccomp,_,_,1
w01140031,"Une fois que Hans Pettersson a pu obtenir des fonds pour payer les dépenses d’Elizabeth Rona, Joliot-Curie lui a donné l’accord pour ",venir, étudier la séparation du polonium à l'Institut Curie à Paris ,26,venir,venir,VERB,VB,VerbForm=Inf,24,xcomp,_,_,1
w01140031,Une fois que Hans Pettersson a ,pu," obtenir des fonds pour payer les dépenses d’Elizabeth Rona, Joliot-Curie lui a donné l’accord pour venir étudier la séparation du polonium à l'Institut Curie à Paris ",7,pu,pouvoir,VERB,VBN,Gender=Masc|Number=Sing|Tense=Past|VerbForm=Part,22,advcl,_,_,1
w01140033,,Reconnue," comme experte dans le domaine, elle avait démontré ses compétences à l'Institut du Radium avec un petit disque de polonium. ",1,Reconnue,reconnaître,VERB,VBN,Gender=Fem|Number=Sing|Tense=Past|VerbForm=Part,8,ccomp,_,wordform=reconnue,-1
w01140034,"Ce disque a permis à Elizabeth Rona de créer des échantillons de laboratoire de polonium, qui ont été utilisés ultérieurement pour la plupart des recherches ",effectuées, par l'Institut. ,28,effectuées,effectuer,VERB,VBN,Gender=Fem|Number=Plur|Tense=Past|VerbForm=Part,27,acl,_,_,-1
w01140034,"Ce disque a permis à Elizabeth Rona de créer des échantillons de laboratoire de polonium, qui ont été ",utilisés, ultérieurement pour la plupart des recherches effectuées par l'Institut. ,20,utilisés,utiliser,VERB,VBN,Gender=Masc|Number=Plur|Tense=Past|VerbForm=Part,11,acl:relcl,_,_,1
w01140034,Ce disque a ,permis," à Elizabeth Rona de créer des échantillons de laboratoire de polonium, qui ont été utilisés ultérieurement pour la plupart des recherches effectuées par l'Institut. ",4,permis,permettre,VERB,VBN,Gender=Masc|Number=Sing|Tense=Past|VerbForm=Part,0,root,_,_,1
w01141025,"En 2013 pendant la saison morte, elle est apparue sur la chaine de télévision CTV Montréal et elle a été ",invitée, pour présenter la météo. ,22,invitée,inviter,VERB,VBN,Gender=Fem|Number=Sing|Tense=Past|VerbForm=Part,10,conj,_,_,1
w01141025,"En 2013 pendant la saison morte, elle est ",apparue, sur la chaine de télévision CTV Montréal et elle a été invitée pour présenter la météo. ,10,apparue,apparaître,VERB,VBN,Gender=Fem|Number=Sing|Tense=Past|VerbForm=Part,0,root,_,_,1
w01141077,"Elle a ensuite affronté la championne en titre et la tête de série Sara Errani, mais a été ",battue,. ,20,battue,battre,VERB,VBN,Gender=Fem|Number=Sing|Tense=Past|VerbForm=Part,4,conj,_,SpaceAfter=No,-1
w01142013,"Lorsque leur fille Cécile Neville épousa Richard Plantagenet, le troisième duc d'York, ils eurent plusieurs enfants, dont Edward IV et Richard III, Joan Beaufort est ",devenue, la grand-mère de deux rois d'York. ,31,devenue,devenir,VERB,VBN,Gender=Fem|Number=Sing|Tense=Past|VerbForm=Part,17,conj,_,_,2
w01142031,Jean de Gand est ,mort, en 1399. ,5,mort,mourir,VERB,VBN,Gender=Masc|Number=Sing|Tense=Past|VerbForm=Part,0,root,_,_,-1
w01142063,Le chevalier Lyvet fut relâché et son disciple fut ,jeté, dans la Tour. ,10,jeté,jeter,VERB,VBN,Gender=Masc|Number=Sing|Tense=Past|VerbForm=Part,5,conj,_,_,1
w01142063,Le chevalier Lyvet fut ,relâché, et son disciple fut jeté dans la Tour. ,5,relâché,relâcher,VERB,VBN,Gender=Masc|Number=Sing|Tense=Past|VerbForm=Part,0,root,_,_,1
w01143015,"Il n'y a pas si longtemps, il était divorcé de l'actrice Gloria Holden, mais après la rupture il a ",voulu, reprendre le flambeau. ,24,voulu,vouloir,VERB,VBN,Gender=Masc|Number=Sing|Tense=Past|VerbForm=Part,11,conj,_,_,1
w01143015,"Il n'y a pas si longtemps, il était ",divorcé," de l'actrice Gloria Holden, mais après la rupture il a voulu reprendre le flambeau. ",11,divorcé,divorcer,VERB,VBN,Gender=Masc|Number=Sing|Tense=Past|VerbForm=Part,0,root,_,_,-1
w01143015,Il n'y ,a," pas si longtemps, il était divorcé de l'actrice Gloria Holden, mais après la rupture il a voulu reprendre le flambeau. ",4,a,avoir,VERB,VBC,Mood=Ind|Number=Sing|Person=3|Tense=Pres|VerbForm=Fin,11,advcl,_,_,-1
w01144031,Il a ,décidé, de ne pas briguer un troisième mandat lors du prochain cycle électoral. ,3,décidé,décider,VERB,VBN,Gender=Masc|Number=Sing|Tense=Past|VerbForm=Part,0,root,_,_,-1
w01144084,"Il avait récupéré et était sorti de l'hôpital le 11 avril, ",devenant, ainsi le premier président des Etats-Unis à survivre une fusillade dans une tentative d'assassinat. ,14,devenant,devenir,VERB,VBG,Tense=Pres|VerbForm=Part,3,advcl,_,_,1
w01144084,Il avait récupéré et était ,sorti," de l'hôpital le 11 avril, devenant ainsi le premier président des Etats-Unis à survivre une fusillade dans une tentative d'assassinat. ",6,sorti,sortir,VERB,VBN,Gender=Masc|Number=Sing|Tense=Past|VerbForm=Part,3,conj,_,_,-1
w01144084,Il avait ,récupéré," et était sorti de l'hôpital le 11 avril, devenant ainsi le premier président des Etats-Unis à survivre une fusillade dans une tentative d'assassinat. ",3,récupéré,récupérer,VERB,VBN,Gender=Masc|Number=Sing|Tense=Past|VerbForm=Part,0,root,_,_,-1
w01144086,Ronald Reagan croyait que Dieu avait épargné sa vie afin qu'il ,puisse, accomplir un objectif plus grand. ,13,puisse,pouvoir,VERB,VBC,Mood=Sub|Number=Sing|Person=3|Tense=Pres|VerbForm=Fin,7,advcl,_,_,3
w01144086,Ronald Reagan ,croyait, que Dieu avait épargné sa vie afin qu'il puisse accomplir un objectif plus grand. ,3,croyait,croire,VERB,VBC,Mood=Ind|Number=Sing|Person=3|Tense=Imp|VerbForm=Fin,0,root,_,_,-1
w01146051,Ernst Bloch est soucieux de faire de l'espoir un principe directeur de son marxisme et ,souligne, que l'humanisme implicite est inhérent à la tradition mystique. ,17,souligne,souligner,VERB,VBC,Mood=Ind|Number=Sing|Person=3|Tense=Pres|VerbForm=Fin,4,conj,_,_,2
w01146099,Une théologie appropriée devra donc être construite compte ,tenu, de son objectif. ,9,tenu,tenir,VERB,VBN,Gender=Masc|Number=Sing|Tense=Past|VerbForm=Part,8,fixed,_,_,1
w01146099,Une théologie appropriée devra donc être ,construite, compte tenu de son objectif. ,7,construite,construire,VERB,VBN,Gender=Fem|Number=Sing|Tense=Past|VerbForm=Part,4,xcomp,_,_,1
w01146099,Une théologie appropriée ,devra, donc être construite compte tenu de son objectif. ,4,devra,devoir,VERB,VBC,Mood=Ind|Number=Sing|Person=3|Tense=Fut|VerbForm=Fin,0,root,_,_,1
w01147010,"En 1991, Pebe Seber ",déménage," avec sa famille à Nashville (Tennessee), après avoir obtenu un nouvel accord d'édition pour sa composition. ",6,déménage,déménager,VERB,VBC,Mood=Ind|Number=Sing|Person=3|Tense=Pres|VerbForm=Fin,0,root,_,_,-1
w01147018,"Kesha a co-écrit avec Pebe, quand elle n'avait que 16 ans, la chanson « Stephen » ; ensuite, elle a contacté David Gamson, un producteur qu'elle admirait et qui faisait partie du groupe d'électropop Scritti Politti, qui a fini par ",accepter, de produire la chanson. ,50,accepter,accepter,VERB,VB,VerbForm=Inf,48,xcomp,_,_,1
w01147018,"Kesha a co-écrit avec Pebe, quand elle n'avait que 16 ans, la chanson « Stephen » ; ensuite, elle a contacté David Gamson, un producteur qu'elle admirait et qui faisait partie du groupe d'électropop Scritti Politti, qui a ",fini, par accepter de produire la chanson. ,48,fini,finir,VERB,VBN,Gender=Masc|Number=Sing|Tense=Past|VerbForm=Part,30,acl:relcl,_,_,1
w01148068,"Cette fois, le message lui est parvenu, mais il refusa de croire qu'elle ne ",voulait, plus se marier avec lui. ,18,voulait,vouloir,VERB,VBC,Mood=Ind|Number=Sing|Person=3|Tense=Imp|VerbForm=Fin,14,ccomp,_,_,-1
w01148068,"Cette fois, le message lui est parvenu, mais il refusa de ",croire, qu'elle ne voulait plus se marier avec lui. ,14,croire,croire,VERB,VB,VerbForm=Inf,12,xcomp,_,_,-1
w01148068,"Cette fois, le message lui est parvenu, mais il ",refusa, de croire qu'elle ne voulait plus se marier avec lui. ,12,refusa,refuser,VERB,VBC,Mood=Ind|Number=Sing|Person=3|Tense=Past|VerbForm=Fin,8,conj,_,_,-1
w01148068,"Cette fois, le message lui est ",parvenu,", mais il refusa de croire qu'elle ne voulait plus se marier avec lui. ",8,parvenu,parvenir,VERB,VBN,Gender=Masc|Number=Sing|Tense=Past|VerbForm=Part,0,root,_,SpaceAfter=No,-1
w01149002,"Edgar Wright est né à Poole, dans le Dorset mais il a ",grandi," principalement dans la petite ville de Wells, dans le Somerset. ",14,grandi,grandir,VERB,VBN,Gender=Masc|Number=Sing|Tense=Past|VerbForm=Part,4,conj,_,_,0
w01149002,Edgar Wright est ,né," à Poole, dans le Dorset mais il a grandi principalement dans la petite ville de Wells, dans le Somerset. ",4,né,naître,VERB,VBN,Gender=Masc|Number=Sing|Tense=Past|VerbForm=Part,0,root,_,_,0
w01149077,"Edgar Wright a un frère qui s’appelle Oscar Wright ; ce dernier est un artiste de bande dessinée, qui ",contribue," aux story-boards, à l’art conceptuel et aux photos promotionnelles pour les films d’Edgar. ",22,contribue,contribuer,VERB,VBC,Mood=Ind|Number=Sing|Person=3|Tense=Pres|VerbForm=Fin,16,acl:relcl,_,_,0
w01150044,Les grandes puissances n'ont pas ,répondu, aux demandes de reconnaissance de l'Albanie. ,7,répondu,répondre,VERB,VBN,Gender=Masc|Number=Sing|Tense=Past|VerbForm=Part,0,root,_,_,2
w01150046,"Au lieu de cela, ils ont décidé que l'Albanie ",serait, sous la suzeraineté ottomane mais avec un gouvernement autonome. ,13,serait,être,VERB,VBC,Mood=Cnd|Number=Sing|Person=3|Tense=Pres|VerbForm=Fin,9,ccomp,_,_,1
w01150046,"Au lieu de cela, ils ont ",décidé, que l'Albanie serait sous la suzeraineté ottomane mais avec un gouvernement autonome. ,9,décidé,décider,VERB,VBN,Gender=Masc|Number=Sing|Tense=Past|VerbForm=Part,0,root,_,_,1
w01150047,"Après qu'il est devenu évident que l'Empire ottoman perdrait toute la Macédoine et son rattachement territorial avec l'Albanie, les grandes puissances se sont rendues compte qu'elles ",devaient, changer leur décision. ,32,devaient,devoir,VERB,VBC,Mood=Ind|Number=Plur|Person=3|Tense=Imp|VerbForm=Fin,28,ccomp,_,_,1
w01150047,Après qu'il est ,devenu," évident que l'Empire ottoman perdrait toute la Macédoine et son rattachement territorial avec l'Albanie, les grandes puissances se sont rendues compte qu'elles devaient changer leur décision. ",5,devenu,devenir,VERB,VBN,Gender=Masc|Number=Sing|Tense=Past|VerbForm=Part,28,advcl,_,_,-1
w01150048,"Le Traité de Londres, signé le 30 mai 1913, a divisé une importante partie du territoire ",revendiquée," par l'Albanie, sans considérer sa composition ethnique, entre les alliés des Balkans, réduisant le territoire de l'Albanie à ses régions centrales. ",20,revendiquée,revendiquer,VERB,VBN,Gender=Fem|Number=Sing|Tense=Past|VerbForm=Part,16,acl,_,_,1
w01150048,"Le Traité de Londres, ",signé," le 30 mai 1913, a divisé une importante partie du territoire revendiquée par l'Albanie, sans considérer sa composition ethnique, entre les alliés des Balkans, réduisant le territoire de l'Albanie à ses régions centrales. ",6,signé,signer,VERB,VBN,Gender=Masc|Number=Sing|Tense=Past|VerbForm=Part,2,acl,_,_,1
n02002007,Les officiers ont ,réussi,", dimanche matin, à maîtriser l’homme de 53 ans au cours de l’incident. ",4,réussi,réussir,VERB,VBN,Gender=Masc|Number=Sing|Tense=Past|VerbForm=Part,0,root,_,SpaceAfter=No,1
n02006006,"Le pétrole brut, l’or et le blé sont tous des ressources naturelles, dans lesquelles des milliards ont été ",investis, dans le monde entier. ,22,investis,investir,VERB,VBN,Gender=Masc|Number=Plur|Tense=Past|VerbForm=Part,13,acl:relcl,_,_,1
n02007010,"Avec soixante et un buts en cent trente-sept matches, il a dépassé le record de buts ",inscrits, pour la fédération allemande de Football. ,18,inscrits,inscrire,VERB,VBN,Gender=Masc|Number=Plur|Tense=Past|VerbForm=Part,17,acl,_,_,1
n02011003,"Avec l’aide des données de cartes de débit, la police à Essen enquête sur quatre personnes qui auraient assisté, sans ",réagir,", à la mort d’un retraité dans une banque. ",25,réagir,réagir,VERB,VB,VerbForm=Inf,22,advcl,_,SpaceAfter=No,1
n02011003,"Avec l’aide des données de cartes de débit, la police à Essen enquête sur quatre personnes qui auraient ",assisté,", sans réagir, à la mort d’un retraité dans une banque. ",22,assisté,assister,VERB,VBN,Gender=Masc|Number=Sing|Tense=Past|VerbForm=Part,19,acl:relcl,_,SpaceAfter=No,1
n02011003,"Avec l’aide des données de cartes de débit, la police à Essen ",enquête," sur quatre personnes qui auraient assisté, sans réagir, à la mort d’un retraité dans une banque. ",16,enquête,enquêter,VERB,VBC,Mood=Ind|Number=Sing|Person=3|Tense=Pres|VerbForm=Fin,0,root,_,_,1
n02011018,Le porte-parole n’a pas écarté la possibilité que d’autres personnes ,pourraient, faire l'objet d'une enquête. ,13,pourraient,pouvoir,VERB,VBC,Mood=Cnd|Number=Plur|Person=3|Tense=Pres|VerbForm=Fin,8,acl,_,_,1
n02016006,"Maintenant que la série 1 n’est plus la plus ancienne, beaucoup d’utilisateurs peuvent ",bénéficier, d’une réduction de 100 euros. ,17,bénéficier,bénéficier,VERB,VB,VerbForm=Inf,16,xcomp,_,_,1
n02016006,"Maintenant que la série 1 n’est plus la plus ancienne, beaucoup d’utilisateurs ",peuvent, bénéficier d’une réduction de 100 euros. ,16,peuvent,pouvoir,VERB,VBC,Mood=Ind|Number=Plur|Person=3|Tense=Pres|VerbForm=Fin,0,root,_,_,1
n02017008,"La photo illustre bien l’étroit écran tactile au-dessus du clavier, ",anticipé, à cause de rumeurs. ,14,anticipé,anticiper,VERB,VBN,Gender=Masc|Number=Sing|Tense=Past|VerbForm=Part,7,acl,_,_,1
n02022015,On ne sait pas comment les deux dramaturges auraient ,travaillé, ensemble. ,10,travaillé,travailler,VERB,VBN,Gender=Masc|Number=Sing|Tense=Past|VerbForm=Part,3,ccomp,_,_,1
n02022015,On ne ,sait, pas comment les deux dramaturges auraient travaillé ensemble. ,3,sait,savoir,VERB,VBC,Mood=Ind|Number=Sing|Person=3|Tense=Pres|VerbForm=Fin,0,root,_,_,-1
n02024008,Une étude suédoise a ,démontré," que les animaux ne font halte que rarement, si jamais, après la période de reproduction qui dure 2 mois. ",5,démontré,démontrer,VERB,VBN,Gender=Masc|Number=Sing|Tense=Past|VerbForm=Part,0,root,_,_,1
n02027007,"Selon Parker, un grand nombre d’agents des services secrets russes ",travaillent, en ce moment en Grande-Bretagne. ,14,travaillent,travailler,VERB,VBC,Mood=Ind|Number=Plur|Person=3|Tense=Pres|VerbForm=Fin,0,root,_,_,1
n02027021,"La loi délimite quelques conditions, dont leur réalisation pourrait remettre en vigueur l’accord : les États-Unis devraient retirer leurs troupes des pays qui ont adhéré à l’Otan depuis l’année 2000, annuler les sanctions contre la Russie et rembourser les coûts ",engagés, en raison de ces sanctions. ,47,engagés,engager,VERB,VBN,Gender=Masc|Number=Plur|Tense=Past|VerbForm=Part,46,acl,_,_,1
