Unnamed: 0,sent_id,left_context,pivot,right_context,ID,FORM,LEMMA,UPOS,XPOS,FEATS,HEAD,DEPREL,DEPS,MISC,dist
1280,4735,Et choisir les éléments à ,analyser, (le type de fichiers) ;,6.0,analyser,analyser,VERB,VERB,VerbForm=Inf,4.0,acl,4:acl,_,2.0
4413,16478,"Je me suis souvent étonné d'avoir vécu sereinement ce drame mais je ne me suis pas interrogé, ",analysé, sur mes réactions.,20.0,analysé,analyser,VERB,VERB,Gender=Masc|Number=Sing|Tense=Past|VerbForm=Part,18.0,advcl,18:advcl,_,1.0
9523,35408,"L'architecte éditicien doit savoir écouter, ",analyser, et proposer des solutions adéquates aux attentes du client.,8.0,analyser,analyser,VERB,VERB,VerbForm=Inf,6.0,conj,6:conj,_,1.0
13676,51060,"Pour créer une telle base de données, les chercheurs ont utilisé et ",analysé, les textes de pas moins de 1.200.000 sites web.,14.0,analysé,analyser,VERB,VERB,Gender=Masc|Number=Sing|Tense=Past|VerbForm=Part,12.0,conj,12:conj,_,2.0
21165,79335,Des prélèvements trimestriels des produits de la ruche seront effectués et ,analysés," trois fois pas an, sauf en hiver lorsque les abeilles sont au repos.",12.0,analysés,analyser,VERB,VERB,Gender=Masc|Number=Plur|Tense=Past|VerbForm=Part,10.0,conj,10:conj,_,1.0
36867,138723,"Au départ, son objectif était d'",analyser," et repenser la politique de développement de la France surtout vis-à-vis de ses """"ex-colonies"""" en Afrique.",8.0,analyser,analyser,VERB,VERB,VerbForm=Inf,6.0,xcomp,6:xcomp,_,1.0
37761,142068,"Le temps de la formation et de la préparation : hors temps scolaire, l'atelier propose des sessions de formation où sont présentés et ",analysés, les documents exploités durant chaque période d'expérimentation.,26.0,analysés,analyser,VERB,VERB,Gender=Masc|Number=Plur|Tense=Past|VerbForm=Part,24.0,conj,24:conj,_,1.0
38123,143333,Elle est balayée à proximité immédiate de l'échantillon à ,analyser,", à une distance bien inférieure à la longueur d'onde d'observation ce qui correspond au champ proche optique.",11.0,analyser,analyser,VERB,VERB,VerbForm=Inf,5.0,acl,5:acl,SpaceAfter=No,3.0
49187,185452,"L'une des raisons pour lesquelles nous avons baissé en parts de marché au cours des deux dernières années en Europe, c'est parce que nous n'avions pas assez de produits neufs"""", a ",analysé, Carlos Ghosn.,39.0,analysé,analyser,VERB,VERB,Gender=Masc|Number=Sing|Tense=Past|VerbForm=Part,30.0,parataxis,30:parataxis,_,2.0
59425,223690,"Je voudrais bien revoir l'action au ralenti mais la Japonaise est embarquée"""", a ",analysé, Brunet.,17.0,analysé,analyser,VERB,VERB,Gender=Masc|Number=Sing|Tense=Past|VerbForm=Part,2.0,parataxis,2:parataxis,_,1.0
72104,271972,"Cette intégration passe également par la prise en compte des risques professionnels dès la formation initiale, afin de donner aux futurs salariés la capacité à appréhender, ",analyser, et prévenir les risques d'une situation de travail.,29.0,analyser,analyser,VERB,VERB,VerbForm=Inf,27.0,conj,27:conj,_,1.0
74156,279441,"En revanche ces derniers arrivent le mieux à mettre en avant leur puissance"""", a ",analysé, le demi de mêlée Jean-Baptiste Elissalde.,17.0,analysé,analyser,VERB,VERB,Gender=Masc|Number=Sing|Tense=Past|VerbForm=Part,5.0,parataxis,5:parataxis,_,1.0
76978,289762,Il passa une journée entière a étudier et ,analyser, l'énorme machine.,9.0,analyser,analyser,VERB,VERB,VerbForm=Inf,7.0,conj,7:conj,_,1.0
86687,326162,Lorsque la puce est plongée dans une solution contenant un brin d'ADN à ,analyser,", celui-ci va alors s'apparier à la séquence d'ADN de la puce qui lui est complémentaire, et activer une des électrodes : le brin complémentaire est alors repéré.",15.0,analyser,analyser,VERB,VERB,VerbForm=Inf,11.0,acl,11:acl,SpaceAfter=No,2.0
91160,343522,Votre CCI se propose de détecter et d',analyser,", à titre gracieux, les projets de votre PMI susceptibles de répondre aux conditions d'intégration dans un programme technologique.",9.0,analyser,analyser,VERB,VERB,VerbForm=Inf,6.0,conj,6:conj,SpaceAfter=No,1.0
95087,358903,"Il semblait évident que l'OOYAGA (astre du carré) enregistré par notre """"UMMO"""" était précisément celui que nous étions en train d'",analyser, (je m'explique au pluriel en me référant à mes frères car MOI j'étais sur UMMO).,27.0,analyser,analyser,VERB,VERB,VerbForm=Inf,25.0,acl,25:acl,_,2.0
95477,360418,C'est un match difficile à ,analyser,", si ce n'est de dire que je suis un peu passée à travers.",7.0,analyser,analyser,VERB,VERB,VerbForm=Inf,5.0,xcomp,5:xcomp,SpaceAfter=No,1.0
96902,365534,"Toutes les informations, concernant notamment le génome humain, sont regroupées dans ces banques, et la bioinformatique est nécessaire pour pouvoir utiliser et ",analyser, ces données.,26.0,analyser,analyser,VERB,VERB,VerbForm=Inf,24.0,conj,24:conj,_,1.0
97414,367403,"Ce pourcentage, qui a atteint """"près de 5% vers 2003"""", se serait """"un peu stabilisé"""" aujourd'hui, """"probablement parce qu'on a fait plus attention à l'administration des antibiotiques"""", a ",analysé, Didier Houssin pour qui il ne s'agit pas d'une épidémie.,42.0,analysé,analyser,VERB,VERB,Gender=Masc|Number=Sing|Tense=Past|VerbForm=Part,2.0,parataxis,2:parataxis,_,1.0
102327,386113,Ainsi la détermination de la fluorescence de chaque point permet-elle de mesurer les quantités relatives des produits de chaque gène exprimés dans les tissus ,analysés, et représentés sur la puce.,26.0,analysés,analyser,VERB,VERB,Gender=Masc|Number=Plur|Tense=Past|VerbForm=Part,25.0,acl,25:acl,_,1.0
102363,386319,La collection NTIC rassemble des essais et documents commentant et ,analysant, les évolutions et révolutions engendrées par le développement tentaculaire des nouvelles technologies.,11.0,analysant,analyser,VERB,VERB,Tense=Pres|VerbForm=Part,9.0,conj,9:conj,_,1.0
107539,405942,Pour amener les enfants à ,analyser," avant de reproduire, il sera nécessaire de justifier cette étape en proposant des activités où elle sera le gage d'une meilleure réussite, d'un gain de temps et de précision notamment dans les tracés.",6.0,analyser,analyser,VERB,VERB,VerbForm=Inf,2.0,xcomp,2:xcomp,_,1.0
110385,416460,Une étude vaudrait la peine d'être faite : comparer et ,analyser, la résistance au fuel vapour-lock du 3.235 cm³ FIAT par rapport au 2.492 cm³ Alfa-Romeo et par rapport au 2.400 cm³ Dino.,12.0,analyser,analyser,VERB,VERB,VerbForm=Inf,10.0,conj,10:conj,_,1.0
113250,427447,Un interprète ou interpréteur [↓] est un outil informatique ayant pour tâche d',analyser,", de traduire et d'exécuter un programme écrit dans un langage informatique.",16.0,analyser,analyser,VERB,VERB,VerbForm=Inf,14.0,acl,14:acl,SpaceAfter=No,1.0
115761,437005,"Dix années de fouilles et près de 4 500 plongées ont été nécessaires pour étudier, ",analyser," et reconstituer les structures de l'épave de Villefranche-sur-Mer identifiée comme la Lomellina, une """"nave"""" gênoise.",17.0,analyser,analyser,VERB,VERB,VerbForm=Inf,15.0,conj,15:conj,_,1.0
120417,455109,"Cet article a une dimension politique car il sert à intimider"""", a ",analysé, le secrétaire général Gregor Rutz.,15.0,analysé,analyser,VERB,VERB,Gender=Masc|Number=Sing|Tense=Past|VerbForm=Part,3.0,parataxis,3:parataxis,_,1.0
123906,468258,Les conférences régionales de santé ont pour rôle d',analyser,", de définir les priorités de santé publique et de formuler des propositions pour une politique de santé centrée sur les besoins de la population de chaque région.",10.0,analyser,analyser,VERB,VERB,VerbForm=Inf,6.0,xcomp,6:xcomp,SpaceAfter=No,1.0
126014,475930,Cette théorie de l'optimum économique inspire également la sphère financière ; nous étudierons la question en ,analysant," successivement : - les déterminants des comportements de marché,",18.0,analysant,analyser,VERB,VERB,Tense=Pres|VerbForm=Part,14.0,advcl,14:advcl,_,1.0
127466,481313,"Des études ont montré, si nous ",analysions,", que la compétence individuelle n'intervenait qu'en 6ème position comme facteur de performance globale de l'entreprise.",8.0,analysions,analyser,VERB,VERB,Mood=Ind|Number=Plur|Person=1|Tense=Imp|VerbForm=Fin,4.0,advcl,4:advcl,SpaceAfter=No,1.0
129766,489806,Elle permet une démarche très construite afin d',analyser, et de faire face aux situations difficiles.,9.0,analyser,analyser,VERB,VERB,VerbForm=Inf,7.0,obl:arg,7:obl:arg,_,2.0
131517,496517,"Au Gothard, la diminution du trafic sur cet axe, traditionnelle source de bouchons, est liée notamment au fait que le week-end pascal tombait spécialement tôt cette année, a ",analysé, le porte-parole de l'Office fédéral des routes.,35.0,analysé,analyser,VERB,VERB,Gender=Masc|Number=Sing|Tense=Past|VerbForm=Part,18.0,parataxis,18:parataxis,_,1.0
132154,498984,"On a manqué de confiance et de sérénité"""", a ",analysé," l'ex-stéphanois, estimant que cette difficulté était la conséquence """"de quelques matches charnières qui ont tourné en (leur) défaveur"""" à cause de détails.",13.0,analysé,analyser,VERB,VERB,Gender=Masc|Number=Sing|Tense=Past|VerbForm=Part,4.0,parataxis,4:parataxis,_,1.0
133276,503367,Les résultats de ces essais seront consignés et ,analysés, dans l'étude des dangers en vue de déterminer notamment les zones susceptibles d'être affectées en cas d'accident.,9.0,analysés,analyser,VERB,VERB,Gender=Masc|Number=Plur|Tense=Past|VerbForm=Part,7.0,conj,7:conj,_,1.0
141018,532225,"Ces unités peuvent aller du groupe de mots au document, en passant par la phrase et cette définition de l'unité de base à ",analyser, peut tout à fait être le critère de choix de tel ou tel outil.,26.0,analyser,analyser,VERB,VERB,VerbForm=Inf,19.0,acl,19:acl,_,1.0
143537,541881,"Je vois cette hésitation comme une exigence démocratique"""", a ",analysé, Ségolène Royal.,12.0,analysé,analyser,VERB,VERB,Gender=Masc|Number=Sing|Tense=Past|VerbForm=Part,2.0,parataxis,2:parataxis,_,2.0
148720,561245,"On va voir que, comme souvent en pareil cas, le premier des deux clichés ",analysés," maintenant est largement erroné, même s'il conserve partiellement et surtout régionalement (le sud du pays) quelques éléments de pertinence.",17.0,analysés,analyser,VERB,VERB,Gender=Masc|Number=Plur|Tense=Past|VerbForm=Part,16.0,acl,16:acl,_,1.0
151554,571892,"Ce cours présentera notamment les méthodes dominantes utilisées par les praticiens de marché (économistes de marché, gestionnaires...) pour ",analyser," et anticiper les évolutions macro-économiques, ainsi que les inflexions de politique monétaire.",23.0,analyser,analyser,VERB,VERB,VerbForm=Inf,6.0,advcl,6:advcl,_,1.0
161963,610740,Le Département Génie Electrique forme des ingénieurs capables d',analyser,", de concevoir et de mettre en oeuvre des systèmes complexes de commande, de contrôle et de régulation des processus industriels.",10.0,analyser,analyser,VERB,VERB,VerbForm=Inf,8.0,xcomp,8:xcomp,SpaceAfter=No,2.0
166478,627744,C'est en quelque sorte l'inconfort de la critique que l'on a voulu ,analyser," en retraçant l'histoire du couple parfois dysharmonieux ou polémique qu'elle forme avec la """" littérature """".",16.0,analyser,analyser,VERB,VERB,VerbForm=Inf,15.0,xcomp,15:xcomp,_,3.0
169128,637867,"NCES, principale agence US chargée de collecter, d'",analyser, et de publier des informations sur l'Éducation aux Etats-Unis (ainsi que sur d'autres pays),11.0,analyser,analyser,VERB,VERB,VerbForm=Inf,8.0,conj,8:conj,_,1.0
169608,639678,Les résultats montrent ici également un effet des antidépresseurs supérieur à celui du placebo avec un pourcentage de répondeurs assez rarement ,analysés," mais qui, lorsque l'on en dispose, tourne également autour de 65 à 70%.",22.0,analysés,analyser,VERB,VERB,Gender=Masc|Number=Plur|Tense=Past|VerbForm=Part,19.0,acl,19:acl,_,1.0
169917,640828,Autant d'enseignements que le sélectionneur va maintenant pouvoir longuement ,analyser, puisqu'il ne reverra plus beaucoup ses troupes d'ici la fin mai.,11.0,analyser,analyser,VERB,VERB,VerbForm=Inf,9.0,xcomp,9:xcomp,_,2.0
177998,671390,Ces résultats nous semblent devoir être vérifiés et ,analysés, plus précisément dans la mesure où les remontées reçues directement des sections sont notablement plus élevées.,9.0,analysés,analyser,VERB,VERB,Gender=Masc|Number=Plur|Tense=Past|VerbForm=Part,7.0,conj,7:conj,_,1.0
178334,672678,"Maîtriser le vocabulaire de la comptabilité, ",analyser," et établir les documents de synthèse, calculer les coûts, recourir à l'informatique de gestion seront vos objectifs à atteindre.",8.0,analyser,analyser,VERB,VERB,VerbForm=Inf,1.0,conj,1:conj,_,2.0
183594,692804,"L'administrateur réseau peut surveiller, ",analyser, et allouer de la bande passante pour supporter le trafic réseau:,7.0,analyser,analyser,VERB,VERB,VerbForm=Inf,5.0,conj,5:conj,_,1.0
187075,705661,"La nouvelle version comprend également un nouveau diagramme de PERT (Program Evaluation Review Technique) pour JViews Gantt, qui exploite JViews Diagrammer pour afficher et ",analyser, les tâches associées à un projet.,28.0,analyser,analyser,VERB,VERB,VerbForm=Inf,26.0,conj,26:conj,_,1.0
191434,722169,"«Soit que la pulsion devenait trop forte ou que l'agresseur a, inconsciemment, cherché à se faire arrêter, pour être certain de ne plus recommencer», a ",analysé, le psychiatre.,33.0,analysé,analyser,VERB,VERB,Gender=Masc|Number=Sing|Tense=Past|VerbForm=Part,6.0,parataxis,6:parataxis,_,1.0
207257,781764,L'information à ,analyser, est saisie en une seule fois sur toute la matrice.,4.0,analyser,analyser,VERB,VERB,VerbForm=Inf,2.0,acl,2:acl,_,1.0
209128,788731,"De nombreux vestiges ont été récupérés, ",analysés,", inventoriés; un rapport a été dressé.",8.0,analysés,analyser,VERB,VERB,Gender=Masc|Number=Plur|Tense=Past|VerbForm=Part,6.0,conj,6:conj,SpaceAfter=No,2.0
212968,803225,D'une part recenser et ,analyser," les pratiques des uns et des autres, en les mettant en regard avec le programme et le document d'accompagnement officiels.",6.0,analyser,analyser,VERB,VERB,VerbForm=Inf,4.0,conj,4:conj,_,2.0
217183,819115,"Le comportement du marché dans les prochains jours va donner des indications sur le fait de savoir si la Bourse a entamé un recul à court terme pour évacuer certains de ses excès"""", a ",analysé, M. Goldman.,37.0,analysé,analyser,VERB,VERB,Gender=Masc|Number=Sing|Tense=Past|VerbForm=Part,9.0,parataxis,9:parataxis,_,1.0
219276,826819,"En effet, en ",analysant," ce que Muhammad () a pu dire en telle ou telle circonstance, ou comment il a agi, ou encore ce qu'il a approuvé, nous sommes à même de mieux comprendre le sens et la portée des injonctions divines.",5.0,analysant,analyser,VERB,VERB,Tense=Pres|VerbForm=Part,6.0,dep,6:dep,_,1.0
219919,829302,Dans cet article sont décrits et ,analysés," de nouveaux algorithmes de détection et diagnostic de telles pannes, basés sur les méthodes récentes d'identification par sous-espaces et sur l'approche statistique locale.",7.0,analysés,analyser,VERB,VERB,Gender=Masc|Number=Plur|Tense=Past|VerbForm=Part,5.0,conj,5:conj,_,2.0
224798,847941,Le SYTRAL doit assurer la gestion du réseau notamment en s'assurant que son délégataire respecte les conditions du contrat mais aussi en évaluant et ,analysant, pour mettre en évidence des pistes d'amélioration éventuelles.,26.0,analysant,analyser,VERB,VERB,Tense=Pres|VerbForm=Part,24.0,conj,24:conj,_,2.0
228300,861136,Linkbot Personal permet aux développeurs de sites Internet d',analyser, et d'optimiser leur site avant de le mettre en ligne.,10.0,analyser,analyser,VERB,VERB,VerbForm=Inf,3.0,xcomp,3:xcomp,_,1.0
228349,861359,"Elle se présente sous la forme de questionnaires à choix multiples, fiches techniques, tableaux, grilles, diagrammes, schémas ou croquis à ",analyser,", à remplir ou à compléter, ou tout autre mode d'interrogation du même type.",26.0,analyser,analyser,VERB,VERB,VerbForm=Inf,8.0,acl,8:acl,SpaceAfter=No,1.0
249139,938813,L'utilisation des logiciels suivants permet de produire et d',analyser, des séquences nucléiques et protéiques et permettent d'étudier les effets de mutations ponctuelles.,11.0,analyser,analyser,VERB,VERB,VerbForm=Inf,8.0,conj,8:conj,_,1.0
