Unnamed: 0,sent_id,left_context,pivot,right_context,ID,FORM,LEMMA,UPOS,XPOS,FEATS,HEAD,DEPREL,DEPS,MISC,dist
5003,18648,"Pour eux, du moins la majorité, ce que certains s'obstinent à ",appeler," les """" querelles communautaires """" sont des inventions de cénacles qui en ont fait leur fonds de commerce.",15.0,appeler,appeler,VERB,VERB,VerbForm=Inf,13.0,xcomp,13:xcomp,_,1.0
14478,54100,"Un mois plus tard, le manager de KFC ",appelle," de nouveau et surenchérit : """"Écoutez excellence, j'ai besoin de votre aide.",10.0,appelle,appeler,VERB,VERB,Mood=Ind|Number=Sing|Person=3|Tense=Pres|VerbForm=Fin,0.0,root,0:root,_,1.0
20358,76319,"Bientôt, en effet, allaient commencer entre la France et l'Angleterre ces hostilités que leur durée devait faire ",appeler, la guerre de Cent Ans.,21.0,appeler,appeler,VERB,VERB,VerbForm=Inf,19.0,xcomp,19:xcomp,_,1.0
38315,144248,"Le mont Baker, en anglais Mount Baker, également ",appelé," La montana del Carmelo, Koma Kulshan, Kulshan, Puk'h'kowitz, Quick-Sman-Ik ou encore Tukullum[1], est un sommet de la chaîne des Cascades situé au nord-ouest des États-Unis.",11.0,appelé,appeler,VERB,VERB,Gender=Masc|Number=Sing|Tense=Past|VerbForm=Part,7.0,acl,7:acl,_,1.0
43236,162991,"Pas de sens, donc, seulement une mélodie, sans doute ",appelée,", ici ou là, par tel ou tel mot d'un chapitre, telle ou telle situation.",13.0,appelée,appeler,VERB,VERB,Gender=Fem|Number=Sing|Tense=Past|VerbForm=Part,9.0,acl,9:acl,SpaceAfter=No,1.0
45229,170712,"La séance d'entraînement matinale s'est en revanche déroulée sans la présence du """"psychologue"""" Tiburce Darou, ",appelé," auprès du Racing, dernier de la L1, pour une dizaine de jours.",21.0,appelé,appeler,VERB,VERB,Gender=Masc|Number=Sing|Tense=Past|VerbForm=Part,16.0,acl,16:acl,_,1.0
49200,185511,Vous avez la possibilité d'appeler ou d'être appelé dans votre chambre. d',appeler, : - directement en composant le 0. Les communications étant comptabilisées au niveau du standard),6.0,appeler,appeler,VERB,VERB,VerbForm=Inf,4.0,acl,4:acl,_,1.0
49201,185511,Vous avez la possibilité d',appeler, ou d'être appelé dans votre chambre. d'appeler : - directement en composant le 0. Les communications étant comptabilisées au niveau du standard),6.0,appeler,appeler,VERB,VERB,VerbForm=Inf,4.0,acl,4:acl,_,1.0
63330,238954,"Vous n'avez pas tenu compte du titre (en Italie toute personne ayant un diplôme universitaire est un """"dottore"""" et il faut ",appeler, ainsi même sans connaître son nom de famille.),26.0,appeler,appeler,VERB,VERB,VerbForm=Inf,25.0,xcomp,25:xcomp,_,2.0
67318,254117,"De part leur côté scandaleux et irrationnel, ils sont souvent mis à part et considérés comme une dérive honteuse du mouvement, à dissocier notamment du jansénisme parlementaire et ",appelant, du XVIIe siècle.,31.0,appelant,appeler,VERB,VERB,Tense=Pres|VerbForm=Part,29.0,conj,29:conj,_,1.0
68127,257164,"Elle porte le nom de la rue qui l'abrite, dans le IXe arrondissement de la capitale, ",appelée," ainsi pour célébrer la campagne d'Italie de Bonaparte, qui y logea.",20.0,appelée,appeler,VERB,VERB,Gender=Fem|Number=Sing|Tense=Past|VerbForm=Part,7.0,acl,7:acl,_,1.0
69275,261524,"Actuellement, ce sont les jeunes ",appelés, qui le paient.,7.0,appelés,appeler,VERB,VERB,Gender=Masc|Number=Plur|Tense=Past|VerbForm=Part,0.0,root,0:root,_,1.0
97379,367305,"Le premier argument est le type d'interruption, le deuxième est la fonction à ",appeler, quand l'interruption arrive (``handler'').,16.0,appeler,appeler,VERB,VERB,VerbForm=Inf,14.0,acl,14:acl,_,2.0
111177,419550,Un interlocuteur anonyme a ,appelé," pour prévenir qu'un engin explosif avait été placé à la gare de Vile Parle, un quartier de Bombay, a précisé Arup Patnaik, vice-préfet de police, sur la chaîne de télévision CNN-IBN.",5.0,appelé,appeler,VERB,VERB,Gender=Masc|Number=Sing|Tense=Past|VerbForm=Part,0.0,root,0:root,_,1.0
113490,428288,Les syndicats montent dun cran et la gauche ,appelle," elle aussi au retrait, mais sans y tirer grand profit.",9.0,appelle,appeler,VERB,VERB,Mood=Ind|Number=Sing|Person=3|Tense=Pres|VerbForm=Fin,3.0,conj,3:conj,_,1.0
144035,543703,"Par conséquent, c'est cet avis favorable que vous ",appelez," aujourd'hui, Monsieur le Maire, à suivre.",11.0,appelez,appeler,VERB,VERB,Mood=Ind|Number=Plur|Person=2|Tense=Pres|VerbForm=Fin,7.0,acl:relcl,7:acl:relcl,_,1.0
145838,550300,La police n'a pas précisé qui avait ,appelé, mais a confirmé que la raison de l'appel était bien le signalement d'une tentative de suicide.,9.0,appelé,appeler,VERB,VERB,Gender=Masc|Number=Sing|Tense=Past|VerbForm=Part,6.0,xcomp,6:xcomp,_,1.0
148420,560129,Les personnes qui ,appelaient, tombaient sur un service téléphonique s'adressant aux femmes en quête d'aventures.,4.0,appelaient,appeler,VERB,VERB,Mood=Ind|Number=Plur|Person=3|Tense=Imp|VerbForm=Fin,2.0,acl:relcl,2:acl:relcl,_,1.0
149247,563244,L'ambiance festive a dominé dans les cinq manifestations auxquelles avaient notamment ,appelé," les associations anti-nucléaires, les Verts et la LCR.",13.0,appelé,appeler,VERB,VERB,Gender=Masc|Number=Sing|Tense=Past|VerbForm=Part,9.0,acl:relcl,9:acl:relcl,_,1.0
155167,585253,Il a précisé que cette idée était défendue par VMware depuis longtemps et qu’il a ,appelé, 'Just Enough Operating System' (se dit d’un système d’exploitation dépourvu de logiciels et de drivers).,17.0,appelé,appeler,VERB,VERB,Gender=Masc|Number=Sing|Tense=Past|VerbForm=Part,8.0,advcl,8:advcl,_,2.0
162356,612224,"Auparavant, un """"souffleur"""", également ",appelé," """"boute-en-train"""", viendra évaluer ses dispositions à la gaudriole, avant de céder sa place à l'étalon vedette.",9.0,appelé,appeler,VERB,VERB,Gender=Masc|Number=Sing|Tense=Past|VerbForm=Part,5.0,acl,5:acl,_,2.0
163146,615289,"Malgré le prix prohibitif, supérieur à 1 000 000 F (152 400), les Leichtbau (aussi ",appelées, Turbo S) sont pourtant parties comme des petits pains...,21.0,appelées,appeler,VERB,VERB,Gender=Fem|Number=Plur|Tense=Past|VerbForm=Part,18.0,acl,18:acl,_,1.0
165806,625184,"Finalement, une communauté locale ",appelle,", envoie, reçoit, soutient des laïcs qui reçoivent une charge ecclésiale.",6.0,appelle,appeler,VERB,VERB,Mood=Ind|Number=Sing|Person=3|Tense=Pres|VerbForm=Fin,0.0,root,0:root,SpaceAfter=No,2.0
201333,759803,"Entre les sélectionnés avec le XV de France pour la tournée estivale, et les ",appelés," pour intégrer l'équipe des Barbarians Français, la saison n'est pas encore terminée pour les Parisiens.",16.0,appelés,appeler,VERB,VERB,Gender=Masc|Number=Plur|Tense=Past|VerbForm=Part,3.0,conj,3:conj,_,1.0
214105,807403,"Il a également indiqué que Frédéric Thiriez, président de la LFP, avait pris contact avec les dirigeants de l'ASNL pour s'enquérir de la santé du Brésilien. « C'est bien que M. Thiriez nous ait ",appelé, pour nous témoigner son attention.,41.0,appelé,appeler,VERB,VERB,Gender=Masc|Number=Sing|Tense=Past|VerbForm=Part,35.0,dep,35:dep,_,1.0
215103,811127,L'attaque tua 53 ,appelés, et en blessa 53 selon les sources russes officielles.,5.0,appelés,appeler,VERB,VERB,Gender=Masc|Number=Plur|Tense=Past|VerbForm=Part,3.0,obj,3:obj,_,1.0
217646,820892,"Bien que n'étant pas membres de l'Union européenne, la Norvège et la Bulgarie ont suivi le mouvement, le gouvernement ayant ",appelé," """"tous ceux qui en ont la possibilité à se joindre à cet hommage"""".",25.0,appelé,appeler,VERB,VERB,Gender=Masc|Number=Sing|Tense=Past|VerbForm=Part,18.0,advcl,18:advcl,_,3.0
220004,829650,Le nom de l'appelant interrompra donc la navigation pour afficher qui ,appelle," tandis qu'il sera possible, une fois un mobile Bluetooth lié avec le GPS autonome, d'effectuer des appels téléphoniques.",13.0,appelle,appeler,VERB,VERB,Mood=Ind|Number=Sing|Person=3|Tense=Pres|VerbForm=Fin,11.0,ccomp,11:ccomp,_,1.0
233735,881242,Les fonctions ,appelées, lors du traçage d'une variable sont définies de la façon suivante:,3.0,appelées,appeler,VERB,VERB,Gender=Fem|Number=Plur|Tense=Past|VerbForm=Part,2.0,acl,2:acl,_,1.0
245437,924929,"Pourtant selon l'article 7 de la déclaration, « tout citoyen ",appelé, ou saisi en vertu de la loi doit obéir à l'instant : il se rend coupable par la résistance ».,13.0,appelé,appeler,VERB,VERB,Gender=Masc|Number=Sing|Tense=Past|VerbForm=Part,12.0,acl,12:acl,_,3.0
261489,985638,"Cependant, ni les uns ni les autres ne font attention à ce qu'ils présument et posent en principe, c'est-à-dire cette science faussement ",appelée,", qui est leur point de départ, et qui les conduit nécessairement à de fausses conclusions.",31.0,appelée,appeler,VERB,VERB,Gender=Fem|Number=Sing|Tense=Past|VerbForm=Part,29.0,acl,29:acl,SpaceAfter=No,1.0
