Unnamed: 0,sent_id,left_context,pivot,right_context,ID,FORM,LEMMA,UPOS,XPOS,FEATS,HEAD,DEPREL,DEPS,MISC,dist
6000,22146,"En conséquence, nous devons nous ",attacher,", d'une part à répertorier les compétences des conseillers, d'autre part à veiller à l'accueil et à l'intégration de nouveaux arrivants dans les domaines les plus en pointe.",7.0,attacher,attacher,VERB,VERB,VerbForm=Inf,5.0,xcomp,5:xcomp,SpaceAfter=No,1.0
7670,28681,"Ses thèmes de prédilection se focalisent rapidement autour du Japon, auquel il s'est intéressé dès sa prime jeunesse, et le bondage, avec des jeunes femmes (infirmières)(japonaises) ",attachées, (auquel et auxquelles il s'est intéressé plus tard).,33.0,attachées,attacher,VERB,VERB,Gender=Fem|Number=Plur|Tense=Past|VerbForm=Part,29.0,acl,29:acl,_,1.0
11109,41651,Je skiais avec une corde ,attachée, autour de la taille.,6.0,attachée,attacher,VERB,VERB,Gender=Fem|Number=Sing|Tense=Past|VerbForm=Part,5.0,acl,5:acl,_,1.0
18197,68178,Ayez le mal en horreur; ,attachez,"-vous fortement au bien. 12.10 Par amour fraternel, soyez pleins d'affection les uns pour les autres; par honneur, usez de prévenances réciproques. 12.11 Ayez du zèle, et non de la paresse.",7.0,attachez,attacher,VERB,VERB,Mood=Imp|Number=Plur|Person=2|Tense=Pres|VerbForm=Fin,0.0,root,0:root,SpaceAfter=No,1.0
37321,140424,Il ne croit pas qu’un équipage non ,attaché," comme celui de Philippe de Dieuleveult, ait pu se maintenir sur le radeau au moment du looping.",9.0,attaché,attacher,VERB,VERB,Gender=Masc|Number=Sing|Tense=Past|VerbForm=Part,7.0,acl,7:acl,_,1.0
76038,286359,Pâle et les cheveux à demi ,attachés,", elle semblait parler à la caméra.",7.0,attachés,attacher,VERB,VERB,Gender=Masc|Number=Plur|Tense=Past|VerbForm=Part,4.0,acl,4:acl,SpaceAfter=No,1.0
90938,342593,"Les pieds, encloués ou ",attachés,", reposaient sur une console en bois fixée sur le montant vertical (stipes).",6.0,attachés,attacher,VERB,VERB,Gender=Masc|Number=Plur|Tense=Past|VerbForm=Part,4.0,conj,4:conj,SpaceAfter=No,1.0
221973,837033,Queue : N'atteignant pas le jarret ; ,attachée, haut ; enroulée complètement (formant une boucle serrée) ; plaquée sur le dessus ou contre la cuisse ; en chandelle ; anourie.,9.0,attachée,attacher,VERB,VERB,Gender=Fem|Number=Sing|Tense=Past|VerbForm=Part,0.0,root,0:root,_,1.0
242781,915049,Si j'ai un mot à ,attacher," à 2008, c'est incertitude"""", explique Stephen Jen, économiste de Morgan Stanley dans une note publiée mercredi 2 janvier.",8.0,attacher,attacher,VERB,VERB,VerbForm=Inf,6.0,acl,6:acl,_,1.0
