Unnamed: 0,sent_id,left_context,pivot,right_context,ID,FORM,LEMMA,UPOS,XPOS,FEATS,HEAD,DEPREL,DEPS,MISC,dist
17658,66217,"Evoquant son séjour à Lourdes, """"un lieu emblématique"""", qui ",attire," et fascine tout croyant"""", il a indiqué s'être """"mis à son école"""".",14.0,attire,attirer,VERB,VERB,Mood=Ind|Number=Sing|Person=3|Tense=Pres|VerbForm=Fin,3.0,acl:relcl,3:acl:relcl,_,3.0
52542,198188,"De plus, cela survient alors que la tempête fait rage sur le marché des quotidiens à grand tirage, qui ont engagé des sommes faramineuses depuis deux ans pour tenter d'",attirer, et de maintenir l'attention des lecteurs.,33.0,attirer,attirer,VERB,VERB,VerbForm=Inf,31.0,xcomp,31:xcomp,_,1.0
130124,491251,"Evidemment incontournable, le plus haut sommet d'europe ",attire, et fascine toujours autant.,10.0,attire,attirer,VERB,VERB,Mood=Ind|Number=Sing|Person=3|Tense=Pres|VerbForm=Fin,0.0,root,0:root,_,3.0
133231,503257,"En détournant l'image, en l'affublant d'un commentaire trivialement éloigné de sa réalité, on n'",attire," que mieux l'attention sur sa vraie nature, son vrai message.",20.0,attire,attirer,VERB,VERB,Mood=Ind|Number=Sing|Person=3|Tense=Pres|VerbForm=Fin,0.0,root,0:root,_,1.0
140736,531165,"En conséquence, la profonde mutation culturelle des musées implique d'",attirer, et de fidéliser le public en prenant mieux en compte ses besoins et attentes.,12.0,attirer,attirer,VERB,VERB,VerbForm=Inf,10.0,xcomp,10:xcomp,_,1.0
153348,578378,L'amphithéâtre ,attirerait, même plus que du temps des Nordiques !,3.0,attirerait,attirer,VERB,VERB,Mood=Cnd|Number=Sing|Person=3|Tense=Pres|VerbForm=Fin,0.0,root,0:root,_,1.0
165313,623216,"Cependant, cet événement n’",attire," pas seulement des volontaires, mais aussi des entreprises qui acceptent de le parrainer, des célébrités et des hommes politiques, qui chaque année rendent l’événement encore plus important.",6.0,attire,attirer,VERB,VERB,Mood=Ind|Number=Sing|Person=3|Tense=Pres|VerbForm=Fin,0.0,root,0:root,_,3.0
199935,754581,Ce marché rentable ,attire, les gros Air France a investi dans Air Ivoire et les petits.,4.0,attire,attirer,VERB,VERB,Mood=Ind|Number=Sing|Person=3|Tense=Pres|VerbForm=Fin,0.0,root,0:root,_,1.0
201322,759765,"La population du Canada atlantique a stagné au cours des dernières années en raison des faibles taux de natalité, de l'émigration constante et de difficultés pour ",attirer, et garder des immigrants.,29.0,attirer,attirer,VERB,VERB,VerbForm=Inf,27.0,acl,27:acl,_,1.0
