Unnamed: 0,sent_id,left_context,pivot,right_context,ID,FORM,LEMMA,UPOS,XPOS,FEATS,HEAD,DEPREL,DEPS,MISC,dist
4885,18221,La politique nucléaire de l'Iran est constante et ne ,changera," pas"""", a-t-il indiqué à des médias iraniens présents à Rome.",11.0,changera,changer,VERB,VERB,Mood=Ind|Number=Sing|Person=3|Tense=Fut|VerbForm=Fin,8.0,conj,8:conj,_,1.0
6301,23356,"Ce qui me rend heureux, c'est quand la lumière ",change, car ce sont à chaque fois des photos nouvelles qui en découlent.,12.0,change,changer,VERB,VERB,Mood=Ind|Number=Sing|Person=3|Tense=Pres|VerbForm=Fin,8.0,ccomp,8:ccomp,_,1.0
6584,24605,"Dana Perino, porte-parole de la Maison blanche, a noté elle que """"rien n'avait ",changé, et que George Bush conservait l'espoir qu'un accord puisse être atteint avant son départ de la présidence.,18.0,changé,changer,VERB,VERB,Gender=Masc|Number=Sing|Tense=Past|VerbForm=Part,0.0,root,0:root,SpaceAfter=No,1.0
8748,32662,"Aujourd'hui, l'horizon a ",changé, : le PS se présente nettement comme «un parti réformiste» : «Il porte un projet de transformation sociale radicale.,6.0,changé,changer,VERB,VERB,Gender=Masc|Number=Sing|Tense=Past|VerbForm=Part,0.0,root,0:root,_,3.0
10816,40504,L'écoulement ,change," en passant d'une direction SO/NE, de Pré La Joux à Châtel, à ENE/ONO de Châtel vers Abondance.",3.0,change,changer,VERB,VERB,Mood=Ind|Number=Sing|Person=3|Tense=Pres|VerbForm=Fin,0.0,root,0:root,_,1.0
12717,47695,Le jeu a beaucoup ,changé,", il est devenu plus physique et la compétition plus féroce.",5.0,changé,changer,VERB,VERB,Gender=Masc|Number=Sing|Tense=Past|VerbForm=Part,0.0,root,0:root,SpaceAfter=No,1.0
13688,51118,"Aujourd'hui, la vie économique a bien ",changé,", et si la forêt représente encore une source de revenus pour la commune, les carrières de grès ne sont plus exploitées, mise à par une.",8.0,changé,changer,VERB,VERB,Gender=Masc|Number=Sing|Tense=Past|VerbForm=Part,31.0,advcl,31:advcl,SpaceAfter=No,3.0
14822,55324,"C'est ainsi que le drame, dont les motifs, deja noues en 1615, n'avaient pas ",change,", se traduisit dans les faits.",20.0,change,changer,VERB,VERB,Gender=Masc|Number=Sing|Tense=Past|VerbForm=Part,6.0,acl:relcl,6:acl:relcl,SpaceAfter=No,1.0
15003,55946,"Avec la dissuasion nucléaire, l'on crut que """"tout ",changeait," pour que rien ne changeât"""" ; or, cette révolution technologique modifiait en profondeur les données stratégiques réelles de la puissance des Etats qui en disposaient.",12.0,changeait,changer,VERB,VERB,Mood=Ind|Number=Sing|Person=3|Tense=Imp|VerbForm=Fin,8.0,ccomp,8:ccomp,_,1.0
15004,55946,"Avec la dissuasion nucléaire, l'on crut que """"tout changeait pour que rien ne ",changeât," ; or, cette révolution technologique modifiait en profondeur les données stratégiques réelles de la puissance des Etats qui en disposaient.",17.0,changeât,changer,VERB,VERB,Mood=Sub|Number=Sing|Person=3|Tense=Pres|VerbForm=Fin,12.0,advcl,12:advcl,SpaceAfter=No,1.0
16569,61853,Normal: si votre salaire augmente (pour suivre les prix) mais que vos mensualités ne ,changent," pas, vous faites une très bonne affaire.",18.0,changent,changer,VERB,VERB,Mood=Sub|Number=Plur|Person=3|Tense=Pres|VerbForm=Fin,6.0,conj,6:conj,_,1.0
17740,66522,Les choses sont sur le point de ,changer,", au grand plaisir des utilisateurs de XP et de Mac OS.",8.0,changer,changer,VERB,VERB,VerbForm=Inf,6.0,acl,6:acl,SpaceAfter=No,1.0
19607,73559,"Parallèlement, la composition des flux migratoires vers la Suède a considérablement ",changé,", la main-d'oeuvre européenne faisant place aux réfugiés non européens et aux migrants sous contrat.",13.0,changé,changer,VERB,VERB,Gender=Masc|Number=Sing|Tense=Past|VerbForm=Part,0.0,root,0:root,SpaceAfter=No,1.0
19777,74149,La ville à bien ,changé,", les dealers infestent les rues et les quartiers populaires se partagent entre les Ballas et les Vagos.",5.0,changé,changer,VERB,VERB,Gender=Masc|Number=Sing|Tense=Past|VerbForm=Part,0.0,root,0:root,SpaceAfter=No,1.0
26698,100091,L'utilisation des cartes routières ,change,", un nouveau besoin apparaît.",6.0,change,changer,VERB,VERB,Mood=Ind|Number=Sing|Person=3|Tense=Pres|VerbForm=Fin,0.0,root,0:root,SpaceAfter=No,1.0
31074,117070,Entre horaires qui ,changent," et respect du jeûne des musulmans, le partage est plutôt convivial et le ramadan resserre les liens entre les communautés.",4.0,changent,changer,VERB,VERB,Mood=Ind|Number=Plur|Person=3|Tense=Pres|VerbForm=Fin,2.0,acl:relcl,2:acl:relcl,_,1.0
31197,117550,"Peu à peu, le ton des romans d'anticipation d'Allemagne de l'Ouest ",change, et laisse la place à une certaine forme de désillusion historique et de méfiance à l'encontre de la technique.,16.0,change,changer,VERB,VERB,Mood=Ind|Number=Sing|Person=3|Tense=Pres|VerbForm=Fin,0.0,root,0:root,_,1.0
35162,132566,A suivre si les prévisions ne ,changent, pas et suivant lemplacement des pluies orageuses !,7.0,changent,changer,VERB,VERB,Mood=Ind|Number=Plur|Person=3|Tense=Pres|VerbForm=Fin,2.0,advcl,2:advcl,_,2.0
36506,137354,"Pour les scientifiques, le phénomène se produit en raison des éléments chimiques présents dans la fiole dont la viscosité ",change, lorsque le récipient est déplacé ou agité.,21.0,change,changer,VERB,VERB,Mood=Ind|Number=Sing|Person=3|Tense=Pres|VerbForm=Fin,12.0,acl:relcl,12:acl:relcl,_,1.0
41698,157327,Les échecs ,changent,", a déclaré le nouveau champion du monde.",3.0,changent,changer,VERB,VERB,Mood=Ind|Number=Plur|Person=3|Tense=Pres|VerbForm=Fin,0.0,root,0:root,SpaceAfter=No,1.0
43362,163441,Les relations franco-américaines sont appelées à ,changer," dès lors que la France aura choisi un successeur à Jacques Chirac, qui se posait en opposant à la domination américaine à travers le monde.",7.0,changer,changer,VERB,VERB,VerbForm=Inf,5.0,xcomp,5:xcomp,_,1.0
44000,165979,Les enseignants sont donc invités voire parfois assignés à ,changer, tout en offrant à leurs élèves des repères stables.,10.0,changer,changer,VERB,VERB,VerbForm=Inf,8.0,xcomp,8:xcomp,_,1.0
45042,170027,Il me semble que le pourcentage de jeunes cerveaux brillants et cultivés ne ,change, guère.,14.0,change,changer,VERB,VERB,Mood=Ind|Number=Sing|Person=3|Tense=Pres|VerbForm=Fin,3.0,ccomp,3:ccomp,_,1.0
46681,176142,"C'était amusant, il y avait toujours quelqu'un qui jouait avec lui, les paysages ",changent,", le klaxon...",18.0,changent,changer,VERB,VERB,Mood=Ind|Number=Plur|Person=3|Tense=Pres|VerbForm=Fin,7.0,advcl,7:advcl,SpaceAfter=No,1.0
47084,177607,La situation n'a pas ,changé,", nous devons battre les autres équipes du groupe.",6.0,changé,changer,VERB,VERB,Gender=Masc|Number=Sing|Tense=Past|VerbForm=Part,0.0,root,0:root,SpaceAfter=No,1.0
48023,181024,"Ce n'est plus comme avant, l'ambiance a beaucoup ",changé,", maintenant c'est du chacun pour soi"""", déplore un autre, employé sur le site depuis 30 ans.",12.0,changé,changer,VERB,VERB,Gender=Masc|Number=Sing|Tense=Past|VerbForm=Part,0.0,root,0:root,SpaceAfter=No,1.0
48239,181848,Les couleurs ,changent, et tout doucement les champs semblent perdre leurs teintes.,3.0,changent,changer,VERB,VERB,Mood=Ind|Number=Plur|Person=3|Tense=Pres|VerbForm=Fin,0.0,root,0:root,_,1.0
49464,186519,La musique ,change,", on entend à présent une musique country.",3.0,change,changer,VERB,VERB,Mood=Ind|Number=Sing|Person=3|Tense=Pres|VerbForm=Fin,0.0,root,0:root,SpaceAfter=No,1.0
50803,191710,"Le chef iranien pour les négociations sur le dossier nucléaire Ali Larijani, a été plus loin, en avertissant: """"ne jouez pas avec la fierté nationale des Iraniens, la situation ",changera," et vos intérêts dans la région seront en danger"""".",35.0,changera,changer,VERB,VERB,Mood=Ind|Number=Sing|Person=3|Tense=Fut|VerbForm=Fin,24.0,conj,24:conj,_,1.0
51218,193200,"Parallèlement, le climat ",change," et les réserves en pétrole qui s'amenuisent, pressent les pays à consacrer davantage de terres à la production de biomasse afin de remplacer les énergies fossiles émettrices de gaz à effet de serre.",5.0,change,changer,VERB,VERB,Mood=Ind|Number=Sing|Person=3|Tense=Pres|VerbForm=Fin,0.0,root,0:root,_,1.0
51861,195596,Comme vous pouvez le voir la navigation sur le site a ,changé,", si vous avez des difficultés ou si vous détectez un disfonctionnement, prévenez le webmestre.",12.0,changé,changer,VERB,VERB,Gender=Masc|Number=Sing|Tense=Past|VerbForm=Part,26.0,advcl,26:advcl,SpaceAfter=No,1.0
51866,195614,La caméra ne ,change, que rarement d'angle et se fixe sur les carnages réalisés devant nos yeux.,4.0,change,changer,VERB,VERB,Mood=Ind|Number=Sing|Person=3|Tense=Pres|VerbForm=Fin,0.0,root,0:root,_,1.0
52343,197389,"Si nous sommes dans un marché qui ne baisse plus quand les financières annoncent des pertes catastrophiques, cela veut dire que la tendance a ",changé,", a poursuivi le vendeur d'actions.",26.0,changé,changer,VERB,VERB,Gender=Masc|Number=Sing|Tense=Past|VerbForm=Part,21.0,ccomp,21:ccomp,SpaceAfter=No,1.0
52776,199078,"Au fur et à mesure que nous grimpons, les paysages ",changent,... et le tracé devient de plus en plus sinueux pour pouvoir mieux se faufiler entre les parois rocheuses.,12.0,changent,changer,VERB,VERB,Mood=Ind|Number=Plur|Person=3|Tense=Pres|VerbForm=Fin,0.0,root,0:root,SpaceAfter=No,1.0
55475,208817,Mais les choses ont ,changé," rapidement quand Jagr a dirigé l'attaque, permettant à Scott Gomez, Martin Straka et au défenseur Michal Rozsival de marquer en avantage, tous en première période.",5.0,changé,changer,VERB,VERB,Gender=Masc|Number=Sing|Tense=Past|VerbForm=Part,0.0,root,0:root,_,1.0
55663,209594,"Théoriquement, la doctrine officielle n'a pas beaucoup ",changé," depuis que quatre généraux, surnommés """"les généraux de l'Apocalypse"""", ont théorisé la dissuasion dite """"du faible au fort"""" dans les années 1960 à la demande du général de Gaulle.",10.0,changé,changer,VERB,VERB,Gender=Masc|Number=Sing|Tense=Past|VerbForm=Part,0.0,root,0:root,_,3.0
58307,219260,"Si les Chambres revoient leur décision - prise dans le cadre de l'assainissement des finances fédérales - de supprimer dès 2006 les 15 millions de subventions à Swissinfo, notre planification ",changera,", a assuré M. Walpen.",33.0,changera,changer,VERB,VERB,Mood=Ind|Number=Sing|Person=3|Tense=Fut|VerbForm=Fin,0.0,root,0:root,SpaceAfter=No,2.0
60396,227352,"Mais si l'on compare la guerre du Kosovo à celle du Golfe, quelque chose a ",changé, : c'est le formidable développement d'Internet.,18.0,changé,changer,VERB,VERB,Gender=Masc|Number=Sing|Tense=Past|VerbForm=Part,0.0,root,0:root,_,3.0
61235,230792,"Moi, j'aime mon père, je suis fière de lui, je ne veux pas qu'il ",change," », a-t-elle dit, avec l'espoir que les gais obtiennent des droits parentaux égaux.",20.0,change,changer,VERB,VERB,Mood=Sub|Number=Sing|Person=3|Tense=Pres|VerbForm=Fin,16.0,ccomp,16:ccomp,_,3.0
61766,232874,"Si une action nécessite un changement des données, le contrôleur demande la modification des données au modèle et ensuite avertit la vue que les données ont ",changé, pour qu'elle se mette à jour.,28.0,changé,changer,VERB,VERB,Gender=Masc|Number=Sing|Tense=Past|VerbForm=Part,21.0,ccomp,21:ccomp,_,1.0
61861,233257,Seules les fixations de celui-ci ont ,changé, pour garder une bonne maniabilité dans les courbes serrées tout en gardant une bonne traction de la roue arrière.,7.0,changé,changer,VERB,VERB,Gender=Masc|Number=Sing|Tense=Past|VerbForm=Part,0.0,root,0:root,_,2.0
63253,238658,La surface ,change," constamment, c'est un véritable casse-tête, et les pilotes vont d'entrée de jeu être confrontés à ce qui les attend durant tout le week-end.",3.0,change,changer,VERB,VERB,Mood=Ind|Number=Sing|Person=3|Tense=Pres|VerbForm=Fin,0.0,root,0:root,_,1.0
67256,253850,Les temps ,changent, et l'univers de Bionic Commando a reçu un sacré ravalement de façade.,3.0,changent,changer,VERB,VERB,Mood=Ind|Number=Plur|Person=3|Tense=Pres|VerbForm=Fin,0.0,root,0:root,_,1.0
68918,260108,La situation en Suisse n'a pas ,changé,", a expliqué Cecilia Ugaz, coordonnatrice de la rédaction du rapport annuel du Programme des Nations Unies pour le développement (PNUD).",8.0,changé,changer,VERB,VERB,Gender=Masc|Number=Sing|Tense=Past|VerbForm=Part,0.0,root,0:root,SpaceAfter=No,1.0
69259,261461,Les couleurs et le rythme de la musique ,changent,", et reflètent d’une certaine manière le ton global de la saison.",9.0,changent,changer,VERB,VERB,Mood=Ind|Number=Plur|Person=3|Tense=Pres|VerbForm=Fin,0.0,root,0:root,SpaceAfter=No,1.0
69325,261675,Qu'elle ne fut pas un décalque; qu'il n'a pas ,changé," (ah, si, il a coupé ses cheveux, ouf !)",14.0,changé,changer,VERB,VERB,Gender=Masc|Number=Sing|Tense=Past|VerbForm=Part,26.0,advcl,26:advcl,_,2.0
70105,264621,Bien sûr notre moralité a bcp ,changé,", mais ce n'est pas relever ce pays qui va nous depasser, nous camers, si popaul et son gouvernement veuillent bien laisser les coudées franches aux forces du developpement.",7.0,changé,changer,VERB,VERB,Gender=Masc|Number=Sing|Tense=Past|VerbForm=Part,0.0,root,0:root,SpaceAfter=No,1.0
70195,264924,Les habitudes sociales de la famille agricole ,changent," et cette dernière s'ouvre à nouvelles sollicitations : ouverture culturelle, week-end, vacances.",8.0,changent,changer,VERB,VERB,Mood=Ind|Number=Plur|Person=3|Tense=Pres|VerbForm=Fin,0.0,root,0:root,_,1.0
70293,265277,"En 2007, 7,6 millions de personnes sont mortes de cancer dans le monde et que les nouveaux cas ont dépassé les 12 millions.Si rien ne ",change,", d'ici 2030 le nombre de décès annuels grimpera à 11,5 millions et celui des nouveaux cas à 16 millions.",29.0,change,changer,VERB,VERB,Mood=Ind|Number=Sing|Person=3|Tense=Pres|VerbForm=Fin,39.0,advcl,39:advcl,SpaceAfter=No,1.0
70675,266633,"La position des mots dans le nuage, leur taille et couleurs ",changent, également à chaque fois que la page est chargée.,13.0,changent,changer,VERB,VERB,Mood=Ind|Number=Plur|Person=3|Tense=Pres|VerbForm=Fin,0.0,root,0:root,_,1.0
71253,268777,"Aujourd'hui, la donne a ",changé," et, si je comprends, je digère moins bien la mise à la trappe prématurée de Carbon - Rosetta - PPC.",6.0,changé,changer,VERB,VERB,Gender=Masc|Number=Sing|Tense=Past|VerbForm=Part,0.0,root,0:root,_,3.0
72369,272908,La nature n'a pas ,changé,", verdoyante, sauvage et magnifiquement préservée.",6.0,changé,changer,VERB,VERB,Gender=Masc|Number=Sing|Tense=Past|VerbForm=Part,0.0,root,0:root,SpaceAfter=No,1.0
73483,276863,Il semble que la manière dont on interagit avec l'information a ,changé,"», explique son président Gord Hotchkiss, rencontré au cinéma Excentris, où il donnait récemment une conférence organisée par le magazine InfoPresse.",13.0,changé,changer,VERB,VERB,Gender=Masc|Number=Sing|Tense=Past|VerbForm=Part,2.0,ccomp,2:ccomp,SpaceAfter=No,2.0
73591,277304,La plupart d'entre vous connaissent déjà les tweaks ... ces modifications de la base de registre qui vous permettent de ,changer, et d'améliorer le comportement de votre appareil.,22.0,changer,changer,VERB,VERB,VerbForm=Inf,20.0,xcomp,20:xcomp,_,1.0
76221,286989,La position du PS pour ne pas ,changer, est celle de l'opposition systématique.,8.0,changer,changer,VERB,VERB,VerbForm=Inf,2.0,acl,2:acl,_,1.0
77403,291238,"S'enchaîneront alors plusieurs tubes mémorables pour les enfants nés dans les années 1960 : Isabelle, je t'aime (500 000 exemplaires), Non, non, rien n'a ",changé," (1 200 000 exemplaires), Des Chansons pop (400 000 exemplaires)...",34.0,changé,changer,VERB,VERB,Gender=Masc|Number=Sing|Tense=Past|VerbForm=Part,16.0,parataxis,16:parataxis,_,2.0
77652,292230,L'attitude de Delarue ,change," brusquement, bien qu'il prétende toujours me parler """" en ami """"",5.0,change,changer,VERB,VERB,Mood=Ind|Number=Sing|Person=3|Tense=Pres|VerbForm=Fin,0.0,root,0:root,_,1.0
78776,296460,Si le jeux n'a pas ,changé,", tu ne peut qu'entraîner et regarder te prendre une taule contre une équipe de 8ème division !",7.0,changé,changer,VERB,VERB,Gender=Masc|Number=Sing|Tense=Past|VerbForm=Part,11.0,advcl,11:advcl,SpaceAfter=No,1.0
80403,302293,Petit philosophie sur le temps Le téléspectateur en ayant marre que ne rien ne ,change," passe à l'intérieur de la télé et """"décoince"""" le temps...",15.0,change,changer,VERB,VERB,Mood=Ind|Number=Sing|Person=3|Tense=Pres|VerbForm=Fin,10.0,ccomp,10:ccomp,_,1.0
80830,303956,"D'après l'industriel haïtien, le président, qui n'a fait aucune promesse lors de sa campagne électorale, demeure toujours muet, alors que rien n'a ",changé, concernant la situation de vie assez précaire de la population haïtienne.,31.0,changé,changer,VERB,VERB,Gender=Masc|Number=Sing|Tense=Past|VerbForm=Part,22.0,advcl,22:advcl,_,2.0
84531,317754,Comment le train ,change,-t-il de voie?,4.0,change,changer,VERB,VERB,Mood=Ind|Number=Sing|Person=3|Tense=Pres|VerbForm=Fin,0.0,root,0:root,SpaceAfter=No,1.0
86816,326690,"Le groupe Caféïne, créé en 1997, avait donné une performance fort respectable en janvier 2002 au Café Campus, j'y étais.Il semble que Caféïne a bel et bien ",changé, et pour le «mieux» en plus ?,34.0,changé,changer,VERB,VERB,Gender=Masc|Number=Sing|Tense=Past|VerbForm=Part,27.0,ccomp,27:ccomp,_,1.0
90188,339686,Ceci est en train de ,changer,", avec le ralliement du secteur bancaire, qui utilisera notamment la fonction porte-monnaie électronique.",6.0,changer,changer,VERB,VERB,VerbForm=Inf,4.0,acl,4:acl,SpaceAfter=No,3.0
90207,339775,Les monoplaces ne ,changent, pas beaucoup lors des courses disputées loin de l'Europe et cette course en Espagne sera la première occasion de vérifier la qualité de notre travail de développement par rapport à ce que les autres ont fait.,4.0,changent,changer,VERB,VERB,Mood=Ind|Number=Plur|Person=3|Tense=Pres|VerbForm=Fin,0.0,root,0:root,_,1.0
90388,340556,La garde à vue se déroule normalement et pour le reste Jean-Christophe Breuil a exprimé naguère sa position et n'avait pas de raison d'en ,changer,", a précisé Me Alain Ribeyre.",28.0,changer,changer,VERB,VERB,VerbForm=Inf,25.0,acl,25:acl,SpaceAfter=No,1.0
90825,342183,"Par exemple, il est possible d'enregistrer de courtes vidéos pour montrer sa joie, sa tristesse, etc. Dès que l'utilisateur utilise un smiley (ou émoticône) pour exprimer sa pensée, son image ",change, pour refléter son état d'esprit.,39.0,change,changer,VERB,VERB,Mood=Ind|Number=Sing|Person=3|Tense=Pres|VerbForm=Fin,0.0,root,0:root,_,1.0
91020,342988,"Mais plus tard, Kyôichirô revînt en ayant ",changé,", il regagna peu à peu le pouvoir du trône des Mibu.",9.0,changé,changer,VERB,VERB,Gender=Masc|Number=Sing|Tense=Past|VerbForm=Part,6.0,advcl,6:advcl,SpaceAfter=No,3.0
91536,344999,Soudain les noms ,changent,", Arrière-grand-père devient Edouard, Papa devient Hilaire, Tante devient Angèle.",4.0,changent,changer,VERB,VERB,Mood=Ind|Number=Plur|Person=3|Tense=Pres|VerbForm=Fin,7.0,advcl,7:advcl,SpaceAfter=No,2.0
91953,346597,"Pour Chris, ce sont les mêmes énigmes mais avec des clés qui ",changent, (c'est aussi plus difficile et on n'a pas de sauvegardes infinies).,14.0,changent,changer,VERB,VERB,Mood=Ind|Number=Plur|Person=3|Tense=Pres|VerbForm=Fin,12.0,acl:relcl,12:acl:relcl,_,3.0
92080,347098,Nous voulons que cette mentalité ,change,", a déclaré le co-président du DTP.",6.0,change,changer,VERB,VERB,Mood=Sub|Number=Sing|Person=3|Tense=Pres|VerbForm=Fin,2.0,ccomp,2:ccomp,SpaceAfter=No,1.0
94778,357794,"De ce fait, cela leur ouvre l'esprit et leur comportement ",change," : création de liens, ils apprennent mieux... &#117; Suggestion de lieux de travail :",13.0,change,changer,VERB,VERB,Mood=Ind|Number=Sing|Person=3|Tense=Pres|VerbForm=Fin,7.0,conj,7:conj,_,1.0
95337,359888,"Il n'y a donc pas de métalangage, mais l'écrit qui se fabrique du langage, pourrait peut-être, être matériel de force à ce que s'y ",changent, nos propos.,31.0,changent,changer,VERB,VERB,Mood=Ind|Number=Plur|Person=3|Tense=Pres|VerbForm=Fin,27.0,acl:relcl,27:acl:relcl,_,1.0
97405,367362,"Selon les dernières rumeurs, celle-ci pourrait voir le jour fin février, mais le calendrier de Microsoft ",changeant," perpétuellement, rien n'est moins sûr.",19.0,changeant,changer,VERB,VERB,Tense=Pres|VerbForm=Part,7.0,conj,7:conj,_,3.0
98556,372048,Hélas aujourd'hui les temps ont bien ,changé,", et excepté un petit nombre remis en état par des passionnés pour conserver une mémoire, la plupart de ces moulins sont à l'abandon.",7.0,changé,changer,VERB,VERB,Gender=Masc|Number=Sing|Tense=Past|VerbForm=Part,0.0,root,0:root,SpaceAfter=No,1.0
98666,372453,"Dès lors, le mode d'organisation ",change,", et ainsi on peut concevoir que la motivation des salariés diminue en conséquence.",8.0,change,changer,VERB,VERB,Mood=Ind|Number=Sing|Person=3|Tense=Pres|VerbForm=Fin,0.0,root,0:root,SpaceAfter=No,1.0
100087,377644,Mais les choses ont ,changé," alors que fin Février, la chaîne ABC s'est portée volontaire pour reprendre la série.",5.0,changé,changer,VERB,VERB,Gender=Masc|Number=Sing|Tense=Past|VerbForm=Part,0.0,root,0:root,_,1.0
100263,378257,Le ton a ,changé," mais la détermination reste la même : """"Nous sommes entrés en résistance pacifique"""".",4.0,changé,changer,VERB,VERB,Gender=Masc|Number=Sing|Tense=Past|VerbForm=Part,0.0,root,0:root,_,1.0
101223,381850,Les équipes ont ,changé," et ce match arrive tôt dans la saison"""", observe le shooteur dominicain Jeff Greer, élu MVP de la dernière finale.",5.0,changé,changer,VERB,VERB,Gender=Masc|Number=Sing|Tense=Past|VerbForm=Part,0.0,root,0:root,_,1.0
105200,396972,Cette position est «très claire» et «n'a pas ,changé," du tout», a expliqué M. Kouchner, réaffirmant que selon Paris, Téhéran avait le droit au nucléaire civil, mais qu'on ne pouvait pas accepter la bombe.",13.0,changé,changer,VERB,VERB,Gender=Masc|Number=Sing|Tense=Past|VerbForm=Part,6.0,conj,6:conj,_,1.0
105289,397297,Elle a cependant une réelle vocation pour ce travail et refuse d’en ,changer, pour gagner davantage d’argent.,14.0,changer,changer,VERB,VERB,VerbForm=Inf,11.0,xcomp,11:xcomp,_,1.0
106349,401366,La raison clef pour bouger vite est que le monde ,change," et que les préférences sont soumises à une érosion permanente"""", a expliqué M. Mandelson lundi.",11.0,change,changer,VERB,VERB,Mood=Ind|Number=Sing|Person=3|Tense=Pres|VerbForm=Fin,7.0,ccomp,7:ccomp,_,1.0
108080,407930,Tu n' as pas ,changé,", tu n'as pas pris la """"grosse tête"""".",6.0,changé,changer,VERB,VERB,Gender=Masc|Number=Sing|Tense=Past|VerbForm=Part,0.0,root,0:root,SpaceAfter=No,3.0
108739,410480,Ça nous donne le goût de ,changer,", et ce sont les individus qui changeront les choses.»",7.0,changer,changer,VERB,VERB,VerbForm=Inf,5.0,acl,5:acl,SpaceAfter=No,2.0
110356,416350,"Il gouverna l'Eglise avec sagesse pendant quinze ans, mais l'humeur de l'empereur ",changea, et saint Ignace fut exilé et remplacé par saint Photius.,17.0,changea,changer,VERB,VERB,Mood=Ind|Number=Sing|Person=3|Tense=Past|VerbForm=Fin,2.0,conj,2:conj,_,2.0
110509,416959,"Aujourd'hui, leurs conditions de travail n'ont pas fondamentalement ",changé,", mais à côté, ils peuvent faire autre chose et ne pas perdre leur vie à la gagner.",11.0,changé,changer,VERB,VERB,Gender=Masc|Number=Sing|Tense=Past|VerbForm=Part,0.0,root,0:root,SpaceAfter=No,3.0
112961,426396,Nous voulons que la perception des choses ,change," », expliquait YouTube en mai dernier.",8.0,change,changer,VERB,VERB,Mood=Sub|Number=Sing|Person=3|Tense=Pres|VerbForm=Fin,2.0,ccomp,2:ccomp,_,2.0
113573,428633,Il suffit maintenant de modifier uniquement les éléments qui ont ,changé, ou de valider chaque page du formulaire si la situation n'a pas évolué depuis la dernière campagne.,11.0,changé,changer,VERB,VERB,Gender=Masc|Number=Sing|Tense=Past|VerbForm=Part,8.0,acl:relcl,8:acl:relcl,_,1.0
113648,428912,Une quasi-unanimité politique se fait pour que cela ,change,", I'île se transforme en département le 19 mars 1946.",9.0,change,changer,VERB,VERB,Mood=Sub|Number=Sing|Person=3|Tense=Pres|VerbForm=Fin,5.0,advcl,5:advcl,SpaceAfter=No,1.0
116842,441077,Sa perception du monde ,change,", tout en restant parfaitement réelle (pratique nommée « stopper-le-monde »).",5.0,change,changer,VERB,VERB,Mood=Ind|Number=Sing|Person=3|Tense=Pres|VerbForm=Fin,0.0,root,0:root,SpaceAfter=No,1.0
117113,442223,Le vent ,changeait, énormément et il y avait des points que nous avons cherchés trop longtemps parce que le vent nous a joué de mauvais tours.,3.0,changeait,changer,VERB,VERB,Mood=Ind|Number=Sing|Person=3|Tense=Imp|VerbForm=Fin,0.0,root,0:root,_,1.0
122374,462438,"Toutefois, à la lumière d'un reportage diffusé mardi par Radio-Canada, il semblerait que la situation ait ",changé, et que le local soit encore utilisé pour former les jeunes.,20.0,changé,changer,VERB,VERB,Gender=Masc|Number=Sing|Tense=Past|VerbForm=Part,15.0,ccomp,15:ccomp,_,1.0
122568,463206,Le besoin de ,changer," la plate-forme vocale interactive et propriétaire, utilisée depuis 1996, s'est fait ressentir en 2006.",4.0,changer,changer,VERB,VERB,VerbForm=Inf,2.0,acl,2:acl,_,1.0
123692,467446,Les choses ont beaucoup ,changé, depuis que l'homme de 18 ans a lancé un site Internet dénonçant l'intimidation à l'école et a commencé à partager son expérience à l'occasion de conférences nationales et d'interviews télévisées.,5.0,changé,changer,VERB,VERB,Gender=Masc|Number=Sing|Tense=Past|VerbForm=Part,0.0,root,0:root,_,1.0
123964,468501,Mais cette règle est en train de ,changer,", prévient l'ACD.",8.0,changer,changer,VERB,VERB,VerbForm=Inf,6.0,acl,6:acl,SpaceAfter=No,1.0
