Unnamed: 0,sent_id,left_context,pivot,right_context,ID,FORM,LEMMA,UPOS,XPOS,FEATS,HEAD,DEPREL,DEPS,MISC,dist
124739,471250,Et le Romario orgueilleux voire arrogant n'a pas ,changé,": """"Aujourd'hui j'ai peut-être des handicaps sur le plan physique ou de la vitesse, mais je suis toujours le meilleur"""".",10.0,changé,changer,VERB,VERB,Gender=Masc|Number=Sing|Tense=Past|VerbForm=Part,0.0,root,0:root,SpaceAfter=No,2.0
125104,472584,Alors les statuts de l'île ,changent," : colonie, province impériale (6 après J.C) puis sénatoriale avec des rattachements à la Sardaigne ou des """" indépendances """" à l'intérieur de l'empire.",7.0,changent,changer,VERB,VERB,Mood=Ind|Number=Plur|Person=3|Tense=Pres|VerbForm=Fin,0.0,root,0:root,_,1.0
125819,475181,"Cette œuvre offre plusieurs pistes: ses motifs, essentiellement floraux, son statut premier de décoration, en passe de ",changer,", on le verra, son état enfin, assez déplorable, qui lui aussi va se modifier, s'améliorer au cours de l'exposition.",22.0,changer,changer,VERB,VERB,VerbForm=Inf,20.0,xcomp,20:xcomp,SpaceAfter=No,1.0
133429,503928,Peut-être à faire en sorte que le monde ne ,change," pas, que les vrais mecs puissent continuer à tout moment de faire preuve de leur pouvoir sur les dominéEs, ça sert peut-être à justifier la violence.",12.0,change,changer,VERB,VERB,Mood=Ind|Number=Sing|Person=3|Tense=Pres|VerbForm=Fin,5.0,ccomp,5:ccomp,_,1.0
135006,509862,Une adresse IP dynamique n'est susceptible de ,changer," que quand votre connexion réseau tombe et se reconnecte, ou bien périodiquement lors d'une négociation DHCP.",9.0,changer,changer,VERB,VERB,VerbForm=Inf,7.0,xcomp,7:xcomp,_,1.0
135720,512490,Mais le passage de deux à trois haltes n'a rien ,changé,", et l'Anglais, qui s'est curieusement gardé comme la veille de pousser son V8 jusqu'au 19.000 t/min réglementaires, a renoncé au combat bien avant terme.",12.0,changé,changer,VERB,VERB,Gender=Masc|Number=Sing|Tense=Past|VerbForm=Part,0.0,root,0:root,SpaceAfter=No,1.0
136076,513775,Les temps ont ,changé, si l'on s'en réfère aux difficultés rencontrées pour mettre sur pied une liste à l'occasion des élections municipales.,4.0,changé,changer,VERB,VERB,Gender=Masc|Number=Sing|Tense=Past|VerbForm=Part,0.0,root,0:root,_,1.0
137989,520720,A moins que les choses ne ,changent,", la dette publique américaine - qui était de 5,7 milliards de dollars lors de l'investiture de Bush - sera augmentée de 2 milliards à cause de cette guerre.",7.0,changent,changer,VERB,VERB,Mood=Sub|Number=Plur|Person=3|Tense=Pres|VerbForm=Fin,29.0,advcl,29:advcl,SpaceAfter=No,1.0
142120,536519,"On aura beau, demain, comme le livre blanc y invite, avoir des négociations tous les ans, rien ne ",changera, si le Ministre de la Fonction Publique arrive à ces négociations avec les mêmes présupposés idéologiques.,23.0,changera,changer,VERB,VERB,Mood=Ind|Number=Sing|Person=3|Tense=Fut|VerbForm=Fin,0.0,root,0:root,_,2.0
143041,540035,Le profil du militant ,change,", il revendique son autonomie par rapport à son association, son parti, son syndicat.",5.0,change,changer,VERB,VERB,Mood=Ind|Number=Sing|Person=3|Tense=Pres|VerbForm=Fin,0.0,root,0:root,SpaceAfter=No,1.0
144244,544360,Mais les choses ont bien ,changé,", analyse-t-il, car les entreprises connaissent leurs marchés, maîtrisent les arcanes du marketing, contrôlent les canaux de distribution, et sont ainsi capables de réagir à temps pour s'adapter.",6.0,changé,changer,VERB,VERB,Gender=Masc|Number=Sing|Tense=Past|VerbForm=Part,0.0,root,0:root,SpaceAfter=No,2.0
145483,548983,"Pour Sebastian Roché, cette politique génératrice de tensions a peu de chances de ",changer, tant que ses concepteurs seront au pouvoir.,15.0,changer,changer,VERB,VERB,VerbForm=Inf,13.0,acl,13:acl,_,1.0
147061,554923,"Certains parmi nous sont très intéressés par le Rassemblement pour la paix (RPP) du président Laurent Dona Fologo.N.V. : Selon vous, qu'est-ce qui aurait ",changé, si le PDCI avait clairement condamné la rébellion ?,32.0,changé,changer,VERB,VERB,Gender=Masc|Number=Sing|Tense=Past|VerbForm=Part,27.0,dep,27:dep,_,1.0
148178,559199,"Quand Jacques Brind'Amour arrive quelque part, l'une des premières choses qui ",changent,", c'est le décor: sous sa gouverne, la SAAQ et la Financière agricole ont dépensé plus de 155 000$ pour réaménager les bureaux de la haute direction.",15.0,changent,changer,VERB,VERB,Mood=Ind|Number=Plur|Person=3|Tense=Pres|VerbForm=Fin,13.0,acl:relcl,13:acl:relcl,SpaceAfter=No,2.0
148784,561477,"Une bulle, qu'on appelle le 2.0, et qui fait que des milliers d'entreprises apprennent tardivement l'inclusion de leurs publics, et découvrent que ça ",change, un peu plus que la surface.,30.0,change,changer,VERB,VERB,Mood=Ind|Number=Sing|Person=3|Tense=Pres|VerbForm=Fin,27.0,ccomp,27:ccomp,_,1.0
152052,573738,Considérez un suffrage indirect comme le Sénat (les sénateurs sont élus par les maires et les députés) : la composition du Sénat ,change, si peu qu'on n'en parle jamais dans les journaux.,25.0,change,changer,VERB,VERB,Mood=Ind|Number=Sing|Person=3|Tense=Pres|VerbForm=Fin,1.0,advcl,1:advcl,_,1.0
158483,597464,"Toutefois «sur l'immigration, j'ai changé parce que l'Europe est en train de ",changer, plus que nous» a-t-il ajouté en se référant notamment à l'évolution de pays comme l'Espagne ou l'Italie sur cette question.,18.0,changer,changer,VERB,VERB,VerbForm=Inf,16.0,acl,16:acl,_,1.0
159118,599950,La formation a ,changé," autour d'eux, et actuellement, elle est constituée des musiciens """"Fresh Prince of Darkness"""", """"Wreck Tom"""", et """"Clint Torres"""".",4.0,changé,changer,VERB,VERB,Gender=Masc|Number=Sing|Tense=Past|VerbForm=Part,0.0,root,0:root,_,1.0
159621,601913,La seule chose qui a ,changé,", c'est la nature de la pression, forcément beaucoup moins forte aujourd'hui"""", consent simplement Heymans.",7.0,changé,changer,VERB,VERB,Gender=Masc|Number=Sing|Tense=Past|VerbForm=Part,4.0,acl:relcl,4:acl:relcl,SpaceAfter=No,2.0
161010,607019,L'UDC a paradoxalement plus de peine à jouer son rôle d'opposition en étant dans l'opposition que lorsqu'elle était au Conseil fédéral Les autres partis ont donc tout intérêt à ne rien ,changer,", à ne pas faire de cadeau à l'UDC.",36.0,changer,changer,VERB,VERB,VerbForm=Inf,29.0,xcomp,29:xcomp,SpaceAfter=No,1.0
161189,607739,Ils seront alors en mesure de déterminer si les conditions de marché ,changent, significativement et permettent d'espérer rentabiliser l'usine.,13.0,changent,changer,VERB,VERB,Mood=Ind|Number=Plur|Person=3|Tense=Pres|VerbForm=Fin,7.0,ccomp,7:ccomp,_,1.0
162022,610896,FO indique toutefois que sa décision concernant la grève n'a pas ,changé," et affirme qu'il y aura bien un conflit social le 2 juin, """"mais peut-être pas à huit organisations"""".",13.0,changé,changer,VERB,VERB,Gender=Masc|Number=Sing|Tense=Past|VerbForm=Part,2.0,ccomp,2:ccomp,_,3.0
162573,613115,L'énergie a ,changé," : certes, il reste sur scène les pianos-jouets et le petit xylophone de La Valse d'Amélie, mais la plupart du temps, Tiersen est à la guitare électrique.",4.0,changé,changer,VERB,VERB,Gender=Masc|Number=Sing|Tense=Past|VerbForm=Part,0.0,root,0:root,_,1.0
163135,615236,"Renault a donc dû adapter son programme pour permettre à Nelson Piquet, en piste aujourd'hui, de boucler plusieurs runs alors que les conditions de piste n'ont eu de cesse de ",changer, tout au long de la journée.,34.0,changer,changer,VERB,VERB,VerbForm=Inf,32.0,acl,32:acl,_,1.0
164676,620890,Leurs regards ont ,changé,"... ce merveilleux sourire que j'étais venue chercher en Palestine, ce sourire palestinien peu à peu disparaît derrière les larmes.",4.0,changé,changer,VERB,VERB,Gender=Masc|Number=Sing|Tense=Past|VerbForm=Part,0.0,root,0:root,SpaceAfter=No,1.0
164847,621481,"Les élèves ont le choix du média - vidéo, internet, enregistrement audio, texte - et dès lors, le rôle du professeur ",change," : il devient un """"conseiller en apprentissage"""" qui s'adapte aux besoins d'élèves impliqués dans leur apprentissage.",26.0,change,changer,VERB,VERB,Mood=Ind|Number=Sing|Person=3|Tense=Pres|VerbForm=Fin,3.0,conj,3:conj,_,1.0
165526,624058,Le tracé n'a pas ,changé,", mais les dégagements sont maintenant en asphalte.",6.0,changé,changer,VERB,VERB,Gender=Masc|Number=Sing|Tense=Past|VerbForm=Part,0.0,root,0:root,SpaceAfter=No,1.0
165984,625832,"Ou en tout cas pas en romanche, chacune prétendant ne pas comprendre l'autre.Mais la donne est en train de ",changer,", grâce en particulier à la RTR.",24.0,changer,changer,VERB,VERB,VerbForm=Inf,22.0,acl,22:acl,SpaceAfter=No,3.0
168147,634059,Mais une chose n'a pas ,changé,": l'Amérique doit affronter des ennemis violents qui nous ont déjà attaqué par le passé et qui veulent nous attaquer encore"""".",8.0,changé,changer,VERB,VERB,Gender=Masc|Number=Sing|Tense=Past|VerbForm=Part,0.0,root,0:root,SpaceAfter=No,2.0
168803,636578,"L'importation ou l'exportation de livres est formellement interdite, aussi il est conseillé de ",changer, au fur et à mesure des besoins.,17.0,changer,changer,VERB,VERB,VerbForm=Inf,15.0,xcomp,15:xcomp,_,1.0
169134,637897,"Tony Blair a prévenu vendredi dernier que """"les règles du jeu ont ",changé,", et annoncé son intention d'en finir avec le """"Londonistan"""", cette nébuleuse de groupes et opposants islamistes qui ont proliféré à Londres depuis une vingtaine d'années.",14.0,changé,changer,VERB,VERB,Gender=Masc|Number=Sing|Tense=Past|VerbForm=Part,4.0,ccomp,4:ccomp,SpaceAfter=No,1.0
172362,650138,"En tout cas je trouve que c'est une bonne idée d'essayer d'imaginer un monde sans nucléaire, ça ",change, un peu de la classique bombe qui défonce tout.,22.0,change,changer,VERB,VERB,Mood=Ind|Number=Sing|Person=3|Tense=Pres|VerbForm=Fin,5.0,advcl,5:advcl,_,2.0
172587,650958,L'aspect et la composition ne ,changent, pas sauf qu'il ne fait pas autant de liquide à la température de la pièce.,7.0,changent,changer,VERB,VERB,Mood=Ind|Number=Plur|Person=3|Tense=Pres|VerbForm=Fin,0.0,root,0:root,_,1.0
173399,654048,La situation ,change,", a estimé ce physicien de formation.",3.0,change,changer,VERB,VERB,Mood=Ind|Number=Sing|Person=3|Tense=Pres|VerbForm=Fin,0.0,root,0:root,SpaceAfter=No,1.0
176048,663968,"Malheureusement, les temps ",changent,", nos villes changent"""", a-t-il ajouté.",5.0,changent,changer,VERB,VERB,Mood=Ind|Number=Plur|Person=3|Tense=Pres|VerbForm=Fin,0.0,root,0:root,SpaceAfter=No,1.0
176049,663968,"Malheureusement, les temps changent, nos villes ",changent,", a-t-il ajouté.",5.0,changent,changer,VERB,VERB,Mood=Ind|Number=Plur|Person=3|Tense=Pres|VerbForm=Fin,0.0,root,0:root,SpaceAfter=No,1.0
177528,669640,Les choses ont ,changé,", l'a rassuré sur ce point un auditeur suédois.",4.0,changé,changer,VERB,VERB,Gender=Masc|Number=Sing|Tense=Past|VerbForm=Part,0.0,root,0:root,SpaceAfter=No,1.0
177923,671063,Il est vrai que le rapport au politique dans la société vietnamienne a ,changé,", on parle plus facilement de politique dans la sphère privée.",14.0,changé,changer,VERB,VERB,Gender=Masc|Number=Sing|Tense=Past|VerbForm=Part,3.0,ccomp,3:ccomp,SpaceAfter=No,2.0
178721,674171,Toulouse est un ville qui ,change,", les photos du passé, mises en face des photos actuelles de la ville, nous montrent comment la ville évolue, sous nos yeux.",6.0,change,changer,VERB,VERB,Mood=Ind|Number=Sing|Person=3|Tense=Pres|VerbForm=Fin,4.0,acl:relcl,4:acl:relcl,SpaceAfter=No,1.0
183226,691374,"Nous pouvons donc dire que l'art amarnien participe à cette mise en scène, mieux, l'illustre et par le truchement de son caractère sacré, qui lui n'est pas abandonné ou ",changé,", rend son effectivité éternelle.",36.0,changé,changer,VERB,VERB,Gender=Masc|Number=Sing|Tense=Past|VerbForm=Part,34.0,conj,34:conj,SpaceAfter=No,2.0
183442,692227,"Enfin, en bref, et en un mot comme en mille, tous ces enfants du XXI siècle, que ",changeraient,-ils s'ils décidaient de faire la révolution de l'évolution?,22.0,changeraient,changer,VERB,VERB,Mood=Cnd|Number=Plur|Person=3|Tense=Pres|VerbForm=Fin,16.0,dep,16:dep,SpaceAfter=No,1.0
188004,709182,"Mais un autre moyen d'obtenir des comptes peut aussi venir des tribunaux internationaux Si les crimes contre l'humanité sont punis avec cohérence et sévérité, les calculs des tueurs ",changeront,", ajoute-t-elle.",32.0,changeront,changer,VERB,VERB,Mood=Ind|Number=Plur|Person=3|Tense=Fut|VerbForm=Fin,0.0,root,0:root,SpaceAfter=No,3.0
188177,709777,La scène ,change, et représente au loin quelques moutons qui paissent.,3.0,change,changer,VERB,VERB,Mood=Ind|Number=Sing|Person=3|Tense=Pres|VerbForm=Fin,0.0,root,0:root,_,1.0
189097,713466,Ses centres d'intérêt ,changent, souvent mais il est toujours absorbé par quelque sujet stupide et sans relation avec son environnement.,5.0,changent,changer,VERB,VERB,Mood=Ind|Number=Plur|Person=3|Tense=Pres|VerbForm=Fin,0.0,root,0:root,_,1.0
189683,715746,Nous n'avons pas l'intention de ,changer," ce qui a fait notre marque de fabrique : simplicité, pertinence, efficacité.",8.0,changer,changer,VERB,VERB,VerbForm=Inf,6.0,acl,6:acl,_,1.0
192144,724871,"Même l'angoisse a changé, dès lors qu'a ",changé, la relation de l'homme avec les choses.,5.0,changé,changer,VERB,VERB,Gender=Masc|Number=Sing|Tense=Past|VerbForm=Part,0.0,root,0:root,SpaceAfter=No,1.0
192145,724871,Même l'angoisse a ,changé,", dès lors qu'a changé la relation de l'homme avec les choses.",5.0,changé,changer,VERB,VERB,Gender=Masc|Number=Sing|Tense=Past|VerbForm=Part,0.0,root,0:root,SpaceAfter=No,1.0
192477,726155,"Mais bien vite, le surnaturel réapparaît, les comportements des uns et des autres ",changent,", les obstacles et les drames s'accumulent.",16.0,changent,changer,VERB,VERB,Mood=Ind|Number=Plur|Person=3|Tense=Pres|VerbForm=Fin,7.0,ccomp,7:ccomp,SpaceAfter=No,3.0
192556,726467,Notre langage a ceci de particulier qu'il n'a pas ,changé,", qu'il n'a pas même varié [...] ; et ceci encore, que le parler dialectal des Tourangeaux et des Berrichons, d'où le nôtre est sorti, est réputé le meilleur de toute la France » (1).",12.0,changé,changer,VERB,VERB,Gender=Masc|Number=Sing|Tense=Past|VerbForm=Part,3.0,ccomp,3:ccomp,SpaceAfter=No,1.0
193384,729630,"Sur la glace, le coef de frottement du caoutchouc peut ",changer, brutalement.,12.0,changer,changer,VERB,VERB,VerbForm=Inf,11.0,xcomp,11:xcomp,_,1.0
194010,732028,"La vie change, le monde change, les gens ",changent,... les listes de courses aussi.,11.0,changent,changer,VERB,VERB,Mood=Ind|Number=Plur|Person=3|Tense=Pres|VerbForm=Fin,3.0,conj,3:conj,SpaceAfter=No,1.0
194011,732028,La vie ,change,", le monde change, les gens changent... les listes de courses aussi.",3.0,change,changer,VERB,VERB,Mood=Ind|Number=Sing|Person=3|Tense=Pres|VerbForm=Fin,0.0,root,0:root,SpaceAfter=No,1.0
194012,732028,"La vie change, le monde ",change,", les gens changent... les listes de courses aussi.",3.0,change,changer,VERB,VERB,Mood=Ind|Number=Sing|Person=3|Tense=Pres|VerbForm=Fin,0.0,root,0:root,SpaceAfter=No,1.0
195080,735789,Les hommes à ,changer, ce sont peut-être les joueurs qui ne sont pas tous irréprochables.,4.0,changer,changer,VERB,VERB,VerbForm=Inf,2.0,acl,2:acl,_,1.0
195527,737569,Les temps ont bien ,changé, et la précarité a gagné du terrain.,5.0,changé,changer,VERB,VERB,Gender=Masc|Number=Sing|Tense=Past|VerbForm=Part,0.0,root,0:root,_,1.0
198535,749295,Les marchés ,changent," rapidement, la concurrence est très vive et nous devons être prêts à lutter avec des armes nouvelles"""", a déclaré M. Armani, 73 ans, dans une interview publiée sur le site internet de son groupe.",4.0,changent,changer,VERB,VERB,Mood=Ind|Number=Plur|Person=3|Tense=Pres|VerbForm=Fin,11.0,advcl,11:advcl,_,1.0
198944,750884,"Les violations des droits humains, au Guatemala, ont ",changé,", mais le résultat est le même: la peur et la psychose de la terreur restent.",11.0,changé,changer,VERB,VERB,Gender=Masc|Number=Sing|Tense=Past|VerbForm=Part,0.0,root,0:root,SpaceAfter=No,1.0
203673,768439,"Inman subit la guerre, la violence, la mort et ",change," fatalement pour devenir plus dur, plus renfermé encore, """"perdant toute bonté"""" de son propre aveu.",12.0,change,changer,VERB,VERB,Mood=Ind|Number=Sing|Person=3|Tense=Pres|VerbForm=Fin,2.0,conj,2:conj,_,1.0
203855,769151,"Lorsque l'on regarde encore plus loin dans le cosmos, on est confronté à un problème: la lumière a mis tellement de temps à nous parvenir que l'astre émetteur a depuis bien ",changé, et qu'il ne se trouve plus à l'endroit que l'on voit dans le ciel.,36.0,changé,changer,VERB,VERB,Gender=Masc|Number=Sing|Tense=Past|VerbForm=Part,22.0,ccomp,22:ccomp,_,1.0
206148,777937,"Par exemple, si vous enregistrez une information qui ",change," rarement et que vous pouvez utiliser une ancienne version pendant deux jours, utilisez deux jours comme délai de rafraîchissement.",10.0,change,changer,VERB,VERB,Mood=Ind|Number=Sing|Person=3|Tense=Pres|VerbForm=Fin,8.0,acl:relcl,8:acl:relcl,_,1.0
207061,781081,"Dans cent ans, si rien ne ",change,", la moitié de ces langues seront mortes.",8.0,change,changer,VERB,VERB,Mood=Ind|Number=Sing|Person=3|Tense=Pres|VerbForm=Fin,16.0,advcl,16:advcl,SpaceAfter=No,2.0
208595,786833,"D'ailleurs, sans les gags usuels de « couches pleines » à ",changer," et de petits enfants rebelles qui deviennent obéissants comme des petits anges à la fin, l'histoire est sans intérêt.",14.0,changer,changer,VERB,VERB,VerbForm=Inf,10.0,acl,10:acl,_,1.0
210729,794531,Cependant les goûts du public ,changent, et la veine des péplums s'épuise.,6.0,changent,changer,VERB,VERB,Mood=Ind|Number=Plur|Person=3|Tense=Pres|VerbForm=Fin,0.0,root,0:root,_,1.0
212683,802095,"On l'a dit, l'interface n'a pas ",changé, visuellement mais de petites modifications de fond sont remarquables.,11.0,changé,changer,VERB,VERB,Gender=Masc|Number=Sing|Tense=Past|VerbForm=Part,0.0,root,0:root,_,3.0
212684,802097,Ce dont on a besoin c'est d'un modèle qui ,change, « assez souvent » pour qu'un utilisateur qui retourne sur un portail quelques minutes après découvre un nouveau lien vers un article différent.,12.0,change,changer,VERB,VERB,Mood=Ind|Number=Sing|Person=3|Tense=Pres|VerbForm=Fin,10.0,acl:relcl,10:acl:relcl,_,2.0
215126,811194,Cela fait plusieurs années que les Suisses veulent que le système ,change,", ce qui n'a pas été le cas avec la modification récente du Code des obligations.",12.0,change,changer,VERB,VERB,Mood=Sub|Number=Sing|Person=3|Tense=Pres|VerbForm=Fin,8.0,ccomp,8:ccomp,SpaceAfter=No,1.0
215908,814081,Les armes ont ,changé,", les modes de communication, aussi.",4.0,changé,changer,VERB,VERB,Gender=Masc|Number=Sing|Tense=Past|VerbForm=Part,0.0,root,0:root,SpaceAfter=No,1.0
216269,815406,Il était intéressant de poser une journée qui ne ,changera," pas et qui sera reconnue par tous les citoyens européens comme la journée des activités maritimes"""" commente la porte parole.",11.0,changera,changer,VERB,VERB,Mood=Ind|Number=Sing|Person=3|Tense=Fut|VerbForm=Fin,8.0,acl:relcl,8:acl:relcl,_,1.0
216652,817006,"La grande reporter part """"parce que la situation à Libération a ",changé,", et qu'elle est """"en désaccord avec ce qui se passe au journal"""".",13.0,changé,changer,VERB,VERB,Gender=Masc|Number=Sing|Tense=Past|VerbForm=Part,4.0,advcl,4:advcl,SpaceAfter=No,3.0
217131,818913,L'office est d'avis désormais que la donne a ,changé, et que ces personnes peuvent en général être renvoyées dès maintenant.,11.0,changé,changer,VERB,VERB,Gender=Masc|Number=Sing|Tense=Past|VerbForm=Part,4.0,ccomp,4:ccomp,_,1.0
219950,829421,Si la situation ,change," et que nos partenaires veulent que nous jouions un rôle en Espagne, nous sommes prêts.",4.0,change,changer,VERB,VERB,Mood=Ind|Number=Sing|Person=3|Tense=Pres|VerbForm=Fin,20.0,advcl,20:advcl,_,2.0
220470,831393,Le gameplay devrait alors radicalement ,changer, et gagner en intensité.,6.0,changer,changer,VERB,VERB,VerbForm=Inf,3.0,xcomp,3:xcomp,_,1.0
220888,833037,Les lèvres véridiques ne ,changent," jamais, mais celui qui use d'un langage frauduleux, son témoignage est changeant.",5.0,changent,changer,VERB,VERB,Mood=Ind|Number=Plur|Person=3|Tense=Pres|VerbForm=Fin,0.0,root,0:root,_,1.0
222646,839498,"Oh, non, les gens n'ont pas ",changé,", ni les autorités portuaires.",10.0,changé,changer,VERB,VERB,Gender=Masc|Number=Sing|Tense=Past|VerbForm=Part,0.0,root,0:root,SpaceAfter=No,2.0
222892,840456,Les temps ont ,changé,", le temps a passé, et nous avons constaté que nous n'avions plus autant de temps disponible qu'autrefois.",4.0,changé,changer,VERB,VERB,Gender=Masc|Number=Sing|Tense=Past|VerbForm=Part,0.0,root,0:root,SpaceAfter=No,1.0
226353,853746,Le ministère de communion et de célébration a beaucoup ,changé, et il changera encore dans ses formes.,10.0,changé,changer,VERB,VERB,Gender=Masc|Number=Sing|Tense=Past|VerbForm=Part,0.0,root,0:root,_,1.0
227432,857880,Les recruteurs n'ont pas ,changé, aussi vite que les nouvelles technologies.,6.0,changé,changer,VERB,VERB,Gender=Masc|Number=Sing|Tense=Past|VerbForm=Part,0.0,root,0:root,_,1.0
229552,865785,"On voit aussi comme on a changé soi-même, comme le temps a ",changé,", comme tout a changé, comme le montage a changé.",7.0,changé,changer,VERB,VERB,Gender=Masc|Number=Sing|Tense=Past|VerbForm=Part,2.0,ccomp,2:ccomp,_,3.0
229554,865785,"On voit aussi comme on a changé soi-même, comme le temps a changé, comme tout a ",changé,", comme le montage a changé.",7.0,changé,changer,VERB,VERB,Gender=Masc|Number=Sing|Tense=Past|VerbForm=Part,2.0,ccomp,2:ccomp,_,3.0
230741,869844,Le titre ne ,changera," jamais, mais La fin du monde sera diffusée à 19 h, à 18 h et à 22 h selon les saisons.",4.0,changera,changer,VERB,VERB,Mood=Ind|Number=Sing|Person=3|Tense=Fut|VerbForm=Fin,0.0,root,0:root,_,1.0
230766,869931,Il n'est pas dit que Pinocchio ,change," vraiment, mais il avance, de son pas de pantin de bois, et son regard se déplace du monde des chimères à celui de la """"vraie vie"""" qui fera de lui un petit garçon de chair.",8.0,change,changer,VERB,VERB,Mood=Ind|Number=Sing|Person=3|Tense=Pres|VerbForm=Fin,5.0,ccomp,5:ccomp,_,1.0
231697,873481,Le filtre à air sera bien sûr examiné avec une attention toute particulière et ,changé," plus souvent que de coutume, afin d'empêcher le sable de pénétrer dans le moteur.",15.0,changé,changer,VERB,VERB,Gender=Masc|Number=Sing|Tense=Past|VerbForm=Part,8.0,conj,8:conj,_,1.0
233149,879010,Les habitudes de consommation sont en train de ,changer,", a constaté le directeur de l'USMB Balz Horber.",9.0,changer,changer,VERB,VERB,VerbForm=Inf,7.0,acl,7:acl,SpaceAfter=No,1.0
234332,883530,La moyenne Durance coule dans un paysage qui ,change," radicalement, car les montagnes s'écartent et des plateaux de plus en plus vastes les remplacent.",9.0,change,changer,VERB,VERB,Mood=Ind|Number=Sing|Person=3|Tense=Pres|VerbForm=Fin,7.0,acl:relcl,7:acl:relcl,_,1.0
234665,884794,Nous sommes en 1902 les temps ,changent,", il faut se ressourcer explorer de nouveaux territoires précurseurs de bouleversements politiques s'annonçant au lointain.",7.0,changent,changer,VERB,VERB,Mood=Ind|Number=Plur|Person=3|Tense=Pres|VerbForm=Fin,2.0,ccomp,2:ccomp,SpaceAfter=No,1.0
236649,892244,"Pour le fabiusien Claude Bartolone, il faut aussi que la candidate explique """"ce qui va ",changer," tout de suite"""" si elle est élue, pour répondre à ceux qui pensent que la politique ne peut plus faire changer les choses.",18.0,changer,changer,VERB,VERB,VerbForm=Inf,17.0,xcomp,17:xcomp,_,1.0
239781,903644,La technologie du Web ,change," quotidiennement et de nouveaux add-on, plug-in et environnements de programmation vont continuer d'apparaitre.",5.0,change,changer,VERB,VERB,Mood=Ind|Number=Sing|Person=3|Tense=Pres|VerbForm=Fin,0.0,root,0:root,_,1.0
239859,903951,Il faut une mort pour que cela ,change,", dit une maman en pleurs à la télé.",9.0,change,changer,VERB,VERB,Mood=Sub|Number=Sing|Person=3|Tense=Pres|VerbForm=Fin,3.0,advcl,3:advcl,SpaceAfter=No,1.0
240662,907053,Exclusif- Les paysages du pôle Nord ,changent," à mesure qu'ils se réchauffement, pointe Madeleine Griselin, géographe au CNRS.",7.0,changent,changer,VERB,VERB,Mood=Ind|Number=Plur|Person=3|Tense=Pres|VerbForm=Fin,0.0,root,0:root,_,2.0
243299,917062,"Au fond, ceux qui ont le plus besoin que leur vie ",change," sont tentés d'exprimer leur """"ras-le-bol"""", leur mécontentement, leur colère souvent, en s'abstenant ou en utilisant des votes protestataires.",13.0,change,changer,VERB,VERB,Mood=Sub|Number=Sing|Person=3|Tense=Pres|VerbForm=Fin,6.0,ccomp,6:ccomp,_,1.0
246351,928447,"A un moment de la réalisation de lalbum, le groupe a éprouvé le besoin de ",changer, denvironnement.,17.0,changer,changer,VERB,VERB,VerbForm=Inf,15.0,acl,15:acl,_,1.0
248698,937131,"Pour justifier ce nouveau refus, les avocats de la firme ont aussi expliqué que les algorithmes du moteur ",changent, trop souvent pour fournir des résultats fiables.,20.0,changent,changer,VERB,VERB,Mood=Ind|Number=Plur|Person=3|Tense=Pres|VerbForm=Fin,14.0,ccomp,14:ccomp,_,2.0
250756,944849,"Au-delà du quartier-colonie de la Colline Française (French Hill), le paysage ",change,", bien que nous restions à l'intérieur de la ville de Jérusalem telle que définie par Israël en 1967.",19.0,change,changer,VERB,VERB,Mood=Ind|Number=Sing|Person=3|Tense=Pres|VerbForm=Fin,0.0,root,0:root,SpaceAfter=No,1.0
251938,949014,"La plupart des analyses tendent vers la seconde proposition, au vu de sa politique au long terme qui témoigne d'une volonté unique et cohérente (alors qu'il ",changea," souvent de conseillers), et de son caractère intransigeant.",31.0,changea,changer,VERB,VERB,Mood=Ind|Number=Sing|Person=3|Tense=Past|VerbForm=Fin,23.0,acl,23:acl,_,1.0
