Unnamed: 0,sent_id,left_context,pivot,right_context,ID,FORM,LEMMA,UPOS,XPOS,FEATS,HEAD,DEPREL,DEPS,MISC,dist
252279,950196,"Non seulement les choix sportifs ont été peu discutés, mais la personnalité de l'homme – dont on disait qu'il avait ",changé, – a généralement été présentée comme séduisante.,24.0,changé,changer,VERB,VERB,Gender=Masc|Number=Sing|Tense=Past|VerbForm=Part,20.0,ccomp,20:ccomp,_,1.0
252294,950267,"Si on change la masse, la période ne ",change, pas et est toujours égale à 16 secondes.,3.0,change,changer,VERB,VERB,Mood=Ind|Number=Sing|Person=3|Tense=Pres|VerbForm=Fin,10.0,advcl,10:advcl,_,1.0
253357,954398,La situation et les hommes ont ,changé,", il est maintenant plus intéressant que les petites communes se regrouppent pour faire face à de plus grands enjeux.",7.0,changé,changer,VERB,VERB,Gender=Masc|Number=Sing|Tense=Past|VerbForm=Part,0.0,root,0:root,SpaceAfter=No,1.0
256702,967492,Non que la réalité ait ,changé,", c'est le regard qui est neuf.",6.0,changé,changer,VERB,VERB,Gender=Masc|Number=Sing|Tense=Past|VerbForm=Part,11.0,advcl,11:advcl,SpaceAfter=No,3.0
257054,968726,"Or les têtes pensantes du gouvernement semblent ignorer cet argument et, si rien ne ",change,", le taux unique s'appliquera à tous les salariés.",16.0,change,changer,VERB,VERB,Mood=Ind|Number=Sing|Person=3|Tense=Pres|VerbForm=Fin,22.0,advcl,22:advcl,SpaceAfter=No,1.0
257602,970816,"Après avoir modifié sa grille de programme en janvier 2007, la première chaîne de la Société nationale de la radio et de la télévision (SNRT) ",change, dhabillage.,29.0,change,changer,VERB,VERB,Mood=Ind|Number=Sing|Person=3|Tense=Pres|VerbForm=Fin,0.0,root,0:root,_,1.0
258286,973514,"Dans les années 90 en Allemagne, l'opinion au sujet des Onkelz est assez contrasté - certaines personnes continuent à condamner le groupe pour son passé, d'autres admettent que la situation a ",changé, et qu'il faut relativiser les choses aujourd'hui.,36.0,changé,changer,VERB,VERB,Gender=Masc|Number=Sing|Tense=Past|VerbForm=Part,31.0,ccomp,31:ccomp,_,2.0
258465,974199,Nous avons chaque jour à nous laisser ,changer, et conduire par l'Amour qui a brûlé le coeur de Jésus.,8.0,changer,changer,VERB,VERB,VerbForm=Inf,7.0,xcomp,7:xcomp,_,1.0
259699,979007,"En effet, avec le temps, les rides se modifient en fonction de la qualité de la peau qui ",change, et dont les besoins évoluent.,21.0,change,changer,VERB,VERB,Mood=Ind|Number=Sing|Person=3|Tense=Pres|VerbForm=Fin,19.0,acl:relcl,19:acl:relcl,_,1.0
259927,979824,C'est le médium dans lequel les pigments sont en suspension qui ,change,": l'huile, l'eau, la cire.",13.0,change,changer,VERB,VERB,Mood=Ind|Number=Sing|Person=3|Tense=Pres|VerbForm=Fin,11.0,dep,11:dep,SpaceAfter=No,1.0
261910,987253,Il y avait vraiment un mince espoir --j'insiste sur l'adjectif +mince que quelque chose aurait commencé à ,changer," avec une victoire de Rafsandjani"""", explique un ambassadeur occidental en poste à Téhéran.",22.0,changer,changer,VERB,VERB,VerbForm=Inf,20.0,xcomp,20:xcomp,_,3.0
263072,991610,Le paysage lui ne fait que ,changer,", changement souvent vécut comme une perte, car le processus d'artialisation n'a pas eu le temps de faire son oeuvre.",7.0,changer,changer,VERB,VERB,VerbForm=Inf,5.0,xcomp,5:xcomp,SpaceAfter=No,1.0
263622,993581,"Par ailleurs, près de la moitié (47%) des Noirs estiment que l'élection de Barack Obama améliorerait les relations entre les races dans le pays, alors que 48% des Blancs estiment que la situation ne ",changerait, guère.,42.0,changerait,changer,VERB,VERB,Mood=Cnd|Number=Sing|Person=3|Tense=Pres|VerbForm=Fin,37.0,ccomp,37:ccomp,_,1.0
264377,996536,Le poste a ,changé, comme le rugby a changé.,4.0,changé,changer,VERB,VERB,Gender=Masc|Number=Sing|Tense=Past|VerbForm=Part,0.0,root,0:root,_,1.0
