Unnamed: 0,sent_id,left_context,pivot,right_context,ID,FORM,LEMMA,UPOS,XPOS,FEATS,HEAD,DEPREL,DEPS,MISC,dist
11662,43700,"LOL mais bon, y'en a marre de ces pro-N, vous ne prenez jamais les ews PS3 à la légère, vous faites tous ",chier, à la fin.,27.0,chier,chier,VERB,VERB,VerbForm=Inf,15.0,xcomp,15:xcomp,_,1.0
75901,285852,J'espère que vos enfants ne vont pas faire ,chier, les autres alors (ce qui m'étonnerait bien mais ca vous ne le voyez pas parce que vos enfants à vous sont siiiiiiiiiiii adorables) Ce sont des enfants quoi!,10.0,chier,chier,VERB,VERB,VerbForm=Inf,7.0,xcomp,7:xcomp,_,2.0
137897,520367,"C'est un très bon moyen d'écrire des articles, mais c'est pas terrible pour discuter, c'est nul pour voter, et c'est à ",chier, pour gérer les données à la manière d'une base de données.,30.0,chier,chier,VERB,VERB,VerbForm=Inf,22.0,conj,22:conj,_,1.0
185287,699131,"À mon avis, la cabale existe, mais elle n'existe pas sous la forme qu'on voit souvent dénoncée (un groupe de pression organisé exprès pour faire ",chier, les honnêtes gens).,31.0,chier,chier,VERB,VERB,VerbForm=Inf,27.0,xcomp,27:xcomp,_,2.0
208046,784847,"Et c'est parti dans les rues de Delhi, a aller dans une nouvelle guesthouse qui se situe a 7-8 km de la boite (fait ",chier, car l'ancienne se trouvait a 500m).,30.0,chier,chier,VERB,VERB,VerbForm=Inf,0.0,root,0:root,_,2.0
218740,824925,"Cowboy : Flatout Ultimate Carnage ne vaut pas la peine d'être joué, c'est flatout 2 avec des effets nesqugene et des morceaux a ",chié, (Fini le demon speeding).,27.0,chié,chier,VERB,VERB,Gender=Masc|Number=Sing|Tense=Past|VerbForm=Part,25.0,acl,25:acl,_,3.0
256490,966667,"Ce qui me gêne, c'est pas qu'ils fassent de la musique à ",chier,", c'est surtout qu'ils le fassent avec une telle prétention et une telle arrogance.",16.0,chier,chier,VERB,VERB,VerbForm=Inf,11.0,xcomp,11:xcomp,SpaceAfter=No,1.0
