Unnamed: 0,sent_id,left_context,pivot,right_context,ID,FORM,LEMMA,UPOS,XPOS,FEATS,HEAD,DEPREL,DEPS,MISC,dist
258582,974601,"Ce sport est toujours bien vivant au coeur de la population et de notre communauté d'affaires», ont-ils unanimement ",constaté,.Le blitz se déroulera sur une période de trois semaines.,23.0,constaté,constater,VERB,VERB,Gender=Masc|Number=Sing|Tense=Past|VerbForm=Part,6.0,parataxis,6:parataxis,SpaceAfter=No,1.0
259534,978307,"La grande surface devait d'ailleurs ouvrir ses portes ce dimanche, mais la grève s'y est poursuive, ce qu'est venu ",constater, un huissier de justice.,25.0,constater,constater,VERB,VERB,VerbForm=Inf,24.0,xcomp,24:xcomp,_,1.0
260365,981392,"Nous avons encore énormément de travail"""", ",constate," Sabine Pakora, 28 ans, comédienne et professeur de danse africaine à Paris, qui joue la femme forte.",9.0,constate,constater,VERB,VERB,Mood=Ind|Number=Sing|Person=3|Tense=Pres|VerbForm=Fin,2.0,parataxis,2:parataxis,_,2.0
261135,984315,"Et Utah ne s'est pas privé pour enfoncer un peu plus les Magics dans leurs errements actuels : """"On a été complétement tétanisés"""", ",constatait," Van Gundy, coach floridien.",28.0,constatait,constater,VERB,VERB,Mood=Ind|Number=Sing|Person=3|Tense=Imp|VerbForm=Fin,7.0,parataxis,7:parataxis,_,2.0
261341,985162,"Les fonctions économiques de la route sont aujourd'hui bien perçues par les populations, a ",constaté, le ministre de l'Équipement et des Transports.,16.0,constaté,constater,VERB,VERB,Gender=Masc|Number=Sing|Tense=Past|VerbForm=Part,10.0,parataxis,10:parataxis,_,1.0
262233,988529,"Au point de vue fermeté, capacité à tenir un débat, je ne suis pas inquiet"""" pour elle, mais """"lui c'est un bateleur"""", avec """"une rhétorique extrêmement rodée"""" où il aligne les """"évidences"""", ",constate," Jean-Louis Bianco, codirecteur de campagne.",47.0,constate,constater,VERB,VERB,Mood=Ind|Number=Sing|Person=3|Tense=Pres|VerbForm=Fin,18.0,parataxis,18:parataxis,_,1.0
