Unnamed: 0,sent_id,left_context,pivot,right_context,ID,FORM,LEMMA,UPOS,XPOS,FEATS,HEAD,DEPREL,DEPS,MISC,dist
145431,548737,Personnellement j'ai constaté (pardon je ,constate,) que de plus en plus d'articles sur l'histoire sont au présent.,8.0,constate,constater,VERB,VERB,Mood=Ind|Number=Sing|Person=1|Tense=Pres|VerbForm=Fin,4.0,parataxis,4:parataxis,SpaceAfter=No,1.0
147027,554763,"Une chose est sûre, """" les habitants sont à la fois contents et inquiets, mais sans résistance """", ",constate," Rachel Zenses, une des coordinatrices.",22.0,constate,constater,VERB,VERB,Mood=Ind|Number=Sing|Person=3|Tense=Pres|VerbForm=Fin,4.0,parataxis,4:parataxis,_,1.0
150556,568061,"Mais, contrairement aux accusations publiées par un certain journal indépendant de Kigali, il n'est pas évident que ce soit le gouvernement rwandais qui retienne les fonds, a ",constaté, l'Agence Rwandaise d'Information (ARI).,32.0,constaté,constater,VERB,VERB,Gender=Masc|Number=Sing|Tense=Past|VerbForm=Part,19.0,parataxis,19:parataxis,_,2.0
150993,569821,"Une large majorité du Sénat, soit 60 de ses membres sur 75, a voté en faveur de l'adoption du traité, a ",constaté, une journaliste de l'AFP.,26.0,constaté,constater,VERB,VERB,Gender=Masc|Number=Sing|Tense=Past|VerbForm=Part,16.0,parataxis,16:parataxis,_,1.0
151841,572958,"Les adultes avec des enfants à la maison mangent plus volontiers que les autres du fromage, de la crème glacée, du boeuf, des pizzas et des amuse-gueules salés, ont ",constaté, les chercheurs.,36.0,constaté,constater,VERB,VERB,Gender=Masc|Number=Sing|Tense=Past|VerbForm=Part,0.0,root,0:root,_,1.0
152718,576174,"L'AIE suggère qu'elle va baisser ses prévisions de demande de pétrole pour l'année prochaine"""", a ",constaté," Bart Melek.Pour l'analyste, le marché se trouve ainsi confronté à un déséquilibre entre l'offre, qui reste importante, et la demande.""""",21.0,constaté,constater,VERB,VERB,Gender=Masc|Number=Sing|Tense=Past|VerbForm=Part,3.0,parataxis,3:parataxis,_,3.0
153159,577694,L'inspecteur ,constate, et émet une contravention.,3.0,constate,constater,VERB,VERB,Mood=Ind|Number=Sing|Person=3|Tense=Pres|VerbForm=Fin,0.0,root,0:root,_,1.0
154493,582723,"Tzipi Livni a adhéré à cet approche"""", ",constate, le ministère russe des Affaires étrangères.,11.0,constate,constater,VERB,VERB,Mood=Ind|Number=Sing|Person=3|Tense=Pres|VerbForm=Fin,5.0,parataxis,5:parataxis,_,2.0
154646,583330,"C'est le genre de match où à la fin tu veux lui demander combien c'est de l'heure"""", a simplement pu ",constater," le Français, pourtant N.44 mondial.",26.0,constater,constater,VERB,VERB,VerbForm=Inf,25.0,xcomp,25:xcomp,_,3.0
155747,587435,"Le pape Benoît XVI est arrivé en hélicoptère à Lourdes samedi à 18H30 en provenance de l'aéroport de Tarbes pour la seconde étape, après Paris, de son voyage de quatre jours en France, a ",constaté, un journaliste de l'AFP.,39.0,constaté,constater,VERB,VERB,Gender=Masc|Number=Sing|Tense=Past|VerbForm=Part,6.0,parataxis,6:parataxis,_,1.0
156019,588438,"Même calme chez Tony Oddy, dont le vol Londres-Manchester a été annulé, qui ",constatait,": """"ce qui compte, c'est que tout le monde soit en sécurité.",18.0,constatait,constater,VERB,VERB,Mood=Ind|Number=Sing|Person=3|Tense=Imp|VerbForm=Fin,2.0,acl:relcl,2:acl:relcl,SpaceAfter=No,1.0
163025,614759,"En général, les gens qui sont obligés de prendre leur retraite ne sont pas prêts à le faire, ",constate, M. Schellenberg.,21.0,constate,constater,VERB,VERB,Mood=Ind|Number=Sing|Person=3|Tense=Pres|VerbForm=Fin,16.0,parataxis,16:parataxis,_,1.0
163042,614823,"Inégalement réparties entre les régions"""", leur financement est en outre """"inégal d'une région à l'autre et la dépense n'est pas proportionnelle à l'activité"""", ",constate, l'auteur.,34.0,constate,constater,VERB,VERB,Mood=Ind|Number=Sing|Person=3|Tense=Pres|VerbForm=Fin,15.0,parataxis,15:parataxis,_,1.0
168155,634117,"«L'exercice est prometteur, mais il prend plus de temps que prévu», ",constate," Hans-Rudolf Merz, qui reconnaît la difficulté de désengager l'Etat de certains domaines.",17.0,constate,constater,VERB,VERB,Mood=Ind|Number=Sing|Person=3|Tense=Pres|VerbForm=Fin,5.0,parataxis,5:parataxis,_,1.0
169924,640848,"Les parcs et jardins de la capitale ont été fermés à titre préventif, a ",constaté, un journaliste de l'AFP.,16.0,constaté,constater,VERB,VERB,Gender=Masc|Number=Sing|Tense=Past|VerbForm=Part,10.0,parataxis,10:parataxis,_,1.0
170262,642228,"Pendant que les représentations explosent, ",constate," Robert Hakim, le taux d'occupation en salles diminue.",7.0,constate,constater,VERB,VERB,Mood=Ind|Number=Sing|Person=3|Tense=Pres|VerbForm=Fin,17.0,advcl,17:advcl,_,3.0
172493,650621,"Allégé d'une partie de ses alluvions, le fleuve s'écoule plus vite et avec plus de force, ",constatait, le printemps dernier un rapport du WWF.,21.0,constatait,constater,VERB,VERB,Mood=Ind|Number=Sing|Person=3|Tense=Imp|VerbForm=Fin,12.0,ccomp,12:ccomp,_,3.0
175986,663767,"Le nombre des déclarations (d'euthanasie) est plus élevé que les années précédentes"""", ",constatent,"-elles dans ce rapport, précisant que dans 167 de ces cas il s'agissait d'assistance et non d'euthanasie active.",18.0,constatent,constater,VERB,VERB,Mood=Ind|Number=Plur|Person=3|Tense=Pres|VerbForm=Fin,11.0,parataxis,11:parataxis,SpaceAfter=No,1.0
177282,668673,"Les cinq classes de polyvalence """" ",constatée," """" sont 166 : Non polyvalent (NP) : le manipulateur exerce son activité professionnelle sur un même secteur technique.",7.0,constatée,constater,VERB,VERB,Gender=Fem|Number=Sing|Tense=Past|VerbForm=Part,5.0,acl,5:acl,_,2.0
177578,669850,"Je regrette ce résultat car il y avait la possibilité de faire la culbute au classement"""", ",constatait,", un brin dépité, l'entraîneur marseillais Jean Fernandez.",19.0,constatait,constater,VERB,VERB,Mood=Ind|Number=Sing|Person=3|Tense=Imp|VerbForm=Fin,2.0,parataxis,2:parataxis,SpaceAfter=No,3.0
179562,677406,"Le marché se consolide après avoir subi des pertes importantes cette semaine, sur fond d'apaisement des craintes liées à l'ouragan Gustav"""", ",constatait," Andrey Kryuchenkov, analyste de la maison de courtage Sucden.",27.0,constatait,constater,VERB,VERB,Mood=Ind|Number=Sing|Person=3|Tense=Imp|VerbForm=Fin,4.0,parataxis,4:parataxis,_,1.0
180674,681767,"Ce spectacle-là n'était pas l'expérience d'une vie, ",constatais,"-je, à moins de la vivre pour la première fois.",13.0,constatais,constater,VERB,VERB,Mood=Ind|Number=Sing|Person=3|Tense=Imp|VerbForm=Fin,8.0,parataxis,8:parataxis,SpaceAfter=No,1.0
180906,682757,"Mais que l'on aime ou pas la production des films français, que l'on critique un événement mettant à l'honneur nos conteurs d'histoires nationaux, force est de ",constater, et d'apprécier la venue des jeunes dans le cinéma français.,33.0,constater,constater,VERB,VERB,VerbForm=Inf,31.0,xcomp,31:xcomp,_,2.0
181749,686033,"Plusieurs familles sont obligées de vendre pour payer la maison de retraite"""", ",constate, l'époux d'une pensionnaire de la maison de retraite de Comines.,16.0,constate,constater,VERB,VERB,Mood=Ind|Number=Sing|Person=3|Tense=Pres|VerbForm=Fin,5.0,parataxis,5:parataxis,_,1.0
183443,692230,"Parce que nous mesurons le PIB par habitant, nous pensons savoir si les gens sont satisfaits ou non"""", a ",constaté," le secrétaire général de l'OCDE, Jose Angel Gurria.",24.0,constaté,constater,VERB,VERB,Gender=Masc|Number=Sing|Tense=Past|VerbForm=Part,12.0,parataxis,12:parataxis,_,3.0
183454,692291,"Une personne a été interpellée dès les premières minutes de l'opération, a ",constaté, un photographe de l'AFP.,15.0,constaté,constater,VERB,VERB,Gender=Masc|Number=Sing|Tense=Past|VerbForm=Part,5.0,parataxis,5:parataxis,_,1.0
185492,699732,"«La répartition de la rente pétrolière ne leur est plus aussi favorable», ",constate, Pascal Menges de la banque Lombard Odier Darier Hentsch (LODH).,16.0,constate,constater,VERB,VERB,Mood=Ind|Number=Sing|Person=3|Tense=Pres|VerbForm=Fin,13.0,parataxis,13:parataxis,_,2.0
185544,699872,"Cela concerne les ports arctiques, les navires commerciaux et les brise-glaces, le matériel naval et aéronautique destiné à faciliter la navigation dans la région de la Voie maritime du Nord"""", a ",constaté, le président russe.,38.0,constaté,constater,VERB,VERB,Gender=Masc|Number=Sing|Tense=Past|VerbForm=Part,2.0,parataxis,2:parataxis,_,2.0
185698,700497,"De nouveaux retards, liés notamment à l'absence de bulletins de vote, sont encore venus perturber la reprise du scrutin, ont ",constaté, les observateurs de l'Union européenne et de l'Union africaine.,25.0,constaté,constater,VERB,VERB,Gender=Masc|Number=Sing|Tense=Past|VerbForm=Part,17.0,parataxis,17:parataxis,_,2.0
185848,701015,"Désormais, il sait """"limiter la casse"""", ",constate, son entraîneur.,11.0,constate,constater,VERB,VERB,Mood=Ind|Number=Sing|Person=3|Tense=Pres|VerbForm=Fin,4.0,parataxis,4:parataxis,_,1.0
187081,705692,"«La taille des dossiers ne cesse de grandir et avec elle la charge de travail demandée à chaque parlementaire», ",constate," Philippe Nantermod, vice-président des Jeunes radicaux suisses.",23.0,constate,constater,VERB,VERB,Mood=Ind|Number=Sing|Person=3|Tense=Pres|VerbForm=Fin,14.0,appos,14:appos,_,2.0
189877,716429,"Il pense maintenant que, en raison de la désillusion sarkozyenne, il va réussir à rétablir l'équilibre"""", ",constate," Philippe Nogrix, sénateur (Union centriste-UDF) d'Ille-et-Vilaine, qui organise dans ce département les premiers pas du MoDem.",22.0,constate,constater,VERB,VERB,Mood=Ind|Number=Sing|Person=3|Tense=Pres|VerbForm=Fin,2.0,parataxis,2:parataxis,_,1.0
190381,718323,"En contrepartie, Ba Mekki reçoit comme cadeau l' """"Hlaoua"""" (un pain de sucre de 2 kg), a ",constaté, le journaliste de l'AFP.,25.0,constaté,constater,VERB,VERB,Gender=Masc|Number=Sing|Tense=Past|VerbForm=Part,12.0,parataxis,12:parataxis,_,1.0
191788,723501,"Dans le même quartier, des locaux de la Senelec, la compagnie nationale d'électricité, ont été endommagés à coups de pierre et partiellement incendiés, a ",constaté, un journaliste de l'AFP.,30.0,constaté,constater,VERB,VERB,Gender=Masc|Number=Sing|Tense=Past|VerbForm=Part,20.0,parataxis,20:parataxis,_,3.0
192040,724490,"Les prix de l'énergie, après deux mois de repli, sont repartis à la hausse, ",constate," l'Insee qui évoque aussi la progression des prix des services de loyers, eau et enlèvement des ordures ménagères.",19.0,constate,constater,VERB,VERB,Mood=Ind|Number=Sing|Person=3|Tense=Pres|VerbForm=Fin,14.0,parataxis,14:parataxis,_,1.0
193148,728674,"Une cinquantaine de manifestants, dont un déguisé en poulet, ont protesté à l'extérieur du département d'Etat aux cris de """"Arrêtez le réchauffement climatique maintenant"""", avant d'être interpellés, a ",constaté, un journaliste de l'AFP.,38.0,constaté,constater,VERB,VERB,Gender=Masc|Number=Sing|Tense=Past|VerbForm=Part,13.0,parataxis,13:parataxis,_,1.0
195125,735971,"Sur le site de l'accident, d'énormes blocs de bétons et des barres en acier étaient enchevêtrées entre les piliers restés eux debout, a ",constaté, un journaliste de l'AFP.,28.0,constaté,constater,VERB,VERB,Gender=Masc|Number=Sing|Tense=Past|VerbForm=Part,19.0,parataxis,19:parataxis,_,2.0
195916,739062,"On constate beaucoup d'altération génétique», ",constate," Jean-Marie Mouchel, professeur spécialiste de l'eau à l'université de Jussieu.",2.0,constate,constater,VERB,VERB,Mood=Ind|Number=Sing|Person=3|Tense=Pres|VerbForm=Fin,0.0,root,0:root,_,3.0
196215,740135,"Dans le même temps, des magasins, dont les vitrines ont été brisées, ont été vidés de leur contenu et des dizaines de voitures ont été incendiées en marge de la manifestation, a ",constaté, un journaliste de l'AFP.,37.0,constaté,constater,VERB,VERB,Gender=Masc|Number=Sing|Tense=Past|VerbForm=Part,18.0,parataxis,18:parataxis,_,3.0
199003,751083,"«Cette plongée n'a donc que peu à voir avec la grève, mais est due avant tout au management catastrophique de l'usine depuis la fin de la grève», ",constate, le président de la Nouvelle Boillat.,34.0,constate,constater,VERB,VERB,Mood=Ind|Number=Sing|Person=3|Tense=Pres|VerbForm=Fin,5.0,parataxis,5:parataxis,_,2.0
199175,751737,"Le taux de participation, c'est nettement moins qu'aux présidentielles», a ",constaté, le chef d'un bureau de vote de Dakar.,16.0,constaté,constater,VERB,VERB,Gender=Masc|Number=Sing|Tense=Past|VerbForm=Part,9.0,parataxis,9:parataxis,_,1.0
200984,758434,"Les deux Sud-Coréennes libérées lundi par les talibans en Afghanistan sont rentrées vendredi à Séoul près d'un mois après leur enlèvement, a ",constaté, un journaliste de l'AFP.,25.0,constaté,constater,VERB,VERB,Gender=Masc|Number=Sing|Tense=Past|VerbForm=Part,12.0,parataxis,12:parataxis,_,2.0
202586,764204,Les difficultés ,constatées," aujourd'hui, concernant le nucléaire, l'environnement et la pollution, la chimie, la biologie, le dopage, les manipulations génétiques et la vache folle, sont connues.",3.0,constatées,constater,VERB,VERB,Gender=Fem|Number=Plur|Tense=Past|VerbForm=Part,2.0,acl,2:acl,_,1.0
205732,776281,"Le numérique, ",constate,"-t-il, bouscule les façons d'apprendre.",4.0,constate,constater,VERB,VERB,Mood=Ind|Number=Sing|Person=3|Tense=Pres|VerbForm=Fin,8.0,dep,8:dep,SpaceAfter=No,1.0
206298,778546,"Sur place, la vie suit son cours au milieu des préparatifs de combat, a ",constaté, un correspondant de l'AFP.,17.0,constaté,constater,VERB,VERB,Gender=Masc|Number=Sing|Tense=Past|VerbForm=Part,6.0,parataxis,6:parataxis,_,1.0
207065,781098,"«On a changé de monde, ",constate,"-t-il, les idéologies sont mortes.",8.0,constate,constater,VERB,VERB,Mood=Ind|Number=Sing|Person=3|Tense=Pres|VerbForm=Fin,4.0,parataxis,4:parataxis,SpaceAfter=No,3.0
208359,785977,"Quinze jours plus tard, force est de ",constater, que toutes les grandes nations du football qui étaient supposées malades ont répondu présentes.,9.0,constater,constater,VERB,VERB,VerbForm=Inf,7.0,xcomp,7:xcomp,_,1.0
208423,786204,"«Au fond, ce qui ne marchait pas, c'était le fait d'utiliser un virus standard pour tout le monde», ",constate, le chercheur originaire d'Aix-en-Provence.,26.0,constate,constater,VERB,VERB,Mood=Ind|Number=Sing|Person=3|Tense=Pres|VerbForm=Fin,14.0,parataxis,14:parataxis,_,2.0
209647,790551,"Une fillette de 11 ans a été sauvée jeudi après avoir passé 68 heures sous les décombres de son école à Yingxiu, épicentre du séisme qui a ravagé le sud-ouest de la Chine, a ",constaté, un photographe de l'AFP.,37.0,constaté,constater,VERB,VERB,Gender=Masc|Number=Sing|Tense=Past|VerbForm=Part,8.0,parataxis,8:parataxis,_,1.0
211965,799375,"Les opérations de vote ont normalement débuté dimanche dans plusieurs bureaux de vote à 08H00 (locales et GMT), ont ",constaté, des journalistes de l'AFP.,23.0,constaté,constater,VERB,VERB,Gender=Masc|Number=Sing|Tense=Past|VerbForm=Part,7.0,parataxis,7:parataxis,_,1.0
213411,804742,"Deux groupes, d'une douzaine de tentes chacun et regroupant des irréductibles non rattachés à l'association, demeuraient toutefois de part et d'autre, a ",constaté, un journaliste de l'AFP.,29.0,constaté,constater,VERB,VERB,Gender=Masc|Number=Sing|Tense=Past|VerbForm=Part,20.0,parataxis,20:parataxis,_,1.0
213502,805132,"Généralement, un dispositif mesh est très lourd à mettre en place"""", ",constate," Andrew Bartram, le nouveau directeur en charge de la zone Europe du Sud pour Ruckus Wireless.",16.0,constate,constater,VERB,VERB,Mood=Ind|Number=Sing|Person=3|Tense=Pres|VerbForm=Fin,9.0,parataxis,9:parataxis,_,3.0
214144,807554,"Ils (les employés) étaient moins susceptibles d'accomplir des tâches additionnelles comme travailler plus longtemps ou le week-end, et étaient en général moins satisfaits de leur travail"""", ont ",constaté, les auteurs de l'étude.,36.0,constaté,constater,VERB,VERB,Gender=Masc|Number=Sing|Tense=Past|VerbForm=Part,29.0,parataxis,29:parataxis,_,1.0
218870,825395,"«Les femmes, les personnes âgées et les personnes au bas revenu pratiquent trop peu d'activité physique», ",constate, M. Manser.,22.0,constate,constater,VERB,VERB,Mood=Ind|Number=Sing|Person=3|Tense=Pres|VerbForm=Fin,14.0,parataxis,14:parataxis,_,2.0
219305,826911,"Environ 250 personnes se sont retrouvées à Bordeaux, a ",constaté, un journaliste de l'AFP.,11.0,constaté,constater,VERB,VERB,Gender=Masc|Number=Sing|Tense=Past|VerbForm=Part,6.0,parataxis,6:parataxis,_,2.0
220128,830096,"C'est effectivement sa liberté de ne pas avoir d'enfant, ",constate, Me Ghelber.,14.0,constate,constater,VERB,VERB,Mood=Ind|Number=Sing|Person=3|Tense=Pres|VerbForm=Fin,6.0,parataxis,6:parataxis,_,2.0
221010,833612,"Si votre long métrage concourt pour le meilleur film et que nombre de ses acteurs sont nommés, votre campagne a de bonnes chances de gagner de l'élan"""", a ",constaté, M. O'Connell.,33.0,constaté,constater,VERB,VERB,Gender=Masc|Number=Sing|Tense=Past|VerbForm=Part,21.0,parataxis,21:parataxis,_,3.0
223563,843068,"Des manifestants palestiniens ont mis à sac hier les bureaux du quartier général de l'ONU à Gaza lors d'une manifestation contre les bombardements israéliens du village libanais de Cana, a ",constaté, un journaliste de l'AFP.,34.0,constaté,constater,VERB,VERB,Gender=Masc|Number=Sing|Tense=Past|VerbForm=Part,5.0,parataxis,5:parataxis,_,1.0
224557,847104,Le contrôle ,constate,", mesure les écarts à la norme et en rend compte.",3.0,constate,constater,VERB,VERB,Mood=Ind|Number=Sing|Person=3|Tense=Pres|VerbForm=Fin,0.0,root,0:root,SpaceAfter=No,1.0
225053,848903,"Pour les fosses de stockages, le préfet de région fixe par arrêté les coûts plafonds sur la base des prix moyens effectivement ",constatés, et selon les modalités de calcul précisées en annexe 3 du présent arrêté.,24.0,constatés,constater,VERB,VERB,Gender=Masc|Number=Plur|Tense=Past|VerbForm=Part,21.0,acl,21:acl,_,2.0
225095,849080,"L'entretien avait débuté à 14 heures locales (15 heures suisses), a ",constaté, un photographe de l'AFP.,16.0,constaté,constater,VERB,VERB,Gender=Masc|Number=Sing|Tense=Past|VerbForm=Part,4.0,parataxis,4:parataxis,_,1.0
227968,859874,"Tous ceux qui soutenaient Jean-Pierre et sa famille ont eu des déprédations à leur tour"""", ",constate, une jeune résidente qui désire conserver l'anonymat.,19.0,constate,constater,VERB,VERB,Mood=Ind|Number=Sing|Person=3|Tense=Pres|VerbForm=Fin,11.0,parataxis,11:parataxis,_,1.0
228253,860956,"On côtoie son jardinier, sa femme de ménage mais ça ne veut pas dire que l'on ait la moindre relation avec eux», ",constate," cruellement Lisa Navarette, porte-parole du Conseil national de La Raza, une organisation de défense des droits des hispaniques.",27.0,constate,constater,VERB,VERB,Mood=Ind|Number=Sing|Person=3|Tense=Pres|VerbForm=Fin,2.0,parataxis,2:parataxis,_,1.0
231154,871526,"Le bilan de ces aides qui atteignent le montant considérable de 6 milliards d'euros apparaît très décevant"""", ",constate, la Cour des comptes.,21.0,constate,constater,VERB,VERB,Mood=Ind|Number=Sing|Person=3|Tense=Pres|VerbForm=Fin,16.0,parataxis,16:parataxis,_,1.0
231631,873275,"Des inscriptions «soutien aux incendies en Grèce» et «insurrection à venir» ont aussi été retrouvées sur une porte de garage voisine de même que celle «insurrection partout» en face du consulat, a ",constaté, un photographe de l'AFP.,40.0,constaté,constater,VERB,VERB,Gender=Masc|Number=Sing|Tense=Past|VerbForm=Part,19.0,parataxis,19:parataxis,_,1.0
233148,879010,"Les habitudes de consommation sont en train de changer, a ",constaté, le directeur de l'USMB Balz Horber.,12.0,constaté,constater,VERB,VERB,Gender=Masc|Number=Sing|Tense=Past|VerbForm=Part,7.0,parataxis,7:parataxis,_,1.0
235783,888994,"Les vacances de Pâques présentent généralement une bonne et une moins bonne semaine, ",constate," le directeur du tourisme de Knokke-Heist, André Desmidt.",15.0,constate,constater,VERB,VERB,Mood=Ind|Number=Sing|Person=3|Tense=Pres|VerbForm=Fin,5.0,parataxis,5:parataxis,_,1.0
236879,893090,"L'accès routier à l'aéroport a également été rouvert, a ",constaté, un journaliste de l'AFP.,13.0,constaté,constater,VERB,VERB,Gender=Masc|Number=Sing|Tense=Past|VerbForm=Part,10.0,parataxis,10:parataxis,_,1.0
237748,896193,"Une vingtaine de salariés intérimaires sans-papiers, soutenus par la CGT, occupaient vendredi une agence d'intérim Manpower près de la gare de Lyon à Paris pour exiger leur régularisation, a ",constaté, un photographe de l'AFP.,34.0,constaté,constater,VERB,VERB,Gender=Masc|Number=Sing|Tense=Past|VerbForm=Part,13.0,parataxis,13:parataxis,_,1.0
237906,896799,"On va utiliser cette eau pour laver, nettoyer et boire, même si elle est sale et véhicule des maladies mais nous sommes obligés de l'utiliser"""", ",constate, Hussein Ali Abdoul Amir.,31.0,constate,constater,VERB,VERB,Mood=Ind|Number=Sing|Person=3|Tense=Pres|VerbForm=Fin,2.0,parataxis,2:parataxis,_,2.0
241890,911751,"Ils ne sont pas nombreux, et c'est inquiétant au vu de ce qu'ils ont été en mesure de faire, cela montre la fragilité du régime"""", ",constate, un diplomate.,32.0,constate,constater,VERB,VERB,Mood=Ind|Number=Sing|Person=3|Tense=Pres|VerbForm=Fin,5.0,parataxis,5:parataxis,_,1.0
243084,916193,Les dégradations ,constatées, et évaluées appellent réparation matérielle et (ou) financière.,3.0,constatées,constater,VERB,VERB,Gender=Fem|Number=Plur|Tense=Past|VerbForm=Part,2.0,acl,2:acl,_,1.0
247795,933881,"On doit aller rechercher des signes de belgitude au fond de nos tiroirs, ",constate, Vincent Yzerbyt.,16.0,constate,constater,VERB,VERB,Mood=Ind|Number=Sing|Person=3|Tense=Pres|VerbForm=Fin,3.0,parataxis,3:parataxis,_,2.0
248308,935738,"La route entre El Ayoun et Tarfaya (sud du Maroc), à une centaine de kilomètres plus au nord, a été coupée à cause de la crue de l'oued Aoudri, a ",constaté, un journaliste de l'AFP.,37.0,constaté,constater,VERB,VERB,Gender=Masc|Number=Sing|Tense=Past|VerbForm=Part,25.0,parataxis,25:parataxis,_,1.0
248405,936093,"Environ 7.000 manifestants étaient présents dans les rues d'Erevan, a ",constaté, un journaliste de l'AFP.,13.0,constaté,constater,VERB,VERB,Gender=Masc|Number=Sing|Tense=Past|VerbForm=Part,5.0,parataxis,5:parataxis,_,2.0
251189,946362,"Le pays pourrait extraire trois millions de barils par jour, il n'en produit plus que deux"""", ",constate," Philippe Sébille-Lopez, consultant en géopolitique des hydrocarbures et spécialiste du Nigeria.",22.0,constate,constater,VERB,VERB,Mood=Ind|Number=Sing|Person=3|Tense=Pres|VerbForm=Fin,4.0,parataxis,4:parataxis,_,1.0
251423,947156,"Les écoles africaines traversent une période de crise, a ",constaté," Mamadou Lamine Traoré, le ministre de l'Éducation nationale, qui a indexé, à l'occasion, les bouleversements sociaux et les mutations que connaît le continent.",11.0,constaté,constater,VERB,VERB,Gender=Masc|Number=Sing|Tense=Past|VerbForm=Part,4.0,parataxis,4:parataxis,_,1.0
252740,952041,"Un des deux derniers champions d'Europe va sans doute y passer"""", ",constate, le champion du monde 2003.,15.0,constate,constater,VERB,VERB,Mood=Ind|Number=Sing|Person=3|Tense=Pres|VerbForm=Fin,8.0,parataxis,8:parataxis,_,2.0
252833,952391,"La première réaction de la communauté internationale, ",constate," toutefois un pêcheur, nous fera réfléchir à deux fois avant de venir en aide à d'autres immigrants clandestins"""".",10.0,constate,constater,VERB,VERB,Mood=Ind|Number=Sing|Person=3|Tense=Pres|VerbForm=Fin,4.0,acl,4:acl,_,2.0
253373,954445,"Chaque montréalais génère en moyenne plus de 508 kg de matières résiduelles par année, ce qui représente des coûts environnementaux et monétaires importants, ",constatent, les hautes instances de la Ville de Montréal.,26.0,constatent,constater,VERB,VERB,Mood=Ind|Number=Plur|Person=3|Tense=Pres|VerbForm=Fin,3.0,parataxis,3:parataxis,_,3.0
253467,954785,"Le problème du terrorisme se résoudra vec la culture et l'éducation"""", s'est écrié en espagnol Chao mardi soir devant 4.000 spectateurs, en grande majorité hispaniques, a ",constaté, une journaliste de l'AFP.,33.0,constaté,constater,VERB,VERB,Gender=Masc|Number=Sing|Tense=Past|VerbForm=Part,6.0,parataxis,6:parataxis,_,1.0
254817,960347,"La taille des transactions ne cesse en effet de s'accroître. « On voit passer beaucoup de gros dossiers de 150 à 500 hectares », ",constate," Philippe Gourmain, même si plus de 90 % des transactions se font sur moins de 25 hectares.",28.0,constate,constater,VERB,VERB,Mood=Ind|Number=Sing|Person=3|Tense=Pres|VerbForm=Fin,15.0,parataxis,15:parataxis,_,1.0
257124,968952,"Celle-ci est pourtant loin d'être appliquée de manière uniforme, a ",constaté, le gouvernement.,15.0,constaté,constater,VERB,VERB,Gender=Masc|Number=Sing|Tense=Past|VerbForm=Part,9.0,parataxis,9:parataxis,_,1.0
257850,971776,"Certaines musulmanes pratiquantes n'ont pas de relation directe avec l'équipe soignante. """" On est obligé de passer par le mari : lui seul peut nous parler, ",constate," Isabelle Allais, infirmière à l'hôpital intercommunal de Créteil.",31.0,constate,constater,VERB,VERB,Mood=Ind|Number=Sing|Person=3|Tense=Pres|VerbForm=Fin,18.0,parataxis,18:parataxis,_,1.0
258284,973497,"Dans le canton de Berne, le niveau de la fiscalité peut être qualifié de satisfaisant, ",constatait, le député socialiste de Tramelan Christophe Gagnebin dans une motion déposée en février dernier.,18.0,constatait,constater,VERB,VERB,Mood=Ind|Number=Sing|Person=3|Tense=Imp|VerbForm=Fin,12.0,parataxis,12:parataxis,_,2.0
