Unnamed: 0,sent_id,left_context,pivot,right_context,ID,FORM,LEMMA,UPOS,XPOS,FEATS,HEAD,DEPREL,DEPS,MISC,dist
13245,49521,"Cela donne un recueil de portraits, observés, ",fantasmés,... mais tous vraisemblables.,10.0,fantasmés,fantasmer,VERB,VERB,Gender=Masc|Number=Plur|Tense=Past|VerbForm=Part,8.0,conj,8:conj,SpaceAfter=No,1.0
50085,189024,"Si donc on veut être juste avec la Traumdeutung, la grammaire philosophique de verbes comme """"souhaiter"""", """"",fantasmer,", """"agir"""" ou """"symboliser"""" doit servir de base au commentaire.",22.0,fantasmer,fantasmer,VERB,VERB,VerbForm=Inf,0.0,root,0:root,SpaceAfter=No,1.0
73251,276152,Dans un pays qui n'a jamais vraiment arrêté de ,fantasmer," autour de Mai-68, la prise de la Sorbonne sonne comme une alerte à un risque potentiel d'embrasement».",11.0,fantasmer,fantasmer,VERB,VERB,VerbForm=Inf,9.0,xcomp,9:xcomp,_,2.0
80017,300936,Une édition longtemps ,fantasmée," qui contiendra entre autres un tout nouveau montage du film supervisé par Ridley Scott, sa """"Final Cut"""" comme elle a été appelée.",4.0,fantasmée,fantasmer,VERB,VERB,Gender=Fem|Number=Sing|Tense=Past|VerbForm=Part,2.0,acl,2:acl,_,1.0
219984,829562,Mes débuts à la télé narre sur le mode hystérico-narcissique l'ascension tant réelle que ,fantasmée, de cette midinette de sous-préfecture.,18.0,fantasmée,fantasmer,VERB,VERB,Gender=Fem|Number=Sing|Tense=Past|VerbForm=Part,16.0,ccomp,16:ccomp,_,1.0
260404,981495,"Et pour d'autres types de musiques, la """"nationalité"""" se rapporterait à une tradition musicale plus ou moins folklorique (et parfois ",fantasmée,") : Rhapsodie hongroise, marche turque, valse viennoise,...",26.0,fantasmée,fantasmer,VERB,VERB,Gender=Fem|Number=Sing|Tense=Past|VerbForm=Part,22.0,conj,22:conj,SpaceAfter=No,3.0
