Unnamed: 0,sent_id,left_context,pivot,right_context,ID,FORM,LEMMA,UPOS,XPOS,FEATS,HEAD,DEPREL,DEPS,MISC,dist
132997,502315,"Nous n'avons pas hésité lorsque la solidarité s'imposait"""", a ",insisté," Schröder, rappelant le soutien de Berlin au lendemain des attentats du 11 septembre 2001.",14.0,insisté,insister,VERB,VERB,Gender=Masc|Number=Sing|Tense=Past|VerbForm=Part,5.0,parataxis,5:parataxis,_,2.0
135379,511221,«Je dis que cette guerre relève de la responsabilité commune du peuple et des gouvernements ils ,insistent," pour poursuivre leur croisade contre notre nation et piller nos richesses», a martelé le chef d'al-Qaïda.",18.0,insistent,insister,VERB,VERB,Mood=Ind|Number=Plur|Person=3|Tense=Pres|VerbForm=Fin,3.0,ccomp,3:ccomp,_,3.0
135414,511340,"Un résultat que nous avons obtenu sans changer le mix produit de l'entreprise"""", ",insiste, Olivier de la Clergerie.,18.0,insiste,insister,VERB,VERB,Mood=Ind|Number=Sing|Person=3|Tense=Pres|VerbForm=Fin,3.0,parataxis,3:parataxis,_,1.0
140068,528460,"Nous avons besoin de ça, d'un rendez-vous où les musiciens se rencontrent intimement"""", ",insiste, le virtuose.,19.0,insiste,insister,VERB,VERB,Mood=Ind|Number=Sing|Person=3|Tense=Pres|VerbForm=Fin,3.0,parataxis,3:parataxis,_,1.0
143304,541071,"L'Autriche, qui doit prendre la présidence tournante de l'UE le 1er janvier, «a simplement ",insisté," pour que les efforts croates (en vue de rejoindre l'Union) soient jugés à leur juste mesure», a-t-il affirmé.",20.0,insisté,insister,VERB,VERB,Gender=Masc|Number=Sing|Tense=Past|VerbForm=Part,0.0,root,0:root,_,1.0
144849,546519,"Cette avancée ne doit pas provoquer """"un sentiment erroné de sécurité"""", ",insistent, les organismes.,15.0,insistent,insister,VERB,VERB,Mood=Ind|Number=Plur|Person=3|Tense=Pres|VerbForm=Fin,4.0,parataxis,4:parataxis,_,1.0
146815,553921,"La pomme de terre péruvienne est arrivée en Europe en 1570 et la chilienne 241 années plus tard, en 1811, ",insiste,"-t-il encore, en citant David Spooner, un scientifique de l'Université du Wisconsin, aux Etats-Unis.",23.0,insiste,insister,VERB,VERB,Mood=Ind|Number=Sing|Person=3|Tense=Pres|VerbForm=Fin,7.0,parataxis,7:parataxis,SpaceAfter=No,1.0
148982,562265,"Il assure protéger les Français dans l'Europe, mais il est en pointe pour recycler le projet de constitution"""", ",insiste, le journal.,23.0,insiste,insister,VERB,VERB,Mood=Ind|Number=Sing|Person=3|Tense=Pres|VerbForm=Fin,2.0,parataxis,2:parataxis,_,1.0
151408,571354,"Il faut respecter la séparation entre le pouvoir judiciaire et le gouvernement, ",insiste," Réal Ménard, porte-parole du Bloc en matière de justice.",14.0,insiste,insister,VERB,VERB,Mood=Ind|Number=Sing|Person=3|Tense=Pres|VerbForm=Fin,2.0,parataxis,2:parataxis,_,1.0
152140,574055,"Notre sport ira mieux bientôt», a ",insisté, Jean-René Bernaudeau qui veut que ses hommes s'inspire des prestations de Fédrigo et Florencio.,9.0,insisté,insister,VERB,VERB,Gender=Masc|Number=Sing|Tense=Past|VerbForm=Part,3.0,parataxis,3:parataxis,_,1.0
153099,577475,"La coalition gouvernementale est «finie», a ",insisté," l'ancien ministre, en appelant à des élections anticipées.",10.0,insisté,insister,VERB,VERB,Gender=Masc|Number=Sing|Tense=Past|VerbForm=Part,6.0,parataxis,6:parataxis,_,1.0
155986,588282,"Nous voulons inviter tout le monde, y compris ceux qui ne connaissent pas l'Eglise"""", a ",insisté," Pierre Touzel, 23 ans, coordinateur national des JMJ.",21.0,insisté,insister,VERB,VERB,Gender=Masc|Number=Sing|Tense=Past|VerbForm=Part,3.0,parataxis,3:parataxis,_,1.0
157066,592325,"Sauf qu'on devra éviter les punitions"""", a ",insisté, l'entraîneur.,11.0,insisté,insister,VERB,VERB,Gender=Masc|Number=Sing|Tense=Past|VerbForm=Part,4.0,parataxis,4:parataxis,_,1.0
158872,598983,"Mais il n'est pas certain que cela suffise à faire baisser les cours. « L'agriculture ce n'est pas l'Opep, il ne suffit pas d'ouvrir les vannes pour jouer sur les cours », ",insiste, un responsable syndical agricole.,41.0,insiste,insister,VERB,VERB,Mood=Ind|Number=Sing|Person=3|Tense=Pres|VerbForm=Fin,24.0,parataxis,24:parataxis,_,3.0
159101,599888,"La gauche doit se réapproprier avec fierté le mot et la chose"""", ",insiste," Bertrand Delanoë qui ne veut plus que les mots """"concurrence"""" et """"compétition"""" soient considérés par la gauche comme """"des gros mots"""".",15.0,insiste,insister,VERB,VERB,Mood=Ind|Number=Sing|Person=3|Tense=Pres|VerbForm=Fin,3.0,parataxis,3:parataxis,_,1.0
162325,612118,"Nous ne parviendrons jamais à un accord avec eux Ils nous ont trahis"""", a ",insisté, Marcos.,17.0,insisté,insister,VERB,VERB,Gender=Masc|Number=Sing|Tense=Past|VerbForm=Part,13.0,parataxis,13:parataxis,_,1.0
164977,621946,"Ce n'est pas un choix pour nous de travailler ensemble, c'est un devoir"""", a ",insisté, M. Sarkozy lors de la cérémonie d'ouverture.,20.0,insisté,insister,VERB,VERB,Gender=Masc|Number=Sing|Tense=Past|VerbForm=Part,0.0,root,0:root,_,1.0
167697,632341,"Ce sont les Américains eux-mêmes qui ont informé les Britanniques, a ",insisté, l'administration.,15.0,insisté,insister,VERB,VERB,Gender=Masc|Number=Sing|Tense=Past|VerbForm=Part,4.0,parataxis,4:parataxis,_,1.0
167833,632872,"Quand la prévention a échoué ou a montré ses limites: il faut aussi passer à la sanction"""", a en outre ",insisté, le ministre.,24.0,insisté,insister,VERB,VERB,Gender=Masc|Number=Sing|Tense=Past|VerbForm=Part,13.0,parataxis,13:parataxis,_,1.0
169172,638023,"«Chaque pays a le droit de choisir son bouquet énergétique», a ",insisté," le président de l'Union, Wolfgang Schüssel.",15.0,insisté,insister,VERB,VERB,Gender=Masc|Number=Sing|Tense=Past|VerbForm=Part,4.0,parataxis,4:parataxis,_,2.0
173707,655202,"France-Italie: le match de la peur"""", ",insiste," Le Figaro, soulignant que les Italiens sont, comme les Français, """"au bord du naufrage"""".",13.0,insiste,insister,VERB,VERB,Mood=Ind|Number=Sing|Person=3|Tense=Pres|VerbForm=Fin,2.0,parataxis,2:parataxis,_,3.0
175338,661459,Si un contributeur refuse cela et ,insiste, pour mettre le lien alors on agira différement.,7.0,insiste,insister,VERB,VERB,Mood=Ind|Number=Sing|Person=3|Tense=Pres|VerbForm=Fin,4.0,conj,4:conj,_,2.0
175666,662632,L'Autriche ,insistait," initialement pour revoir le premier compromis sur l'ouverture des négociations avec Ankara, trouvé en décembre 2004 par l'ensemble des chefs d'Etat et de gouvernement de l'UE, y compris son chancelier Wolfgang Schà¼ssel.",3.0,insistait,insister,VERB,VERB,Mood=Ind|Number=Sing|Person=3|Tense=Imp|VerbForm=Fin,0.0,root,0:root,_,1.0
181869,686458,"Bernanke a plaidé pour un plan de relance immédiat, tout en ",insistant, pour qu'il soit temporaire et bien ciblé afin d'éviter tout dérapage budgétaire.,13.0,insistant,insister,VERB,VERB,Tense=Pres|VerbForm=Part,3.0,advcl,3:advcl,_,2.0
182025,687047,"La prévision du FMI souligne la nécessité d'éviter de pénaliser la croissance"""", ",insiste," le ministre de l'Economie allemand qui veut poursuivre les réformes, notamment sur le marché du travail.",16.0,insiste,insister,VERB,VERB,Mood=Ind|Number=Sing|Person=3|Tense=Pres|VerbForm=Fin,5.0,parataxis,5:parataxis,_,1.0
183471,692363,"L'initiative en revint à Philippe Burty, qui ",insista, longuement auprès de Victor Hugo pour publier ses dessins.,10.0,insista,insister,VERB,VERB,Mood=Ind|Number=Sing|Person=3|Tense=Past|VerbForm=Fin,6.0,acl:relcl,6:acl:relcl,_,1.0
184324,695499,"Il ne s'agit d'ailleurs en aucun cas, selon lui, d'une """" lutte personnelle avec Sarkozy """" : """" Je ne cède pas à la menace """", a ",insisté, le candidat de Debout la République.,34.0,insisté,insister,VERB,VERB,Gender=Masc|Number=Sing|Tense=Past|VerbForm=Part,4.0,parataxis,4:parataxis,_,1.0
184406,695802,"Nous n'envisageons pas du tout d'abandonner Iter"""", a ",insisté," M. Sakata, en jugeant improbable la conclusion d'un accord global en mai.",13.0,insisté,insister,VERB,VERB,Gender=Masc|Number=Sing|Tense=Past|VerbForm=Part,3.0,parataxis,3:parataxis,_,1.0
185559,699940,"Il faut appliquer la loi avec intelligence"""", ",insiste, M. Bouakkaz.,10.0,insiste,insister,VERB,VERB,Mood=Ind|Number=Sing|Person=3|Tense=Pres|VerbForm=Fin,2.0,parataxis,2:parataxis,_,2.0
185974,701512,"Les témoignages des victimes concordent, des documents accablants parviennent les uns après les autres à la lumière, mais le président George W. Bush ",insiste,: la torture ne fait pas partie de l'arsenal américain contre le terrorisme.,26.0,insiste,insister,VERB,VERB,Mood=Ind|Number=Sing|Person=3|Tense=Pres|VerbForm=Fin,5.0,conj,5:conj,SpaceAfter=No,1.0
186662,704138,"C'était cela, notre héritage collectif », ",insiste," Padraic White, l'un des pères des réformes économiques qui sont à l'origine du miracle.",10.0,insiste,insister,VERB,VERB,Mood=Ind|Number=Sing|Person=3|Tense=Pres|VerbForm=Fin,3.0,parataxis,3:parataxis,_,1.0
188396,710639,Certains programmes mal écrits peuvent en être gênés ; contactez votre revendeur et ,insistez, pour qu'il corrige son code si cela arrivait.,14.0,insistez,insister,VERB,VERB,Mood=Ind|Number=Plur|Person=2|Tense=Pres|VerbForm=Fin,10.0,conj,10:conj,_,1.0
190668,719369,"Nous devons maintenant entamer de vraies négociations et de vraies discussions entre les premiers ministres provinciaux et le gouvernement fédéral», a ",insisté, M. Lord.,24.0,insisté,insister,VERB,VERB,Gender=Masc|Number=Sing|Tense=Past|VerbForm=Part,2.0,parataxis,2:parataxis,_,2.0
192028,724457,"Meiwes, qui a toujours reconnu les faits, a une nouvelle fois affirmé que sa victime avait ",insisté, pour qu'il la tue.,19.0,insisté,insister,VERB,VERB,Gender=Masc|Number=Sing|Tense=Past|VerbForm=Part,14.0,ccomp,14:ccomp,_,1.0
193516,730227,"Ainsi, la préservation en rive du couvert végétal protégerait la barrière visuelle et ferait, du coup, écran au développement domiciliaire dans l'île, ",insiste,-t-il en pensant aux propriétaires riverains.,28.0,insiste,insister,VERB,VERB,Mood=Ind|Number=Sing|Person=3|Tense=Pres|VerbForm=Fin,10.0,parataxis,10:parataxis,SpaceAfter=No,2.0
194707,734475,"SAN JUAN, Porto Rico (AP) - Alors qu'il se tient bien loin de la quête de Barry Bonds, Hank Aaron ",insiste, pour dire que son silence vaut mille mots.,26.0,insiste,insister,VERB,VERB,Mood=Ind|Number=Sing|Person=3|Tense=Pres|VerbForm=Fin,0.0,root,0:root,_,1.0
195352,736892,"Depuis 20-25 ans, les menaces évoluent, elles sont de plus en plus hybrides et les pirates se professionnalisent"""", ",insiste," d'emblée Thierry Bedos, directeur de McAfee France.",26.0,insiste,insister,VERB,VERB,Mood=Ind|Number=Sing|Person=3|Tense=Pres|VerbForm=Fin,10.0,parataxis,10:parataxis,_,2.0
196069,739606,"Si le Polisario continue à exiger un référendum pour l'indépendance, le Maroc le rejettera de nouveau et le Conseil de sécurité (de l'ONU) va ",insister, pour trouver un accord consensuel.,31.0,insister,insister,VERB,VERB,VerbForm=Inf,30.0,xcomp,30:xcomp,_,2.0
197209,743987,"La réouverture des stades sera progressive et sera liée au respect des règles sur la sécurité des spectateurs"""", a ",insisté, la ministre des Sports Giovanna Melandri.,23.0,insisté,insister,VERB,VERB,Gender=Masc|Number=Sing|Tense=Past|VerbForm=Part,7.0,parataxis,7:parataxis,_,1.0
199953,754620,"Ainsi, afin d'éviter les risques d'hémorragie digestive, """"une personne sous anticoagulant ne doit jamais prendre d'aspirine"""", ",insiste, M. Queneau.,25.0,insiste,insister,VERB,VERB,Mood=Ind|Number=Sing|Person=3|Tense=Pres|VerbForm=Fin,18.0,parataxis,18:parataxis,_,2.0
200618,757048,Nous avons décidé de saisir toutes les opportunités pour développer nos relations bilatérales en mobilisant en particulier les secteurs privés des deux pays a ,insisté, le Premier ministre.,25.0,insisté,insister,VERB,VERB,Gender=Masc|Number=Sing|Tense=Past|VerbForm=Part,3.0,advcl,3:advcl,_,1.0
206864,780405,Les rares élus qui ont ,insisté," pour dénoncer le conflit d'intérêts ont à l'inverse été médiatiquement lynchés"""".",6.0,insisté,insister,VERB,VERB,Gender=Masc|Number=Sing|Tense=Past|VerbForm=Part,3.0,acl:relcl,3:acl:relcl,_,2.0
207398,782348,Le capitaine français proteste et ,insiste, pour que Ravioli rejoigne Cornu dans les filets afin que son équipe dispose également d'un gardien à quatre bras.,6.0,insiste,insister,VERB,VERB,Mood=Ind|Number=Sing|Person=3|Tense=Pres|VerbForm=Fin,4.0,conj,4:conj,_,1.0
210241,792624,"Si d'ici là il ne se présente pas à l'hôpital, il y sera amené de force"""", a ",insisté, le gouverneur.,23.0,insisté,insister,VERB,VERB,Gender=Masc|Number=Sing|Tense=Past|VerbForm=Part,17.0,parataxis,17:parataxis,_,1.0
210876,795097,"Avant le problème du logement, se pose la question de la dignité"""", ",insiste," le candidat qui dénonce """"la France à deux vitesses"""" et stigmatise Nicolas Sarkozy l'accusant d'""""instrumentaliser les banlieues et le thème de la sécurité"""".",16.0,insiste,insister,VERB,VERB,Mood=Ind|Number=Sing|Person=3|Tense=Pres|VerbForm=Fin,8.0,parataxis,8:parataxis,_,2.0
214284,808129,"«Il faut faire attention à ce qu'on met sur la plate-forme globale qu'est Internet», ",insiste," Kosmas Tsiraktsopoulos, l'un des collaborateurs du préposé fédéral à la protection des données.",22.0,insiste,insister,VERB,VERB,Mood=Ind|Number=Sing|Person=3|Tense=Pres|VerbForm=Fin,3.0,parataxis,3:parataxis,_,1.0
215690,813187,"Il y aura un débat sur les droits de l'homme, a ",insisté, la présidence portugaise.,14.0,insisté,insister,VERB,VERB,Gender=Masc|Number=Sing|Tense=Past|VerbForm=Part,3.0,parataxis,3:parataxis,_,2.0
218600,824438,"«Fini le mythe de l'État et de l'armée invincible», a ",insisté," Hassan Nasrallah, faisant référence à l'État d'Israël et son armée.",16.0,insisté,insister,VERB,VERB,Gender=Masc|Number=Sing|Tense=Past|VerbForm=Part,2.0,parataxis,2:parataxis,_,1.0
219742,828559,"La France, tout de même, fait partie d'un ensemble européen où le droit est quand même très sourcilleux sur les droits des minorités et les droits des croyances"""", a ",insisté, le président du CFCM.,35.0,insisté,insister,VERB,VERB,Gender=Masc|Number=Sing|Tense=Past|VerbForm=Part,8.0,parataxis,8:parataxis,_,3.0
220068,829915,Heureusement que les producteurs ont ,insisté, pour ramener la durée de ce supplice à 2 h 45 minutes.,6.0,insisté,insister,VERB,VERB,Gender=Masc|Number=Sing|Tense=Past|VerbForm=Part,0.0,root,0:root,_,1.0
220126,830092,"Je suis venu en avion de ligne chez des amis qui me reçoivent"""", a ",insisté, M. Sarkozy.,17.0,insisté,insister,VERB,VERB,Gender=Masc|Number=Sing|Tense=Past|VerbForm=Part,3.0,parataxis,3:parataxis,_,2.0
222779,840054,"Nous devrions renvoyer l'affaire (au juge de première instance) pour que les faits puissent être discutés"""", a ",insisté, le juge David Souter.,23.0,insisté,insister,VERB,VERB,Gender=Masc|Number=Sing|Tense=Past|VerbForm=Part,2.0,parataxis,2:parataxis,_,3.0
223401,842499,"Mais dans la difficulté, dans l'épreuve, on est avec ses amis, on est à leurs côtés, on les soutient, on les aide"""", a ",insisté, le chef de l'Etat français.,32.0,insisté,insister,VERB,VERB,Gender=Masc|Number=Sing|Tense=Past|VerbForm=Part,11.0,parataxis,11:parataxis,_,2.0
225760,851578,"La mère de Théo, qui a ",insisté," pour retrouver son fils, obtient à nouveau la garde de son fils à son domicile.",8.0,insisté,insister,VERB,VERB,Gender=Masc|Number=Sing|Tense=Past|VerbForm=Part,2.0,acl:relcl,2:acl:relcl,_,1.0
227016,856305,"En comparaison des deux milliards d'échanges commerciaux entre les deux pays, ce n'est rien"""", ",insiste, le conseiller fédéral.,21.0,insiste,insister,VERB,VERB,Mood=Ind|Number=Sing|Person=3|Tense=Pres|VerbForm=Fin,18.0,parataxis,18:parataxis,_,1.0
229510,865622,"Dans 116 bassins d'emploi, """"il est impossible de trouver un maçon qualifié"""", ",insiste," Jean-Pierre Revoil, le directeur général de l'Unedic.",18.0,insiste,insister,VERB,VERB,Mood=Ind|Number=Sing|Person=3|Tense=Pres|VerbForm=Fin,10.0,parataxis,10:parataxis,_,2.0
233890,881800,"Le chapitre VII """"n'implique pas nécessairement une action militaire"""" et aucune sanction n'est envisagée dans l'immédiat, ",insiste,"-t-on à Paris, alors que les Etats-Unis n'excluent pas la force.",23.0,insiste,insister,VERB,VERB,Mood=Ind|Number=Sing|Person=3|Tense=Pres|VerbForm=Fin,18.0,advcl,18:advcl,SpaceAfter=No,1.0
234067,882521,Les étudiants ont ,insisté, pour démanteler le réseau.,4.0,insisté,insister,VERB,VERB,Gender=Masc|Number=Sing|Tense=Past|VerbForm=Part,0.0,root,0:root,_,1.0
235904,889404,"Ils ont grandi avec des consoles de jeux, des Game Boy et des cellulaires dont l'image est de mauvaise qualité», ",insiste," Nicolas Girard Deltruc, directeur général du Festival du nouveau cinéma de Montréal.",25.0,insiste,insister,VERB,VERB,Mood=Ind|Number=Sing|Person=3|Tense=Pres|VerbForm=Fin,3.0,parataxis,3:parataxis,_,2.0
237170,894033,Le Président de la République ,insiste," pour dire que s'agissant de ces tueurs, notre justice doit se montrer exemplaire.",6.0,insiste,insister,VERB,VERB,Mood=Ind|Number=Sing|Person=3|Tense=Pres|VerbForm=Fin,0.0,root,0:root,_,1.0
239168,901323,"Vous pouvez emballer un vieux poisson dans du papier et l'appeler changement ; il sentira toujours mauvais après huit ans"""", a ",insisté, le candidat démocrate.,26.0,insisté,insister,VERB,VERB,Gender=Masc|Number=Sing|Tense=Past|VerbForm=Part,17.0,parataxis,17:parataxis,_,2.0
240348,905748,"Le Coran n'interdit pas l'autopsie, mais ",insiste, pour que le plus grand respect soit apporté à la dépouille .,10.0,insiste,insister,VERB,VERB,Mood=Ind|Number=Sing|Person=3|Tense=Pres|VerbForm=Fin,4.0,conj,4:conj,_,1.0
243755,918785,"Il reste encore beaucoup de questions à résoudre"""", ",insiste," Dominique Dron, responsable de la nouvelle chaire de l'Ecole des mines consacrée aux nouvelles stratégies énergétiques.",12.0,insiste,insister,VERB,VERB,Mood=Ind|Number=Sing|Person=3|Tense=Pres|VerbForm=Fin,3.0,parataxis,3:parataxis,_,2.0
244898,922905,"Mais si les troupes africaines ne sont pas mises en place rapidement, ce sera le chaos"""", a lancé M. Konaré, ",insistant, pour que le gouvernement somalien joue la carte de l'ouverture politique.,25.0,insistant,insister,VERB,VERB,Tense=Pres|VerbForm=Part,21.0,advcl,21:advcl,_,2.0
251008,945747,"L'UE reste prête à négocier un accord équilibré pour réduire et finalement éliminer les subventions pour les avions civils de grande capacité"""", a ",insisté, le commissaire européen.,27.0,insisté,insister,VERB,VERB,Gender=Masc|Number=Sing|Tense=Past|VerbForm=Part,3.0,parataxis,3:parataxis,_,2.0
251307,946730,"Berne fera des jalouses chez les Alémaniques"""", ",insiste,"-t-il, saluant le succès de la manifestation sur la place Fédérale en octobre, avec 18000 soutiens-gorge accrochés à une corde à linge.",11.0,insiste,insister,VERB,VERB,Mood=Ind|Number=Sing|Person=3|Tense=Pres|VerbForm=Fin,3.0,parataxis,3:parataxis,SpaceAfter=No,1.0
252613,951549,"Cette victoire, a ",insisté," Daniel Tessier, c'est celle des travailleurs de Saint-Michel.",5.0,insisté,insister,VERB,VERB,Gender=Masc|Number=Sing|Tense=Past|VerbForm=Part,2.0,acl,2:acl,_,1.0
255462,962699,"Paris et Londres """"sont déterminés à rester engagés, côte à côte, avec tous nos alliés, en Afghanistan où, je n'ai pas peur de le dire, une partie essentielle est en train de se jouer"""", a ",insisté, le président français.,45.0,insisté,insister,VERB,VERB,Gender=Masc|Number=Sing|Tense=Past|VerbForm=Part,6.0,parataxis,6:parataxis,_,2.0
256366,966155,"Du reste, les tarifs ne peuvent plus être gelés, a ",insisté," le ministre des Ressources naturelles, à propos des hausses successives qui ont fait grimper la facture de 16,7 pour cent en quatre ans.",13.0,insisté,insister,VERB,VERB,Gender=Masc|Number=Sing|Tense=Past|VerbForm=Part,7.0,parataxis,7:parataxis,_,1.0
257614,970842,"Mais nous voulons un accord pour le climat qui ne déséquilibre pas l'économie de nos Etats"""", a ",insisté," Donald Tusk, le Premier ministre polonais.",22.0,insisté,insister,VERB,VERB,Gender=Masc|Number=Sing|Tense=Past|VerbForm=Part,4.0,parataxis,4:parataxis,_,2.0
258093,972691,"Pour des raisons démographiques et d'autres raisons, je ne pense pas que l'Europe puisse croître assez rapidement pour compenser le ralentissement aux Etats-Unis"""", a ",insisté, le ministre italien au FT.,31.0,insisté,insister,VERB,VERB,Gender=Masc|Number=Sing|Tense=Past|VerbForm=Part,13.0,parataxis,13:parataxis,_,1.0
259784,979287,"L'appartenance religieuse ou l'absence de religion doit rester une affaire de liberté personnelle qui ne regarde pas la collectivité"""", ",insiste," Boël Sambuc, vice-présidente de la CFR.",25.0,insiste,insister,VERB,VERB,Mood=Ind|Number=Sing|Person=3|Tense=Pres|VerbForm=Fin,10.0,parataxis,10:parataxis,_,1.0
259897,979718,"Lors d'une soirée un homme accoste une belle jeune femme et lui propose un dernier verre chez lui, il ",insiste, en lui précisant qu'il est magicien et qu'il lui montrera un tour de magie.,22.0,insiste,insister,VERB,VERB,Mood=Ind|Number=Sing|Person=3|Tense=Pres|VerbForm=Fin,7.0,advcl,7:advcl,_,1.0
259944,979860,"«Mais sans volonté didactique», ",insiste,"-t-elle, et dans le désordre chronologique le plus total.",8.0,insiste,insister,VERB,VERB,Mood=Ind|Number=Sing|Person=3|Tense=Pres|VerbForm=Fin,4.0,parataxis,4:parataxis,SpaceAfter=No,3.0
260516,981890,"S'ils insistent, nous travaillerons dur pour bloquer cette action avec l'assistance de nos amis"""", a ",insisté, le ministre.,21.0,insisté,insister,VERB,VERB,Gender=Masc|Number=Sing|Tense=Past|VerbForm=Part,6.0,parataxis,6:parataxis,_,1.0
260663,982462,"Et pour y arriver, il nous faut bien planifier et organiser la préparation de nos représentants"""", a ",insisté, M. Foli.,21.0,insisté,insister,VERB,VERB,Gender=Masc|Number=Sing|Tense=Past|VerbForm=Part,8.0,parataxis,8:parataxis,_,2.0
263399,992771,"Ce serait nettement plus bénéfique pour les parents de la région», a ",insisté, M. Deslières.,15.0,insisté,insister,VERB,VERB,Gender=Masc|Number=Sing|Tense=Past|VerbForm=Part,5.0,parataxis,5:parataxis,_,2.0
