Unnamed: 0,sent_id,left_context,pivot,right_context,ID,FORM,LEMMA,UPOS,XPOS,FEATS,HEAD,DEPREL,DEPS,MISC,dist
80049,301050,"Alors que, depuis janvier, l'euro s'était envolé vers des records historiques, le sentiment semble s'être ",inversé, et les investisseurs ont révisé leurs positions.,22.0,inversé,inverser,VERB,VERB,Gender=Masc|Number=Sing|Tense=Past|VerbForm=Part,19.0,xcomp,19:xcomp,_,1.0
113095,426852,Là ou Lord of War évitait le piège avec son point de vue moral faussement ,inversé,", Severance fonce tête baissée dans le panneau.",16.0,inversé,inverser,VERB,VERB,Gender=Masc|Number=Sing|Tense=Past|VerbForm=Part,11.0,acl,11:acl,SpaceAfter=No,1.0
181727,685972,"Mais depuis un bon moment maintenant, le rapport de force s'est ",inversé, : les Italiens n'ont plus battu la formation tricolore depuis 1978 et un match du premier tour du Mondial argentin (2-1).,14.0,inversé,inverser,VERB,VERB,Gender=Masc|Number=Sing|Tense=Past|VerbForm=Part,0.0,root,0:root,_,2.0
202050,762273,"Répondant à ceux qui disent que """"la tendance s'est ",inversée,", il a déclaré: """"une hirondelle ne fait pas le printemps"""".",12.0,inversée,inverser,VERB,VERB,Gender=Fem|Number=Sing|Tense=Past|VerbForm=Part,5.0,ccomp,5:ccomp,SpaceAfter=No,3.0
210372,793082,Quand les cours boursiers se sont ,inversés,", il a rasé sa barbe et il s'est mis à faire les yeux doux mais plus personne ne le regardait.",7.0,inversés,inverser,VERB,VERB,Gender=Masc|Number=Plur|Tense=Past|VerbForm=Part,11.0,advcl,11:advcl,SpaceAfter=No,2.0
248508,936497,Une telle fonction est difficile à ,inverser,", à moins de posséder une information particulière, tenue secrète : la clé privée.",7.0,inverser,inverser,VERB,VERB,VerbForm=Inf,5.0,xcomp,5:xcomp,SpaceAfter=No,2.0
259911,979771,"De cette façon, l’amplificateur amplifie une image réduite et ",inversée," des distorsions, ce qui permet d'en diminuer le taux, de linéariser la courbe de réponse tension / fréquence, et d'augmenter la bande passante.",12.0,inversée,inverser,VERB,VERB,Gender=Fem|Number=Sing|Tense=Past|VerbForm=Part,10.0,conj,10:conj,_,2.0
