Unnamed: 0,sent_id,left_context,pivot,right_context,ID,FORM,LEMMA,UPOS,XPOS,FEATS,HEAD,DEPREL,DEPS,MISC,dist
730,2698,Il a besoin de ,marquer," en-dehors de l'entraînement"""".",5.0,marquer,marquer,VERB,VERB,VerbForm=Inf,2.0,xcomp,2:xcomp,_,2.0
9228,34362,"C'est aussi cette """" homosociabilité """" vécue et assumée qui a créé, soutenu et ",marqué," la lutte """" civile """" et civique contre le sida.",17.0,marqué,marquer,VERB,VERB,Gender=Masc|Number=Sing|Tense=Past|VerbForm=Part,13.0,conj,13:conj,_,1.0
9484,35300,Le nouveau renfort du Club a ,marqué, lors du match des réserves contre le FC Malines.,7.0,marqué,marquer,VERB,VERB,Gender=Masc|Number=Sing|Tense=Past|VerbForm=Part,0.0,root,0:root,_,2.0
10076,37510,Frei finit par comprendre qu’il avait plus de chance de ,marquer, en profitant de la lenteur de la défense centrale qu’en essayant de jouer les ballons de la tête.,12.0,marquer,marquer,VERB,VERB,VerbForm=Inf,10.0,acl,10:acl,_,1.0
14055,52396,"Distinguer narrateur et auteur, narrateur explicitement ",marqué," et narrateur implicite, narrateur et observateur (description)",8.0,marqué,marquer,VERB,VERB,Gender=Masc|Number=Sing|Tense=Past|VerbForm=Part,6.0,acl,6:acl,_,1.0
14689,54873,Le silence le plus ,marqué," s'observe chez le grand voisin chinois et principal allié de la junte birmane, dont les journaux phares n'accordent pas une ligne ni une image à ces événements.",5.0,marqué,marquer,VERB,VERB,Gender=Masc|Number=Sing|Tense=Past|VerbForm=Part,0.0,root,0:root,_,1.0
24624,92224,Elle reste localisée aux coteaux aux caractères méditerranéens bien ,marqués,", au sud-est du département.",10.0,marqués,marquer,VERB,VERB,Gender=Masc|Number=Plur|Tense=Past|VerbForm=Part,7.0,acl,7:acl,SpaceAfter=No,1.0
25716,96421,Les Mighty Ducks ont manqué une occasion de remporter le match quand ils ont été incapables de ,marquer, lors d'un avantage numérique en prolongation.,18.0,marquer,marquer,VERB,VERB,VerbForm=Inf,16.0,xcomp,16:xcomp,_,1.0
30902,116508,Ce scrutin ,marquera,-t-il la fin de la crise politique en Kabylie ?,3.0,marquera,marquer,VERB,VERB,Mood=Ind|Number=Sing|Person=3|Tense=Fut|VerbForm=Fin,0.0,root,0:root,SpaceAfter=No,1.0
32397,122091,Voici trois dimensions clairement ,marquées," : on peut aller bien dans son corps, avoir une situation sociale enviable et souffrir pourtant psychiquement.",5.0,marquées,marquer,VERB,VERB,Gender=Fem|Number=Plur|Tense=Past|VerbForm=Part,3.0,acl,3:acl,_,1.0
39163,147395,Le numéro 26 a obtenu quelques bonnes chances de ,marquer, obtenant trois tirs au but.,10.0,marquer,marquer,VERB,VERB,VerbForm=Inf,8.0,acl,8:acl,_,1.0
39420,148381,"Les Brésiliens, tenants du titre, peuvent compter sur un défense de fer et sur Renan, un gardien très rassurant (un but concédé seulement en cinq matches), mais éprouvent depuis le début du tournoi quelques difficultés à ",marquer, (6 buts).,43.0,marquer,marquer,VERB,VERB,VerbForm=Inf,41.0,acl,41:acl,_,1.0
44075,166275,"La BCE a retiré 7 milliards d'euros du circuit monétaire de la zone euro, via une opération de refinancement hebdomadaire ",marquée," de nouveau par une parfaite stabilité des taux, aucun changement monétaire n'étant anticipé à court terme.",23.0,marquée,marquer,VERB,VERB,Gender=Fem|Number=Sing|Tense=Past|VerbForm=Part,19.0,acl,19:acl,_,1.0
46545,175575,"Ce style est l'expression des salles de prêche favorisée par les ordres mendiants qui ont joué un rôle exceptionnel dans la vie religieuse allemande, il en résulte un intérieur avec un sens très ",marqué, de l'unité dans les espaces.,36.0,marqué,marquer,VERB,VERB,Gender=Masc|Number=Sing|Tense=Past|VerbForm=Part,34.0,amod,34:amod,_,1.0
48027,181037,Comme j'avais juste à lever les bras pour ,marquer,", mon surnom était 'Le Mutant'.",10.0,marquer,marquer,VERB,VERB,VerbForm=Inf,6.0,advcl,6:advcl,SpaceAfter=No,2.0
49883,188301,Johnson a estimé que la principale menace pesant sur l'économie mondiale était celle de tensions ,marquées, et durables sur les marchés financiers.,17.0,marquées,marquer,VERB,VERB,Gender=Fem|Number=Plur|Tense=Past|VerbForm=Part,16.0,acl,16:acl,_,2.0
49974,188655,"Comment fonctionnent-elles, en quoi ",marquent,-elles la ville ?,8.0,marquent,marquer,VERB,VERB,Mood=Ind|Number=Plur|Person=3|Tense=Pres|VerbForm=Fin,0.0,root,0:root,SpaceAfter=No,1.0
53143,200381,"Bien sûr qu'il faut, quand la chanson est vraiment notable, a ",marqué, au delà de l'album auquel elle appartient.,15.0,marqué,marquer,VERB,VERB,Gender=Masc|Number=Sing|Tense=Past|VerbForm=Part,0.0,root,0:root,_,3.0
55203,207734,En dépit de ses capacités à ,marquer," et à prendre des rebonds, Zach Randolph a été l'objet de plusieurs critiques en raison de son mauvais caractère.",7.0,marquer,marquer,VERB,VERB,VerbForm=Inf,5.0,acl,5:acl,_,1.0
59274,223077,Stéphane Samson pour l'empêcher de ,marquer, (79è min).,7.0,marquer,marquer,VERB,VERB,VerbForm=Inf,5.0,xcomp,5:xcomp,_,2.0
62156,234381,"C'est ainsi que l'on observe, dans le cas d'un discours, un souci d'explicitation plus ",marqué, qu'en face à face ; ce qui pourrait favoriser une meilleure mémorisation des informations.,21.0,marqué,marquer,VERB,VERB,Gender=Masc|Number=Sing|Tense=Past|VerbForm=Part,17.0,acl,17:acl,_,1.0
64923,244836,C'est d'autant plus dommage que le Racing paraît capable de ,marquer," quand bon lui semble, en se donnant simplement la peine d'appuyer sur l'accélérateur.",13.0,marquer,marquer,VERB,VERB,VerbForm=Inf,11.0,xcomp,11:xcomp,_,1.0
80644,303229,Pauleta (7 buts cette saison) a joué mais n'a pas ,marqué,", Kroupi son adversaire du jour (5 buts) non plus En revanche, Wiltord (Lyon) revient à hauteur du Lorrain.",14.0,marqué,marquer,VERB,VERB,Gender=Masc|Number=Sing|Tense=Past|VerbForm=Part,9.0,conj,9:conj,SpaceAfter=No,3.0
81022,304659,La performance masque une progression bien plus ,marquée," dans la bière, avec une augmentation de 5,6% par rapport à 2006.",8.0,marquée,marquer,VERB,VERB,Gender=Fem|Number=Sing|Tense=Past|VerbForm=Part,5.0,acl,5:acl,_,1.0
82837,311370,Et un avant-centre qui sort sans avoir ,marqué,", il en veut à la terre entière.",8.0,marqué,marquer,VERB,VERB,Gender=Masc|Number=Sing|Tense=Past|VerbForm=Part,5.0,advcl,5:advcl,SpaceAfter=No,2.0
83259,312872,"Les volumes sont en retrait par rapport au premier trimestre 2004, en raison de conditions hivernales plus ",marquées,", mais ceci est assez habituel dans nos métiers, en raison de leur saisonnalité"""".",19.0,marquées,marquer,VERB,VERB,Gender=Fem|Number=Plur|Tense=Past|VerbForm=Part,16.0,acl,16:acl,SpaceAfter=No,1.0
84544,317802,Les derniers indicateurs économiques montrant une inflation persistante et un ralentissement peu ,marqué, de l'activité en Europe incitent le marché à parier sur un nouveau statu quo monétaire de la BCE.,13.0,marqué,marquer,VERB,VERB,Gender=Masc|Number=Sing|Tense=Past|VerbForm=Part,11.0,acl,11:acl,_,2.0
84855,318968,"Au contraire, Brock James profitait de chaque occasion pour ",marquer,", et donnait 17 points d'avance à l'ASM à l'heure de jeu, alors que les deux équipes étaient à nouveau au complet.",11.0,marquer,marquer,VERB,VERB,VerbForm=Inf,6.0,advcl,6:advcl,SpaceAfter=No,1.0
84982,319418,"Il s'agit d'évaluer si je vais monter chez les lourds ou si j'aurai une chance tout de suite chez les lourds-légers"""", poursuivait le Guadeloupéen, étrangement souriant et peu ",marqué, physiquement si ce n'est une main droite douloureuse.,37.0,marqué,marquer,VERB,VERB,Gender=Masc|Number=Sing|Tense=Past|VerbForm=Part,34.0,conj,34:conj,_,2.0
85946,323032,"Les courses d'amateurs, qui vivotent à peine, témoignent déjà d'un profond désenchantement, certainement plus ",marqué, que l'inflexion des courbes d'audience.,20.0,marqué,marquer,VERB,VERB,Gender=Masc|Number=Sing|Tense=Past|VerbForm=Part,16.0,acl,16:acl,_,1.0
89884,338502,Une coordination peu ,marquée, n'a semble-t-il pas permis de tirer parti des initiatives locales alors qu'un retour d'expérience serait aujourd'hui très utile dans l'élaboration d'une stratégie d'évolution du système d'information.,4.0,marquée,marquer,VERB,VERB,Gender=Fem|Number=Sing|Tense=Past|VerbForm=Part,2.0,acl,2:acl,_,1.0
95541,360590,"Cette désaffection réside sans aucun doute, dans le fait que ces emplois présentent un profil trop souvent flou; mais également dans le différentiel trop ",marqué, des rémunérations entre postes comptables et non comptables.,27.0,marqué,marquer,VERB,VERB,Gender=Masc|Number=Sing|Tense=Past|VerbForm=Part,25.0,acl,25:acl,_,1.0
101321,382279,On s'attendait à un match où les occasions de ,marquer," seraient peu nombreuses mais ce fut plutôt un festival offensif alors que les deux gardiens partants, Milan Hnilicka et Henrik Lundqvist, n'étaient pas à leur mieux.",11.0,marquer,marquer,VERB,VERB,VerbForm=Inf,9.0,acl,9:acl,_,1.0
102853,388066,Voilà quelques uns de ces faits saillants qui ont ,marqué,", vendredi, la fin de la période de dépôt de la déclaration de candidature en vue des élections municipales du 6 novembre prochain.",10.0,marqué,marquer,VERB,VERB,Gender=Masc|Number=Sing|Tense=Past|VerbForm=Part,6.0,acl:relcl,6:acl:relcl,SpaceAfter=No,2.0
112340,424067,Matt D'Agostini a obtenu l'une des rares occasions de ,marquer,", mais son tir a heurté le poteau.",12.0,marquer,marquer,VERB,VERB,VerbForm=Inf,10.0,acl,10:acl,SpaceAfter=No,1.0
115938,437614,"Dans les bâtiments hauts on recoupe la lame d’air, pour éviter l’effet de cheminée en cas d’incendie mais aussi pour obtenir un joint bien ",marqué, entre les lames verticales.,29.0,marqué,marquer,VERB,VERB,Gender=Masc|Number=Sing|Tense=Past|VerbForm=Part,27.0,acl,27:acl,_,2.0
120777,456418,"Mais le vrai problème, c'est que même quand tout fonctionne et qu'on obtient une bonne chance de ",marquer,", Martin Biron se trouve inévitablement dans le chemin.",21.0,marquer,marquer,VERB,VERB,VerbForm=Inf,19.0,acl,19:acl,SpaceAfter=No,1.0
123588,467104,"Donc, l'avantage ",marqué, lorsque le partenaire abandonne ne peut être qu'IPPON.,5.0,marqué,marquer,VERB,VERB,Gender=Masc|Number=Sing|Tense=Past|VerbForm=Part,4.0,acl,4:acl,_,3.0
137525,518905,"Par contre, je sais qu'Akalé (auteur d'un doublé) ne ",marquait," pas autant que ça quand je l'ai connu (à Auxerre)"""", confiait l'entraîneur artésien.",15.0,marquait,marquer,VERB,VERB,Mood=Ind|Number=Sing|Person=3|Tense=Imp|VerbForm=Fin,5.0,ccomp,5:ccomp,_,2.0
146615,553130,"Avec leur trio magique Messi-Eto'o-Ronaldinho -très en verve lors de la deuxième période à Stamford Bridge-, les Catalans, leaders de la Liga, vont tenter de ",marquer, rapidement pour rendre la tâche des Anglais impossible.,34.0,marquer,marquer,VERB,VERB,VerbForm=Inf,32.0,xcomp,32:xcomp,_,2.0
146744,553641,Il a la capacité de ,marquer, et tout club a besoin de lui pour gagner.,6.0,marquer,marquer,VERB,VERB,VerbForm=Inf,4.0,acl,4:acl,_,3.0
148417,560111,Les Turcs peuvent en profiter à condition d'empêcher Nowitzki de ,marquer," (35 pts, 11 rbds face aux Tchèques).",12.0,marquer,marquer,VERB,VERB,VerbForm=Inf,9.0,xcomp,9:xcomp,_,2.0
154288,581989,"Malgré la présence des Kovalchuk, Hossa, Bondra, Marc Savard et Bobby Holik, l'équipe de Bob Hartley n'a pas réussi à ",marquer, lors de ses nombreux avantages numériques.Le Canadien a réalisé tout un boulot à court d'un homme.,27.0,marquer,marquer,VERB,VERB,VerbForm=Inf,25.0,xcomp,25:xcomp,_,1.0
154593,583097,"En deux matchs, on a donné 27 chances de ",marquer,", dont 12 directement sur l'attaque à cinq"""", a précisé Roy.",11.0,marquer,marquer,VERB,VERB,VerbForm=Inf,9.0,acl,9:acl,SpaceAfter=No,2.0
154632,583269,"Cette première POI de MAP, officiellement arrêtée le 17 septembre aura permis de tirer quelques enseignements avant l'arrivée des perturbations plus ",marquées,", que les prévisionnistes voient poindre pour cette semaine&#133; """"(A suivre)",24.0,marquées,marquer,VERB,VERB,Gender=Fem|Number=Plur|Tense=Past|VerbForm=Part,22.0,acl,22:acl,SpaceAfter=No,2.0
161706,609794,"Entre ces deux groupes, une succession de sommets moins ",marqués,", disposés en chapelet le long d'un arc de cercle formant un cirque vers le nord, et qui constitue le bassin de draînage du Touyre.",11.0,marqués,marquer,VERB,VERB,Gender=Masc|Number=Plur|Tense=Past|VerbForm=Part,9.0,amod,9:amod,SpaceAfter=No,3.0
171990,648725,Le jeu de rôle a une faiblesse assez ,marquée,: il ne fonctionne que lorsque les joueurs ne s'opposent pas systématiquement.,9.0,marquée,marquer,VERB,VERB,Gender=Fem|Number=Sing|Tense=Past|VerbForm=Part,7.0,acl,7:acl,SpaceAfter=No,1.0
172367,650149,Ils (les Olympiques) ont aussi profité de chacune de nos erreurs pour ,marquer,"», notait le no 17 des Remparts, qui a récolté 11 points à ses cinq dernières parties.",15.0,marquer,marquer,VERB,VERB,VerbForm=Inf,8.0,advcl,8:advcl,SpaceAfter=No,1.0
173022,652544,Trop sûre d'elle - elle avait remporté ses six derniers matches en ,marquant," beaucoup (19 buts) -, la Roma, pourtant dominatrice, n'a pas su résister à l'enthousiasme et la hargne de la Lazio.",14.0,marquant,marquer,VERB,VERB,Tense=Pres|VerbForm=Part,8.0,advcl,8:advcl,_,1.0
176452,665537,Des changements plus ,marqués," en cas d'aphasie (dans 71% des cas contre 51 Même si finalement, pour l'auteur, « les couples ont semblé trouver une autre forme d'amour physique ».",4.0,marqués,marquer,VERB,VERB,Gender=Masc|Number=Plur|Tense=Past|VerbForm=Part,2.0,acl,2:acl,_,1.0
176517,665785,"A la suite d'un mouvement rapide, Donatien Crosnier de Strasbourg réussit à se démarquer pour passer le ballon à Filipe Vargas, qui ",marqua, facilement. 1 - 0 au tableau d'affichage.,26.0,marqua,marquer,VERB,VERB,Mood=Ind|Number=Sing|Person=3|Tense=Past|VerbForm=Fin,22.0,acl:relcl,22:acl:relcl,_,1.0
193381,729622,Des pantalons fuselés s'accompagnent de vestes à la carrure ,marquée, et élargie.,11.0,marquée,marquer,VERB,VERB,Gender=Fem|Number=Sing|Tense=Past|VerbForm=Part,10.0,acl,10:acl,_,1.0
197153,743763,"Mais, le résultat est le même, nous ",marquons, un Waza-hari.,10.0,marquons,marquer,VERB,VERB,Mood=Ind|Number=Plur|Person=1|Tense=Pres|VerbForm=Fin,7.0,advcl,7:advcl,_,3.0
200022,754803,Ce sont des expériences qui ,marquent," et qui, qu'on le veuille ou non, font partie de l'implication émotive des tout-petits lorsqu'on les convoque à un spectacle de théâtre d'ombres.",6.0,marquent,marquer,VERB,VERB,Mood=Ind|Number=Plur|Person=3|Tense=Pres|VerbForm=Fin,4.0,acl:relcl,4:acl:relcl,_,3.0
204643,772351,"Deux fois, leur défense, emmenée par un magnifique Jamie Carragher, aura empêché Chelsea de ",marquer,", ce qu'il avait réussi sur ses 13 derniers matches de C1 à l'extérieur.",18.0,marquer,marquer,VERB,VERB,VerbForm=Inf,15.0,xcomp,15:xcomp,SpaceAfter=No,1.0
210171,792310,Il s'agit de sa croissance la plus ,marquée, depuis octobre 1994.,9.0,marquée,marquer,VERB,VERB,Gender=Fem|Number=Sing|Tense=Past|VerbForm=Part,6.0,acl,6:acl,_,2.0
210867,795076,"Cou Sa ligne supérieure dessine, depuis la nuque bien ",marquée,", une courbe élégante jusqu'au garrot.",11.0,marquée,marquer,VERB,VERB,Gender=Fem|Number=Sing|Tense=Past|VerbForm=Part,9.0,acl,9:acl,SpaceAfter=No,1.0
216388,815869,A force de dominer sans ,marquer,", Marseille s'est exposé aux contres adverses.",6.0,marquer,marquer,VERB,VERB,VerbForm=Inf,4.0,advcl,4:advcl,SpaceAfter=No,1.0
219543,827806,"Une première fois en 1655, devant l'ingérence trop ",marquée, des seigneurs de Poyaler qui prétendaient exercer leur autorité jusque dans le sanctuaire.,11.0,marquée,marquer,VERB,VERB,Gender=Fem|Number=Sing|Tense=Past|VerbForm=Part,9.0,acl,9:acl,_,1.0
223278,842075,"Rio Ferdinand appartient à cette première école de pensée : """"Je suis sûr que les Barcelonais trouveront les espaces pour ",marquer,", prédit Rio Ferdinand sur le site officiel de l'UEFA.",22.0,marquer,marquer,VERB,VERB,VerbForm=Inf,18.0,advcl,18:advcl,SpaceAfter=No,1.0
226518,854309,"La faible progression des salaires et l'inflation expliquent cette baisse des dépenses, la plus ",marquée," depuis celle calculée pour septembre 2005; après l'ouragan Katrina, les ventes au détail avaient reculé de 0,3 pour cent en écart mensuel.",17.0,marquée,marquer,VERB,VERB,Gender=Fem|Number=Sing|Tense=Past|VerbForm=Part,11.0,acl,11:acl,_,2.0
226551,854445,"Quand vous avez la chance de jouer pour un club comme Liverpool, vous devez ",marquer," régulièrement"""", a déclaré Crouch, qui espère jouer contre le PSV.",16.0,marquer,marquer,VERB,VERB,VerbForm=Inf,15.0,xcomp,15:xcomp,_,1.0
228283,861073,"Devant les coûts de cette activité, en moyens et en temps que les élèves y consacrent, il était nécessaire de rechercher une meilleure efficacité et une cohérence plus ",marquée, avec les exigences de la société actuelle.,31.0,marquée,marquer,VERB,VERB,Gender=Fem|Number=Sing|Tense=Past|VerbForm=Part,29.0,acl,29:acl,_,2.0
233407,879987,"Les secteurs des services administratifs, de l'ingénierie, de la comptabilité et de l'audit ont enregistré l'augmentation la plus ",marquée," le mois dernier, avec une demande d'emploi qui bénéficie tout particulièrement aux employés de bureau.",24.0,marquée,marquer,VERB,VERB,Gender=Fem|Number=Sing|Tense=Past|VerbForm=Part,21.0,acl,21:acl,_,1.0
240879,907883,J'ai profité du retour pour ,marquer,", a-t-il expliqué après la rencontre.",7.0,marquer,marquer,VERB,VERB,VerbForm=Inf,3.0,advcl,3:advcl,SpaceAfter=No,1.0
248614,936829,On a eu plusieurs chances de ,marquer,", a noté Julien, qui aimerait gagner par un écart plus confortable.",7.0,marquer,marquer,VERB,VERB,VerbForm=Inf,5.0,acl,5:acl,SpaceAfter=No,3.0
249499,940200,"Sans surprise, c'est dans la région Europe centrale et de l'est que la croissance la plus ",marquée," a été observée, avec une progression de 21% de son bénéfice sous-jacent à 150 millions d'euros.",20.0,marquée,marquer,VERB,VERB,Gender=Fem|Number=Sing|Tense=Past|VerbForm=Part,8.0,dep,8:dep,_,1.0
255333,962147,Après le match nul (1-1) à l'aller et obligés de ,marquer," pour espérer se qualifier, les Gunners ont démarré pied au plancher.",16.0,marquer,marquer,VERB,VERB,VerbForm=Inf,14.0,xcomp,14:xcomp,_,1.0
257463,970242,"Depuis la mi-novembre, ils ont toutes les peines du monde à gagner et à ",marquer, (2 victoires et 7 buts inscrits en 10 matches).,16.0,marquer,marquer,VERB,VERB,VerbForm=Inf,13.0,conj,13:conj,_,2.0
258361,973798,"La décennie suivante, là où la barrière entre la variété et la musique pour dancefloor se fait plus ",marquée,", ses chansons ne marqueront plus les esprits.",20.0,marquée,marquer,VERB,VERB,Gender=Fem|Number=Sing|Tense=Past|VerbForm=Part,18.0,xcomp,18:xcomp,SpaceAfter=No,1.0
262953,991185,Les chiffres de novembre ont toutefois été révisés pour faire ressortir une hausse moins ,marquée," qu'annoncé précédemment: +0,6% pour l'indice général, contre 1,0% annoncé précédemment.",15.0,marquée,marquer,VERB,VERB,Gender=Fem|Number=Sing|Tense=Past|VerbForm=Part,13.0,acl,13:acl,_,1.0
