Unnamed: 0,sent_id,left_context,pivot,right_context,ID,FORM,LEMMA,UPOS,XPOS,FEATS,HEAD,DEPREL,DEPS,MISC,dist
27057,101521,"Evel Knievel était un héros de la culture populaire américaine, le """"dernier gladiateur de la nouvelle Rome"""" selon les propres termes de ce vantard impénitent, qui a tout ",osé,", sauf peut-être mener une vie honnête.",33.0,osé,oser,VERB,VERB,Gender=Masc|Number=Sing|Tense=Past|VerbForm=Part,27.0,acl:relcl,27:acl:relcl,SpaceAfter=No,2.0
103487,390355,C'est une manière de dire aux gens: ,osez,", soyez les pionniers de vos vies!",10.0,osez,oser,VERB,VERB,Mood=Ind|Number=Plur|Person=2|Tense=Pres|VerbForm=Fin,4.0,parataxis,4:parataxis,SpaceAfter=No,1.0
139177,525205,Bravo Président Même Chirac n'aurait pas ,osé,", je suis désolé pour les infirmières, mais...",8.0,osé,oser,VERB,VERB,Gender=Masc|Number=Sing|Tense=Past|VerbForm=Part,0.0,root,0:root,SpaceAfter=No,1.0
218368,823617,"Sylvain Carpentier sera pour sa part la tête de liste de """" ",Oser," pour Vitry """" (SE).",13.0,Oser,oser,VERB,VERB,VerbForm=Inf,8.0,nmod,8:nmod,_,1.0
233022,878538,"Évidemment, l'absence d'enfants peut aussi s'expliquer par le risque de scandale inévitable si des enfants pouvaient être abattus (même la série Grand Theft Auto n'a pas ",osé,"), mais le joueur ne peut blesser ses alliés dans le jeu.",33.0,osé,oser,VERB,VERB,Gender=Masc|Number=Sing|Tense=Past|VerbForm=Part,7.0,parataxis,7:parataxis,SpaceAfter=No,1.0
