Unnamed: 0,sent_id,left_context,pivot,right_context,ID,FORM,LEMMA,UPOS,XPOS,FEATS,HEAD,DEPREL,DEPS,MISC,dist
46664,176061,L'enquête ,piétinant,", il tentera de recueillir lui-même des indices pouvant mener à l'inculpation du suspect.",3.0,piétinant,piétiner,VERB,VERB,Tense=Pres|VerbForm=Part,6.0,advcl,6:advcl,SpaceAfter=No,1.0
79613,299365,L’insurrection ,piétine,", les hommes massés sur la place de Grève s’impatientent.",3.0,piétine,piétiner,VERB,VERB,Mood=Ind|Number=Sing|Person=3|Tense=Pres|VerbForm=Fin,0.0,root,0:root,SpaceAfter=No,1.0
128608,485611,La place parisienne continuait de ,piétiner,", même après trois mauvais indicateurs américains et l'ouverture en baisse de Wall Street.",6.0,piétiner,piétiner,VERB,VERB,VerbForm=Inf,4.0,xcomp,4:xcomp,SpaceAfter=No,1.0
206740,779976,"La très grande majorité des victimes, 647 morts, ont péri noyées ou ",piétinées, après un mouvement de panique sur un pont de Bagdad provoqué par une rumeur sur la présence de deux kamikazes parmi la foule.,15.0,piétinées,piétiner,VERB,VERB,Gender=Fem|Number=Plur|Tense=Past|VerbForm=Part,13.0,conj,13:conj,_,1.0
212327,800721,Le projet d'une antenne du Centre ,piétine,", Pékin ne semblant pas pressé de donner son feu vert.",8.0,piétine,piétiner,VERB,VERB,Mood=Ind|Number=Sing|Person=3|Tense=Pres|VerbForm=Fin,0.0,root,0:root,SpaceAfter=No,1.0
217486,820353,"Plusieurs dizaines ont été blessés, ",piétinés,", étouffés ou encore le ventre lacéré par les barbelés.",7.0,piétinés,piétiner,VERB,VERB,Gender=Masc|Number=Plur|Tense=Past|VerbForm=Part,5.0,conj,5:conj,SpaceAfter=No,1.0
247470,932611,Ce n'est pas parcque ce journal là à autoriser ces caricatures qu'il faut aller ,piétiner, et cracher sur la drapeau danois...,17.0,piétiner,piétiner,VERB,VERB,VerbForm=Inf,16.0,xcomp,16:xcomp,_,2.0
254224,957837,"Bousculé, ballotté, tiraillé, ",piétiné,", submergé, ce corps gracile recèle une vigueur insoupçonnée.",7.0,piétiné,piétiner,VERB,VERB,Gender=Masc|Number=Sing|Tense=Past|VerbForm=Part,1.0,conj,1:conj,SpaceAfter=No,2.0
