Unnamed: 0,sent_id,left_context,pivot,right_context,ID,FORM,LEMMA,UPOS,XPOS,FEATS,HEAD,DEPREL,DEPS,MISC,dist
37049,139445,"Celui qui, à gauche, mettra tout le monde d'accord, c'est François Hollande"""", ",pronostique,"-t-il: """"En 2007, Hollande sera le candidat de la gauche au second tour.",21.0,pronostique,pronostique,VERB,VERB,Mood=Ind|Number=Sing|Person=3|Tense=Pres|VerbForm=Fin,17.0,parataxis,17:parataxis,SpaceAfter=No,1.0
72249,272468,"«La situation avec Moscou ne sera pas meilleure», ",pronostique," toutefois Piotr Kaczynski, coordinateur du Programme européen de l'Institut des affaires publiques de Varsovie.",12.0,pronostique,pronostique,VERB,VERB,Mood=Ind|Number=Sing|Person=3|Tense=Pres|VerbForm=Fin,9.0,parataxis,9:parataxis,_,2.0
88774,334279,"Le marché immobilier devrait """"enfin toucher un plancher en 2009, après quatre ans de baisse"""", ",pronostique," le FMI, qui parle toutefois de prévision optimiste.",20.0,pronostique,pronostique,VERB,VERB,Mood=Ind|Number=Sing|Person=3|Tense=Pres|VerbForm=Fin,15.0,parataxis,15:parataxis,_,1.0
93798,353999,"La croissance du PIB ne devrait pas dépasser 1,6% cette année, ",pronostique, l'institut de la statistique.,14.0,pronostique,pronostique,VERB,VERB,Mood=Ind|Number=Sing|Person=3|Tense=Pres|VerbForm=Fin,6.0,parataxis,6:parataxis,_,1.0
120507,455429,"L'affaire n'est plus institutionnelle, elle est personnelle, ",pronostique, un diplomate.,13.0,pronostique,pronostique,VERB,VERB,Mood=Ind|Number=Sing|Person=3|Tense=Pres|VerbForm=Fin,7.0,parataxis,7:parataxis,_,1.0
131504,496490,"J'ai le sentiment"""" que le Blu-ray """"n'est qu'une étape"""", ",pronostique," François Séguineau, directeur général de la filiale française, convaincu que les coffrets et lecteurs DVD feront bientôt partie du passé.",19.0,pronostique,pronostique,VERB,VERB,Mood=Ind|Number=Sing|Person=3|Tense=Pres|VerbForm=Fin,2.0,parataxis,2:parataxis,_,1.0
196981,743112,"Dans les grandes villes où le scrutin est plus politisé, la cuvée 2008 risque d'être nettement moins bonne que celle de 2001"""", ",pronostique," Maurice Leroy, du Nouveau Centre, allié à l'UMP.",28.0,pronostique,pronostique,VERB,VERB,Mood=Ind|Number=Sing|Person=3|Tense=Pres|VerbForm=Fin,16.0,parataxis,16:parataxis,_,3.0
202683,764564,"«Les concentrations devraient s'accélérer dans les trois prochaines années, à l'instar du rachat de la division de Siemens par le taïwanais BenQ», ",pronostique, Neil Mawston.,29.0,pronostique,pronostique,VERB,VERB,Mood=Ind|Number=Sing|Person=3|Tense=Pres|VerbForm=Fin,4.0,parataxis,4:parataxis,_,2.0
