Unnamed: 0,sent_id,left_context,pivot,right_context,ID,FORM,LEMMA,UPOS,XPOS,FEATS,HEAD,DEPREL,DEPS,MISC,dist
33664,126808,Une nouvelle phase de saisie de l'information ainsi ,récoltée," a lieu, suivie d'un nouveau contrôle.",10.0,récoltée,récolter,VERB,VERB,Gender=Fem|Number=Sing|Tense=Past|VerbForm=Part,8.0,acl,8:acl,_,1.0
71379,269222,L'argent ,récolté, lors de cet évènement sera reversé au Robin Hood Relief Fund qui est chargé de distribuer l'argent des différentes fondations aux victimes et famille des attentats.,3.0,récolté,récolter,VERB,VERB,Gender=Masc|Number=Sing|Tense=Past|VerbForm=Part,2.0,acl,2:acl,_,1.0
100020,377440,La notation anglo-saxonne (dans le cas des facs US que je connais) est complètement truquée pour permettre au moindre ignorant d'avoir toujours plus de 90 % et de ,récolter, un A. On ne peut vraiment pas dire que ce soit une référence valable.,32.0,récolter,récolter,VERB,VERB,VerbForm=Inf,26.0,conj,26:conj,_,1.0
104656,394881,"Les points de mardi seront alors effacés, alors que ceux ",récoltés, lors du programme technique de lundi seront conservés.,12.0,récoltés,récolter,VERB,VERB,Gender=Masc|Number=Plur|Tense=Past|VerbForm=Part,11.0,acl,11:acl,_,1.0
114546,432379,Les sommes ,récoltés," lors de cette vente iront directement dans le plan de sauvetage du centre de """"La Gardette"""", Centre d'accueil pour jeunes adultes autistes à Saint-Paul de Vence.",3.0,récoltés,récolter,VERB,VERB,Gender=Masc|Number=Plur|Tense=Past|VerbForm=Part,2.0,acl,2:acl,_,1.0
149972,565951,"La cour international d'appel de la FIA a émis un jugement plus clément jeudi mais décidé que Jason Button, le pilote de BAR-Honda, est privé des six points ",récoltés, lors de sa troisième place sur le circuit d'Imola.,34.0,récoltés,récolter,VERB,VERB,Gender=Masc|Number=Plur|Tense=Past|VerbForm=Part,33.0,acl,33:acl,_,1.0
167254,630573,Les fonds ainsi ,récoltés, sont estimés à 782 millions d'euros par an.,4.0,récoltés,récolter,VERB,VERB,Gender=Masc|Number=Plur|Tense=Past|VerbForm=Part,2.0,acl,2:acl,_,1.0
