Unnamed: 0,sent_id,left_context,pivot,right_context,ID,FORM,LEMMA,UPOS,XPOS,FEATS,HEAD,DEPREL,DEPS,MISC,dist
27567,103419,"Mais les jeunes populaires ont bien fait leur travail : la salle regarde comme des perturbateurs, et personne ne ",sourcille, quand ils sont expulsés par des agents.,21.0,sourcille,sourciller,VERB,VERB,Mood=Ind|Number=Sing|Person=3|Tense=Pres|VerbForm=Fin,7.0,conj,7:conj,_,1.0
34665,130643,"S'élevant à 1300 milliards de dollars, elle lui permettent, en théorie, de s'acheter sans ",sourciller, les plus beaux joyaux du capitalisme mondial.,20.0,sourciller,sourciller,VERB,VERB,VerbForm=Inf,18.0,obl:mod,18:obl:mod,_,2.0
42819,161435,Certains candidats en arrivent ainsi à énoncer sans ,sourciller," une idée au début du texte et son contraire à la fin, se pénalisant eux-mêmes par défaut de vigilance.",9.0,sourciller,sourciller,VERB,VERB,VerbForm=Inf,7.0,obl:mod,7:obl:mod,_,1.0
185193,698754,"Par ailleurs, la motorisation hybride n'est pas au programme et, chez Nissan, on nous affirme, sans ",sourciller,", que la CVT permettra des économies de carburant comparables à celles des voitures hybrides.",22.0,sourciller,sourciller,VERB,VERB,VerbForm=Inf,19.0,advcl,19:advcl,SpaceAfter=No,1.0
204711,772544,"En effet, il semblerait qu'énormément de monde lui ait demandé plus d'informations, ce qu'il fait sans ",sourciller," sur son blog = 0) { window.open(this.href); return false; }"""">le site de DoubleFine.",22.0,sourciller,sourciller,VERB,VERB,VerbForm=Inf,20.0,advcl,20:advcl,_,1.0
257587,970740,"Arrivé près des coussins, il jeta sans ",sourciller, une large besace couverte de sable.,9.0,sourciller,sourciller,VERB,VERB,VerbForm=Inf,7.0,advcl,7:advcl,_,3.0
