Unnamed: 0,sent_id,left_context,pivot,right_context,ID,FORM,LEMMA,UPOS,XPOS,FEATS,HEAD,DEPREL,DEPS,MISC,dist
20458,76717,"C’est enfin la Maison du Peuple de Victor Horta, inaugurée le jour de Pâques 1899 à la lisière des Marolles : « La Pâque Rouge », ",titre, le journal « Le Peuple ».,30.0,titre,titre,VERB,VERB,Mood=Ind|Number=Sing|Person=3|Tense=Pres|VerbForm=Fin,5.0,parataxis,5:parataxis,_,2.0
38379,144494,"Le soulèvement du Tibet s'étend, ",titre," la Tageszeitung, qui publie en première page la photo de Tibétains en exil à Dharamsala en Inde, dont l'un brandit un portrait du Dalaï lama.",8.0,titre,titre,VERB,VERB,Mood=Ind|Number=Sing|Person=3|Tense=Pres|VerbForm=Fin,6.0,advcl,6:advcl,_,1.0
68913,260089,"Le maillot jaune est un menteur"""", ",titre," la Gazzetta dello Sport, le principal quotidien sportif transalpin pour qui ce mercredi restera comme """"la journée la plus dramatique de l'histoire du Tour de France"""" et la """"nuit la plus longue pour le cyclisme"""".",9.0,titre,titre,VERB,VERB,Mood=Ind|Number=Sing|Person=3|Tense=Pres|VerbForm=Fin,6.0,parataxis,6:parataxis,_,1.0
90457,340781,"«Actuel, c’est fini», ",titre, l’ultime couverture du magazine.,9.0,titre,titre,VERB,VERB,Mood=Ind|Number=Sing|Person=3|Tense=Pres|VerbForm=Fin,6.0,parataxis,6:parataxis,_,1.0
116291,439038,"Faux Départ pour la paix», ",titre," Libération, qui ne croit pas trop au projet de résolution franco-américain pour sortir de la crise.",8.0,titre,titre,VERB,VERB,Mood=Ind|Number=Sing|Person=3|Tense=Pres|VerbForm=Fin,2.0,parataxis,2:parataxis,_,1.0
119728,452442,"Un bain de sang pour Brown», ",titre, le quotidien du soir londonien Evening Standard (droite).,9.0,titre,titre,VERB,VERB,Mood=Ind|Number=Sing|Person=3|Tense=Pres|VerbForm=Fin,2.0,parataxis,2:parataxis,_,1.0
244447,921309,"Sautez à bord du Bombardier Express», ",titre, Nick Morton.,9.0,titre,titre,VERB,VERB,Mood=Ind|Number=Sing|Person=3|Tense=Pres|VerbForm=Fin,1.0,parataxis,1:parataxis,_,2.0
