Unnamed: 0,sent_id,left_context,pivot,right_context,ID,FORM,LEMMA,UPOS,XPOS,FEATS,HEAD,DEPREL,DEPS,MISC,dist
197269,744256,"Des artistes tels que Patrick Tosani, Philippe Ramette ou François Morellet, non sans réfléchir sur les moyens et les outils quils ",utilisent,", y mêlent humour et réflexion sur le corps, la mort, le genre, la sexualité ou l'animalité.",24.0,utilisent,utiliser,VERB,VERB,Mood=Ind|Number=Plur|Person=3|Tense=Pres|VerbForm=Fin,19.0,acl:relcl,19:acl:relcl,SpaceAfter=No,1.0
197278,744312,"Quand il en parle, l'entraineur utilise des adjectifs possessifs : mon athlète, mon gars, mon équipe, mes filles, etc. L'appropriation symbolique passe par le langage le plus habituellement ",utilisé, pour dire une relation de nature technique.,36.0,utilisé,utiliser,VERB,VERB,Gender=Masc|Number=Sing|Tense=Past|VerbForm=Part,32.0,acl,32:acl,_,2.0
197767,746276,Quelle technologie ,utilisez,-vous qu'une tierce partie contrôle?,3.0,utilisez,utiliser,VERB,VERB,Mood=Ind|Number=Plur|Person=2|Tense=Pres|VerbForm=Fin,0.0,root,0:root,SpaceAfter=No,1.0
198522,749226,Je jure également de ne rien révéler ou ,utiliser," de ce qui sera porté à ma connaissance à l'occasion de l'exercice de mes fonctions. """"",9.0,utiliser,utiliser,VERB,VERB,VerbForm=Inf,7.0,conj,7:conj,_,3.0
198868,750553,Le procédé : le procédé de fabrication à ,utiliser," est la découpe LASER Le process : le process de FAO à commander regroupe une station de FAO (CATIA v4) et une table XY de découpe PLASMA de la SAF """"Soudure Autogène Française""""",9.0,utiliser,utiliser,VERB,VERB,VerbForm=Inf,5.0,acl,5:acl,_,1.0
200169,755357,La méthode de traitement esquissée précédemment ne traite pas de la validité du calcul monochromatique ,utilisé, lors de la définition des profils atmosphériques en termes de coefficients optiques.,16.0,utilisé,utiliser,VERB,VERB,Gender=Masc|Number=Sing|Tense=Past|VerbForm=Part,14.0,acl,14:acl,_,1.0
202074,762370,Ils sont au nombre de 8 ce qui correspond à la dimension du groupe SU(3) ,utilisé, pour décrire mathématiquement l'interaction forte.,17.0,utilisé,utiliser,VERB,VERB,Gender=Masc|Number=Sing|Tense=Past|VerbForm=Part,12.0,acl,12:acl,_,2.0
204128,770348,L'intérêt du film réside surtout dans le parallèle qui est fait entre la propagande ,utilisée, pour justifier la guerre du Vietnam en 1964 et celle qui a servi à vendre l'invasion de l'Irak en 2003.,16.0,utilisée,utiliser,VERB,VERB,Gender=Fem|Number=Sing|Tense=Past|VerbForm=Part,15.0,acl,15:acl,_,1.0
204134,770365,Les adresses suivantes sont à ,utiliser, pour recevoir une QSL.,6.0,utiliser,utiliser,VERB,VERB,VerbForm=Inf,0.0,root,0:root,_,1.0
204972,773602,"La manière dont ils sont structurés, nommés, ",utilisés,", protégés et implémentés sont des points majeurs de la conception du SE.",10.0,utilisés,utiliser,VERB,VERB,Gender=Masc|Number=Plur|Tense=Past|VerbForm=Part,6.0,conj,6:conj,SpaceAfter=No,1.0
207196,781533,Il précise les sources des données et la méthode ,utilisée, pour compter les adhérents.,10.0,utilisée,utiliser,VERB,VERB,Gender=Fem|Number=Sing|Tense=Past|VerbForm=Part,9.0,acl,9:acl,_,1.0
207767,783712,"D'après cette enquête, les logiciels Open Source les plus ",utilisés," sont le serveur d'application JBoss, les bases de données de type MySQL et Postgres et la plateforme de développement Eclipse.",12.0,utilisés,utiliser,VERB,VERB,Gender=Masc|Number=Plur|Tense=Past|VerbForm=Part,7.0,acl,7:acl,_,2.0
209668,790658,Le terme de résistance ballast s'applique aussi à la résistance ,utilisée, autrefois pour diminuer la tension appliquée au système d'allumages après le démarrage du moteur.,12.0,utilisée,utiliser,VERB,VERB,Gender=Fem|Number=Sing|Tense=Past|VerbForm=Part,11.0,acl,11:acl,_,1.0
210620,794088,"Alors, le risque est grand, dans le cas de la Palestine, de voir cette exposition ",utilisée, et détournée de son objectif premier.,19.0,utilisée,utiliser,VERB,VERB,Gender=Fem|Number=Sing|Tense=Past|VerbForm=Part,18.0,acl,18:acl,_,2.0
211073,795862,Bt est le terme couramment ,utilisé, pour désigner les protéines extraites d'une bactérie (appelée Bacillus thuringiensis) naturellement présente dans le sol.,6.0,utilisé,utiliser,VERB,VERB,Gender=Masc|Number=Sing|Tense=Past|VerbForm=Part,4.0,acl,4:acl,_,1.0
216111,814799,Le verre : c'est le support le plus ,utilisé, (lames ou lamelles de microscope).,10.0,utilisé,utiliser,VERB,VERB,Gender=Masc|Number=Sing|Tense=Past|VerbForm=Part,7.0,acl,7:acl,_,1.0
216419,815993,"Ses applications puissantes, faciles à ",utiliser," peuvent ouvrir, éditer, et sauvegarder en douceur directement sur les formats fichiers Microsoft Office correspondants tels que .doc, .xls, et . ppt.",7.0,utiliser,utiliser,VERB,VERB,VerbForm=Inf,5.0,xcomp,5:xcomp,_,1.0
216459,816143,"Avant vingt heures, je ne diffuse pas de résultats"""", écrivait-il, offrant également sur sa page un logo prêt à ",utiliser, représentant un haut-parleur barré d'un signe d'interdiction.,26.0,utiliser,utiliser,VERB,VERB,VerbForm=Inf,24.0,xcomp,24:xcomp,_,1.0
216692,817178,"Il aimerait, par exemple, pouvoir comprendre quelle part le vent joue dans les déformations des grands arcs et quelle technologie ",utiliser, pour consolider les pierres.,23.0,utiliser,utiliser,VERB,VERB,VerbForm=Inf,22.0,acl,22:acl,_,1.0
218778,825057,Quel type de téléphone portable ,utilisez,-vous?,6.0,utilisez,utiliser,VERB,VERB,Mood=Ind|Number=Plur|Person=2|Tense=Pres|VerbForm=Fin,0.0,root,0:root,SpaceAfter=No,1.0
219108,826318,"Le double saut, à ",utiliser," judicieusement pour traverser un précipice, attraper une plateforme mouvante au bon moment, ou accéder à des endroits trop haut pour un simple saut.",6.0,utiliser,utiliser,VERB,VERB,VerbForm=Inf,3.0,acl,3:acl,_,1.0
219365,827128,"Selon The Inq., l'Athlon Rev. G serait d'ailleurs le coeur ",utilisé, pour former chacun des quatre coeurs du K8L.,16.0,utilisé,utiliser,VERB,VERB,Gender=Masc|Number=Sing|Tense=Past|VerbForm=Part,15.0,acl,15:acl,_,2.0
220695,832250,Plusieurs fibres optiques non ,utilisées, actuellement sont disponibles dans ce fourreau.,5.0,utilisées,utiliser,VERB,VERB,Gender=Fem|Number=Plur|Tense=Past|VerbForm=Part,2.0,acl,2:acl,_,1.0
221155,834155,Les injonctions de ne plus ,utiliser," et de ne plus disposer des noms litigieux sont des mesures de réglementation, de gestion et de contrôle de l'usage des biens.",6.0,utiliser,utiliser,VERB,VERB,VerbForm=Inf,2.0,acl,2:acl,_,1.0
222630,839453,"«Ils l'avaient habillé avec une combinaison blanche et il avait les mains ligotées devant lui avec des liens en plastique», a-t-il précisé, décrivant la combinaison ",utilisée, pour sauvegarder d'éventuelles preuves physiques sur le suspect.,33.0,utilisée,utiliser,VERB,VERB,Gender=Fem|Number=Sing|Tense=Past|VerbForm=Part,32.0,acl,32:acl,_,1.0
223275,842064,"Un taux directeur de 0,50% seulement constitue, en effet, une marge de manoeuvre extrêmement limitée qu'il convient de n'",utiliser, qu'à bon escient.,24.0,utiliser,utiliser,VERB,VERB,VerbForm=Inf,21.0,dep,21:dep,_,1.0
223674,843591,Un avantage certain de ces poches est qu'elles peuvent être transportées et ,utilisées," partout, car aucun équipement spécial facilitant la conservation n'est nécessaire.",14.0,utilisées,utiliser,VERB,VERB,Gender=Fem|Number=Plur|Tense=Past|VerbForm=Part,12.0,conj,12:conj,_,1.0
225861,851951,Plusieurs approches ,utilisées, pour étudier une maladie du cerveau peuvent être utilisées pour d'autres.,3.0,utilisées,utiliser,VERB,VERB,Gender=Fem|Number=Plur|Tense=Past|VerbForm=Part,2.0,acl,2:acl,_,1.0
228012,860001,C'est une prise souvent ,utilisée, lors d'une esquive.,6.0,utilisée,utiliser,VERB,VERB,Gender=Fem|Number=Sing|Tense=Past|VerbForm=Part,4.0,acl,4:acl,_,1.0
230368,868542,"Or, il souligne que les appareils de tomodensitométrie sont de plus en plus puissants et précis et de plus en plus ",utilisés,", même s'ils soumettent aussi les patients à des doses de plus en plus fortes de radiation.",23.0,utilisés,utiliser,VERB,VERB,Gender=Masc|Number=Plur|Tense=Past|VerbForm=Part,15.0,conj,15:conj,SpaceAfter=No,1.0
232995,878430,Ce dernier permet de réduire l'éclairage sur la partie la moins ,utilisée, de l'écran afin de réduire sa consommation.,13.0,utilisée,utiliser,VERB,VERB,Gender=Fem|Number=Sing|Tense=Past|VerbForm=Part,10.0,acl,10:acl,_,1.0
233246,879361,"A la fin mars, le groupe affirmait disposer de 23,9 milliards de dollars de liquidités et d'une ligne de crédit, non ",utilisée,", de sept milliards.",25.0,utilisée,utiliser,VERB,VERB,Gender=Fem|Number=Sing|Tense=Past|VerbForm=Part,20.0,acl,20:acl,SpaceAfter=No,1.0
235859,889237,"Dans le gymnase vert, la vidéo, de plus en plus ",utilisée," et de plus en plus sophistiquée, envahit les abords des praticables.",13.0,utilisée,utiliser,VERB,VERB,Gender=Fem|Number=Sing|Tense=Past|VerbForm=Part,7.0,acl,7:acl,_,1.0
237797,896381,Les flores ,utilisées, pour rechercher une fleur inconnue utilisent des critères assez divers :,3.0,utilisées,utiliser,VERB,VERB,Gender=Fem|Number=Plur|Tense=Past|VerbForm=Part,2.0,acl,2:acl,_,1.0
238486,898864,La NASA souhaite en effet attendre que toute la lumière soit faite sur les causes du dysfonctionnement le 11 avril dernier de l'étage supérieur construit par Boeing qu'elle doit ,utiliser, pour propulser Chandra sur son orbite définitive.,32.0,utiliser,utiliser,VERB,VERB,VerbForm=Inf,31.0,xcomp,31:xcomp,_,1.0
240562,906622,C'est le régime ,utilisé, lorsque la personne a seulement besoin d'être conseillée et contrôlée.,5.0,utilisé,utiliser,VERB,VERB,Gender=Masc|Number=Sing|Tense=Past|VerbForm=Part,4.0,acl,4:acl,_,3.0
241076,908655,Cet article touche les trois types principalement ,utilisés, et leurs limitations.,8.0,utilisés,utiliser,VERB,VERB,Gender=Masc|Number=Plur|Tense=Past|VerbForm=Part,6.0,acl,6:acl,_,1.0
241164,908991,Je lance un appel pour que personne n',utilise," ou ne cite mon nom pour défendre sa cause sans y être autorisé, y compris sur la campagne électorale de l'ANC pour 2009"""", écrit-il.",9.0,utilise,utiliser,VERB,VERB,Mood=Sub|Number=Sing|Person=3|Tense=Pres|VerbForm=Fin,2.0,advcl,2:advcl,_,3.0
242150,912652,"La cyclosporine A ou le FK506, des immunosuppresseurs, sont deux substances largement ",utilisées," pour bloquer la calcineurine, molécule-signal importante dans les cellules liées aux macrophages.",15.0,utilisées,utiliser,VERB,VERB,Gender=Fem|Number=Plur|Tense=Past|VerbForm=Part,13.0,acl,13:acl,_,1.0
244489,921440,"Ils interdiraient les armes militaires d'assaut, comme celle ",utilisée, lors de la fusillade au Collège Dawson de Montréal.,11.0,utilisée,utiliser,VERB,VERB,Gender=Fem|Number=Sing|Tense=Past|VerbForm=Part,10.0,acl,10:acl,_,3.0
246164,927698,"Les astronautes utiliseraient un freinage atmosphérique pour réduire leur vitesse en approchant de la Terre, et atterriraient sur la surface de la Terre dans une capsule similaire à celles ",utilisées, lors des missions Apollo.,31.0,utilisées,utiliser,VERB,VERB,Gender=Fem|Number=Plur|Tense=Past|VerbForm=Part,30.0,acl,30:acl,_,1.0
246344,928399,Il peut maintenant demander à l'émetteur de la carte de crédit ,utilisée," pour effectuer l'achat de procéder à la rétrofacturation, c'est-à-dire de créditer à votre compte le montant dû par le commerçant.",13.0,utilisée,utiliser,VERB,VERB,Gender=Fem|Number=Sing|Tense=Past|VerbForm=Part,10.0,acl,10:acl,_,1.0
246398,928625,"C'est la promesse de services conviviaux, faciles à vivre et performants avec des mobiles simples à ",utiliser," et spécialement conçus pour i-mode&#153; : navigation intuitive, touche directe pour l'e-mail, larges écrans couleur...",19.0,utiliser,utiliser,VERB,VERB,VerbForm=Inf,17.0,xcomp,17:xcomp,_,1.0
252189,949901,La propriété la plus ,utilisée, des solutions de H2O2 est le pouvoir oxydant qui permet d'oxyder de nombreux composés organiques (colorants...) et minéraux.,5.0,utilisée,utiliser,VERB,VERB,Gender=Fem|Number=Sing|Tense=Past|VerbForm=Part,2.0,acl,2:acl,_,1.0
255319,962088,"Pour Michel Biezunski, cette contrainte fait de RDF un modèle de données spécialisé difficile à ",utiliser, pour décrire autre chose que des ressources Web.,17.0,utiliser,utiliser,VERB,VERB,VerbForm=Inf,15.0,xcomp,15:xcomp,_,2.0
255370,962317,Il en ressort que trois machines très largement ,utilisées," présentent des failles de sécurité, de fiabilité ou d'intégrité.",9.0,utilisées,utiliser,VERB,VERB,Gender=Fem|Number=Plur|Tense=Past|VerbForm=Part,6.0,acl,6:acl,_,1.0
255970,964636,"Il n'en demeure pas moins que le CIT est connu, ",utilisé," et apprécié par les étudiants, les enseignants et le personnel administratif du Campus Tréfilerie, et cela depuis très longtemps.",13.0,utilisé,utiliser,VERB,VERB,Gender=Masc|Number=Sing|Tense=Past|VerbForm=Part,11.0,conj,11:conj,_,3.0
256343,966069,"Il s'agissait en effet de ne pas traiter d'environnement puisque je traitais d'écologie (au sens strict, seul utilisable, mais jamais ",utilisé, : une science globale).,27.0,utilisé,utiliser,VERB,VERB,Gender=Masc|Number=Sing|Tense=Past|VerbForm=Part,23.0,conj,23:conj,_,3.0
256446,966450,Les cartes ne peuvent être reproduites par photocopie et les armoiries qu'elles portent ne sont visibles qu'aux rayons X. Les papiers spéciaux ,utilisés, pour confectionner les cartes sont en filigrane.,25.0,utilisés,utiliser,VERB,VERB,Gender=Masc|Number=Plur|Tense=Past|VerbForm=Part,23.0,acl,23:acl,_,1.0
256486,966636,Il existe des fonctionnalités plus cachées - mais qu'il ne faut pas hésiter à ,utiliser," - dans le menu """" Options """" de Netscape ou dans le menu """" Affichage """" puis """" Options Internet """" d'Internet Explorer.",16.0,utiliser,utiliser,VERB,VERB,VerbForm=Inf,14.0,xcomp,14:xcomp,_,2.0
257072,968769,"Hagman, le 10e joueur ",utilisé," lors de la fusillade, a déjoué le gardien Pascal Leclaire à l'aide d'un lancer du revers.",6.0,utilisé,utiliser,VERB,VERB,Gender=Masc|Number=Sing|Tense=Past|VerbForm=Part,5.0,acl,5:acl,_,1.0
257405,970044,Une fois ,utilisée,", une carte Objet magique est défaussée.",3.0,utilisée,utiliser,VERB,VERB,Gender=Fem|Number=Sing|Tense=Past|VerbForm=Part,10.0,advcl,10:advcl,SpaceAfter=No,1.0
257712,971249,Ce garage est utilisé par les chasseurs eux-mêmes mais aussi par les visiteurs éventuels qui doivent bien sûr se conformer aux consignes traditionnellement ,utilisées, pour annoncer leur approche.,26.0,utilisées,utiliser,VERB,VERB,Gender=Fem|Number=Plur|Tense=Past|VerbForm=Part,24.0,acl,24:acl,_,1.0
257926,972044,"Byrd a reconnu avoir pris des hormones pour des raisons médicales, tout en ajoutant qu'il n'en a jamais ",utilisées, sans avoir une prescription d'un médecin.,22.0,utilisées,utiliser,VERB,VERB,Gender=Fem|Number=Plur|Tense=Past|VerbForm=Part,15.0,ccomp,15:ccomp,_,1.0
258536,974420,"Charles Michel Vézina, celui qui avait fourni l'arme ",utilisée," pour tirer sur le journaliste Michel Auger, a été arrêté pour avoir créé une chaîne clandestine de fabrication de mitraillettes.",11.0,utilisée,utiliser,VERB,VERB,Gender=Fem|Number=Sing|Tense=Past|VerbForm=Part,10.0,acl,10:acl,_,1.0
262397,989229,"Ce dernier obtient 41.406 s. Sous Cinebench 10, ce même processeur obtient 1 726 avec un seul core d'",utilisé,", soit 9% de moins que le Barcelona.",21.0,utilisé,utiliser,VERB,VERB,Gender=Masc|Number=Sing|Tense=Past|VerbForm=Part,19.0,acl,19:acl,SpaceAfter=No,2.0
262765,990535,"Alors que les mines antipersonnel sont interdites, les BASM sont considérées comme légales et de nombreux pays continuent à produire, à ",utiliser, et à exporter ces armes.,24.0,utiliser,utiliser,VERB,VERB,VerbForm=Inf,21.0,conj,21:conj,_,1.0
263726,993971,"En France ou en Grande-Bretagne, aucune des dénominations officielles ",utilisées, pour désigner des personnes d'une autre nationalité ou leurs parents n'exprime aussi fortement l'exclusion.,11.0,utilisées,utiliser,VERB,VERB,Gender=Fem|Number=Plur|Tense=Past|VerbForm=Part,9.0,acl,9:acl,_,1.0
