Unnamed: 0,sent_id,left_context,pivot,right_context,ID,FORM,LEMMA,UPOS,XPOS,FEATS,HEAD,DEPREL,DEPS,MISC,dist
93880,354328,Vous pouvez alors choisir le source à ,utiliser," en faisant un lien symbolique ; par exemple, `ln -sf linux-1.2.2 /usr/src/linux' indiquera la version 1.2.2 comme version courante.",8.0,utiliser,utiliser,VERB,VERB,VerbForm=Inf,6.0,acl,6:acl,_,2.0
97011,365877,"Le PC portable professionnel HP Compaq 6510b associe des performances optimales et des fonctions de sécurité novatrices pour vous offrir une solution informatique mobile fiable, facile à ",utiliser, et d'un rapport qualité/prix exceptionnel.,29.0,utiliser,utiliser,VERB,VERB,VerbForm=Inf,27.0,xcomp,27:xcomp,_,2.0
98499,371824,Cette victoire s’explique par la tactique ,utilisée, lors du combat mais aussi par l’habileté politique d’Hannibal qui utilise les erreurs de ses adversaires.,8.0,utilisée,utiliser,VERB,VERB,Gender=Fem|Number=Sing|Tense=Past|VerbForm=Part,7.0,acl,7:acl,_,1.0
99495,375418,Plusieurs applications ,utilisent, déjà Portable Firefox Live pour offrir un navigateur à base de contenu et HTML à partir du CD.,3.0,utilisent,utiliser,VERB,VERB,Mood=Ind|Number=Plur|Person=3|Tense=Pres|VerbForm=Fin,0.0,root,0:root,_,1.0
100014,377408,Le symbole couramment ,utilisé, est [ʨ] mais celui-ci n’est pas officiellement dans l'alphabet phonétique international.,4.0,utilisé,utiliser,VERB,VERB,Gender=Masc|Number=Sing|Tense=Past|VerbForm=Part,2.0,acl,2:acl,_,1.0
100143,377846,Le nouveau mode C6 réduit la consommation de chaque coeur non ,utilisé, à une valeur quasiment égale à zéro.,12.0,utilisé,utiliser,VERB,VERB,Gender=Masc|Number=Sing|Tense=Past|VerbForm=Part,10.0,acl,10:acl,_,1.0
100431,378919,"L'enquête montrera que l'accident résulte directement d'une erreur de navigation, l'équipage ayant affiché et ",utilisé, le VOR LSA de Lyon au lieu de VNE.,20.0,utilisé,utiliser,VERB,VERB,Gender=Masc|Number=Sing|Tense=Past|VerbForm=Part,18.0,conj,18:conj,_,1.0
100800,380252,"Toutefois, le CCNE a bien précisé que l'interdiction du clonage ne concernait pas le clonage de cellules déjà couramment ",utilisé," et qui a abouti à d'importantes applications dans le domaine de la recherche, du diagnostic et des traitements.",22.0,utilisé,utiliser,VERB,VERB,Gender=Masc|Number=Sing|Tense=Past|VerbForm=Part,17.0,acl,17:acl,_,1.0
101244,381942,"Alors que Francoeur faisait beaucoup confiance à ses vétérans et n'hésitait pas à couper son banc lorsque la situation se corsait, Veilleux aime bien ",utiliser, et impliquer tout son monde.,27.0,utiliser,utiliser,VERB,VERB,VerbForm=Inf,25.0,xcomp,25:xcomp,_,1.0
102769,387767,Si les méthodes sont différentes de celles maintenant ,utilisées,", Frobenius utilise en effet comme outil essentiel les déterminants de groupes tombés maintenant en désuétude, les bases de la théorie sont esquissées.",9.0,utilisées,utiliser,VERB,VERB,Gender=Fem|Number=Plur|Tense=Past|VerbForm=Part,7.0,acl,7:acl,SpaceAfter=No,2.0
102850,388054,"Il a indiqué qu'une centaine de nouveaux radars, fixes et mobiles, avaient été mis en service début juillet, portant à 820 le nombre de total de ces appareils ",utilisés, pour détecter les excès de vitesse.,33.0,utilisés,utiliser,VERB,VERB,Gender=Masc|Number=Plur|Tense=Past|VerbForm=Part,32.0,acl,32:acl,_,1.0
103035,388752,Les fonctions de téléphonie sont simples à ,utiliser," : """"simple comme un clic"""".",8.0,utiliser,utiliser,VERB,VERB,VerbForm=Inf,6.0,xcomp,6:xcomp,_,1.0
103454,390229,"Une version de l'algorithme NFS, ",utilisant,", entre autres éléments, ces am&#233;liorations, a conduit au dernier record du monde dans ce domaine, établi par Arjen Lenstra.",8.0,utilisant,utiliser,VERB,VERB,Tense=Pres|VerbForm=Part,2.0,acl,2:acl,SpaceAfter=No,1.0
104293,393580,Des langages seront étudiés et ,utilisés, pour appliquer quelques unes des méthodes de l'Intelligence Artificielle dans le cadre de la réalisation d'un projet.,6.0,utilisés,utiliser,VERB,VERB,Gender=Masc|Number=Plur|Tense=Past|VerbForm=Part,4.0,conj,4:conj,_,1.0
105390,397700,Aujourd'hui les matériaux les plus ,utilisés, sont les alliages AlGaAs (arseniure de gallium et aluminium) et InGaAs (arseniure de gallium et indium).,6.0,utilisés,utiliser,VERB,VERB,Gender=Masc|Number=Plur|Tense=Past|VerbForm=Part,3.0,acl,3:acl,_,2.0
105574,398514,"Par exemple, sous l'appellation """"Appareil circulatoire"""", ont été regroupées les plantes ",utilisées," pour soigner les varices, les hémorroïdes, l'hypertension ou encore l'angine de poitrine.",17.0,utilisées,utiliser,VERB,VERB,Gender=Fem|Number=Plur|Tense=Past|VerbForm=Part,16.0,acl,16:acl,_,1.0
106559,402094,Voici quelques règles d'utilisation et de bonne conduite pour bien ,utiliser, et surtout pour préservez le bon fonctionnement de votre messagerie.,12.0,utiliser,utiliser,VERB,VERB,VerbForm=Inf,3.0,acl,3:acl,_,1.0
106833,403159,"Ces terminaux seront multiples, faciles à ",utiliser, et adaptés à l'usage qui en sera fait.,8.0,utiliser,utiliser,VERB,VERB,VerbForm=Inf,6.0,xcomp,6:xcomp,_,1.0
107437,405599,Créez les calques que vous envisagez d',utiliser, dans la palette Calques.,8.0,utiliser,utiliser,VERB,VERB,VerbForm=Inf,6.0,xcomp,6:xcomp,_,2.0
109715,413974,Ce sort ,utilise, tellement de force magique que temporairement l'utilisateur perd ses pouvoirs et ses cheveux deviennent blancs.,3.0,utilise,utiliser,VERB,VERB,Mood=Ind|Number=Sing|Person=3|Tense=Pres|VerbForm=Fin,0.0,root,0:root,_,1.0
111400,420391,Aussi pour faire la figure on sera amené à ,utiliser," : La macro Conique par F, D, A ie par foyer, directrice et un point, macro déjà contenue dans la figure d'expérimentation.",10.0,utiliser,utiliser,VERB,VERB,VerbForm=Inf,8.0,xcomp,8:xcomp,_,1.0
114229,431082,Si le journal intime a été la forme la plus souvent ,utilisée,", c’est parce qu’elle est d’abord la plus simple.",12.0,utilisée,utiliser,VERB,VERB,Gender=Fem|Number=Sing|Tense=Past|VerbForm=Part,8.0,acl,8:acl,SpaceAfter=No,2.0
115747,436970,"Aussi, nombreuses sont, aujourd'hui, les collectivités qui reconnaissent et ",utilisent, le savoir-faire d'OPH 21 pour mener à bien la conception et la réalisation de leurs équipements.,13.0,utilisent,utiliser,VERB,VERB,Mood=Ind|Number=Plur|Person=3|Tense=Pres|VerbForm=Fin,11.0,conj,11:conj,_,1.0
116635,440364,"Cobrasoft s'est différencié par l'édition des jeux de la série Meurtre ou, en plus du support du jeu, on trouvait des indices véritables que l'on pouvait ",utiliser, quand on les trouvait dans le jeu.,32.0,utiliser,utiliser,VERB,VERB,VerbForm=Inf,31.0,xcomp,31:xcomp,_,1.0
117140,442348,"Dans certains cas celles-ci peuvent être critiquables, incomplètes ou maladroitement ",utilisées," (tableaux illisibles, notes en fin de chapitre et non pas en bas de page, absence de tableaux ou d'exemples etc.).",12.0,utilisées,utiliser,VERB,VERB,Gender=Fem|Number=Plur|Tense=Past|VerbForm=Part,7.0,conj,7:conj,_,2.0
118368,447247,"De fait, la partie non ",utilisée, de la partition ne contiendra plus que des zéros.,7.0,utilisée,utiliser,VERB,VERB,Gender=Fem|Number=Sing|Tense=Past|VerbForm=Part,5.0,acl,5:acl,_,1.0
122755,463857,L'ACV (acyclovir) est un agent antiviral fréquemment ,utilisé," lors des traitements consécutifs à une infection par le virus de l'herpès (Palù et al., 1992).",11.0,utilisé,utiliser,VERB,VERB,Gender=Masc|Number=Sing|Tense=Past|VerbForm=Part,8.0,acl,8:acl,_,1.0
128204,484000,"Quel élément avez-vous trouvé, ",utilisé, pour fédérer l'ensemble ?,7.0,utilisé,utiliser,VERB,VERB,Gender=Masc|Number=Sing|Tense=Past|VerbForm=Part,5.0,advcl,5:advcl,_,1.0
128385,484687,"Avant que tout un chacun, y compris les entreprises, utilise cette technique à grande échelle, les outils de son développement seront aussi simples à ",utiliser, qu'un traitement de texte.,28.0,utiliser,utiliser,VERB,VERB,VerbForm=Inf,26.0,xcomp,26:xcomp,_,1.0
130317,491937,La technique de ribotypage ne doit pas être la seule technique ,utilisée, pour identifier les souches de V.cholerae O1.,12.0,utilisée,utiliser,VERB,VERB,Gender=Fem|Number=Sing|Tense=Past|VerbForm=Part,11.0,acl,11:acl,_,1.0
130379,492167,Je l'ai trouvé car il est similaire dans son titre à l'article Les Pierres Jumelles (menhirs) et sa redirection sur la base du nom le plus ,utilisé,", Les Pierres d'Acq (menhirs).",31.0,utilisé,utiliser,VERB,VERB,Gender=Masc|Number=Sing|Tense=Past|VerbForm=Part,28.0,acl,28:acl,SpaceAfter=No,2.0
132242,499337,"Des deux programmes, cfdisk est vraiment le plus facile à ",utiliser,", mais ses versions actuelles sont aussi moins tolérantes vis à vis d'une table de partitions inexistante ou mal faite.",12.0,utiliser,utiliser,VERB,VERB,VerbForm=Inf,10.0,xcomp,10:xcomp,SpaceAfter=No,2.0
134906,509456,Une fois ,utilisée,", l'eau sale ne peut être rendue à la nature sans assainissement.",3.0,utilisée,utiliser,VERB,VERB,Gender=Fem|Number=Sing|Tense=Past|VerbForm=Part,9.0,advcl,9:advcl,SpaceAfter=No,1.0
136797,516346,"En 2008, c'est le système à clef publique le plus ",utilisé," (carte bancaire française, de nombreux sites web commerciaux…).",13.0,utilisé,utiliser,VERB,VERB,Gender=Masc|Number=Sing|Tense=Past|VerbForm=Part,7.0,acl,7:acl,_,2.0
137366,518339,La plupart des saxophonistes pratiquant le répertoire contemporain ,utilisent, et maîtrisent cette technique.,9.0,utilisent,utiliser,VERB,VERB,Mood=Ind|Number=Plur|Person=3|Tense=Pres|VerbForm=Fin,0.0,root,0:root,_,1.0
139072,524802,Une méthode qu'Alstom se défend d',utiliser,", mais qui est tout à fait courante pour emporter des marchés à l'exportation.",8.0,utiliser,utiliser,VERB,VERB,VerbForm=Inf,6.0,xcomp,6:xcomp,SpaceAfter=No,1.0
139977,528126,"Or, comme nous avons pu le voir dans cette actualité, Windows 2000 reste un système très ",utilisé,", surtout dans le milieu des entreprises.",19.0,utilisé,utiliser,VERB,VERB,Gender=Masc|Number=Sing|Tense=Past|VerbForm=Part,17.0,acl,17:acl,SpaceAfter=No,1.0
140001,528211,Une autre voie de recherche très ,utilisée, est l'étude en soufflerie.,7.0,utilisée,utiliser,VERB,VERB,Gender=Fem|Number=Sing|Tense=Past|VerbForm=Part,3.0,acl,3:acl,_,1.0
140085,528552,"Mais, si la densité des données devient trop importante, le champ magnétique ",utilisé," lors de l'écriture d'un bit influence également les bits voisins, ce qui mène inévitablement à une perte de données.",15.0,utilisé,utiliser,VERB,VERB,Gender=Masc|Number=Sing|Tense=Past|VerbForm=Part,13.0,acl,13:acl,_,1.0
142332,537340,La technique principalement ,utilisée, est la pêche au toc visant particulièrement la truite.,4.0,utilisée,utiliser,VERB,VERB,Gender=Fem|Number=Sing|Tense=Past|VerbForm=Part,2.0,acl,2:acl,_,1.0
142357,537455,Les amorces de PCR ,utilisées, pour en amplifier la séquence sont également communes.,5.0,utilisées,utiliser,VERB,VERB,Gender=Fem|Number=Plur|Tense=Past|VerbForm=Part,2.0,acl,2:acl,_,1.0
143808,542814,"Il lit les podcasts, les fichiers musicaux (MP3), les webradio et engage même des conversations avec d'autres lapins à l'autre bout du monde grâce à la technologie déjà largement ",utilisée, de la VOIP (voix sur internet).,36.0,utilisée,utiliser,VERB,VERB,Gender=Fem|Number=Sing|Tense=Past|VerbForm=Part,33.0,acl,33:acl,_,2.0
145012,547198,L'Austrofascisme est un terme parfois ,utilisé, pour décrire le régime politique instauré en Autriche entre 1933 et 1938.,7.0,utilisé,utiliser,VERB,VERB,Gender=Masc|Number=Sing|Tense=Past|VerbForm=Part,5.0,acl,5:acl,_,1.0
145179,547809,Cette forme provient de la méthode ,utilisée, pour pointer le télescope.,7.0,utilisée,utiliser,VERB,VERB,Gender=Fem|Number=Sing|Tense=Past|VerbForm=Part,6.0,acl,6:acl,_,1.0
145554,549231,Le prétexte ,utilisé, ici est le respect du droit à l'objection de conscience.,3.0,utilisé,utiliser,VERB,VERB,Gender=Masc|Number=Sing|Tense=Past|VerbForm=Part,2.0,acl,2:acl,_,1.0
145970,550798,Les photos des candidats ,utilisées, pour créer cette image sont sous copyright.,5.0,utilisées,utiliser,VERB,VERB,Gender=Fem|Number=Plur|Tense=Past|VerbForm=Part,4.0,acl,4:acl,_,1.0
147512,556619,Une palée désigne aussi un appui provisoire ,utilisé, lors de la construction d'un pont (cf. Viaduc de Millau).,8.0,utilisé,utiliser,VERB,VERB,Gender=Masc|Number=Sing|Tense=Past|VerbForm=Part,6.0,acl,6:acl,_,1.0
150118,566445,"De plus, la prosodie est apprise et ",utilisée, inconsciemment : elle n'est pas enseignée aux enfants comme on le fait pour les sons de la langue lors de l'apprentissage de la lecture.,9.0,utilisée,utiliser,VERB,VERB,Gender=Fem|Number=Sing|Tense=Past|VerbForm=Part,7.0,conj,7:conj,_,1.0
150396,567443,Une manne mal ,utilisée," : """"J'ai dénombré 339 structures (Forem, régies de quartier, entreprises d'insertion...) !",4.0,utilisée,utiliser,VERB,VERB,Gender=Fem|Number=Sing|Tense=Past|VerbForm=Part,2.0,acl,2:acl,_,1.0
151378,571269,"Au début des années 1980, Metin Colpan, alors doctorant, développa de procédures avancées pour la séparation des acides nucléiques, qui étaient bien plus simples et rapides à ",utiliser, que les méthodes existantes.,32.0,utiliser,utiliser,VERB,VERB,VerbForm=Inf,28.0,advcl,28:advcl,_,1.0
151866,573071,Les deux hommes ont été récompensés pour leurs travaux sur cette nanotechnologie ,utilisée, pour lire l'information stockée sur des disques durs.,13.0,utilisée,utiliser,VERB,VERB,Gender=Fem|Number=Sing|Tense=Past|VerbForm=Part,12.0,acl,12:acl,_,2.0
152405,575049,Elle cherche des systèmes simples à ,utiliser, qui puissent assurer les tâches administratives de la dimension de celles d'une petite ville.,7.0,utiliser,utiliser,VERB,VERB,VerbForm=Inf,4.0,acl,4:acl,_,1.0
152483,575338,J'y donne quelques résutats peu ,utilisés, et donc peu connus sur les filtres récursifs bidimensionnels.,7.0,utilisés,utiliser,VERB,VERB,Gender=Masc|Number=Plur|Tense=Past|VerbForm=Part,5.0,acl,5:acl,_,2.0
152986,577136,"Les spécifications pour tout futur sous-type de """"text"""" devront spécifier si elles ",utilisent," ou un paramètre """"charset"""" ou si elles ne le font pas, et peuvent aussi bien avoir la possibilité de restreindre ces valeurs.",15.0,utilisent,utiliser,VERB,VERB,Mood=Ind|Number=Plur|Person=3|Tense=Pres|VerbForm=Fin,12.0,ccomp,12:ccomp,_,1.0
154000,580878,"A la fin de l'année 2000, les deux gouvernements se sont mis d'accord sur la procédure à ",utiliser,", en application de l'accord de 1995.",21.0,utiliser,utiliser,VERB,VERB,VerbForm=Inf,19.0,acl,19:acl,SpaceAfter=No,2.0
155888,587970,Le kit de connexion au Réseau Santé Social génère des erreurs dans le fichier GALSS.INI ,utilisé, pour accéder au lecteur de cartes Sesam-Vitale.,16.0,utilisé,utiliser,VERB,VERB,Gender=Masc|Number=Sing|Tense=Past|VerbForm=Part,14.0,acl,14:acl,_,1.0
156713,590931,Elle évalue le montant des sommes qu'il a détournées ou abusivement ,utilisées," à 24,3 millions d'euros.",13.0,utilisées,utiliser,VERB,VERB,Gender=Fem|Number=Plur|Tense=Past|VerbForm=Part,10.0,conj,10:conj,_,1.0
157107,592502,La relation d'ordre ,utilisée, ici est celle induite par l'inclusion des idéaux.,5.0,utilisée,utiliser,VERB,VERB,Gender=Fem|Number=Sing|Tense=Past|VerbForm=Part,2.0,acl,2:acl,_,1.0
158681,598302,Ces « nouveaux partenaires » constitueront un bassin important de ressources supplémentaires à ,utiliser, pour désengorger le trop plein de clientèles dans le réseau.,14.0,utiliser,utiliser,VERB,VERB,VerbForm=Inf,11.0,acl,11:acl,_,1.0
159371,600955,"C'est la raison pour laquelle, de façon similaire à la procédure ",utilisée," lors de la création, il existe une obligation d'information des cocontractants lors de l'extension de compétences.",14.0,utilisée,utiliser,VERB,VERB,Gender=Fem|Number=Sing|Tense=Past|VerbForm=Part,13.0,acl,13:acl,_,1.0
159735,602332,"Bon point : un mode d'emploi pour la recherche d'un job (rédiger une lettre de motivation percutante ou un CV, préparer un entretien d'embauche, les méthodes à ",utiliser, et réussir son entrée en entreprise).,34.0,utiliser,utiliser,VERB,VERB,VerbForm=Inf,32.0,acl,32:acl,_,1.0
159878,602839,"L'entreprise canadienne _ dont le titre avait plafonné à 11,95 $ au cours de la dernière année _ fabrique des équipements ",utilisés," pour contrer des menaces chimiques, biologiques, radioactives et explosives.",23.0,utilisés,utiliser,VERB,VERB,Gender=Masc|Number=Plur|Tense=Past|VerbForm=Part,22.0,acl,22:acl,_,1.0
162156,611431,Elles ont également découvert un tunnel que des activistes d'Al-Qaïda prévoyaient d',utiliser, pour faire exploser le siège du gouvernement de la province de Ninive.,16.0,utiliser,utiliser,VERB,VERB,VerbForm=Inf,14.0,xcomp,14:xcomp,_,1.0
162201,611591,Le système est simple à ,utiliser,": lorsqu'un abonné a trouvé une place, il téléphone à Mobilaxe pour spécifier la zone et la durée du stationnement.",6.0,utiliser,utiliser,VERB,VERB,VerbForm=Inf,4.0,xcomp,4:xcomp,SpaceAfter=No,1.0
162231,611743,L'utilisateur peut créer et ,utiliser, plusieurs gestions de podcasts en même temps et répondre à différents besoins d'utilisation.,6.0,utiliser,utiliser,VERB,VERB,VerbForm=Inf,4.0,conj,4:conj,_,1.0
162619,613290,Les conditions communément ,utilisées," sont 5 j (on ne peut donc avoir qu'une dégradation partielle) à 20°C, à l'abri de la lumière et de l'air ; on parle alors de la DBO5.",4.0,utilisées,utiliser,VERB,VERB,Gender=Fem|Number=Plur|Tense=Past|VerbForm=Part,2.0,acl,2:acl,_,1.0
163470,616505,Ce File Record décrit la liste des clusters ,utilisés, ou non sur le volume.,9.0,utilisés,utiliser,VERB,VERB,Gender=Masc|Number=Plur|Tense=Past|VerbForm=Part,8.0,acl,8:acl,_,1.0
163625,617083,Par exemple l'énergie ,utilisée," pour cultiver, raffiner les biocarburants reste peu importante par rapport à celle qui est gagnée.",5.0,utilisée,utiliser,VERB,VERB,Gender=Fem|Number=Sing|Tense=Past|VerbForm=Part,4.0,acl,4:acl,_,1.0
164133,619017,"Les agents anesthésiques volatils, aussi appelés anesthésiques allogénés, sont des substances ",utilisées, pour provoquer une anesthésie générale.,14.0,utilisées,utiliser,VERB,VERB,Gender=Fem|Number=Plur|Tense=Past|VerbForm=Part,13.0,acl,13:acl,_,1.0
165215,622860,"L'équation est simple : la chloroquine, l'antipaludéen le plus ",utilisé,", ne marche plus dans nombre de pays africains car les organismes ont développé des résistances.",13.0,utilisé,utiliser,VERB,VERB,Gender=Masc|Number=Sing|Tense=Past|VerbForm=Part,10.0,acl,10:acl,SpaceAfter=No,1.0
167620,632006,C'est le moyen le plus ,utilisé, et aussi le plus sur pour vos transactions sur Internet.,7.0,utilisé,utiliser,VERB,VERB,Gender=Masc|Number=Sing|Tense=Past|VerbForm=Part,4.0,acl,4:acl,_,3.0
168066,633762,La désignation des matériaux Ce document est un site sur la désignation des matériaux présentant toutes les abréviations et symbolisations ,utilisées," pour désigner les aciers, les cuivres, etc.",21.0,utilisées,utiliser,VERB,VERB,Gender=Fem|Number=Plur|Tense=Past|VerbForm=Part,18.0,acl,18:acl,_,1.0
168455,635312,Le but est de familiariser les étudiants avec les différents langages ,utilisés, pour fournir des services en réseaux.,12.0,utilisés,utiliser,VERB,VERB,Gender=Masc|Number=Plur|Tense=Past|VerbForm=Part,11.0,acl,11:acl,_,1.0
168902,636954,"Ils s'inscrivent en concurrence directe avec les solutions de type Windows Home Server de Microsoft qui, selon Shawn Shu, reste encore trop compliquée à ",utiliser, pour séduire les particuliers.,28.0,utiliser,utiliser,VERB,VERB,VerbForm=Inf,26.0,xcomp,26:xcomp,_,1.0
169364,638763,Les antiviraux sont des médicaments ,utilisés, pour traiter les infections causées par des virus ou pour procurer une protection temporaire contre une infection virale.,6.0,utilisés,utiliser,VERB,VERB,Gender=Masc|Number=Plur|Tense=Past|VerbForm=Part,5.0,acl,5:acl,_,1.0
169925,640855,"Les motos et chariots en tout genre, généralement ",utilisés," pour perpétrer des attentats, ne pourront être garés devant les marchés.",10.0,utilisés,utiliser,VERB,VERB,Gender=Masc|Number=Plur|Tense=Past|VerbForm=Part,2.0,acl,2:acl,_,1.0
172834,651858,Le montant réellement ,utilisé," des investissements étrangers directs a été de 69,5 milliards de USD.",4.0,utilisé,utiliser,VERB,VERB,Gender=Masc|Number=Sing|Tense=Past|VerbForm=Part,2.0,acl,2:acl,_,1.0
175489,661996,"A gauche, sur une petite corniche, vous verrez un bouton que vous devrez ",utiliser, pour faire descendre le sommet d'une des pyramides.,16.0,utiliser,utiliser,VERB,VERB,VerbForm=Inf,15.0,xcomp,15:xcomp,_,1.0
177614,669987,"Il existe d'autres appels système pour les processus, en particulier pour demander davantage de mémoire (ou restituer de la mémoire non ",utilisée,"), ou pour attendre la fin d'un processus fils et remplacer son code par un programme différent.",25.0,utilisée,utiliser,VERB,VERB,Gender=Fem|Number=Sing|Tense=Past|VerbForm=Part,23.0,acl,23:acl,SpaceAfter=No,2.0
177699,670287,"Ce danger existe cependant quelle que soit la langue internationale (devenant alors """"universelle"""") ",utilisée,", construite ou non.",18.0,utilisée,utiliser,VERB,VERB,Gender=Fem|Number=Sing|Tense=Past|VerbForm=Part,9.0,acl,9:acl,SpaceAfter=No,1.0
181360,684589,"Dès 2008, chez Fortis, le compte le plus ",utilisé,", """" Easy Pack """", passera de 27 euros à 31 euros par an.",11.0,utilisé,utiliser,VERB,VERB,Gender=Masc|Number=Sing|Tense=Past|VerbForm=Part,8.0,acl,8:acl,SpaceAfter=No,1.0
181570,685405,Il désigne «personnalité de l'année» quiconque a créé ou ,utilisé, du contenu sur Internet.,13.0,utilisé,utiliser,VERB,VERB,Gender=Masc|Number=Sing|Tense=Past|VerbForm=Part,11.0,conj,11:conj,_,3.0
182306,687967,"Les exemples les plus connus sont les piles électriques, les déboucheurs chimiques de canalisations, les médicaments non ",utilisés,", auxquels il faut rajouter les peintures, les pesticides, les déchets de produits électroniques.",20.0,utilisés,utiliser,VERB,VERB,Gender=Masc|Number=Plur|Tense=Past|VerbForm=Part,18.0,acl,18:acl,SpaceAfter=No,1.0
182438,688511,"La principale mesure, qui entrerait en vigueur le 1er janvier prochain, est une hausse de 7 pour cent des seuils de revenu imposable ",utilisés, pour calculer le taux d'impôt.,26.0,utilisés,utiliser,VERB,VERB,Gender=Masc|Number=Plur|Tense=Past|VerbForm=Part,22.0,acl,22:acl,_,1.0
182997,690497,Affinez vos traductions avec Harrap's Shorter : Actuel et facile à ,utiliser,", la nouvelle version du Harrap's Shorter est non seulement un dictionnaire bilingue incomparable mais plus généralement un véritable outil d'aide à la rédaction.",13.0,utiliser,utiliser,VERB,VERB,VerbForm=Inf,11.0,xcomp,11:xcomp,SpaceAfter=No,1.0
185243,698977,Simplement parcequ'il est beaucoup plus important de diffuser du code que des milliers d'utilisateurs vont pouvoir ,utiliser," et tester, que d'attendre des mois qu'une version soit ``compl&#232;te''.",19.0,utiliser,utiliser,VERB,VERB,VerbForm=Inf,18.0,xcomp,18:xcomp,_,3.0
185402,699433,La fermeture des gares qui ,utilisaient, a fait le bonheur des industriels qui les ont repris...,6.0,utilisaient,utiliser,VERB,VERB,Mood=Ind|Number=Plur|Person=3|Tense=Imp|VerbForm=Fin,4.0,acl:relcl,4:acl:relcl,_,1.0
185450,699592,Le filtre UV le plus ,utilisé, est l'octylméthoxycinnamate (retrouvé dans 21 échantillons sur 29) ; il est souvent associé au butylméthoxydibenzoylméthane.,6.0,utilisé,utiliser,VERB,VERB,Gender=Masc|Number=Sing|Tense=Past|VerbForm=Part,2.0,acl,2:acl,_,1.0
186179,702267,Ce type de risque existe avec d'autres technologies ,utilisées, pour améliorer les plantes.,10.0,utilisées,utiliser,VERB,VERB,Gender=Fem|Number=Plur|Tense=Past|VerbForm=Part,9.0,acl,9:acl,_,1.0
188019,709216,Les bilans mitigés montrent que les formules jusqu'alors ,utilisées," ont atteint leurs limites, mêmes si elles ont développé des richesses dont il ne faudrait pas se détourner.",10.0,utilisées,utiliser,VERB,VERB,Gender=Fem|Number=Plur|Tense=Past|VerbForm=Part,7.0,acl,7:acl,_,1.0
190277,717888,"A noter que, comme son prédécesseur, il gère la technologie TPM 1.2 (Trusted Platform Module) qui permet l'authentification du système afin de savoir s'il a l'autorisation ou non d'",utiliser, ou d'installer certains logiciels.,37.0,utiliser,utiliser,VERB,VERB,VerbForm=Inf,33.0,acl,33:acl,_,1.0
190717,719523,Les 6 milliards versés par la Confédération pour sauver l'UBS se verraient-ils donc ,utilisés, pour distribuer des bonus aux employés?,16.0,utilisés,utiliser,VERB,VERB,Gender=Masc|Number=Plur|Tense=Past|VerbForm=Part,13.0,xcomp,13:xcomp,_,1.0
193449,729964,"En serre verre, les structures les plus ",utilisées, sont aujourd'hui les serres venlo et de plus en plus celles en 2 X 4 m et de hauteurs élevées.,9.0,utilisées,utiliser,VERB,VERB,Gender=Fem|Number=Plur|Tense=Past|VerbForm=Part,6.0,acl,6:acl,_,1.0
194154,732511,Ils considéraient que seule l'agriculture était vraiment productrice en apportant plus (aliments) qu'elle n',utilisait," (semences), les autres activités ne faisant que transformer les produits naturels.",19.0,utilisait,utiliser,VERB,VERB,Mood=Ind|Number=Sing|Person=3|Tense=Imp|VerbForm=Fin,12.0,acl:relcl,12:acl:relcl,_,2.0
194306,733045,"L'active queue management ou gestion active de file d'attente, est un ensemble de techniques ",utilisées," pour traiter le problème de congestion dans les réseaux IP, tel que le réseau Internet.",18.0,utilisées,utiliser,VERB,VERB,Gender=Fem|Number=Plur|Tense=Past|VerbForm=Part,17.0,acl,17:acl,_,1.0
195264,736477,Les catégories ,utilisées, lorsqu'il est question de pays en développement font référence aux objectifs et aux concepts de ceux qui les utilisent.,3.0,utilisées,utiliser,VERB,VERB,Gender=Fem|Number=Plur|Tense=Past|VerbForm=Part,2.0,acl,2:acl,_,1.0
