Unnamed: 0,sent_id,left_context,pivot,right_context,ID,FORM,LEMMA,UPOS,XPOS,FEATS,HEAD,DEPREL,DEPS,MISC,dist
49,233,"Non que le jeu ne vaille absolument pas le coup, mais quand on se frotte à un géant comme GTA, il ",vaut, mieux avoir des arguments un peu plus sérieux pour espérer s'en sortir dignement.,24.0,vaut,valoir,VERB,VERB,Mood=Ind|Number=Sing|Person=3|Tense=Pres|VerbForm=Fin,1.0,conj,1:conj,_,1.0
1381,5128,"Il n'appelle plus la même déférence», fait ",valoir," le politologue, dont le raisonnement peut aisément s'appliquer à toutes les générations.",11.0,valoir,valoir,VERB,VERB,VerbForm=Inf,3.0,parataxis,3:parataxis,_,1.0
2205,8244,"Les producteurs privés viennent nous voir avec des idées et nous sommes ouverts aux propositions», fait ",valoir, le nouveau patron de TQS.,19.0,valoir,valoir,VERB,VERB,VerbForm=Inf,4.0,parataxis,4:parataxis,_,1.0
3231,12141,La parole d'un Président ,vaut," plus qu'une Convention d'extradition, ratifiée par le Parlement français ?",6.0,vaut,valoir,VERB,VERB,Mood=Ind|Number=Sing|Person=3|Tense=Pres|VerbForm=Fin,0.0,root,0:root,_,1.0
4310,16070,"Mais un souterrain, cela fait travailler les esprits et si le fouilles doivent être entreprises, mieux ",vaut, commencer par rechercher l'emplacement le plus probable.,19.0,vaut,valoir,VERB,VERB,Mood=Ind|Number=Sing|Person=3|Tense=Pres|VerbForm=Fin,7.0,conj,7:conj,_,2.0
9584,35653,"Mon expérience dans des secteurs industriels pas toujours faciles m'a appris que si vous posez les problèmes avec les gens, pas sans eux ou contre eux, vous arrivez toujours, vaille que ",vaille,", à trouver une solution.",34.0,vaille,valoir,ADV,ADV,_,31.0,advmod,31:advmod,_,1.0
18787,70435,Discuter autour d'un petit thé à la menthe au café «les amoureux d'Asilah» assis sur de modestes chaises en bambou sur le bord de l'Atlantique ,vaut, bien plus que tous les forums et académies des plus grandes métropoles du monde.,31.0,vaut,valoir,VERB,VERB,Mood=Ind|Number=Sing|Person=3|Tense=Pres|VerbForm=Fin,0.0,root,0:root,_,1.0
19954,74828,"Le fait même que le BND se soit excusé, fait-il ",valoir,", montre que les services secrets «perçoivent l'existence d'un problème».",13.0,valoir,valoir,VERB,VERB,VerbForm=Inf,0.0,root,0:root,SpaceAfter=No,1.0
21343,79921,"C'est une décision qui entérine les déclarations"""" faites par M. Blatter immédiatement après le match, a fait ",valoir," M. Sahin, pour qui """"cette décision est davantage politique que sportive"""".",21.0,valoir,valoir,VERB,VERB,VerbForm=Inf,4.0,parataxis,4:parataxis,_,3.0
23327,87687,Mais l'argument ne ,vaut, que si la baisse du taux est effectivement et durablement répercutée en totalité sur le prix facturé au client.,5.0,vaut,valoir,VERB,VERB,Mood=Ind|Number=Sing|Person=3|Tense=Pres|VerbForm=Fin,0.0,root,0:root,_,1.0
24880,93142,"Il n'appartient pas à Air France de remettre en cause de telles décisions prises dans le cadre d'un Etat de droit"""", a fait ",valoir, le porte-parole de la compagnie.,28.0,valoir,valoir,VERB,VERB,VerbForm=Inf,3.0,parataxis,3:parataxis,_,1.0
27349,102624,"Lorsqu'on sait exactement où se trouvent les parcelles, il faut qu'il y ait une sanction de l'acte illégal de fauchage"""", a fait ",valoir, le président de la commission des Affaires économiques.,30.0,valoir,valoir,VERB,VERB,VerbForm=Inf,13.0,parataxis,13:parataxis,_,2.0
28369,106598,"Le président Chirac n'est plus sortable"""", a-t-il ajouté, en faisant ",valoir," qu'""""au Comité international olympique des critères de géopolitique ont joué contre nous"""".",17.0,valoir,valoir,VERB,VERB,VerbForm=Inf,13.0,advcl,13:advcl,_,1.0
28848,108505,"Quant aux prix, """"ils fluctuent en fonction de l'offre et de la demande, et la demande a été forte sur Paris en juillet"""", a fait ",valoir," Bertrand Lecourt, président de la chambre syndicale des hôteliers de Paris.",32.0,valoir,valoir,VERB,VERB,VerbForm=Inf,7.0,parataxis,7:parataxis,_,2.0
29998,113051,"Il prend la parole de Guité contre la mienne alors qu'il écrit que Guité n'a aucune crédibilité», a fait ",valoir, M. Pelletier.,24.0,valoir,valoir,VERB,VERB,VerbForm=Inf,2.0,parataxis,2:parataxis,_,2.0
30457,114821,L'homme pense au Dr Folamour et se dit qu'il ,vaut," mieux en rire faute de pleurer ou de ne plus dormir.Ainsi, même les plus grands secrets sont-ils de polichinelles.",12.0,vaut,valoir,VERB,VERB,Mood=Ind|Number=Sing|Person=3|Tense=Pres|VerbForm=Fin,9.0,ccomp,9:ccomp,_,1.0
31376,118285,"Mais elles demandent du temps et de la méthode. """" Ca ne sert à rien de lire des livres, il ",vaut," mieux faire des expériences sur Internet """".",23.0,vaut,valoir,VERB,VERB,Mood=Ind|Number=Sing|Person=3|Tense=Pres|VerbForm=Fin,0.0,root,0:root,_,3.0
31500,118708,"«Tous les parents ont eu leur premier choix», fait ",valoir," Lyn Thériault-Faust, commissaire du quartier.",13.0,valoir,valoir,VERB,VERB,VerbForm=Inf,6.0,parataxis,6:parataxis,_,1.0
40808,153887,"Si tous les automobilistes s'étaient attachés en 2007, «65 vies de plus auraient été sauvées», a fait ",valoir, le professeur de mathématiques.,23.0,valoir,valoir,VERB,VERB,VerbForm=Inf,13.0,parataxis,13:parataxis,_,1.0
41090,154953,"Nous, nous y avons répondu - le conseil économique nous l'a d'ailleurs demandé - et fait ",valoir, nous étions en mesure de garantir la continuité du service public.,20.0,valoir,valoir,VERB,VERB,VerbForm=Inf,6.0,conj,6:conj,_,2.0
41578,156892,"La Suisse refuserait elle aussi d'exclure deux cantons des accords européens, ont fait ",valoir, divers orateurs.,16.0,valoir,valoir,VERB,VERB,VerbForm=Inf,18.0,case,18:case,_,1.0
41609,157016,"Les remous autour de cette affiche s'inscrivent dans la campagne électorale, a-t-il fait ",valoir,", soulignant dans la foulée que la notion de mouton noir était la même dans toutes les langues.",18.0,valoir,valoir,VERB,VERB,VerbForm=Inf,3.0,dep,3:dep,SpaceAfter=No,1.0
53441,201465,"La tradition Soto estime, quant à elle, qu'il ",vaut," mieux s'en tenir à la seule posture assise, zazen, le kōan risquant de se pervertir en un jeu de l'esprit ou dans une réflexion inutile.",12.0,vaut,valoir,VERB,VERB,Mood=Ind|Number=Sing|Person=3|Tense=Pres|VerbForm=Fin,4.0,ccomp,4:ccomp,_,1.0
54067,203666,Ce film ne ,vaut, pas plus que les quelques jetons que j'ai en moins.,4.0,vaut,valoir,VERB,VERB,Mood=Ind|Number=Sing|Person=3|Tense=Pres|VerbForm=Fin,0.0,root,0:root,_,1.0
57093,214836,"Honey amène un jour à son frère les coordonnées téléphoniques des agents d'Anna, mais il les jette car cela ",vaut, mieux pour son moral.,22.0,vaut,valoir,VERB,VERB,Mood=Ind|Number=Sing|Person=3|Tense=Pres|VerbForm=Fin,19.0,conj,19:conj,_,1.0
58457,219856,"Les coûts, fait-il ",valoir,", n'y ont augmenté que de 1,6% en 2007.",6.0,valoir,valoir,VERB,VERB,VerbForm=Inf,0.0,root,0:root,SpaceAfter=No,1.0
59890,225491,"C'est la même campagne de peur des libéraux"""", a fait ",valoir," Dimitri Soudas, attaché de presse du premier ministre, qui a pris la peine de souligner que le gouvernement conservateur n'a aucunement l'intention de rouvrir le débat sur la peine de mort.",14.0,valoir,valoir,VERB,VERB,VerbForm=Inf,5.0,parataxis,5:parataxis,_,1.0
62829,237041,Le virtuel ne ,vaut, pas toujours mieux que le réel.,4.0,vaut,valoir,VERB,VERB,Mood=Ind|Number=Sing|Person=3|Tense=Pres|VerbForm=Fin,0.0,root,0:root,_,1.0
66194,249724,"De plus, si jamais la garantie pour les délais d'attente devait s'appliquer à d'autres chirurgie que celles des hanches, des genoux et des cataractes, il faudrait obtenir plus de fonds d'Ottawa, a fait ",valoir, le ministre Couillard.,42.0,valoir,valoir,VERB,VERB,VerbForm=Inf,32.0,parataxis,32:parataxis,_,2.0
68770,259564,"Parce que la F1 est si médiatique, nous faisons toujours très attention à ne faire rien qui puisse la discréditer à cause du grand nombre de personnes qui vivent de cela"""", a encore fait ",valoir, le pilote.,38.0,valoir,valoir,VERB,VERB,VerbForm=Inf,10.0,parataxis,10:parataxis,_,1.0
70497,265992,"Le constat brutal, qui fait écho aux inquiétudes de Jacques Parizeau formulées plus tôt cet automne, ",vaut," même lorsqu'on isole l'effet d'autres variables, tel le milieu socioéconomique.",19.0,vaut,valoir,VERB,VERB,Mood=Ind|Number=Sing|Person=3|Tense=Pres|VerbForm=Fin,0.0,root,0:root,_,1.0
70510,266044,Faut-il la remplacer par Image:Emile Zola - Pot-Bouille.djvu ou bien ,vaut,-il mieux placer dans les liens externes quelque chose comme Lire Pot-Bouille en ligne ?,14.0,vaut,valoir,VERB,VERB,Mood=Ind|Number=Sing|Person=3|Tense=Pres|VerbForm=Fin,0.0,root,0:root,SpaceAfter=No,1.0
71611,270069,"Peter Friederich a reconnu avoir touché les sommes en jeu mais croyait avoir affaire à des investisseurs pour des placements en bourse, a fait ",valoir, Me Didier Bottge.,26.0,valoir,valoir,VERB,VERB,VerbForm=Inf,0.0,root,0:root,_,3.0
72623,273744,"Cette stratégie nous a conduits à nous intéresser à des actifs très sûrs """", fait ",valoir, Olivier Goy.,17.0,valoir,valoir,VERB,VERB,VerbForm=Inf,5.0,parataxis,5:parataxis,_,1.0
73244,276131,Une petite image ,vaut," mieux qu'un long discours, que pensez-vous du modèle ?",4.0,vaut,valoir,VERB,VERB,Mood=Ind|Number=Sing|Person=3|Tense=Pres|VerbForm=Fin,0.0,root,0:root,_,1.0
76872,289375,"Nous sommes au début de l'année, et Boeing, comme certaines compagnies, préfère être conservateur», fait aussi ",valoir, M. Szuper.,23.0,valoir,valoir,VERB,VERB,VerbForm=Inf,0.0,root,0:root,_,2.0
83011,312027,"Toutes les fantaisies sont permises, mais il ",vaut," mieux, cependant, respecter l'harmonie des couleurs.",9.0,vaut,valoir,VERB,VERB,Mood=Ind|Number=Sing|Person=3|Tense=Pres|VerbForm=Fin,5.0,conj,5:conj,_,1.0
90381,340526,"Les critiques incessantes à l'endroit de leur plan sur la qualité de l'air les auront peut-être forcés à faire plus dans ce secteur"""", a fait ",valoir, M. Ogilvie.,30.0,valoir,valoir,VERB,VERB,VerbForm=Inf,19.0,parataxis,19:parataxis,_,1.0
91904,346390,"L'hôpital est un des plus fréquentés d'Ankara et traitent des cas difficiles avec des nouveaux-nés venant de tout le pays, a fait ",valoir, M. Dilmen.,28.0,valoir,valoir,VERB,VERB,VerbForm=Inf,0.0,root,0:root,_,1.0
92292,347899,"Les scandales (de corruption) ont nui à notre cause, mais le vrai scandale de Washington, c'est les dépenses fédérales sans fin, et nos électeurs ont dit 'ça suffit fait ",valoir, M. Pence.,38.0,valoir,valoir,VERB,VERB,VerbForm=Inf,33.0,ccomp,33:ccomp,_,1.0
92936,350478,Cette réponse suffit à prouver que le quintuple médaillé des Mondiaux 2005 de Bormio ,vaut," mieux que l'air d'éternel satisfait et de premier de la classe, qu'il affiche sous sa casquette vissée à l'envers.",15.0,vaut,valoir,VERB,VERB,Mood=Ind|Number=Sing|Person=3|Tense=Pres|VerbForm=Fin,5.0,advcl,5:advcl,_,1.0
96431,363764,"Sauf que ce projet «permettra d'assurer un approvisionnement en électricité pour le Québec, mais également pour le réseau électrique nord-américain», a fait ",valoir, M. Harper.,28.0,valoir,valoir,VERB,VERB,VerbForm=Inf,6.0,parataxis,6:parataxis,_,2.0
96813,365170,"Le nucléaire, a fait ",valoir," Michaël Marie, secrétaire régional des Verts Basse-Normandie, est """"une pieuvre qui mange l'espace des autres secteurs de l'économie, sans créer d'emplois"""".",6.0,valoir,valoir,VERB,VERB,VerbForm=Inf,19.0,dep,19:dep,_,1.0
103546,390588,"On va les mettre en place graduellement», a fait ",valoir, M. Charest.,12.0,valoir,valoir,VERB,VERB,VerbForm=Inf,2.0,parataxis,2:parataxis,_,2.0
104148,392873,"La grippe aviaire a touché la France mais """"ce n'est qu'une épizootie, pas une épidémie et encore moins une pandémie"""", fait ",valoir," M. Virolle.""""",28.0,valoir,valoir,VERB,VERB,VerbForm=Inf,5.0,parataxis,5:parataxis,_,1.0
109410,412887,Afin de respecter l'adage « Mieux ,vaut," prévenir que guérir », les entreprises doivent donc envisager l'ajout systématique d'une clause au sein de leurs contrats, qui tiendrait compte de ce genre de situation.",8.0,vaut,valoir,VERB,VERB,Mood=Ind|Number=Sing|Person=3|Tense=Pres|VerbForm=Fin,0.0,root,0:root,_,1.0
118676,448422,"Partout où il va au Canada il mentionne que le français est la langue fondatrice de ce pays», a fait ",valoir," Dimitris Soudas, porte-parole de M. Harper.",23.0,valoir,valoir,VERB,VERB,VerbForm=Inf,0.0,root,0:root,_,2.0
122371,462431,"C'était un engagement précis de ce nouveau gouvernement, c'est populaire, et j'encourage les autres partis à l'appuyer"""", a fait ",valoir," M. Harper, à la sortie de la première réunion de son conseil des ministres.",28.0,valoir,valoir,VERB,VERB,VerbForm=Inf,4.0,parataxis,4:parataxis,_,1.0
126283,476951,"Pas même, tant la majorité des économistes est désormais convaincue que la seule question qui ",vaille," n'est plus de savoir si la récession est là ou pas, mais combien de temps durera """"la crise"""".",17.0,vaille,valoir,VERB,VERB,Mood=Ind|Number=Sing|Person=3|Tense=Pres|VerbForm=Fin,15.0,acl:relcl,15:acl:relcl,_,3.0
129978,490636,C'est la vie du foot mais il ,vaut, mieux entendre ça de la part des joueurs ».,9.0,vaut,valoir,VERB,VERB,Mood=Ind|Number=Sing|Person=3|Tense=Pres|VerbForm=Fin,4.0,conj,4:conj,_,2.0
132144,498969,"Les établissements scolaires devraient rouvrir lundi, """"à l'exception de quelques communes où les bâtiments ont été inondés, mais c'est marginal"""", a fait ",valoir, M. Vallaud.,30.0,valoir,valoir,VERB,VERB,VerbForm=Inf,4.0,parataxis,4:parataxis,_,1.0
132312,499642,"Pour l'instant, «il n'a pas été déterminé que la mort est directement reliée à l'utilisation du Taser», a fait ",valoir, le ministre responsable de la police.,27.0,valoir,valoir,VERB,VERB,VerbForm=Inf,11.0,parataxis,11:parataxis,_,1.0
134741,508813,"Par temps de pluie, les fosses septiques débordent et il ",vaut, mieux se munir de bonnes bottes et d'un guide pour celui qui n'est pas du « cru ».,12.0,vaut,valoir,VERB,VERB,Mood=Ind|Number=Sing|Person=3|Tense=Pres|VerbForm=Fin,9.0,conj,9:conj,_,1.0
135264,510824,"L'ACIDE : Attention, le Vrai Acide est une défonce hyper forte, à ne pas prendre tout seul, dans un endroit cool, avec des gens cools avec qui y'a pas de problèmes, il ",vaut, mieux être bien dans sa tête et dans sa vie.,40.0,vaut,valoir,VERB,VERB,Mood=Ind|Number=Sing|Person=3|Tense=Pres|VerbForm=Fin,18.0,xcomp,18:xcomp,_,1.0
140802,531458,"L'évolution des comptes publics n'est que l'un des indicateurs pris en compte par la BCE dans le cadre de sa stratégie"""", a fait ",valoir, le gouverneur de la Banque de France.,29.0,valoir,valoir,VERB,VERB,VerbForm=Inf,10.0,parataxis,10:parataxis,_,1.0
142593,538355,"Oui, mais, elle vaut quoi, cette housse (elle ",vaut, 25  environ !),6.0,vaut,valoir,VERB,VERB,Mood=Ind|Number=Sing|Person=3|Tense=Pres|VerbForm=Fin,0.0,root,0:root,_,3.0
143651,542261,"Il n'y a aucun motif pour notre parti de faire confiance à ce gouvernement"""", a fait ",valoir," M. Layton, disant aussi que le verdict du juge John Gomery dans son rapport sur le scandale des commandites a aussi pesé dans la balance.",20.0,valoir,valoir,VERB,VERB,VerbForm=Inf,4.0,parataxis,4:parataxis,_,1.0
143793,542727,"«Il pourrait y avoir 1800 bulletins différents», fait ",valoir," ce groupe cofondé par l'historien Éric Bédard, selon qui le Ministère «manque de leadership».",12.0,valoir,valoir,VERB,VERB,VerbForm=Inf,3.0,parataxis,3:parataxis,_,2.0
148166,559142,"La proportionnelle est à manier avec prudence"""", a fait ",valoir," le ministre de l'Intérieur François Baroin, jugeant que """"c'est le scrutin majoritaire qui donne les moyens d'agir"""".",13.0,valoir,valoir,VERB,VERB,VerbForm=Inf,6.0,parataxis,6:parataxis,_,1.0
149808,565291,Quelquefois les enfants arrivent à baisser la tête sans faire tomber l'anneau ; il ,vaut, mieux alors coller un dessin sur le mus en face et leur demander de le regarder.,16.0,vaut,valoir,VERB,VERB,Mood=Ind|Number=Sing|Person=3|Tense=Pres|VerbForm=Fin,0.0,root,0:root,_,2.0
151648,572228,"C'est donc quitte ou double pour Button, qui visiblement a compris qu'il n'avait pas grande marge de manoeuvre dans les circonstances, et que l'attente ",valait, mieux que la fuite.,31.0,valait,valoir,VERB,VERB,Mood=Ind|Number=Sing|Person=3|Tense=Imp|VerbForm=Fin,17.0,conj,17:conj,_,1.0
152356,574906,"«Les salaires réels augmentent selon un taux supérieur à 10 % depuis le milieu de 2005, ce qui stimule la demande intérieure», fait ",valoir, M. Gomes.,28.0,valoir,valoir,VERB,VERB,VerbForm=Inf,5.0,parataxis,5:parataxis,_,2.0
152574,575716,Nous avons des qualités à faire ,valoir,", affirme le commissaire-priseur.",7.0,valoir,valoir,VERB,VERB,VerbForm=Inf,4.0,acl,4:acl,SpaceAfter=No,1.0
153138,577620,"Il ne faut effectivement pas prêter le flanc à la critique, et il ",valait, je crois mieux que ce soit moi qui le réduise.,15.0,valait,valoir,VERB,VERB,Mood=Ind|Number=Sing|Person=3|Tense=Imp|VerbForm=Fin,3.0,conj,3:conj,_,1.0
159086,599815,"À cause de """"cette conduite trompeuse et malhonnête, Paterson a accru la teneur en or de certains échantillons"""", fait ",valoir, la plaignante.,24.0,valoir,valoir,VERB,VERB,VerbForm=Inf,13.0,parataxis,13:parataxis,_,1.0
162529,612923,"Or celle-ci peut s'avérer dangereuse pour leur santé, a fait ",valoir, Thérèse Meyer (PDC/FR) au nom de la commission.,13.0,valoir,valoir,VERB,VERB,VerbForm=Inf,14.0,case,14:case,_,1.0
163263,615737,Une loi fédérale ,vaut, mieux qu'un concordat entre tous les cantons.,4.0,vaut,valoir,VERB,VERB,Mood=Ind|Number=Sing|Person=3|Tense=Pres|VerbForm=Fin,0.0,root,0:root,_,1.0
164412,619963,"La situation des locataires à faible revenu est loin de s'être améliorée», fait ",valoir," le coordonnateur du FRAPRU, François Saillant.",17.0,valoir,valoir,VERB,VERB,VerbForm=Inf,9.0,parataxis,9:parataxis,_,1.0
166495,627807,"Ce jeu a eu de sales critiques tout de même, il ne ",vaut," pas et de loin un DMCM'enfin je le ferai mon opinion moi meme, meme si acheter ça 60...",14.0,vaut,valoir,VERB,VERB,Mood=Ind|Number=Sing|Person=3|Tense=Pres|VerbForm=Fin,4.0,advcl,4:advcl,_,1.0
167968,633392,"Un des objectifs principaux est d'approfondir un peu plus les relations entre l'Afrique du Sud et l'Union européenne"""", a fait ",valoir, le gouvernement sud-africain dans un communiqué.,26.0,valoir,valoir,VERB,VERB,VerbForm=Inf,5.0,parataxis,5:parataxis,_,1.0
169470,639143,"Rapportées à la population chinoise, les émissions de GES sont relativement faibles, a fait ",valoir, le chef de l'Etat.,17.0,valoir,valoir,VERB,VERB,VerbForm=Inf,13.0,parataxis,13:parataxis,_,1.0
172729,651505,"A plus court terme, une """"avance à ",valoir," de 200 euros sur les revalorisations à venir sera versée """"courant avril"""", selon l'Elysée, aux quelque 634.000 bénéficiaires du minimum vieillesse.",10.0,valoir,valoir,VERB,VERB,VerbForm=Inf,8.0,acl,8:acl,SpaceAfter=No,2.0
173665,655060,"Comme c'est toi qui a chargé l'original sur Commons, il ",vaudrait, mieux que tu charges toi-même cette version.,14.0,vaudrait,valoir,VERB,VERB,Mood=Cnd|Number=Sing|Person=3|Tense=Pres|VerbForm=Fin,0.0,root,0:root,_,1.0
174866,659540,"Le lait coûte plus cher au Canada qu'ailleurs, fait également ",valoir," Pierre M. Nadeau, président-directeur général du Conseil des industriels laitiers du Québec (CILQ), qui regroupe des transformateurs de lait, dont des fabricants de fromage.",13.0,valoir,valoir,VERB,VERB,VerbForm=Inf,0.0,root,0:root,_,1.0
175260,661168,C'est l'offre et la demande qui détermine le prix de vente fait ,valoir," M. Roy.Ainsi, il n'est pas rare qu'une petite maison, située sur une butte, se vende autour de 150 000 $.",15.0,valoir,valoir,VERB,VERB,VerbForm=Inf,16.0,case,16:case,_,1.0
175388,661619,"Cela n'est pas un gros problème, je n'ai aucun droits d'auteur à faire ",valoir,", mais ça me semble bizarre ces modifications d'historique : pourquoi ?",18.0,valoir,valoir,VERB,VERB,VerbForm=Inf,13.0,acl,13:acl,SpaceAfter=No,3.0
178107,671782,"Ni Washington ni Bruxelles, qui ont d'autres revendications à faire ",valoir," auprès de Pékin, ne l'ignore.",13.0,valoir,valoir,VERB,VERB,VerbForm=Inf,10.0,acl,10:acl,_,1.0
178253,672334,"La possibilité donnée à ceux qui le désirent de déposer leurs armes à l'arsenal plutôt que de les garder à la maison suffit, a fait ",valoir, Ulrich Schlüer (UDC/ZH).,28.0,valoir,valoir,VERB,VERB,VerbForm=Inf,0.0,root,0:root,_,1.0
178612,673789,"« Nous avons un avantage cette année, et c'est le fait d'avoir un mécanisme en place pour procéder aux observations, ce qui a permis de lancer des avertissements précoces et d'empêcher bien des morts », a fait ",valoir, M. Anyamba.,44.0,valoir,valoir,VERB,VERB,VerbForm=Inf,3.0,parataxis,3:parataxis,_,2.0
179540,677334,"S'adapter ne signifie pas pour autant renoncer à lutter contre le réchauffement, ont fait ",valoir, une partie des participants.,17.0,valoir,valoir,VERB,VERB,VerbForm=Inf,0.0,root,0:root,_,1.0
179869,678584,"Vous l'aurez compris, si vous n'avez toujours pas installé le dernier correctif en date, il ",vaut," encore mieux s'abstenir, le temps que RedOctane trouve une solution enfin fiable pour leur Guitar Hero II.",20.0,vaut,valoir,VERB,VERB,Mood=Ind|Number=Sing|Person=3|Tense=Pres|VerbForm=Fin,0.0,root,0:root,_,2.0
181815,686269,Pour nous le seul sondage qui ,vaille," vraiment, ce sont les chiffres attestant de la réalisation de nos objectifs.",7.0,vaille,valoir,VERB,VERB,Mood=Ind|Number=Sing|Person=3|Tense=Pres|VerbForm=Fin,5.0,acl:relcl,5:acl:relcl,_,1.0
185971,701495,En clair: le contrôle administratif qu'exercent les Etats-Unis sur Internet ,vaut, mieux que celui qui pourrait exercer les dictatures via un organisme international.,13.0,vaut,valoir,VERB,VERB,Mood=Ind|Number=Sing|Person=3|Tense=Pres|VerbForm=Fin,0.0,root,0:root,_,1.0
186733,704374,"De ce fait, il a indiqué que pour être membre de l'organisation le seul critère qui ",vaille, est celui d'avoir 18 ans et moins de 40 ans: Les autres critères fondés notamment sur la fortune s'avérant non fondés.,19.0,vaille,valoir,VERB,VERB,Mood=Ind|Number=Sing|Person=3|Tense=Pres|VerbForm=Fin,17.0,acl:relcl,17:acl:relcl,_,2.0
189188,713805,Son acquisition ,valait,"-elle les 5,2 millions de dollars qu'il allait devoir inscrire dans sa masse salariale ?",3.0,valait,valoir,VERB,VERB,Mood=Ind|Number=Sing|Person=3|Tense=Imp|VerbForm=Fin,0.0,root,0:root,SpaceAfter=No,1.0
189701,715828,C'est pendant cette période que Guaita a montré qu'il ,valait, bien mieux que sa bévue de la première mi-temps.,12.0,valait,valoir,VERB,VERB,Mood=Ind|Number=Sing|Person=3|Tense=Imp|VerbForm=Fin,9.0,ccomp,9:ccomp,_,1.0
190084,717199,"Le Premier ministre se réjouit d'apporter rapidement son témoignage et il fait toute confiance à la justice pour que la vérité soit faite dans cette affaire"""", a-t-on fait ",valoir, samedi à Matignon.,34.0,valoir,valoir,VERB,VERB,VerbForm=Inf,5.0,parataxis,5:parataxis,_,2.0
190742,719640,"Le capitalisme de marché est bon pour ceux qui ont la capacité de survivre, a fait ",valoir," M. Ozawa, mais ses excès doivent être rectifiés afin que chacun puisse avoir une vie décente.",18.0,valoir,valoir,VERB,VERB,VerbForm=Inf,6.0,parataxis,6:parataxis,_,1.0
198159,747769,"Et s'ils le prétendent et le maintiennent, ils font preuve d'un aveuglement grave», a fait ",valoir, M. Boisclair.,21.0,valoir,valoir,VERB,VERB,VerbForm=Inf,11.0,parataxis,11:parataxis,_,2.0
198291,748318,"Il faut s'assurer de lui offrir le même prix que lorsqu'on avait 8000 wagons qui circulaient sur la voie », fait ",valoir, M. Roussy.,25.0,valoir,valoir,VERB,VERB,VerbForm=Inf,2.0,parataxis,2:parataxis,_,2.0
202678,764548,"Pour ce spécialiste du virtuel, les blogs sont une forme d'exhibitionnisme sain : « Il ",vaut," mieux que les adolescents ne gardent pas pour eux leurs angoisses face à deux grands thèmes tabous, le sexe et la mort. »",18.0,vaut,valoir,VERB,VERB,Mood=Ind|Number=Sing|Person=3|Tense=Pres|VerbForm=Fin,11.0,dep,11:dep,_,2.0
204321,771132,"Mais d'ores et déjà , des constructeurs français ont des modèles à leur catalogue qui rejettent moins de gaz carbonique"""" que la Toyota Prius, a fait ",valoir, M. Cabal.,31.0,valoir,valoir,VERB,VERB,VerbForm=Inf,11.0,punct,11:punct,_,2.0
204501,771816,"Ce processus en deux mouvements réclamant quelques secondes, il ",vaut," mieux éviter de le lancer à découvert, là où on est une cible facile et gérer convenablement ses points de vie sous peine de réapparaître au dernier point de sauvegarde.",11.0,vaut,valoir,VERB,VERB,Mood=Ind|Number=Sing|Person=3|Tense=Pres|VerbForm=Fin,0.0,root,0:root,_,1.0
206626,779622,"On sait que les travaux vont débuter un jour de toute façon», fait ",valoir, la coordonnatrice aux communications de la commission scolaire.,16.0,valoir,valoir,VERB,VERB,VerbForm=Inf,2.0,parataxis,2:parataxis,_,2.0
206741,779977,"Nous sommes partis pour des procédures qui sont longues et qui vont durer des années"""", a fait ",valoir, M. Irastorza.,21.0,valoir,valoir,VERB,VERB,VerbForm=Inf,4.0,parataxis,4:parataxis,_,2.0
213592,805500,Le seul critère qui ,vaille," aujourd'hui pour distinguer les héros intemporels, c'est la réussite sur les quatre tournois du Grand Chelem.",5.0,vaille,valoir,VERB,VERB,Mood=Ind|Number=Sing|Person=3|Tense=Pres|VerbForm=Fin,3.0,acl:relcl,3:acl:relcl,_,1.0
218389,823690,"Ses deux plus proches poursuivants, Malcolm Glazer, propriétaire des Buccaneers, et Wayne Huizenga, des Dolphins, ",valent," tous deux 2,5 G$ US.",21.0,valent,valoir,VERB,VERB,Mood=Ind|Number=Plur|Person=3|Tense=Pres|VerbForm=Fin,0.0,root,0:root,_,1.0
219161,826483,Elle prévoit que l'immunité familiale qui préside dans des affaires de vol ne ,vaut," plus """"lorsque le vol porte sur des objets ou documents indispensables à la vie quotidienne de la victime, tels que des documents d'identité ou des moyens de paiement"""".",15.0,vaut,valoir,VERB,VERB,Mood=Ind|Number=Sing|Person=3|Tense=Pres|VerbForm=Fin,2.0,ccomp,2:ccomp,_,3.0
