Unnamed: 0,sent_id,left_context,pivot,right_context,ID,FORM,LEMMA,UPOS,XPOS,FEATS,HEAD,DEPREL,DEPS,MISC,dist
220468,831384,C'est vrai qu'une bonne éjaculation – Clin d'œil – ,vaut, mieux qu'une proposition AdQ !,13.0,vaut,valoir,VERB,VERB,Mood=Ind|Number=Sing|Person=3|Tense=Pres|VerbForm=Fin,3.0,ccomp,3:ccomp,_,2.0
221166,834208,"Le professeur en pharmocologie Norio Matsuki, qui a dirigé ces travaux, conseille : """"Pour oublier quelque chose de négatif, il ",vaut," mieux l'effacer par quelque chose de positif le plus vite possible et ne pas toucher à l'alcool"""".",25.0,vaut,valoir,VERB,VERB,Mood=Ind|Number=Sing|Person=3|Tense=Pres|VerbForm=Fin,14.0,ccomp,14:ccomp,_,1.0
221277,834637,"C'est un coup de poker.Thibault Giresse, parce qu'il faut une tête de Turc pour faire marrer le groupe, ou pour se défouler, et mieux ",vaut," un petit maigre qu'un grand baraqué, pas vrai ?",32.0,vaut,valoir,VERB,VERB,Mood=Ind|Number=Sing|Person=3|Tense=Pres|VerbForm=Fin,8.0,conj,8:conj,_,3.0
225452,850399,Des Américains estiment qu'il ,vaut, mieux être préventif et éviter les excès.,6.0,vaut,valoir,VERB,VERB,Mood=Ind|Number=Sing|Person=3|Tense=Pres|VerbForm=Fin,3.0,ccomp,3:ccomp,_,1.0
225634,851037,"Bien au contraire, le gouvernement veut encourager les gens à utiliser le plus souvent possible le transport en commun ou le cas échéant, à acheter des voitures moins énergivores et plus écologiques, a fait ",valoir, le ministre des Transports.,38.0,valoir,valoir,VERB,VERB,VerbForm=Inf,7.0,parataxis,7:parataxis,_,1.0
226633,854802,Le président zimbabwéen Robert Mugabe a tenté d'attirer ses concitoyens -- dont le nombre est estimé à 3 millions en Afrique du Sud -- en faisant ,valoir, dimanche qu'il «restait des terres à distribuer».,28.0,valoir,valoir,VERB,VERB,VerbForm=Inf,9.0,advcl,9:advcl,_,1.0
229259,864689,"Cette connaissance sur la période glaciaire est utile parce qu'en sachant la taille de cette nappe de glace, il est possible de savoir que le niveau de la mer a grimpé de 60 mètres lorsqu'elle a fondu, a fait ",valoir, M. Mitrovica.,44.0,valoir,valoir,VERB,VERB,VerbForm=Inf,8.0,parataxis,8:parataxis,_,1.0
234933,885805,"Le programme est très, très perfectible», fait ",valoir," M. Nadeau au Soleil, après avoir sensibilisé le ministre de l'Agriculture.",11.0,valoir,valoir,VERB,VERB,VerbForm=Inf,7.0,parataxis,7:parataxis,_,1.0
235299,887262,"Il vaut mieux attendre la 5e révision de l'AI pour intervenir sur les problèmes de fond, a fait ",valoir, en vain Meinrado Robbiani (PDC/TI).,21.0,valoir,valoir,VERB,VERB,VerbForm=Inf,2.0,parataxis,2:parataxis,_,2.0
237735,896155,"Les paysans estiment que tenter de """"faire pleuvoir"""" pour grappiller quelques litres d'eau ",vaut, mieux que regarder passer un nuage.,17.0,vaut,valoir,VERB,VERB,Mood=Ind|Number=Sing|Person=3|Tense=Pres|VerbForm=Fin,3.0,xcomp,3:xcomp,_,1.0
238381,898491,"Cette procédure ne pourrait être mise en oeuvre qu'à l'initiative d'un demandeur désireux de prouver sa bonne foi le plus rapidement possible"""", a fait ",valoir," Thierry Mariani (UMP), auteur de l'amendement qui a donné lieu à une vive discussion.",30.0,valoir,valoir,VERB,VERB,VerbForm=Inf,4.0,parataxis,4:parataxis,_,1.0
243023,915975,"Il faut transformer cette industrie et augmenter la productivité"""", a fait ",valoir, M. Ménard.,14.0,valoir,valoir,VERB,VERB,VerbForm=Inf,2.0,parataxis,2:parataxis,_,2.0
245758,926197,"Mais de fait, c'est la première fois depuis l'ouverture du parc en 1992 que les salariés ne touchent pas leur prime à la fin de l'année"""", a fait ",valoir, M. Charpentier.,35.0,valoir,valoir,VERB,VERB,VerbForm=Inf,9.0,parataxis,9:parataxis,_,2.0
247521,932796,"Les gars ont fait preuve de caractère en revenant après avoir tiré de l'arrière pendant plus de la moitié de la partie"""", a fait ",valoir, l'entraîneur en chef Yohan Duranleau.,28.0,valoir,valoir,VERB,VERB,VerbForm=Inf,4.0,parataxis,4:parataxis,_,1.0
248983,938349,"Mais comme la plupart du temps, les gens ne savent pas leur rôle à jouer, il ",vaut, mieux les apprendre afin qu'ils puissent acquérir une compétence.,19.0,vaut,valoir,VERB,VERB,Mood=Ind|Number=Sing|Person=3|Tense=Pres|VerbForm=Fin,0.0,root,0:root,_,1.0
249578,940452,"Le concept de la « concurrence libre et non faussée » figure de nombreuses fois - une douzaine au moins - dans d’autres documents légaux de l’UE, faisaient ",valoir, des diplomates.,32.0,valoir,valoir,VERB,VERB,VerbForm=Inf,34.0,case,34:case,_,1.0
250347,943247,"Là-bas, la bière est gratis"""", fait ",valoir, le bassiste.,13.0,valoir,valoir,VERB,VERB,VerbForm=Inf,9.0,parataxis,9:parataxis,_,1.0
250419,943570,"Accumulant les succès sportifs, (Roger Federer) est l'un des plus grands ambassadeurs de la Suisse à travers le monde"""", a fait ",valoir, lundi la Poste suisse qui dédie pour la première fois un timbre à une personnalité vivante.,28.0,valoir,valoir,VERB,VERB,VerbForm=Inf,12.0,parataxis,12:parataxis,_,2.0
254748,960105,"Le marché allemand est le plus concurrentiel d'Europe"""", a fait ",valoir, M. Mayrhuber.,15.0,valoir,valoir,VERB,VERB,VerbForm=Inf,8.0,parataxis,8:parataxis,_,1.0
255712,963642,"Genève, Berne, Bâle et Zurich n'ont qu'à payer leur part, a fait ",valoir," Peter Bieri (PDC/ZG), au nom de la majorité.",18.0,valoir,valoir,VERB,VERB,VerbForm=Inf,9.0,advcl,9:advcl,_,1.0
259219,977096,"Un commerçant n'a pas de clause de conscience à invoquer, ni de déontologie à faire ",valoir,", autres que la conformité et la qualité de son produit/service au contrat qui le lie à son client/utilisateur.",18.0,valoir,valoir,VERB,VERB,VerbForm=Inf,15.0,xcomp,15:xcomp,SpaceAfter=No,1.0
262182,988337,Voilà une protection de nos droits d'auteur ainsi reformulés par le copyleft et qui ,vaut, bien celle qui prétend actuellement protéger la création artistique.,16.0,vaut,valoir,VERB,VERB,Mood=Ind|Number=Sing|Person=3|Tense=Pres|VerbForm=Fin,3.0,conj,3:conj,_,2.0
