Unnamed: 0,sent_id,left_context,pivot,right_context,ID,FORM,LEMMA,UPOS,XPOS,FEATS,HEAD,DEPREL,DEPS,MISC,dist
1104,4091,"Ma recommandation, c'est de rencontrer nos partenaires européens, leur dire la situation dans laquelle nous ",sommes," et de voir avec eux quel est le meilleur calendrier possible"""", a-t-il estimé.",19.0,sommes,être,VERB,VERB,Mood=Ind|Number=Plur|Person=1|Tense=Pres|VerbForm=Fin,15.0,acl:relcl,15:acl:relcl,_,1.0
3159,11829,"Quand je suis arrivé, je voyais bien qu'avec le pétrole etc., on y ",serait," pas, donc j'ai dit que je sentais une croissance entre 2,5 et 2%, en indiquant une tendance"""".",17.0,serait,être,VERB,VERB,Mood=Cnd|Number=Sing|Person=3|Tense=Pres|VerbForm=Fin,0.0,root,0:root,_,3.0
3486,13086,Euh… Où ,est, le problème ?,4.0,est,être,VERB,VERB,Mood=Ind|Number=Sing|Person=3|Tense=Pres|VerbForm=Fin,1.0,dep,1:dep,_,1.0
3828,14372,"Je sais qu'il est parfois difficile d'un point de vue politique, quand la croissance ",est," là, que les recettes sont plus importantes qu'attendu, de dire qu'il faut consolider les finances publiques et réduire la dette"""", a souligné M. Almunia.",6.0,est,être,AUX,AUX,Mood=Ind|Number=Sing|Person=3|Tense=Pres|VerbForm=Fin,8.0,cop,8:cop,_,2.0
3917,14729,"C'en est fait de la forteresse d'Éphraïm, Et du royaume de Damas, et du reste de la Syrie: Il en ",sera," comme de la gloire des enfants d'Israël, Dit l'Éternel des armées.",26.0,sera,être,VERB,VERB,Mood=Ind|Number=Sing|Person=3|Tense=Fut|VerbForm=Fin,0.0,root,0:root,_,1.0
4476,16676,"Il a dit qu'il est la vérité, et cela ",est,", car il est uni à moi qui suis la vérité.",6.0,est,être,AUX,AUX,Mood=Ind|Number=Sing|Person=3|Tense=Pres|VerbForm=Fin,8.0,cop,8:cop,_,1.0
5293,19663,"Les vaches sont traites à la main, de la façon la plus traditionnelle qui ",soit,", et les laiteries ne veulent plus de leur production car elle n'est pas conforme à toutes les normes hygiéniques et sanitaires imposées par Bruxelles.",16.0,soit,être,VERB,VERB,Mood=Ind|Number=Sing|Person=3|Tense=Pres|VerbForm=Fin,11.0,acl:relcl,11:acl:relcl,SpaceAfter=No,1.0
6312,23427,"Si le régime linéaire est bien compris, il n'en ",est, pas de même du régime non-linéaire.,5.0,est,être,AUX,AUX,Mood=Ind|Number=Sing|Person=3|Tense=Pres|VerbForm=Fin,7.0,aux:pass,7:aux:pass,_,2.0
6672,24881,Il nous arrive d'utiliser la même machine quand nous ,sommes," ensemble, certains week-ends.",11.0,sommes,être,VERB,VERB,Mood=Ind|Number=Plur|Person=1|Tense=Pres|VerbForm=Fin,5.0,advcl,5:advcl,_,1.0
7193,26935,La force de Business Objects ,est, bien de pouvoir proposer une même technologie déployée sur site ou hébergée ou encore une combinaison des deux.,6.0,est,être,VERB,VERB,Mood=Ind|Number=Sing|Person=3|Tense=Pres|VerbForm=Fin,0.0,root,0:root,_,1.0
7614,28471,Je l'ai fait juste parce que j'avais besoin d'argent et que j',étais, encore en plein dans la défonce.,16.0,étais,être,VERB,VERB,Mood=Ind|Number=Sing|Person=1|Tense=Imp|VerbForm=Fin,9.0,conj,9:conj,_,1.0
8296,30967,"En France, """"c'est une des interventions les plus classiques qui ",soit,", reconnaît le professeur Deloche.",14.0,soit,être,VERB,VERB,Mood=Sub|Number=Sing|Person=3|Tense=Pres|VerbForm=Fin,9.0,acl:relcl,9:acl:relcl,SpaceAfter=No,2.0
8977,33472,Et l'identification du fait que nous n',étions," pas un groupe aérien et que nous n'aurions pas de responsabilité de gestion a été, je dirais, dès le départ clair.",9.0,étions,être,VERB,VERB,Mood=Ind|Number=Plur|Person=1|Tense=Imp|VerbForm=Fin,5.0,acl,5:acl,_,2.0
9275,34536,La traduction française du radiogramme chiffré ci-dessus ,est," : «Hâtez l'approvisionnement en munitions, le faire même de jour tant qu'on n'est pas vu».",10.0,est,être,VERB,VERB,Mood=Ind|Number=Sing|Person=3|Tense=Pres|VerbForm=Fin,0.0,root,0:root,_,1.0
9432,35073,"Benoît Ce jour-là, tes yeux ",étaient," ailleurs, plongés dans le songe du souvenir, ils semblaient regarder vers ton passé, et moi, je ne pouvais deviner pourquoi ce souvenir te troublait tant.",8.0,étaient,être,VERB,VERB,Mood=Ind|Number=Plur|Person=3|Tense=Imp|VerbForm=Fin,19.0,advcl,19:advcl,_,2.0
10999,41238,"Interrogé dernièrement par Boursier.com Jean-Pierre Roturier, le PDG d'Euromedis, avait souligné être """"dans une situation où le résultat d'exploitation progresse fortement"""" et """"il en ",sera," de même pour le résultat net"""".",32.0,sera,être,VERB,VERB,Mood=Ind|Number=Sing|Person=3|Tense=Fut|VerbForm=Fin,25.0,conj,25:conj,_,3.0
11095,41601,Ce qui reste à faire pour l'Algérie c',est,", juste, de commencer probablement après le départ de son président actuel à négocier une mutation stratégique plus conforme aux intérêts réels de son peuple.",10.0,est,être,VERB,VERB,Mood=Ind|Number=Sing|Person=3|Tense=Pres|VerbForm=Fin,0.0,root,0:root,SpaceAfter=No,1.0
11129,41731,"Le mot d'ordre maintenant, c'",est," ne touchez plus aux enfants à moins qu'ils soient eux-mêmes en danger"""", signale Andrée Turbide, présidente du Syndicat de l'enseignement des Deux-Rives, dans la région de Québec.",8.0,est,être,VERB,VERB,Mood=Ind|Number=Sing|Person=3|Tense=Pres|VerbForm=Fin,10.0,nsubj,10:nsubj,_,1.0
11435,42931,"Le cyclone a endommagé 93 bâtiments administratifs, 35 écoles, 43 hôpitaux et 36 ponts ont ",été,", et détruit 36 501 hectares de culture.",18.0,été,être,VERB,VERB,Tense=Past|VerbForm=Part,4.0,conj,4:conj,SpaceAfter=No,1.0
13037,48786,"Dans le même temps, cette prise de position pousse les entreprises à l'introspection, donc à faire l'effort de définir qui elles ",sont, dans toutes leurs dimensions.,26.0,sont,être,VERB,VERB,Mood=Ind|Number=Plur|Person=3|Tense=Pres|VerbForm=Fin,23.0,obj,23:obj,_,1.0
13448,50307,Je crois que ce que l'on peut souligner aussi c',est," combien ils ont apprécié le travail avec des professionnels, le travail en ateliers.",12.0,est,être,VERB,VERB,Mood=Ind|Number=Sing|Person=3|Tense=Pres|VerbForm=Fin,2.0,ccomp,2:ccomp,_,1.0
13681,51093,Aucun clivage n'est apparent que ce ,soit, au niveau du dipeptide EG3 ou d'un autre dipeptide dans cette partie de la polyprotéine.,8.0,soit,être,VERB,VERB,Mood=Sub|Number=Sing|Person=3|Tense=Pres|VerbForm=Fin,5.0,advcl,5:advcl,_,1.0
14013,52241,"Mais SCI déclare aujourd'hui qu'""""il n'",est," plus dans l'intérêt de la compagnie ou de ses actionnaires de prolonger ces discussions plus longtemps"""".",7.0,est,être,VERB,VERB,Mood=Ind|Number=Sing|Person=3|Tense=Pres|VerbForm=Fin,11.0,amod,11:amod,_,1.0
14271,53255,Le roi Abdallah est prêt à faire tout ce qui ,est," en son pouvoir pour les ramener à des """"niveaux convenables"""" , a déclaré hier le secrétaire général de l'ONU, Ban Ki-moon, à l'issue d'une visite en Arabie.",4.0,est,être,AUX,AUX,Mood=Ind|Number=Sing|Person=3|Tense=Pres|VerbForm=Fin,5.0,cop,5:cop,_,1.0
14619,54596,"Lorsque les parents sont séparés, les enfants majeurs habitent plus souvent loin de leur père (48% à plus de deux heures, contre seulement 20% quand les parents ",sont, ensemble).,4.0,sont,être,AUX,AUX,Mood=Ind|Number=Plur|Person=3|Tense=Pres|VerbForm=Fin,5.0,aux:pass,5:aux:pass,_,2.0
14636,54667,"Pour autant, Jean-François Lamour a bien pris soin de préciser à Jacques Peyrat n'avoir aucun pouvoir coercitif, tout ministre qu'il ",soit,", sur une instance indépendante comme la DNCG.",25.0,soit,être,VERB,VERB,Mood=Sub|Number=Sing|Person=3|Tense=Pres|VerbForm=Fin,22.0,acl:relcl,22:acl:relcl,SpaceAfter=No,1.0
15189,56600,"L'Entre-Deux, les Hautes Plaines et les cirques naturels de Salazie et Cilaos font partie des régions les plus courues par les estivants, ces derniers notamment parce qu'ils ",sont, ou ont été des destinations thermales.,32.0,sont,être,VERB,VERB,Mood=Ind|Number=Plur|Person=3|Tense=Pres|VerbForm=Fin,24.0,acl:relcl,24:acl:relcl,_,2.0
15296,57004,"Les États parties prennent toutes les mesures appropriées sur les plans national, bilatéral et multilatéral pour empêcher l'enlèvement, la vente ou la traite d'enfants à quelque fin que ce ",soit, et sous quelque forme que ce soit.,34.0,soit,être,VERB,VERB,Mood=Sub|Number=Sing|Person=3|Tense=Pres|VerbForm=Fin,33.0,fixed,33:fixed,_,1.0
16059,60054,"L'un des principaux inconvénients, quand on est zimbabwéen, c'est que l'inconséquence du régime de Mugabe vous poursuit où que vous ",soyez,", du moins si vous avez toujours de la famille au pays.",26.0,soyez,être,VERB,VERB,Mood=Ind|Number=Plur|Person=2|Tense=Imp|VerbForm=Fin,23.0,acl,23:acl,SpaceAfter=No,1.0
16138,60345,"De prochaines offres seront faites à l'avenir, sans que trop de détails ne filtrent non plus, si ce n'",est, qu'elles concerneront les serveurs et les IdeaPad.,23.0,est,être,VERB,VERB,Mood=Ind|Number=Sing|Person=3|Tense=Pres|VerbForm=Fin,21.0,fixed,21:fixed,_,1.0
16579,61881,Le SSS (code observatoire UAI E12) est situé à l'observatoire de Siding Spring (code observatoire UAI 413) : longitude 149.1 ,est,", latitude 31.3 sud et altitude 1150 m, approximativement à 400 km au nord-ouest de Sydney en Australie.",9.0,est,être,AUX,AUX,Mood=Ind|Number=Sing|Person=3|Tense=Pres|VerbForm=Fin,10.0,aux:pass,10:aux:pass,_,3.0
17240,64547,"Là où le chef d'expédition, Martin Noël, a vraiment eu chaud, c'",est, lorsque la centrifugeuse servant à l'analyse des tests sanguins a pris feu dans la tente-laboratoire!,17.0,est,être,VERB,VERB,Mood=Ind|Number=Sing|Person=3|Tense=Pres|VerbForm=Fin,0.0,root,0:root,_,3.0
17490,65565,"Cela relève, si je ne m'abuse de l'obligation contractuelle de la Ville mais on ne nous dit pas où nous en ",sommes," de l'exécution de cette obligation contractuelle, quel est son coût prévisionnel, par exemple.",25.0,sommes,être,VERB,VERB,Mood=Ind|Number=Plur|Person=1|Tense=Pres|VerbForm=Fin,20.0,ccomp,20:ccomp,_,1.0
17845,66903,"Another Step fut un triomphe artistique pour Kim Wilde, qui co-signe ici plus de la moitié des chansons, mais il n'en ",fut, pas de même au niveau commercial.,3.0,fut,être,AUX,AUX,Mood=Ind|Number=Sing|Person=3|Tense=Past|VerbForm=Fin,5.0,cop,5:cop,_,2.0
17875,66976,"Bonsoir, la vraie citation, c'est le XXe siècle sera religieux ou ne ",sera," pas, ce qui n'a pas le même sens (je me demande même si c'est pas le XXie siècle ?.",12.0,sera,être,AUX,AUX,Mood=Ind|Number=Sing|Person=3|Tense=Fut|VerbForm=Fin,13.0,cop,13:cop,_,2.0
18185,68132,"Aujourd'hui en France, moins de la moitié des patients décèdent de leur cancer, que ce ",soit," directement ou indirectement, dans les 5 ans suivant le diagnostic.",18.0,soit,être,VERB,VERB,Mood=Sub|Number=Sing|Person=3|Tense=Pres|VerbForm=Fin,11.0,advcl,11:advcl,_,1.0
18294,68507,"Mais les matches se succèdant très vite et avec la pression qu'il y a, il vaut mieux utiliser les joueurs en confiance, Fernand, Nico ",sont," bien, il faut en tenir compte.",29.0,sont,être,VERB,VERB,Mood=Ind|Number=Plur|Person=3|Tense=Pres|VerbForm=Fin,18.0,advcl,18:advcl,_,1.0
18380,68864,L'essentiel pour eux ,était, ailleurs : amasser le plus de milliards possibles.,5.0,était,être,VERB,VERB,Mood=Ind|Number=Sing|Person=3|Tense=Imp|VerbForm=Fin,0.0,root,0:root,_,1.0
18420,69013,"Si les exportations militaires augmentent sensiblement de 3,2%, il n'en ",est," pas de même pour le marché militaire national qui enregistre une diminution de 3,8%.",14.0,est,être,VERB,VERB,Mood=Ind|Number=Sing|Person=3|Tense=Pres|VerbForm=Fin,0.0,root,0:root,_,1.0
19025,71410,"Enfin le Chinois Frankie Xie, créateur de la marque Jefen, a une nouvelle fois proposé une collection où la touche chinoise est peu visible, si ce n'",est, dans des écailles de fourrure censées rappeler celles de dragons.,24.0,est,être,AUX,AUX,Mood=Ind|Number=Sing|Person=3|Tense=Pres|VerbForm=Fin,26.0,cop,26:cop,_,1.0
19461,72983,"Un gros travail défensif à son actif, plus le pressing sur les défenseurs auxerrois ",sont," là pour embellir la copie de Micka, une copie qui sera ternie par un carton rouge pour un vilain geste d'énervement commis sur un joueur adverse.",16.0,sont,être,VERB,VERB,Mood=Ind|Number=Plur|Person=3|Tense=Pres|VerbForm=Fin,3.0,advcl,3:advcl,_,2.0
20116,75368,La question ,est, : Pour ou contre de récupérer les enclaves espagnoles au Maroc ?,3.0,est,être,VERB,VERB,Mood=Ind|Number=Sing|Person=3|Tense=Pres|VerbForm=Fin,0.0,root,0:root,_,1.0
20287,75976,"Si elle fait appel, nous la renvoyons systématiquement vers les agents de développement locaux, que ce ",soit," la CCI, la Chambre des Métiers, etc...",19.0,soit,être,VERB,VERB,Mood=Sub|Number=Sing|Person=3|Tense=Pres|VerbForm=Fin,12.0,acl,12:acl,_,3.0
20523,76935,Mais le n°6 déclare qu'il ne pourrait en ,être," autrement : """"depuis trois ans, nous avons un ryhtme de travail très régulier.",11.0,être,être,VERB,VERB,VerbForm=Inf,9.0,xcomp,9:xcomp,_,2.0
21476,80353,"Des fois, on se ramasse 30 ou 40. On ",est," trop pour aller dans les maisons, les parents ne voudront pas a expliqué une adolescente.",12.0,est,être,VERB,VERB,Mood=Ind|Number=Sing|Person=3|Tense=Pres|VerbForm=Fin,0.0,root,0:root,_,1.0
22119,82790,"En l'occurence, je doute très fortement que la photographie soit réellement dans le domaine public, et rien n'",est, là pour m'ôter ce doute.,22.0,est,être,VERB,VERB,Mood=Ind|Number=Sing|Person=3|Tense=Pres|VerbForm=Fin,6.0,conj,6:conj,_,1.0
22673,85045,"Recevez sur votre téléphone mobile, où que vous ",soyez,", tous les buts, les pénalités, les résultats, les classements, les infos et bien d'autres choses encore!",10.0,soyez,être,VERB,VERB,Mood=Ind|Number=Plur|Person=2|Tense=Imp|VerbForm=Fin,7.0,fixed,7:fixed,SpaceAfter=No,2.0
22742,85274,Nous devons faire les choses conformément à notre manière d',être," et nous y arrivons bien"""", a estimé le président Obiang.",11.0,être,être,VERB,VERB,VerbForm=Inf,9.0,nmod,9:nmod,_,2.0
23851,89406,Le problème n'existe pas : ou ce joueur est Allemand (et il ,est,") et il doit être déchu de sa nationalité, où il est Iranien et il n'a qu'a retourner chez lui.",10.0,est,être,AUX,AUX,Mood=Ind|Number=Sing|Person=3|Tense=Pres|VerbForm=Fin,11.0,cop,11:cop,_,1.0
25689,96305,"Pour M6, c'est une très mauvaise audience avec moins de 10% de PDM pour la série française """"Où ",es," tu ?""""",23.0,es,être,VERB,VERB,Mood=Ind|Number=Sing|Person=1|Tense=Pres|VerbForm=Fin,9.0,dep,9:dep,_,3.0
25828,96842,On ne parle plus tellement des nids-de-poule mais ils ,sont," là, très présents dans la vie des automobilistes, et certaines rues de Montréal sont toujours dans un état lamentable.",10.0,sont,être,VERB,VERB,Mood=Ind|Number=Plur|Person=3|Tense=Pres|VerbForm=Fin,3.0,conj,3:conj,_,2.0
26334,98791,Elle décrit le phénomène physique qui ,est," que ; plus la couche d'eau est importante, plus celle-ci percole rapidement dans le milieu vers le bas.",7.0,est,être,VERB,VERB,Mood=Ind|Number=Sing|Person=3|Tense=Pres|VerbForm=Fin,4.0,acl:relcl,4:acl:relcl,_,1.0
26477,99273,"Chaque chansons possède l'arrangement qui tue, le petit truc qui s'il n'",est, pas là ne change pas le morceau mais qui en tout cas le rend immédiatement meilleur.,16.0,est,être,VERB,VERB,Mood=Ind|Number=Sing|Person=3|Tense=Pres|VerbForm=Fin,11.0,acl:relcl,11:acl:relcl,_,1.0
27047,101461,"Mais au fond peu importe, les élections ",sont," là pour nous départager et il faut qu'après les élections, ce qui nous rassemble soit plus fort que ce qui nous divise"""", a-t-il ironisé.",9.0,sont,être,VERB,VERB,Mood=Ind|Number=Plur|Person=3|Tense=Pres|VerbForm=Fin,5.0,advcl,5:advcl,_,2.0
27194,102014,Et ouais c'est dur la vie :o) Et le mieux c',est," lors des vacances scolaires, comme durant ces deux semaines, parce qu'en général les patrons sont en vacances et dans ces moments-là, Sandra et moi en profitons pour faire """"relâche"""".",4.0,est,être,AUX,AUX,Mood=Ind|Number=Sing|Person=3|Tense=Pres|VerbForm=Fin,5.0,cop,5:cop,_,3.0
27516,103251,"J'avais ce genre de caractère qui faisait que j'étais facilement invitée en WE chez les autres et j'aimais bien entrer dans l'intimité des familles, découvrir d'autres manières d'",être, et de vivre.,35.0,être,être,VERB,VERB,VerbForm=Inf,33.0,acl,33:acl,_,1.0
27755,104172,"Pour l'insertion dans un article, la section la plus susceptible de vous aider ",est, probablement : Insérer une image dans un article.,16.0,est,être,VERB,VERB,Mood=Ind|Number=Sing|Person=3|Tense=Pres|VerbForm=Fin,0.0,root,0:root,_,1.0
28397,106712,"En effet, si elles avaient été contributives de cette classe, cela aurait ",été, parce que leurs échecs auraient été très fortement orientés de cette façon avec de fortes intensités. 4.1.,7.0,été,être,AUX,AUX,Tense=Past|VerbForm=Part,8.0,cop,8:cop,_,1.0
28611,107578,"Au lieu de se mettre au service des intérêts de leurs collègues, il en ",est, qui n'ont d'autre souci que leur propre devenir.,16.0,est,être,VERB,VERB,Mood=Ind|Number=Sing|Person=3|Tense=Pres|VerbForm=Fin,0.0,root,0:root,_,1.0
29619,111652,"Vous pouvez formuler des requêtes, demander où en ",sont, les remboursements tiers payant ou encore télécharger les recettes dans le logiciel de comptabilité.,10.0,sont,être,VERB,VERB,Mood=Ind|Number=Plur|Person=3|Tense=Pres|VerbForm=Fin,7.0,ccomp,7:ccomp,_,1.0
29670,111821,"Près de trente ans plus tard, Nestor Turcotte constate que le débat sur l’indépendance du Québec a dévié et qu'il n'",est, plus ce qu'il était à ses tous débuts.,25.0,est,être,VERB,VERB,Mood=Ind|Number=Sing|Person=3|Tense=Pres|VerbForm=Fin,20.0,conj,20:conj,_,1.0
29962,112928,Si les Irlandais ne nous en veulent pas - ce n'est pas leur genre - ce premier week-end de la 6e Coupe du monde de rugby est quelque part un séminaire à ciel ouvert sur un thème unique : où en ,sont, les grands favoris du tournoi ?,45.0,sont,être,VERB,VERB,Mood=Ind|Number=Plur|Person=3|Tense=Pres|VerbForm=Fin,34.0,nmod,34:nmod,_,1.0
30077,113351,"L'un de mes meilleurs amis, (les autorités) sont venus l'arrêter et ça fait un an que ni moi ni sa famille ne savons où il ",est,"», a confié le capitaine de l'équipe d'Irak, musulman sunnite.",31.0,est,être,VERB,VERB,Mood=Ind|Number=Sing|Person=3|Tense=Pres|VerbForm=Fin,28.0,ccomp,28:ccomp,SpaceAfter=No,2.0
30104,113451,"Le premier est parti sur le versant de la montagne, le second, dont j'",étais,", a gagné le sommet.",17.0,étais,être,VERB,VERB,Mood=Ind|Number=Sing|Person=1|Tense=Imp|VerbForm=Fin,13.0,acl:relcl,13:acl:relcl,SpaceAfter=No,1.0
30215,113878,"Si le quorum n'est pas atteint, une seconde assemblée générale est convoquée dans les 15 jours qui suivent, elle peut alors délibérer quel que ",soit, le quorum.,28.0,soit,être,VERB,VERB,Mood=Ind|Number=Sing|Person=3|Tense=Pres|VerbForm=Fin,27.0,fixed,27:fixed,_,1.0
31755,119644,"Et dès lors quon expulse une personne parce quil ne rentre pas dans le cadre légal, devenons nous responsables de son avenir, comme si, en ",sommes,", nous étions responsable de toutes les tragédies du monde ?",29.0,sommes,être,VERB,VERB,Mood=Ind|Number=Plur|Person=1|Tense=Pres|VerbForm=Fin,18.0,advcl,18:advcl,SpaceAfter=No,1.0
32658,123009,"«La principale raison pour laquelle je reste chef, c'",est," pour m'assurer que le Parti conservateur ne fera pas la même chose au prochain chef», a expliqué M. Dion.",12.0,est,être,VERB,VERB,Mood=Ind|Number=Sing|Person=3|Tense=Pres|VerbForm=Fin,0.0,root,0:root,_,2.0
33536,126388,"Toutefois, chaque fois, le président Bush a fait preuve d'une grande loyauté, si ce n'",est, d'une réticence à se séparer de son proche collaborateur.,20.0,est,être,VERB,VERB,Mood=Ind|Number=Sing|Person=3|Tense=Pres|VerbForm=Fin,18.0,fixed,18:fixed,_,1.0
34536,130109,"Toutes ces démarches, que ce ",soit," thèmes de réflexion ou travaux, ont permis au CEEIADE d'être reconnu et sollicité par les différentes instances représentatives de notre profession.",7.0,soit,être,VERB,VERB,Mood=Sub|Number=Sing|Person=3|Tense=Pres|VerbForm=Fin,3.0,nmod,3:nmod,_,1.0
34710,130838,L'attitude d'Angélique pourrait finalement peser sur le verdict retenu par les jurés dont la principale préoccupation ,était,", avant de délibérer, de déterminer si oui ou non le meurtre de Chantal avait été prémédité.",19.0,était,être,VERB,VERB,Mood=Ind|Number=Sing|Person=3|Tense=Imp|VerbForm=Fin,14.0,acl:relcl,14:acl:relcl,SpaceAfter=No,1.0
34760,131008,"Aux commandes de l'un des principaux groupes mondiaux pour la production de chaux et de dolomie, la famille Lhoist - qui investit dans Mardaga à titre personnel - n'en ",est, pas à son coup d'essai dans le secteur de l'édition.,33.0,est,être,VERB,VERB,Mood=Ind|Number=Sing|Person=3|Tense=Pres|VerbForm=Fin,20.0,amod,20:amod,_,1.0
34822,131252,"Parce que les meurtres ont été commis dans différents comtés, parce que l'informatique n'en ",est," qu'à ses balbutiements, l'efficacité que l'on attend aujourd'hui des détectives de séries télévisées n'est encore qu'une utopie.",18.0,est,être,VERB,VERB,Mood=Ind|Number=Sing|Person=3|Tense=Pres|VerbForm=Fin,41.0,advcl,41:advcl,_,1.0
35351,133189,"Si vous tenez à protéger la page de PdD, il serait préférable de retirer la boîte déroulante : elle n'",est, là que pour éviter que des gens votent sans s'apercevoir de l'annulation.,22.0,est,être,VERB,VERB,Mood=Ind|Number=Sing|Person=3|Tense=Pres|VerbForm=Fin,13.0,advcl,13:advcl,_,1.0
35699,134359,"Un premier groupe de 118 personnes a été inculpé samedi, et un deuxième groupe de 33 personnes l'a ",été," lundi pour les mêmes chefs d'accusation, selon Ena.""""",8.0,été,être,AUX,AUX,Tense=Past|VerbForm=Part,9.0,aux:pass,9:aux:pass,_,2.0
35902,135081,Le but du pointage n',est, pas seulement de dire que tel ou tel animal correspond ou non au standard.,6.0,est,être,VERB,VERB,Mood=Ind|Number=Sing|Person=3|Tense=Pres|VerbForm=Fin,0.0,root,0:root,_,1.0
35972,135353,Le Choix du Président : où ,est, l'agriculture équitable?,7.0,est,être,VERB,VERB,Mood=Ind|Number=Sing|Person=3|Tense=Pres|VerbForm=Fin,2.0,nmod,2:nmod,_,1.0
36045,135587,"Si vous attendiez depuis longtemps la conclusion d'une affaire, la signature d'un contrat, la finalisation d'un projet de quelque nature qu'il ",soit,", cela devrait se concrétiser avec bonheur durant cette fin d'année.",28.0,soit,être,VERB,VERB,Mood=Sub|Number=Sing|Person=3|Tense=Pres|VerbForm=Fin,26.0,fixed,26:fixed,SpaceAfter=No,1.0
36292,136573,Nous nous sommes engagés à effectuer un sondage chez les Skateurs et Rollers de façon à mieux comprendre qui ils ,sont, et qu'elles sont leurs attentes en matière de skate parc.,21.0,sont,être,VERB,VERB,Mood=Ind|Number=Plur|Person=3|Tense=Pres|VerbForm=Fin,18.0,ccomp,18:ccomp,_,1.0
36460,137179,"Pour le stratège libéral George Young, il ne faudrait pas oublier que M. Dion affronte des chefs qui en ",sont," à leur cinquième (Duceppe) ou troisième (Harper, Layton) campagne.",21.0,sont,être,VERB,VERB,Mood=Ind|Number=Plur|Person=3|Tense=Pres|VerbForm=Fin,18.0,acl:relcl,18:acl:relcl,_,1.0
36514,137369,Dans le cadre de la démocratie représentative (et cest bien le cadre où nous ,sommes,", dussiez-vous le déplorer), quand on choisit, on choisit ses représentants.",16.0,sommes,être,VERB,VERB,Mood=Ind|Number=Plur|Person=1|Tense=Pres|VerbForm=Fin,13.0,acl:relcl,13:acl:relcl,SpaceAfter=No,1.0
36813,138531,"Mais dire cela, c'",est, jouer sur les mots.,6.0,est,être,VERB,VERB,Mood=Ind|Number=Sing|Person=3|Tense=Pres|VerbForm=Fin,7.0,aux:pass,7:aux:pass,_,1.0
37249,140146,"Le collier dissimule mal les cicatrices, le sang sèche sur les reins légèrement cambrés, les signes que je voyais se craquèlent, le visage se penche avec douceur et sa bouche ",est, là comme un vase à libation.,34.0,est,être,VERB,VERB,Mood=Ind|Number=Sing|Person=3|Tense=Pres|VerbForm=Fin,38.0,cop,38:cop,_,1.0
38785,145942,Les Français entrent en Alsace&#133; ça y ,est,", Thann est repris&#133; Je revois M. Martin entrant chez moi et se laissant tomber sur une chaise.",9.0,est,être,VERB,VERB,Mood=Ind|Number=Sing|Person=3|Tense=Pres|VerbForm=Fin,0.0,root,0:root,SpaceAfter=No,1.0
39298,147927,"Par contre là où ça craint à donf, comme le disent si bien les djeunz, c'",est," que ce Day of Defeat : Source est uniquement disponible en téléchargement payant via le réputé (huhuhu) portail Steam de Valve pour la modique somme de 19,95$.",19.0,est,être,VERB,VERB,Mood=Ind|Number=Sing|Person=3|Tense=Pres|VerbForm=Fin,0.0,root,0:root,_,3.0
39610,149209,"Une journée pour rien ou presque, si ce n'",est," qu'elle a globalement permis de consolider les gains de la veille, alors qu'aucune statistique économique n'était programmée ce jour.",11.0,est,être,VERB,VERB,Mood=Ind|Number=Sing|Person=3|Tense=Pres|VerbForm=Fin,2.0,advcl,2:advcl,_,1.0
39613,149218,La formule ,étant," : Télétravaillez à votre domicile"""" ou """"Gagnez de l'argent en travaillant chez vous par le télétravail...""""",3.0,étant,être,VERB,VERB,Tense=Pres|VerbForm=Part,0.0,root,0:root,_,1.0
40616,153162,"Le Dodge Caravan R/T n'est encore qu'un concept-car, mais force ",est, de constater que l'exercice est plutôt réussi.,8.0,est,être,AUX,AUX,Mood=Ind|Number=Sing|Person=3|Tense=Pres|VerbForm=Fin,12.0,cop,12:cop,_,3.0
41329,155882,"Ce qui me fait « marrer » (venant d'EA, on ne peut pas faire autre chose que rigoler ou pleurer ), c'",est, surtout que les screens PC sont des timbres postes alors que les screens XBox 360 sont en hi res le monde à l'envers...,27.0,est,être,VERB,VERB,Mood=Ind|Number=Sing|Person=3|Tense=Pres|VerbForm=Fin,35.0,nsubj,35:nsubj,_,1.0
42456,160145,"Car il faudrait du courage aujourd'hui à un responsable, de quelque bord qu'il ",soit,", pour avouer que tout doit être remis à plat, que Sesam-Vitale va dans le mur sous sa forme actuelle, qu'il faut revoir la copie.",16.0,soit,être,VERB,VERB,Mood=Sub|Number=Sing|Person=3|Tense=Pres|VerbForm=Fin,13.0,amod,13:amod,SpaceAfter=No,1.0
