Unnamed: 0,sent_id,left_context,pivot,right_context,ID,FORM,LEMMA,UPOS,XPOS,FEATS,HEAD,DEPREL,DEPS,MISC,dist
42826,161462,"Un jeu académique en attaque, une défense très physique et organisée, les Bulls ",seront, là cette année.,16.0,seront,être,VERB,VERB,Mood=Ind|Number=Plur|Person=3|Tense=Fut|VerbForm=Fin,2.0,conj,2:conj,_,1.0
42951,161842,"En fait une radio paye le droit de diffusion et après tout les auditeurs ont le droit de garder les morceaux alors qu'eu non rien déboursé, qu'il y ",est," 1 auditeur ou 3 millions, l'artiste aura les mêmes royalties ?",32.0,est,être,VERB,VERB,Mood=Ind|Number=Sing|Person=3|Tense=Pres|VerbForm=Fin,15.0,conj,15:conj,_,1.0
44835,169301,Ceux qui agissaient sur son esprit alors ne ,furent," pas, je le regrette profondément à la hauteur de son grand cœur.",9.0,furent,être,VERB,VERB,Mood=Ind|Number=Plur|Person=3|Tense=Past|VerbForm=Fin,0.0,root,0:root,_,1.0
45105,170240,"« Parmi les instruments humains, il en ",est, un qui se distingue parmi les autres comme symbole d’art et de beauté : c’est le pinceau.,9.0,est,être,VERB,VERB,Mood=Ind|Number=Sing|Person=3|Tense=Pres|VerbForm=Fin,10.0,amod,10:amod,_,1.0
45546,171865,"La question est """"d'",être," ou de ne pas être"""", n'hésitent pas à affirmer certains scientifiques.",6.0,être,être,VERB,VERB,VerbForm=Inf,3.0,xcomp,3:xcomp,_,1.0
45547,171865,"La question est """"d'être ou de ne pas ",être,", n'hésitent pas à affirmer certains scientifiques.",6.0,être,être,VERB,VERB,VerbForm=Inf,3.0,xcomp,3:xcomp,_,1.0
45740,172606,"Si l'échéance de l'An 2000 est connue depuis longtemps et préparée en conséquence, il n'en ",est, pas de même pour l'Euro où beaucoup de points restent obscurs.,8.0,est,être,AUX,AUX,Mood=Ind|Number=Sing|Person=3|Tense=Pres|VerbForm=Fin,9.0,aux:pass,9:aux:pass,_,2.0
46012,173536,"Et ce qui est clair pour moi, aujourd'hui, c'est que le résultat a ",été, au-delà de mes espérances.,17.0,été,être,VERB,VERB,Tense=Past|VerbForm=Part,12.0,ccomp,12:ccomp,_,1.0
46354,174913,La question ,est, donc: sommes-nous tenus par l'appelation de l'église ?,3.0,est,être,VERB,VERB,Mood=Ind|Number=Sing|Person=3|Tense=Pres|VerbForm=Fin,0.0,root,0:root,_,1.0
46669,176098,Le mien ,est," : je pense que l'enjeu de tout cela, c'est la logique de ce que j'appellerai le plan profond de la ville.",3.0,est,être,VERB,VERB,Mood=Ind|Number=Sing|Person=3|Tense=Pres|VerbForm=Fin,0.0,root,0:root,_,1.0
46723,176289,"La seule différence, c'est qu'ils ",sont," au plus près de la vie, ils voient des choses très dures.",9.0,sont,être,VERB,VERB,Mood=Ind|Number=Plur|Person=3|Tense=Pres|VerbForm=Fin,6.0,ccomp,6:ccomp,_,2.0
47803,180289,On a vu à Rennes qu'il n'était pas encore complètement dans le rythme mais il ,est, mieux dans le jeu.,18.0,est,être,VERB,VERB,Mood=Ind|Number=Sing|Person=3|Tense=Pres|VerbForm=Fin,3.0,conj,3:conj,_,1.0
49955,188608,"L'Arabe n'étais, n'",est, et ne serais jamais une langue sacrée car il n'existe pas de langue sacrée!,7.0,est,être,VERB,VERB,Mood=Ind|Number=Sing|Person=3|Tense=Pres|VerbForm=Fin,4.0,conj,4:conj,_,1.0
50050,188917,"Ils sont des terroristes, capturés sur le champ de bataille dans des endroits comme l'Afghanistan et il ",est," dans l'intérêt de notre pays que nous en apprenions le plus possible de ces gens qui sont encore détenus"""", a estimé M. Bush.",20.0,est,être,VERB,VERB,Mood=Ind|Number=Sing|Person=3|Tense=Pres|VerbForm=Fin,23.0,cop,23:cop,_,2.0
50582,190865,Le club tombe parfois durement que ce ,soit," en France (Clermont Foot, Gueugnon) ou en Europe (Juventus de Turin, Bayern de Munich, Maccabi Haïfa).",8.0,soit,être,VERB,VERB,Mood=Sub|Number=Sing|Person=3|Tense=Pres|VerbForm=Fin,3.0,ccomp,3:ccomp,_,1.0
51992,196062,"Olivier Besancenot, le leader trotskiste, a affirmé que les actes de sabotage «ne ",sont," pas et ne seront jamais ceux de la LCR», tandis que SUD-Rail a mis en garde «ceux qui frisent la diffamation en voulant confondre terrorisme et action syndicale».",17.0,sont,être,VERB,VERB,Mood=Ind|Number=Plur|Person=3|Tense=Pres|VerbForm=Fin,9.0,ccomp,9:ccomp,_,3.0
52031,196244,"Là où les choses se compliquent, c'",est, lorsque quelqu'un tente d'influer sur les résultats.,9.0,est,être,VERB,VERB,Mood=Ind|Number=Sing|Person=3|Tense=Pres|VerbForm=Fin,0.0,root,0:root,_,1.0
52814,199213,"D'ailleurs, et j'en préviens les mères de famille, ce que j'écris n'",est," pas pour les petites filles"""".",18.0,est,être,VERB,VERB,Mood=Ind|Number=Sing|Person=3|Tense=Pres|VerbForm=Fin,7.0,dep,7:dep,_,3.0
52910,199563,"Une des règles de comportement fondamentales sur wikipedia étant de """"présumer de la bonne foi"""" des autres contributeurs, il me semble clair que la contrepartie évidente en ",est, que trahir cette confiance est particulièrement grave.,31.0,est,être,VERB,VERB,Mood=Ind|Number=Sing|Person=3|Tense=Pres|VerbForm=Fin,25.0,ccomp,25:ccomp,_,2.0
54003,203451,Cela m'a rendu trop optimiste au début de ma dernière année car je voyais la mariée plus belle qu'elle n',était," et que mon obsession était de protéger, peut-être à l'excès, les joueurs et l'entraîneur.",23.0,était,être,VERB,VERB,Mood=Ind|Number=Sing|Person=3|Tense=Imp|VerbForm=Fin,19.0,ccomp,19:ccomp,_,1.0
54371,204784,"Le prétendu """"respect de la femme"""", qui était à l'origine une des plus belles valeurs qui ",soient,", vit depuis des années une dérive qui me semble critiquable, qui consiste à en faire une version laïque des pires tabous religieux de notre passé.",21.0,soient,être,VERB,VERB,Mood=Ind|Number=Plur|Person=3|Tense=Pres|VerbForm=Fin,19.0,acl:relcl,19:acl:relcl,SpaceAfter=No,1.0
54508,205273,"Ce qui nous intéressait, c'",est, bien de révéler une distraction de fonds publics et de faire connaître son préjudice sur la trésorerie d'une institution qui doit offrir des services de base à la population.,7.0,est,être,VERB,VERB,Mood=Ind|Number=Sing|Person=3|Tense=Pres|VerbForm=Fin,0.0,root,0:root,_,1.0
55114,207377,"Jéhu trouva les frères d'Achazia, roi de Juda, et il dit: Qui ",êtes,-vous?,17.0,êtes,être,VERB,VERB,Mood=Ind|Number=Plur|Person=2|Tense=Pres|VerbForm=Fin,0.0,root,0:root,SpaceAfter=No,1.0
55705,209726,"Si la chaîne (a0, a1, …, an) est un mot du code, alors il en ",est," de même de la suivante : (an, a0, a1, …, an-1).",13.0,est,être,AUX,AUX,Mood=Ind|Number=Sing|Person=3|Tense=Pres|VerbForm=Fin,15.0,cop,15:cop,_,2.0
56110,211241,"Jusqu'à ce jour nous ne savions pas grand chose sur le prochain Silent Hill, prévu sur PS3, si ce n'",est, qu'il devrait être proche du 2e opus.,24.0,est,être,VERB,VERB,Mood=Ind|Number=Sing|Person=3|Tense=Pres|VerbForm=Fin,22.0,fixed,22:fixed,_,1.0
56316,211999,On vient juste de faire l'amour et je suis sorti de la chambre alors que tu ,étais, encore dans le lit!,18.0,étais,être,VERB,VERB,Mood=Ind|Number=Sing|Person=1|Tense=Imp|VerbForm=Fin,11.0,advcl,11:advcl,_,1.0
56520,212783,"Voilà un bien grand mot En théorie, ça ne me semble pas mauvais, mais là où je suis en désaccord, c'",est, quand les conséquences sont néfastes pour les gens ordinaires.,25.0,est,être,VERB,VERB,Mood=Ind|Number=Sing|Person=3|Tense=Pres|VerbForm=Fin,12.0,conj,12:conj,_,2.0
56821,213915,"A peine arrivé, il ",était, comme à la maison.,6.0,était,être,VERB,VERB,Mood=Ind|Number=Sing|Person=3|Tense=Imp|VerbForm=Fin,0.0,root,0:root,_,1.0
57192,215162,Mais on apprécie tout cela d'un œil tout simplement parce que l'autre cherche à éviter les pièges qui ,sont," partout : l'asphalte huileux glisse, les virages sont secs, la circulation est chaotique (euphémisme) et surtout on roule à gauche.",21.0,sont,être,VERB,VERB,Mood=Ind|Number=Plur|Person=3|Tense=Pres|VerbForm=Fin,19.0,acl:relcl,19:acl:relcl,_,1.0
58370,219478,"Ces excursions rappellent, s'il en ",était," besoin, à quel point l'Irak reste un pays dangereux pour les journalistes, mais aussi pour les candidats et les électeurs.",8.0,était,être,VERB,VERB,Mood=Ind|Number=Sing|Person=3|Tense=Imp|VerbForm=Fin,3.0,advcl,3:advcl,_,1.0
59221,222910,"Le congrès tenu samedi dernier par l'UDC en a donné, s'il en ",était," encore besoin, un signal très clair.",16.0,était,être,VERB,VERB,Mood=Ind|Number=Sing|Person=3|Tense=Imp|VerbForm=Fin,11.0,advcl,11:advcl,_,1.0
59449,223784,"Il expose ses découvertes de manière si claire même pour le grand public, que force ",est, de constater que les résultats parlent d'eux-mêmes.,17.0,est,être,VERB,VERB,Mood=Ind|Number=Sing|Person=3|Tense=Pres|VerbForm=Fin,6.0,dep,6:dep,_,3.0
60612,228194,"Lorsque l'Etat utilise le crime comme moyen de faire justice, alors il ",est, beaucoup à craindre pour la justice.,15.0,est,être,VERB,VERB,Mood=Ind|Number=Sing|Person=3|Tense=Pres|VerbForm=Fin,0.0,root,0:root,_,1.0
60840,229112,Le vrai courage politique ne ,serait,-il pas de dire que le programme de législature est de la foutaise?,6.0,serait,être,VERB,VERB,Mood=Cnd|Number=Sing|Person=3|Tense=Pres|VerbForm=Fin,0.0,root,0:root,SpaceAfter=No,1.0
62190,234482,"A cet effet le dépositaire s'interdit, sous quelque prétexte que ce ",soit,", de refuser l'accès de ses locaux à tout mandataire du déposant.",14.0,soit,être,VERB,VERB,Mood=Sub|Number=Sing|Person=3|Tense=Pres|VerbForm=Fin,11.0,nmod,11:nmod,SpaceAfter=No,1.0
64212,242191,Mais il semble que vous ayez perdu le sentiment de ce qui ,est," bien, pour vous attacher uniquement aux choses sensibles et frivoles, qui passent comme le vent.",13.0,est,être,VERB,VERB,Mood=Ind|Number=Sing|Person=3|Tense=Pres|VerbForm=Fin,11.0,acl:relcl,11:acl:relcl,_,1.0
65839,248253,Le menu ,est," : -Pommes de terre, Haricots et Poulet -Salade de fruits locaux.",3.0,est,être,VERB,VERB,Mood=Ind|Number=Sing|Person=3|Tense=Pres|VerbForm=Fin,0.0,root,0:root,_,1.0
66120,249401,"Bref, Sarkozy va faire son possible pour occuper le terrain et espère que les français serons assez idiots pour oublier en deux semaines ce qu'il as fait et dit, oublier qui il ",est,", oublier ce qu'as fait son parti en 5ans.",36.0,est,être,VERB,VERB,Mood=Ind|Number=Sing|Person=3|Tense=Pres|VerbForm=Fin,33.0,ccomp,33:ccomp,SpaceAfter=No,3.0
66588,251327,"En Israël, deux mois et demi ",sont, comme deux ans et demi ailleurs.,8.0,sont,être,VERB,VERB,Mood=Ind|Number=Plur|Person=3|Tense=Pres|VerbForm=Fin,11.0,dep,11:dep,_,1.0
67512,254868,"Les fransquillons (région flamande), en revanche, se sont toujours considérés comme des Flamands qu'ils n'ont jamais cessé d'",être,", ils sont fiers de leur originalité culturelle : c'est-à-dire à la fois Flamands et d'expression française.",25.0,être,être,VERB,VERB,VerbForm=Inf,23.0,xcomp,23:xcomp,SpaceAfter=No,1.0
68618,259015,"Un jeton inox, représentant la feuille du gingko biloba, est disposé aléatoirement dans les fûts de 300 kg, permettant de gagner un bon d'achat pour un ginkgo biloba, l'une des plus anciennes essences qui ",soit,", dans une jardinerie.",41.0,soit,être,VERB,VERB,Mood=Ind|Number=Sing|Person=3|Tense=Pres|VerbForm=Fin,39.0,acl:relcl,39:acl:relcl,SpaceAfter=No,1.0
68668,259194,«Les faits n'ont été établis sous aucune forme que ce ,soit," et le fait est que nous avons choisi d'aller aux Nations unies», a-t-il déclaré.",13.0,soit,être,VERB,VERB,Mood=Sub|Number=Sing|Person=3|Tense=Pres|VerbForm=Fin,11.0,fixed,11:fixed,_,2.0
69272,261499,Le public ,sera," là, au-delà de toute espérance.",3.0,sera,être,VERB,VERB,Mood=Ind|Number=Sing|Person=3|Tense=Fut|VerbForm=Fin,0.0,root,0:root,_,1.0
69550,262558,Les pauvres de l'Europe ne ,sont," plus au Sud, mais à l'Est.",7.0,sont,être,VERB,VERB,Mood=Ind|Number=Plur|Person=3|Tense=Pres|VerbForm=Fin,0.0,root,0:root,_,1.0
70535,266140,"Barghouti rejette cet argument : """"Tout négociateur doit avoir un mandat"""", dit-il, un vote étant nécessaire avant qu'Arafat signe quelque accord de paix que ce ",soit, avec Israël.,32.0,soit,être,VERB,VERB,Mood=Sub|Number=Sing|Person=3|Tense=Pres|VerbForm=Fin,27.0,nmod,27:nmod,_,1.0
70602,266396,"Pour lui, se préoccuper de la santé, c'",est, aussi et d'abord ça.,11.0,est,être,VERB,VERB,Mood=Ind|Number=Sing|Person=3|Tense=Pres|VerbForm=Fin,16.0,aux:pass,16:aux:pass,_,2.0
70891,267320,"Ouais, que l'on aime ou pas leur musique, Radiohead nous montre a nouveau ce qui peut-être réinventé dans le domaine musical, que ce ",soit, ce qu'on a entre les oreilles au final ou la manière par l...,28.0,soit,être,VERB,VERB,Mood=Sub|Number=Sing|Person=3|Tense=Pres|VerbForm=Fin,18.0,ccomp,18:ccomp,_,3.0
71167,268375,"En mai, nous avons posé la question au patron d'Airbus Sa réponse a ",été,: nous n'avons aucune information nous permettant de conclure qu'il y aura un décalage de livraisons.,16.0,été,être,VERB,VERB,Tense=Past|VerbForm=Part,0.0,root,0:root,SpaceAfter=No,1.0
72319,272740,La question à se poser maintenant ,est, : qu'allons-nous faire de toute cette puissance?,7.0,est,être,VERB,VERB,Mood=Ind|Number=Sing|Person=3|Tense=Pres|VerbForm=Fin,0.0,root,0:root,_,1.0
72426,273088,"De grandes intellectuelles comme Marguerite Yourcenar, première femme élue à l'Académie française, Simone de Beauvoir, Françoise Gaspard, Patria Jimenez, Colette ou la sportive Amélie Mauresmo ont ",été, ou sont des lesbiennes notoires.,33.0,été,être,VERB,VERB,Tense=Past|VerbForm=Part,0.0,root,0:root,_,2.0
72795,274423,"Vous avez besoin de cet amour inconditionnel et vous avez besoin de montrer qu'il existe, qu'il vient du Ciel, mais surtout qu'il ",est, là pour être donné à la Terre et à votre quotidien.[...],28.0,est,être,VERB,VERB,Mood=Ind|Number=Sing|Person=3|Tense=Pres|VerbForm=Fin,16.0,conj,16:conj,_,2.0
72862,274680,"Où trouve-t-on des hôtels, si ce n'",est, dans les villes?,11.0,est,être,VERB,VERB,Mood=Ind|Number=Sing|Person=3|Tense=Pres|VerbForm=Fin,2.0,advcl,2:advcl,_,1.0
73285,276264,"Quand on monte au désert, les dieux se taisent ; lorsqu'on en redescend, on ",est, comme marqué du sceau du divin.,18.0,est,être,VERB,VERB,Mood=Ind|Number=Sing|Person=3|Tense=Pres|VerbForm=Fin,0.0,root,0:root,_,1.0
73744,277816,La question ,est,": dans quoi investit-on pour demain et après-demain souligne Guillaume Bousson, spécialiste énergie au cabinet Eurogroup.",4.0,est,être,VERB,VERB,Mood=Ind|Number=Sing|Person=3|Tense=Pres|VerbForm=Fin,0.0,root,0:root,SpaceAfter=No,1.0
74101,279220,"En association avec Smartvote, la Tribune de Genève vous propose de trouver les candidats dont les opinions sont les plus proches des vôtres, quel que ",soit, le parti.,28.0,soit,être,VERB,VERB,Mood=Ind|Number=Sing|Person=3|Tense=Pres|VerbForm=Fin,27.0,fixed,27:fixed,_,1.0
74698,281399,"Si EA est fidèle à ses habitudes de boîte à pomper les sioux, on devrait avoir un jeu identique au précédent, si ce n'",est, qu'il permettra de vivre la coupe du monde avec les équipes et poules officielles.,3.0,est,être,AUX,AUX,Mood=Ind|Number=Sing|Person=3|Tense=Pres|VerbForm=Fin,4.0,cop,4:cop,_,2.0
74759,281614,Les milliardaires ,sont," là très souvent, ils achètent d'immenses propriétés et parfois carrément des bouts de montagne pour être sûrs de rester à l'écart des paparazzi...",3.0,sont,être,VERB,VERB,Mood=Ind|Number=Plur|Person=3|Tense=Pres|VerbForm=Fin,0.0,root,0:root,_,1.0
75499,284356,"La difficulté, me semble-t-il, c'",est, que aujourd'hui nous avons beaucoup plus de mal à faire des formations continues.,10.0,est,être,VERB,VERB,Mood=Ind|Number=Sing|Person=3|Tense=Pres|VerbForm=Fin,2.0,nmod,2:nmod,_,1.0
75902,285855,"Ce qu'on a fait, c'",est," Si tu attends un film à venir, et bien j'attends la même chose en tant que fan.",8.0,est,être,VERB,VERB,Mood=Ind|Number=Sing|Person=3|Tense=Pres|VerbForm=Fin,0.0,root,0:root,_,1.0
76267,287149,"Chaude (460 degrés Celsius au sol, ndlr), un milieu acide concentré : c'est le milieu le plus hostile qui ",soit," pour les sondes"""".",26.0,soit,être,VERB,VERB,Mood=Ind|Number=Sing|Person=3|Tense=Pres|VerbForm=Fin,21.0,acl:relcl,21:acl:relcl,_,3.0
76795,289127,Vous avez une longue conversation avec lui (elle) pour lui expliquer que même s'il (elle) ,est," bien d'entretenir de bonnes relations avec sa mère, vous aimeriez qu'il (elle) se décide à couper le cordon.",21.0,est,être,VERB,VERB,Mood=Ind|Number=Sing|Person=3|Tense=Pres|VerbForm=Fin,33.0,advcl,33:advcl,_,1.0
77005,289860,Nous saurons sans doute au bout où ,est," la vérité"""", a-t-il encore déclaré lors du Grand jury RTL/Le Figaro/LCI.",8.0,est,être,VERB,VERB,Mood=Ind|Number=Sing|Person=3|Tense=Pres|VerbForm=Fin,6.0,acl:relcl,6:acl:relcl,_,1.0
77112,290207,"De prime abord, rien de très surprenant dans ce Chopper si ce n'",est, que la moto d'origine n'est autre qu'une Honda Goldwing GL 1000.,15.0,est,être,VERB,VERB,Mood=Ind|Number=Sing|Person=3|Tense=Pres|VerbForm=Fin,13.0,fixed,13:fixed,_,1.0
77154,290375,"Ça fait un bout de temps que moi j'essaie de produire un documentaire sur le Front National, mais on a du mal à trouver un vrai sujet d'attaque parce que si on leur donne la parole, c'",est, finalement leur donner aussi une nouvelle audience.,42.0,est,être,VERB,VERB,Mood=Ind|Number=Sing|Person=3|Tense=Pres|VerbForm=Fin,2.0,advcl,2:advcl,_,1.0
77540,291777,"L'emphase, la vigueur des jugements, la volonté de punir des coupables inconnus ",sont, là pour cacher la triste réalité.,16.0,sont,être,VERB,VERB,Mood=Ind|Number=Plur|Person=3|Tense=Pres|VerbForm=Fin,0.0,root,0:root,_,1.0
78137,294089,Ce terme est utilisé dans son sens le plus large pour définir la connaissance systématique dans quelque domaine que ce ,soit,", mais il est plus généralement appliqué à la recherche de lois vérifiables.",21.0,soit,être,VERB,VERB,Mood=Sub|Number=Sing|Person=3|Tense=Pres|VerbForm=Fin,19.0,fixed,19:fixed,SpaceAfter=No,1.0
80309,302002,Les demies ne ,sont,-elles plus dans les têtes agenaises ?,4.0,sont,être,VERB,VERB,Mood=Ind|Number=Plur|Person=3|Tense=Pres|VerbForm=Fin,0.0,root,0:root,SpaceAfter=No,1.0
80393,302272,"Cette opération, coûteuse s'il en ",fut,", ne fut guère à la gloire de l'artiste; car on s'aperçut bien vite que la cloche, à une nuance près, frappait la note donnée par une autre de ses voisines, coulée en 1875.",8.0,fut,être,VERB,VERB,Mood=Ind|Number=Sing|Person=3|Tense=Past|VerbForm=Fin,4.0,dep,4:dep,SpaceAfter=No,1.0
80473,302546,"Elle est restée longtemps inconsciente et quand elle a repris connaissance, elle ne savait plus où elle ",était,", raconte l'entraîneur de l'équipe de France de vitesse Laurent Chrétien, présent sur les lieux.",20.0,était,être,VERB,VERB,Mood=Ind|Number=Sing|Person=3|Tense=Imp|VerbForm=Fin,16.0,ccomp,16:ccomp,SpaceAfter=No,1.0
80575,302950,"La commission de discipline avait également banni Brennan, désormais à la retraite, de toute participation à ses compétitions de «quelque manière que ce ",soit,"», c'est-à-dire également comme membre de l'encadrement d'une équipe.",27.0,soit,être,VERB,VERB,Mood=Sub|Number=Sing|Person=3|Tense=Pres|VerbForm=Fin,26.0,fixed,26:fixed,SpaceAfter=No,1.0
81783,307468,"Le Magique a été créé par Marc et Martine, qui sont tous deux architectes (oui oui, """"",sont,", ils travaillent encore), mais surtout qui sont d'un enthousiasme communicatif pour leur bar à artistes et leur quartier.",12.0,sont,être,AUX,AUX,Mood=Ind|Number=Plur|Person=3|Tense=Pres|VerbForm=Fin,15.0,cop,15:cop,_,1.0
82016,308383,"Les contes et les mythes sont deux choses différentes, mais il ",est, vrai que certains contes rejoignent les grands mythes de l'humanité.,13.0,est,être,VERB,VERB,Mood=Ind|Number=Sing|Person=3|Tense=Pres|VerbForm=Fin,8.0,conj,8:conj,_,1.0
82239,309170,Mon but n',est, certainement pas de nuire à l'encyclopédie.,4.0,est,être,VERB,VERB,Mood=Ind|Number=Sing|Person=3|Tense=Pres|VerbForm=Fin,0.0,root,0:root,_,1.0
83254,312855,"C'est tout le sens de mon propos d'aujourd'hui et c'est, ",soyez," en sûrs, l'esprit dans lequel le Collège poursuivra son action.",15.0,soyez,être,VERB,VERB,Mood=Imp|Number=Plur|Person=2|Tense=Pres|VerbForm=Fin,17.0,advmod,17:advmod,_,1.0
83641,314354,"Tout comme par Moreau, je suis impressionné par des gars comme Jarret Stoll et Raffi Torres, qui ",sont, constamment sur la rondelle.,20.0,sont,être,VERB,VERB,Mood=Ind|Number=Plur|Person=3|Tense=Pres|VerbForm=Fin,13.0,acl:relcl,13:acl:relcl,_,1.0
84061,315958,L'accueil était convivial à souhait et les gens heureux d',être," là, de serrer la main, de délivrer quelques paroles préparées avec le c&#156;ur.",12.0,être,être,VERB,VERB,VerbForm=Inf,10.0,dep,10:dep,_,1.0
84469,317527,"Il t'attrape, il te bloque, il te tord dans tous les sens, tu te retrouves la tête en bas, tout tordu, tu sais plus ou t'",es,", et hop t'as perdu le combat.",33.0,es,être,VERB,VERB,Mood=Ind|Number=Sing|Person=1|Tense=Pres|VerbForm=Fin,29.0,ccomp,29:ccomp,SpaceAfter=No,1.0
84553,317828,D'autres sites M'écrire Accueil Corvette Mythique voiture de sport s'il en ,est,", la Corvette exprime toujours M aussi bien la conception du GT à l'américaine.",15.0,est,être,VERB,VERB,Mood=Ind|Number=Sing|Person=3|Tense=Pres|VerbForm=Fin,19.0,advcl,19:advcl,SpaceAfter=No,1.0
84594,317993,"Et la première chose que Miyamoto a dit, c'",était,", 'Pourquoi vous mettez des mitrailleuses sur les voitures ?",11.0,était,être,VERB,VERB,Mood=Ind|Number=Sing|Person=3|Tense=Imp|VerbForm=Fin,0.0,root,0:root,SpaceAfter=No,1.0
84789,318759,«La plupart des managers sauront d'ici la fin de l'année où ils en ,sont,"», a assuré le porte-parole du groupe en Belgique, Wilfried Remans.",17.0,sont,être,VERB,VERB,Mood=Ind|Number=Plur|Person=3|Tense=Pres|VerbForm=Fin,13.0,acl:relcl,13:acl:relcl,SpaceAfter=No,2.0
85757,322233,"En 1995 déjà, une poignée de voix avait décidé de l'issue du scrutin, il en a ",été, de même cette fois encore.,20.0,été,être,VERB,VERB,Tense=Past|VerbForm=Part,10.0,advcl,10:advcl,_,2.0
87046,327462,La sémantique associée à ces règles ,est, : si l'événement est déclenché et que les conditions sont vérifiées alors les actions sont effectuées.,7.0,est,être,VERB,VERB,Mood=Ind|Number=Sing|Person=3|Tense=Pres|VerbForm=Fin,0.0,root,0:root,_,1.0
87165,327961,"Mon avis à moi , c'",est," quel aurais pu acheté autre chose que c'est fameuse boucles d'oreilles , en fait elle lui a rendu .",7.0,est,être,VERB,VERB,Mood=Ind|Number=Sing|Person=3|Tense=Pres|VerbForm=Fin,10.0,dep,10:dep,_,1.0
87277,328415,"La science et l'économie sont en train de prévaloir sur l'humain, alors que nos sociétés ont lutté pour qu'il n'en ",soit, plus ainsi dans le domaine du travail.,26.0,soit,être,VERB,VERB,Mood=Sub|Number=Sing|Person=3|Tense=Pres|VerbForm=Fin,20.0,advcl,20:advcl,_,1.0
87488,329195,"Comme je le disais, ces tests ont été effectués plusieurs fois et ont toujours donné les mêmes résultats, que ce ",soit, le Pismo qui soit serveur ou le G3 beige.,23.0,soit,être,VERB,VERB,Mood=Sub|Number=Sing|Person=3|Tense=Pres|VerbForm=Fin,22.0,fixed,22:fixed,_,1.0
87751,330229,Mais la question qu'on se pose ici ,est,": """"Est-ce que Rosalee se laissera séduire par le play-boy acteur, ou bien reviendra-t-elle aux vraies valeurs en cédant à la déclaration d'amour de son ami d'enfance?""""",9.0,est,être,VERB,VERB,Mood=Ind|Number=Sing|Person=3|Tense=Pres|VerbForm=Fin,0.0,root,0:root,SpaceAfter=No,2.0
87910,330859,"Il a expliqué aux policiers « ne pas comprendre » pourquoi il était poursuivi.Les enquêteurs disposent de peu d'éléments sur l'agresseur, si ce n'",est," que, si c'est bien le même homme.",30.0,est,être,VERB,VERB,Mood=Ind|Number=Sing|Person=3|Tense=Pres|VerbForm=Fin,18.0,advcl,18:advcl,_,1.0
88012,331234,"Avant d'amorcer la rencontre, les Jets (2-3) n'avaient qu'une victoire et en ",étaient, déjà à leur quatrième quart partant de la campagne.,21.0,étaient,être,VERB,VERB,Mood=Ind|Number=Plur|Person=3|Tense=Imp|VerbForm=Fin,26.0,det,26:det,_,1.0
89313,336331,"Ils pourraient """"surveiller, poursuivre et affronter toute tentative des pirates d'entrer en mer Rouge, que ce ",soit," lors d'actes de piraterie ou en fuyant des confrontations"""", dit le texte.",21.0,soit,être,VERB,VERB,Mood=Sub|Number=Sing|Person=3|Tense=Pres|VerbForm=Fin,20.0,fixed,20:fixed,_,1.0
89457,336915,L'écriture ,est, comme je me sens au moment où j'écris.,3.0,est,être,VERB,VERB,Mood=Ind|Number=Sing|Person=3|Tense=Pres|VerbForm=Fin,0.0,root,0:root,_,1.0
90613,341360,On raconte que le succès de cette chanson fut un véritable hasard : il était prévu qu'elle sorte en face B. Quoi qu'il en ,soit,", The Jam -et Weller en particulier- atteignent le rang de stars en Angleterre grâce à cette chanson.",27.0,soit,être,VERB,VERB,Mood=Sub|Number=Sing|Person=3|Tense=Pres|VerbForm=Fin,30.0,advcl,30:advcl,SpaceAfter=No,1.0
91107,343310,Une question qui me brûle les lèvres : avez-vous ,été, et êtes-vous ce qu'on appelle un bandit ou un truand ?,11.0,été,être,VERB,VERB,Tense=Past|VerbForm=Part,2.0,acl:relcl,2:acl:relcl,_,1.0
91394,344391,Une cinquantaine d'associations montreront au public où en ,sont, leurs initiatives.,10.0,sont,être,VERB,VERB,Mood=Ind|Number=Plur|Person=3|Tense=Pres|VerbForm=Fin,5.0,dep,5:dep,_,1.0
91423,344551,"Je ne suis pas un spécialiste des artifices, que ce ",soit, l'alcool ou autre chose.,12.0,soit,être,VERB,VERB,Mood=Sub|Number=Sing|Person=3|Tense=Pres|VerbForm=Fin,6.0,advcl,6:advcl,_,1.0
92841,350154,Nous allons te donner la réponse qui ,est, : à cet endroit la vitesse est limitée à 30 km/heure.,8.0,est,être,VERB,VERB,Mood=Ind|Number=Sing|Person=3|Tense=Pres|VerbForm=Fin,6.0,acl:relcl,6:acl:relcl,_,1.0
92893,350334,Le meilleur groupe punk breton du Loiret n',est," plus et on pourra dire à nos enfants : """"Moi petit(e), j'étais au dernier concert des Excités"""".",9.0,est,être,VERB,VERB,Mood=Ind|Number=Sing|Person=3|Tense=Pres|VerbForm=Fin,0.0,root,0:root,_,2.0
