Unnamed: 0,sent_id,left_context,pivot,right_context,ID,FORM,LEMMA,UPOS,XPOS,FEATS,HEAD,DEPREL,DEPS,MISC,dist
93399,352393,"Correspondant en hongrois au suffixe -n, il exprime le lieu sur lequel on ",est, (ce qui équivaut à un adessif en finnois).,15.0,est,être,VERB,VERB,Mood=Ind|Number=Sing|Person=3|Tense=Pres|VerbForm=Fin,11.0,acl:relcl,11:acl:relcl,_,2.0
93682,353520,"Ce monsieur n'a jamais résolu le moindre problème, que ce ",soit, aux finances (passé inaperçu) qu'à l'intérieur il ne fait que brasser du vent et embobiner les amers par des discours simplistes inspirés de l'extrême droite.,13.0,soit,être,VERB,VERB,Mood=Sub|Number=Sing|Person=3|Tense=Pres|VerbForm=Fin,9.0,acl,9:acl,_,1.0
94404,356400,"Selon certaines allégations"""", relève Amnesty, les poursuites engagées contre lui et ses proches """"",seraient," motivées par des considérations d'ordre politique"""".",19.0,seraient,être,VERB,VERB,Mood=Cnd|Number=Plur|Person=3|Tense=Pres|VerbForm=Fin,20.0,aux:pass,20:aux:pass,_,2.0
94415,356459,"Afin de proposer aux possesseurs de PC, un Ghost Recon Advanced Warfighter de la meilleure qualité qui ",soit,", Ubisoft a décidé de repousser la sortie de cette version à une date ultérieure.",19.0,soit,être,VERB,VERB,Mood=Sub|Number=Sing|Person=3|Tense=Pres|VerbForm=Fin,10.0,acl:relcl,10:acl:relcl,SpaceAfter=No,2.0
94556,356967,"J'ignore encore qui tu es, qui tu seras, mais je suis d'ores et déjà certain que tu ",seras,", comme ton frère, une source inépuisable de bonheur.",10.0,seras,être,VERB,VERB,Mood=Ind|Number=Plur|Person=2|Tense=Fut|VerbForm=Fin,2.0,ccomp,2:ccomp,SpaceAfter=No,1.0
94595,357101,"Sur ses terres, le symbole de la rose a disparu comme si de rien n'",était,.Sophie LandrinArticle paru dans l'édition du 24.09.08.,17.0,était,être,VERB,VERB,Mood=Ind|Number=Sing|Person=3|Tense=Imp|VerbForm=Fin,11.0,advcl,11:advcl,SpaceAfter=No,1.0
95476,360418,"C'est un match difficile à analyser, si ce n'",est, de dire que je suis un peu passée à travers.,2.0,est,être,AUX,AUX,Mood=Ind|Number=Sing|Person=3|Tense=Pres|VerbForm=Fin,4.0,cop,4:cop,_,1.0
96105,362630,Les danseurs qui ,étaient, là ont ri pendant une demi-heure.,4.0,étaient,être,VERB,VERB,Mood=Ind|Number=Plur|Person=3|Tense=Imp|VerbForm=Fin,2.0,acl:relcl,2:acl:relcl,_,1.0
97376,367276,"Les troubles sociaux de ces dernières semaines avaient pu le faire oublier, mais le fait ",est, là: les idées de l'extrême droite exercent une influence considérable en France.,17.0,est,être,VERB,VERB,Mood=Ind|Number=Sing|Person=3|Tense=Pres|VerbForm=Fin,9.0,conj,9:conj,_,1.0
97713,368564,"Avec son frère, puis sa soeur, la mère enfin, Jared entre au coeur d'une intrigue palpitante, tous menacés qu'ils ",sont, par la convoitise du terrible ogre Mulgarath (Nick Nolte pour la voix et quand il prend forme humaine).,26.0,sont,être,VERB,VERB,Mood=Ind|Number=Plur|Person=3|Tense=Pres|VerbForm=Fin,23.0,ccomp,23:ccomp,_,2.0
98112,370158,Si les héros aident les habitants à découvrir où ,sont," les poules, ils ne parviennent cependant pas à trouver un moyen de quitter la vallée entourée d'une haute falaise.",10.0,sont,être,VERB,VERB,Mood=Ind|Number=Plur|Person=3|Tense=Pres|VerbForm=Fin,8.0,ccomp,8:ccomp,_,2.0
98125,370198,Vous trouverez pour chaque chapitre un éclairage sur tous les changements du système éducatif que vous avez ,été, ou serez amenés à rencontrer cette année.,18.0,été,être,VERB,VERB,Tense=Past|VerbForm=Part,13.0,acl:relcl,13:acl:relcl,_,1.0
98126,370199,"De même que l'on enlève l'ivraie pour la jeter au feu, ainsi en ",sera,-t-il à la fin du monde.,17.0,sera,être,VERB,VERB,Mood=Ind|Number=Sing|Person=3|Tense=Fut|VerbForm=Fin,0.0,root,0:root,SpaceAfter=No,1.0
99012,373719,"L'énigme Obama"""": bien curieux ce titre, car le candidat est campé de façon très nette dans l'article et le commentaire """"Barack est la personne qu'il a l'air d'",être, résout fort bien et fort simplement le soi-disant mystère.,37.0,être,être,VERB,VERB,VerbForm=Inf,35.0,xcomp,35:xcomp,SpaceAfter=No,1.0
99105,374055,"Il est strictement interdit d'utiliser ou de reproduire le nom """" CARTE BLANCHE """" ou son logo, seuls ou associés, à quelque titre que ce ",soit, et notamment à des fins publicitaires sans l'accord préalable écrit de la société CARTE BLANCHE.,29.0,soit,être,VERB,VERB,Mood=Sub|Number=Sing|Person=3|Tense=Pres|VerbForm=Fin,28.0,fixed,28:fixed,_,3.0
99210,374477,"En 2008, la croissance devrait être moins spectaculaire, mais elle ",sera," là, prévoient les analystes.",13.0,sera,être,VERB,VERB,Mood=Ind|Number=Sing|Person=3|Tense=Fut|VerbForm=Fin,6.0,conj,6:conj,_,1.0
99523,375521,"On peut utiliser des méthodes de management visuel pour l'assister, mais souvent, le plus simple leitmotiv de Seiton ",est," : Une place pour chaque chose, et chaque chose a (ou à) sa place.",22.0,est,être,VERB,VERB,Mood=Ind|Number=Sing|Person=3|Tense=Pres|VerbForm=Fin,2.0,conj,2:conj,_,1.0
99591,375745,"Depuis le site panoramique de la tour Montparnasse, la compagnie Le Temps d'un rêve vous entraîne à la rencontre de la capitale au fil de contes avec marionnettes sur le thème Il ",était, une fois.,35.0,était,être,VERB,VERB,Mood=Ind|Number=Sing|Person=3|Tense=Imp|VerbForm=Fin,37.0,dep,37:dep,_,1.0
99905,376983,"Dans la conclusion de son grand hymne 'Patmos', le poète nomme la """"cultivation de la lettre bien établie et l'interprétation de ce qui ",est, comme la fonction majeure du poète.,29.0,est,être,VERB,VERB,Mood=Ind|Number=Sing|Person=3|Tense=Pres|VerbForm=Fin,27.0,acl:relcl,27:acl:relcl,SpaceAfter=No,1.0
99935,377092,"Beaucoup de Monts Gargans ont, comme lui, un rapport avec l’Archange saint Michel, ainsi en ",est,"-il à Rouen du quartier encore appelé Mont Gargan et, sur les hauteurs de la Côte Sainte-Catherine, se trouve un prieuré Saint-Michel.",20.0,est,être,VERB,VERB,Mood=Ind|Number=Sing|Person=3|Tense=Pres|VerbForm=Fin,5.0,advcl,5:advcl,SpaceAfter=No,2.0
100034,377479,On n'aura pas atteint 30% (à la fin du mandat de Jacques Chirac) mais on ne ,sera," pas loin"""", a dit Jean-François Copé sur Canal +.",22.0,sera,être,VERB,VERB,Mood=Ind|Number=Sing|Person=3|Tense=Fut|VerbForm=Fin,6.0,conj,6:conj,_,2.0
100451,379012,"Pourtant, la réforme de l'Etat ne ",sera," pas, on veut l'espérer, au centre de tous les entretiens entre l'informateur et les présidents de parti.",9.0,sera,être,VERB,VERB,Mood=Ind|Number=Sing|Person=3|Tense=Fut|VerbForm=Fin,13.0,advcl,13:advcl,_,1.0
101020,381078,"Le niveau de jeu ne s'envole pas comme ça, donc si je ne gagnais plus, c'",est, il y avait d'autres raisons.,20.0,est,être,VERB,VERB,Mood=Ind|Number=Sing|Person=3|Tense=Pres|VerbForm=Fin,7.0,advcl,7:advcl,_,1.0
101053,381168,Maintenant encore les sauvages d'Amérique divinisent tout ce qui ,est, au delà de leur faible capacité.,11.0,est,être,VERB,VERB,Mood=Ind|Number=Sing|Person=3|Tense=Pres|VerbForm=Fin,9.0,acl:relcl,9:acl:relcl,_,1.0
101228,381866,"Ni, au point où nous en ",sommes,", que les patronymes des créateurs des grands courants pédagogiques.",8.0,sommes,être,VERB,VERB,Mood=Ind|Number=Plur|Person=1|Tense=Pres|VerbForm=Fin,4.0,acl:relcl,4:acl:relcl,SpaceAfter=No,2.0
101523,383025,"Bien que ce projet constitue une avancée, la Confédération paysanne déplore le montant forfaitaire des cotisations, quel que ",soit, le revenu paysan.,21.0,soit,être,VERB,VERB,Mood=Ind|Number=Sing|Person=3|Tense=Pres|VerbForm=Fin,20.0,fixed,20:fixed,_,1.0
101737,384045,Ce n'est pas réservé aux seuls spécialistes mais c',est," comprendre ce qu'elle dit et surtout """"comment"""" elle le dit.",3.0,est,être,AUX,AUX,Mood=Ind|Number=Sing|Person=3|Tense=Pres|VerbForm=Fin,5.0,cop,5:cop,_,1.0
102560,387077,Si jadis élève ou prof de TS1 tu ,étais,", n'hésite pas à envoyer tout ce que tu veux voir apparaître ici (ton e-mail et ta page web par exemple, mais aussi d'autres choses si tu veux).",9.0,étais,être,VERB,VERB,Mood=Ind|Number=Sing|Person=1|Tense=Imp|VerbForm=Fin,3.0,nmod,3:nmod,SpaceAfter=No,1.0
102880,388157,L'ambition des signataires a ,été,", et demeure, de rejoindre tous les mouvements d'éducation à l'environnement (GRAINE) qui est associé à cette démarche.",6.0,été,être,VERB,VERB,Tense=Past|VerbForm=Part,0.0,root,0:root,SpaceAfter=No,1.0
104614,394717,Ces gars sont les pires grands frères qui ,soit," parce qu'ils donnent des conseils horriblement immoraux aux petits frères"""" explique le réalisateur ajoutant qu'une campagne nationale sera mise sur pied pour trouver les jeunes acteurs.",9.0,soit,être,VERB,VERB,Mood=Sub|Number=Sing|Person=3|Tense=Pres|VerbForm=Fin,7.0,acl:relcl,7:acl:relcl,_,1.0
104770,395315,"Dans tout ça, le Danemark, lui, pays pacifiste s'il en ",est,", comprend mal comment il se retrouve dans un tel baril de poudre.",15.0,est,être,VERB,VERB,Mood=Ind|Number=Sing|Person=3|Tense=Pres|VerbForm=Fin,10.0,nmod,10:nmod,SpaceAfter=No,1.0
105037,396357,"En matière de corporatisme, j'aimerai savoir où en ",sont, les parlementaires avec leur régime spécial de retraite Pardon ?,11.0,sont,être,VERB,VERB,Mood=Ind|Number=Plur|Person=3|Tense=Pres|VerbForm=Fin,8.0,ccomp,8:ccomp,_,1.0
105048,396428,Quatre vies ne ,seront, pas de trop pour régler son compte à ce singe boxeur.,4.0,seront,être,VERB,VERB,Mood=Ind|Number=Plur|Person=3|Tense=Fut|VerbForm=Fin,6.0,dep,6:dep,_,1.0
105176,396884,"Les Pumas ont soif de reconnaissance, que ce ",soit, auprès des instances internationales mais aussi dans leur propre pays.,10.0,soit,être,VERB,VERB,Mood=Sub|Number=Sing|Person=3|Tense=Pres|VerbForm=Fin,3.0,advcl,3:advcl,_,1.0
106751,402840,"Aujourd'hui, les Etats-Unis ne ",sont," plus à l'avant-garde en matière de régulation des produits toxiques"""".",7.0,sont,être,VERB,VERB,Mood=Ind|Number=Plur|Person=3|Tense=Pres|VerbForm=Fin,11.0,cop,11:cop,_,3.0
107948,407362,Le contraire aurait terni l'image des héros de DC et force ,est, d'admettre que les personnages de Midway ne sont pas moins intéressants une fois guéris de leurs penchants sanguinaires.,13.0,est,être,VERB,VERB,Mood=Ind|Number=Sing|Person=3|Tense=Pres|VerbForm=Fin,4.0,conj,4:conj,_,1.0
108416,409224,"Les autres membres de la secte, les ravisseurs et les plus déterminés ",sont," là, autour de leur gourou.",14.0,sont,être,VERB,VERB,Mood=Ind|Number=Plur|Person=3|Tense=Pres|VerbForm=Fin,0.0,root,0:root,_,1.0
109047,411659,Le titre ,est," : """"Sans eux, Steevy n'existerait pas mais c'est là THE problème!",3.0,est,être,VERB,VERB,Mood=Ind|Number=Sing|Person=3|Tense=Pres|VerbForm=Fin,0.0,root,0:root,_,1.0
110388,416466,"En fait, """"personne ne se risque d'ailleurs"""" à faire quelque estimation que ce ",soit," """"ni sur la durée, ni sur la profondeur de cette crise .",18.0,soit,être,VERB,VERB,Mood=Sub|Number=Sing|Person=3|Tense=Pres|VerbForm=Fin,15.0,nmod,15:nmod,_,1.0
111096,419237,"À l'ouest se trouve la paroisse de Arco de São Jorge, et à l'",est, celles de Ilha et de Santana.,17.0,est,être,VERB,VERB,Mood=Ind|Number=Sing|Person=3|Tense=Pres|VerbForm=Fin,5.0,conj,5:conj,_,2.0
111122,419329,"Il s'est dit touché par les encouragements, mais il précise qu'il n'",est, pas et ne sera pas candidat.,3.0,est,être,AUX,AUX,Mood=Ind|Number=Sing|Person=3|Tense=Pres|VerbForm=Fin,4.0,aux:tense,4:aux:tense,_,1.0
113909,429782,Ce canton bénéficie du meilleur taux de Suisse romande; il n',est," pas loin des 1,5%, seuil où la situation est considérée comme fluide.",13.0,est,être,VERB,VERB,Mood=Ind|Number=Sing|Person=3|Tense=Pres|VerbForm=Fin,0.0,root,0:root,_,1.0
114517,432264,Mais force ,est, de reconnaître qu'ils se préoccupent beaucoup plus du risque de paralysie du trafic marchandises que du sort des usagers privés.,3.0,est,être,VERB,VERB,Mood=Ind|Number=Sing|Person=3|Tense=Pres|VerbForm=Fin,0.0,root,0:root,_,1.0
114643,432728,"J'avais fermé les yeux en me disant """"ça y ",est," il tombe"""" et bien pas du tout et en plus, il courtisait la belle dame.",12.0,est,être,VERB,VERB,Mood=Ind|Number=Sing|Person=3|Tense=Pres|VerbForm=Fin,14.0,dep,14:dep,_,2.0
114836,433426,Sid c',est, aussi quand la source paraît douteuse.,3.0,est,être,VERB,VERB,Mood=Ind|Number=Sing|Person=3|Tense=Pres|VerbForm=Fin,0.0,root,0:root,_,1.0
115414,435649,"Le Costaricien, qui était resté muet en championnat depuis fin juillet en ",est, donc désormais à deux buts en deux rencontres.,14.0,est,être,VERB,VERB,Mood=Ind|Number=Sing|Person=3|Tense=Pres|VerbForm=Fin,19.0,cop,19:cop,_,1.0
115677,436681,Vous avez évoqué le besoin de ces populations à faire connaître et partager leurs façons d',être, et de vivre.,17.0,être,être,VERB,VERB,VerbForm=Inf,15.0,acl,15:acl,_,1.0
116009,437898,"A un point tel que l'IRB s'est fendu d'un communiqué de soutien : """"L'IRB est convaincu que le niveau des arbitres est encore meilleur comme jamais il n'a ",été, lors d'une Coupe du monde de rugby.,35.0,été,être,VERB,VERB,Tense=Past|VerbForm=Part,29.0,advcl,29:advcl,_,1.0
116021,437961,"Sont considérées comme faisant partie du public, toutes les personnes admises dans l'établissement à quelque titre que ce ",soit, en plus du personnel. » (4) Art.,21.0,soit,être,VERB,VERB,Mood=Sub|Number=Sing|Person=3|Tense=Pres|VerbForm=Fin,19.0,fixed,19:fixed,_,1.0
116460,439713,"Alors, même si l'intégration de ces quatre nouveaux arrivants un pue particuliers a causé quelques soucis d'organisation au sein de la Capitainerie, ils ",sont, tous là pour au moins 5 ans.,28.0,sont,être,VERB,VERB,Mood=Ind|Number=Plur|Person=3|Tense=Pres|VerbForm=Fin,0.0,root,0:root,_,1.0
116632,440354,Seule la voix passive fait un usage réellement inoffensif du verbe « ,être, » (et difficilement escamotable) : « La pomme est mangée par Jérôme ».,13.0,être,être,VERB,VERB,VerbForm=Inf,11.0,acl,11:acl,_,2.0
116982,441644,"C'est une rencontre du ras-le-bol, de l'indignation, de la colère populaire, une rencontre avec les organisations de base qui ",sont, déjà sur le terrain.,25.0,sont,être,VERB,VERB,Mood=Ind|Number=Plur|Person=3|Tense=Pres|VerbForm=Fin,21.0,acl:relcl,21:acl:relcl,_,1.0
117896,445483,"Inversement, constatons que nos plus belles bêtises ",sont, lorsque nous avons suivi la route des conseillers contre notre conviction.,9.0,sont,être,VERB,VERB,Mood=Ind|Number=Plur|Person=3|Tense=Pres|VerbForm=Fin,3.0,ccomp,3:ccomp,_,1.0
118120,446330,"Lorsque la chaleur de la journée tombe et que la nuit plus douce arrive, ils ",sont," toujours des milliers à entrer dans l'enceinte de la mosquée, portant des tapis, de la nourriture et de l'eau.",17.0,sont,être,VERB,VERB,Mood=Ind|Number=Plur|Person=3|Tense=Pres|VerbForm=Fin,20.0,cop,20:cop,_,1.0
118728,448661,"Le Salon du livre vient de fermer ses portes, et force ",est, de constater qu'il a donné lieu à de nombreuses déclarations sur les bibliothèques.,13.0,est,être,VERB,VERB,Mood=Ind|Number=Sing|Person=3|Tense=Pres|VerbForm=Fin,5.0,conj,5:conj,_,1.0
119429,451340,Il l'incarne dans sa façon d',être," et dans la façon dont il a dirigé le ministère de l'Intérieur, le ministère des Finances ou dont il a fait de l'UMP une force politique considérable avec 400.000 militants"""", a ajouté M. Fillon.",8.0,être,être,VERB,VERB,VerbForm=Inf,6.0,acl,6:acl,_,2.0
120642,455951,"Alors même si le pouvoir à Belgrade se passerait bien du Monténégro, il lui faut par la répression et la guerre, arrêter s'il ",est, encore temps le changement qui s'annonce.,27.0,est,être,VERB,VERB,Mood=Ind|Number=Sing|Person=3|Tense=Pres|VerbForm=Fin,24.0,advcl,24:advcl,_,1.0
122135,461620,"Nous faisons beaucoup de débats publics, mais force ",est," de constater que le débat ne prend pas dans la population, en particulier si l'on compare avec la question de l'asile et des étrangers, pour laquelle il y avait un véritable bouillonnement.",10.0,est,être,VERB,VERB,Mood=Ind|Number=Sing|Person=3|Tense=Pres|VerbForm=Fin,2.0,conj,2:conj,_,1.0
122816,464044,"Et là où il entrera, dites au propriétaire: """"Le maître te fait dire: Où ",est," la salle où je pourrai manger la Pâque avec mes disciples?""""",19.0,est,être,VERB,VERB,Mood=Ind|Number=Sing|Person=3|Tense=Pres|VerbForm=Fin,2.0,dep,2:dep,_,3.0
123002,464832,L'administrateur de site peut disposer d'informations personnelles vous concernant si vous les lui avez communiquÃ©,es," directement ou si vous les avez fournies Ã la sociÃ©tÃ© pour laquelle il travaille (sur votre carte de visite, par exemple).",19.0,es,être,VERB,VERB,Gender=Fem|Number=Plur|Tense=Past|VerbForm=Part,18.0,advcl,18:advcl,_,1.0
124347,469699,Alors si un joueur n',est," pas là, on doit compenser en communiquant davantage.",6.0,est,être,VERB,VERB,Mood=Ind|Number=Sing|Person=3|Tense=Pres|VerbForm=Fin,11.0,advcl,11:advcl,_,2.0
124878,471784,"Davidson a aussi laissé la presse sur son appétit, dimanche, ne dérogeant pas à ce qui ",est, comme une tradition en hockey féminin.,19.0,est,être,VERB,VERB,Mood=Ind|Number=Sing|Person=3|Tense=Pres|VerbForm=Fin,17.0,acl:relcl,17:acl:relcl,_,1.0
125487,474031,Tandis que ce qui nous paraît clair et distinct n',est,", on s'en rend vite compte, que le résultat d'un détour  une médiation, un usage des mots.",11.0,est,être,VERB,VERB,Mood=Ind|Number=Sing|Person=3|Tense=Pres|VerbForm=Fin,16.0,advcl,16:advcl,SpaceAfter=No,1.0
126256,476836,"De mon côté, inclure de la publicité ne me dérange pas -tant qu'elle n'est pas envahissante- que ce ",soit, pour disposer des fonds nécessaires aux fonctionnement de wikipedia ou que ce soit pour faire de wikipedia une organisation rentable.,22.0,soit,être,VERB,VERB,Mood=Sub|Number=Sing|Person=3|Tense=Pres|VerbForm=Fin,11.0,advcl,11:advcl,_,2.0
126482,477646,"Les marchés ont fortement réagi à l'annonce de l'arrêt de la production dans plusieurs raffineries aux Etats-Unis, que ce ",soit, en raison de pannes ou d'opérations de maintenance.,23.0,soit,être,VERB,VERB,Mood=Sub|Number=Sing|Person=3|Tense=Pres|VerbForm=Fin,5.0,advcl,5:advcl,_,1.0
126629,478213,"Il paraît que si les cheveux se dressent sur notre tête, c'",est, qu'on est sur le point d'être frappé par l'éclair.,14.0,est,être,VERB,VERB,Mood=Ind|Number=Sing|Person=3|Tense=Pres|VerbForm=Fin,2.0,ccomp,2:ccomp,_,1.0
126806,478835,Ce nouveau Service d'Information de COnsultation des Créances (SICOC) vous permet de savoir ce qu'il en ,est, d'une demande de remboursement ou de paiement (autre que les traitements et salaires) déposée auprès de l'inspection académique.,21.0,est,être,VERB,VERB,Mood=Ind|Number=Sing|Person=3|Tense=Pres|VerbForm=Fin,17.0,ccomp,17:ccomp,_,2.0
128401,484746,"Dans ce salon Téléform, nous voyons que nous ",sommes, tous dans des métiers qui évoluent beaucoup et rapidement.,10.0,sommes,être,VERB,VERB,Mood=Ind|Number=Plur|Person=1|Tense=Pres|VerbForm=Fin,7.0,ccomp,7:ccomp,_,2.0
128835,486399,Le gouvernement espagnol attendait de ce congrès des indications lui permettant de savoir où en ,est, l'espoir d'un dépôt des armes par l'ETA.,16.0,est,être,VERB,VERB,Mood=Ind|Number=Sing|Person=3|Tense=Pres|VerbForm=Fin,13.0,ccomp,13:ccomp,_,1.0
129284,488092,"Ca fait longtemps qu'on a l'impression que tout le monde veut des terminaux à écran tactile, que ce ",soit," pour des PC, des smartphones, ou autre, mais au final dès que quelqu'un se lance là dedans, c'est un échec commercial.",22.0,soit,être,VERB,VERB,Mood=Sub|Number=Sing|Person=3|Tense=Pres|VerbForm=Fin,13.0,advcl,13:advcl,_,1.0
129759,489779,Il faut que cette recherche n'en ,est, qu'à ses débuts et de nombreux tests seront nécessaires avant d'atteindre l'étape des essais cliniques.,8.0,est,être,VERB,VERB,Mood=Ind|Number=Sing|Person=3|Tense=Pres|VerbForm=Fin,2.0,ccomp,2:ccomp,_,2.0
130497,492636,"La vérité, c'",est," qu'étant moins sûre de moi, je me retranchais derrière une attitude sans doute plus raide.",5.0,est,être,VERB,VERB,Mood=Ind|Number=Sing|Person=3|Tense=Pres|VerbForm=Fin,0.0,root,0:root,_,1.0
130574,492935,"Nous n'en savons pas plus, si ce n'",est," que cet InPerson est tout de même équipé d'une puce DaVinci, la même qui est à l'intérieur de l'Archos 605 et du Cowon A3.",11.0,est,être,VERB,VERB,Mood=Ind|Number=Sing|Person=3|Tense=Pres|VerbForm=Fin,9.0,fixed,9:fixed,_,2.0
132236,499321,"Que la FIB renoue avec les combats internationaux, où ",est, le mal.,11.0,est,être,VERB,VERB,Mood=Ind|Number=Sing|Person=3|Tense=Pres|VerbForm=Fin,7.0,acl:relcl,7:acl:relcl,_,1.0
132393,500002,Elle se prénomme Thouyi ; elle refuse de croire Menî lorsque celui-ci lui révèle qui il ,est, et lui impose sa présence.,17.0,est,être,VERB,VERB,Mood=Ind|Number=Sing|Person=3|Tense=Pres|VerbForm=Fin,14.0,ccomp,14:ccomp,_,1.0
133106,502779,Toutes les filles qui ,sont," là sont des joueuses phares dans leur club, elles n'ont pas l'habitude de rentrer deux minutes et de ressortir.",5.0,sont,être,VERB,VERB,Mood=Ind|Number=Plur|Person=3|Tense=Pres|VerbForm=Fin,3.0,acl:relcl,3:acl:relcl,_,2.0
133127,502828,"La seule chose qui pourrait me faire hésiter, ce ",serait," si j'avais un désaccord de fond avec le président de la République"""", indique le sénateur (UMP) de la Vienne.",12.0,serait,être,VERB,VERB,Mood=Cnd|Number=Sing|Person=3|Tense=Pres|VerbForm=Fin,0.0,root,0:root,_,2.0
133553,504443,"Voilà, mademoiselle, ce qu'il en ",est, du thème de ce M. Raf.,9.0,est,être,VERB,VERB,Mood=Ind|Number=Sing|Person=3|Tense=Pres|VerbForm=Fin,5.0,acl:relcl,5:acl:relcl,_,2.0
134079,506488,Jeanne Mas : Cette image était si importante que je ne savais plus qui j',étais,", si les gens m'aimaient pour moi ou juste pour mon personnage.",16.0,étais,être,VERB,VERB,Mood=Ind|Number=Sing|Person=1|Tense=Imp|VerbForm=Fin,12.0,obj,12:obj,SpaceAfter=No,1.0
134136,506703,"Il a délégué les détails à d'autres, posant rarement le pied dans la région, si ce n'",est, pour aller encourager ses troupes en Irak.,21.0,est,être,VERB,VERB,Mood=Ind|Number=Sing|Person=3|Tense=Pres|VerbForm=Fin,10.0,advcl,10:advcl,_,3.0
134686,508655,"On m'a interdit l'accès au bâtiment sans explication, et ce bien que j'ai précisé qui j'",étais,", a déclaré le diplomate aux journalistes présents sur place.",22.0,étais,être,VERB,VERB,Mood=Ind|Number=Sing|Person=1|Tense=Imp|VerbForm=Fin,14.0,acl:relcl,14:acl:relcl,SpaceAfter=No,1.0
134792,509000,"Si François Bayrou monte dans les sondages, estime Ségolène Royal, c'est parce qu'il apparaît comme « le candidat antisystème ». « Mais on sait qui il ",est," : c'est une illusion de changement », confie-t-elle en privé.",14.0,est,être,AUX,AUX,Mood=Ind|Number=Sing|Person=3|Tense=Pres|VerbForm=Fin,18.0,cop,18:cop,_,1.0
135233,510699,"Y figure aussi une poussette """" spécial jogging """" à double place Quoi qu'il en ",soit,", on raconte que Jennifer et l'heureux futur papa, Marc Anthony, ne ménageraient pas les dépenses afin d'aménager les chambres d'enfant dans leurs trois propriétés.",17.0,soit,être,VERB,VERB,Mood=Sub|Number=Sing|Person=3|Tense=Pres|VerbForm=Fin,13.0,fixed,13:fixed,SpaceAfter=No,1.0
135652,512246,La question que doit se poser la communauté wikipédienne ,est, donc : est-ce que ce comportement entre en conflit avec les principes de base de wikipédia ?,10.0,est,être,VERB,VERB,Mood=Ind|Number=Sing|Person=3|Tense=Pres|VerbForm=Fin,0.0,root,0:root,_,1.0
137107,517551,Le théme national d'année ,est," : """"Mets du Pep's autour de toi"""".",6.0,est,être,VERB,VERB,Mood=Ind|Number=Sing|Person=3|Tense=Pres|VerbForm=Fin,0.0,root,0:root,_,1.0
137444,518601,Un des moments forts ,fut, lorsque le Président s'asseya près de la vieille Zé Diarra.,5.0,fut,être,VERB,VERB,Mood=Ind|Number=Sing|Person=3|Tense=Past|VerbForm=Fin,0.0,root,0:root,_,2.0
137516,518880,Je me souviens d'avoir un jour oubliant où j',étais,", ri aux éclats au grand étonnement des autres passagers.",11.0,étais,être,VERB,VERB,Mood=Ind|Number=Sing|Person=1|Tense=Imp|VerbForm=Fin,8.0,ccomp,8:ccomp,SpaceAfter=No,1.0
138298,521957,"Si je suis maître, où ",est, la crainte qu'on a de moi?,7.0,est,être,VERB,VERB,Mood=Ind|Number=Sing|Person=3|Tense=Pres|VerbForm=Fin,4.0,conj,4:conj,_,3.0
138658,523322,"Le monde est constitu&#233; d'atomes et &#224; chaque instant, Dieu les redispose tels qu'ils ",sont,", ce qui nous donne l'impression d'une r&#233;gularit&#233;.",22.0,sont,être,VERB,VERB,Mood=Ind|Number=Plur|Person=3|Tense=Pres|VerbForm=Fin,19.0,dep,19:dep,SpaceAfter=No,1.0
138724,523590,"De forme carrée, triangulaire, en demi-cercle ou oblongue, mais sa forme idéale ",étant, quand sa longueur dépassait d'un tiers sa largeur.,16.0,étant,être,VERB,VERB,Tense=Pres|VerbForm=Part,2.0,conj,2:conj,_,1.0
138846,524048,Tu n',es," pas sans savoir qu'à Fluide, on a un nouveau Boss.",3.0,es,être,VERB,VERB,Mood=Ind|Number=Sing|Person=1|Tense=Pres|VerbForm=Fin,0.0,root,0:root,_,1.0
139365,525923,"Le P10 intègre également un visibility processor dont on ne sait pas grand chose, si ce n'",est, qu'il réalise les opérations de Z-occlusion culling qui permet de ne pas rendre les objets non-visibles.,19.0,est,être,VERB,VERB,Mood=Ind|Number=Sing|Person=3|Tense=Pres|VerbForm=Fin,17.0,fixed,17:fixed,_,1.0
140529,530301,"Dans le camp libéral, les deux champions sont Yvon Vallières, de Richmond, et Pierre Paradis, de Brome-Missisquoi, qui en ",étaient, mardi à leur neuvième assermentation.,27.0,étaient,être,VERB,VERB,Mood=Ind|Number=Plur|Person=3|Tense=Imp|VerbForm=Fin,17.0,acl:relcl,17:acl:relcl,_,1.0
140750,531242,Au point qu’il ne saura plus vraiment où il en ,est," et que, d’un triangle amoureux, cela deviendra presque une relation à trois.",12.0,est,être,VERB,VERB,Mood=Ind|Number=Sing|Person=3|Tense=Pres|VerbForm=Fin,6.0,ccomp,6:ccomp,_,1.0
141058,532400,La question ,est, : qui possède le téléphone ?,4.0,est,être,VERB,VERB,Mood=Ind|Number=Sing|Person=3|Tense=Pres|VerbForm=Fin,0.0,root,0:root,_,1.0
