Unnamed: 0,sent_id,left_context,pivot,right_context,ID,FORM,LEMMA,UPOS,XPOS,FEATS,HEAD,DEPREL,DEPS,MISC,dist
192757,727190,"Par ailleurs les récents discours de Monsieur Allègre sur l'école citoyenne ont confirmé, s'il en ",était," besoin, la nécessité d'intégrer la notion dans les pratiques professionnelles communes.",19.0,était,être,VERB,VERB,Mood=Ind|Number=Sing|Person=3|Tense=Imp|VerbForm=Fin,14.0,advcl,14:advcl,_,1.0
192862,727584,"Et ce qui fou les ch'tons, c'",est, c'est qu'on est sûrement pas mis au courant.,10.0,est,être,VERB,VERB,Mood=Ind|Number=Sing|Person=3|Tense=Pres|VerbForm=Fin,0.0,root,0:root,_,1.0
193174,728764,C'est l'abandon pour Sato et il ne ,sont, plus que 13 en course!,10.0,sont,être,VERB,VERB,Mood=Ind|Number=Plur|Person=3|Tense=Pres|VerbForm=Fin,13.0,cop,13:cop,_,1.0
193379,729610,"Le complice habituel de Jérôme Savary, le compositeur pianiste Gérard Daguerre, aidé par Zouzou Thomas, signe la musique de ce spectacle musical et il ",sera," lui même dans la fosse, accompagné par six autres instrumentistes.",28.0,sera,être,VERB,VERB,Mood=Ind|Number=Sing|Person=3|Tense=Fut|VerbForm=Fin,19.0,conj,19:conj,_,1.0
194085,732296,"Des cris retentirent : """"ô noble, où ",êtes,-vous ?,10.0,êtes,être,VERB,VERB,Mood=Ind|Number=Plur|Person=2|Tense=Pres|VerbForm=Fin,6.0,conj,6:conj,SpaceAfter=No,1.0
194689,734420,"Une fois, devant lui, j'avais expliqué que nous ",étions," seuls au club à devoir prendre des décisions : moi en quelques heures, le coach en quelques secondes.",12.0,étions,être,VERB,VERB,Mood=Ind|Number=Plur|Person=1|Tense=Imp|VerbForm=Fin,9.0,ccomp,9:ccomp,_,1.0
195211,736283,"Si les choses s'améliorent progressivement pour la prise en charge des enfants, il est loin d'en ",être, de même pour celle des adolescents.,20.0,être,être,VERB,VERB,VerbForm=Inf,17.0,dep,17:dep,_,1.0
195805,738642,"Pour les convaincre, je n'hésite pas à dire que l'humanité ne serait pas où elle ",est, sans la science au premier plan.,19.0,est,être,VERB,VERB,Mood=Ind|Number=Sing|Person=3|Tense=Pres|VerbForm=Fin,15.0,dep,15:dep,_,1.0
195806,738642,"Pour les convaincre, je n'hésite pas à dire que l'humanité ne ",serait, pas où elle est sans la science au premier plan.,15.0,serait,être,VERB,VERB,Mood=Cnd|Number=Sing|Person=3|Tense=Pres|VerbForm=Fin,10.0,ccomp,10:ccomp,_,1.0
196053,739539,L'intérêt d'utiliser un outil comme CVS ,est," d'abord qu'il stocke seulement les différences entre deux versions successives, réalisant ainsi un gain de place appréciable.",9.0,est,être,VERB,VERB,Mood=Ind|Number=Sing|Person=3|Tense=Pres|VerbForm=Fin,0.0,root,0:root,_,1.0
196162,739947,"Il s'agit tout simplement de commentaires à charge, avec une thèse sans la contre-thèse où en ",est,"-t-il de la déontologie journalistique, ou encore une fois, on met en avant, la liberté de la presse pour atteindre ses propres intérêts....",19.0,est,être,VERB,VERB,Mood=Ind|Number=Sing|Person=3|Tense=Pres|VerbForm=Fin,3.0,dep,3:dep,SpaceAfter=No,1.0
196384,740756,Le problème n',est,-il pas que 1804 fait partie du Calendrier républicain ?,4.0,est,être,VERB,VERB,Mood=Ind|Number=Sing|Person=3|Tense=Pres|VerbForm=Fin,0.0,root,0:root,SpaceAfter=No,1.0
196415,740911,"Bah, ce sont des images libres de Flickr ; où ",est, le problème ?,12.0,est,être,VERB,VERB,Mood=Ind|Number=Sing|Person=3|Tense=Pres|VerbForm=Fin,0.0,root,0:root,_,1.0
197124,743659,D'habitude on n',est," dehors qu'une heure le matin et une heure l'après-midi"""", explique K. 24 ans, qui a effectué 7 kilomètres en 45 minutes.",6.0,est,être,VERB,VERB,Mood=Ind|Number=Sing|Person=3|Tense=Pres|VerbForm=Fin,7.0,cop,7:cop,_,1.0
197237,744113,Mais le garde du corps il doit avoir l'âge de mon arrière grand-père il ,est, sur d'avoir choisi la bonne personne pour le protéger?,16.0,est,être,VERB,VERB,Mood=Ind|Number=Sing|Person=3|Tense=Pres|VerbForm=Fin,7.0,advcl,7:advcl,_,1.0
197387,744734,Au moins la ministre des Affaires étrangères la comprend-elle et l'on peut imaginer ce qu'il en ,serait, si Moritz Leuenberger ou Eveline Widmer-Schlumpf étaient chargés du dossier.,20.0,serait,être,VERB,VERB,Mood=Cnd|Number=Sing|Person=3|Tense=Pres|VerbForm=Fin,30.0,nsubj:pass,30:nsubj:pass,_,1.0
197591,745481,"Châteaux, réunions secrètes, nuits de négociations, annulations de rendez-vous internationaux, tout y ",était, pour que le citoyen célèbre le génie politique du Premier ministre.,17.0,était,être,VERB,VERB,Mood=Ind|Number=Sing|Person=3|Tense=Imp|VerbForm=Fin,0.0,root,0:root,_,1.0
197778,746299,"Étrangement, cette course n'a jamais été aussi populaire que cette année alors que de nombreux pilotes de renom sont inscrits, que ce ",soit," de la Coupe Nextel de NASCAR, de l'IRL ou de Champ Car en plus des réguliers de cette populaire série.",26.0,soit,être,VERB,VERB,Mood=Sub|Number=Sing|Person=3|Tense=Pres|VerbForm=Fin,22.0,advcl,22:advcl,_,1.0
198760,750138,Le professeur pose subrepticement la question : le propre de Don Quichotte n',est,-il pas d'être ridicule dans son entêtement à poursuivre sa croisade absurde ?,14.0,est,être,VERB,VERB,Mood=Ind|Number=Sing|Person=3|Tense=Pres|VerbForm=Fin,3.0,advcl,3:advcl,SpaceAfter=No,1.0
199009,751100,Trois propositions Nous espérons et souhaitons qu'il en ,soit, de même de la part de votre majorité.,10.0,soit,être,VERB,VERB,Mood=Sub|Number=Sing|Person=3|Tense=Pres|VerbForm=Fin,6.0,ccomp,6:ccomp,_,1.0
199410,752677,"Ce que le rapport dit, c'",est," oublions notre passé, notre histoire et notre culture et définissons notre avenir en fonction des us et coutumes des nouveaux Québécois.",8.0,est,être,VERB,VERB,Mood=Ind|Number=Sing|Person=3|Tense=Pres|VerbForm=Fin,0.0,root,0:root,_,1.0
199499,753063,"Durant cette période, j'ai oublié qui j'",étais, et ce que j'avais fait dans le football.,10.0,étais,être,VERB,VERB,Mood=Ind|Number=Sing|Person=1|Tense=Imp|VerbForm=Fin,8.0,acl:relcl,8:acl:relcl,_,1.0
199571,753304,"Ce qui est certain, c'",est, que le temps d'un salon unique où tous les éditeurs se rassemblaient à coups de millions de dollars pour exposer leurs jeux au public est révolu.,3.0,est,être,AUX,AUX,Mood=Ind|Number=Sing|Person=3|Tense=Pres|VerbForm=Fin,4.0,cop,4:cop,_,3.0
199793,754090,"On ne sait si le Général Claude-Augustin de Tercier (° 1752 - † 1823) eut connaissance du crime de ses lieutenants, toujours ",est,-il qu'il ne prononça aucune sanction.,28.0,est,être,VERB,VERB,Mood=Ind|Number=Sing|Person=3|Tense=Pres|VerbForm=Fin,3.0,advcl,3:advcl,SpaceAfter=No,1.0
199965,754641,"Rescapé d'un monde qui croyait ne plus avoir besoin de lui, l'âne s'est trouvé une nouvelle mission : réapprendre aux humains le bonheur d'",être, et le plaisir de cheminer.,29.0,être,être,VERB,VERB,VerbForm=Inf,27.0,acl,27:acl,_,3.0
199980,754695,Un ostréiculteur australien affirme avoir mis au point l'aphrodisiaque le plus efficace qui ,soit,", grâce à ses huîtres nourries au Viagra qui émoustillent déja de nombreux clients à l'étranger.",15.0,soit,être,VERB,VERB,Mood=Sub|Number=Sing|Person=3|Tense=Pres|VerbForm=Fin,10.0,acl:relcl,10:acl:relcl,SpaceAfter=No,1.0
200489,756540,"Le problème, c'est qu'on ne sait pas où ",sont, les risques.,13.0,sont,être,VERB,VERB,Mood=Ind|Number=Plur|Person=3|Tense=Pres|VerbForm=Fin,10.0,dep,10:dep,_,1.0
201537,760525,Le but des 56 premiers membres de la «Garde Hongroise» («Magyar Garda») ,sera, humblement de «sauver le peuple hongrois».,19.0,sera,être,VERB,VERB,Mood=Ind|Number=Sing|Person=3|Tense=Fut|VerbForm=Fin,0.0,root,0:root,_,1.0
201576,760664,En gros le message ,est," :""""Nous sommes très fiers de notre merveille.",5.0,est,être,VERB,VERB,Mood=Ind|Number=Sing|Person=3|Tense=Pres|VerbForm=Fin,0.0,root,0:root,_,1.0
203637,768338,"Mais aujourd'hui, l'enjeu n'",est," pas là: le Grenelle doit déboucher sur des propositions concrètes, financées et à la hauteur de la crise écologique, rien de tout cela n'est pour l'instant acté.",7.0,est,être,VERB,VERB,Mood=Ind|Number=Sing|Person=3|Tense=Pres|VerbForm=Fin,39.0,advcl,39:advcl,_,2.0
205406,775137,"Alors que Le Monde (daté de mardi) lui demande si Harry Roselmack est """"destiné à succéder un jour à Patrick Poivre d'Arvor"""", Robert Namias répond: """"Si la question ",est,: peut-on imaginer un présentateur noir régulièrement au +20H00+ de TF1?,15.0,est,être,AUX,AUX,Mood=Ind|Number=Sing|Person=3|Tense=Pres|VerbForm=Fin,17.0,aux:tense,17:aux:tense,_,1.0
205439,775278,Même les seuls éléments positifs du film que sont ces trois personnages sont perdus parce que le nazisme a ,été," ainsi, il n'y a plus d'issue pour personne. (...)",20.0,été,être,VERB,VERB,Tense=Past|VerbForm=Part,14.0,advcl,14:advcl,_,3.0
205759,776366,"Abordant le volet """"identité nationale"""", Hortefeux-la-joie, porte-flingue du Président, a """"conseillé à tous ceux qui ironisaient"""" sur ce volet de son ministère, dont nous ",sommes,", d'""""analyser le vote irlandais"""".",33.0,sommes,être,VERB,VERB,Mood=Ind|Number=Plur|Person=1|Tense=Pres|VerbForm=Fin,26.0,acl:relcl,26:acl:relcl,SpaceAfter=No,2.0
206354,778714,"Il en a été ainsi du suffrage universel, l'égalité des droits de l'homme et de la femme et il en ",sera," de même, sans doute, d'autres droits.",24.0,sera,être,VERB,VERB,Mood=Ind|Number=Sing|Person=3|Tense=Fut|VerbForm=Fin,7.0,conj,7:conj,_,1.0
207837,783996,La morale des services photo c',est," : plus y en a pour les """" étrangers """", moins y en a pour les potes.",7.0,est,être,VERB,VERB,Mood=Ind|Number=Sing|Person=3|Tense=Pres|VerbForm=Fin,0.0,root,0:root,_,1.0
208291,785752,"Le congrès a alors lieu à York, Pennsylvanie et Steuben, après s'être fait congédier de Philadelphie durant l'hiver, ",est, parmi eux le 5 février 1778.,24.0,est,être,VERB,VERB,Mood=Ind|Number=Sing|Person=3|Tense=Pres|VerbForm=Fin,3.0,conj,3:conj,_,1.0
208306,785799,"Donc, oui, un avion longeant la ligne d'équateur va plus vite lorsqu'il tourne dans le même sens que la Terre, mais uniquement pour quelqu'un qui n'",est, pas sur Terre.,33.0,est,être,VERB,VERB,Mood=Ind|Number=Sing|Person=3|Tense=Pres|VerbForm=Fin,30.0,acl:relcl,30:acl:relcl,_,1.0
208429,786217,"Mais si on garde l'état d'esprit qui est actuellement le notre jusqu'au bout, on ne ",sera, pas loin du titre.,20.0,sera,être,VERB,VERB,Mood=Ind|Number=Sing|Person=3|Tense=Fut|VerbForm=Fin,0.0,root,0:root,_,1.0
208630,786950,"Premier défilé, premier succès, Yves Saint Laurent n'en reste pas moins un ",être," fragile, agoraphobe, timide, cachant son air poupin derrière de grosses lunettes.",16.0,être,être,VERB,VERB,VerbForm=Inf,12.0,xcomp,12:xcomp,_,1.0
208950,788056,"Interrogé sur la possibilité d'une augmentation d'un euro de la consultation généraliste, M. Bertrand a répondu : """"Ce qui importe surtout, c'",est," de savoir avec quoi on peut donner cet euro de plus"""".",28.0,est,être,VERB,VERB,Mood=Ind|Number=Sing|Person=3|Tense=Pres|VerbForm=Fin,19.0,advcl,19:advcl,_,3.0
209335,789475,Les engagements du président de la République pris à l'issue du Grenelle sont toujours d'actualité mais force ,est," de constater qu'ils sont absents des récentes déclarations du gouvernement"""", font-ils remarquer.",21.0,est,être,VERB,VERB,Mood=Ind|Number=Sing|Person=3|Tense=Pres|VerbForm=Fin,18.0,conj,18:conj,_,1.0
209402,789700,Le seul fait de la reconnaissance par la Cour d'État de son pouvoir de contrôle sur cette coutume l'inscrit dans le champ juridique; s'il en ,était," autrement, elle lui échapperait Tout le reste est littérature.",30.0,était,être,VERB,VERB,Mood=Ind|Number=Sing|Person=3|Tense=Imp|VerbForm=Fin,35.0,advcl,35:advcl,_,2.0
209747,790896,"Les IFDD ne sont pas, et n'ont jamais ",été,", des indemnités représentatives de frais, elles sont des compléments de rémunération pour répondre à des niveaux de qualifications mal pris en compte par la grille Fonction Publique.",11.0,été,être,VERB,VERB,Tense=Past|VerbForm=Part,5.0,dep,5:dep,SpaceAfter=No,1.0
210128,792142,"Il ajouté que Abou Mazen a exprimé sa condamnation de telles infiltrations, que ce ",soit, d'armes ou d'individus.,16.0,soit,être,VERB,VERB,Mood=Sub|Number=Sing|Person=3|Tense=Pres|VerbForm=Fin,7.0,advcl,7:advcl,_,1.0
210208,792455,"Cette parenthèse est la seule, aussi longue, dont a bénéficié Le Guen depuis son arrivée pour pourvoir travailler, si ce n'",est," avec la totalité de son groupe, du moins avec ses principaux joueurs.",3.0,est,être,AUX,AUX,Mood=Ind|Number=Sing|Person=3|Tense=Pres|VerbForm=Fin,8.0,cop,8:cop,_,1.0
210427,793318,"Ce fut beaucoup plus facile que l'an dernier, n'",est,"-ce pas?, a lancé Weekley, tout sourire, au groupe qui l'accompagnait, après avoir inscrit une normale de routine au 17e trou.",12.0,est,être,VERB,VERB,Mood=Ind|Number=Sing|Person=3|Tense=Pres|VerbForm=Fin,5.0,parataxis,5:parataxis,SpaceAfter=No,1.0
210438,793348,"Ce sont des émotions terribles, heureusement les familles ",sont," ensemble et se ressoudent On constitue LA famille des victimes"""", a expliqué Jean-Pierre Leroy, père d'une des sept victimes.",3.0,sont,être,AUX,AUX,Mood=Ind|Number=Plur|Person=3|Tense=Pres|VerbForm=Fin,5.0,cop,5:cop,_,1.0
210514,793667,Le motif ,est, : « Vandalisme: un super pirate a fait du defacement.,3.0,est,être,VERB,VERB,Mood=Ind|Number=Sing|Person=3|Tense=Pres|VerbForm=Fin,0.0,root,0:root,_,1.0
210567,793891,"Le rapport sujet-objet est encore un rapport d'adéquation qui en définit la vérité possible, il n'",est," pas, comme l'a montré le pragmatisme, un rapport de transformation qui définit la vérité par les effets de l'action.",6.0,est,être,AUX,AUX,Mood=Ind|Number=Sing|Person=3|Tense=Pres|VerbForm=Fin,9.0,cop,9:cop,_,1.0
210773,794709,"Depuis le début de la guerre en mars 2003, ils ",sont, donc 3055 à avoir péri.,12.0,sont,être,VERB,VERB,Mood=Ind|Number=Plur|Person=3|Tense=Pres|VerbForm=Fin,14.0,cop,14:cop,_,1.0
210781,794740,La particularité principale de l'orbite de Phœbé ,est," surtout qu'elle est rétrograde, ce satellite tournant autour de Saturne dans le sens opposé à celui de la rotation de la planète sur elle-même.",9.0,est,être,VERB,VERB,Mood=Ind|Number=Sing|Person=3|Tense=Pres|VerbForm=Fin,0.0,root,0:root,_,1.0
211106,796029,"Ma tactique, c'",était, tout simplement de jouer mon jeu.,5.0,était,être,VERB,VERB,Mood=Ind|Number=Sing|Person=3|Tense=Imp|VerbForm=Fin,0.0,root,0:root,_,1.0
212535,801516,"La gestion des déchets, pour être essentielle, est loin de constituer l'unique raison d'",être, de l'Agence.,7.0,être,être,AUX,AUX,VerbForm=Inf,8.0,cop,8:cop,_,1.0
213057,803532,"La critique essentielle, c'",était,": on jouait trop bien, on a oublié par moments que l'objectif c'était l'efficacité.",6.0,était,être,VERB,VERB,Mood=Ind|Number=Sing|Person=3|Tense=Imp|VerbForm=Fin,0.0,root,0:root,SpaceAfter=No,1.0
213988,806975,"Le magistrat avait refusé jeudi d'écarter toute hypothèse, que ce ",soit," celle d'une mort accidentelle, d'un drame familial ou d'un enlèvement par un tiers.",13.0,soit,être,VERB,VERB,Mood=Sub|Number=Sing|Person=3|Tense=Pres|VerbForm=Fin,9.0,advcl,9:advcl,_,1.0
214271,808081,"Sinon, il organise lui-même sa communication, que ce ",soit, quand il est mis en cause pour le choix d'un parrain ou pour la publication de photos de ses jumeaux.,11.0,soit,être,VERB,VERB,Mood=Sub|Number=Sing|Person=3|Tense=Pres|VerbForm=Fin,4.0,advcl,4:advcl,_,1.0
214308,808231,"Et j'entendis l'ange des eaux qui disait: Tu es juste, toi qui ",es,", et qui étais; tu es saint, parce que tu as exercé ce jugement.",12.0,es,être,AUX,AUX,Mood=Ind|Number=Plur|Person=2|Tense=Pres|VerbForm=Fin,13.0,cop,13:cop,_,1.0
214310,808231,"Et j'entendis l'ange des eaux qui disait: Tu es juste, toi qui es, et qui ",étais,"; tu es saint, parce que tu as exercé ce jugement.",21.0,étais,être,VERB,VERB,Mood=Ind|Number=Sing|Person=1|Tense=Imp|VerbForm=Fin,17.0,conj,17:conj,SpaceAfter=No,1.0
214979,810673,"L’Internet est un fort axe de développement, que ce ",soit," pour mettre à jour un blog, poster une vidéo ou lire ses mails.",12.0,soit,être,VERB,VERB,Mood=Sub|Number=Sing|Person=3|Tense=Pres|VerbForm=Fin,6.0,advcl,6:advcl,_,1.0
215298,811812,Les Valaisans et les Neuchâtelois ne ,sont, pas au mieux.,7.0,sont,être,VERB,VERB,Mood=Ind|Number=Plur|Person=3|Tense=Pres|VerbForm=Fin,0.0,root,0:root,_,1.0
215517,812605,"Le système de propulsion est approximativement le même que celui du Chopper, si ce n'",est, que les roues sont beaucoup plus petites et nombreuses.,5.0,est,être,AUX,AUX,Mood=Ind|Number=Sing|Person=3|Tense=Pres|VerbForm=Fin,8.0,cop,8:cop,_,1.0
216625,816885,Car si leurs parents Barack et Michelle assurent qu'ils souhaitent leur offrir l'éducation la plus normale qui ,soit,", Malia et Sasha ne seront définitivement plus des enfants comme les autres.",20.0,soit,être,VERB,VERB,Mood=Sub|Number=Sing|Person=3|Tense=Pres|VerbForm=Fin,15.0,acl:relcl,15:acl:relcl,SpaceAfter=No,3.0
216658,817025,"Dans un communiqué, publié sur son site internet, ASO """"réaffirme que le choix de la sécurité n'est pas, n'a jamais ",été," et ne sera jamais sujet à compromis au sein du rallye Dakar"""".",27.0,été,être,VERB,VERB,Tense=Past|VerbForm=Part,21.0,xcomp,21:xcomp,_,2.0
216821,817687,"Pour David Walstra, vice-président Europe de la Blu-ray Disc Association, la bataille n'est peut-être pas encore jouée mais nous ne ",serions, pas loin de l'épilogue.,26.0,serions,être,VERB,VERB,Mood=Cnd|Number=Plur|Person=1|Tense=Pres|VerbForm=Fin,22.0,conj,22:conj,_,1.0
217062,818629,"Une liste est beaucoup plus souple qu'une catégorie, permet de faire figurer des entrées qui ne (sont pas encore/",seront, jamais) des articles (et donc non présentes dans une catégorie).,24.0,seront,être,VERB,VERB,Mood=Ind|Number=Plur|Person=3|Tense=Fut|VerbForm=Fin,22.0,conj,22:conj,_,1.0
217503,820413,Une easy-info comme il en ,est, de l’easy-listening pour la musique.,8.0,est,être,VERB,VERB,Mood=Ind|Number=Sing|Person=3|Tense=Pres|VerbForm=Fin,4.0,nmod,4:nmod,_,1.0
218261,823237,"Je ne suis pas le seul concerné, Stef48 et Pingui-king méritaient eux aussi largement d'être admins, mais ce qui n'allait pas surtout, c'",était, qu'ils n'avaient pas leur bac àmha.,31.0,était,être,VERB,VERB,Mood=Ind|Number=Sing|Person=3|Tense=Imp|VerbForm=Fin,14.0,conj,14:conj,_,2.0
218591,824407,"Nous nous disions : d'accord, nous ne croyons plus à grand-chose, mais, enfin, l'héritage ",est," là, il veille au grain.",21.0,est,être,VERB,VERB,Mood=Ind|Number=Sing|Person=3|Tense=Pres|VerbForm=Fin,3.0,conj,3:conj,_,1.0
220759,832536,"Lorsque Lazarus la trouve à demi-nue et à moitié morte sur la route en face de chez lui, et qu'il apprend qui elle ",est,", il décide de la sauvée de ses démons contre son gré et l'enchaîne.",26.0,est,être,VERB,VERB,Mood=Ind|Number=Sing|Person=3|Tense=Pres|VerbForm=Fin,23.0,obj,23:obj,SpaceAfter=No,1.0
221461,835231,"Aidé par un aristocrate rêvant de retrouver son seul fils unique aux États-Unis, Tom Ripley emploiera tous les moyens qu'il détient pour maintenir sa promesse. même jusqu'à se personnaliser pour un être dont il n'",est, guère.,40.0,est,être,VERB,VERB,Mood=Ind|Number=Sing|Person=3|Tense=Pres|VerbForm=Fin,36.0,acl:relcl,36:acl:relcl,_,1.0
222015,837153,"Nos pères ont péché, ils ne ",sont," plus, Et c'est nous qui portons la peine de leurs iniquités.",8.0,sont,être,VERB,VERB,Mood=Ind|Number=Plur|Person=3|Tense=Pres|VerbForm=Fin,4.0,advcl,4:advcl,_,1.0
222248,837978,"A Najaf, Moqtada Sadr a lancé un nouvel appel à la fin de la violence confessionnelle, affirmant qu'il """"rejette catégoriquement que des chiites tuent de sunnites ou que des chiites tuent leurs coreligionnaires quel que ",soit," le motif"""".",40.0,soit,être,VERB,VERB,Mood=Ind|Number=Sing|Person=3|Tense=Pres|VerbForm=Fin,39.0,fixed,39:fixed,_,1.0
222399,838545,"Ces deux témoignages, parmi tant d'autres, résument, si besoin en ",était," encore, le ouf de soulagement qu'éprouvent les populations du cercle de Kolondiéba.",15.0,était,être,VERB,VERB,Mood=Ind|Number=Sing|Person=3|Tense=Imp|VerbForm=Fin,10.0,advcl,10:advcl,_,2.0
222790,840083,Et House dira Tu vois c'est ce qu'on appelle un sophisme : c'est pas parce que tu dis que c'est un chien que c'en ,est, forcément....,7.0,est,être,AUX,AUX,Mood=Ind|Number=Sing|Person=3|Tense=Pres|VerbForm=Fin,8.0,cop,8:cop,_,1.0
222820,840204,Il y eut certains matins frileux sur les bords de la Baltique. […] On ,était," comme on était à sept heures du matin. […] Le scénario de Sartre était un scénario sartrien, complètement fidèle à la pièce de Miller.",18.0,était,être,VERB,VERB,Mood=Ind|Number=Sing|Person=3|Tense=Imp|VerbForm=Fin,0.0,root,0:root,_,3.0
224109,845343,"On ne sait pas encore grand-chose de ce deuxième épisode, si ce n'",est," qu'il proposera de nouveaux modes de jeu, des cartes inédites et un système d'armes complètement revu.",15.0,est,être,VERB,VERB,Mood=Ind|Number=Sing|Person=3|Tense=Pres|VerbForm=Fin,13.0,fixed,13:fixed,_,3.0
224239,845782,Ma question ,est," : puis-je importer mes photos dans Commons, puis les utiliser pour illustrer l'article où cette maison est citée ?",3.0,est,être,VERB,VERB,Mood=Ind|Number=Sing|Person=3|Tense=Pres|VerbForm=Fin,0.0,root,0:root,_,1.0
224553,847083,"Un tarif très intéressant pour un scooter GT au gabarit conséquent, surtout que cette version carbu n'a rien a envier à son successeur, si ce n'",est, que ce dernier répond à l'euro3 et affiche des performances légèrement meilleures.,30.0,est,être,VERB,VERB,Mood=Ind|Number=Sing|Person=3|Tense=Pres|VerbForm=Fin,28.0,fixed,28:fixed,_,1.0
224660,847490,"Depuis les origines, l'occidental se trouve face à un paradoxe: comment l'homme peut-il être libre si Dieu ",est,", puisqu'Il sait tout et peut tout de toute éternité?",23.0,est,être,VERB,VERB,Mood=Ind|Number=Sing|Person=3|Tense=Pres|VerbForm=Fin,17.0,advcl,17:advcl,SpaceAfter=No,1.0
225686,851263,Nous allons faire le point pour savoir où nous en ,sommes," », a déclaré à l'issue d'une conférence de presse Eric Madjé Amenouvé, le président du comité.",11.0,sommes,être,VERB,VERB,Mood=Ind|Number=Plur|Person=3|Tense=Pres|VerbForm=Fin,7.0,ccomp,7:ccomp,_,1.0
225968,852278,Les Aigles ont besoin pour cette aventure au Ghana du soutien de quelle que nature que ce ,soit," de tous les Maliens"""", dira le ministre Niang.",18.0,soit,être,VERB,VERB,Mood=Sub|Number=Sing|Person=3|Tense=Pres|VerbForm=Fin,17.0,fixed,17:fixed,_,1.0
227483,858052,"Mais à côté des 2 minutes et quelques de Rachid Nekkaz, petit candidat indépendant, on ne peut s'empêcher de se demander : où ",est," Frédéric Nihous, candidat de Chasse pêche nature et tradition ?",27.0,est,être,VERB,VERB,Mood=Ind|Number=Sing|Person=3|Tense=Pres|VerbForm=Fin,21.0,advcl,21:advcl,_,1.0
227906,859637,Les historiens savent qu'une partie non négligeable de la responsabilité du sous-développement dans lequel nous ,sommes, est du à une mauvaise utilisation des concepts de halal et de haram.,17.0,sommes,être,VERB,VERB,Mood=Ind|Number=Plur|Person=1|Tense=Pres|VerbForm=Fin,13.0,acl:relcl,13:acl:relcl,_,1.0
229534,865728,"Si le Bulex n'a jamais disparu, c'",est, aussi que les soirées ne sont qu'un pan de ses activités.,10.0,est,être,VERB,VERB,Mood=Ind|Number=Sing|Person=3|Tense=Pres|VerbForm=Fin,19.0,cop,19:cop,_,1.0
229606,865935,"Ne vous concentrez pas sur l'image, elle n'",est, là que pour matérialiser l'interrogation.,11.0,est,être,VERB,VERB,Mood=Ind|Number=Sing|Person=3|Tense=Pres|VerbForm=Fin,3.0,advcl,3:advcl,_,1.0
229631,866022,"Ces """"étoiles filantes"""", qui n'en ",sont," donc pas, semblent provenir d'une même direction du ciel (le radiant), un peu comme lorsqu'on est dans un tunnel rectiligne et que l'on a l'impression que les bords de celui-ci convergent vers un même point.",10.0,sont,être,VERB,VERB,Mood=Ind|Number=Plur|Person=3|Tense=Pres|VerbForm=Fin,14.0,nsubj,14:nsubj,_,1.0
229737,866383,La question posé par cette demande d'arbitrage ,est," donc: cette façon """"détournée"""" de provoquer certaines réactions en utilisant les PàS est-elle acceptable ou non?",9.0,est,être,VERB,VERB,Mood=Ind|Number=Sing|Person=3|Tense=Pres|VerbForm=Fin,0.0,root,0:root,_,1.0
231070,871222,"S'il est admis que le scientisme et le communisme font reposer leurs théories sur l'athéisme, il n'en ",est, pas de même pour le nazisme.,3.0,est,être,AUX,AUX,Mood=Ind|Number=Sing|Person=3|Tense=Pres|VerbForm=Fin,4.0,aux:pass,4:aux:pass,_,1.0
231297,872049,On s'attend donc à l'existence d'orbites circulaires possibles quel que ,soit," le nombre quantique principal, mais aussi à celle d'orbites elliptiques.",14.0,soit,être,VERB,VERB,Mood=Ind|Number=Sing|Person=3|Tense=Pres|VerbForm=Fin,13.0,fixed,13:fixed,_,2.0
231713,873542,"Au-dessus de la vieille ville, la chapelle russe du cimetière, une petite merveille d'architecture construite par Touranoff, ne tient presque plus debout, il en ",est, de même d'un certain nombre de grands tombeaux de famille.,32.0,est,être,VERB,VERB,Mood=Ind|Number=Sing|Person=3|Tense=Pres|VerbForm=Fin,25.0,advcl,25:advcl,_,1.0
231841,874054,"Vous avez fait la preuve saison après saison, en vous soumettant en aussi grand nombre au supplice des débats, que vous n'",étiez, ni cyniques ni dépolitisés.,25.0,étiez,être,VERB,VERB,Mood=Ind|Number=Plur|Person=2|Tense=Imp|VerbForm=Fin,12.0,ccomp,12:ccomp,_,1.0
231866,874157,La question ,est, : qui détermine quelles actions sont favorables ou défavorables ?,3.0,est,être,VERB,VERB,Mood=Ind|Number=Sing|Person=3|Tense=Pres|VerbForm=Fin,0.0,root,0:root,_,1.0
232050,874811,"C'est ce que tente actuellement l'Italie, mais les observateurs avertis émettent les plus grandes réserves quant aux résultats, et force ",est, de constater que l'on n'observe guère de frémissement significatif.,2.0,est,être,AUX,AUX,Mood=Ind|Number=Sing|Person=3|Tense=Pres|VerbForm=Fin,3.0,cop,3:cop,_,2.0
