sent_id,left_context,pivot,right_context,ID,FORM,LEMMA,UPOS,XPOS,FEATS,HEAD,DEPREL,DEPS,MISC,dist
ParisStories_2022_18_mocheMaisMignonne__13,"du coup, bah, on est tous ",allé, se coucher. ,10,allé,aller,VERB,_,Gender=Masc|Number=Sing|Tense=Past|VerbForm=Part,0,root,_,AlignBegin=36712|AlignEnd=36890,-1
ParisStories_2022_18_mocheMaisMignonne__14,"et après, donc le lendemain, on est allé la ",voir, à l'hôpital. ,12,voir,voir,VERB,_,VerbForm=Inf,10,xcomp,_,AlignBegin=39759|AlignEnd=39949|Subject=SubjRaising,1
ParisStories_2022_18_mocheMaisMignonne__14,"et après, donc le lendemain, on est ",allé, la voir à l'hôpital. ,10,allé,aller,VERB,_,Gender=Masc|Number=Sing|Tense=Past|VerbForm=Part,0,root,_,AlignBegin=39377|AlignEnd=39568,1
ParisStories_2022_18_mocheMaisMignonne__15,je me ,souviens, pas vraiment du jour. ,3,souviens,souvenir,VERB,_,Mood=Ind|Number=Sing|Person=1|Tense=Pres|VerbForm=Fin,0,root,_,AlignBegin=40892|AlignEnd=41173,-1
ParisStories_2022_18_mocheMaisMignonne__23,elle ,était," dans son, tu sais, c'est pas des landaus, c'est les trucs dans les hôpitaux là, je crois que c'est en verre. ",2,était,être,VERB,_,Mood=Ind|Number=Sing|Person=3|Tense=Imp|VerbForm=Fin,18,reparandum,_,AlignBegin=55888|AlignEnd=56140,-1
ParisStories_2022_18_mocheMaisMignonne__26,mais ils les ,mettent, dedans. ,4,mettent,mettre,VERB,_,Mood=Ind|Number=Plur|Person=3|Tense=Pres|VerbForm=Fin,0,root,_,AlignBegin=63271|AlignEnd=63478,-1
ParisStories_2022_18_mocheMaisMignonne__27,"elle était dedans avec ses, avec ses cheveux, là, qui ",sortaient," de partout, et avec ses petites peluches. ",14,sortaient,sortir,VERB,_,Mood=Ind|Number=Plur|Person=3|Tense=Imp|VerbForm=Fin,9,acl:relcl,_,AlignBegin=65775|AlignEnd=66004,1
ParisStories_2022_18_mocheMaisMignonne__27,elle ,était," dedans avec ses, avec ses cheveux, là, qui sortaient de partout, et avec ses petites peluches. ",2,était,être,VERB,_,Mood=Ind|Number=Sing|Person=3|Tense=Imp|VerbForm=Fin,0,root,_,AlignBegin=63916|AlignEnd=64145,-1
ParisStories_2022_18_mocheMaisMignonne__28,et je l'ai ,prise, dans mes bras. ,5,prise,prendre,VERB,_,Gender=Fem|Number=Sing|Tense=Past|VerbForm=Part,0,root,_,AlignBegin=68609|AlignEnd=68815,-1
ParisStories_2022_18_mocheMaisMignonne__33,je la ,rencontrais, pour la première fois. ,3,rencontrais,rencontrer,VERB,_,Mood=Cnd|Number=Sing|Person=1|Tense=Pres|VerbForm=Fin,0,root,_,AlignBegin=75852|AlignEnd=76241,-1
ParisStories_2022_18_mocheMaisMignonne__35,"mais du coup, il y avait aussi mon oncle et ma tante, vu qu'ils m'avaient emmenée, vu que j'avais ",dormi, chez eux la veille. ,27,dormi,dormir,VERB,_,Gender=Masc|Number=Sing|Tense=Past|VerbForm=Part,23,ccomp,_,AlignBegin=86715|AlignEnd=86883,1
ParisStories_2022_18_mocheMaisMignonne__35,"mais du coup, il y avait aussi mon oncle et ma tante, vu qu'ils m'avaient emmenée, vu que j'avais ",dormi, chez eux la veille. ,27,dormi,dormir,VERB,_,Gender=Masc|Number=Sing|Tense=Past|VerbForm=Part,23,ccomp,_,AlignBegin=86715|AlignEnd=86883,1
ParisStories_2022_18_mocheMaisMignonne__37,"enfin, je crois ils avaient pris un, un chariot vide ou, je sais pas, tu sais, le truc là où on ",met, les bébés. ,27,met,mettre,VERB,_,Mood=Ind|Number=Sing|Person=3|Tense=Pres|VerbForm=Fin,24,acl:relcl,_,AlignBegin=94200|AlignEnd=94328,1
ParisStories_2022_18_mocheMaisMignonne__38,et ils avaient ,courru," avec, dans le couloir. ",4,courru,courrir,VERB,_,Gender=Masc|Number=Sing|Tense=Past|VerbForm=Part,0,root,_,AlignBegin=95177|AlignEnd=95374,-1
ParisStories_2022_18_mocheMaisMignonne__40,"mais ouais, ils avaient ",foutu, un peu le bazar. ,6,foutu,foutu,VERB,_,Gender=Masc|Number=Sing|Tense=Past|VerbForm=Part,0,root,_,AlignBegin=99400|AlignEnd=99606,-1
ParisStories_2022_18_mocheMaisMignonne__41,"je me souviens, j'étais jalouse aussi, parce que mon cousin, donc qui a mon âge, il a ",pris, ma sœur dans ses bras. ,23,pris,prendre,VERB,_,Gender=Masc|Tense=Past|VerbForm=Part,7,advcl,_,AlignBegin=104912|AlignEnd=105087,1
ParisStories_2022_18_mocheMaisMignonne__43,mais je crois que je m'en ,souviens," à moitié, avec les photos, parce que, ça fait longtemps. ",8,souviens,souvenir,VERB,_,Mood=Ind|Number=Sing|Person=1|Tense=Pres|VerbForm=Fin,3,ccomp,_,AlignBegin=111922|AlignEnd=112124,-1
ParisStories_2022_18_mocheMaisMignonne__43,mais je crois que je m'en ,souviens," à moitié, avec les photos, parce que, ça fait longtemps. ",8,souviens,souvenir,VERB,_,Mood=Ind|Number=Sing|Person=1|Tense=Pres|VerbForm=Fin,3,ccomp,_,AlignBegin=111922|AlignEnd=112124,-1
ParisStories_2022_18_mocheMaisMignonne__46,je sais qu'on l'a ,ramenée, à la maison. ,7,ramenée,ramener,VERB,_,Gender=Fem|Number=Sing|Tense=Past|VerbForm=Part,2,ccomp,_,AlignBegin=120116|AlignEnd=120268,-1
ParisStories_2022_15_onEnParleAPersonne__1,"parce que, je me souviens, que tu étais ",sorti,", un peu avant moi, genre, peut-être dix minutes, ou, une demi-heure, je sais plus. ",11,sorti,sortir,VERB,_,Gender=Masc|Number=Sing|Tense=Past|VerbForm=Part,6,ccomp,_,AlignBegin=2849|AlignEnd=3140|SpaceAfter=No,-1
ParisStories_2022_15_onEnParleAPersonne__1,"parce que, je me souviens, que tu étais ",sorti,", un peu avant moi, genre, peut-être dix minutes, ou, une demi-heure, je sais plus. ",11,sorti,sortir,VERB,_,Gender=Masc|Number=Sing|Tense=Past|VerbForm=Part,6,ccomp,_,AlignBegin=2849|AlignEnd=3140|SpaceAfter=No,-1
ParisStories_2022_15_onEnParleAPersonne__2,"enfin, je sais que tu étais ",sorti, avant moi. ,8,sorti,sortir,VERB,_,Gender=Masc|Number=Sing|Tense=Past|VerbForm=Part,4,ccomp,_,AlignBegin=7973|AlignEnd=8255,-1
ParisStories_2022_15_onEnParleAPersonne__3,et je sais que je t'ai ,vu," à la porte, euh, sur le côté à droite. ",8,vu,voir,VERB,_,Gender=Masc|Number=Sing|Tense=Past|VerbForm=Part,3,ccomp,_,AlignBegin=10059|AlignEnd=10236,-1
ParisStories_2022_15_onEnParleAPersonne__5,et j'ai fais exprès de ,sortir," par devant, pour faire genre que je t'avais pas vu, en mode je te cherche et tout. ",7,sortir,sortir,VERB,_,VerbForm=Inf,5,xcomp,_,AlignBegin=15156|AlignEnd=15381|Subject=SubjRaising,-1
ParisStories_2022_15_onEnParleAPersonne__6,je me souviens d'avoir ,fait," un truc con comme ça, je sais pas pourquoi. ",6,fait,faire,VERB,_,Gender=Masc|Mood=Ind|Number=Sing|Person=3|Tense=Pres|VerbForm=Fin,3,xcomp,_,AlignBegin=20375|AlignEnd=20547,-1
ParisStories_2022_15_onEnParleAPersonne__7,juste parce que j'avais peur d',aller," juste droit vers toi, en fait. ",8,aller,aller,VERB,_,VerbForm=Inf,6,xcomp,_,AlignBegin=24247|AlignEnd=24499|Subject=SubjRaising,1
ParisStories_2022_15_onEnParleAPersonne__14,"on a parlé de, euh, on a pas ",parlé," d'Overwatch, à ce moment-là. ",3,parlé,parler,VERB,_,Gender=Masc|Number=Sing|Tense=Past|VerbForm=Part,11,reparandum,_,AlignBegin=37551|AlignEnd=37918,-1
ParisStories_2022_15_onEnParleAPersonne__14,"on a parlé de, euh, on a pas ",parlé," d'Overwatch, à ce moment-là. ",3,parlé,parler,VERB,_,Gender=Masc|Number=Sing|Tense=Past|VerbForm=Part,11,reparandum,_,AlignBegin=37551|AlignEnd=37918,-1
ParisStories_2022_15_onEnParleAPersonne__14,on a ,parlé," de, euh, on a pas parlé d'Overwatch, à ce moment-là. ",3,parlé,parler,VERB,_,Gender=Masc|Number=Sing|Tense=Past|VerbForm=Part,11,reparandum,_,AlignBegin=37551|AlignEnd=37918,-1
ParisStories_2022_15_onEnParleAPersonne__19,"je me souviens que euh, je m'étais ",préparée,", genre, peut-être cinq heures à l'avance au moins. ",10,préparée,préparer,VERB,_,Gender=Masc|Number=Sing|Tense=Past|VerbForm=Part,3,ccomp,_,AlignBegin=50841|AlignEnd=51138|SpaceAfter=No,3
ParisStories_2022_15_onEnParleAPersonne__20,et j'avais fais exprès de ,rentrer, le plus vite possible. ,7,rentrer,rentrer,VERB,_,VerbForm=Inf,5,xcomp,_,AlignBegin=56008|AlignEnd=56252|Subject=SubjRaising,-1
ParisStories_2022_15_onEnParleAPersonne__21,"et, j'avais déjà tout ",préparé,", le matin. ",7,préparé,préparer,VERB,_,Gender=Masc|Number=Sing|Tense=Past|VerbForm=Part,0,root,_,AlignBegin=58476|AlignEnd=58726|SpaceAfter=No,-1
ParisStories_2022_15_onEnParleAPersonne__24,j'ai ,repris," une douche dès que je suis rentrée, en mode vite vite vite. ",3,repris,reprendre,VERB,_,Gender=Masc|Number=Sing|Tense=Past|VerbForm=Part,0,root,_,AlignBegin=64284|AlignEnd=64430,-1
ParisStories_2022_15_onEnParleAPersonne__25,"et je me souviens que j'étais montée au grenier, parce que toutes mes affaires étaient au grenier à ce moment-là, quand j'",étais, chez ma grand-mère. ,7,étais,être,AUX,_,Mood=Ind|Number=Sing|Person=1|Tense=Imp|VerbForm=Fin,8,aux:tense,_,AlignBegin=68308|AlignEnd=68473,1
ParisStories_2022_15_onEnParleAPersonne__25,"et je me souviens que j'étais montée au grenier, parce que toutes mes affaires ",étaient," au grenier à ce moment-là, quand j'étais chez ma grand-mère. ",18,étaient,être,VERB,_,Mood=Ind|Number=Plur|Person=3|Tense=Imp|VerbForm=Fin,8,advcl,_,AlignBegin=69823|AlignEnd=69997,1
ParisStories_2022_15_onEnParleAPersonne__25,"et je me souviens que j'étais montée au grenier, parce que toutes mes affaires ",étaient," au grenier à ce moment-là, quand j'étais chez ma grand-mère. ",18,étaient,être,VERB,_,Mood=Ind|Number=Plur|Person=3|Tense=Imp|VerbForm=Fin,8,advcl,_,AlignBegin=69823|AlignEnd=69997,1
ParisStories_2022_15_onEnParleAPersonne__25,et je me souviens que j'étais ,montée," au grenier, parce que toutes mes affaires étaient au grenier à ce moment-là, quand j'étais chez ma grand-mère. ",8,montée,monter,VERB,_,Gender=Fem|Number=Sing|Tense=Past|VerbForm=Part,4,ccomp,_,AlignBegin=68473|AlignEnd=68639,-1
ParisStories_2022_15_onEnParleAPersonne__26,et j'étais ,montée, au grenier. ,4,montée,monter,VERB,_,Gender=Fem|Number=Sing|Tense=Past|VerbForm=Part,0,root,_,AlignBegin=73022|AlignEnd=73208,-1
ParisStories_2022_15_onEnParleAPersonne__32,et au final je me suis ,retrouvée, avec le d~ … ,8,retrouvée,retrouver,VERB,_,Gender=Fem|Number=Sing|Tense=Past|VerbForm=Part,0,root,_,AlignBegin=86158|AlignEnd=86306,-1
ParisStories_2022_15_onEnParleAPersonne__32,et au final je me suis ,retrouvée, avec le d~ … ,8,retrouvée,retrouver,VERB,_,Gender=Fem|Number=Sing|Tense=Past|VerbForm=Part,0,root,_,AlignBegin=86158|AlignEnd=86306,-1
ParisStories_2022_15_onEnParleAPersonne__38,"je me souviens, j'ai fait en sorte de ",parler, de toi. ,11,parler,parler,VERB,_,VerbForm=Inf,9,acl,_,AlignBegin=101861|AlignEnd=102120|Subject=SubjRaising,1
ParisStories_2022_15_onEnParleAPersonne__38,"je me souviens, j'ai ",fait, en sorte de parler de toi. ,7,fait,faire,VERB,_,Gender=Masc|Mood=Ind|Number=Sing|Person=3|Tense=Pres|VerbForm=Fin,0,root,_,AlignBegin=100821|AlignEnd=101081,-1
ParisStories_2022_15_onEnParleAPersonne__39,"s~, sauf que, du coup, ça va pas du tout avec le on en parle à personne, hein qu'on ",disait, au début. ,27,disait,dire,VERB,_,Mood=Ind|Number=Sing|Person=3|Tense=Imp|VerbForm=Fin,20,acl:relcl,_,AlignBegin=106917|AlignEnd=107188,0
ParisStories_2022_15_onEnParleAPersonne__39,"s~, sauf que, du coup, ça va pas du tout avec le on en ",parle," à personne, hein qu'on disait au début. ",20,parle,parler,VERB,_,Mood=Ind|Number=Sing|Person=3|Tense=Pres|VerbForm=Fin,11,dep,_,AlignBegin=105588|AlignEnd=105851|Reported=Yes,0
ParisStories_2022_15_onEnParleAPersonne__42,"mh, on, je sais plus comment, on avait décidé qu'on ",disait, pas encore tout de suite. ,15,disait,dire,VERB,_,Mood=Ind|Number=Sing|Person=3|Tense=Imp|VerbForm=Fin,12,ccomp,_,AlignBegin=113496|AlignEnd=113754,-1
ParisStories_2022_15_onEnParleAPersonne__43,"franchement, je savais déjà que je l'avais déjà ",dit, à quelqu'un. ,11,dit,dire,VERB,_,Mood=Ind|Number=Sing|Person=3|Tense=Pres|VerbForm=Fin,4,ccomp,_,AlignBegin=119215|AlignEnd=119679,-1
ParisStories_2022_15_onEnParleAPersonne__46,"genre, j'",étais, au bout de la rue. ,4,étais,être,VERB,_,Mood=Ind|Number=Sing|Person=1|Tense=Imp|VerbForm=Fin,0,root,_,AlignBegin=124270|AlignEnd=124444,0
ParisStories_2022_15_onEnParleAPersonne__50,on ,arrive, dans le village. ,2,arrive,arriver,VERB,_,Mood=Ind|Number=Sing|Person=3|Tense=Pres|VerbForm=Fin,0,root,_,AlignBegin=133481|AlignEnd=133712,-1
ParisStories_2019_cuisineApproximative_3,"genre souvent j'ai plus l'habitude de, de pas trop suivre les proportions, de regarder en gros et tout, donc souvent je ",fous," de l'eau dans la casserole, et souvent trop. ",27,fous,fou,VERB,_,Mood=Ind|Number=Sing|Person=1|Tense=Pres|VerbForm=Fin,4,conj,_,_,0
ParisStories_2019_cuisineApproximative_3,"genre souvent j'ai plus l'habitude de, de pas trop suivre les proportions, de ",regarder," en gros et tout, donc souvent je fous de l'eau dans la casserole, et souvent trop. ",18,regarder,regarder,VERB,_,VerbForm=Inf,7,acl,_,Subject=SubjRaising,0
ParisStories_2019_cuisineApproximative_5,"et en gros euh, ensuite, ensuite, tu ",mets," le beurre, genre des morceaux de beurre, ",11,mets,mettre,VERB,_,Mood=Ind|Number=Sing|Person=2|Tense=Pres|VerbForm=Fin,0,root,_,_,-1
ParisStories_2019_cuisineApproximative_6,et là j'ai ,regardé, la recette pour une fois du coup quand je t'en ai fait aujourd'hui. ,5,regardé,regarder,VERB,_,Gender=Masc|Number=Sing|Tense=Past|VerbForm=Part,0,root,_,_,-1
ParisStories_2019_cuisineApproximative_13,"euh, l'eau s'évapore et donc ça permet que, euh, en fait, la pâte se ",détache," des bords de la casserole parce que l'eau est évaporée, ",21,détache,détacher,VERB,_,Mood=Ind|Number=Sing|Person=3|Tense=Pres|VerbForm=Fin,10,ccomp,_,_,3
ParisStories_2019_cuisineApproximative_14,et du coup tu ,finis, avec une vraie boule de pâte. ,6,finis,finir,VERB,_,Mood=Ind|Number=Sing|Person=2|Tense=Pres|VerbForm=Fin,0,root,_,_,1
ParisStories_2019_cuisineApproximative_23,"là je rajoute le fr~, fromage et tout, et euh, non non non bah je je l'",enlève," du feu en fait, dès que, dès que le beurre est fondu. ",21,enlève,enlever,VERB,_,Mood=Ind|Number=Sing|Person=1|Tense=Pres|VerbForm=Fin,0,root,_,_,3
ParisStories_2019_cuisineApproximative_24,"en fait, quand tu ",mets, la farine à le final ça se décolle. ,6,mets,mettre,VERB,_,Mood=Ind|Number=Sing|Person=2|Tense=Pres|VerbForm=Fin,14,advcl,_,_,1
ParisStories_2019_cuisineApproximative_28,"mais du coup après tu le retires du feu une fois que, une fois que c'est, XXX enfin une fois qu~ une fois que le beurre a fondu et que la la farine a été mise et que ça s'est bien ",décollé, de la casserole. ,48,décollé,décoller,VERB,_,Gender=Masc|Number=Sing|Tense=Past|VerbForm=Part,33,conj,_,_,1
ParisStories_2019_cuisineApproximative_28,mais du coup après tu le ,retires," du feu une fois que, une fois que c'est, XXX enfin une fois qu~ une fois que le beurre a fondu et que la la farine a été mise et que ça s'est bien décollé de la casserole. ",8,retires,retirer,VERB,_,Mood=Ind|Number=Sing|Person=2|Tense=Pres|VerbForm=Fin,0,root,_,_,1
ParisStories_2019_devoirPhilosophie_2,le sujet c'était peut-on se ,mettre, à la place d'autrui ? ,7,mettre,mettre,VERB,_,VerbForm=Inf,5,xcomp,_,Subject=SubjRaising,1
ParisStories_2019_devoirPhilosophie_5,"mais bon, le prof nous avait quand même euh, ",initiés," à la dissertation, en nous expliquant euh, ce qu'était la thèse, l'antithèse et la synthèse. ",12,initiés,initier,VERB,_,Gender=Masc|Number=Plur|Tense=Past|VerbForm=Part,0,root,_,_,1
ParisStories_2019_devoirPhilosophie_6,"nous avait dit aussi d'utiliser des euh, arguments hum, plutôt atypiques pas toujours euh, ceux du cours, et d'utiliser aussi euh, des exemples et des citations d'auteurs, et de savoir les expliquer et de pas les ",balancer, que dans le vent comme ça. ,47,balancer,balancer,VERB,_,VerbForm=Inf,6,conj,_,Subject=OblRaising,3
ParisStories_2019_devoirPhilosophie_7,du coup je m'étais ,penchée, un peu sur mon devoir ,7,penchée,pencher,VERB,_,Gender=Fem|Number=Sing|Tense=Past|VerbForm=Part,0,root,_,_,-1
ParisStories_2019_devoirPhilosophie_9,donc je l'ai ,laissé," un peu de côté tu vois, quelques jours. ",5,laissé,laisser,VERB,_,Gender=Masc|Number=Sing|Tense=Past|VerbForm=Part,0,root,_,_,-1
ParisStories_2019_devoirPhilosophie_9,donc je l'ai ,laissé," un peu de côté tu vois, quelques jours. ",5,laissé,laisser,VERB,_,Gender=Masc|Number=Sing|Tense=Past|VerbForm=Part,0,root,_,_,-1
ParisStories_2019_devoirPhilosophie_10,et ensuite je suis ,revenue," dessus~fin, pas tout de suite. ",5,revenue,revenir,VERB,_,Gender=Fem|Number=Sing|Person=1|Tense=Past|VerbForm=Part,0,root,_,_,-1
ParisStories_2019_devoirPhilosophie_11,"en fait, un jour, j'",ai," euh, j'entends, j'écoutais pardon la radio. ",8,ai,avoir,VERB,_,Mood=Ind|Number=Sing|Person=1|Tense=Pres|VerbForm=Fin,15,reparandum,_,_,1
ParisStories_2019_devoirPhilosophie_13,"et euh, j'écoutais le témoignage d'une euh bonne sœur, sœur Marie-Paul Ross qui ",était," en train de présenter euh, son livre. ",18,était,être,VERB,_,Mood=Ind|Number=Sing|Person=3|Tense=Imp|VerbForm=Fin,14,acl:relcl,_,_,1
ParisStories_2019_devoirPhilosophie_14,je voudrais vous ,parler," d'amour, et de sexe. ",4,parler,parler,VERB,_,VerbForm=Inf,2,xcomp,_,Subject=SubjRaising,-1
ParisStories_2019_devoirPhilosophie_16,"c'est ça en fait le, le truc qui m'a interpellé, c'est que en gros euh, elle est ",devenue, sexologue. ,24,devenue,devenir,VERB,_,Gender=Fem|Number=Sing|Tense=Past|VerbForm=Part,16,ccomp,_,_,1
ParisStories_2019_devoirPhilosophie_19,"tu vois, d'un côté, elle a ",fait, vœu de chasteté. ,10,fait,faire,VERB,_,Gender=Masc|Number=Sing|Tense=Past|VerbForm=Part,0,root,_,_,0
ParisStories_2019_devoirPhilosophie_20,"et d'un autre côté, elle veut euh, ",donner," des conseils euh, à ses patients euh, sur le sexe. ",11,donner,donner,VERB,_,VerbForm=Inf,8,xcomp,_,Subject=SubjRaising,1
ParisStories_2019_devoirPhilosophie_20,"et d'un autre côté, elle ",veut," euh, donner des conseils euh, à ses patients euh, sur le sexe. ",8,veut,vouloir,VERB,_,Mood=Ind|Number=Sing|Person=3|Tense=Pres|VerbForm=Fin,0,root,_,_,1
ParisStories_2019_devoirPhilosophie_21,"donc pour moi, je me suis ",dit,", ça va pas ensemble, ",8,dit,dire,VERB,_,Gender=Masc|Number=Sing|Tense=Past|VerbForm=Part,0,root,_,SpaceAfter=No,-1
ParisStories_2019_devoirPhilosophie_23,"et euh en gros, elle ",expliquait," euh, comment est venue euh, sa vocation euh, pour devenir sexologue. ",7,expliquait,expliquer,VERB,_,Mood=Ind|Number=Sing|Person=3|Tense=Imp|VerbForm=Fin,0,root,_,_,-1
ParisStories_2019_devoirPhilosophie_25,"elle expliquait qu'elle est, qu'elle a eu vraiment un choc culturel, et euh qu'elle a était ",confrontée, à beaucoup de violences sexuelles. ,22,confrontée,confronter,VERB,_,Gender=Fem|Number=Sing|Tense=Past|VerbForm=Part,10,conj,_,_,2
ParisStories_2019_devoirPhilosophie_26,"notamment euh, chez les jeunes générations, donc en gros chez les jeunes, et euh qu'ils ne ",savaient," pas euh, se respecter, et ils n'avaient aucune éducation sexuelle. ",21,savaient,savoir,VERB,_,Mood=Ind|Number=Plur|Person=3|Tense=Imp|VerbForm=Fin,0,root,_,_,2
ParisStories_2019_devoirPhilosophie_27,"du coup euh, comme elle était, quand même, ",confrontée," à beaucoup de violences sexuelles, elle s'est dit ben, pour les aider, je vais leur donner des cours d'éducation sexuelle, pour euh, justement euh, essayer de changer leurs comportements et leur vision quoi. ",13,confrontée,confronter,VERB,_,Gender=Fem|Number=Sing|Tense=Past|VerbForm=Part,23,advcl,_,_,1
ParisStories_2019_devoirPhilosophie_30,"si tu veux il y avait des filles qui se faisaient euh, ",avorter," euh, comme ça, tu vois, sans leur consentement. ",14,avorter,avorter,VERB,_,VerbForm=Inf,11,xcomp,_,Subject=SubjRaising,1
ParisStories_2019_devoirPhilosophie_30,"si tu veux il y avait des filles qui se faisaient euh, ",avorter," euh, comme ça, tu vois, sans leur consentement. ",14,avorter,avorter,VERB,_,VerbForm=Inf,11,xcomp,_,Subject=SubjRaising,1
ParisStories_2019_devoirPhilosophie_34,"parce que, du coup, cette femme, euh finalement, elle doit faire preuve d'empathie, pour pouvoir ",donner," des conseils en matière de sexe, à ses patients, puisque, en gros, elle elle a fait vœu de chasteté, elle est religieuse. ",23,donner,donner,VERB,_,VerbForm=Inf,22,xcomp,_,Subject=SubjRaising,4
ParisStories_2019_devoirPhilosophie_35,"elle a un engagement religieux, mais en même temps, elle doit faire preuve d'empathie, pour pouvoir, justement, ",donner," des conseils à ses patients, en matière de sexe. ",24,donner,donner,VERB,_,VerbForm=Inf,20,xcomp,_,Subject=SubjRaising,1
ParisStories_2019_devoirPhilosophie_35,"elle a un engagement religieux, mais en même temps, elle ",doit," faire preuve d'empathie, pour pouvoir, justement, donner des conseils à ses patients, en matière de sexe. ",13,doit,devoir,VERB,_,Mood=Ind|Number=Sing|Person=3|Tense=Pres|VerbForm=Fin,2,conj,_,_,1
ParisStories_2019_peripitiesVoiture_2,donc euh j'ai ,fait, la conduite accompagnée à le lycée. ,5,fait,faire,VERB,_,Gender=Masc|Number=Sing|Tense=Past|VerbForm=Part,0,root,_,_,-1
ParisStories_2019_peripitiesVoiture_3,donc avant ça il ,fallait," que je passe le code et tout, ",5,fallait,falloir,VERB,_,Mood=Ind|Number=Sing|Person=3|Tense=Imp|VerbForm=Fin,0,root,_,_,-1
ParisStories_2019_peripitiesVoiture_5,"après ces leçons de conduite euh, j'ai pu me ",lancer," dans la conduite accompagnée avec ma mère, ",12,lancer,lancer,VERB,_,VerbForm=Inf,10,xcomp,_,Subject=SubjRaising,1
ParisStories_2019_peripitiesVoiture_5,"après ces leçons de conduite euh, j'ai pu me ",lancer," dans la conduite accompagnée avec ma mère, ",12,lancer,lancer,VERB,_,VerbForm=Inf,10,xcomp,_,Subject=SubjRaising,1
ParisStories_2019_peripitiesVoiture_5,"après ces leçons de conduite euh, j'ai ",pu," me lancer dans la conduite accompagnée avec ma mère, ",10,pu,pouvoir,VERB,_,Gender=Masc|Number=Sing|Tense=Past|VerbForm=Part,0,root,_,_,1
ParisStories_2019_peripitiesVoiture_7,donc c',était, sur un an je devais faire la conduite accompagnée. ,3,était,être,VERB,_,Mood=Ind|Number=Sing|Person=3|Tense=Imp|VerbForm=Fin,8,advcl,_,_,1
ParisStories_2019_peripitiesVoiture_10,"euh on a fait beaucoup de trajets, on est partie en vacances, on est allée chez mes tantes qui ",habitent, euh sur Paris. ,22,habitent,habiter,VERB,_,Mood=Ind|Number=Plur|Person=3|Tense=Pres|VerbForm=Fin,20,acl:relcl,_,_,3
ParisStories_2019_peripitiesVoiture_10,"euh on a fait beaucoup de trajets, on est partie en vacances, on est ",allée, chez mes tantes qui habitent euh sur Paris. ,17,allée,aller,VERB,_,Gender=Fem|Number=Sing|Tense=Past|VerbForm=Part,11,conj,_,_,6
ParisStories_2019_peripitiesVoiture_10,"euh on a fait beaucoup de trajets, on est ",partie," en vacances, on est allée chez mes tantes qui habitent euh sur Paris. ",11,partie,partir,VERB,_,Gender=Fem|Number=Sing|Tense=Past|VerbForm=Part,4,appos,_,_,6
ParisStories_2019_peripitiesVoiture_11,donc euh il fallait ,passer," par le périph euh, ",5,passer,passer,VERB,_,VerbForm=Inf,4,xcomp,_,Subject=SubjRaising,-1
ParisStories_2019_peripitiesVoiture_12,"XXX j'ai vraiment eu des bonnes expériences pour euh m'aider à apprendre à conduire, parce que on ",apprend, avec l'expérience. ,21,apprend,apprendre,VERB,_,Mood=Ind|Number=Sing|Person=3|Tense=Pres|VerbForm=Fin,5,advcl,_,_,1
ParisStories_2019_peripitiesVoiture_15,mais avant ça euh ils m'ont ,redonné," quelques heures de conduite, pour vérifier que j'avais pas perdu. ",8,redonné,redonner,VERB,_,Gender=Masc|Number=Sing|Tense=Past|VerbForm=Part,0,root,_,_,-1
ParisStories_2019_peripitiesVoiture_16,je me souviens même euh l'heure de conduite que j'ai ,eu," la veille de passer mon permis, ",13,eu,avoir,VERB,_,Gender=Masc|Number=Sing|Tense=Past|VerbForm=Part,7,acl:relcl,_,_,1
ParisStories_2019_peripitiesVoiture_16,je me ,souviens," même euh l'heure de conduite que j'ai eu la veille de passer mon permis, ",3,souviens,souvenir,VERB,_,Mood=Ind|Number=Sing|Person=1|Tense=Pres|VerbForm=Fin,0,root,_,_,-1
ParisStories_2019_peripitiesVoiture_17,"je me suis mise euh sur la voie de gauche, alors que je devais pas de le tout me ",mettre, sur cette voie. ,21,mettre,mettre,VERB,_,VerbForm=Inf,15,xcomp,_,Subject=SubjRaising,1
ParisStories_2019_peripitiesVoiture_17,je me suis ,mise," euh sur la voie de gauche, alors que je devais pas de le tout me mettre sur cette voie. ",4,mise,mettre,VERB,_,Gender=Fem|Number=Sing|Tense=Past|VerbForm=Part,0,root,_,_,-1
ParisStories_2019_peripitiesVoiture_18,c'est parce que je pensais que le stop il s',étalait," sur tout le long de la route, mais, en fait, pas de le tout. ",12,étalait,étaler,VERB,_,Mood=Ind|Number=Sing|Person=3|Tense=Imp|VerbForm=Fin,6,ccomp,_,_,-1
ParisStories_2019_peripitiesVoiture_21,le lendemain donc je ,passais, mon permis. ,5,passais,passer,VERB,_,Mood=Ind|Number=Sing|Person=1|Tense=Imp|VerbForm=Fin,0,root,_,_,1
ParisStories_2019_peripitiesVoiture_22,j'ai eu très peur parce que euh le même jour de que mon permis j',avais," un examen, un contrôle de l'espagnol, ",17,avais,avoir,VERB,_,Mood=Ind|Number=Sing|Person=1|Tense=Imp|VerbForm=Fin,3,advcl,_,_,1
ParisStories_2019_peripitiesVoiture_24,le matin j'avais ,eu, mon partiel d'espagnol. ,5,eu,avoir,VERB,_,Gender=Masc|Number=Sing|Tense=Past|VerbForm=Part,0,root,_,_,1
ParisStories_2019_peripitiesVoiture_25,"et, en fait, euh vu que j'habite sur euh la... enfin, dans le sud de Seine et Marne, j'ai dû me déplacer sur Paris le matin, prendre le train et tout, et ",remonter, après mon partiel. ,42,remonter,remonter,VERB,_,VerbForm=Inf,29,conj,_,Subject=SubjRaising,1
ParisStories_2019_peripitiesVoiture_25,"et, en fait, euh vu que j'habite sur euh la... enfin, dans le sud de Seine et Marne, j'ai dû me ",déplacer," sur Paris le matin, prendre le train et tout, et remonter après mon partiel. ",29,déplacer,déplacer,VERB,_,VerbForm=Inf,27,xcomp,_,Subject=SubjRaising,1
ParisStories_2019_peripitiesVoiture_25,"et, en fait, euh vu que j'habite sur euh la... enfin, dans le sud de Seine et Marne, j'ai dû me ",déplacer," sur Paris le matin, prendre le train et tout, et remonter après mon partiel. ",29,déplacer,déplacer,VERB,_,VerbForm=Inf,27,xcomp,_,Subject=SubjRaising,1
