sent_id,left_context,pivot,right_context,ID,FORM,LEMMA,UPOS,XPOS,FEATS,HEAD,DEPREL,DEPS,MISC,dist
ParisStories_2022_13_CocktailsEtCrêpes__17,"et du coup pour rigoler, je lui avais demandé de ",venir, avec moi en réserve. ,13,venir,venir,VERB,_,VerbForm=Inf,11,xcomp,_,AlignBegin=62261|AlignEnd=62498|Subject=OblRaising,1
ParisStories_2022_13_CocktailsEtCrêpes__19,"et du coup, on est ",restées," bloquées en bas, pendant dix minutes, à peu près. ",8,restées,rester,VERB,_,Gender=Fem|Number=Plur|Tense=Past|VerbForm=Part,0,root,_,AlignBegin=69240|AlignEnd=69455,2
ParisStories_2022_13_CocktailsEtCrêpes__20,"et du coup, on a ",parlé, un petit peu de tout et de rien. ,8,parlé,parler,VERB,_,Gender=Masc|Number=Sing|Tense=Past|VerbForm=Part,0,root,_,AlignBegin=72021|AlignEnd=72190,-1
ParisStories_2022_13_CocktailsEtCrêpes__20,"et du coup, on a ",parlé, un petit peu de tout et de rien. ,8,parlé,parler,VERB,_,Gender=Masc|Number=Sing|Tense=Past|VerbForm=Part,0,root,_,AlignBegin=72021|AlignEnd=72190,-1
ParisStories_2022_13_CocktailsEtCrêpes__23,"et petit à petit, bah, on est ",devenue, amie. ,10,devenue,devenir,VERB,_,Gender=Fem|Number=Sing|Tense=Past|VerbForm=Part,0,root,_,AlignBegin=82455|AlignEnd=82684,-1
ParisStories_2022_13_CocktailsEtCrêpes__25,"à chaque fois, en fin de service, on ",allait, chez lui. ,11,allait,aller,VERB,_,Mood=Ind|Number=Sing|Person=3|Tense=Imp|VerbForm=Fin,0,root,_,AlignBegin=91446|AlignEnd=91666,-1
ParisStories_2022_13_CocktailsEtCrêpes__25,"à chaque fois, en fin de service, on ",allait, chez lui. ,11,allait,aller,VERB,_,Mood=Ind|Number=Sing|Person=3|Tense=Imp|VerbForm=Fin,0,root,_,AlignBegin=91446|AlignEnd=91666,-1
ParisStories_2022_13_CocktailsEtCrêpes__25,"à chaque fois, en fin de service, on ",allait, chez lui. ,11,allait,aller,VERB,_,Mood=Ind|Number=Sing|Person=3|Tense=Imp|VerbForm=Fin,0,root,_,AlignBegin=91446|AlignEnd=91666,-1
ParisStories_2022_13_CocktailsEtCrêpes__28,"et puis même tu vois, quand j'y repense, à ce fameux cocktail qu'elle m'a demandé, bah, elle ",faisait, un peu la même avec les crêpes. ,25,faisait,faire,VERB,_,Mood=Ind|Number=Sing|Person=3|Tense=Imp|VerbForm=Fin,0,root,_,AlignBegin=100487|AlignEnd=100621,1
ParisStories_2022_13_CocktailsEtCrêpes__28,"et puis même tu vois, quand j'y repense, à ce fameux cocktail qu'elle m'a demandé, bah, elle ",faisait, un peu la même avec les crêpes. ,25,faisait,faire,VERB,_,Mood=Ind|Number=Sing|Person=3|Tense=Imp|VerbForm=Fin,0,root,_,AlignBegin=100487|AlignEnd=100621,1
ParisStories_2022_13_CocktailsEtCrêpes__28,"et puis même tu vois, quand j'y repense, à ce fameux cocktail qu'elle m'a demandé, bah, elle ",faisait, un peu la même avec les crêpes. ,25,faisait,faire,VERB,_,Mood=Ind|Number=Sing|Person=3|Tense=Imp|VerbForm=Fin,0,root,_,AlignBegin=100487|AlignEnd=100621,1
ParisStories_2022_13_CocktailsEtCrêpes__30,"enfin, en tout cas, elle ",faisait," des mélanges, euh, qui étaient vraiment trop drôles. ",8,faisait,faire,VERB,_,Mood=Ind|Number=Sing|Person=3|Tense=Imp|VerbForm=Fin,0,root,_,AlignBegin=110662|AlignEnd=110991,4
ParisStories_2022_13_CocktailsEtCrêpes__30,"enfin, en tout cas, elle ",faisait," des mélanges, euh, qui étaient vraiment trop drôles. ",8,faisait,faire,VERB,_,Mood=Ind|Number=Sing|Person=3|Tense=Imp|VerbForm=Fin,0,root,_,AlignBegin=110662|AlignEnd=110991,4
ParisStories_2022_11_copineEnCarton__3,"donc finalement ben, euh, ça a été très compliqué entre nous, parce qu'on est quand même resté trois ans ensemble, pour euh, faire pl~, un peu ",résumé,. ,34,résumé,résumé,VERB,_,Gender=Masc|Number=Plur|Tense=Past|VerbForm=Part,21,advcl,_,AlignBegin=9167|AlignEnd=9469|SpaceAfter=No,-1
ParisStories_2022_11_copineEnCarton__3,"donc finalement ben, euh, ça a été très compliqué entre nous, parce qu'on est quand même ",resté," trois ans ensemble, pour euh, faire pl~, un peu résumé. ",21,resté,rester,VERB,_,Gender=Masc|Number=Sing|Tense=Past|VerbForm=Part,11,advcl,_,AlignBegin=6145|AlignEnd=6447,-1
ParisStories_2022_11_copineEnCarton__3,"donc finalement ben, euh, ça a été très ",compliqué," entre nous, parce qu'on est quand même resté trois ans ensemble, pour euh, faire pl~, un peu résumé. ",11,compliqué,compliquer,VERB,_,Gender=Masc|Number=Sing|Tense=Past|VerbForm=Part,0,root,_,AlignBegin=4825|AlignEnd=4971,-1
ParisStories_2022_11_copineEnCarton__4,on est ,resté," trois ans ensemble, parce qu'on s'est mis ensemble. ",3,resté,rester,VERB,_,Gender=Masc|Number=Sing|Tense=Past|VerbForm=Part,0,root,_,AlignBegin=10028|AlignEnd=10179,-1
ParisStories_2022_11_copineEnCarton__7,"mais, euh, on s'est ",mis, ensemble pendant trois ans. ,8,mis,mettre,VERB,_,Gender=Masc|Number=Sing|Tense=Past|VerbForm=Part,0,root,_,AlignBegin=16164|AlignEnd=16405,-1
ParisStories_2022_11_copineEnCarton__8,"et, c'était pas la folie, parce que il ",avait," des problèmes, euh. ",12,avait,avoir,VERB,_,Mood=Ind|Number=Sing|Person=3|Tense=Imp|VerbForm=Fin,7,advcl,_,AlignBegin=20066|AlignEnd=20420,3
ParisStories_2022_11_copineEnCarton__13,"mais euh, je me s~, j'aurais dû le ",laisser," à XXX, finalement. ",12,laisser,laisser,VERB,_,VerbForm=Inf,10,xcomp,_,AlignBegin=35306|AlignEnd=35541|Subject=SubjRaising,-1
ParisStories_2022_11_copineEnCarton__14,"non, parce qu'après, il l'a ",quitté, pour moi. ,10,quitté,quitter,VERB,_,Gender=Masc|Number=Sing|Tense=Past|VerbForm=Part,0,root,_,AlignBegin=36994|AlignEnd=37135,-1
ParisStories_2022_11_copineEnCarton__18,"et du coup, ben, euh, on est ",resté, trois ans ensemble. ,12,resté,rester,VERB,_,Gender=Masc|Number=Sing|Tense=Past|VerbForm=Part,0,root,_,AlignBegin=43440|AlignEnd=43692,2
ParisStories_2022_11_copineEnCarton__19,"alors, les premiers un an et demi, ça a ",été,", parce qu'on était pas en couple, officiellement. ",12,été,être,VERB,_,Gender=Masc|Number=Sing|Tense=Past|VerbForm=Part,0,root,_,AlignBegin=45968|AlignEnd=46137|SpaceAfter=No,3
ParisStories_2022_11_copineEnCarton__20,"mais après, une fois qu'il m'a dit ouais, tu veux ",sortir," avec moi là, ça a été la catastrophe. ",15,sortir,sortir,VERB,_,VerbForm=Inf,14,xcomp,_,AlignBegin=50993|AlignEnd=51161|Subject=SubjRaising,1
ParisStories_2022_11_copineEnCarton__22,et je pouvais rien ,faire,. ,5,faire,faire,VERB,_,VerbForm=Inf,3,xcomp,_,AlignBegin=55322|AlignEnd=55523|SpaceAfter=No|Subject=SubjRaising,-1
ParisStories_2022_11_copineEnCarton__23,"c'était, il me surveillait, il me ",fliquait, tout le temps. ,10,fliquait,fliquer,VERB,_,Mood=Ind|Number=Sing|Person=3|Tense=Imp|VerbForm=Fin,2,conj,_,AlignBegin=56788|AlignEnd=56969,-1
ParisStories_2022_11_copineEnCarton__24,pourquoi tu ,vas, à une soirée sans moi ? ,3,vas,aller,VERB,_,Mood=Ind|Number=Sing|Person=2|Tense=Pres|VerbForm=Fin,0,root,_,AlignBegin=58762|AlignEnd=58952,-1
ParisStories_2022_11_copineEnCarton__25,je pouvais pas ,vivre, sans lui. ,4,vivre,vivre,VERB,_,VerbForm=Inf,2,xcomp,_,AlignBegin=60517|AlignEnd=60786|Subject=SubjRaising,-1
ParisStories_2022_11_copineEnCarton__28,"donc ok, j'étais ",attirée," par lui au début, physiquement. ",6,attirée,attirer,VERB,_,Gender=Fem|Number=Sing|Tense=Past|VerbForm=Part,0,root,_,AlignBegin=64982|AlignEnd=65215,-1
ParisStories_2022_11_copineEnCarton__28,"donc ok, j'étais ",attirée," par lui au début, physiquement. ",6,attirée,attirer,VERB,_,Gender=Fem|Number=Sing|Tense=Past|VerbForm=Part,0,root,_,AlignBegin=64982|AlignEnd=65215,-1
ParisStories_2022_11_copineEnCarton__39,"du coup, ce qui c'est passé, c'est que, ben, à un moment, je lui ai ",dit, carte sur table. ,24,dit,dire,VERB,_,Mood=Ind|Number=Sing|Person=3|Tense=Pres|VerbForm=Fin,12,ccomp,_,AlignBegin=89312|AlignEnd=89476,1
ParisStories_2022_11_copineEnCarton__41,"euh, tu me ",fliques, tout le temps. ,5,fliques,fliquer,VERB,_,Mood=Ind|Number=Sing|Person=2|Tense=Pres|VerbForm=Fin,0,root,_,AlignBegin=92507|AlignEnd=92665,-1
ParisStories_2022_11_copineEnCarton__43,je peux pas ,voir, mes amis sans toi. ,4,voir,voir,VERB,_,VerbForm=Inf,2,xcomp,_,AlignBegin=94704|AlignEnd=94859|Subject=SubjRaising,-1
ParisStories_2022_11_copineEnCarton__53,"enfin, je ",vois, jamais mes potes sans toi. ,4,vois,voir,VERB,_,Mood=Ind|Number=Sing|Person=1|Tense=Pres|VerbForm=Fin,0,root,_,AlignBegin=108399|AlignEnd=108543,-1
ParisStories_2022_11_copineEnCarton__54,"est-ce que je t'ai déjà dit euh, écoute, tu vas pas ",voir, César sans moi. ,16,voir,voir,VERB,_,VerbForm=Inf,14,xcomp,_,AlignBegin=112855|AlignEnd=113101|Subject=SubjRaising,3
ParisStories_2022_11_copineEnCarton__56,si tu as envie de ,voir," tes potes sans moi, mais vraiment, vas-y ! ",6,voir,voir,VERB,_,VerbForm=Inf,4,acl,_,AlignBegin=115299|AlignEnd=115445|Subject=SubjRaising,-1
ParisStories_2022_10_frèreHyperDifférent__5,"du coup, il est ",né," quand, moi, j'avais, euh, trois ans et demi, un truc comme ça. ",7,né,naître,VERB,_,Gender=Masc|Number=Sing|Tense=Past|VerbForm=Part,0,root,_,AlignBegin=10656|AlignEnd=10839,1
ParisStories_2022_10_frèreHyperDifférent__12,"mais euh, je me souviens que je suis arrivée avec mon papa, et que j'ai vu ma mère, et avec mon petit frère dans les bras, et qu'à ce moment-là, euh, on ",devait," le changer, on devait changer sa couche. ",42,devait,devoir,VERB,_,Mood=Ind|Number=Sing|Person=3|Tense=Imp|VerbForm=Fin,10,conj,_,AlignBegin=34424|AlignEnd=34682,1
ParisStories_2022_10_frèreHyperDifférent__12,"mais euh, je me souviens que je suis ",arrivée," avec mon papa, et que j'ai vu ma mère, et avec mon petit frère dans les bras, et qu'à ce moment-là, euh, on devait le changer, on devait changer sa couche. ",10,arrivée,arriver,VERB,_,Gender=Fem|Number=Sing|Tense=Past|VerbForm=Part,6,ccomp,_,AlignBegin=28319|AlignEnd=28556,-1
ParisStories_2022_10_frèreHyperDifférent__14,"et euh, bien euh, j'ai ",vomi, à ce moment-là. ,9,vomi,vomir,VERB,_,Gender=Masc|Number=Sing|Tense=Past|VerbForm=Part,0,root,_,AlignBegin=40472|AlignEnd=40875,-1
ParisStories_2022_10_frèreHyperDifférent__16,"du coup, je me dis, la première fois que j'ai vu mon frère, littéralement, j'ai ",vomi,. ,23,vomi,vomir,VERB,_,Gender=Masc|Number=Sing|Tense=Past|VerbForm=Part,7,ccomp,_,AlignBegin=44820|AlignEnd=45081|SpaceAfter=No,-1
ParisStories_2022_10_frèreHyperDifférent__21,"mais, en tout cas, je me ",souviens," de cette scène-là, à l'hôpital. ",9,souviens,souvenir,VERB,_,Mood=Ind|Number=Sing|Person=1|Tense=Pres|VerbForm=Fin,0,root,_,AlignBegin=58556|AlignEnd=58691,1
ParisStories_2022_10_frèreHyperDifférent__21,"mais, en tout cas, je me ",souviens," de cette scène-là, à l'hôpital. ",9,souviens,souvenir,VERB,_,Mood=Ind|Number=Sing|Person=1|Tense=Pres|VerbForm=Fin,0,root,_,AlignBegin=58556|AlignEnd=58691,1
ParisStories_2022_10_frèreHyperDifférent__23,"je sais qu'on a une photo, où on ",est," tous les deux avec, euh, moi avec lui dans les bras, comme ça, comme un petit bébé. ",11,est,être,VERB,_,Mood=Ind|Number=Sing|Person=3|Tense=Pres|VerbForm=Fin,7,acl:relcl,_,AlignBegin=62514|AlignEnd=62735,1
ParisStories_2022_10_frèreHyperDifférent__23,"je sais qu'on a une photo, où on ",est," tous les deux avec, euh, moi avec lui dans les bras, comme ça, comme un petit bébé. ",11,est,être,VERB,_,Mood=Ind|Number=Sing|Person=3|Tense=Pres|VerbForm=Fin,7,acl:relcl,_,AlignBegin=62514|AlignEnd=62735,1
ParisStories_2022_10_frèreHyperDifférent__23,"je sais qu'on a une photo, où on ",est," tous les deux avec, euh, moi avec lui dans les bras, comme ça, comme un petit bébé. ",11,est,être,VERB,_,Mood=Ind|Number=Sing|Person=3|Tense=Pres|VerbForm=Fin,7,acl:relcl,_,AlignBegin=62514|AlignEnd=62735,1
ParisStories_2022_10_frèreHyperDifférent__31,"mais ouais, après euh, à cette époque-là, on habitait euh, on ",habitait," dans les Bouches du Rhône, du coup. ",13,habitait,habiter,VERB,_,Mood=Ind|Number=Sing|Person=3|Tense=Imp|VerbForm=Fin,17,reparandum,_,AlignBegin=83090|AlignEnd=83449,1
ParisStories_2022_10_frèreHyperDifférent__31,"mais ouais, après euh, à cette époque-là, on ",habitait," euh, on habitait dans les Bouches du Rhône, du coup. ",13,habitait,habiter,VERB,_,Mood=Ind|Number=Sing|Person=3|Tense=Imp|VerbForm=Fin,17,reparandum,_,AlignBegin=83090|AlignEnd=83449,1
ParisStories_2022_10_frèreHyperDifférent__32,"et, euh, bah, on, après, on a chacun ",eu, nos chambres et tout. ,14,eu,avoir,VERB,_,Gender=Masc|Number=Sing|Tense=Past|VerbForm=Part,0,root,_,AlignBegin=87891|AlignEnd=88168,-1
ParisStories_2022_10_frèreHyperDifférent__32,"et, euh, bah, on, après, on a chacun ",eu, nos chambres et tout. ,14,eu,avoir,VERB,_,Gender=Masc|Number=Sing|Tense=Past|VerbForm=Part,0,root,_,AlignBegin=87891|AlignEnd=88168,-1
ParisStories_2022_10_frèreHyperDifférent__33,"et, bon, on a ",fait," un peu nos, nos vies chacun de notre côté, quoi. ",7,fait,faire,VERB,_,Gender=Masc|Mood=Ind|Number=Sing|Person=3|Tense=Pres|VerbForm=Fin,0,root,_,AlignBegin=90148|AlignEnd=90346,-1
ParisStories_2022_10_frèreHyperDifférent__33,"et, bon, on a ",fait," un peu nos, nos vies chacun de notre côté, quoi. ",7,fait,faire,VERB,_,Gender=Masc|Mood=Ind|Number=Sing|Person=3|Tense=Pres|VerbForm=Fin,0,root,_,AlignBegin=90148|AlignEnd=90346,-1
ParisStories_2022_10_frèreHyperDifférent__33,"et, bon, on a ",fait," un peu nos, nos vies chacun de notre côté, quoi. ",7,fait,faire,VERB,_,Gender=Masc|Mood=Ind|Number=Sing|Person=3|Tense=Pres|VerbForm=Fin,0,root,_,AlignBegin=90148|AlignEnd=90346,-1
ParisStories_2022_10_frèreHyperDifférent__34,"et puis, vous ",avez, des vies graves différentes. ,5,avez,avoir,VERB,_,Mood=Ind|Number=Plur|Person=2|Tense=Pres|VerbForm=Fin,0,root,_,AlignBegin=93032|AlignEnd=93265,-1
ParisStories_2022_10_frèreHyperDifférent__36,"mais euh, on est ",devenu," des personnes, on est rapidement devenu des personnes hyper différentes. ",6,devenu,devenir,VERB,_,Gender=Masc|Number=Sing|Tense=Past|VerbForm=Part,13,reparandum,_,AlignBegin=101803|AlignEnd=102017,-1
ParisStories_2022_10_frèreHyperDifférent__43,et ça ,correspond," assez à nos personnalités que, lui, bah maintenant il est plus euh, bah, il va plus bouger partout et tout. ",3,correspond,correspondre,VERB,_,Mood=Ind|Number=Sing|Person=3|Tense=Pres|VerbForm=Fin,0,root,_,AlignBegin=113969|AlignEnd=114219,-1
ParisStories_2022_10_frèreHyperDifférent__46,"tu sais que, moi, j'ai ",marché, à neuf mois et demi ? ,9,marché,marcher,VERB,_,Gender=Masc|Number=Sing|Tense=Past|VerbForm=Part,2,ccomp,_,AlignBegin=126809|AlignEnd=126959,1
ParisStories_2022_10_frèreHyperDifférent__60,"ta mère, elle a juste dit ça, c'est une info très importante à ",retenir, pour mon fils euh. ,17,retenir,retenir,VERB,_,VerbForm=Inf,13,acl,_,AlignBegin=145261|AlignEnd=145424|Subject=SubjRaising,1
ParisStories_2022_3_petitDuCentre__1,"oui, bah, en fait, je voulais te raconter ma rencontre avec, euh, un enfant du centre, parce que maintenant ça va faire, euh, deux semaines que je ",travaille," au centre, bah, le mercredi. ",37,travaille,travailler,VERB,_,Mood=Ind|Number=Sing|Person=1|Tense=Pres|VerbForm=Fin,29,ccomp,_,AlignBegin=9434|AlignEnd=9767,0
ParisStories_2022_3_petitDuCentre__1,"oui, bah, en fait, je voulais te raconter ma rencontre avec, euh, un enfant du centre, parce que maintenant ça va faire, euh, deux semaines que je ",travaille," au centre, bah, le mercredi. ",37,travaille,travailler,VERB,_,Mood=Ind|Number=Sing|Person=1|Tense=Pres|VerbForm=Fin,29,ccomp,_,AlignBegin=9434|AlignEnd=9767,0
ParisStories_2022_3_petitDuCentre__2,"et, et la semaine dernière, j'ai ",rencontré, un petit garçon. ,10,rencontré,rencontrer,VERB,_,Gender=Masc|Number=Sing|Tense=Past|VerbForm=Part,0,root,_,AlignBegin=14461|AlignEnd=14799,1
ParisStories_2022_3_petitDuCentre__5,"au début, il voulait pas ",venir, dans la salle pour faire des activités. ,8,venir,venir,VERB,_,VerbForm=Inf,6,xcomp,_,AlignBegin=25811|AlignEnd=26117|Subject=SubjRaising,1
ParisStories_2022_3_petitDuCentre__5,"au début, il ",voulait, pas venir dans la salle pour faire des activités. ,6,voulait,vouloir,VERB,_,Mood=Ind|Number=Sing|Person=3|Tense=Imp|VerbForm=Fin,0,root,_,AlignBegin=25199|AlignEnd=25505,1
ParisStories_2022_3_petitDuCentre__7,"et je lui ai demandé, euh, pourquoi il, il, il ne voulait pas ",participer," aux activités, et euh, et comme, bah, tous les enfants. ",18,participer,participer,VERB,_,VerbForm=Inf,16,xcomp,_,AlignBegin=34070|AlignEnd=34642|Subject=SubjRaising,-1
ParisStories_2022_3_petitDuCentre__11,je l'ai ,pris," dans mes bras, parce qu'il était en, en train de pleurer. ",4,pris,prendre,VERB,_,Gender=Masc|Tense=Past|VerbForm=Part,0,root,_,AlignBegin=44768|AlignEnd=45005,-1
ParisStories_2022_3_petitDuCentre__14,et il m'a dit tu peux ,dormir, sur mon épaule si tu veux. ,8,dormir,dormir,VERB,_,VerbForm=Inf,7,xcomp,_,AlignBegin=57181|AlignEnd=57508|Subject=SubjRaising,-1
ParisStories_2022_3_petitDuCentre__18,"et on a passé tout le temps ensemble, parce qu'il était un peu ",perdu, par rapport aux autres. ,16,perdu,perdre,VERB,_,Gender=Masc|Number=Sing|Tense=Past|VerbForm=Part,4,advcl,_,AlignBegin=73869|AlignEnd=74139,3
ParisStories_2022_3_petitDuCentre__18,"et on a passé tout le temps ensemble, parce qu'il était un peu ",perdu, par rapport aux autres. ,16,perdu,perdre,VERB,_,Gender=Masc|Number=Sing|Tense=Past|VerbForm=Part,4,advcl,_,AlignBegin=73869|AlignEnd=74139,3
ParisStories_2022_3_petitDuCentre__19,"euh, je pense que, je pense que c'est parce que, euh c'était la première fois ou la deuxième fois qu'il ",venait," comme ça au centre un, un mercredi. ",27,venait,venir,VERB,_,Mood=Ind|Number=Sing|Person=3|Tense=Imp|VerbForm=Fin,24,acl,_,AlignBegin=80933|AlignEnd=81194,1
ParisStories_2022_3_petitDuCentre__25,on a ,discuté," avec, euh, bah, sa mère et avec Warren. ",3,discuté,discuter,VERB,_,Gender=Masc|Number=Sing|Tense=Past|VerbForm=Part,0,root,_,AlignBegin=102484|AlignEnd=102859,-1
ParisStories_2022_3_petitDuCentre__26,"et il a même dit qu'il ne voulait pas rentrer à la maison et que, et qu'il voulait ",rentrer, avec moi. ,11,rentrer,rentrer,VERB,_,VerbForm=Inf,9,xcomp,_,AlignBegin=109024|AlignEnd=109306|Subject=SubjRaising,-1
ParisStories_2022_3_petitDuCentre__26,et il a même dit qu'il ne voulait pas ,rentrer," à la maison et que, et qu'il voulait rentrer avec moi. ",11,rentrer,rentrer,VERB,_,VerbForm=Inf,9,xcomp,_,AlignBegin=109024|AlignEnd=109306|Subject=SubjRaising,-1
ParisStories_2022_8_rencontreALiège__2,je venais d',arriver, en Belgique. ,4,arriver,arriver,VERB,_,VerbForm=Inf,2,xcomp,_,AlignBegin=2037|AlignEnd=2223|Subject=SubjRaising,-1
ParisStories_2022_8_rencontreALiège__3,c',était, au tout début de mes études d'orthophonie. ,2,était,être,VERB,_,Mood=Ind|Number=Sing|Person=3|Tense=Imp|VerbForm=Fin,0,root,_,AlignBegin=3427|AlignEnd=3608,0
ParisStories_2022_8_rencontreALiège__5,"je m'étais euh, ",installée, le dimanche dans mon appartement. ,6,installée,installer,VERB,_,Gender=Fem|Number=Sing|Tense=Past|VerbForm=Part,0,root,_,AlignBegin=8813|AlignEnd=9121,-1
ParisStories_2022_8_rencontreALiège__5,"je m'étais euh, ",installée, le dimanche dans mon appartement. ,6,installée,installer,VERB,_,Gender=Fem|Number=Sing|Tense=Past|VerbForm=Part,0,root,_,AlignBegin=8813|AlignEnd=9121,-1
ParisStories_2022_8_rencontreALiège__6,"et le jeudi, ils avaient ",organisé," une pré-rentrée à la Haute École, pour qu'on puisse euh, se rencontrer, nous, les françaises. ",7,organisé,organiser,VERB,_,Gender=Masc|Number=Sing|Tense=Past|VerbForm=Part,0,root,_,AlignBegin=13126|AlignEnd=13424,1
ParisStories_2022_8_rencontreALiège__6,"et le jeudi, ils avaient ",organisé," une pré-rentrée à la Haute École, pour qu'on puisse euh, se rencontrer, nous, les françaises. ",7,organisé,organiser,VERB,_,Gender=Masc|Number=Sing|Tense=Past|VerbForm=Part,0,root,_,AlignBegin=13126|AlignEnd=13424,1
ParisStories_2022_8_rencontreALiège__8,"et il y avait un professeur de la Haute École qui répondait à toutes nos questions, sur comment s'installer, trouver un appartement, euh, à ",faire," ses courses à Liège, plein de, plein de petites choses pratiques comme ça, pour nous aider à, à mieux intégrer la ville en fait, et mieux s'intégrer surtout. ",30,faire,faire,VERB,_,VerbForm=Inf,21,conj,_,AlignBegin=32461|AlignEnd=32831|Subject=NoRaising,5
ParisStories_2022_8_rencontreALiège__8,et il y avait un professeur de la Haute École qui ,répondait," à toutes nos questions, sur comment s'installer, trouver un appartement, euh, à faire ses courses à Liège, plein de, plein de petites choses pratiques comme ça, pour nous aider à, à mieux intégrer la ville en fait, et mieux s'intégrer surtout. ",12,répondait,réponre,VERB,_,Gender=Masc|Number=Sing|Tense=Past|VerbForm=Part,6,acl:relcl,_,AlignBegin=26671|AlignEnd=26998,5
ParisStories_2022_8_rencontreALiège__10,on a ,fait, une promenade dans la ville de Liège. ,3,fait,faire,VERB,_,Gender=Masc|Mood=Ind|Number=Sing|Person=3|Tense=Pres|VerbForm=Fin,0,root,_,AlignBegin=47699|AlignEnd=47948,-1
ParisStories_2022_8_rencontreALiège__11,ça a été ,organisé, par le prof. ,4,organisé,organiser,VERB,_,Gender=Masc|Number=Sing|Tense=Past|VerbForm=Part,0,root,_,AlignBegin=50394|AlignEnd=50593,-1
ParisStories_2022_8_rencontreALiège__12,et donc on est toutes ,parties," en groupe, euh, un peu comme euh, comme euh, comme quand on était petit, euh. ",6,parties,partir,VERB,_,Gender=Fem|Number=Plur|Tense=Past|VerbForm=Part,0,root,_,AlignBegin=52697|AlignEnd=52885,-1
ParisStories_2022_8_rencontreALiège__12,et donc on est toutes ,parties," en groupe, euh, un peu comme euh, comme euh, comme quand on était petit, euh. ",6,parties,partir,VERB,_,Gender=Fem|Number=Plur|Tense=Past|VerbForm=Part,0,root,_,AlignBegin=52697|AlignEnd=52885,-1
ParisStories_2022_8_rencontreALiège__14,et on se ,promenait, dans les rues. ,4,promenait,promener,VERB,_,Mood=Ind|Number=Sing|Person=3|Tense=Imp|VerbForm=Fin,0,root,_,AlignBegin=58742|AlignEnd=58959,-1
ParisStories_2022_8_rencontreALiège__15,"et en fait, derrière moi, j'ai entendu une fille qui parlait assez fort, et qui ",parlait, de la ville de Monaco. ,14,parlait,parler,VERB,_,Mood=Ind|Number=Sing|Person=3|Tense=Imp|VerbForm=Fin,12,acl:relcl,_,AlignBegin=63114|AlignEnd=63329,2
ParisStories_2022_8_rencontreALiège__15,"et en fait, derrière moi, j'ai ",entendu," une fille qui parlait assez fort, et qui parlait de la ville de Monaco. ",10,entendu,entendre,VERB,_,Gender=Masc|Number=Sing|Tense=Past|VerbForm=Part,0,root,_,AlignBegin=62255|AlignEnd=62469,2
ParisStories_2022_8_rencontreALiège__17,"et, euh, elle ",parlait, de tout son voyage. ,6,parlait,parler,VERB,_,Mood=Ind|Number=Sing|Person=3|Tense=Imp|VerbForm=Fin,0,root,_,AlignBegin=71247|AlignEnd=71579,-1
ParisStories_2022_8_rencontreALiège__18,"elle avait pris euh, euh, la voiture euh, le train, pour ",venir," euh, de Monaco à Liège. ",16,venir,venir,VERB,_,VerbForm=Inf,3,advcl,_,AlignBegin=77321|AlignEnd=77656|Subject=NoRaising,-1
ParisStories_2022_8_rencontreALiège__20,"et en fait, je l'entendais ",parler, derrière moi. ,8,parler,parler,VERB,_,VerbForm=Inf,7,xcomp,_,AlignBegin=82555|AlignEnd=82748|Subject=ObjRaising,-1
ParisStories_2022_8_rencontreALiège__25,mais je me suis ,retournée, vers elle. ,5,retournée,retourner,VERB,_,Gender=Fem|Number=Sing|Tense=Past|VerbForm=Part,0,root,_,AlignBegin=95372|AlignEnd=95555,-1
ParisStories_2022_8_rencontreALiège__27,"enfin je t'entends parler depuis tout à l'heure, est-ce que je peux me ",joindre, à toi ? ,18,joindre,joindre,VERB,_,VerbForm=Inf,16,xcomp,_,AlignBegin=102746|AlignEnd=102945|Subject=SubjRaising,-1
ParisStories_2022_8_rencontreALiège__31,"parce qu'en fait, on a fait que ",parler," de plein de choses euh, bah, de, de nos écoles, dans lesquelles on était avant, euh, Liège euh, l'orthophonie. ",10,parler,parler,VERB,_,VerbForm=Inf,0,root,_,AlignBegin=113629|AlignEnd=113790|Subject=ObjRaising,1
ParisStories_2022_8_rencontreALiège__32,on a ,parlé," vraiment de, de plein plein de choses. ",3,parlé,parler,VERB,_,Gender=Masc|Number=Sing|Tense=Past|VerbForm=Part,0,root,_,AlignBegin=121901|AlignEnd=122091,-1
ParisStories_2022_1_rencontreSolfège__1,"et à la fin du cours, je lui ai ",demandé," mais au fait, euh, bah, euh, comment je te enfin, euh, j'ai l'impression de te connaître ! ",12,demandé,demander,VERB,_,Gender=Masc|Number=Sing|Tense=Past|VerbForm=Part,0,root,_,AlignBegin=1648|AlignEnd=1854,3
ParisStories_2022_1_rencontreSolfège__20,"mais, du coup, elle ",habite, à Athis ? ,8,habite,habiter,VERB,_,Mood=Ind|Number=Sing|Person=3|Tense=Pres|VerbForm=Fin,0,root,_,AlignBegin=37455|AlignEnd=37632,-1
ParisStories_2022_1_rencontreSolfège__21,"euh, oui, elle ",habite, à Athis. ,6,habite,habiter,VERB,_,Mood=Ind|Number=Sing|Person=3|Tense=Pres|VerbForm=Fin,0,root,_,AlignBegin=38827|AlignEnd=38995,-1
ParisStories_2022_1_rencontreSolfège__26,"donc elle m'a dit, euh, tennis, elle le ",faisait, pas à Athis. ,13,faisait,faire,VERB,_,Mood=Ind|Number=Sing|Person=3|Tense=Imp|VerbForm=Fin,5,ccomp,_,AlignBegin=45482|AlignEnd=45703,-1
ParisStories_2022_1_rencontreSolfège__27,elle le ,faisait," sur Orly, donc. ",3,faisait,faire,VERB,_,Mood=Ind|Number=Sing|Person=3|Tense=Imp|VerbForm=Fin,0,root,_,AlignBegin=46671|AlignEnd=46935,-1
ParisStories_2022_1_rencontreSolfège__29,"et après, on est ",venu, à l'instrument. ,6,venu,venir,VERB,_,Gender=Masc|Number=Sing|Tense=Past|VerbForm=Part,0,root,_,AlignBegin=50147|AlignEnd=50446,-1
ParisStories_2022_1_rencontreSolfège__30,et elle me disait qu'elle ,faisait, de l'alto. ,7,faisait,faire,VERB,_,Mood=Ind|Number=Sing|Person=3|Tense=Imp|VerbForm=Fin,4,ccomp,_,AlignBegin=51989|AlignEnd=52162,-1
ParisStories_2022_1_rencontreSolfège__34,"elle m'a dit, euh je l'ai ",fait," au, euh... ",10,fait,faire,VERB,_,Gender=Masc|Mood=Ind|Number=Sing|Person=3|Tense=Pres|VerbForm=Fin,4,ccomp,_,AlignBegin=60182|AlignEnd=60360,-1
