sent_id,left_context,pivot,right_context,ID,FORM,LEMMA,UPOS,XPOS,FEATS,HEAD,DEPREL,DEPS,MISC
8941,Mes sor toz ceus qui laienz ,estoient, en fu li rois Artus joianz et liez de ce que greignor debonaireté li avoit Nostre Sires mostré qu'a nul roi qui devant lui eust esté. ,7,estoient,_,VERB,VERcjg,VerbForm=Fin,4,acl:relcl,_,XmlId=w_qgraal_cm_6376
8944,Si em parlerent assez tant com li mengiers ,dura,", ",9,dura,_,VERB,VERcjg,VerbForm=Fin,3,advcl,_,SpaceAfter=No|XmlId=w_qgraal_cm_6444
8945,et li rois meïsmes en comença a parler a cels qui plus pres de lui ,estoient,", ",16,estoient,_,VERB,VERcjg,VerbForm=Fin,10,acl:relcl,_,SpaceAfter=No|XmlId=w_qgraal_cm_6461
8945,et li rois meïsmes en ,comença," a parler a cels qui plus pres de lui estoient, ",6,comença,_,VERB,VERcjg,VerbForm=Fin,0,root,_,XmlId=w_qgraal_cm_6451
8946,et ,dist, : ,2,dist,_,VERB,VERcjg,VerbForm=Fin,0,root,_,XmlId=w_qgraal_cm_6464
8947,« Certes seignor mout devons avoir grant joie de ce que Nostre Sires nos a mostré si grant signe d'amor qu'il de sa grace nos volt repaistre a si haut jor com ,est, le jor de la Pente. ,35,est,_,VERB,VERcjg,VerbForm=Fin,32,advcl,_,XmlId=w_qgraal_cm_6500
8948,"- Sire, ",fet," mes sires Gauvains, encor i a il autre chose que vos ne savez mie, ",4,fet,_,VERB,VERcjg,VerbForm=Fin,11,parataxis,_,XmlId=w_qgraal_cm_6510
8949,car il n'a çaienz home qui n'ait esté serviz de quan qu'il demandoit et ,pensoit,", ",18,pensoit,_,VERB,VERcjg,VerbForm=Fin,16,conj,_,SpaceAfter=No|XmlId=w_qgraal_cm_6544
8950,et ce n'avint onques mes en nule cort se ne fu chiés le Roi ,Mehaignié,. ,16,Mehaignié,_,VERB,VERppe,Tense=Past|VerbForm=Part,15,acl,_,SpaceAfter=No|XmlId=w_qgraal_cm_6561
8951,Mes de tant sont il engignié qu'il nel porent ,veoir," apertement, ",11,veoir,_,VERB,VERinf,VerbForm=Inf,6,advcl,_,XmlId=w_qgraal_cm_6573
8951,Mes de tant sont il ,engignié," qu'il nel porent veoir apertement, ",6,engignié,_,VERB,VERppe,Tense=Past|VerbForm=Part,0,root,_,XmlId=w_qgraal_cm_6568
8953,"por quoi je endroit moi faz orendroit.i. veu, que le matin sanz plus ",atendre," entrerai en la queste en tel maniere que je la maintendrai.i. an et.i. jor, et encor plus se mestiers est. ",16,atendre,_,VERB,VERinf,VerbForm=Inf,17,advcl,_,XmlId=w_qgraal_cm_6600
8954,"Ne ne revendrai a cort por chose qui aviegne devant que je l'aie veu plus apertement qu'il ne m'a ci esté demostré, se ce puet estre en nule maniere que je le puisse veoir ne ",doie,", ",40,doie,_,VERB,VERcjg,VerbForm=Fin,38,conj,_,SpaceAfter=No|XmlId=w_qgraal_cm_6664
8954,Ne ne revendrai a cort por chose qui ,aviegne," devant que je l'aie veu plus apertement qu'il ne m'a ci esté demostré, se ce puet estre en nule maniere que je le puisse veoir ne doie, ",9,aviegne,_,VERB,VERcjg,VerbForm=Fin,7,acl:relcl,_,XmlId=w_qgraal_cm_6633
8955,et s'il ne puet ,estre, je m'en retornerai. » ,6,estre,_,VERB,VERinf,VerbForm=Inf,10,advcl,_,XmlId=w_qgraal_cm_6671
8957,et firent tuit autretel veu com mes sires Gauvains avoit ,fait,", ",11,fait,_,VERB,VERppe,Tense=Past|VerbForm=Part,5,acl,_,SpaceAfter=No|XmlId=w_qgraal_cm_6705
8958,et distrent qu'il ne fineroient jamés d',errer, devant qu'il seroient assis a la haute table ou si douce viande estoit toz jorz aprestee come cele qu'il avoient iluec eue. ,9,errer,_,VERB,VERinf,VerbForm=Inf,6,xcomp,_,XmlId=w_qgraal_cm_6715
8958,et distrent qu'il ne ,fineroient, jamés d'errer devant qu'il seroient assis a la haute table ou si douce viande estoit toz jorz aprestee come cele qu'il avoient iluec eue. ,6,fineroient,_,VERB,VERcjg,VerbForm=Fin,2,ccomp,_,XmlId=w_qgraal_cm_6712
8958,et ,distrent, qu'il ne fineroient jamés d'errer devant qu'il seroient assis a la haute table ou si douce viande estoit toz jorz aprestee come cele qu'il avoient iluec eue. ,2,distrent,_,VERB,VERcjg,VerbForm=Fin,0,root,_,XmlId=w_qgraal_cm_6708
8959,Et quant li rois ,vit, qu'il avoient fait tel veu si en fu mout a malaise. ,5,vit,_,VERB,VERcjg,VerbForm=Fin,14,advcl,_,XmlId=w_qgraal_cm_6745
8960,Car bien ,set, qu'il nes porra pas retorner de ceste emprise. ,3,set,_,VERB,VERcjg,VerbForm=Fin,0,root,_,XmlId=w_qgraal_cm_6761
8965,car quant il departiront de moi de quele heure que ce soit je sai bien qu'il ne ,revendront, jamés arriere ,19,revendront,_,VERB,VERcjg,VerbForm=Fin,14,ccomp,_,XmlId=w_qgraal_cm_6843
8965,car quant il departiront de moi de quele heure que ce soit je ,sai, bien qu'il ne revendront jamés arriere ,14,sai,_,VERB,VERcjg,VerbForm=Fin,0,root,_,XmlId=w_qgraal_cm_6837
8966,"tuit, ainz demorront en ceste queste li plusor qui ne faudra pas si tost come vos ",cuidoiz,", ",18,cuidoiz,_,VERB,VERcjg,VerbForm=Fin,15,advcl,_,SpaceAfter=No|XmlId=w_qgraal_cm_6864
8966,"tuit, ainz demorront en ceste queste li plusor qui ne ",faudra," pas si tost come vos cuidoiz, ",12,faudra,_,VERB,VERcjg,VerbForm=Fin,7,acl:relcl,_,XmlId=w_qgraal_cm_6858
8968,car je les ai escreuz et ,eslevez," de tot mon pooir, ",7,eslevez,_,VERB,VERppe,Tense=Past|VerbForm=Part,5,conj,_,XmlId=w_qgraal_cm_6880
8972,car je avoie ,apris," a veoir les souvent, et avoir lor compaignie, ",4,apris,_,VERB,VERppe,Tense=Past|VerbForm=Part,0,root,_,XmlId=w_qgraal_cm_6921
8973,car je ne puis pas en moi veoir coment je m'en puisse ,soffrir,. » ,14,soffrir,_,VERB,VERinf,VerbForm=Inf,8,ccomp,_,SpaceAfter=No|XmlId=w_qgraal_cm_6945
8974,Aprés ceste parole comença li rois a ,penser," mout durement, ",8,penser,_,VERB,VERinf,VerbForm=Inf,4,xcomp,_,XmlId=w_qgraal_cm_6955
8976,Et quant il parla si ,dist, si haut que cil de laienz le porent bien oïr : ,6,dist,_,VERB,VERcjg,VerbForm=Fin,0,root,_,XmlId=w_qgraal_cm_6985
8976,Et quant il ,parla, si dist si haut que cil de laienz le porent bien oïr : ,4,parla,_,VERB,VERcjg,VerbForm=Fin,6,advcl,_,XmlId=w_qgraal_cm_6983
8977,« Gauvains Gauvains mis m'avez le grant corroz ou cuer donc jamés ne me porrai esbatre devant que je ,sache," veraiement a quele fin ceste queste porra torner, ",21,sache,_,VERB,VERcjg,VerbForm=Fin,17,advcl,_,XmlId=w_qgraal_cm_7017
8979,"- Ha.´ sire, ",fet," Lancelot, por Dieu que est ce que vos dites ? ",6,fet,_,VERB,VERcjg,VerbForm=Fin,11,parataxis,_,XmlId=w_qgraal_cm_7046
8983,"- Lancelot, ",fait," li rois, la grant amor que j'ai toz jorz vers aus eue me fet dire tiex paroles, ",4,fait,_,VERB,VERcjg,VerbForm=Fin,20,parataxis,_,XmlId=w_qgraal_cm_7111
90,Blanche ad la barbe e tut ,flurit," le chef, ",7,flurit,_,VERB,VERppe,Tense=Past|VerbForm=Part,9,acl,_,XmlId=w_58_01013
92,"S'est kil demandet, ne l'estoet ",enseigner,. ,9,enseigner,_,VERB,VERinf,VerbForm=Inf,8,xcomp,_,SpaceAfter=No|XmlId=w_58_01034
92,S'est kil ,demandet,", ne l'estoet enseigner. ",4,demandet,_,VERB,VERcjg,VerbForm=Fin,2,csubj,_,SpaceAfter=No|XmlId=w_58_01029
92,S',est," kil demandet, ne l'estoet enseigner. ",2,est,_,VERB,VERcjg,VerbForm=Fin,8,advcl,_,XmlId=w_58_01027
beroul-399.new,es le vos ,lié,. ,4,lié,_,VERB,VERppe,Tense=Past|VerbForm=Part,2,acl,_,SpaceAfter=No|XmlId=w_26_04125
roland-238.new,as les vus ,aquisez,. ,4,aquisez,_,VERB,VERppe,Tense=Past|VerbForm=Part,2,acl,_,SpaceAfter=No|XmlId=w_58_02310
10001,Quant cil le vit venir si nel ,salua," pas, ",8,salua,_,VERB,VERcjg,VerbForm=Fin,0,root,_,XmlId=w_qgraal_cm_56688
10001,Quant cil le vit ,venir," si nel salua pas, ",5,venir,_,VERB,VERinf,VerbForm=Inf,4,xcomp,_,XmlId=w_qgraal_cm_56685
10004,car tu es ,morz, se tu ne te puez de moi deffendre. » ,4,morz,_,VERB,VERppe,Tense=Past|VerbForm=Part,0,root,_,XmlId=w_qgraal_cm_56704
10005,Si li vient le glaive ,aloignié,", ",6,aloignié,_,VERB,VERppe,Tense=Past|VerbForm=Part,3,xcomp,_,SpaceAfter=No|XmlId=w_qgraal_cm_56720
10009,il ,point, oultre ,2,point,_,VERB,VERcjg,VerbForm=Fin,0,root,_,XmlId=w_qgraal_cm_56778
10010,et ,revient, arriere ,2,revient,_,VERB,VERcjg,VerbForm=Fin,0,root,_,XmlId=w_qgraal_cm_56781
10018,Si ot chevauchié.ii. granz jornees qui assez l'orent grevé et ,travaillié,. ,13,travaillié,_,VERB,VERppe,Tense=Past|VerbForm=Part,11,conj,_,SpaceAfter=No|XmlId=w_qgraal_cm_56874
10019,Tant a ,chevauchié," qu'il vint par devant un hermitage qui estoit en une montaingne, ",3,chevauchié,_,VERB,VERppe,Tense=Past|VerbForm=Part,0,root,_,XmlId=w_qgraal_cm_56878
10021,et voit devant l'uis ,seoir,".i. hermite vielz hons et anciens, ",6,seoir,_,VERB,VERinf,VerbForm=Inf,2,xcomp,_,SpaceAfter=No|XmlId=w_qgraal_cm_56901
10025,"« Sire, fet Lancelot, porriez vos herbergier.i. chevalier ",errant, ? ,12,errant,_,VERB,VERppa,Tense=Pres|VerbForm=Part,11,amod,_,XmlId=w_qgraal_cm_56940
10025,"« Sire, ",fet," Lancelot, porriez vos herbergier.i. chevalier errant ? ",4,fet,_,VERB,VERcjg,VerbForm=Fin,9,parataxis,_,XmlId=w_qgraal_cm_56932
10026,"- Biau sire, ",fet," li preudons, s'il vos plest je vos herbergerai huimés au mielz que je porrai, ",5,fet,_,VERB,VERcjg,VerbForm=Fin,15,parataxis,_,XmlId=w_qgraal_cm_56946
10027,"et vos donrai, fet li preudons, a ",mengier, de ce que Diex nos a presté. » ,10,mengier,_,VERB,VERinf,VerbForm=Inf,3,xcomp,_,XmlId=w_qgraal_cm_56973
10027,"et vos donrai, ",fet," li preudons, a mengier de ce que Diex nos a presté. » ",5,fet,_,VERB,VERcjg,VerbForm=Fin,3,parataxis,_,XmlId=w_qgraal_cm_56968
10028,Et il ,dit," qu'il ne demande mielz, ",3,dit,_,VERB,VERcjg,VerbForm=Fin,0,root,_,XmlId=w_qgraal_cm_56985
10035,Et quant il est touz ,desarmez," li preudons li demande s'il a oï vespres, ",6,desarmez,_,VERB,VERppe,Tense=Past|VerbForm=Part,10,advcl,_,XmlId=w_qgraal_cm_57055
10036,et il ,dist," qu'il ne vit home ne fame ne meson ne recet fors un sol home qu'il encontra ore a midi, ",3,dist,_,VERB,VERcjg,VerbForm=Fin,0,root,_,XmlId=w_qgraal_cm_57068
10045,car il vit qu'il comença a ,plorer," des lors qu'il conta l'aventure dou saint Graal, ",8,plorer,_,VERB,VERinf,VerbForm=Inf,6,xcomp,_,XmlId=w_qgraal_cm_57187
10045,car il vit qu'il ,comença," a plorer des lors qu'il conta l'aventure dou saint Graal, ",6,comença,_,VERB,VERcjg,VerbForm=Fin,3,ccomp,_,XmlId=w_qgraal_cm_57185
10045,car il ,vit," qu'il comença a plorer des lors qu'il conta l'aventure dou saint Graal, ",3,vit,_,VERB,VERcjg,VerbForm=Fin,0,root,_,XmlId=w_qgraal_cm_57182
10047,et il dist que si ,fera," il volentiers puis qu'il le velt, ",6,fera,_,VERB,VERcjg,VerbForm=Fin,3,ccomp,_,XmlId=w_qgraal_cm_57229
10047,et il ,dist," que si fera il volentiers puis qu'il le velt, ",3,dist,_,VERB,VERcjg,VerbForm=Fin,0,root,_,XmlId=w_qgraal_cm_57226
10052,et ,aseure, ,2,aseure,_,VERB,VERcjg,VerbForm=Fin,0,root,_,XmlId=w_qgraal_cm_57291
10055,« Sire conseilliez moi de ce que je vos demanderai se vos ,savez,. ,13,savez,_,VERB,VERcjg,VerbForm=Fin,3,advcl,_,SpaceAfter=No|XmlId=w_qgraal_cm_57325
10056,- ,Dites,", ",2,Dites,_,VERB,VERcjg,VerbForm=Fin,0,root,_,SpaceAfter=No|XmlId=w_qgraal_cm_57328
10057,,fet," li preudons, ",1,fet,_,VERB,VERcjg,VerbForm=Fin,0,root,_,XmlId=w_qgraal_cm_57330
10059,"- Sire, ",fet," Lancelot, il m'avint en mon dormant anuit que devant moi venoit uns hons toz avironnez d'estoiles, ",4,fet,_,VERB,VERcjg,VerbForm=Fin,9,parataxis,_,XmlId=w_qgraal_cm_57351
10062,Quant li preudons ot ceste parole si ,dist, : ,8,dist,_,VERB,VERcjg,VerbForm=Fin,0,root,_,XmlId=w_qgraal_cm_57405
10064,Saches veraiement que ci a mout greignor senefiance que maintes genz ne ,cuident,. ,13,cuident,_,VERB,VERcjg,VerbForm=Fin,7,acl,_,SpaceAfter=No|XmlId=w_qgraal_cm_57441
10064,,Saches, veraiement que ci a mout greignor senefiance que maintes genz ne cuident. ,1,Saches,_,VERB,VERcjg,VerbForm=Fin,0,root,_,XmlId=w_qgraal_cm_57429
10065,Or m'escoute se tu ,vels,", ",6,vels,_,VERB,VERcjg,VerbForm=Fin,3,advcl,_,SpaceAfter=No|XmlId=w_qgraal_cm_57448
10068,car einsi le ,couvient, a fere. ,4,couvient,_,VERB,VERcjg,VerbForm=Fin,0,root,_,XmlId=w_qgraal_cm_57470
10069,Voirs fu aprés la passion Jhesucrist.xlii. anz que Joseph d'Abarimacie li preudons li verais chevaliers issi de Jerusalem par le comandement Nostre Seignor por ,preechier, et por annoncier la verité de la novele loi et les comandemenz de l'evangile. ,27,preechier,_,VERB,VERinf,VerbForm=Inf,18,xcomp,_,XmlId=w_qgraal_cm_57500
10078,et bien fu aparant chose que il fu preudons et loiax la ou Nostre Sires li dona veoir les granz secrez et les granz repostailles del saint Graal donc onques chevalier n'avoit gueres veu a celui tens se Joseph n',estoit,. ,42,estoit,_,VERB,VERcjg,VerbForm=Fin,35,advcl,_,SpaceAfter=No|XmlId=w_qgraal_cm_57702
10078,et bien fu ,aparant, chose que il fu preudons et loiax la ou Nostre Sires li dona veoir les granz secrez et les granz repostailles del saint Graal donc onques chevalier n'avoit gueres veu a celui tens se Joseph n'estoit. ,4,aparant,_,VERB,VERppa,Tense=Pres|VerbForm=Part,5,amod,_,XmlId=w_qgraal_cm_57664
10079,Ne puis ne fu chevaliers qui gueres en veïst se ce ne fu ausi come en ,sonjant,. ,17,sonjant,_,VERB,VERppa,Tense=Pres|VerbForm=Part,9,advcl,_,SpaceAfter=No|XmlId=w_qgraal_cm_57720
10079,Ne puis ne ,fu, chevaliers qui gueres en veïst se ce ne fu ausi come en sonjant. ,4,fu,_,VERB,VERcjg,VerbForm=Fin,0,root,_,XmlId=w_qgraal_cm_57707
10083,et estoit si rades et si ,bruianz, qu'il n'estoit riens qui le poïst soffrir. ,7,bruianz,_,VERB,VERppa,Tense=Pres|VerbForm=Part,4,conj,_,XmlId=w_qgraal_cm_57794
10085,"car il estoit a cent doubles plus clers que au comencement, et si douz a boivre que nus ne s'em poïst ",saouler,", ",24,saouler,_,VERB,VERinf,VerbForm=Inf,15,advcl,_,SpaceAfter=No|XmlId=w_qgraal_cm_57854
10085,"car il estoit a cent doubles plus clers que au comencement, et si douz a ",boivre," que nus ne s'em poïst saouler, ",17,boivre,_,VERB,VERinf,VerbForm=Inf,15,acl,_,XmlId=w_qgraal_cm_57847
10087,Aprés ,resgardoit," li rois Ewalac, ",2,resgardoit,_,VERB,VERcjg,VerbForm=Fin,0,root,_,XmlId=w_qgraal_cm_57870
10094,li niés le roi Mordrain donc le lac issoit ce fu Celydoines li filz Nasciens que Nostre Sires envoia en ceste terre por ,confondre," et por combatre contre les mescreanz, ",24,confondre,_,VERB,VERinf,VerbForm=Inf,19,advcl,_,XmlId=w_qgraal_cm_57982
10112,Cil vousist mielz estre ,morz," qu'il vousist riens fere contre son creator, ",5,morz,_,VERB,VERppe,Tense=Past|VerbForm=Part,0,root,_,XmlId=w_qgraal_cm_58196
10116,li quinz aprés ot non Janaans bons chevaliers et loiax et ,hardiz, plus que nus hom. ,12,hardiz,_,VERB,VERppe,Tense=Past|VerbForm=Part,7,conj,_,XmlId=w_qgraal_cm_58247
10120,et ,vint," maindre en cest païs, ",2,vint,_,VERB,VERcjg,VerbForm=Fin,0,root,_,XmlId=w_qgraal_cm_58281
10122,Si fu si preudons com tu as ,oï,", quant tu trovas a la fontainne le cors de ton ayel. ",8,oï,_,VERB,VERppe,Tense=Past|VerbForm=Part,4,acl,_,SpaceAfter=No|XmlId=w_qgraal_cm_58305
10123,"De celui issi li rois Bans tes peres qui assez fu plus preudons et de sainte vie que maintes genz ne cuiderent, qui ",cuiderent," que le duel de sa terre l'eust mort, ",22,cuiderent,_,VERB,VERcjg,VerbForm=Fin,13,advcl,_,SpaceAfter=No|XmlId=w_qgraal_cm_58340
10123,De celui issi li rois Bans tes peres qui assez fu plus preudons et de sainte vie que maintes genz ne ,cuiderent,", qui cuiderent que le duel de sa terre l'eust mort, ",22,cuiderent,_,VERB,VERcjg,VerbForm=Fin,13,advcl,_,SpaceAfter=No|XmlId=w_qgraal_cm_58340
10124,mes non ,fist,. ,3,fist,_,VERB,VERcjg,VerbForm=Fin,0,root,_,SpaceAfter=No|XmlId=w_qgraal_cm_58356
10126,Si ,mostra, Nostre Sires que il avoit oïe sa proiere. ,2,mostra,_,VERB,VERcjg,VerbForm=Fin,0,root,_,XmlId=w_qgraal_cm_58384
10132,Or ,covient," que je te die qui sont li dui chevalier qui erent en lor compaignie, ",2,covient,_,VERB,VERcjg,VerbForm=Fin,0,root,_,XmlId=w_qgraal_cm_58481
10133,ce est a ,dire, qu'il ert descenduz d'els. ,4,dire,_,VERB,VERinf,VerbForm=Inf,2,xcomp,_,XmlId=w_qgraal_cm_58507
10133,ce ,est, a dire qu'il ert descenduz d'els. ,2,est,_,VERB,VERcjg,VerbForm=Fin,0,root,_,XmlId=w_qgraal_cm_58505
10136,Quant il estoient toz assemblez devant toi il ,disoient, : ,9,disoient,_,VERB,VERcjg,VerbForm=Fin,0,root,_,XmlId=w_qgraal_cm_58542
10137,“ Pere des ciax ,vien," nos visiter, ",5,vien,_,VERB,VERcjg,VerbForm=Fin,0,root,_,XmlId=w_qgraal_cm_58548
10140,En ce qu'il disoient : “ Pere ,vien," nos visiter ” t'acoilloient il en lor compaignie, ",9,vien,_,VERB,VERcjg,VerbForm=Fin,5,ccomp,_,XmlId=w_qgraal_cm_58578
10140,En ce qu'il ,disoient," : “ Pere vien nos visiter ” t'acoilloient il en lor compaignie, ",5,disoient,_,VERB,VERcjg,VerbForm=Fin,2,acl,_,XmlId=w_qgraal_cm_58574
10141,et prioient Nostre Seignor qu'il ,venist," quierre els et toi, por ce qu'il estoient comencement de toi, et racine. ",7,venist,_,VERB,VERcjg,VerbForm=Fin,2,ccomp,_,XmlId=w_qgraal_cm_58595
10142,Par ce qu'il ,distrent, : “ A chascun rendés ce qu'il a deservi ”.´ doiz tu entendre qu'il n'ot onques en aux se droiture non. ,5,distrent,_,VERB,VERcjg,VerbForm=Fin,2,acl,_,XmlId=w_qgraal_cm_58617
10144,ce ,est, de rendre a chascun son droit. ,2,est,_,VERB,VERcjg,VerbForm=Fin,0,root,_,XmlId=w_qgraal_cm_58666
10150,Ce est a ,dire," qu'il le metoit oultre toutes mannieres d'omes terriens, si que nus ne li resemblast ne en fierté ne en pooir. ",4,dire,_,VERB,VERinf,VerbForm=Inf,2,xcomp,_,XmlId=w_qgraal_cm_58786
10150,Ce ,est," a dire qu'il le metoit oultre toutes mannieres d'omes terriens, si que nus ne li resemblast ne en fierté ne en pooir. ",2,est,_,VERB,VERcjg,VerbForm=Fin,0,root,_,XmlId=w_qgraal_cm_58784
10152,et il ,disoit, : ,3,disoit,_,VERB,VERcjg,VerbForm=Fin,0,root,_,XmlId=w_qgraal_cm_58849
10154,Et cil començoit tantost a ,voler,", ",6,voler,_,VERB,VERinf,VerbForm=Inf,3,xcomp,_,SpaceAfter=No|XmlId=w_qgraal_cm_58875
10154,Et cil ,començoit," tantost a voler, ",3,començoit,_,VERB,VERcjg,VerbForm=Fin,0,root,_,XmlId=w_qgraal_cm_58872
10155,si devenoient ses eles si granz et si merveilleuses que touz li monz en ert ,coverz,. ,16,coverz,_,VERB,VERppe,Tense=Past|VerbForm=Part,9,advcl,_,SpaceAfter=No|XmlId=w_qgraal_cm_58892
10155,si ,devenoient, ses eles si granz et si merveilleuses que touz li monz en ert coverz. ,2,devenoient,_,VERB,devenir,VerbForm=Fin,0,root,_,XmlId=w_qgraal_cm_58878
10162,"- Sire, fet Lancelot, ce que vos me dites que li bons chevaliers est mes filz me fet mout ",esbahir,. ,22,esbahir,_,VERB,VERinf,VerbForm=Inf,20,xcomp,_,SpaceAfter=No|XmlId=w_qgraal_cm_59072
10162,"- Sire, ",fet," Lancelot, ce que vos me dites que li bons chevaliers est mes filz me fet mout esbahir. ",4,fet,_,VERB,VERcjg,VerbForm=Fin,20,parataxis,_,XmlId=w_qgraal_cm_59054
10163,"- Tu n'en doiz pas estre esbahiz, ",fet," li preudons, ne merveillier t'en, ",10,fet,_,VERB,VERcjg,VerbForm=Fin,8,parataxis,_,XmlId=w_qgraal_cm_59083
10163,- Tu n'en doiz pas estre ,esbahiz,", fet li preudons, ne merveillier t'en, ",8,esbahiz,_,VERB,VERppe,Tense=Past|VerbForm=Part,0,root,_,SpaceAfter=No|XmlId=w_qgraal_cm_59081
10164,car tu ,sez," bien que la fille le roi Pellés coneus tu charnelment, ",3,sez,_,VERB,VERcjg,VerbForm=Fin,0,root,_,XmlId=w_qgraal_cm_59094
10169,Si le t'ai dit et fet conoistre por ce que je ne ,voloie," pas que tu te preïsses a lui par bataille, ",14,voloie,_,VERB,VERcjg,VerbForm=Fin,10,acl,_,XmlId=w_qgraal_cm_59169
10169,Si le t'ai dit et fet ,conoistre," por ce que je ne voloie pas que tu te preïsses a lui par bataille, ",8,conoistre,_,VERB,VERinf,VerbForm=Inf,5,xcomp,_,XmlId=w_qgraal_cm_59163
10169,Si le t'ai dit et ,fet," conoistre por ce que je ne voloie pas que tu te preïsses a lui par bataille, ",7,fet,_,VERB,VERppe,Tense=Past|VerbForm=Part,5,conj,_,XmlId=w_qgraal_cm_59162
10170,car tu le porroies fere ,pechier," mortelment en toi honir del cors, ",6,pechier,_,VERB,VERinf,VerbForm=Inf,5,xcomp,_,XmlId=w_qgraal_cm_59185
10171,car se tu te prenoies a lui par bataille tu ,sez, bien ,11,sez,_,VERB,VERcjg,VerbForm=Fin,0,root,_,XmlId=w_qgraal_cm_59203
10172,et puez savoir que ce seroit tantost ,alee," chose de toi, puis que nule proesce ne se prent a la soe. ",8,alee,_,VERB,VERppe,Tense=Past|VerbForm=Part,9,acl,_,XmlId=w_qgraal_cm_59212
10172,et puez ,savoir," que ce seroit tantost alee chose de toi, puis que nule proesce ne se prent a la soe. ",3,savoir,_,VERB,VERinf,VerbForm=Inf,0,root,_,XmlId=w_qgraal_cm_59207
10173,"- Sire, ",fet," Lancelot, mout m'est grant confort de ceste chose que vos m'avez dite, ",4,fet,_,VERB,VERcjg,VerbForm=Fin,11,parataxis,_,XmlId=w_qgraal_cm_59231
10174,car il me semble puis que Nostre Sires a soffert que tel fruit est issuz de moi.´ cil qui tant est preudons ne devroit pas ,soffrir," que ses peres quiex qu'il soit alast a perdicion, ",27,soffrir,_,VERB,VERinf,VerbForm=Inf,0,root,_,XmlId=w_qgraal_cm_59274
10174,car il me semble puis que Nostre Sires a ,soffert," que tel fruit est issuz de moi.´ cil qui tant est preudons ne devroit pas soffrir que ses peres quiex qu'il soit alast a perdicion, ",10,soffert,_,VERB,VERppe,Tense=Past|VerbForm=Part,27,advcl,_,XmlId=w_qgraal_cm_59257
10176,"- Je te dirai, ",fet," li preudons, coment il est. ",6,fet,_,VERB,VERcjg,VerbForm=Fin,4,parataxis,_,XmlId=w_qgraal_cm_59317
10184,"- Puis qu'il est einsi, fet Lancelot, que nus fors Jhesucrist ne me puet valoir ne aidier.´ lui pri je qu'il me vaille et ",aït,", et ne me laist chaoir es mains de l'anemi, si que je li puisse rendre le tresor qu'il me demande. Ce est l'ame de moi au jor espovantable qu'il dira as mauvés : ",30,aït,_,VERB,VERcjg,VerbForm=Fin,28,conj,_,SpaceAfter=No|XmlId=w_qgraal_cm_59439
10184,"- Puis qu'il est einsi, fet Lancelot, que nus fors Jhesucrist ne me puet valoir ne ",aidier,".´ lui pri je qu'il me vaille et aït, et ne me laist chaoir es mains de l'anemi, si que je li puisse rendre le tresor qu'il me demande. Ce est l'ame de moi au jor espovantable qu'il dira as mauvés : ",20,aidier,_,VERB,VERinf,VerbForm=Inf,18,conj,_,SpaceAfter=No|XmlId=w_qgraal_cm_59429
10184,"- Puis qu'il est einsi, ",fet," Lancelot, que nus fors Jhesucrist ne me puet valoir ne aidier.´ lui pri je qu'il me vaille et aït, et ne me laist chaoir es mains de l'anemi, si que je li puisse rendre le tresor qu'il me demande. Ce est l'ame de moi au jor espovantable qu'il dira as mauvés : ",8,fet,_,VERB,VERcjg,VerbForm=Fin,23,parataxis,_,XmlId=w_qgraal_cm_59417
10190,Et quant il fu hore de ,mengier, il issirent de la chapele ,7,mengier,_,VERB,VERinf,VerbForm=Inf,5,acl,_,XmlId=w_qgraal_cm_59539
10193,Et quant il orent ,mengié," li preudons fist Lancelot couchier sus l'erbe come cil qui autre lit n'avoit apareillié, ",5,mengié,_,VERB,VERppe,Tense=Past|VerbForm=Part,8,advcl,_,XmlId=w_qgraal_cm_59563
10194,et il se dormi asez bien come cil qui las estoit et ,travailliez,", ",13,travailliez,_,VERB,VERppe,Tense=Past|VerbForm=Part,10,conj,_,SpaceAfter=No|XmlId=w_qgraal_cm_59593
10195,et ne baoit pas tant a la grant aise del monde com il ,soloit,", ",14,soloit,_,VERB,VERcjg,VerbForm=Fin,3,advcl,_,SpaceAfter=No|XmlId=w_qgraal_cm_59608
10196,car s'i i ,baast," il n'i dormist jamés por la terre qui trop ert dure, et por la haire qui ert aspre et poignant aprés la char, ",5,baast,_,VERB,VERcjg,VerbForm=Fin,9,advcl,_,XmlId=w_qgraal_cm_59614
10197,mes il est ore a ce menez que ceste mesese et ceste durté li plest tant et ,embelist," qu'il n'essaia onques mes riens qui tant li pleust, ",18,embelist,_,VERB,VERcjg,VerbForm=Fin,15,conj,_,XmlId=w_qgraal_cm_59658
10201,Et quant li jorz ,aparut, il se leva ,5,aparut,_,VERB,VERcjg,VerbForm=Fin,8,advcl,_,XmlId=w_qgraal_cm_59698
10202,et ,ala, oïr le servise Nostre Seignor. ,2,ala,_,VERB,VERcjg,VerbForm=Fin,0,root,_,XmlId=w_qgraal_cm_59703
10203,Quant li preudons ot ,chanté, si prist Lancelot ses armes ,5,chanté,_,VERB,VERppe,Tense=Past|VerbForm=Part,7,advcl,_,XmlId=w_qgraal_cm_59714
10207,et il dist que si ,feroit," il se Diex li donoit santé, ",6,feroit,_,VERB,VERcjg,VerbForm=Fin,3,ccomp,_,XmlId=w_qgraal_cm_59753
10207,et il ,dist," que si feroit il se Diex li donoit santé, ",3,dist,_,VERB,VERcjg,VerbForm=Fin,0,root,_,XmlId=w_qgraal_cm_59750
10208,si se ,parti, de laienz ,3,parti,_,VERB,VERcjg,VerbForm=Fin,0,root,_,XmlId=w_qgraal_cm_59763
10211,et mout se repentoit des granz max qu'il avoit fet par quoi il estoit departiz et ,gitez," de la haute compaignie qu'il avoit veue en son dormant, ",18,gitez,_,VERB,VERppe,Tense=Past|VerbForm=Part,16,conj,_,XmlId=w_qgraal_cm_59813
10215,et il voit devant lui.i. chastel fort et bien ,seant," avironnez de murs et de fossez, ",11,seant,_,VERB,VERppa,Tense=Pres|VerbForm=Part,8,conj,_,XmlId=w_qgraal_cm_59909
10223,et tant i avoit chevaliers ,abatuz, que ce estoit merveille. ,6,abatuz,_,VERB,VERppe,Tense=Past|VerbForm=Part,5,acl,_,XmlId=w_qgraal_cm_60027
10228,et lesse ,corre," le cheval, ",3,corre,_,VERB,VERinf,VerbForm=Inf,2,xcomp,_,XmlId=w_qgraal_cm_60098
10230,Il ,point, oultre ,2,point,_,VERB,VERcjg,VerbForm=Fin,0,root,_,XmlId=w_qgraal_cm_60119
10238,Car tant sont soffrant et ,endurant," qu'il s'en esbahist touz, ",6,endurant,_,VERB,VERppa,Tense=Pres|VerbForm=Part,4,conj,_,XmlId=w_qgraal_cm_60210
10238,Car tant sont ,soffrant," et endurant qu'il s'en esbahist touz, ",4,soffrant,_,VERB,VERppa,Tense=Pres|VerbForm=Part,0,root,_,XmlId=w_qgraal_cm_60208
10240,et ,maille," ausi come il feïst sus une piece de fust, ",2,maille,_,VERB,VERcjg,VerbForm=Fin,0,root,_,XmlId=w_qgraal_cm_60223
10241,mes cil ne ,font, pas semblant qu'il se sentent des coux qu'il lor done. ,4,font,_,VERB,VERcjg,VerbForm=Fin,0,root,_,XmlId=w_qgraal_cm_60237
10245,ainz est si durement lassez et travailliez qu'il ne ,cuide," jamés avoir pooir de porter armes, ",11,cuide,_,VERB,VERcjg,VerbForm=Fin,4,advcl,_,XmlId=w_qgraal_cm_60290
10245,ainz est si durement lassez et ,travailliez," qu'il ne cuide jamés avoir pooir de porter armes, ",7,travailliez,_,VERB,VERppe,Tense=Past|VerbForm=Part,5,conj,_,XmlId=w_qgraal_cm_60286
10245,ainz est si durement ,lassez," et travailliez qu'il ne cuide jamés avoir pooir de porter armes, ",5,lassez,_,VERB,VERppe,Tense=Past|VerbForm=Part,0,root,_,XmlId=w_qgraal_cm_60284
10249,Et tuit si compaignon furent maintenant ,failli,", qu'il lor failli d'aide, ",7,failli,_,VERB,VERppe,Tense=Past|VerbForm=Part,0,root,_,SpaceAfter=No|XmlId=w_qgraal_cm_60322
