sent_id,left_context,pivot,right_context,ID,FORM,LEMMA,UPOS,XPOS,FEATS,HEAD,DEPREL,DEPS,MISC
4388,"Live du lit, tot ",esfroïz,", ",6,esfroïz,_,VERB,VERppe,Tense=Past|VerbForm=Part,1,acl,_,SpaceAfter=No|XmlId=w_26_05433
4390,"Au tresallir que Tristran fait, Li sans decent (malement ",vait,) De la plaie sor la farine. ,12,vait,_,VERB,VERcjg,VerbForm=Fin,9,parataxis,_,SpaceAfter=No|XmlId=w_26_05454
4393,"Mot grant miracle Deus i out, Quis ",garanti,", si con li plot. ",9,garanti,_,VERB,VERcjg,VerbForm=Fin,3,acl,_,SpaceAfter=No|XmlId=w_26_05511
4396,Tristran faisoit Senblant conme se il ,dormoit, ; ,7,dormoit,_,VERB,VERcjg,VerbForm=Fin,3,ccomp,_,XmlId=w_26_05543
4396,Tristran ,faisoit, Senblant conme se il dormoit ; ,2,faisoit,_,VERB,VERcjg,VerbForm=Fin,0,root,_,XmlId=w_26_05538
4410,Ne ,lairont, justise n'en facent. ,2,lairont,_,VERB,VERcjg,VerbForm=Fin,0,root,_,XmlId=w_26_05663
4413,,Provez," estes, » ",1,Provez,_,VERB,VERppe,Tense=Past|VerbForm=Part,0,root,_,XmlId=w_26_05684
4416,"Certes, Tristran, demain, ce quit, Soiez certains d'estre ",destruit,. » ,14,destruit,_,VERB,VERppe,Tense=Past|VerbForm=Part,11,acl,_,SpaceAfter=No|XmlId=w_26_05715
4419,Li fel ,dïent, : ,3,dïent,_,VERB,VERcjg,VerbForm=Fin,0,root,_,XmlId=w_26_05745
4422,Bien ,sai,", venuz sui a mau saut. ",2,sai,_,VERB,VERcjg,VerbForm=Fin,0,root,_,SpaceAfter=No|XmlId=w_26_05766
4423,"Ne fust por vos a corocier, Cist plez fust ja ",venduz, mot chier ; ,12,venduz,_,VERB,VERppe,Tense=Past|VerbForm=Part,0,root,_,XmlId=w_26_05785
4423,Ne fust por vos a ,corocier,", Cist plez fust ja venduz mot chier ; ",6,corocier,_,VERB,VERinf,VerbForm=Inf,2,xcomp,_,SpaceAfter=No|XmlId=w_26_05779
4430,"« Qar il n'a home en ta meson, Se disoit ceste traïson Que pris eüse drüerie O la roïne par folie, Ne m'en trovast en chanp, ",armé,. ,32,armé,_,VERB,VERppe,Tense=Past|VerbForm=Part,26,acl,_,SpaceAfter=No|XmlId=w_26_05886
4435,"Ja, se Tristran ice seüst Que escondire nul leüst, Mex se laisast vif depecier Que lui ne lié ",soufrist, lïer. ,21,soufrist,_,VERB,VERcjg,VerbForm=Fin,14,advcl,_,XmlId=w_26_05946
4435,"Ja, se Tristran ice seüst Que escondire nul leüst, Mex se laisast vif ",depecier, Que lui ne lié soufrist lïer. ,16,depecier,_,VERB,VERinf,VerbForm=Inf,14,xcomp,_,XmlId=w_26_05941
4435,"Ja, se Tristran ice seüst Que escondire nul ",leüst,", Mex se laisast vif depecier Que lui ne lié soufrist lïer. ",10,leüst,_,VERB,VERcjg,VerbForm=Fin,5,acl,_,SpaceAfter=No|XmlId=w_26_05935
4435,"Ja, se Tristran ice seüst Que ",escondire," nul leüst, Mex se laisast vif depecier Que lui ne lié soufrist lïer. ",8,escondire,_,VERB,VERinf,VerbForm=Inf,10,xcomp,_,XmlId=w_26_05933
4436,"Mais en Deu tant fort se fiot Que bien savoit et bien quidoit, S'a escondit peüst venir, Nus nen osast armes saisir Encontre lui, lever ne ",prendre, : ,31,prendre,_,VERB,VERinf,VerbForm=Inf,25,conj,_,XmlId=w_26_05979
4436,"Mais en Deu tant fort se fiot Que bien savoit et bien quidoit, S'a escondit peüst venir, Nus nen osast armes saisir Encontre lui, ",lever, ne prendre : ,29,lever,_,VERB,VERinf,VerbForm=Inf,25,conj,_,XmlId=w_26_05977
4436,"Mais en Deu tant fort se fiot Que bien savoit et bien quidoit, S'a escondit peüst venir, Nus nen ",osast," armes saisir Encontre lui, lever ne prendre : ",23,osast,_,VERB,VERcjg,VerbForm=Fin,13,ccomp,_,XmlId=w_26_05971
4436,Mais en Deu tant fort se fiot Que bien savoit et bien ,quidoit,", S'a escondit peüst venir, Nus nen osast armes saisir Encontre lui, lever ne prendre : ",13,quidoit,_,VERB,VERcjg,VerbForm=Fin,10,conj,_,SpaceAfter=No|XmlId=w_26_05961
4436,Mais en Deu tant fort se fiot Que bien ,savoit," et bien quidoit, S'a escondit peüst venir, Nus nen osast armes saisir Encontre lui, lever ne prendre : ",10,savoit,_,VERB,VERcjg,VerbForm=Fin,7,advcl,_,XmlId=w_26_05958
4437,Bien se ,quidoit, par chanp defendre. ,3,quidoit,_,VERB,VERcjg,VerbForm=Fin,0,root,_,XmlId=w_26_05983
4443,Li criz live par la cité Qu'endui sont ensenble ,trové, Tristran et la roïne Iseut Et que li rois destruire eus veut. ,11,trové,_,VERB,VERppe,Tense=Past|VerbForm=Part,2,acl,_,XmlId=w_26_06057
4444,,Pleurent," li grant e li petit, ",1,Pleurent,_,VERB,VERcjg,VerbForm=Fin,0,root,_,XmlId=w_26_06071
4446,"« A ! las, tant avon a ",plorer, ! ,9,plorer,_,VERB,VERinf,VerbForm=Inf,7,xcomp,_,XmlId=w_26_06096
4446,"« A ! las, tant ",avon, a plorer ! ,7,avon,_,VERB,VERcjg,VerbForm=Fin,0,root,_,XmlId=w_26_06094
4448,"Ha ! roïne franche, ",honoree,", En qel terre sera mais nee Fille de roi qui ton cors valle ? ",6,honoree,_,VERB,VERppe,Tense=Past|VerbForm=Part,3,acl,_,SpaceAfter=No|XmlId=w_26_06124
4452,"Qant le Morhout prist ja ci port, Qui ça venoit por nos enfanz, Nos barons fist si tost taisanz Que onques n'ot un si hardi Qui s'en ",osast, armer vers lui. ,32,osast,_,VERB,VERcjg,VerbForm=Fin,28,acl:relcl,_,XmlId=w_26_06237
4452,"Qant le Morhout prist ja ci port, Qui ça venoit por nos enfanz, Nos barons fist si tost ",taisanz, Que onques n'ot un si hardi Qui s'en osast armer vers lui. ,21,taisanz,_,VERB,VERppa,Tense=Pres|VerbForm=Part,18,xcomp,_,XmlId=w_26_06226
446,vit la raisun ,escrite, : ,4,escrite,_,VERB,VERppe,Tense=Past|VerbForm=Part,3,acl,_,XmlId=w_58_04356
45,De noz ostages ,ferat, trecher les testes. ,4,ferat,_,VERB,VERcjg,VerbForm=Fin,0,root,_,XmlId=w_58_00495
454,Tant ad erret nen est dreiz que plus ,vivet,. ,9,vivet,_,VERB,VERcjg,VerbForm=Fin,6,csubj,_,SpaceAfter=No|XmlId=w_58_04448
454,Tant ad ,erret, nen est dreiz que plus vivet. ,3,erret,_,VERB,VERppe,Tense=Past|VerbForm=Part,0,root,_,XmlId=w_58_04442
462,,Dist, Blancandrins : ,1,Dist,_,VERB,VERcjg,VerbForm=Fin,0,root,_,XmlId=w_58_04531
47,,Dient, paien : ,1,Dient,_,VERB,VERcjg,VerbForm=Fin,0,root,_,XmlId=w_58_00529
470,"« Bel sire Guenes, ço li ad dit Marsilie, Jo vos ai fait alques de legerie, Quant por ",ferir, vus demustrai grant ire. ,22,ferir,_,VERB,VERinf,VerbForm=Inf,24,advcl,_,XmlId=w_58_04614
472,Melz en valt l'or que ne ,funt, cinc cenz livres ; ,8,funt,_,VERB,VERcjg,VerbForm=Fin,1,acl,_,XmlId=w_58_04636
474,Guenes ,respunt, : ,2,respunt,_,VERB,VERcjg,VerbForm=Fin,0,root,_,XmlId=w_58_04652
486,Quant ert il mais recreanz d',osteier, ? » ,7,osteier,_,VERB,VERinf,VerbForm=Inf,5,xcomp,_,XmlId=w_58_04752
486,Quant ert il mais ,recreanz, d'osteier ? » ,5,recreanz,_,VERB,VERppa,Tense=Pres|VerbForm=Part,0,root,_,XmlId=w_58_04750
487,Guenes ,respunt, : ,2,respunt,_,VERB,VERcjg,VerbForm=Fin,0,root,_,XmlId=w_58_04756
489,N'est hom kil ,veit, e conuistre le set Que ço ne diet que l'emperere est ber. ,5,veit,_,VERB,VERcjg,VerbForm=Fin,3,acl,_,XmlId=w_58_04769
489,N',est, hom kil veit e conuistre le set Que ço ne diet que l'emperere est ber. ,2,est,_,VERB,VERcjg,VerbForm=Fin,0,root,_,XmlId=w_58_04766
490,Tant nel vos sai ne preiser ne ,loer, Que plus n'i ad d'onur e de bontet. ,8,loer,_,VERB,VERinf,VerbForm=Inf,6,conj,_,XmlId=w_58_04791
491,"Sa grant valor, kil purreit ",acunter, ? ,7,acunter,_,VERB,VERinf,VerbForm=Inf,0,root,_,XmlId=w_58_04809
492,De tel barnage l'ad Deus enluminet Meilz voelt ,murir, que guerpir sun barnet. » ,10,murir,_,VERB,VERinf,VerbForm=Inf,3,acl,_,XmlId=w_58_04820
493,,Dist, li paiens : ,1,Dist,_,VERB,VERcjg,VerbForm=Fin,0,root,_,XmlId=w_58_04827
497,"Tanz cols ad pris de lances e d'espiez, Tanz riches reis ",cunduiz, a mendistiet ! ,14,cunduiz,_,VERB,VERppe,Tense=Past|VerbForm=Part,4,conj,_,XmlId=w_58_04875
498,Quant ert il mais recreanz d',osteier, ? ,7,osteier,_,VERB,VERinf,VerbForm=Inf,5,xcomp,_,XmlId=w_58_04885
498,Quant ert il mais ,recreanz, d'osteier ? ,5,recreanz,_,VERB,VERppa,Tense=Pres|VerbForm=Part,0,root,_,XmlId=w_58_04883
499,"- Ço n'iert, dist Guenes, tant cum ",vivet, sis niés : ,11,vivet,_,VERB,VERcjg,VerbForm=Fin,4,advcl,_,XmlId=w_58_04897
499,"- Ço n'iert, ",dist," Guenes, tant cum vivet sis niés : ",6,dist,_,VERB,VERcjg,VerbForm=Fin,4,parataxis,_,XmlId=w_58_04892
499,- Ço n',iert,", dist Guenes, tant cum vivet sis niés : ",4,iert,_,VERB,VERcjg,VerbForm=Fin,0,root,_,SpaceAfter=No|XmlId=w_58_04890
504,,Dist, li Sarrazins : ,1,Dist,_,VERB,VERcjg,VerbForm=Fin,0,root,_,XmlId=w_58_04951
507,Par tantes teres est alet ,cunquerant,", ",6,cunquerant,_,VERB,VERppa,Tense=Pres|VerbForm=Part,5,xcomp,_,SpaceAfter=No|XmlId=w_58_04983
508,"Tanz colps ad pris de bons espiez trenchanz, Tanz riches reis morz e ",vencuz, en champ ! ,15,vencuz,_,VERB,VERppe,Tense=Past|VerbForm=Part,4,conj,_,XmlId=w_58_04999
508,"Tanz colps ad pris de bons espiez trenchanz, Tanz riches reis ",morz, e vencuz en champ ! ,13,morz,_,VERB,VERppe,Tense=Past|VerbForm=Part,4,conj,_,XmlId=w_58_04997
508,Tanz colps ad pris de bons espiez ,trenchanz,", Tanz riches reis morz e vencuz en champ ! ",8,trenchanz,_,VERB,VERppa,Tense=Pres|VerbForm=Part,7,amod,_,SpaceAfter=No|XmlId=w_58_04992
509,Quant ier il mais d'osteier ,recreant, ? ,7,recreant,_,VERB,VERppa,Tense=Pres|VerbForm=Part,0,root,_,XmlId=w_58_05009
509,Quant ier il mais d',osteier, recreant ? ,6,osteier,_,VERB,VERinf,VerbForm=Inf,7,xcomp,_,XmlId=w_58_05008
510,"- Ço n'iert, dist Guenes, tant cum ",vivet, Rollant : ,11,vivet,_,VERB,VERcjg,VerbForm=Fin,4,advcl,_,XmlId=w_58_05021
510,"- Ço n'iert, ",dist," Guenes, tant cum vivet Rollant : ",6,dist,_,VERB,VERcjg,VerbForm=Fin,4,parataxis,_,XmlId=w_58_05016
510,- Ço n',iert,", dist Guenes, tant cum vivet Rollant : ",4,iert,_,VERB,VERcjg,VerbForm=Fin,0,root,_,SpaceAfter=No|XmlId=w_58_05014
514,"Soürs est Carles, ne crent hume ",vivant,. » ,8,vivant,_,VERB,VERppa,Tense=Pres|VerbForm=Part,7,amod,_,SpaceAfter=No|XmlId=w_58_05068
515,"« Bel sire Guenes, ",dist," Marsilies li reis, Jo ai tel gent, plus bele ne verreiz ; ",6,dist,_,VERB,VERcjg,VerbForm=Fin,12,parataxis,_,XmlId=w_58_05078
518,Guenes ,respunt, : ,2,respunt,_,VERB,VERcjg,VerbForm=Fin,0,root,_,XmlId=w_58_05112
526,"Mort sunt li cunte, se ",est, ki mei en creit. ,7,est,_,VERB,VERcjg,VerbForm=Fin,1,advcl,_,XmlId=w_58_05204
526,,Mort," sunt li cunte, se est ki mei en creit. ",1,Mort,_,VERB,VERppe,Tense=Past|VerbForm=Part,0,root,_,XmlId=w_58_05198
527,Carlles verrat sun grant orguill ,cadeir, ; ,6,cadeir,_,VERB,VERinf,VerbForm=Inf,2,xcomp,_,XmlId=w_58_05215
530,Guenes ,respont, : ,2,respont,_,VERB,VERcjg,VerbForm=Fin,0,root,_,XmlId=w_58_05241
538,La gent de France iert blecee e ,blesmie, ; ,8,blesmie,_,VERB,VERppe,Tense=Past|VerbForm=Part,6,conj,_,XmlId=w_58_05320
538,La gent de France iert ,blecee, e blesmie ; ,6,blecee,_,VERB,VERppe,Tense=Past|VerbForm=Part,0,root,_,XmlId=w_58_05318
539,"Nel di por ço, des voz ",iert, la martirie. ,8,iert,_,VERB,VERcjg,VerbForm=Fin,2,dislocated,_,XmlId=w_58_05329
541,De quel que ,seit,", Rollant n'estuertrat mie. ",4,seit,_,VERB,VERcjg,VerbForm=Fin,2,acl,_,SpaceAfter=No|XmlId=w_58_05343
544,Chi purreit faire que Rollant i fust ,mort,", ",8,mort,_,VERB,VERppe,Tense=Past|VerbForm=Part,3,ccomp,_,SpaceAfter=No|XmlId=w_58_05374
544,Chi purreit ,faire," que Rollant i fust mort, ",3,faire,_,VERB,VERinf,VerbForm=Inf,0,root,_,XmlId=w_58_05369
546,Si ,remeindreient, les merveilluses oz ; ,2,remeindreient,_,VERB,VERcjg,VerbForm=Fin,0,root,_,XmlId=w_58_05386
550,Puis si ,cumencet, a venir ses tresors. ,3,cumencet,_,VERB,VERcjg,VerbForm=Fin,0,root,_,XmlId=w_58_05420
558,Marsilies ,fait, porter un livre avant : ,2,fait,_,VERB,VERcjg,VerbForm=Fin,0,root,_,XmlId=w_58_05490
562,"E, se il poet, ",murrat, i veirement. ,7,murrat,_,VERB,VERcjg,VerbForm=Fin,0,root,_,XmlId=w_58_05531
562,"E, se il ",poet,", murrat i veirement. ",5,poet,_,VERB,VERcjg,VerbForm=Fin,7,advcl,_,SpaceAfter=No|XmlId=w_58_05529
563,Guenes ,respunt, : ,2,respunt,_,VERB,VERcjg,VerbForm=Fin,0,root,_,XmlId=w_58_05536
567,Cler en ,riant, l'ad dit a Guenelun : ,3,riant,_,VERB,VERppa,Tense=Pres|VerbForm=Part,6,acl,_,XmlId=w_58_05564
57,,Dient, paien : ,1,Dient,_,VERB,VERcjg,VerbForm=Fin,0,root,_,XmlId=w_58_00654
572,- Ben serat ,fait,", ",4,fait,_,VERB,VERppe,Tense=Past|VerbForm=Part,0,root,_,SpaceAfter=No|XmlId=w_58_05620
573,li quens Guenes ,respunt, ; ,4,respunt,_,VERB,VERcjg,VerbForm=Fin,0,root,_,XmlId=w_58_05625
576,Cler en ,riant, a Guenelun l'ad dit : ,3,riant,_,VERB,VERppa,Tense=Pres|VerbForm=Part,8,acl,_,XmlId=w_58_05646
581,- Ben serat ,fait," », ",4,fait,_,VERB,VERppe,Tense=Past|VerbForm=Part,0,root,_,XmlId=w_58_05681
582,Guenes ,respundit, ; ,2,respundit,_,VERB,VERcjg,VerbForm=Fin,0,root,_,XmlId=w_58_05685
595,"« L'aveir Carlun, est il ",apareilliez, ? » ,8,apareilliez,_,VERB,VERppe,Tense=Past|VerbForm=Part,0,root,_,XmlId=w_58_05793
596,E cil ,respunt, : ,3,respunt,_,VERB,VERcjg,VerbForm=Fin,0,root,_,XmlId=w_58_05798
602,Ja mais n',iert, an altretel ne vos face. ,4,iert,_,VERB,VERcjg,VerbForm=Fin,0,root,_,XmlId=w_58_05889
607,Guenes ,respunt, : ,2,respunt,_,VERB,VERcjg,VerbForm=Fin,0,root,_,XmlId=w_58_05937
608,« Mei est vis que trop ,targe, ! » ,7,targe,_,VERB,VERcjg,VerbForm=Fin,4,csubj,_,XmlId=w_58_05945
609,"Pois est munted, ",entret, en sun veiage. ,5,entret,_,VERB,VERcjg,VerbForm=Fin,3,conj,_,XmlId=w_58_05952
612,"Li quens Rollant, il l'ad e prise e ",fraite, ; ,11,fraite,_,VERB,VERppe,Tense=Past|VerbForm=Part,9,conj,_,XmlId=w_58_05984
615,"Par main en l'albe, si cum li jurz ",esclairet,", Guenes li quens est venuz as herberges. ",11,esclairet,_,VERB,VERcjg,VerbForm=Fin,17,advcl,_,SpaceAfter=No|XmlId=w_58_06021
621,Par grant veisdie cumencet a ,parler, ,6,parler,_,VERB,VERinf,VerbForm=Inf,4,xcomp,_,XmlId=w_58_06088
625,Mult grant aveir vos en ,faz," amener E.XX. hostages, ",6,faz,_,VERB,VERcjg,VerbForm=Fin,0,root,_,XmlId=w_58_06113
626,,faites," les ben guarder, ",1,faites,_,VERB,VERcjg,VerbForm=Fin,0,root,_,XmlId=w_58_06119
628,"Kar a mes oilz vi.IIII. C. milie armez, Halbers vestuz, alquanz healmes fermez, ",Ceintes," espees as punz d'or neielez, Ki l'en conduistrent tresqu'en la mer : ",18,Ceintes,_,VERB,VERppe,Tense=Past|VerbForm=Part,19,acl,_,XmlId=w_58_06156
628,"Kar a mes oilz vi.IIII. C. milie armez, Halbers vestuz, alquanz healmes ",fermez,", Ceintes espees as punz d'or neielez, Ki l'en conduistrent tresqu'en la mer : ",16,fermez,_,VERB,VERppe,Tense=Past|VerbForm=Part,15,acl,_,SpaceAfter=No|XmlId=w_58_06154
628,Kar a mes oilz vi.IIII. C. milie ,armez,", Halbers vestuz, alquanz healmes fermez, Ceintes espees as punz d'or neielez, Ki l'en conduistrent tresqu'en la mer : ",9,armez,_,VERB,VERppe,Tense=Past|VerbForm=Part,8,acl,_,SpaceAfter=No|XmlId=w_58_06147
629,De Marcilie s'en fuient por la chrestïentet Que il ne voelent ne tenir ne ,guarder,. ,16,guarder,_,VERB,VERinf,VerbForm=Inf,14,conj,_,SpaceAfter=No|XmlId=w_58_06188
631,La sunt ,neiez,", ",3,neiez,_,VERB,VERppe,Tense=Past|VerbForm=Part,0,root,_,SpaceAfter=No|XmlId=w_58_06207
632,jamais nes en ,verrez, ; ,4,verrez,_,VERB,VERcjg,VerbForm=Fin,0,root,_,XmlId=w_58_06212
64,Ja einz ne verrat ,passer," cest premer meis Que jel sivrai od mil de mes fedeilz, ",5,passer,_,VERB,VERinf,VerbForm=Inf,4,xcomp,_,XmlId=w_58_00717
68,,Dist, Blancandrins : ,1,Dist,_,VERB,VERcjg,VerbForm=Fin,0,root,_,XmlId=w_58_00756
7,Nes poet ,guarder, que mals ne l'i ateignet. ,3,guarder,_,VERB,VERinf,VerbForm=Inf,0,root,_,XmlId=w_58_00074
70,Dis blanches mules ,fist," amener Marsilies, Que li tramist li reis de Suatilie. ",4,fist,_,VERB,VERcjg,VerbForm=Fin,0,root,_,XmlId=w_58_00772
72,Cil sunt ,muntez, ki le message firent ; ,3,muntez,_,VERB,VERppe,Tense=Past|VerbForm=Part,0,root,_,XmlId=w_58_00798
75,Nes poet ,guarder, que alques ne l'engignent. ,3,guarder,_,VERB,VERinf,VerbForm=Inf,0,root,_,XmlId=w_58_00825
77,Cordres ad prise e les murs ,peceiez,", ",7,peceiez,_,VERB,VERppe,Tense=Past|VerbForm=Part,3,conj,_,SpaceAfter=No|XmlId=w_58_00849
80,En la citet nen ad remés paien Ne seit ocis u ,devient, chrestïen. ,12,devient,_,VERB,devenir,VerbForm=Fin,10,conj,_,XmlId=w_58_00887
80,En la citet nen ad remés paien Ne seit ,ocis, u devient chrestïen. ,10,ocis,_,VERB,VERppe,Tense=Past|VerbForm=Part,7,acl,_,XmlId=w_58_00885
83,La u cist ,furent,", des altres i out bien : ",4,furent,_,VERB,VERcjg,VerbForm=Fin,9,advcl,_,SpaceAfter=No|XmlId=w_58_00933
8603,et il ,dient, : ,3,dient,_,VERB,VERcjg,VerbForm=Fin,0,root,_,XmlId=w_qgraal_cm_1538
8604,Car il ont toz jorz esté sainz et ,haitiez,. ,9,haitiez,_,VERB,VERppe,Tense=Past|VerbForm=Part,7,conj,_,SpaceAfter=No|XmlId=w_qgraal_cm_1554
8605,"« Certes, ",fet," mes sires Gauvains, ce me plest mout. » ",4,fet,_,VERB,VERcjg,VerbForm=Fin,11,parataxis,_,XmlId=w_qgraal_cm_1559
8607,et li rois comande que les tables soient ,mises,", ",9,mises,_,VERB,VERppe,Tense=Past|VerbForm=Part,4,ccomp,_,SpaceAfter=No|XmlId=w_qgraal_cm_1603
8607,et li rois ,comande," que les tables soient mises, ",4,comande,_,VERB,VERcjg,VerbForm=Fin,0,root,_,XmlId=w_qgraal_cm_1598
8608,car il est tens de ,mengier, ,6,mengier,_,VERB,VERinf,VerbForm=Inf,4,acl,_,XmlId=w_qgraal_cm_1610
8610,"« Sire, ",fait," Keus li seneschaux, se vos asseez ja au disner il m'est avis que vos enfraindroiz la costume de ceainz, ",4,fait,_,VERB,VERcjg,VerbForm=Fin,18,parataxis,_,XmlId=w_qgraal_cm_1619
8611,car nos avons veu toz jorz que vos a haute feste n'asseiez a table devant que aucune aventure fust en vostre cort avenue ,voiant, toz les barons de vostre ostel. ,25,voiant,_,VERB,VERppa,Tense=Pres|VerbForm=Part,13,advcl,_,XmlId=w_qgraal_cm_1666
8612,"- Certes, ",fet," li rois, Keus, vos dites voir, ",4,fet,_,VERB,VERcjg,VerbForm=Fin,11,parataxis,_,XmlId=w_qgraal_cm_1677
8614,et la tendrai tant com je ,porrai,", ",7,porrai,_,VERB,VERcjg,VerbForm=Fin,3,advcl,_,SpaceAfter=No|XmlId=w_qgraal_cm_1700
8615,mes je avoie si grant joie de Lancelot et de ses cousins qui estoient venu a cort sain et ,haitié, qu'il ne me sovenoit de la costume. ,20,haitié,_,VERB,VERppe,Tense=Past|VerbForm=Part,18,conj,_,XmlId=w_qgraal_cm_1721
8617,,fet, Keus. ,1,fet,_,VERB,VERcjg,VerbForm=Fin,0,root,_,XmlId=w_qgraal_cm_1738
8618,Endementres qu'il parloient einsi si ,entra, laienz uns vaslez qui dist au roi : ,7,entra,_,VERB,VERcjg,VerbForm=Fin,0,root,_,XmlId=w_qgraal_cm_1747
8618,Endementres qu'il ,parloient, einsi si entra laienz uns vaslez qui dist au roi : ,4,parloient,_,VERB,VERcjg,VerbForm=Fin,7,advcl,_,XmlId=w_qgraal_cm_1744
8620,,fet, li rois. ,1,fet,_,VERB,VERcjg,VerbForm=Fin,0,root,_,XmlId=w_qgraal_cm_1767
8623,,Venez," le veoir, ",1,Venez,_,VERB,VERcjg,VerbForm=Fin,0,root,_,XmlId=w_qgraal_cm_1797
8624,car je ,sai, bien que ce est aventure merveilleuse. » ,3,sai,_,VERB,VERcjg,VerbForm=Fin,0,root,_,XmlId=w_qgraal_cm_1803
8625,Et li rois ,descent," maintenant por ceste aventure veoir, ",4,descent,_,VERB,VERcjg,VerbForm=Fin,0,root,_,XmlId=w_qgraal_cm_1815
8626,et si ,font," tuit li autre, ",3,font,_,VERB,VERcjg,VerbForm=Fin,0,root,_,XmlId=w_qgraal_cm_1824
8627,et quant il sont venuz a la rive si troevent le perron qui estoit venuz a rive et ,issuz," hors de l'eve, ",19,issuz,_,VERB,VERppe,Tense=Past|VerbForm=Part,15,conj,_,XmlId=w_qgraal_cm_1847
8631,et li baron resgardoient les letres qui ,disoient, : ,8,disoient,_,VERB,VERcjg,VerbForm=Fin,6,acl:relcl,_,XmlId=w_qgraal_cm_1899
8636,car je ,sai, bien que vos estes li mieldres chevaliers dou monde. » ,3,sai,_,VERB,VERcjg,VerbForm=Fin,0,root,_,XmlId=w_qgraal_cm_1953
8637,Et il respont toz ,corrouciez, : ,5,corrouciez,_,VERB,VERppe,Tense=Past|VerbForm=Part,2,acl,_,XmlId=w_qgraal_cm_1969
8637,Et il ,respont, toz corrouciez : ,3,respont,_,VERB,VERcjg,VerbForm=Fin,0,root,_,XmlId=w_qgraal_cm_1967
8640,car je ne sui mie dignes ne ,soffisanz," que je la doie prendre, ",8,soffisanz,_,VERB,VERppa,Tense=Pres|VerbForm=Part,6,conj,_,XmlId=w_qgraal_cm_2000
8643,car ce seroit folie se je ,tendoie, a avoir la. ,7,tendoie,_,VERB,VERcjg,VerbForm=Fin,4,advcl,_,XmlId=w_qgraal_cm_2028
8644,"- Toutes voies, ",fet," li rois, i essaierez vos se vos la porriez oster. ",5,fet,_,VERB,VERcjg,VerbForm=Fin,10,parataxis,_,XmlId=w_qgraal_cm_2037
8645,"- Sire, fet il, non ",ferai,. ,8,ferai,_,VERB,VERcjg,VerbForm=Fin,0,root,_,SpaceAfter=No|XmlId=w_qgraal_cm_2057
8645,"- Sire, ",fet," il, non ferai. ",4,fet,_,VERB,VERcjg,VerbForm=Fin,8,parataxis,_,XmlId=w_qgraal_cm_2053
8646,Car je sai bien que nus n'i ,essaiera, ja por quoi il i faille qu'il n'en reçoive plaie. ,9,essaiera,_,VERB,VERcjg,VerbForm=Fin,3,ccomp,_,XmlId=w_qgraal_cm_2067
8646,Car je ,sai, bien que nus n'i essaiera ja por quoi il i faille qu'il n'en reçoive plaie. ,3,sai,_,VERB,VERcjg,VerbForm=Fin,0,root,_,XmlId=w_qgraal_cm_2061
8648,,fet, li rois. ,1,fet,_,VERB,VERcjg,VerbForm=Fin,0,root,_,XmlId=w_qgraal_cm_2087
8649,"- Sire, ",fait," il, je le sai bien, ",4,fait,_,VERB,VERcjg,VerbForm=Fin,9,parataxis,_,XmlId=w_qgraal_cm_2094
8651,car je voil que vos ,sachiez, qu'en cest jor d'ui comenceront les granz aventures et les granz merveilles dou saint Graal. » ,6,sachiez,_,VERB,VERcjg,VerbForm=Fin,3,ccomp,_,XmlId=w_qgraal_cm_2115
8651,car je ,voil, que vos sachiez qu'en cest jor d'ui comenceront les granz aventures et les granz merveilles dou saint Graal. » ,3,voil,_,VERB,VERcjg,VerbForm=Fin,0,root,_,XmlId=w_qgraal_cm_2112
8652,Quant li rois ot que Lancelot n'en ,fera, plus si dist a mon seignor Gauvain : ,9,fera,_,VERB,VERcjg,VerbForm=Fin,4,ccomp,_,XmlId=w_qgraal_cm_2143
8652,Quant li rois ,ot, que Lancelot n'en fera plus si dist a mon seignor Gauvain : ,4,ot,_,VERB,VERcjg,VerbForm=Fin,12,advcl,_,XmlId=w_qgraal_cm_2138
8654,"- Sire, ",fait," il, sauve vostre grace non feré, puis que mes sires Lancelot n'i velt essaier ",4,fait,_,VERB,VERcjg,VerbForm=Fin,11,parataxis,_,XmlId=w_qgraal_cm_2161
8657,"- Toute voies, ",fait," li rois, i essaieroiz vos por ce que je le voil. Ne mie por l'espee avoir. » ",5,fait,_,VERB,VERcjg,VerbForm=Fin,10,parataxis,_,XmlId=w_qgraal_cm_2205
8660,et ,sache,", ",2,sache,_,VERB,VERcjg,VerbForm=Fin,0,root,_,SpaceAfter=No|XmlId=w_qgraal_cm_2241
8663,« Biaux niés lessiez ,ester,", ",5,ester,_,VERB,VERinf,VerbForm=Inf,4,xcomp,_,SpaceAfter=No|XmlId=w_qgraal_cm_2262
8663,« Biaux niés ,lessiez," ester, ",4,lessiez,_,VERB,VERcjg,VerbForm=Fin,0,root,_,XmlId=w_qgraal_cm_2261
8665,"- Mes sires Gauvains, fet Lancelot, or ",sachiez, que ceste espee vos touchera encore si de pres que vos ne la voldriez avoir bailliee por un chastel. ,10,sachiez,_,VERB,VERcjg,VerbForm=Fin,0,root,_,XmlId=w_qgraal_cm_2280
8665,"- Mes sires Gauvains, ",fet," Lancelot, or sachiez que ceste espee vos touchera encore si de pres que vos ne la voldriez avoir bailliee por un chastel. ",6,fet,_,VERB,VERcjg,VerbForm=Fin,10,parataxis,_,XmlId=w_qgraal_cm_2276
8666,"- Sire, fet mes sires Gauvains, je n'en ",poi, mes. ,12,poi,_,VERB,VERcjg,VerbForm=Fin,0,root,_,XmlId=w_qgraal_cm_2312
8666,"- Sire, ",fet," mes sires Gauvains, je n'en poi mes. ",4,fet,_,VERB,VERcjg,VerbForm=Fin,12,parataxis,_,XmlId=w_qgraal_cm_2304
8667,Se je en deusse orendroit ,morir, si le feïsse je por la volenté mon seignor acomplir. » ,6,morir,_,VERB,VERinf,VerbForm=Inf,9,advcl,_,XmlId=w_qgraal_cm_2320
8670,et il dist que si ,fera, il volentiers por fere a mon seignor Gauvain compaignie. ,6,fera,_,VERB,VERcjg,VerbForm=Fin,3,ccomp,_,XmlId=w_qgraal_cm_2369
8670,et il ,dist, que si fera il volentiers por fere a mon seignor Gauvain compaignie. ,3,dist,_,VERB,VERcjg,VerbForm=Fin,0,root,_,XmlId=w_qgraal_cm_2366
8672,et ,tret,", ",2,tret,_,VERB,VERcjg,VerbForm=Fin,0,root,_,SpaceAfter=No|XmlId=w_qgraal_cm_2388
8674,et lors ,croient," bien tuit cil de la place que Lancelot die voir, et les letres dou pont que il soient veraies. ",3,croient,_,VERB,VERcjg,VerbForm=Fin,0,root,_,XmlId=w_qgraal_cm_2399
8675,Si n'i a mes si hardi qui main i ,osast," metre, ",11,osast,_,VERB,VERcjg,VerbForm=Fin,7,acl:relcl,_,XmlId=w_qgraal_cm_2431
8675,Si n'i a mes si ,hardi," qui main i osast metre, ",7,hardi,_,VERB,VERppe,Tense=Past|VerbForm=Part,4,obl,_,XmlId=w_qgraal_cm_2427
8678,car a aventure n'avez vos pas failli devant ,mengier, ,10,mengier,_,VERB,VERinf,VerbForm=Inf,8,advcl,_,XmlId=w_qgraal_cm_2468
8680,- ,Alons," donc, ",2,Alons,_,VERB,VERcjg,VerbForm=Fin,0,root,_,XmlId=w_qgraal_cm_2474
8681,,fet," li rois, ",1,fet,_,VERB,VERcjg,VerbForm=Fin,0,root,_,XmlId=w_qgraal_cm_2477
8685,et li rois ,fet, l'eve corner ,4,fet,_,VERB,VERcjg,VerbForm=Fin,0,root,_,XmlId=w_qgraal_cm_2508
8688,Celui jor servirent laienz.iiii. roi tuit ,coronné,", et avec aux tant de hauz homes que a merveilles les poïst l'en tenir. ",8,coronné,_,VERB,VERppe,Tense=Past|VerbForm=Part,6,acl,_,SpaceAfter=No|XmlId=w_qgraal_cm_2541
8691,Si avint einsint quant il se furent tuit assis par laienz qu'il troverent que tuit li compaignon de la table reonde furent ,venu,", et li siege empli, fors solement cil que l'en apeloit siege perilleux. ",24,venu,_,VERB,VERppe,Tense=Past|VerbForm=Part,14,ccomp,_,SpaceAfter=No|XmlId=w_qgraal_cm_2606
8691,Si avint einsint quant il se furent tuit assis par laienz qu'il ,troverent," que tuit li compaignon de la table reonde furent venu, et li siege empli, fors solement cil que l'en apeloit siege perilleux. ",14,troverent,_,VERB,VERcjg,VerbForm=Fin,2,ccomp,_,XmlId=w_qgraal_cm_2596
8691,Si ,avint," einsint quant il se furent tuit assis par laienz qu'il troverent que tuit li compaignon de la table reonde furent venu, et li siege empli, fors solement cil que l'en apeloit siege perilleux. ",2,avint,_,VERB,VERcjg,VerbForm=Fin,0,root,_,XmlId=w_qgraal_cm_2584
8695,et li rois Artus qui premiers parla ,dist, : ,8,dist,_,VERB,VERcjg,VerbForm=Fin,0,root,_,XmlId=w_qgraal_cm_2690
8695,et li rois Artus qui premiers ,parla, dist : ,7,parla,_,VERB,VERcjg,VerbForm=Fin,3,acl:relcl,_,XmlId=w_qgraal_cm_2689
8697,mes je cuit que nos les verrons encor anuit greignors que cestes ne ,sont,. » ,14,sont,_,VERB,VERcjg,VerbForm=Fin,10,acl,_,SpaceAfter=No|XmlId=w_qgraal_cm_2722
8697,mes je ,cuit, que nos les verrons encor anuit greignors que cestes ne sont. » ,3,cuit,_,VERB,VERcjg,VerbForm=Fin,0,root,_,XmlId=w_qgraal_cm_2711
8698,Endementres que li rois parloit einsi si ,entra," laienz.i. preudom a une blanche robe vielz et anciens, ",8,entra,_,VERB,VERcjg,VerbForm=Fin,0,root,_,XmlId=w_qgraal_cm_2732
