sent_id,left_context,pivot,right_context
FQB_TREC-fr-1818,Où Golda Meir a-t-elle ,grandi, ? 
FQB_TREC-fr-1819,Quand Marilyn Monroe s'est-elle ,suicidée, ? 
FQB_TREC-fr-1820,Quand ,est, l'indépendance du Mexique ? 
FQB_TREC-fr-1824,Le vaisseau Magellan a permis aux scientifiques de faire des recherches ,approfondies, sur quelle planète ? 
FQB_TREC-fr-1824,Le vaisseau Magellan a ,permis, aux scientifiques de faire des recherches approfondies sur quelle planète ? 
FQB_TREC-fr-1825,En quelle année est ,paru, le Nintendo 64 ? 
FQB_TREC-fr-1827,Où s'est ,déroulée, la bataille de l'Alamo ? 
FQB_TREC-fr-1830,Dans quelle ville se ,termine, le tour de France ? 
FQB_TREC-fr-1835,Qui était l'ennemi ,juré, de Sherlock Holmes ? 
FQB_TREC-fr-1837,En quelle année fut ,construit," Ebbets Field, chef-lieu des Dodgers de Brooklyn ? "
FQB_TREC-fr-1839,Quel pays fut ,formé, en 1948 ? 
FQB_TREC-fr-1841,Quelle est la dernière strophe du poème d'Edgar Allen Poe ,intitulé," ""The Raven"" ? "
FQB_TREC-fr-1843,Pendant quel mois ,naissent, le plus de bébés ? 
FQB_TREC-fr-1845,Dans quelle province se ,trouve, Calgary ? 
FQB_TREC-fr-1852,Quand Henri VIII a-t-il ,régné, sur l'Angleterre ? 
FQB_TREC-fr-1853,Où se ,trouvait, la prison Andersonville ? 
FQB_TREC-fr-1854,Quelle était la profession de William Shakespeare avant que il ne ,commence, à composer des pièces de théâtre ? 
FQB_TREC-fr-1855,À quelle vitesse ,tourne, la Terre ? 
FQB_TREC-fr-1856,Quelle ville est ,connue, comme étant la capitale du caoutchouc ? 
FQB_TREC-fr-1858-imp,Dites-moi où est ,située, la compagnie DuPont. 
FQB_TREC-fr-1860,À quelle comédie musicale de Broadway ,appartient," la chanson ""The Story is Me"" ? "
FQB_TREC-fr-1861,Où est ,né, Bill Gates ? 
FQB_TREC-fr-1864,Quel était le nom du premier enfant de parents anglais à être ,né, en Amérique ? 
FQB_TREC-fr-1866,Quelle partie de l'oeil continue à ,grandir, au cours de la vie d'une personne ? 
FQB_TREC-fr-1866,Quelle partie de l'oeil ,continue, à grandir au cours de la vie d'une personne ? 
FQB_TREC-fr-1867,Dans quelle ville italienne se ,trouve," la cathédrale Santa Maria del Fiore, ou le Duomo ? "
FQB_TREC-fr-1868,Quelle capitale se ,trouve, sur le fleuve Susquehanna ? 
FQB_TREC-fr-1870,Dans quel pays se ,trouve, Pretoria ? 
FQB_TREC-fr-1872,Comment est ,morte, Eva Peron ? 
FQB_TREC-fr-1875,Dans quel comté se ,trouve," Saint-Paul, au Minnesota ? "
FQB_TREC-fr-1876,À quelle distance de la Terre se ,trouve, le Soleil ? 
FQB_TREC-fr-1878,En quelle année fut ,inventé, le phonographe ? 
FQB_TREC-fr-1879,Sous quel surnom le musicien Ernesto Antonio Puente Junior était-il mieux ,connu, ? 
FQB_TREC-fr-1880,Quand est ,né, le roi Louis XIV ? 
FQB_TREC-fr-1881,Quel est le nom scientifique de la plante ,nommée," ""zinnia"" ? "
FQB_TREC-fr-1883,Quelle portion de la couche d'ozone est ,appauvrie, ? 
FQB_TREC-fr-1884,Où se ,trouve, la mer de la Tranquillité ? 
FQB_TREC-fr-1888,En quelle année fut ,inventée, l'ampoule ? 
FQB_TREC-fr-1892,D'où ,provient, la cannelle ? 
FQB_TREC-fr-1893,Quel général américain est ,enterré, à Salzbourg ? 
FQB_UNESCO-2,Que cela signifie-t-il pour un bien d'être ,inscrit, sur la Liste ? 
FQB_UNESCO-5,à qui appartient un bien dès lors que il est ,inscrit, sur la Liste du patrimoine mondial ? 
FQB_UNESCO-5,à qui ,appartient, un bien dès lors que il est inscrit sur la Liste du patrimoine mondial ? 
FQB_UNESCO-9,à qui ,puis,-je adresser une suggestion ? 
FQB_UNESCO-10,Qui puis-je informer d'une menace ,pesant, sur un bien du patrimoine mondial ou un bien sur la Liste du patrimoine mondial en péril ? 
FQB_UNESCO-10,Qui ,puis,-je informer d'une menace pesant sur un bien du patrimoine mondial ou un bien sur la Liste du patrimoine mondial en péril ? 
FQB_UNESCO-11,Comment puis-je ,contribuer, au Fonds du patrimoine mondial ? 
FQB_UNESCO-11,Comment ,puis,-je contribuer au Fonds du patrimoine mondial ? 
FQB_UNESCO-12,Comment ce Fonds est-il ,utilisé, ? 
FQB_UNESCO-15,Comment puis-je obtenir/,utiliser, les photos de sites du patrimoine mondial ? 
FQB_UNESCO-15,Comment ,puis,-je obtenir/utiliser les photos de sites du patrimoine mondial ? 
FQB_UNESCO-16,"Je suis photographe, comment ",puis,-je proposer mes services ou vendre mes photos à l'UNESCO ? 
FQB_UNESCO-20,,Puis,"-je utiliser le logo du patrimoine mondial dans des brochures, publicités ou d'autres média ? "
FQB_UNESCO-23,Comment puis-je ,devenir, partenaire ? 
FQB_UNESCO-23,Comment ,puis,-je devenir partenaire ? 
FQB_UNESCO-24,Comment ,travailler,/faire un stage au Centre du patrimoine mondial de l'UNESCO ? 
